来源,时间,标题
财联社,2026-05-01 12:37:18,中国驻欧盟使团：欧洲议会有关决议粗暴干涉中国内政，已提出严正交涉
财联社,2026-05-01 12:34:09,驻日美军舰载机陆上起降训练再次引发抗议
财联社,2026-05-01 12:32:12,品牌金饰克价超1400元 贵金属分析师：预计价格中心年内将逐步上移
财联社,2026-05-01 12:12:35,中方对美起草安理会涉南苏丹决议一意孤行表示遗憾
财联社,2026-05-01 12:02:47,蔚来4月交付新车29356台 同比增长22.8%
财联社,2026-05-01 11:51:23,美联邦通信委员会审议通过检测认证和电信领域相关限制措施 商务部回应
财联社,2026-05-01 11:44:46,郑栅洁：推进算力资源规模化、集约化、绿色化、普惠化发展 深化拓展“人工智能+”
财联社,2026-05-01 11:07:48,何立峰会见比利时副首相兼外交大臣普雷沃
财联社,2026-05-01 11:00:46,广东惠州实施人才房票政策：不限户籍社保 最高补贴10万元
财联社,2026-05-01 10:58:37,特朗普威胁削减驻德美军 默茨强调跨大西洋伙伴关系
财联社,2026-05-01 10:52:08,中上协：全市场上市公司2025年合计分红2.43万亿元 较上年增加805亿元
财联社,2026-05-01 10:43:57,英国罗罗公司预测年利润增16% 称可完全化解伊朗战事影响
财联社,2026-05-01 10:41:39,特朗普称将取消对苏格兰威士忌的关税和进口限制
财联社,2026-05-01 10:40:29,2025年全市场上市公司实现营收73.01万亿元 同比增长1.2%
财联社,2026-05-01 10:35:57,伊朗外长：“制止以色列侵略黎巴嫩”是伊美停火方案组成部分
财联社,2026-05-01 10:33:37,机构: 4月深圳一二手网签量超9000套
财联社,2026-05-01 10:29:43,摩尔线程完成DeepSeek-V4全链路工程化适配
财联社,2026-05-01 10:10:02,第四批全国中成药联盟采购开标 覆盖89种临床常用药品
财联社,2026-05-01 10:06:25,黎巴嫩真主党使用光纤无人机对抗以军
财联社,2026-05-01 10:04:22,理想汽车4月交付量达34085辆
财联社,2026-05-01 10:02:15,点名意大利西班牙 特朗普拟削减在欧多国驻军
财联社,2026-05-01 09:58:27,TCL李东生拜访索尼集团：合资公司已就中长期战略方向形成初步规划
财联社,2026-05-01 09:58:04,单程仅约2小时 广东湛江往返越南芽庄航线复航
财联社,2026-05-01 09:39:27,白宫记协晚宴枪击事件嫌疑人将在案件审理期间继续被关押
财联社,2026-05-01 09:15:02,美国汽油均价再创近4年来新高
财联社,2026-05-01 09:08:48,今天全国铁路预计发送旅客2480万人次
财联社,2026-05-01 08:55:44,美政府官员：2月28日开始的“敌对行动已结束”
财联社,2026-05-01 08:54:52,国能龙源射阳100万千瓦海上风电项目一期工程开工
财联社,2026-05-01 08:52:38,亚洲最长地铁环线 武汉地铁12号线一期通车
财联社,2026-05-01 08:51:13,上海航运交易所：节前运输市场总体平稳 航线运价整体略有上浮
财联社,2026-05-01 08:41:29,铁路上海站今迎“五一”假期客流最高峰 预计发送旅客82.8万人次
财联社,2026-05-01 08:31:12,受AI相关需求提振 韩国出口继续激增
财联社,2026-05-01 08:19:28,西部数据美股夜盘跌超7%
财联社,2026-05-01 08:07:07,特斯拉去年从SpaceX与xAI斩获5.73亿美元营收
财联社,2026-05-01 08:00:30,韩国4月进口同比增长16.7% 出口同比增长48%
财联社,2026-05-01 07:59:27,伊朗外交部：期待伊美谈判迅速达成结果并不现实
财联社,2026-05-01 07:49:29,以色列被曝向阿联酋部署激光防御系统应对伊朗
财联社,2026-05-01 07:42:21,腾云智算与华为达成深度合作 共筑福建智算新生态
财联社,2026-05-01 07:38:49,美军一艘驱逐舰据报发生火灾
财联社,2026-05-01 07:30:04,一季度世界最大清洁能源走廊发电量超618亿千瓦时 同比增长7.19%
财联社,2026-05-01 07:14:32,美国两大铁路公司申请合并 拟打造横贯全国货运网络
同花顺,2026-05-01 05:04:52,跨境客流持续走高 广深港高铁成为大湾区互联互通“黄金通道”
同花顺,2026-05-01 04:53:23,11国外长谴责以袭击全球坚韧船队
同花顺,2026-05-01 04:24:16,国务院安委办部署“五一”假期期间安全生产明查暗访工作
同花顺,2026-05-01 04:08:00,中国常驻联合国副代表孙磊对美起草安理会涉南苏丹决议一意孤行表示遗憾
同花顺,2026-05-01 04:03:54,蔚来汽车四月交付量为29356辆 同比增长23%
同花顺,2026-05-01 03:51:25,商务部新闻发言人就美国联邦通信委员会审议通过检测认证和电信领域相关限制措施事答记者问
同花顺,2026-05-01 03:40:16,南非葡萄酒行业欢迎中国零关税举措
同花顺,2026-05-01 03:37:59,以色列防长称或很快恢复对伊朗打击
同花顺,2026-05-01 03:31:39,宁德时代上线电池在供车型查询入口
同花顺,2026-05-01 03:11:05,成本上涨 消费品巨头联合利华决定提价
同花顺,2026-05-01 02:35:05,机构：4月深圳一二手网签量超9000套
同花顺,2026-05-01 02:32:33,2025年上市公司整体业绩企稳回暖 科技创新势能迸发
同花顺,2026-05-01 02:31:56,WTI原油涨超1%
同花顺,2026-05-01 02:16:19,长三角铁路迎来“五一”假期客流高峰，预计发送旅客470万人次
同花顺,2026-05-01 02:12:14,智己汽车：2026年4月销量10016台，1-4月累计销量同比增长130%
同花顺,2026-05-01 02:01:30,"理想汽车：2026年4月交付34,085辆汽车"
同花顺,2026-05-01 01:49:38,武汉轨道交通12号线一期开通运营
同花顺,2026-05-01 01:46:18,哥伦比亚谴责以色列扣押本国援加沙船员
同花顺,2026-05-01 01:35:19,零跑汽车4月交付71387台，同比增长73.9%
同花顺,2026-05-01 01:31:22,富时中国A50指数期货涨1%
同花顺,2026-05-01 01:22:06,民航局副局长胡振江率团赴港澳开展民航安全技术交流
同花顺,2026-05-01 01:13:00,问界M6发布一周交付突破5000台
同花顺,2026-05-01 01:11:50,小米汽车2026年4月交付量超过30000台
同花顺,2026-05-01 01:07:31,韩国4月份半导体出口额达到319亿美元，同比大增173%
同花顺,2026-05-01 01:05:41,30年期日本国债收益率下降2.0个基点，至3.715%
同花顺,2026-05-01 01:02:10,布伦特原油站上112美元/桶
同花顺,2026-05-01 01:01:58,富时中国A50期货盘初上涨0.8%
同花顺,2026-05-01 00:32:00,黑龙江省启动“五一”文旅消费周活动
同花顺,2026-05-01 00:03:00,布伦特原油站上111美元/桶
同花顺,2026-05-01 00:02:41,日经225指数高开0.16%
同花顺,2026-04-30 23:50:10,现货白银日内涨幅扩大至1%
同花顺,2026-04-30 23:33:34,日本4月东京CPI同比增长1.5%，预期1.70%，前值1.40%
同花顺,2026-04-30 23:28:05,英媒：以色列已向阿联酋部署激光防御系统应对伊朗
同花顺,2026-04-30 22:59:42,国际足联主席：已收到5亿份2026年世界杯球票购票需求
同花顺,2026-04-30 22:57:02,德黑兰传出防空系统拦截声 以宣称考虑恢复对伊军事行动
同花顺,2026-04-30 22:56:43,伊朗股市暂停交易至5月4日
同花顺,2026-04-30 22:52:29,新兴市场股市录得2022年以来最佳单月表现，AI热潮与油价风险交织
同花顺,2026-04-30 22:50:52,联合国机构：加沙爆炸物污染严重 已成“每日紧急危机”
同花顺,2026-04-30 22:42:39,巴勒斯坦足协主席拒绝握手以官员
同花顺,2026-04-30 22:24:09,美官员称伊朗战事成本或达500亿美元 为官方披露两倍
同花顺,2026-04-30 22:17:26,特朗普称已“摧毁”伊朗核能力 仅少数人知晓谈判实际进展
同花顺,2026-04-30 22:03:44,美联储6月维持利率不变的概率为95%
同花顺,2026-04-30 22:03:31,德黑兰部分城区启动防空系统拦截无人机 现已恢复平静
同花顺,2026-04-30 21:51:24,苹果CEO库克：预计第三季度的内存成本将显著高于第二季度
