来源,时间,标题
财联社,2026-03-13 23:16:22,伊朗发起“真实承诺-4”第45轮军事行动
财联社,2026-03-13 23:03:11,以军称将进一步向以北部增派部队
财联社,2026-03-13 23:01:46,上海合晶：拟募资不超过9亿元用于12英寸半导体大硅片产业化项目等
财联社,2026-03-13 23:01:37,国内商品期市夜盘收盘涨跌参半 化工品涨幅居前
财联社,2026-03-13 22:53:01,王毅同荷兰外交大臣贝伦德森通电话
财联社,2026-03-13 22:43:34,生态环境部：不断巩固拓展纠治打着环保幌子搞“一刀切”问题
财联社,2026-03-13 22:38:27,伊朗军方情报部门称打击两个煽动舆论的团伙
财联社,2026-03-13 22:34:37,欧委会：社交媒体X已就“蓝标认证”提交整改方案
财联社,2026-03-13 22:25:00,美军坠毁加油机机上6人全部死亡
财联社,2026-03-13 22:24:34,墨西哥对涉华环氧大豆油作出反倾销终裁
财联社,2026-03-13 22:23:49,深交所：本周共对120起证券异常交易行为采取了自律监管措施
财联社,2026-03-13 22:22:56,美国对涉华临时钢制围栏作出双反终裁
财联社,2026-03-13 22:21:14,印度对华糖精反补贴案启动反规避调查
财联社,2026-03-13 22:20:49,美国联邦调查局或赴古巴参与快艇事件调查
财联社,2026-03-13 22:19:50,秘鲁对华拉链及其配件启动反倾销日落复审调查
财联社,2026-03-13 22:17:01,港股IPO：圣火科技集团有限公司递表港交所
财联社,2026-03-13 22:12:50,莱尔科技：控股股东特耐尔拟减持不超3%股份
财联社,2026-03-13 22:07:45,2026年“3·15”晚会主题发布 将关注食品安全、公共安全、金融安全、广告市场等领域
财联社,2026-03-13 22:03:41,上海航交所：本周波斯湾航线市场货量大幅下跌 即期市场订舱价格继续上涨
财联社,2026-03-13 22:02:55,宁波航交所：印巴航线市场货量重回疲软态势 本周运价指数较上周跌31.5%
财联社,2026-03-13 21:54:46,摩根大通：预计下周结束前原油供应削减将接近1200万桶/日
财联社,2026-03-13 21:52:07,上海：打响上海定制品牌 建立统一标识和认证制度
财联社,2026-03-13 21:50:02,港股IPO：江西齐云山食品股份有限公司递表港交所
财联社,2026-03-13 21:49:50,中华人民共和国国民经济和社会发展第十五个五年规划纲要
财联社,2026-03-13 21:45:59,道明证券将美联储下次降息的预测时间从6月推迟到9月
财联社,2026-03-13 21:22:17,泽连斯基：美国放宽石油制裁将为俄带来100亿美元收入
财联社,2026-03-13 21:19:38,比特币升破7.3万美元上方 过去24小时内涨4%
财联社,2026-03-13 21:19:23,金富科技：拟收购卓晖金属和联益热能各51%股权 交易对价合计5.712亿元
财联社,2026-03-13 21:17:43,荷兰国际集团：油价高企冲击欧元区消费者信心
财联社,2026-03-13 21:17:29,MiniMax：获联交所批准不再被视为未商业化公司 简称不再印有“P”标记
财联社,2026-03-13 21:11:22,公安部部署依法严厉打击涉农药犯罪
财联社,2026-03-13 21:11:05,名创优品：预期2025年收入约214.40亿元至214.45亿元 同比增长约26%
财联社,2026-03-13 21:08:49,三部门：对能繁母猪、育肥猪等保险费率进行定期调整 原则上调整周期不超过3年
财联社,2026-03-13 21:07:34,三部门：鼓励保险公司开发生猪产业链各环节保险产品
财联社,2026-03-13 21:06:14,上交所对天风证券及有关责任人予以纪律处分
财联社,2026-03-13 21:04:47,锴威特：拟购买晶艺半导体控制权并募集配套资金 股票停牌
财联社,2026-03-13 21:04:18,以色列总统称特朗普攻击国家主权
财联社,2026-03-13 21:02:34,土安全部门：10天内已拦截三枚伊朗方向导弹
财联社,2026-03-13 20:59:22,中信重工：2025年净利润同比增长0.24% 拟每10股派0.328元
财联社,2026-03-13 20:56:48,华锐精密：董事及高管拟合计减持不超0.03%股份
财联社,2026-03-13 20:10:42,金煤科技：原油价格波动导致部分化工品价格波动 短期价格呈震荡走势
财联社,2026-03-13 20:10:26,美股盘前要闻一览：特朗普鼓动油轮“拿出点胆量”通过霍尔木兹海峡；苹果宣布降低中国App Store佣金率；马斯克宣布开发“数字擎天柱”项目
财联社,2026-03-13 20:10:04,报道称特朗普在七国集团会议上“吹嘘”伊朗“即将投降”
财联社,2026-03-13 20:08:08,创源股份：董事长陈刚已被有关监察机关留置
财联社,2026-03-13 20:06:57,俄罗斯表示希望举行新一轮乌克兰问题三方会谈
财联社,2026-03-13 20:04:27,世界黄金协会：1月全球央行累计公开净购金量达5吨 购金势头有所放缓
财联社,2026-03-13 20:01:22,韩国政府：将“坚决严正应对”高市早苗涉独岛言论
财联社,2026-03-13 20:00:33,伊朗首都集会现场附近发生巨大爆炸 巨大浓烟冲天而起
财联社,2026-03-13 19:58:20,机构：若航运中断常态化 全球肥料原料供应可能会减少30%至50%
财联社,2026-03-13 19:55:02,美股期货走高 三大股指期货均涨0.4%
财联社,2026-03-13 19:50:09,ST晨鸣：公司五大生产基地全面恢复生产
财联社,2026-03-13 19:47:06,古巴称与美国的对话处于初期阶段
财联社,2026-03-13 19:47:03,联合国特别报告员：美以打击伊朗不合法 后果不可预估
财联社,2026-03-13 19:45:05,证监会修订发布《公开募集证券投资基金信息披露内容与格式准则第2号—定期报告的内容与格式》
财联社,2026-03-13 19:40:10,荣盛发展：终止2022年度向特定对象发行A股股票事项
财联社,2026-03-13 19:34:27,猪肉价格连降四周 全国鸡蛋降价
财联社,2026-03-13 19:30:51,长飞光纤：全资附属公司拟3130万港元认购FutureTech Stars有限合伙20.17%份额
财联社,2026-03-13 19:11:05,双良节能：控股股东双良集团因涉嫌信息披露违法违规被证监会立案
财联社,2026-03-13 19:09:24,国新能源：股东宏展房产拟减持不超2.07%股份
财联社,2026-03-13 19:08:31,浙江与吉利签署新一轮战略框架协议 推动浙江汽车及零部件产业高端化、智能化、绿色化转型
财联社,2026-03-13 19:07:27,贵州茅台：公司副总经理蒋焰被实施留置
财联社,2026-03-13 19:07:04,腾远钴业：股东长江晨道拟减持不超2%股份
财联社,2026-03-13 19:05:43,于东来：胖东来郑州店可能十月份开业
财联社,2026-03-13 18:59:44,塔牌集团：拟使用不超过46亿元闲置自有资金进行委托理财
财联社,2026-03-13 18:58:28,中国冶金报：2月末的铁矿石价格反弹更多是情绪和技术性修复 上涨不具备支撑基础
财联社,2026-03-13 18:56:53,贵州茅台副总经理、财务总监、董事会秘书蒋焰接受审查调查
财联社,2026-03-13 18:55:23,杰恩设计：王柯华拟受让5.73%公司股份
财联社,2026-03-13 18:54:27,沃森生物：子公司签署海外市场战略合作协议
财联社,2026-03-13 18:53:18,汇天再获近2亿美元股权融资
财联社,2026-03-13 18:52:40,重庆新能源装机并网容量突破1000万千瓦
财联社,2026-03-13 18:51:26,信维通信：拟定增募资不超60亿元用于商业卫星通信器件及组件项目等
财联社,2026-03-13 18:10:54,特朗普鼓动油轮“拿出点胆量”通过霍尔木兹海峡
财联社,2026-03-13 18:10:44,翼菲科技港股IPO及境内未上市股份“全流通”获中国证监会备案
财联社,2026-03-13 18:08:23,中国稀土集团与中核铀业举行工作会谈
财联社,2026-03-13 18:07:40,亨通股份：拟2.74亿元收购澳龙生物40%股权
财联社,2026-03-13 18:07:22,希腊爆发大规模抗议 反对美以军事打击伊朗
财联社,2026-03-13 18:02:37,思格新能源港股IPO及境内未上市股份“全流通”获中国证监会备案
财联社,2026-03-13 18:01:46,华沿机器人港股IPO及境内未上市股份“全流通”获中国证监会备案
财联社,2026-03-13 17:59:46,中办、国办：培育壮大新兴产业 在具备条件的革命老区实施“人工智能+”行动
财联社,2026-03-13 17:57:52,傅里叶半导体港股IPO及境内未上市股份“全流通”获中国证监会备案
财联社,2026-03-13 17:57:07,澳大利亚计划释放7.62亿升燃油
财联社,2026-03-13 17:55:06,中办、国办：支持革命老区积极发展有机农业、特色养殖和林下经济等 打造一批优质特色农副产品生产供应基地
财联社,2026-03-13 17:53:29,波兰总统：不会签署“欧洲安全行动”相关法案
财联社,2026-03-13 17:51:03,江西：围绕共享制造等新模式新业态培育一批服务型制造创新发展高地 每个支持500万元
财联社,2026-03-13 17:50:51,宣泰医药：合作产品恩扎卢胺片获批上市
财联社,2026-03-13 17:48:54,超50%员工将离开？魅族回应：处于全面战略转型的关键期
财联社,2026-03-13 17:13:32,部分区域监管再提辖内消金公司压降担保增信业务占比 已有公司计划年内清零
财联社,2026-03-13 17:12:52,今天预计全社会跨区域人员流动量超1.9亿人次
财联社,2026-03-13 17:11:58,招商证券张夏：牛市正从第二阶段向盈利驱动、顺周期板块占优的第三阶段切换
财联社,2026-03-13 17:11:34,原东风裕隆汽车有限公司采购总部副总部长陶骏接受审查调查
财联社,2026-03-13 17:10:39,以北部城镇遭伊朗袭击 58人受伤
财联社,2026-03-13 17:10:02,烽火通信：决定终止参与投资设立基金合伙企业
财联社,2026-03-13 17:09:27,万丰股份：拟投资10亿元建设改性特种工程塑料制造应用项目
财联社,2026-03-13 17:06:39,国家金融监督管理总局机构恢复与处置司原一级巡视员刘炜被开除党籍和公职
财联社,2026-03-13 17:06:00,在伊拉克执行任务的美军加油机降落特拉维夫 部分机翼受损
财联社,2026-03-13 17:05:55,复星医药：控股子公司药品获临床试验批准
财联社,2026-03-13 17:04:39,央行：2月份经常项下跨境人民币结算金额为1.22万亿元
财联社,2026-03-13 17:02:15,央行：前两个月人民币存款增加9.26万亿元 非银行业金融机构存款增加2.84万亿元
财联社,2026-03-13 17:02:14,央行：3月16日将开展5000亿元买断式逆回购操作 期限为6个月
财联社,2026-03-13 17:01:45,央行：前两个月人民币贷款增加5.61万亿元
财联社,2026-03-13 16:11:49,日本政府推动设立国家情报机制 引发舆论质疑
财联社,2026-03-13 16:10:22,香港恒生指数收跌0.98% 新消费板块走低
财联社,2026-03-13 16:09:16,美探测器因太阳活动影响提前重返地球大气层
财联社,2026-03-13 16:08:58,华软科技：控股子公司天安化工完成检修并复产
财联社,2026-03-13 16:05:49,追觅预计下周发射第一颗太空算力卫星
财联社,2026-03-13 16:05:44,机构：2025年第四季度全球前五大企业级SSD营收季增超50%
财联社,2026-03-13 16:05:30,央行：2025年4季度末金融业机构总资产538.9万亿元 同比增长8.7%
财联社,2026-03-13 16:03:44,3月13日连板股分析：连板股晋级率近四成 化工板块反复活跃
财联社,2026-03-13 16:03:42,迈得医疗：控股子公司取得国内医疗器械注册证
财联社,2026-03-13 16:02:58,纳睿雷达：签订2.31亿元天气雷达设备采购合同
财联社,2026-03-13 16:02:26,外交部就伊朗局势回应：各方应立即停止军事行动
财联社,2026-03-13 16:01:56,江苏省镇江市委常委、政法委书记许文接受审查调查
财联社,2026-03-13 16:01:35,欧洲主要股指开盘集体下跌
财联社,2026-03-13 15:59:23,花旗：理想汽车-W首季指引符预期 目标价72.7港元
财联社,2026-03-13 15:19:22,3月13日涨停分析
财联社,2026-03-13 15:17:36,国债期货收盘表现分化
财联社,2026-03-13 15:17:23,刘国梁卸任世界乒联董事会主席
财联社,2026-03-13 15:12:34,三菱日联银行：若日元跌破160 日本财务省或加强口头警告
财联社,2026-03-13 15:10:23,以方称对伊朗德黑兰开启新一轮“大规模”打击行动
财联社,2026-03-13 15:08:00,王毅、王小洪、董军将赴越南出席中越外交、国防、公安“3+3”战略对话机制首次部长级会议
财联社,2026-03-13 15:07:25,美元指数站上100点
财联社,2026-03-13 15:05:09,科创板指数样本股迎季度调整 寒武纪、石头科技等多股竞价异动
财联社,2026-03-13 15:02:24,国内商品期货收盘涨跌不一 原油涨超5%
财联社,2026-03-13 15:01:54,收评：沪指震荡调整跌0.81% 化工、风电板块逆势走强
财联社,2026-03-13 14:59:48,上海闵行：推进液流电池、钠离子电池、新型锂离子等多元前沿技术开发
财联社,2026-03-13 14:55:43,上海闵行：加快聚变能商业化应用 形成“核心研发+配套制造+服务支撑”的产业生态
财联社,2026-03-13 14:14:33,电子气体概念快速走强 华特气体涨超10%
财联社,2026-03-13 14:07:11,脑机概念异动 创新医疗、三博脑科涨近10%
财联社,2026-03-13 14:02:51,耀才证券金融涨超40%
财联社,2026-03-13 14:02:43,首款侵入式脑机接口医疗器械获批上市
财联社,2026-03-13 13:57:01,国家启动国储氮磷及复合肥提前投放
财联社,2026-03-13 13:56:40,中科院院士欧阳明高：未来五年新能源汽车将有全过程安全、全自动驾驶、全固态电池等七大技术方向 
财联社,2026-03-13 13:56:12,商务部副部长盛秋平：以旧换新政策带动2025年家电、手机市场规模均突破万亿元大关
财联社,2026-03-13 13:55:29,武汉长江新区未来产业引导基金成立 出资额10亿
财联社,2026-03-13 13:51:39,商务部新闻发言人就美贸易代表办公室宣布以“产能过剩”为由对包括中国在内的16个经济体发起301调查答记者问
财联社,2026-03-13 13:50:21,PCB概念异动拉升 中英科技涨超10%
财联社,2026-03-13 13:49:38,【风口研报·公司】绑定全球燃气轮机三巨头之一，公司去年已与西门子签订三年供货协定，叠加与国产商用航空发动机的深度配套，有望迎来历史性窗口期
财联社,2026-03-13 13:43:47,【电报解读】到2050年将全球核能装机增至2020年的三倍，算力巨头纷纷加码核能，其战略价值被重新评估，这家公司产品在国内外核电项目上均有应用
财联社,2026-03-13 13:41:42,医疗耗材股持续走高 中红医疗、英科医疗逼近20cm涨停
同花顺,2026-03-13 13:26:19,上期所沪锡主力合约跌幅超3%
同花顺,2026-03-13 13:20:01,新华社播发“十五五”规划纲要
财联社,2026-03-13 13:18:08,电网设备概念集体下挫 顺纳股份跌停
财联社,2026-03-13 13:16:26,美财长说暂无需为打击伊朗花销担忧
财联社,2026-03-13 13:14:57,以军说袭击一名黎巴嫩真主党成员
财联社,2026-03-13 13:13:58,有色·钨概念持续走弱 中钨高新逼近跌停
财联社,2026-03-13 13:11:24,中国加入《三倍核能宣言》
同花顺,2026-03-13 13:11:20,巴基斯坦西北部警车遇袭 致7人死亡
同花顺,2026-03-13 13:09:26,波士顿科学首款中国基地生产医疗器械获批
同花顺,2026-03-13 13:09:14,金融监管总局、财政部、农业农村部：加强协作促进生猪保险高质量发展
同花顺,2026-03-13 13:08:35,嘉事堂：2025年净利润1.11亿元，同比下降29.57%
同花顺,2026-03-13 13:08:32,飞亚达：2025年净利润8731.78万元，同比下降60.37%
同花顺,2026-03-13 13:08:28,金富科技：拟设立注册资本1亿元全资子公司
财联社,2026-03-13 13:08:18,午后生物质能概念走高 赞宇科技涨停
同花顺,2026-03-13 13:07:22,厦门港务：2025年净利润2.06亿元，同比增长3.02%
同花顺,2026-03-13 13:06:47,日本柏崎刈羽核电站因漏电将暂停发电
财联社,2026-03-13 13:05:03,阿富汗称多地再遭巴基斯坦空袭
同花顺,2026-03-13 13:03:40,锴威特：拟发行股份及支付现金购买晶艺半导体控制权 不超过10个交易日
同花顺,2026-03-13 13:02:33,上期所燃油、低硫燃油主力合约跌超4% 大商所苯乙烯主力合约跌超3%
财联社,2026-03-13 13:02:13,土耳其南部因吉尔利克空军基地响起防空警报
同花顺,2026-03-13 13:01:22,东盟召开特别外长会讨论中东局势外溢影响
同花顺,2026-03-13 13:01:10,波罗的海干散货指数涨2.83%
同花顺,2026-03-13 13:00:47,上期所原油主力合约大跌6% 大商所聚氯乙烯（PVC）主力合约跌超2%
同花顺,2026-03-13 13:00:21,芯朋微：2025年净利润1.86亿元，同比增长67.34%
同花顺,2026-03-13 13:00:00,期市夜盘开盘，国内期货主力合约多数下跌
同花顺,2026-03-13 12:57:09,美心翼申：拟现金收购泰州鑫宇精工股份有限公司不超过70%股份
财联社,2026-03-13 12:53:31,【金牌纪要库】CDN正从内容分发向边缘计算升级，有望显著优化Agent交互流畅度
财联社,2026-03-13 12:42:06,【机构调研】公司构建资源循环到精深加工的全生命周期价值链，回收循环再造钨资源量超1万吨
财联社,2026-03-13 12:39:56,FF：针对华其心及其团伙涉嫌非法做空的行为采取正式法律行动
财联社,2026-03-13 12:24:26,国家医保局：DRG付费3.0版分组方案临床论证工作有序推进
财联社,2026-03-13 12:21:16,巴西：柴油进口免税 原油出口加税
财联社,2026-03-13 12:15:14,美国计划推进4月实施载人绕月飞行任务
财联社,2026-03-13 12:15:02,财联社3月13日午间新闻精选
财联社,2026-03-13 12:13:19,Omdia：无偏光片OLED迎来增长机遇 2032年出货量或达2.44亿片
同花顺,2026-03-13 12:10:30,中科环保：拟发行可转换公司债券总额不超过人民币10亿元
同花顺,2026-03-13 12:10:25,焦作万方：2025年净利润10.71亿元，同比增长81.95%
财联社,2026-03-13 12:10:06,【盘中宝•数据】化工+风电+电网+电力+锂电池，五大热点一周以来获融资净买入情况（附表）
财联社,2026-03-13 12:09:13,香港联交所就有关提升香港上市机制竞争力建议咨询市场意见
同花顺,2026-03-13 12:08:29,粤高速Ａ：2025年净利润18.01亿元，同比增长15.31%
同花顺,2026-03-13 12:08:25,成飞集成：2025年净亏损4394.92万元
财联社,2026-03-13 12:07:50,外交部副部长孙卫东会见印尼驻华大使周浩黎
同花顺,2026-03-13 12:07:49,创源股份：董事长陈刚被留置
同花顺,2026-03-13 12:02:52,慧博云通：收到深圳证券交易所审核问询函
同花顺,2026-03-13 12:01:38,博盈特焊：博德瑞及刘一宁等完成减持0.2234%
财联社,2026-03-13 12:00:22,港股午评：恒生指数跌0.48% 恒生科技指数跌0.41%
财联社,2026-03-13 11:57:30,北京金融监管局发布消费提示：谨防“贷款催收”诈骗短信
财联社,2026-03-13 11:56:11,中科院院士欧阳明高：三至五年内300-350wh/kg能量密度固态电池或开始普及和实用化
同花顺,2026-03-13 11:55:08,3月13日 周五《新闻联播》要闻18条
财联社,2026-03-13 11:54:13,3月13日午间涨停分析
同花顺,2026-03-13 11:51:48,辰欣药业：股东辰昕同泰拟减持不超过1%
同花顺,2026-03-13 11:51:23,中公教育：控股股东部分股份被司法拍卖完成过户
同花顺,2026-03-13 11:50:24,华升股份：2025年净利润亏损3521.62万元
同花顺,2026-03-13 11:49:32,中国证监会修订发布《公开募集证券投资基金信息披露内容与格式准则第2号—定期报告的内容与格式》
财联社,2026-03-13 11:48:51,警方侦破一起非法售卖长期停牌债券案 涉案金额超2亿元
同花顺,2026-03-13 11:45:19,苏丹重要边境口岸遭空袭致13人死亡
财联社,2026-03-13 11:45:00,上海3宗涉宅用地68.09亿元成交
同花顺,2026-03-13 11:44:39,阿里云发布手机“一键养虾”产品JVSClaw
同花顺,2026-03-13 11:34:31,荣盛发展：终止2022年度向特定对象发行A股股票事项并撤回申请文件
同花顺,2026-03-13 11:34:27,中航高科：拟向全体股东每10股派送现金股利为2.23元（含税）
同花顺,2026-03-13 11:34:20,中航高科：2025年净利润10.31亿元，同比下降10.57%
同花顺,2026-03-13 11:34:20,财政部等三部门：加快补齐农村公共充换电设施短板
财联社,2026-03-13 11:33:06,市场监管总局：去年办结垄断案件22件 罚没金额超6亿元
财联社,2026-03-13 11:32:54,午评：三大指数集体飘绿 化工板块连续爆发
财联社,2026-03-13 11:32:23,温氏股份：预计2026年中华土鸡（黄羽肉鸡）价格将好于2025年
财联社,2026-03-13 11:32:07,【掘金行业龙头】储能+核聚变+数据中心，解决方案为BEST项目提供关键支撑，国内储能产品连续四年出货量第二，这家公司在北美、欧洲、中东等地拥有大量的项目成功运作经验
财联社,2026-03-13 11:32:04,国内期货主力合约多数上涨 上期所原油涨超7%
财联社,2026-03-13 11:31:20,美将领证实伊朗小学遭袭是美军所为
同花顺,2026-03-13 11:30:49,猪肉价格连降四周 全国鸡蛋降价了
财联社,2026-03-13 11:28:41,以色列总理内塔尼亚胡称正“粉碎”伊朗政权 袭击伊核科学家
同花顺,2026-03-13 11:27:58,海关总署：扎实推进海南自贸港建设，加快综合保税区转型升级，打造更多开放高地
财联社,2026-03-13 11:25:42,国际能源署：全球石油市场面临史上最严重供应梗阻 3月全球原油日供应量将骤降约800万桶
财联社,2026-03-13 11:24:37,上海成功出让3宗地 成交总金额68亿元
财联社,2026-03-13 11:24:02,伊朗称袭击“林肯”号航母致其撤走
财联社,2026-03-13 11:22:37,美强推安理会召开对伊制裁会议 中俄投反对票
财联社,2026-03-13 11:20:31,日本财务大臣称已准备好对汇率采取一切必要措施
财联社,2026-03-13 11:14:52,【风口研报·公司】“稀土回收”稀缺标的、规模位居行业领先，这家公司加速向下游磁材领域扩张、今年新产能投产将增加1万吨年产能，未来有望受益于量价齐升
同花顺,2026-03-13 11:12:29,李强主持召开国务院常务会议，审议通过《全国农业普查条例（修订草案）》
同花顺,2026-03-13 11:11:53,李强主持召开国务院常务会议，研究建立地方财政补贴负面清单管理机制
同花顺,2026-03-13 11:11:14,双良节能：控股股东双良集团因涉嫌信息披露违法违规被立案
同花顺,2026-03-13 11:10:38,李强主持召开国务院常务会议，讨论通过《国务院2026年重点工作分工方案》。
财联社,2026-03-13 11:10:10,中国石油首个绿电直连项目获批
同花顺,2026-03-13 11:09:43,民政部、财政部：加快推进养老服务消费补贴项目实施
同花顺,2026-03-13 11:08:32,速腾聚创激光雷达获新石器30万台独家订单
同花顺,2026-03-13 11:07:56,宏柏新材：副总经理李明崽拟减持0.02%
同花顺,2026-03-13 11:07:32,贵州茅台：副总经理蒋焰被实施留置
同花顺,2026-03-13 11:07:17,腾讯电脑“龙虾管家”上线
同花顺,2026-03-13 11:06:39,腾远钴业：股东晨道投资拟减持不超过2%
同花顺,2026-03-13 11:06:36,利尔达：因涉嫌信息披露违法违规被立案
同花顺,2026-03-13 11:05:28,华塑科技：控股孙公司拟购买资产，交易价格5141.39万元
同花顺,2026-03-13 11:05:23,天利科技修正2025年度业绩预告 预计净利润为亏损400万元至200万元
同花顺,2026-03-13 11:04:22,今天国际：高管曾巍巍已减持0.03%
同花顺,2026-03-13 11:04:18,霍莱沃：变更募集资金投向1.43亿元
同花顺,2026-03-13 11:04:13,鼎胜新材：拟以7000万元-1.4亿元回购公司股份
同花顺,2026-03-13 11:03:45,网络交易监管持续发力，市场监管总局：平台生态治理取得重要进展
同花顺,2026-03-13 10:58:27,“德纳”号遇难船员遗体被送回伊朗
同花顺,2026-03-13 10:58:01,中环海陆：股东江海机械已减持3%
同花顺,2026-03-13 10:57:54,聚飞光电：2025年净利润3.06亿元，同比下降9.96%
财联社,2026-03-13 10:54:02,创新药概念走高 广生堂涨超13%
财联社,2026-03-13 10:46:43,【盘中宝】科技巨头提升市占率的核心突破口，该创新品类有望带动产业链迎来高速发展拐点，这家公司可生产相关领域重要零部件产品
财联社,2026-03-13 10:46:00,可控核聚变概念异动拉升 兰石重装涨停
财联社,2026-03-13 10:36:50,热泵概念震荡走强 日出东方、万和电气双双涨停
财联社,2026-03-13 10:35:31,禾赛科技：与九识智能签订20万颗激光雷达独家订单
财联社,2026-03-13 10:34:33,2026全国家电暨数码和智能产品消费季启动
财联社,2026-03-13 10:31:29,存储芯片概念震荡回升 德明利涨超8%续创历史新高
财联社,2026-03-13 10:31:27,春运期间海南离岛免税购物金额近75亿元 同比增长近40%
财联社,2026-03-13 10:29:57,一艘伊朗船只因靠近美国“林肯”号航母被击中
财联社,2026-03-13 10:22:49,美国ITC推翻美国商务部裁定 将不对进口自中国的活性阳极材料征收双反关税
财联社,2026-03-13 10:22:04,美最高法院裁定关税违法后大批企业要求索赔 手动处理需时500年
财联社,2026-03-13 10:21:37,风电板块持续拉升 天顺风能涨停
财联社,2026-03-13 10:19:29,中央气象台3月13日10时继续发布暴雪蓝色预警
财联社,2026-03-13 10:17:02,沪深两市成交额突破1万亿 较上一日此时缩量超100亿
同花顺,2026-03-13 10:11:37,抖音回应苹果降低中国App Store佣金率
同花顺,2026-03-13 10:11:12,经纬辉开：拟剥离电子信息板块业务资产
同花顺,2026-03-13 10:06:22,华谊集团：高管顾春林已减持0.006%股份
同花顺,2026-03-13 10:04:53,抖音新版网暴治理规范启动意见征集
