来源,时间,标题
同花顺,2026-06-01 11:12:45,瑞立科密：发行股份购买资产的股份发行价格调整为45.45元/股
同花顺,2026-06-01 11:08:59,重庆市国资委与中化学生态环境有限公司举行工作座谈会
同花顺,2026-06-01 11:08:50,俄总统新闻秘书说法国扣押俄油轮“近乎国际海盗行径”
同花顺,2026-06-01 09:47:41,派诺科技：中标4.55亿元项目
同花顺,2026-06-01 09:47:39,东山精密今日跌10.00% 国泰海通上海分公司净买入11.51亿元
同花顺,2026-06-01 09:45:55,欧科亿：格林美询价转让873.3万股
同花顺,2026-06-01 09:44:42,ST喜临门：控股股东及其一致行动人预重整申请获法院受理
同花顺,2026-06-01 09:44:38,盛帮股份：终止筹划收购无锡沃可60%股权
同花顺,2026-06-01 09:40:32,爱普股份：签署补充协议变更股权转让补偿条款
同花顺,2026-06-01 09:40:19,南向资金今日净买入46.57亿港元 康方生物获净买入居前
同花顺,2026-06-01 09:35:37,伊朗情报机构宣布捣毁一恐怖分子团伙
同花顺,2026-06-01 09:34:56,海螺水泥：首次回购0.0113%公司股份，已支付的总金额为人民币 1207.94万元
同花顺,2026-06-01 09:33:51,ST万邦：公司股票可能被实施退市风险警示
同花顺,2026-06-01 09:33:37,现货黄金失守4490美元/盎司
同花顺,2026-06-01 09:31:43,壹连科技：股东长江晨道已减持1.99957%
同花顺,2026-06-01 09:28:10,伊朗打击美军基地导弹发射画面
同花顺,2026-06-01 09:23:54,方大集团：拟以4000万元-6000万元回购公司股份
同花顺,2026-06-01 09:23:31,江苏博云：股份转让价格调整至42.02元/股
同花顺,2026-06-01 09:20:30,新宁物流：公开挂牌转让香港新宁43%股权 交易金额834万元
同花顺,2026-06-01 09:19:15,北汽蓝谷：5月产量20982辆、销量21871辆
同花顺,2026-06-01 09:18:32,华光环能：控股股东已减持0.13%
同花顺,2026-06-01 09:18:27,合合信息：非公开询价转让价113.75元/股
同花顺,2026-06-01 09:17:45,敦煌种业：公司作为原告涉案金额为1323.97万元的重大诉讼案件已由法院受理
同花顺,2026-06-01 07:45:24,现货黄金失守4500美元/盎司
同花顺,2026-06-01 07:41:20,成功率99.25%，越疆空弈DobotWAM具身大模型发布，LIBERO排名第一
同花顺,2026-06-01 07:40:36,伊朗外交部：黎巴嫩停火是美伊谅解备忘录不可或缺的一部分
同花顺,2026-06-01 07:39:52,英国外交大臣库珀访华，外交部回应
同花顺,2026-06-01 07:38:37,缅甸掸邦南坎镇爆炸事件致一名中国公民受伤 外交部：目前已获得救治
同花顺,2026-06-01 07:37:04,LME锡主力合约涨超2%
同花顺,2026-06-01 07:36:45,外交部：中国圆满完成5月安理会轮值主席工作，将继续为世界和平担当尽责
同花顺,2026-06-01 07:35:40,外交部：日方近期一系列错误言行，国际社会必须高度警惕
同花顺,2026-06-01 07:35:11,华为nova 16 系列正式发布 售价2999元起
同花顺,2026-06-01 07:33:37,Robo.ai宣布完成对Neurovia AI全资收购
同花顺,2026-06-01 07:30:59,“开门杀”等交通事故赔偿最新司法解释6月底施行
同花顺,2026-06-01 07:30:44,国家卫健委：目前已有3000多家医疗机构建成儿童友好医院
同花顺,2026-06-01 07:29:51,LME镍主力合约涨超1%
同花顺,2026-06-01 07:28:02,COMEX铝期货涨超1%
同花顺,2026-06-01 07:18:22,国家发改委等部门：非化石能源电力消费量的认定方式包括电能量交易、绿证交易等两种方式
同花顺,2026-06-01 07:17:47,国家卫健委：我国儿童健康水平持续提升
同花顺,2026-06-01 07:14:43,牧原股份携手阿里云共建养猪大模型
同花顺,2026-06-01 07:12:40,高盛：MLCC已成为AI服务器物料清单第三大成本项 仅次于GPU和存储芯片
同花顺,2026-06-01 07:12:16,联想、戴尔、微软等厂商将在今年秋季推出首批搭载英伟达RTX Spark的AI PC
同花顺,2026-06-01 07:09:12,消息人士：美正试图推动黎以新停火倡议
同花顺,2026-06-01 05:35:32,曹操出行成立智行科技公司，含AI相关业务
同花顺,2026-06-01 05:34:57,并行科技成立科技新公司 含AI软件开发业务
同花顺,2026-06-01 05:30:54,ETF两市成交额超4000亿元
同花顺,2026-06-01 05:28:43,国产世界模型登顶WorldArena榜单
同花顺,2026-06-01 05:28:29,电机板块短线拉升
同花顺,2026-06-01 05:27:25,广州—乌鲁木齐—法兰克福航线开通 中欧往返可节省10余小时时长
同花顺,2026-06-01 05:26:48,浙江：拟实施“星火计划”培育未来产业行动 加速量子技术产品规模化应用
同花顺,2026-06-01 05:26:19,英伟达将与宇树科技等全球人形机器人制造商合作开发研究用途机器人
同花顺,2026-06-01 05:22:05,法国总统马克龙称法国海军在大西洋拦截一艘油轮
同花顺,2026-06-01 05:21:47,港股金山软件涨近11%
同花顺,2026-06-01 05:17:05,软银集团股价延续涨势，现涨13.4%
同花顺,2026-06-01 05:16:38,AI应用概念持续走高，光云科技等涨停
同花顺,2026-06-01 05:14:12,天算星座预计2030年建成在轨算力服务 推标准化Token化模式
同花顺,2026-06-01 05:13:29,PCB概念板块短线拉升
同花顺,2026-06-01 05:12:28,韩国韩华航空航天公司发生爆炸致5死2伤
同花顺,2026-06-01 05:11:06,SK海力士韩国工厂发生气体泄漏，3600名人员紧急疏散
同花顺,2026-06-01 05:10:12,网络餐饮新规实施首日，淘宝闪购依规完成首批外卖商户打标
同花顺,2026-06-01 05:08:06,麦格米特触及涨停
同花顺,2026-06-01 05:05:27,云计算板块走高，用友网络涨停
同花顺,2026-06-01 03:08:46,中国国新、雄安基金等成立青年创投基金
同花顺,2026-06-01 03:08:14,科创50指数跌幅扩大至4%
同花顺,2026-06-01 03:07:13,大唐新能源、三一重能成立新能源公司
同花顺,2026-06-01 03:04:28,英特尔计划在年底前推出一款新型人工智能芯片，以对抗英伟达
同花顺,2026-06-01 03:03:51,京东折扣超市落地淮南万达，填补当地硬折扣零售业态空白
同花顺,2026-06-01 03:02:53,富时中国A50指数期货跌1%
同花顺,2026-06-01 03:02:37,独立储能清单管理政策近期将出台
同花顺,2026-06-01 02:56:37,海河流域正式入汛
同花顺,2026-06-01 02:54:54,韩华航空航天韩国大田工厂爆炸事故已致6伤
同花顺,2026-06-01 02:54:06,PCB概念持续下挫，东山精密、宏和科技触及跌停
同花顺,2026-06-01 02:49:19,特朗普坚称美伊协议“明确禁止”伊朗拥核
同花顺,2026-06-01 02:49:06,创业板指跌1%，CPO、半导体、光纤概念板块跌幅居前
同花顺,2026-06-01 02:48:37,韩国清州SK海力士工厂发生气体泄漏，造成六人受伤
同花顺,2026-06-01 02:48:05,港股大模型概念股持续下挫，智谱跌超10%
同花顺,2026-06-01 02:47:39,深中通道西人工岛将建机器人酒店
同花顺,2026-06-01 02:45:27,科创50指数跌幅扩大至3%
同花顺,2026-06-01 02:42:46,国际原子能机构人员将获准进入扎波罗热核电站遭袭区
同花顺,2026-06-01 02:38:14,沪深京三市成交额超1.5万亿元，较上日此时缩量1921亿元
同花顺,2026-06-01 02:36:50,中央网信办净化网络谣言主题宣传活动在豫举行
同花顺,2026-06-01 01:46:19,港股汽车股走强，小鹏集团-W涨超7%
同花顺,2026-06-01 01:45:22,中国5月RatingDog制造业PMI51.8，前值52.2
同花顺,2026-06-01 01:43:18,电池板块拉升，圣阳股份涨停
同花顺,2026-06-01 01:40:43,电力板块短线下挫，京能电力跌停
同花顺,2026-06-01 01:40:13,港股恒生科技指数涨幅达2%
同花顺,2026-06-01 01:36:54,生益科技股价创历史新高
同花顺,2026-06-01 01:34:57,科创50指数跌幅扩大至2%，芯片产业链概念股下跌
同花顺,2026-06-01 01:34:28,科技部部长阴和俊：深入落实企业科技创新主体地位 推动企业真正成为未来产业发展的主导力量
同花顺,2026-06-01 01:34:12,北京人工智能产投基金入股太空算力创企轨道辰光
同花顺,2026-06-01 01:34:10,北证50指数涨幅扩大至2%
同花顺,2026-06-01 01:34:01,军工电子板块短线拉升，火炬电子涨停
同花顺,2026-06-01 01:32:08,科创50指数跌幅扩大至1%
同花顺,2026-06-01 01:31:49,AI PC板块走高，春秋电子涨停
同花顺,2026-06-01 01:31:20,港股恒生科技指数涨幅达1%
同花顺,2026-06-01 01:31:03,北证50指数涨幅扩大至1%
同花顺,2026-06-01 01:29:19,股指期货早盘开盘 主力合约集体高开
同花顺,2026-06-01 01:28:33,利通电子一字跌停
同花顺,2026-06-01 01:26:32,ETF开盘：ESG300ETF领涨9.29%，创业板增强ETF领跌5.01%
同花顺,2026-06-01 01:25:34,A股开盘：三大指数多数高开
同花顺,2026-06-01 01:22:38,央行：6月1日开展了110亿元7天期逆回购操作
同花顺,2026-06-01 00:31:39,韩国综指涨幅扩大至2%
同花顺,2026-06-01 00:28:53,中信证券：美联储内部偏鸽力量明显减弱
同花顺,2026-06-01 00:26:25,全球最大的白银ETF iShares Silver Trust持仓量较前日减少59.09吨
同花顺,2026-06-01 00:21:33,韩国5月出口同比增长53.2%
同花顺,2026-06-01 00:11:07,华泰2026建筑建材行业中期展望：深挖科技链新材料等三条主线
同花顺,2026-06-01 00:08:23,日韩股市创新高
同花顺,2026-06-01 00:01:36,日韩股市集体高开
同花顺,2026-06-01 00:01:06,布伦特原油站上93美元/桶
同花顺,2026-06-01 00:00:27,高盛将2026年末伦敦金属交易所铜价预测上调至每吨13735美元
同花顺,2026-06-01 00:00:14,中金：国内钨价短期大跌后有望企稳回升，全球钨业龙头配置价值持续凸显
同花顺,2026-05-31 23:57:01,招商证券：判断6月A股仍处盈利驱动的上行第三阶段
同花顺,2026-05-31 23:49:42,深化改革方案已下发 多地密集部署新一轮国资国企改革启动
同花顺,2026-05-31 23:46:48,基准10年期日本国债期货早盘下跌0.16点
同花顺,2026-05-31 23:40:05,下半年车市进入智驾“下半场”，高阶辅助驾驶下探至15万元级市场
同花顺,2026-05-31 23:39:42,中信建投：海外商业航天出现短期扰动，持续看好卫星互联网及可复用火箭方向
同花顺,2026-05-31 23:33:09,阿盟秘书长谴责以色列对黎巴嫩军事行动 呼吁立即停火
同花顺,2026-05-31 23:32:09,新里程：康养业务2026年将保持强劲增长趋势
同花顺,2026-05-31 23:31:08,中信建投：看好香港房地产市场头部企业经营与业绩的持续提升
同花顺,2026-05-31 23:21:15,6月基金经理调研：A股仍是最受青睐的方向之一
同花顺,2026-05-31 23:19:33,英国批评以色列在黎升级军事行动 德国亦表担忧
