来源,时间,标题
同花顺,2025-11-05 23:56:51.000,中信建投：医疗器械板块拐点来临 正在估值业绩双修复
同花顺,2025-11-05 23:45:07.000,谷歌与游戏开发商Epic Games就应用商店纠纷达成和解
同花顺,2025-11-05 23:42:52.000,美股全线反攻，特朗普称将结束联邦政府对加密货币的“战争”
同花顺,2025-11-05 23:42:21.000,中方呼吁国际社会稳妥推进阿卜耶伊政治进程
财联社,2025-11-05 23:41:38.000,欧盟理事会就修改《欧洲气候法》达成一致
同花顺,2025-11-05 23:35:29.000,低空物流产业加速“起飞”
同花顺,2025-11-05 23:34:21.000,加拿大央行计划裁员10%
同花顺,2025-11-05 23:32:54.000,中信建投：军工行业三季报综述，板块业绩拐点已现
同花顺,2025-11-05 23:32:38.000,中期分红队伍壮大，多家行业龙头公司首次出手
财联社,2025-11-05 23:32:33.000,美军试射未携带弹头的“民兵3”洲际弹道导弹
财联社,2025-11-05 23:31:41.000,美最高法院就政府关税政策合法性展开辩论
同花顺,2025-11-05 23:31:29.000,全国首单崩岗治理新增耕地指标交易落地
同花顺,2025-11-05 23:30:58.000,欧委会宣布涉中企FSR深度调查，欧盟中国商会表达关切
财联社,2025-11-05 23:30:07.000,加沙地带卫生部门：本轮巴以冲突已致加沙超23万人死伤
同花顺,2025-11-05 23:30:05.000,美国政府停摆打破历史纪录
财联社,2025-11-05 23:26:34.000,美休斯敦大规模移民执法行动已致超1500人被捕
财联社,2025-11-05 23:01:42.000,国内期货主力合约涨跌互现 焦煤涨超2%
同花顺,2025-11-05 22:40:35.000,俄副外长：俄美领导人会晤条件尚未达成
财联社,2025-11-05 22:38:59.000,均胜电子香港上市公开发售部分获147.67倍认购
财联社,2025-11-05 22:35:47.000,【电报解读】SK海力士向英伟达供应的HBM4较上代涨价50%！机构称国产HBM量产势在必行，上游设备材料或迎来扩产机遇，这家公司的薄膜沉积设备可以应用于高带宽存储芯片生产制造中
财联社,2025-11-05 22:33:22.000,波兰与斯洛伐克总统均反对接受欧盟移民配额
同花顺,2025-11-05 22:32:53.000,冈村富夫当选捷克众议院主席
财联社,2025-11-05 22:32:18.000,小马智行香港上市面向散户配售部分获得15.88倍认购
同花顺,2025-11-05 22:31:42.000,碧桂园境外债务重组计划获大多数债权人批准
财联社,2025-11-05 22:30:45.000,美股三大指数开盘涨跌互现 纳指小幅高开0.06%
财联社,2025-11-05 22:29:02.000,甘肃省探获7亿吨冶镁白云岩矿
财联社,2025-11-05 22:28:29.000,美国财政部称至少未来几个季度将维持中长期债券发行规模不变
财联社,2025-11-05 22:24:49.000,文远知行：最终发售价27.1港元 香港公开发售获73.44倍认购
财联社,2025-11-05 22:21:57.000,俄称持续打击被围乌军 乌称击退俄军进攻
同花顺,2025-11-05 22:18:49.000,高通首席执行官：到2027财年，数据中心业务营收将变得可观
财联社,2025-11-05 22:12:28.000,梦天家居：拟购买川土微控制权暨实控人筹划控制权变更 股票停牌
财联社,2025-11-05 21:57:48.000,ST柯利达：控股股东以6.16元/协议转让总股本6.71%
财联社,2025-11-05 21:55:58.000,【风口研报·洞察】细分锂电材料2026年或迎供需缺口，目前头部企业产能利用率已达饱和，供给较下游储能及动力电池需求存在错配，9月份部分产品涨价已落地执行；流动性危机带来买入机会
同花顺,2025-11-05 21:55:07.000,COMEX黄金期货涨0.81% COMEX白银期货涨1.38%
财联社,2025-11-05 21:54:50.000,美国三场地方选举结果揭晓 民主党籍候选人胜出
财联社,2025-11-05 21:49:56.000,天际股份：公司散单销售占比约30% 价格随行就市
财联社,2025-11-05 21:48:06.000,王毅同伊朗外长阿拉格齐通电话
财联社,2025-11-05 21:42:13.000,欧洲央行管委：央行不会草率得出应在下次会议降息结论
财联社,2025-11-05 21:41:39.000,上大股份：股东计划合计拟减持不超3.90%公司股份
财联社,2025-11-05 21:41:19.000,泰恩康正式启动CKBA药物治疗阿尔茨海默适应症研发
财联社,2025-11-05 21:40:47.000,【电报解读】储能+人型机器人+eVTOL等新兴应用场景快速增长下，机构预计该新技术领域未来需求量或增速翻倍，这家企业与多家厂商长期合作，细分产品已供货
财联社,2025-11-05 21:39:55.000,美肯塔基州坠机事故机场已重新开放航班起降
同花顺,2025-11-05 21:37:12.000,巴西央行将基准利率维持在15%不变，符合预期
同花顺,2025-11-05 21:34:55.000,美国40个主要机场运力将削减10%
财联社,2025-11-05 21:34:23.000,新疆交建：特变电工集团拟减持不超2.88%公司股份
财联社,2025-11-05 21:32:52.000,土耳其首都安卡拉一所大学突发爆炸 暂无人员伤亡
同花顺,2025-11-05 21:17:17.000,富时A50期指连续夜盘收涨0.5%，报15361点
同花顺,2025-11-05 21:16:46.000,ALBEMARLE第三季度销售净额13.1亿美元，高于市场预期
同花顺,2025-11-05 21:15:03.000,美国运输部：美国主要机场自周五起实施强制性航班削减
财联社,2025-11-05 21:13:13.000,波黑检方停止调查塞族共和国领导人
财联社,2025-11-05 21:06:50.000,全国中成药联盟第四批集采启动医疗机构报量工作
同花顺,2025-11-05 21:03:36.000,高通第四季度经调整营收112.7亿美元，预估107.7亿美元
同花顺,2025-11-05 21:03:29.000,热门中概股多数上涨，纳斯达克中国金龙指数涨0.15%
财联社,2025-11-05 21:02:24.000,【财联社早知道】世界第一！我国新型储能装机规模超1亿千瓦，机构预计全球储能装机明年40-50%增长，这家公司在国内储能变流器市场连续四年荣登出货量排名前二；中国太空游项目将在高交会全球首发
财联社,2025-11-05 21:01:34.000,贵州茅台：2025年中期利润分配方案出炉 每股派发现金红利23.957元
财联社,2025-11-05 20:59:27.000,贵州茅台：拟以15亿至30亿元回购股份并注销
财联社,2025-11-05 20:57:56.000,匈牙利外长：匈美领导人会晤主题将是俄乌冲突和双边关系
财联社,2025-11-05 20:57:29.000,首都在线：与超聚变在采购及生态联盟方面有合作
财联社,2025-11-05 20:56:52.000,沪电股份：泰国工厂第三季度亏损约4300万
财联社,2025-11-05 20:55:11.000,11月5日周三《新闻联播》要闻21条
财联社,2025-11-05 20:52:37.000,金杯电工：股东拟合计减持不超1.77%股份
财联社,2025-11-05 20:49:50.000,以色列法院裁定以军前首席检察官今晚获释
财联社,2025-11-05 20:49:49.000,天际股份：短期看六氟磷酸锂处于供需紧张阶段
财联社,2025-11-05 20:45:06.000,天邑股份：控股股东及特定股东合计拟减持不超1%股份
财联社,2025-11-05 20:44:54.000,富特科技：车载电源国内市场以小三电集成方案为主 大集成方案正逐步成为重要趋势
同花顺,2025-11-05 20:44:40.000,美国货币市场基金资产增加1199.9亿美元
财联社,2025-11-05 20:44:20.000,伯特利：与金润电气投资1亿元设立伯特利驱动 布局人形机器人关键部件等赛道
财联社,2025-11-05 20:40:20.000,诚通证券聘任席睿为总经理
财联社,2025-11-05 20:39:54.000,欧央行管委Stournaras：欧洲央行不会草率得出应在下次会议降息结论
同花顺,2025-11-05 20:32:22.000,摩根大通CEO戴蒙称：资产价格相当高，市场始终存在下跌的风险
同花顺,2025-11-05 20:20:22.000,以色列在加沙接收一具以方人员遗体
同花顺,2025-11-05 20:15:30.000,嘉信理财CEO Rick Wurster表示，保持参与市场大体上带来回报
同花顺,2025-11-05 20:12:58.000,现货黄金站上3990美元/盎司
财联社,2025-11-05 20:03:16.000,智谱中标679.8万元水电大模型项目
财联社,2025-11-05 20:02:59.000,通宇通讯：微波天线业务已成公司当前毛利最高业务板块
财联社,2025-11-05 20:02:30.000,上海新阳：公司光刻胶已实现批量化销售 整体销售规模持续增加
财联社,2025-11-05 20:02:25.000,华尔泰：拟投资11.53亿元建设二氧化碳综合利用年产12万吨氨基树脂项目
财联社,2025-11-05 20:02:00.000,豪尔赛：公司犯单位行贿罪 被判处罚金700万元
同花顺,2025-11-05 20:01:36.000,OpenAI首席财务官：警惕泡沫的市场需对AI多些热情
财联社,2025-11-05 20:01:02.000,国家市场监督管理总局局长罗文会见欧盟委员会民主、司法、法治与消费者保护委员迈克尔·麦格拉斯
财联社,2025-11-05 19:57:38.000,卫宁健康：实际控制人周炜被判有期徒刑一年六个月 并处罚金20万元
财联社,2025-11-05 19:54:52.000,日本今年上半年新生儿数量创新低 不足32万人
财联社,2025-11-05 19:53:39.000,铜陵有色：以32.04亿元竞得安徽省铜陵市鸡冠山—胡村铜金钼矿勘查探矿权
财联社,2025-11-05 19:53:33.000,比亚迪：10月份方程豹钛7销量超2万辆
财联社,2025-11-05 19:50:52.000,【机构调研】这家公司33000PAI算力资源已全部对外出租
财联社,2025-11-05 19:50:15.000,赛力斯：H股成功挂牌并上市交易
财联社,2025-11-05 19:46:33.000,台风“海鸥”已致菲律宾85人死亡 75人失踪
财联社,2025-11-05 19:45:25.000,中国太空游项目将在高交会全球首发
财联社,2025-11-05 19:44:32.000,中央金融办王江：建设金融强国必须加强六大关键核心金融要素建设
财联社,2025-11-05 19:41:41.000,以法院将涉嫌泄露以军虐囚视频的前军事检察长延押两日
财联社,2025-11-05 19:38:02.000,国能日新：拟与东方新能共同出资4亿元设立合资公司
同花顺,2025-11-05 19:37:36.000,OpenAI数据中心合作伙伴Crusoe估值约130亿美元
同花顺,2025-11-05 19:20:16.000,特朗普称赞加密货币，称其减轻了美元压力
同花顺,2025-11-05 19:13:53.000,摩根大通和英伟达是首批使用Helios运行复杂算法以解决商业问题的客户
同花顺,2025-11-05 19:12:39.000,谷歌Gemini将在2026年帮助运行苹果siri功能
同花顺,2025-11-05 19:02:37.000,美国总统特朗普重申对美联储主席鲍威尔的批评
同花顺,2025-11-05 19:01:22.000,特朗普预计美国汽油价格将回落
财联社,2025-11-05 18:58:26.000,第二批次网络安全保险服务试点工作启动
财联社,2025-11-05 18:57:49.000,西菱动力：拟收购纬湃汽车电子（上海）有限公司100%股权
同花顺,2025-11-05 18:52:26.000,特朗普预计美国第三季度GDP增速将达到4.2%或更高
财联社,2025-11-05 18:51:17.000,凯美特气：股东及一致行动人计划减持不超过3%公司股份
财联社,2025-11-05 18:49:28.000,2连板标准股份：选举控股股东法定代表人王坤元为董事长
财联社,2025-11-05 18:46:13.000,美国知名“空头”做空英伟达
同花顺,2025-11-05 18:45:18.000,华纳兄弟探索（WBD）将宣布出售或拆分业务的截止日期定在圣诞节
财联社,2025-11-05 18:44:53.000,晶泰与礼来在双抗领域达成3.45亿美元AI大分子研发合作
财联社,2025-11-05 18:38:20.000,舒泰神：股东香塘集团计划减持不超1%公司股份
财联社,2025-11-05 18:37:52.000,巴斯夫湛江一体化基地核心装置首批产品启动生产
财联社,2025-11-05 18:37:11.000,快意电梯：与专业机构共同投资设立产业基金
财联社,2025-11-05 18:34:56.000,天普股份：四名自然人均已将买卖公司股票所获收益上缴至天普股份
财联社,2025-11-05 18:33:46.000,豪能股份：拟发行可转债募资不超18亿元 用于智能制造核心零部件项目（二期）等
财联社,2025-11-05 18:33:00.000,中国国产列车首次亮相奥地利铁路
财联社,2025-11-05 18:32:19.000,闻泰科技第二大股东无锡国联集成电路投资中心拟减持不超3%股份
财联社,2025-11-05 18:31:35.000,2连板神马电力：正在筹划在越南、罗马尼亚投资建厂事宜 具体投资规模等尚未确定
财联社,2025-11-05 18:30:40.000,可川科技：控股股东施惠庆拟减持不超3%股份
财联社,2025-11-05 18:30:34.000,2连板神马电力：实控人陈小琴9月17日至11月5日期间减持1%公司股份
财联社,2025-11-05 18:28:19.000,挪威历史性暂停主权财富基金道德准则 允许其保留所投美科技巨头股份
财联社,2025-11-05 18:27:02.000,章源钨业公布11月上半月长单采购报价
财联社,2025-11-05 18:25:18.000,商务部：停止实施对原产于美国的进口相关截止波长位移单模光纤的反规避措施
同花顺,2025-11-05 18:17:06.000,美联储隔夜逆回购协议使用规模下降
财联社,2025-11-05 18:06:13.000,温氏股份：10月生猪销量收入同比下降13.15%
同花顺,2025-11-05 18:04:15.000,土耳其国家情报部门负责人会见哈马斯代表团，讨论加沙停火
财联社,2025-11-05 18:03:44.000,欧航局成功发射“哨兵-1D”卫星
财联社,2025-11-05 18:03:36.000,三江购物：股东阿里泽泰拟减持不超3%股份
财联社,2025-11-05 17:52:39.000,晨光新材：股东皓景博瑞拟减持不超0.96%股份
财联社,2025-11-05 17:51:20.000,机构：预计2035年全球固态电池需求量将达到740GWh
财联社,2025-11-05 17:51:12.000,何小鹏：汽车现在全球是10万亿美金市场 但机器人会是20万亿美金的市场
同花顺,2025-11-05 17:46:17.000,墨西哥主要股指涨幅扩大至1.9%至63562.97点，创历史新高
财联社,2025-11-05 17:40:32.000,南向资金全天净买入103.73亿港元 南方恒生科技净买额居首
财联社,2025-11-05 17:36:50.000,智洋创新：董事及高管拟合计减持不超0.52%公司股份
财联社,2025-11-05 17:35:42.000,邵佳一出任中国国家男子足球队主教练
财联社,2025-11-05 17:34:29.000,中国证券投资基金业协会接待美国投资公司协会一行来访
财联社,2025-11-05 17:33:26.000,中天科技：已研发出适用于量子通信的特种光纤 传输损耗较传统光纤降低30%
财联社,2025-11-05 17:31:53.000,中天科技：近期成功获批江苏省科技重大专项《全固态低成本锂离子储能电池研发》
财联社,2025-11-05 17:28:14.000,【风口研报·公司】碳酸锂+钾盐资源双轮驱动，这家公司实控人变化后具备碳酸锂产能持续增长预期，有望成为细分领域提锂龙头；另有一家掌握核心技术平台的血制品“新锐”
同花顺,2025-11-05 17:17:10.000,美债收益率继续上涨
同花顺,2025-11-05 17:12:58.000,俄总统普京：若美恢复核试验 俄将采取对等反制措施
财联社,2025-11-05 17:04:18.000,LG化学宣布将开发肾细胞癌创新疗法
财联社,2025-11-05 17:01:33.000,商务部新闻发言人就调整出口管制管控名单措施答记者问
财联社,2025-11-05 17:01:28.000,商务部新闻发言人就调整不可靠实体清单措施答记者问
财联社,2025-11-05 16:58:45.000,*ST天山：10月份活畜销售收入同比增长242.54%
财联社,2025-11-05 16:57:45.000,泰国对华热轧钢板反倾销案发起反规避调查及期中复审调查
财联社,2025-11-05 16:57:20.000,南方电网：新能源高渗透下 系统快速调节能力不足已成影响大电网安全的关键因素
财联社,2025-11-05 16:54:47.000,调查显示11月份钢材市场价格走势谨慎乐观
财联社,2025-11-05 16:52:41.000,小鹏计划2026年底规模量产高阶人形机器人
财联社,2025-11-05 16:50:01.000,小鹏宣布与宝钢开展机器人合作
财联社,2025-11-05 16:49:42.000,路德环境：拟变更证券简称为“路德科技”
同花顺,2025-11-05 16:48:23.000,美光科技股价涨幅扩大，最新上涨8.2%
财联社,2025-11-05 16:47:52.000,吉视传媒：公司股价存在短期上涨过快后的下跌风险
财联社,2025-11-05 16:44:33.000,江苏：支持符合条件的体育企业上市
财联社,2025-11-05 16:42:57.000,香港证监会终身禁止恒生银行前有关人士张艺议重投业界
同花顺,2025-11-05 16:30:12.000,上市辅导提醒：武汉嘉晨电子技术股份有限公司启动上市辅导
同花顺,2025-11-05 16:30:09.000,"上市辅导提醒：映恩生物（Duality Biotherapeutics, Inc.）启动上市辅导"
同花顺,2025-11-05 16:06:30.000,美联储理事米兰：ADP数据是个令人欣喜的意外；政府停摆前的就业市场趋势似乎依然存在；就业市场数据表明利率可能低于当前水平；美联储政策仍过于限制性，当前政策存在风险。（财联社）
财联社,2025-11-05 16:05:26.000,福安药业：子公司庆余堂收到菲律宾GMP符合性证书
同花顺,2025-11-05 16:04:32.000,为结束政府“停摆” 美国会民主党领袖呼吁同特朗普会谈
财联社,2025-11-05 16:03:16.000,11月5日连板股分析：资金继续抱团高位股 平潭发展走出14天11板
同花顺,2025-11-05 16:02:54.000,美国银行计划向另类投资市场投入大约5000亿美元
同花顺,2025-11-05 16:02:33.000,美国三季度家庭债务增长1.1%
财联社,2025-11-05 15:59:19.000,金融监管总局副局长周亮赴香港访问
财联社,2025-11-05 15:53:07.000,我国首台极紫外波段物质吸收谱台式化仪器成功研制
同花顺,2025-11-05 15:50:22.000,英国10年期国债收益率升至10月21日以来最高水平
财联社,2025-11-05 15:49:08.000,ST逸飞：46系圆柱电芯设备订单增长较快
财联社,2025-11-05 15:48:37.000,硅业分会：本周国内多晶硅市场整体延续弱稳态势 成交活跃度略有回升
财联社,2025-11-05 15:47:20.000,委内瑞拉俄罗斯已保持军事合作25年
财联社,2025-11-05 15:46:38.000,北美电影市场10月票房创27年新低
财联社,2025-11-05 15:45:45.000,圣阳股份：自主研发的固态电池已完成安全验证 进入典型场景市场应用阶段
同花顺,2025-11-05 15:44:20.000,HSBC将潍柴动力A股评级上调至买进
财联社,2025-11-05 15:38:17.000,嘉元科技：与宁德时代签订合作框架协议 在新型电池用负极集流体材料（包括但不限于固态电池用铜箔）等方面全方位开展合作
同花顺,2025-11-05 15:33:32.000,乌称美应对提供远程武器持开放态度
同花顺,2025-11-05 15:31:38.000,美国上周EIA原油库存增加520.2万桶
同花顺,2025-11-05 15:31:04.000,美国至10月31日当周EIA战略石油储备库存 49.8万桶，前值53.3万桶
同花顺,2025-11-05 15:18:54.000,摩根大通证券上调阳光电源评级至超配
同花顺,2025-11-05 15:12:29.000,美国货机坠毁死亡人数升至9人
财联社,2025-11-05 15:03:48.000,格鲁吉亚外长博乔里什维利将访华
财联社,2025-11-05 15:02:29.000,波士顿科学大中华区总裁张珺：六款产品“首展首秀” 进博会已成“握手式创新策源地”
财联社,2025-11-05 15:02:28.000,收评：创业板指低开高走涨超1% 电网设备板块近20股涨停
同花顺,2025-11-05 15:02:20.000,美国10月ISM非制造业PMI为52.4，预期为50.8
同花顺,2025-11-05 15:01:37.000,国内期货夜盘收盘主力合约涨跌互现
财联社,2025-11-05 15:01:30.000,国内商品期货多数收跌 多晶硅跌超2%
财联社,2025-11-05 15:01:21.000,原甘肃省扶贫开发办公室副主任李世英接受审查调查
财联社,2025-11-05 15:00:17.000,多晶硅11月或仍有累库压力 部分硅片企业已有减产计划
同花顺,2025-11-05 14:58:08.000,雅本化学：未来将探索更多创新原药项目合作机会
财联社,2025-11-05 14:56:28.000,厄瓜多尔5省3市因严重内乱进入紧急状态
同花顺,2025-11-05 14:55:39.000,抢占出海桥头堡！华为、腾讯、蚂蚁等亮相香港金融科技周
财联社,2025-11-05 14:54:19.000,特朗普再次提名艾萨克曼出任美航天局局长
财联社,2025-11-05 14:52:52.000,【盘中宝】前9月新增数量同比增近50%，机构称反内卷持续推进下该行业价格和盈利修复明显，这家企业产品出货量位居全球前列
同花顺,2025-11-05 14:52:49.000,MEMS巨头Silex考虑斯德哥尔摩IPO，此前控股权转给瑞典财团
同花顺,2025-11-05 14:52:32.000,泽连斯基：美应对向乌提供远程武器持开放态度
同花顺,2025-11-05 14:49:57.000,中国银联与中国银行将联合发布离境退税创新服务产品
财联社,2025-11-05 14:45:51.000,日本自卫队开始支援捕熊行动
同花顺,2025-11-05 14:45:02.000,中国一汽分别与大众汽车集团、奥迪汽车股份公司、丰田汽车（中国）签署合作备忘录
财联社,2025-11-05 14:44:10.000,宇树科技王兴兴：当下具身机器人发展阶段类似于ChatGPT发布前的1—3年左右
财联社,2025-11-05 14:43:56.000,【电报解读】大众将与地平线联合研发汽车SOC芯片，地平线智驾芯片2024年市占率达35%，这家公司基于其芯片的新一代产品预计下年量产
财联社,2025-11-05 14:41:37.000,宇树科技王兴兴：预计今年国内智能机器人领域单家企业平均增长率在50%—100%
同花顺,2025-11-05 14:31:12.000,美股开盘：三大指数涨跌不一
同花顺,2025-11-05 14:24:17.000,齐默巴奥米特控股美股盘前跌超10%
同花顺,2025-11-05 14:18:34.000,Pinterest美股盘前跌超20%
同花顺,2025-11-05 14:07:44.000,特朗普再要求参议院终止“冗长辩论”以结束政府停摆
同花顺,2025-11-05 14:07:08.000,以军称打死2名加沙地带试图越界人员 称其构成“直接威胁”
同花顺,2025-11-05 14:05:33.000,字节旗下豆包PC端产品负责人齐俊元离职
财联社,2025-11-05 14:05:16.000,美政府被曝正考虑向沙特出售48架F-35战机
财联社,2025-11-05 14:04:07.000,日本制铁预计本财年净亏损600亿日元
财联社,2025-11-05 14:01:20.000,陈国基：香港正构建先进科创体系
财联社,2025-11-05 13:57:58.000,沪深两市成交额突破1.5万亿 预计全天成交约1.85万亿
财联社,2025-11-05 13:55:32.000,北京：加快AI+医药健康示范应用 支持医疗卫生机构联合大模型企业挂牌AI实体医院
同花顺,2025-11-05 13:54:40.000,现货白银站上48美元/盎司
财联社,2025-11-05 13:51:48.000,港交所：前三季度新股总集资额达1883亿港元
财联社,2025-11-05 13:51:35.000,科德数控与上飞公司签署卓越创新中心共建协议 双方将围绕大飞机复杂核心零件等方面开展合作
财联社,2025-11-05 13:48:07.000,北京：拟设立脑机接口专项孵化基金 打造中关村（昌平）脑机接口产业集聚区
财联社,2025-11-05 13:45:43.000,港股有色板块走强 天齐锂业H股涨6%
财联社,2025-11-05 13:43:53.000,港交所：前三季度沪深股通及港股通成交金额同比分别上升67%和229%
财联社,2025-11-05 13:43:49.000,液冷服务器概念震荡走强 淳中科技6天3板再创历史新高
同花顺,2025-11-05 13:34:45.000,新疆交建：股东特变电工拟减持不超过2.88%股份
财联社,2025-11-05 13:29:34.000,安徽：扎实推进新一轮找矿突破战略行动 分类施策推进停产矿山复工复产
财联社,2025-11-05 13:28:52.000,【金牌纪要库·风口会议】成本降至八分之一！AI漫剧项目利润显著提升，这家为国内AI漫剧制作龙头企业之一
财联社,2025-11-05 13:28:09.000,李强出席第八届中国国际进口博览会开幕式并发表主旨演讲
同花顺,2025-11-05 13:27:48.000,大洋电机：董事刘自文、刘博、伍小云拟分别减持0.0144%、0.0094%和0.0123%股份
财联社,2025-11-05 13:25:59.000,丰田汽车第二财季经营利润8395.5亿日元 同比下降27%
财联社,2025-11-05 13:25:24.000,安徽：支持铜陵等重点黄金矿区资源整合 鼓励黄金企业以资本为纽带开展整合
财联社,2025-11-05 13:25:22.000,影视股异动拉升 中国电影涨停
同花顺,2025-11-05 13:24:23.000,赛诺菲创新靶向纳米抗体药物可倍力在华获批
财联社,2025-11-05 13:24:09.000,普京：“海燕”和“波塞冬”两款武器装备可保数十年战略平衡
同花顺,2025-11-05 13:15:49.000,美国“小非农”人数高于预期
同花顺,2025-11-05 13:04:42.000,Unity美股盘前涨超20%
同花顺,2025-11-05 12:56:38.000,沪宁股份：拟向上海虹剑光电科技有限公司投资4000万元
财联社,2025-11-05 12:53:36.000,于东来：胖东来没有上市规划
同花顺,2025-11-05 12:53:24.000,德尔未来：董事史旭东、高管张立新、财务总监吴惠芳拟分别减持0.0142%、0.0463%、0.0224%股份
同花顺,2025-11-05 12:53:09.000,金杯电工：股东、部分董事兼高级管理人员拟合计减持不超1.77%股份
同花顺,2025-11-05 12:52:26.000,浩云科技：董事长雷洪文已减持0.602%股份
财联社,2025-11-05 12:49:11.000,11月5日午间涨停分析
同花顺,2025-11-05 12:46:22.000,天邑股份：控股股东及特定股东拟分别减持不超过0.1771%、0.8228%公司股份
财联社,2025-11-05 12:38:03.000,加拿大新政府公布首份财政预算案
财联社,2025-11-05 12:37:39.000,【机构调研】这家公司是少数能够提供IDC交直流配电系统全套关键设备及解决方案的厂商之一
同花顺,2025-11-05 12:33:53.000,全球首型深远海智能渔业养殖工船抵达湛江 准备交付使用
财联社,2025-11-05 12:32:34.000,台风“海鸥”影响南海 自然资源部启动海洋灾害四级应急响应
财联社,2025-11-05 12:28:14.000,香港财政司司长陈茂波：将以双引擎战略发展AI
同花顺,2025-11-05 12:26:36.000,梯瓦制药美股盘前涨超10%
同花顺,2025-11-05 12:23:34.000,淮河能源：发行股份及支付现金购买资产暨关联交易事项获上交所审核通过
财联社,2025-11-05 12:22:47.000,湖南省平江县：全面推行现房销售
财联社,2025-11-05 12:20:55.000,今年西部陆海新通道班列累运量突破120万标箱
同花顺,2025-11-05 12:20:04.000,菲律宾军方一架直升机进行预防性迫降
