来源,时间,标题
财联社,2025-11-01 22:23:03.000,四只小鼠“入住”空间站 状态良好
财联社,2025-11-01 21:54:13.000,明年APEC深圳举办 李家超：配合中央规划 港府会全力以赴
财联社,2025-11-01 21:48:12.000,点球大战泰州队击败南通队 夺得“苏超”冠军
财联社,2025-11-01 21:30:47.000,外交部发言人就日本领导人APEC会议期间涉台错误言行答记者问
财联社,2025-11-01 21:15:35.000,鸿蒙智行：10月交付新车68216台 成交均价39万元
财联社,2025-11-01 21:04:12.000,吉利汽车：10月乘用车销量达307133辆 新能源汽车销量177882辆
财联社,2025-11-01 20:45:57.000,伯克希尔哈撒韦：Q3前五大重仓股公允价值合计占比66%
财联社,2025-11-01 20:15:02.000,11月1日周六《新闻联播》要闻19条
财联社,2025-11-01 20:05:14.000,伯克希尔哈撒韦：Q3净利润307.96亿美元 现金储备达3816.7亿美元
财联社,2025-11-01 19:11:02.000,美国防部将提供“战斧”决定权交给总统
财联社,2025-11-01 19:09:42.000,关于举办纪念孙中山先生诞辰160周年活动的决定
财联社,2025-11-01 18:46:01.000,今年前9个月浙江横店微短剧剧组接待量同比增长285.8%
财联社,2025-11-01 18:25:47.000,韩正访问沙特
财联社,2025-11-01 18:24:56.000,比亚迪李云飞：10月份销售44.17万辆 创年内新高
财联社,2025-11-01 18:06:41.000,习近平同韩国总统李在明会谈
财联社,2025-11-01 17:43:09.000,国家粮食和物资储备局召开粮食领域“十五五”规划专家座谈会
财联社,2025-11-01 17:29:55.000,广西梧州市藤县一民房发生火灾 造成3人死亡
财联社,2025-11-01 17:07:54.000,深蓝汽车：10月交付36792辆
财联社,2025-11-01 16:29:42.000,广汽菲克长沙工厂即将开启第六次拍卖
财联社,2025-11-01 16:09:28.000,国家能源局：9月全国新增建档立卡新能源发电项目共7218个
财联社,2025-11-01 16:00:15.000,郑丽文就任中国国民党主席
财联社,2025-11-01 15:48:04.000,燃料从“铀”到“钍” 我国实现钍基熔盐堆研发突破 
财联社,2025-11-01 15:46:17.000,伊朗革命卫队海军在波斯湾查获24万升走私燃料
财联社,2025-11-01 15:38:43.000,以军称打死一名黎真主党精锐部队成员
财联社,2025-11-01 15:37:28.000,蔚来：2025年10月交付40397辆
财联社,2025-11-01 15:19:07.000,李在明：期待在深圳再次相聚 见证新的发展篇章
财联社,2025-11-01 15:07:51.000,铁路部门启动“双11”网购高峰期快件运输服务
财联社,2025-11-01 15:04:37.000,海南航空接收空客A330neo
财联社,2025-11-01 15:03:43.000,山西电力现货市场出清周期缩短至5分钟
同花顺,2025-11-01 14:53:59.000,飞天茅台电商平台售价低见1550元/瓶
财联社,2025-11-01 14:32:22.000,加拿大总理称已就反关税广告向特朗普致歉
财联社,2025-11-01 14:27:59.000,习近平出席韩国总统举行的欢迎仪式
财联社,2025-11-01 14:27:58.000,2025国谈第三日下午：诺华、罗氏、贝达药业等企业代表入场
同花顺,2025-11-01 14:11:45.000,四只小鼠“入住”空间站！状态良好
财联社,2025-11-01 14:08:14.000,我国西部地区装机最大的抽蓄电站主体工程开工
财联社,2025-11-01 14:00:03.000,领克月销破4万台 品牌均价超20万元
财联社,2025-11-01 13:48:07.000,阿维塔10月销量13506辆
同花顺,2025-11-01 13:41:32.000,中企承建的斐济首座绿色建筑启用
同花顺,2025-11-01 13:33:47.000,海南离岛免税政策升级
同花顺,2025-11-01 13:30:36.000,习近平圆满结束出席亚太经合组织第三十二次领导人非正式会议和对韩国的国事访问
财联社,2025-11-01 13:27:45.000,中国贸促会接棒2026年亚太经合组织工商领导人峰会主办权
财联社,2025-11-01 13:16:30.000,今年厦门口岸出入境破500万人次 外籍旅客量创新高
同花顺,2025-11-01 12:54:09.000,"吉利汽车：10月新能源汽车销量177,882辆，同比增长64%"
财联社,2025-11-01 12:51:53.000,我国航空制造装备领域取得重大突破 世界最大蒙皮拉伸机通过验收
财联社,2025-11-01 12:45:23.000,全国政协十四届常委会第十四次会议举行全体会议 王沪宁出席
同花顺,2025-11-01 12:40:04.000,美国纽约两架联合航空客机发生地面擦碰事故
财联社,2025-11-01 12:26:13.000,李在明：中韩经济合作至关重要
财联社,2025-11-01 12:05:48.000,阿根廷内阁首席部长辞职
同花顺,2025-11-01 12:04:52.000,伯克希尔哈撒韦A2025年Q3净利润307.96亿美元
同花顺,2025-11-01 11:51:45.000,规模500亿元，江苏社保科创基金签约
同花顺,2025-11-01 11:38:19.000,韩国总统：和平是建设可持续明天的基础
财联社,2025-11-01 11:31:57.000,第十八届中国-欧盟投资贸易科技合作洽谈会将于11月在成都举办
财联社,2025-11-01 11:15:27.000,2025国谈第三日上午场：阿斯利康代表已完成全部谈判离场
财联社,2025-11-01 11:12:25.000,习近平宣布中方将在深圳举办亚太经合组织第三十三次领导人非正式会议
财联社,2025-11-01 11:03:10.000,新疆维吾尔自治区政协党组成员、副主席金之镇被查
同花顺,2025-11-01 11:01:40.000,郑州演艺赛事奖励政策今起施行 大型演出最高奖补300万元
财联社,2025-11-01 10:57:25.000,单价逾57万元/平 深圳法拍市场一套住宅以3.65亿元价格成交
财联社,2025-11-01 10:57:03.000,全国1%人口抽样调查现场登记环节今起开展
财联社,2025-11-01 10:56:25.000,极氪推出全系车型跨年购置税补贴方案 补贴金额最高1.5万元
财联社,2025-11-01 10:47:47.000,北汽新能源10月销量30542台
财联社,2025-11-01 10:45:55.000,陈光明旗下专户产品宣布“封盘”
同花顺,2025-11-01 10:42:46.000,美研究军机在南海坠毁原因
财联社,2025-11-01 10:37:26.000,俄方反制 对多名欧盟官员实施入境限制措施
财联社,2025-11-01 10:19:49.000,小鹏汽车10月交付新车42013台
同花顺,2025-11-01 10:10:26.000,哈桑当选坦桑尼亚总统
财联社,2025-11-01 09:59:36.000,俄称击落6架飞往莫斯科无人机
财联社,2025-11-01 09:50:19.000,深圳10月一二手住宅总网签6847套 环比降10.3%
财联社,2025-11-01 09:49:58.000,中国第42次南极考察队起航
同花顺,2025-11-01 09:38:54.000,外媒：柯克遇刺后，美高官纷纷搬进军事基地
财联社,2025-11-01 09:27:24.000,2025中国5G+工业互联网大会将于11月21日至23日在湖北武汉举办
同花顺,2025-11-01 09:24:22.000,三峡工程整体竣工5年来累计发电4230亿千万时
财联社,2025-11-01 09:21:05.000,商务部回应安世半导体相关问题：将对符合条件的出口予以豁免
财联社,2025-11-01 09:21:05.000,商务部新闻发言人就安世半导体相关问题应询答记者问
财联社,2025-11-01 09:13:03.000,零跑汽车10月交付70289台
财联社,2025-11-01 09:08:43.000,习近平继续出席亚太经合组织第三十二次领导人非正式会议
同花顺,2025-11-01 09:04:17.000,美网红卡戴珊质疑美国登月造假，NASA回应：以前去过6次月球
财联社,2025-11-01 08:57:13.000,习近平将继续出席亚太经合组织第三十二次领导人非正式会议
财联社,2025-11-01 08:51:32.000,中指研究院：百城新建住宅平均价格环比上涨0.28%
同花顺,2025-11-01 08:49:20.000,QFII三季度新进增持114股 37股年内涨幅翻倍
财联社,2025-11-01 08:41:48.000,2025国谈第三日上午场开启：艾伯维、信达生物、金赛药业、阿斯利康等药企入场
财联社,2025-11-01 08:41:29.000,财政部、税务总局发布关于黄金有关税收政策的公告
财联社,2025-11-01 08:40:21.000,279家北交所公司披露三季报 超八成实现盈利
财联社,2025-11-01 08:03:55.000,机构调研集中度大幅提升 35家公司接待超百家机构
财联社,2025-11-01 07:53:34.000,DTE能源与甲骨文签署供电协议
财联社,2025-11-01 07:41:01.000,辽宁省委书记许昆林会见辽宁U18男足队：推动举办东北地区城市足球联赛
同花顺,2025-11-01 07:40:52.000,香港2025年第三季度本地生产总值预估同比上升3.8%
同花顺,2025-11-01 07:19:18.000,宇树科技王兴兴：中国企业在全球科技版图中扮演纽带角色
同花顺,2025-11-01 07:16:56.000,刘强东称将打造“超级供应链”
同花顺,2025-11-01 07:10:34.000,华泰证券：看好锂电产业链材料各环节盈利改善 实现量利齐升
财联社,2025-11-01 07:02:17.000,美联邦航空管理局：超35处地点存在空管人员配备问题
财联社,2025-11-01 07:00:54.000,核心设备完全国产化 我国钍基熔盐实验堆建成并首次实现堆内钍铀转化
财联社,2025-11-01 07:00:26.000,南非已为举办二十国集团领导人约堡峰会“做好准备”
财联社,2025-11-01 07:00:15.000,约旦副首相会见巴林外交大臣 讨论加沙局势
财联社,2025-11-01 06:32:43.000,美国白宫宣布限制记者进入新规定
财联社,2025-11-01 06:31:57.000,美法官裁定总统不能要求选民在投票前出示公民身份证明
财联社,2025-11-01 06:30:00.000,周六你需要知道的隔夜全球要闻
财联社,2025-11-01 06:16:54.000,美国纽约肯尼迪国际机场因人员配备问题面临地面停飞
同花顺,2025-11-01 06:16:49.000,2025年世界城市日全球主场活动在哥伦比亚举办
财联社,2025-11-01 06:09:51.000,特朗普称尚未决定是否袭击委内瑞拉境内目标
财联社,2025-11-01 06:05:22.000,中央气象台11月1日06时继续发布暴雪蓝色预警
财联社,2025-11-01 06:04:37.000,中央气象台11月1日06时发布大雾橙色预警
同花顺,2025-11-01 06:04:24.000,黎巴嫩总统斥以色列用袭击回应谈判
财联社,2025-11-01 05:56:50.000,英伟达CEO黄仁勋完成10亿美元股票出售
同花顺,2025-11-01 05:51:17.000,北京越野宣布10月销量15003台
同花顺,2025-11-01 05:48:56.000,"阿维塔10月销量13,506辆"
财联社,2025-11-01 05:32:37.000,离岸人民币兑美元较周四纽约尾盘跌118点
同花顺,2025-11-01 05:20:25.000,匈牙利总理说欧洲正走向战争
同花顺,2025-11-01 05:12:05.000,宠物托运服务上新：部分车票带“宠”字
同花顺,2025-11-01 04:11:42.000,2026年4次飞行任务公布
同花顺,2025-11-01 04:03:09.000,新能源车接连起火，经济日报：给新能源汽车系上安全带
同花顺,2025-11-01 03:02:02.000,安理会通过多个联合国任务授权延期
同花顺,2025-11-01 02:51:49.000,今起新规正式实施 国产小客车新车上牌网上“一站办结”
同花顺,2025-11-01 02:46:27.000,温氏股份：已制定明确出海计划 探寻增长新空间
同花顺,2025-11-01 02:43:11.000,习近平在亚太经合组织第三十二次领导人非正式会议第二阶段会议上的讲话
同花顺,2025-11-01 02:21:02.000,2025年1-10月奔腾品牌销量157617辆
同花顺,2025-11-01 02:20:37.000,10月小鹏汽车交付新车42013台
同花顺,2025-11-01 02:13:53.000,岚图汽车2025年10月交付17218辆
同花顺,2025-11-01 02:13:09.000,寒武纪回应原CTO索赔42.87亿元：将全力应诉
同花顺,2025-11-01 02:10:53.000,吉利银河M9第20000辆量产车正式下线
同花顺,2025-11-01 02:09:37.000,"理想汽车2025年10月交付31,767辆"
同花顺,2025-11-01 02:02:57.000,红十字国际委员会总干事：针对人道主义工作者的袭击“情况严重”
同花顺,2025-11-01 02:02:35.000,"智己汽车10月销售13,159台"
同花顺,2025-11-01 02:02:07.000,2025年10月小米汽车交付量持续超过40000台
同花顺,2025-11-01 01:53:01.000,中国工程院院士倪光南：中国已成为全球开源大模型创新引领者
同花顺,2025-11-01 01:50:42.000,中国第42次南极考察队从上海起航
同花顺,2025-11-01 01:34:45.000,基金新规来了：专治基金经理忽悠人
同花顺,2025-11-01 01:16:48.000,中信证券：在上证突破4000点和三季报披露完成后，市场大概率重新回到业绩驱动的结构市
同花顺,2025-11-01 00:39:01.000,上市车企前三季度业绩分化加剧 新能源汽车成破局关键
同花顺,2025-11-01 00:18:28.000,光伏行业龙头厂商减亏 硅料环节率先回暖
同花顺,2025-11-01 00:12:17.000,海南离岛免税“升级”政策今起实施
同花顺,2025-11-01 00:04:28.000,钢铁业未见“金九银十” 中钢协呼吁“自律控产”
同花顺,2025-10-31 23:31:51.000,中国6项全球重要农业文化遗产获联合国粮农组织授牌
同花顺,2025-10-31 21:33:08.000,富时A50期指连续夜盘收涨0.19%，报15280点
同花顺,2025-10-31 21:08:26.000,保加利亚议会决定暂停向其他欧盟成员国供应石油产品
同花顺,2025-10-31 21:07:56.000,美国劳工部在特朗普政府关门期间进一步召回250名工作人员
同花顺,2025-10-31 20:07:26.000,纳斯达克中国金龙指数收涨0.53% 月线5连涨遭终结
同花顺,2025-10-31 20:01:33.000,美股三大指数月线均至少6连涨 亚马逊创历史新高
同花顺,2025-10-31 19:59:30.000,IMF表示，美国经济在2025年的增长率将为2.0%
同花顺,2025-10-31 19:59:02.000,最快纪录！神二十一与空间站完成对接
同花顺,2025-10-31 19:35:32.000,神二十一成功对接空间站
同花顺,2025-10-31 19:18:40.000,在岸人民币兑美元收报7.1200元
同花顺,2025-10-31 19:05:04.000,美法官裁定政府不得在“停摆”期间暂停食品援助
同花顺,2025-10-31 18:50:51.000,马斯克社交平台X将推出独立应用 “X聊天”
同花顺,2025-10-31 18:37:03.000,法拉利与加密货币交易所BingX签署多年合作伙伴协议
财新网,2025-10-31 10:12:06.718,今年是摩托车出口最好的一年
财新网,2025-10-31 09:47:44.665,9月持有额突破3.5万亿元
财新网,2025-10-31 08:44:06.265,鲍威尔“踩刹车” “新债王”冈拉克怎么看
财新网,2025-10-31 04:00:00.000,有知情人士称成本将超20亿欧元……
财新网,2025-10-31 02:00:00.000,中国内地银行面临多重压力
财新网,2025-10-30 09:51:16.072,同比下降220亿元
财新网,2025-10-30 07:02:15.330,媒体称OpenAI将于明年申请IPO
财新网,2025-10-30 03:00:00.000,这个持续三年的行动终于将画上句号
财新网,2025-10-29 08:34:44.858,家具制造业人丁不旺
财新网,2025-10-29 08:05:16.310,这个国家正考虑十多年来首次增加黄金储备的计划
财新网,2025-10-29 07:59:32.153,市场应急方案有哪些？
财新网,2025-10-29 03:00:00.000,金融行业降薪覆盖面延伸
财新网,2025-10-28 09:10:51.114,上半财年（4—9月）销量创纪录
财新网,2025-10-28 09:00:00.000,公司前三季大幅减亏 第三季度单季转盈
财新网,2025-10-28 08:32:52.492,化肥越用越少
财新网,2025-10-28 08:19:33.240,农业除涝达标面积新高
财新网,2025-10-28 03:00:00.000,交易员担心日本长期国债收益率将再度上行
财新网,2025-10-27 10:00:00.000,韩国总统李在明发出警告：韩国正迈向与日本类似的道路
财新网,2025-10-27 09:10:00.000,汇丰预计将损失11亿美元
财新网,2025-10-27 08:57:34.350,上班时长短了但短的不多
财新网,2025-10-27 08:25:57.177,FDI同比降幅收窄
财新网,2025-10-27 05:00:00.000,宏胜集团最新消息
财新网,2025-10-27 03:00:00.000,安世半导体事件背后的博弈
