来源,时间,标题
财联社,2025-11-03 16:03:46.000,杭氧股份：中标聚变新能（安徽）有限公司-低温氮系统采购项目
财联社,2025-11-03 16:02:31.000,杭州10月二手房网签5934套 环比下降6.9%、同比降35%
财联社,2025-11-03 16:01:30.000,欧洲主要股指开盘涨跌不一 德国DAX30指数涨0.15%
财联社,2025-11-03 15:59:42.000,西班牙国王费利佩六世首次访华 外交部回应
财联社,2025-11-03 15:58:32.000,北方稀土：人形机器人将成稀土磁材需求新引擎
财联社,2025-11-03 15:57:39.000,韩建河山：与中国核工业华兴建设有限公司签署2.07亿元采购合同 约占2024年度经审计营业收入的26.29%
财联社,2025-11-03 15:55:22.000,巴斯夫将整合亚洲聚四氢呋喃业务 关闭韩国蔚山工厂
财联社,2025-11-03 15:49:31.000,我国最大火电厂今日全容量投产
财联社,2025-11-03 15:47:00.000,城发环境：入选印度尼西亚垃圾发电项目供应商名单
财联社,2025-11-03 15:46:32.000,11月3日连板股分析：连板股晋级率仅一成 芳香胺概念走强
财联社,2025-11-03 15:40:33.000,菲律宾和加拿大签署军事协议 中方表态
财联社,2025-11-03 15:39:21.000,国家数据局：优先支持民营企业牵头标准研制
财联社,2025-11-03 15:37:12.000,杭叉集团：计划两年内让物流人形机器人成本下降60%-70%
财联社,2025-11-03 15:07:23.000,格鲁吉亚总理科巴希泽等外国领导人将出席第八届中国国际进口博览会
财联社,2025-11-03 15:06:51.000,爱沙尼亚外长查赫克纳将访华
财联社,2025-11-03 15:06:18.000,西班牙国王费利佩六世将访华
财联社,2025-11-03 15:02:36.000,收评：沪指探底回升涨0.55% 钍基熔盐概念股集体爆发
财联社,2025-11-03 15:01:02.000,国内商品期货收盘涨跌不一 菜粕涨超4%
财联社,2025-11-03 15:00:35.000,全国秋粮收获过九成 冬小麦播种过两成半
财联社,2025-11-03 14:59:38.000,10月玻璃供应增减并行 产能过剩隐患仍在增强
财联社,2025-11-03 14:53:03.000,埃克森美孚CEO警告 欧盟可持续发展法律或令其无法在欧开展业务
财联社,2025-11-03 14:52:15.000,凯德投资拟合并丰树投资？凯德投资：不就传闻或猜测发表评论
财联社,2025-11-03 14:49:42.000,沪深两市成交额连续第6个交易日突破2万亿 较上一日此时缩量超2000亿
财联社,2025-11-03 14:45:43.000,11月3日全国农产品批发市场猪肉平均价格为17.98元/公斤 比上周五上升1.0%
财联社,2025-11-03 14:45:03.000,欧洲央行管委内格尔：欧元区经济前景未变 12月会议将保留所有选项
财联社,2025-11-03 14:03:00.000,央行与韩国银行续签双边本币互换协议 互换规模为4000亿元人民币/70万亿韩元
财联社,2025-11-03 13:58:51.000,日研究揭示癌症强效“刹车”分子的作用机制
财联社,2025-11-03 13:54:04.000,“半岛大超炮”获国内首张超声医美械三类证
财联社,2025-11-03 13:52:20.000,OPEC+宣布明年初暂停增产后 摩根士丹利上调油价预期
财联社,2025-11-03 13:47:49.000,周大生一年关店560家
财联社,2025-11-03 13:46:54.000,【盘中宝】前9月接待量同比增近300%，机构称供需共振下该行业高景气或延续，未来市场规模有望冲击1000亿，这家企业旗下产品近期登顶海外榜单榜首
财联社,2025-11-03 13:45:17.000,创业板指翻红 此前一度跌超2%
财联社,2025-11-03 13:33:04.000,光伏概念延续反弹 阿特斯涨超10%
财联社,2025-11-03 13:29:05.000,俄总理米舒斯京抵达中国 将与中方讨论深化人文领域合作等议题
财联社,2025-11-03 13:24:39.000,消息称三星暂停DDR5合约价报价 SK海力士、美光跟进
财联社,2025-11-03 13:23:45.000,特朗普称不会屈服于民主党勒索
财联社,2025-11-03 13:18:46.000,【风口研报·公司】稀土供需缺口突出，这家公司布局多年的稀土资源回收迎来量价齐升，且下游高性能磁材产能即将释放，覆盖电机、风电、机器人等高成长赛道
财联社,2025-11-03 13:18:27.000,存储芯片概念持续走强 太极实业触及涨停
财联社,2025-11-03 13:07:26.000,【电报解读】全球首条飞行汽车量产线贯通，机构称头部eVTOL主机厂订单陆续落地，产业链规模化发展态势清晰，这家公司与小鹏汇天建立长期稳定合作
财联社,2025-11-03 13:03:16.000,亚投行宣布计划在香港设立办事处
财联社,2025-11-03 12:57:12.000,白皮书：南方电力市场市场化交易电量超7成 绿证交易量占全国63%
财联社,2025-11-03 12:50:44.000,【机构调研】这家全球PCB专用设备领域最大供应商新产品获下游龙头企业大批量采购
财联社,2025-11-03 12:28:49.000,香港证监会发出新指引利便持牌虚拟资产交易平台 连接全球流动性和扩展多元化产品及服务
财联社,2025-11-03 12:17:03.000,我国成功发射遥感四十六号卫星
财联社,2025-11-03 12:12:17.000,李家超将率团赴上海出席第八届进博会 逾350家港企参加进博会创历届新高
财联社,2025-11-03 12:05:15.000,财联社11月3日午间新闻精选
财联社,2025-11-03 12:01:59.000,港股午评：恒生指数涨0.58% 恒生科技指数跌0.24%
财联社,2025-11-03 11:56:43.000,上海成功研制灭活基孔肯雅病毒标准物质
财联社,2025-11-03 11:53:39.000,午间公告：维信诺筹划向特定对象发行股票 或致公司控制权变更
财联社,2025-11-03 11:48:16.000,11月3日涨停分析
财联社,2025-11-03 11:41:56.000,我国装机规模最大火力发电厂今天投产
财联社,2025-11-03 11:32:36.000,汇天飞行汽车量产工厂首台“陆地航母”飞行器正式下线
财联社,2025-11-03 11:31:34.000,国内期货主力合约多数下跌 菜粕涨超4%
财联社,2025-11-03 11:31:11.000,午评：创业板指半日跌超1% 电池概念股集体下挫
财联社,2025-11-03 11:23:52.000,阿富汗6.4级地震已致8人死亡 180人受伤
财联社,2025-11-03 11:17:24.000,明确“黑救护”打击范围 六部门开展非法救护车专项整治
财联社,2025-11-03 11:12:26.000,油气股震荡拉升 中国海油、中国石油双双涨超4%
财联社,2025-11-03 11:11:03.000,成交总价2.96亿元 一家咨询管理公司拍下上海协和城地上一、二层商场
财联社,2025-11-03 11:09:27.000,【电报解读】商用清洁机器人国家标准发布，行业前五大厂商份额占比超6成，这家龙头公司产品已在全球20多个国家交付
财联社,2025-11-03 11:09:25.000,廖岷会见英国内阁办公室副常务次官埃拉姆
财联社,2025-11-03 11:07:17.000,四川省人大常委会原党组成员、副主任宋朝华严重违纪违法被开除党籍
财联社,2025-11-03 11:04:44.000,国家发展改革委原党组成员、副主任徐宪平严重违纪违法被开除党籍
财联社,2025-11-03 11:02:46.000,存储芯片概念局部回暖 普冉股份涨近10%
财联社,2025-11-03 11:01:34.000,中国证监会原党委委员、副主席王建军严重违纪违法被“双开”
财联社,2025-11-03 10:58:35.000,工信部部长李乐成：推进AI手机、AI电脑等消费终端换代 加快人形机器人、脑机接口等新一代智能终端研发与应用
财联社,2025-11-03 10:54:46.000,主力资金监控：北方稀土净卖出超10亿
财联社,2025-11-03 10:41:25.000,【风口研报·公司】国内海风陆续开工+欧洲风电供给紧缺，这家塔筒桩基龙头同时布局海洋牧场、换流站、漂浮式基础等产品，目前已提前布局两大出口基地
财联社,2025-11-03 10:39:03.000,化工板块逆势走强 迪尔化工涨超20%
财联社,2025-11-03 10:38:28.000,创业板指跌逾2% 科创50跌超3%
财联社,2025-11-03 10:31:31.000,俄军称在红军城打击被困乌军
财联社,2025-11-03 10:31:22.000,广东美的电气更名库卡机器人自动化公司
财联社,2025-11-03 10:28:48.000,价格监测中心召开2025-26年度供暖季 天然气供需及价格形势专家座谈会
财联社,2025-11-03 10:26:08.000,沪深两市成交额突破1万亿 较上一日此时缩量超900亿
财联社,2025-11-03 10:22:51.000,郑州：建设具有国际影响力种业大市 到2027年产业链规模达55亿元
财联社,2025-11-03 10:18:09.000,商用清洁机器人国家标准发布
财联社,2025-11-03 10:16:44.000,工信部：落实大规模设备更新和消费品以旧换新相关政策 支持重点行业节水装备设备更新及技术改造
财联社,2025-11-03 10:13:35.000,李家超：鼓励更多投资者进入金融科技领域
财联社,2025-11-03 10:12:07.000,工商银行：暂停受理如意金积存业务的开户、主动积存、新增定期积存计划以及提取实物的申请
财联社,2025-11-03 10:12:04.000,海南自贸概念震荡走强 罗牛山等多股涨停
财联社,2025-11-03 10:03:41.000,黄金、有色板块震荡下挫 潮宏基触及跌停
财联社,2025-11-03 10:03:37.000,最新民调显示美国选民对两党普遍失望
财联社,2025-11-03 10:03:26.000,电网设备板块震荡走强 新特电气涨超11%
财联社,2025-11-03 10:03:05.000,湖南省邵阳市委原常委、市人民政府原副市长仇珂静被开除党籍和公职
财联社,2025-11-03 10:02:04.000,李强将出席第八届进博会开幕式及相关活动
财联社,2025-11-03 10:01:44.000,原北京市国家税务局党组书记、局长吴新联接受纪律审查和监察调查
财联社,2025-11-03 09:43:10.000,港股煤炭股走强 中国秦发涨超5%
财联社,2025-11-03 09:41:30.000,煤炭板块再度走强 安泰集团涨停
财联社,2025-11-03 09:40:31.000,固态电池概念震荡下挫 海科新源跌近15%
财联社,2025-11-03 09:35:57.000,短剧概念快速拉升 欢瑞世纪、粤传媒双双2连板
财联社,2025-11-03 09:32:52.000,创新药概念延续强势 三生国健涨超10%
财联社,2025-11-03 09:30:17.000,钍基熔盐概念发酵 宝色股份等多股涨停
财联社,2025-11-03 09:28:16.000,【盘中宝】行业巨头接连更新产品能力，机构称该AI领域有望迎来拐点机遇，未来相关产品国产化+AI化支持力度或将更加显著，这家企业上半年发布新一代AI产品
财联社,2025-11-03 09:28:07.000,竞价看龙头
财联社,2025-11-03 09:26:24.000,三大指数集体低开
财联社,2025-11-03 09:24:34.000,茅台集团换帅完成工商变更
财联社,2025-11-03 09:21:22.000,央行公开市场今日净回笼2590亿元
财联社,2025-11-03 09:17:44.000,预告
财联社,2025-11-03 09:08:42.000,高盛：中国股市正迈进增长期 AH股指数至2027年底潜在回报达30%
财联社,2025-11-03 09:04:05.000,广东：2025年底前扩展工业旅游资源数到300家左右
财联社,2025-11-03 09:01:24.000,广东：组织好“粤超”足球赛、“省港杯”足球赛等区域精品赛事
财联社,2025-11-03 09:00:34.000,国内商品期货市场开盘多数下跌
财联社,2025-11-03 08:21:19.000,长城科技：实际控制人正在筹划股份协议转让事宜 停牌不超过2个交易日
财联社,2025-11-03 08:14:30.000,中泰证券：政策与技术双轮驱动 光伏产业迈向高质量发展
财联社,2025-11-03 08:10:14.000,财联社11月3日早间新闻精选
财联社,2025-11-03 08:09:14.000,特朗普称尚未认真考虑向乌克兰提供“战斧”导弹
财联社,2025-11-03 08:06:58.000,【九点特供】燃料从“铀”到“钍”，中国核能科技实现全新突破，分析师看好我国钍资源储量丰富，钍基熔盐堆可以助力能源独立，这家公司在钍基熔盐堆领域具有丰富的技术储备和产品销售
财联社,2025-11-03 08:03:58.000,奥特曼称OpenAI年收入远超130亿美元
财联社,2025-11-03 08:03:50.000,马尔代夫正式实施“世代禁烟令”
同花顺,2025-11-03 08:02:30.000,美国能源部长称重启核试验“不包含核爆炸”
财联社,2025-11-03 07:58:41.000,石四药集团：维生素B6注射液通过仿制药质量和疗效一致性评价
同花顺,2025-11-03 07:55:12.000,韩建河山：公司中标项目签订合同，金额为2.07亿元
同花顺,2025-11-03 07:54:03.000,城发环境：入选印尼垃圾发电项目供应商
财联社,2025-11-03 07:53:59.000,今日申购指南及新股定位分析
同花顺,2025-11-03 07:53:54.000,大连电瓷：预中标国家电网5900万元项目
财联社,2025-11-03 07:53:40.000,投资日历：周一资本市场大事提醒
同花顺,2025-11-03 07:53:31.000,凯龙高科：取得E-mark认证
同花顺,2025-11-03 07:52:52.000,开云集团Bottega Veneta将宣布调价，预计上调20%-30%
同花顺,2025-11-03 07:52:49.000,通达股份：预中标1.33亿元国家电网物资
同花顺,2025-11-03 07:52:11.000,土耳其10月消费者价格指数同比上涨32.87%
财联社,2025-11-03 07:51:17.000,中信建投：持续看好储能全球共振大趋势不变
同花顺,2025-11-03 07:51:10.000,俄罗斯堪察加东岸远海发生6.1级地震
同花顺,2025-11-03 07:50:49.000,现货白银涨幅扩大至1%
财联社,2025-11-03 07:49:41.000,粉笔：公司董事会主席兼主要股东张小龙增持股份
财联社,2025-11-03 07:48:29.000,本周央行公开市场将有20680亿元逆回购到期
同花顺,2025-11-03 07:48:03.000,恒而达：行星滚柱丝杠螺纹高效磨削工艺的研发已到最后冲刺阶段
同花顺,2025-11-03 07:47:14.000,李家超：帮助内地企业利用香港作为跳板扩展海外业务
同花顺,2025-11-03 07:46:23.000,南向资金净买入超40亿港元
财联社,2025-11-03 07:44:56.000,泰国空置房屋达164万套
财联社,2025-11-03 07:41:11.000,【点金互动易】六氟磷酸锂+固态电池，六氟磷酸锂产线满产，这家公司硫化物固态电解质中试推进，已经具备中试量产的能力
财联社,2025-11-03 07:38:30.000,A股限售股解禁一览：43.54亿元市值限售股今日解禁
同花顺,2025-11-03 07:38:10.000,“十四五”期间 我国研制发布数据领域国家标准超120项
财联社,2025-11-03 07:37:37.000,倒车影像无法正常显示 日本丰田汽车在加拿大召回近10万辆汽车
同花顺,2025-11-03 07:33:48.000,以方确认哈马斯移交的三具被扣押人员遗体身份
同花顺,2025-11-03 07:32:46.000,美方称中方正在秘密测试核武器，中方：中国始终坚持走和平发展道路，恪守“暂停核试验”承诺
同花顺,2025-11-03 07:31:26.000,南向资金净买入超30亿港元
同花顺,2025-11-03 07:30:26.000,现货白银站上49美元/盎司
同花顺,2025-11-03 07:08:13.000,百奥泰成立生物药业公司，注册资本3.3亿元
同花顺,2025-11-03 07:07:59.000,利元亨与中原特钢签署战略合作协议
同花顺,2025-11-03 07:03:48.000,期货收评：大幅补涨 菜粕涨超4%！黑色建材尾盘走低
财联社,2025-11-03 07:03:32.000,斩断田间窃密黑手！间谍在我国搜集农作物基因数据
财联社,2025-11-03 07:02:12.000,【研选】光伏行业顶层政策+行业自律+技术迭代的供给侧改革思路愈发明确，分析师看好反内卷核心抓手多晶硅企业；公司各业务增速均环比提升，订阅业务加速提升投资者信心
同花顺,2025-11-03 07:02:06.000,现货黄金站上4020美元/盎司
同花顺,2025-11-03 07:01:04.000,ETF收评：中韩半导体ETF领涨4.62%，科创信息ETF领跌2.23%
同花顺,2025-11-03 07:01:00.000,ETF两市成交额5581.69亿元
同花顺,2025-11-03 07:00:45.000,A股收评：沪指缩量反弹涨0.55%，游戏、文化传媒等AI应用方向持续爆发
财联社,2025-11-03 07:00:41.000,截至三季度末 险资持仓A股市值超6500亿元
财联社,2025-11-03 07:00:23.000,拓展双向投资合作空间 更多细化措施将出台
财联社,2025-11-03 06:59:24.000,技术迭代引爆中尺寸OLED需求 国内显示面板企业竞相扩产力争上游
财联社,2025-11-03 06:58:34.000,券商三季度新进206只个股 重点布局有色金属、医药生物板块
同花顺,2025-11-03 06:58:26.000,南向资金净买入超20亿港元
财联社,2025-11-03 06:55:57.000,具有超导性能的锗材料制成
同花顺,2025-11-03 06:54:13.000,ETF两市成交额超5500亿元
同花顺,2025-11-03 06:46:40.000,沪深京三市成交额超2万亿元，较上日此时缩量2104亿元
同花顺,2025-11-03 06:46:17.000,以太坊日内跌近4%
同花顺,2025-11-03 06:45:51.000,实探华强北：内存条价格已翻倍 “早上报价下午又涨100多” 专家：算力中心建设推动上涨
同花顺,2025-11-03 06:41:56.000,泉果基金创始人王国斌突然离世
同花顺,2025-11-03 06:37:52.000,第八届进博会完成布展 新增600余家参展企业
同花顺,2025-11-03 06:33:55.000,挪威将与空客等公司达成协议解决30亿美元诉讼
同花顺,2025-11-03 06:33:21.000,2025年9月全国电视剧（网络剧）拍摄制作备案公示剧目141部
同花顺,2025-11-03 06:31:27.000,韩国综指收涨2.78%
财联社,2025-11-03 06:28:52.000,279家北交所公司披露三季报 超八成盈利
财联社,2025-11-03 06:24:04.000,上市公司业绩向好 分红回购频次稳步提升
财联社,2025-11-03 06:18:50.000,周一（11月3日）重点关注财经事件和经济数据
财联社,2025-11-03 06:14:59.000,美联储12月降息25个基点的概率为69.8%
同花顺,2025-11-03 06:06:54.000,最高检：今年前9个月检察机关起诉侵害未成年人犯罪5.3万人
同花顺,2025-11-03 06:02:43.000,中国人民银行与韩国银行续签双边本币互换协议
财联社,2025-11-03 06:00:21.000,新型钙钛矿光伏器件光电转换率达25.19% 再创新高
同花顺,2025-11-03 05:53:45.000,A股三大指数午后全线翻红
同花顺,2025-11-03 05:51:05.000,越疆发布家庭智能体机器人Rover X1
同花顺,2025-11-03 05:50:19.000,沪深京三市成交额超1.7万亿元，较上日此时缩量1872亿元
同花顺,2025-11-03 05:44:59.000,创业板指午后翻红，此前跌超2%
同花顺,2025-11-03 05:43:07.000,ETF两市成交额超4500亿元
同花顺,2025-11-03 05:41:02.000,阿联酋国家石油公司：2040年后，石油日需求量将保持在1亿桶以上
同花顺,2025-11-03 05:36:53.000,萝卜快跑：已覆盖全球22个城市 周单量超25万单
财联社,2025-11-03 05:33:20.000,新型人工神经元能模仿脑细胞电化学行为
同花顺,2025-11-03 05:29:18.000,光伏设备板块午后再度拉升，阿特斯涨超10%
同花顺,2025-11-03 05:26:15.000,ETF两市成交额超4000亿元
同花顺,2025-11-03 05:18:57.000,港股午后震荡走高，恒生指数涨1%
同花顺,2025-11-03 05:18:13.000,化工板块震荡走强，化肥方向领涨
同花顺,2025-11-03 05:15:42.000,助力中国和沙特的民航连接 SAL与中国货运航空签署协议
同花顺,2025-11-03 05:14:48.000,沪深京三市成交额超1.5万亿元，较上日此时缩量1961亿元
同花顺,2025-11-03 05:14:26.000,存储芯片板块午后持续回暖，香农芯创涨超5%再创新高
同花顺,2025-11-03 05:13:50.000,高盛：首予康诺亚“买入”评级及目标价92.67港元
同花顺,2025-11-03 05:12:33.000,AI医疗影像独角兽数坤科技再冲IPO
同花顺,2025-11-03 05:09:11.000,卫星导航板块午后快速走高，航天智装20cm涨停创新高
同花顺,2025-11-03 05:07:48.000,食品股午后持续走高，巴比食品涨停
财联社,2025-11-03 04:56:19.000,阿富汗发生6.4级地震 震源深度20公里
同花顺,2025-11-03 04:48:38.000,野村证券上调MSCI中国及MSCI除日本外亚洲指数预期 看好盈利增长与人工智能前景
同花顺,2025-11-03 04:40:42.000,阿富汗6.4级地震已致10人死亡 240人受伤
同花顺,2025-11-03 04:37:02.000,广州地铁回应“‘摇一摇’广告影响扫码乘车”：已立即关闭
同花顺,2025-11-03 04:33:35.000,司法部系统重申行政执法人员负面禁令
财联社,2025-11-03 04:30:57.000,西太平洋银行全年净利润69.2亿澳元 不及预期
同花顺,2025-11-03 04:25:10.000,高盛：我们仍然认为 美联储降息的动机与我们对美元进一步下行的前提是一致的
财联社,2025-11-03 04:21:11.000,欧佩克从俄罗斯、伊拉克等五个国家收到了最新的减产补偿计划
同花顺,2025-11-03 04:19:27.000,萝卜快跑披露周单量超25万单
同花顺,2025-11-03 04:16:26.000,11月3日午间公告一览：神宇股份发行可转换公司债券获同意
同花顺,2025-11-03 04:14:02.000,智元机器人与龙旗科技合作落地真机强化学习技术
同花顺,2025-11-03 04:09:30.000,韩国股市延续AI热潮涨势 SK海力士一度上涨10%
同花顺,2025-11-03 04:06:30.000,美团LongCat-Flash-Omni正式发布并开源
同花顺,2025-11-03 04:04:37.000,第八届进博会新闻中心向中外媒体开放，设AI服务专区
同花顺,2025-11-03 04:04:22.000,世纪华通旗下盛趣游戏与芒果TV达成独家战略合作
同花顺,2025-11-03 04:01:09.000,港股午评：恒生指数涨0.58%，恒生科技指数跌0.24%
同花顺,2025-11-03 03:59:41.000,汇丰：美元或持续承压，预计2026年初触底
财联社,2025-11-03 03:57:51.000,以色列称接收三具以方被扣押人员遗体
同花顺,2025-11-03 03:48:35.000,韩国芯片股上涨
财联社,2025-11-03 03:41:28.000,菲律宾发生5.5级地震 震源深度120公里
同花顺,2025-11-03 03:39:24.000,主要产油国宣布12月保持增产节奏 明年初暂停增产
财联社,2025-11-03 03:31:43.000,或上调资金总额、或提高价格上限 多家A股公司回购计划“加码”
同花顺,2025-11-03 03:30:56.000,A股午评：创业板指半日跌1.37%，固态电池、光刻机等热门赛道股多数调整
同花顺,2025-11-03 03:30:45.000,ETF午评：纳指生物科技ETF领涨4.21%，科创信息ETF领跌3.65%
同花顺,2025-11-03 03:30:32.000,ETF两市成交额3565.79亿元
同花顺,2025-11-03 03:15:26.000,国务院安委会办公室召开建筑施工安全生产形势分析会
财联社,2025-11-03 03:13:05.000,A股主题交易活跃度有望上行 机构看好科技核心主线不变
同花顺,2025-11-03 03:10:30.000,ETF两市成交额超3000亿元
同花顺,2025-11-03 03:08:01.000,财政部副部长廖岷会见英国内阁办公室副常务次官迈克尔·埃拉姆
同花顺,2025-11-03 03:07:30.000,亚投行将在香港设立办事处
同花顺,2025-11-03 03:03:25.000,国家发展改革委原党组成员、副主任徐宪平被开除党籍
同花顺,2025-11-03 02:58:38.000,工业富联成交额达100亿元
同花顺,2025-11-03 02:55:43.000,存储芯片板块探底拉升，普冉股份涨近10%
同花顺,2025-11-03 02:53:34.000,英特尔正在就收购美国AI芯片独角兽SambaNova进行初步谈判
同花顺,2025-11-03 02:50:39.000,指数短线拉升，沪指再度翻红
同花顺,2025-11-03 02:50:26.000,沪深京三市成交额超1.2万亿元，较上日此时缩量1257亿元
同花顺,2025-11-03 02:48:46.000,高德、HERE达成合作 为中国汽车品牌提供ADAS等解决方案
同花顺,2025-11-03 02:46:30.000,ETF两市成交额超2500亿元
财联社,2025-11-03 02:42:48.000,两融业务驱动业绩增长 上市券商利息净收入同比增逾五成
同花顺,2025-11-03 02:41:16.000,李乐成：加快推进人工智能赋能新型工业化
同花顺,2025-11-03 02:37:40.000,北京亦庄前三季度GDP同比增长10.8%
财联社,2025-11-03 02:37:24.000,ETF规模10个月增长逾2万亿元
同花顺,2025-11-03 02:36:12.000,创业板指跌超2%，全市场超2800只个股下跌
同花顺,2025-11-03 02:34:08.000,瑞尔特上演“天地板”
同花顺,2025-11-03 02:29:38.000,ETF两市成交额超2000亿元
同花顺,2025-11-03 02:27:41.000,中际旭创成交额达100亿元
同花顺,2025-11-03 02:23:48.000,沪深京三市成交额超1万亿元，较上日此时缩量1000亿元
同花顺,2025-11-03 02:22:28.000,造纸板块震荡拉升，华泰股份直线涨停
同花顺,2025-11-03 02:20:43.000,原北京市国家税务局党组书记、局长吴新联被查
同花顺,2025-11-03 02:17:03.000,ETF两市成交额超1500亿元
同花顺,2025-11-03 02:17:02.000,2026年度“北京普惠健康保”开放参保，起付线降至15000元，特药报销比例提高
同花顺,2025-11-03 02:16:54.000,“三桶油”持续拉升，中国海油涨超5%
同花顺,2025-11-03 02:16:24.000,科技部推动“创新积分制2.0”在全国试行
财联社,2025-11-03 02:14:19.000,个人养老金基金三周年：数量超300只 规模迈上150亿元
同花顺,2025-11-03 02:03:43.000,ETF两市成交额超1000亿元
同花顺,2025-11-03 02:03:07.000,银行板块短线拉升，上海银行涨超2%
同花顺,2025-11-03 02:01:39.000,事关港澳台人员往来、过境免签口岸扩容等 10项重磅政策发布
同花顺,2025-11-03 02:00:23.000,开盘半小时 沪深京三市成交额达7467亿元
同花顺,2025-11-03 01:59:44.000,燃气板块震荡拉升，百川能源涨停
财联社,2025-11-03 01:55:47.000,美一客机险与直升机空中相撞
同花顺,2025-11-03 01:42:32.000,海南自贸区板块逆势上扬，海马汽车、欣龙控股涨停
同花顺,2025-11-03 01:41:37.000,创业板指跌1%
同花顺,2025-11-03 01:41:32.000,前三季度规上电子信息制造业增加值同比增长10.9％
同花顺,2025-11-03 01:41:25.000,光刻机概念股震荡走弱，凯美特气接近跌停
同花顺,2025-11-03 01:39:30.000,黄金概念盘初走低，潮宏基接近跌停
同花顺,2025-11-03 01:38:56.000,中证1000股指期货(IM)主力合约日内跌超1%
同花顺,2025-11-03 01:37:04.000,影视传媒、短剧游戏板块盘初冲高，欢瑞世纪、粤传媒2连板
同花顺,2025-11-03 01:35:59.000,煤炭开采加工板块盘初拉升，安泰集团涨停
同花顺,2025-11-03 01:33:23.000,电池板块盘初走低，海科新源跌超10%
同花顺,2025-11-03 01:32:23.000,存储芯片板块盘初下挫，时空科技跌停
财联社,2025-11-03 01:30:42.000,俄罗斯总理签署命令 终止与芬兰能源协议部分条款
同花顺,2025-11-03 01:30:26.000,北交所新股N丹娜高开超440%
