来源,时间,标题
同花顺,2026-03-06 19:34:27,WTI原油期货4月合约涨超12%
同花顺,2026-03-06 19:27:41,委内瑞拉在中断15个月后恢复稀释原油出口
财联社,2026-03-06 19:10:17,中国—瑞士自贸协定升级第四轮谈判在瑞士举行
财联社,2026-03-06 19:09:43,佩斯科夫：受中东局势影响 对俄能源需求显著上升
财联社,2026-03-06 19:03:17,麦科田医疗港股IPO及境内未上市股份“全流通”获中国证监会备案
财联社,2026-03-06 19:03:13,国务院办公厅印发《关于加强基层消防工作的意见》 督促行业、系统基层单位落实消防安全责任制
财联社,2026-03-06 19:01:40,日本油企申请释放国家战略储备原油
财联社,2026-03-06 19:01:37,源杰科技：筹划发行H股股票并在香港联交所主板上市
财联社,2026-03-06 19:01:37,【机构龙虎榜解读】CPO+数据中心+芯片，正研发下一代CPO高速光连接技术，800G光模块已给多个客户送样并测试中，拥有光芯片到光器件设计制造能力，机构大额净买入这家公司
财联社,2026-03-06 19:01:26,习近平：推进全民健康数智化建设
财联社,2026-03-06 19:01:26,今年我国首次开展大规模跨电网经营区绿电交易
财联社,2026-03-06 19:00:26,乐动机器人港股IPO及境内未上市股份“全流通”获中国证监会备案
财联社,2026-03-06 18:59:36,俄乌进行新一轮被扣押人员交换
财联社,2026-03-06 18:58:22,国际能源署署长：市场上石油充足 目前无动用应急储备的计划
财联社,2026-03-06 18:57:55,习近平：坚定不移走中国特色卫生与健康发展道路 推动“十五五”时期健康中国建设取得决定性进展
财联社,2026-03-06 18:57:49,普源精电港股上市获中国证监会备案
财联社,2026-03-06 18:56:18,欧洲天然气本周料收涨逾60% 势创能源危机以来最大单周涨幅
财联社,2026-03-06 18:53:33,迈为股份：拟投资35亿元建设钙钛矿叠层电池成套装备项目
财联社,2026-03-06 18:53:17,杭州余杭区：即日起至3月31日购买全区新建商品住宅 每套补助5万元
财联社,2026-03-06 18:52:53,迈为股份：控股子公司拟15亿元投建半导体装备研发制造项目
同花顺,2026-03-06 18:52:35,巴克莱称，如果中东局势再持续数周，布伦特原油有可能试探120美元/桶
财联社,2026-03-06 18:51:20,星环科技：公司仍处于未盈利状态
同花顺,2026-03-06 18:16:22,美国将围绕海湾货运开辟200亿美元再保险工具
财联社,2026-03-06 18:08:14,伊朗说要动用新一代导弹打击美以目标
财联社,2026-03-06 18:05:39,中国女足3:0战胜乌兹别克斯坦女足 两轮战罢暂列小组第二
财联社,2026-03-06 18:04:57,特朗普称当前未考虑向伊朗派地面部队
财联社,2026-03-06 17:59:47,华灿光电：针对MicroLED在光通信等扩展领域的应用 目前仍处于早期研发和样品验证阶段
财联社,2026-03-06 17:56:58,俄央行将外币现金提取限制措施再延长半年
财联社,2026-03-06 17:54:51,Meta智能眼镜曝隐私风险 用户AI互动画面会被第三方查看
财联社,2026-03-06 17:54:35,胡塞称全面支持伊朗准备随时参战
财联社,2026-03-06 17:54:08,浙江省足协：2026年全力办好首届浙江省城市足球联赛
财联社,2026-03-06 17:54:06,方大炭素：拟使用自有资金购买理财产品 总额度不超过16亿元
财联社,2026-03-06 17:51:45,东阳光：拟取得东数一号70%股权 股票复牌
财联社,2026-03-06 17:49:36,意大利防长：美以违反国际法 “不是我们想要的战争”
财联社,2026-03-06 17:48:18,潘功胜：将继续稳步扩大金融高水平开放 支持上海国际金融中心建设
财联社,2026-03-06 17:47:44,连续6年赤字 德国科隆大教堂将收门票
财联社,2026-03-06 17:46:32,200多名船员已上岸 伊朗军舰船员转移至斯里兰卡
财联社,2026-03-06 17:45:35,南向资金今日净卖近22亿港元 阿里巴巴遭净卖出居前
财联社,2026-03-06 17:40:44,美油涨幅扩大至4% 续创2024年7月以来新高
同花顺,2026-03-06 17:25:55,美国天然气期货涨超6.00%，现报3.205美元/百万英热
同花顺,2026-03-06 17:21:30,以色列全境发布伊朗导弹最新预警，警报随时可能响起
同花顺,2026-03-06 17:16:47,美国原油价格升破90美元 伊朗战事持续冲击能源供应
财联社,2026-03-06 17:12:56,郑栅洁：从未来发展考虑 将推进人工智能超大规模智算集群、卫星互联网、可控核聚变等一系列重大工程和项目
财联社,2026-03-06 17:12:39,迪拜黄金库存积压严重 目前正以折扣价出售
财联社,2026-03-06 17:11:20,郑栅洁：“十五五”时期将实施一批投资万亿级以上的能源重大工程
财联社,2026-03-06 17:11:02,伊朗外长与古巴外长通话 谴责美以军事行动
财联社,2026-03-06 17:10:42,商务部部长谈外贸：西方不亮东方亮 任尔东西南北风
财联社,2026-03-06 17:08:16,澳洲3月9日起严禁未成年人访问色情网站
财联社,2026-03-06 17:06:48,恒瑞医药：子公司收到阿得贝利单抗注射液药物临床试验批准通知书
财联社,2026-03-06 17:06:46,"香港金管局：2026年2月底 官方外汇储备资产为4,392亿美元"
财联社,2026-03-06 17:05:52,蓝佛安：财政呈现紧平衡态势 必须更好地统筹生财、聚财、用财之道
财联社,2026-03-06 17:05:28,财政部部长：中央本级“三公”经费压减7%以上
财联社,2026-03-06 17:05:23,苏州人工智能专项母基金等成立投资合伙企业 出资额5亿
财联社,2026-03-06 17:04:19,潘功胜：在防范金融风险、维护金融稳定方面重点做好五个方面工作
财联社,2026-03-06 17:04:00,央行行长潘功胜：2025年我国重点领域金融风险有序化解 中国股票市场在全球主要股市中表现较好
财联社,2026-03-06 17:00:58,3月焦煤市场供需好转 价格震荡运行为主
财联社,2026-03-06 17:00:36,徽商银行：2025年净利润约169.3亿元 同比增长约6.3%
同花顺,2026-03-06 16:45:59,美联储理事：油价冲击可能抑制核心通胀
同花顺,2026-03-06 16:26:36,美国海关与边境保护局将推出退款处理系统
同花顺,2026-03-06 16:25:04,西班牙首相：美以对伊军事行动是“极其严重的错误”
同花顺,2026-03-06 16:24:20,预测市场平台Kalshi因伊朗领导人相关预测市场豁免条款遭起诉
财联社,2026-03-06 16:10:11,郑栅洁：“十五五”规划纲要草案中民生福祉类指标占比最高
财联社,2026-03-06 16:08:54,机构：成本抬升叠加出口利好 苯乙烯期价强势封涨停
财联社,2026-03-06 16:08:05,郑栅洁：应对学龄人口三个排浪式达峰 “十五五”规划将普通高中建设和优质本科扩容作为重点任务
财联社,2026-03-06 16:06:57,中微半导推出新一代CMS32F040系列32位微控制器
同花顺,2026-03-06 16:05:27,美国国务卿鲁比奥：美国目标是政权更迭而非更迭国家
财联社,2026-03-06 16:03:07,财政部部长蓝佛安：千亿级财政金融协同促内需专项资金可惠及万亿级信贷
财联社,2026-03-06 16:00:13,证监会主席吴清：监管执法和投资者保护是核心职能 不能削弱、只能加强
财联社,2026-03-06 15:58:42,长江和记宣布就巴拿马政府强行接管货柜码头事宜采取进一步法律行动
财联社,2026-03-06 15:58:12,吴清：中国资产吸引力明显提高
财联社,2026-03-06 15:57:30,财政部部长：中央财政安排1000亿元支持财政金融协同促内需
财联社,2026-03-06 15:55:49,证监会主席吴清：精准有力打击财务造假、操纵市场、内幕交易等恶性违法行为
财联社,2026-03-06 15:54:22,证监会主席吴清：围绕深化投融资综合改革 进一步完善资本市场基础制度
财联社,2026-03-06 15:54:15,证监会主席吴清：股市风向标的作用更加凸显
财联社,2026-03-06 15:53:22,证监会主席吴清：在持续狠抓上市公司真实性的基础上进一步提升可投性
财联社,2026-03-06 15:53:06,韩国与阿联酋商定恢复航班运行
同花顺,2026-03-06 15:23:09,中概股逆势走强 京东以5.5%涨幅领涨
同花顺,2026-03-06 15:22:34,日本考虑释放战略石油储备应对霍尔木兹海峡运输中断
同花顺,2026-03-06 15:19:08,美股三大股指跌幅收窄
财联社,2026-03-06 15:17:48,财政部部长：今年财政资金规模安排三方面创“新高”
财联社,2026-03-06 15:16:26,国债期货收盘多数持平
财联社,2026-03-06 15:16:20,郑栅洁：会同财政部、人民银行等部门设立国家级并购基金
财联社,2026-03-06 15:13:24,高澜股份：直流输电液冷产品已应用于国内外50余条高压直流输电工程
财联社,2026-03-06 15:12:56,国家发展改革委主任：“十五五”末人工智能相关产业规模将增长到10万亿元以上
财联社,2026-03-06 15:12:38,国家发展改革委主任：北斗产业规模五年内有望突破1万亿元
财联社,2026-03-06 15:12:17,上期所：铅期货合约交割品级中替代品对标准品贴水150元/吨
财联社,2026-03-06 15:11:49,郑栅洁：将推进“六张网”和重点领域建设 投资将超过7万亿元
财联社,2026-03-06 15:11:40,国家发展改革委主任：预计“十五五”时期服务业规模将突破100万亿元
财联社,2026-03-06 15:11:33,郑栅洁：安排更多的政策和资金 更好地释放消费潜力
同花顺,2026-03-06 15:11:25,"LME三月期铝价格上涨3%至每吨3,395美元"
财联社,2026-03-06 15:11:01,上期所：修订案及升贴水设置自2026年3月17日从铅期货PB2703合约开始实施
财联社,2026-03-06 15:08:20,国家发改委主任郑栅洁：预计今年GDP增量超过6万亿元
同花顺,2026-03-06 15:07:46,现货白银日内涨幅扩大至3%，报84.78美元/盎司
财联社,2026-03-06 15:07:41,扎波罗热核电站受损高压供电线路已修复
财联社,2026-03-06 15:06:34,出口设施仍然关闭 卡塔尔能源将其长期租用的LNG运输船对外出租
财联社,2026-03-06 15:04:46,本周多晶硅价格较大幅走跌 市场看空情绪逐渐加强
同花顺,2026-03-06 15:04:22,现货黄金向上触及5150美元，日内上涨1.39%
财联社,2026-03-06 15:02:30,港股IPO：琻捷电子递表港交所
财联社,2026-03-06 15:01:40,收评：沪指缩量涨0.38% 智能电网、化工板块全线走强
同花顺,2026-03-06 15:00:37,期市夜盘收盘，国内期货主力合约普涨
同花顺,2026-03-06 14:57:13,文远知行迪拜Robotaxi车队恢复运营
同花顺,2026-03-06 14:57:05,诚邦股份：2025年净亏损1.2亿元
同花顺,2026-03-06 14:51:31,美联储古尔斯比：今天的就业报告令人失望
同花顺,2026-03-06 14:42:48,国防部就澳大利亚炒作所谓中国军机不安全接近其舰载机答问
同花顺,2026-03-06 14:39:00,以军称精准打击一名伊朗高级指挥官
同花顺,2026-03-06 14:34:09,伊朗外长就军舰遭袭事件与印度和斯里兰卡外长通话
同花顺,2026-03-06 14:32:51,美国能源部长赖特：实施了抑制措施以帮助降低油价
同花顺,2026-03-06 14:32:43,美国总统特朗普认为汽油价格会“很快”下降
同花顺,2026-03-06 14:32:25,伊朗德黑兰传出巨大爆炸声
同花顺,2026-03-06 14:32:21,美国总统特朗普：古巴“很快”就会垮台
同花顺,2026-03-06 14:30:49,美股开盘：2月非农爆冷 美股三大指数集体低开
同花顺,2026-03-06 14:29:11,WTI原油日内暴涨12.00%，现报88.42美元/桶
同花顺,2026-03-06 14:25:27,全国政协委员郭媛媛：人工智能时代 陪伴不能被“AI”异化
同花顺,2026-03-06 14:19:42,深交所：本周对近期股价异常波动的“豫能控股”进行重点监控
同花顺,2026-03-06 14:10:39,卡塔尔政府发出手机警报，警告威胁升级
同花顺,2026-03-06 14:10:32,化工品期货夜盘全线上涨
同花顺,2026-03-06 14:07:02,安迪苏：2025年度净利润11.55亿元，同比下降4.13%
同花顺,2026-03-06 14:06:24,土耳其银行指数跌4.7%，创1月16日以来盘中新低
同花顺,2026-03-06 14:06:08,浙江东日：2025年净利润1.44亿元，同比增长6.94%
同花顺,2026-03-06 14:04:01,燃油主力合约日内暴涨16.00%，现报4511.00元/吨
财联社,2026-03-06 14:03:48,先为达生物：全球首个偏向型GLP-1减重药物先维盈获批上市
同花顺,2026-03-06 14:02:35,外交部副部长苗得雨出席加纳独立日招待会
同花顺,2026-03-06 14:02:18,郑商所短纤主力合约触及涨停
同花顺,2026-03-06 13:59:44,亚马逊美股盘前跌超2%
财联社,2026-03-06 13:59:06,联合海上信息中心：霍尔木兹海峡航运几乎完全停滞
同花顺,2026-03-06 13:58:34,英伟达美股盘前跌超2%
同花顺,2026-03-06 13:58:20,郑商所甲醇主力合约大涨8%
财联社,2026-03-06 13:57:30,蜜雪冰城正试水现磨咖啡
同花顺,2026-03-06 13:55:35,美股恐慌指数VIX最新上涨3.12点至26.87点
同花顺,2026-03-06 13:55:20,盖普美股盘前跌超10%
同花顺,2026-03-06 13:53:46,全国政协委员张文宏呼吁：为中国创新药企的生存与盈利留出空间
同花顺,2026-03-06 13:52:31,布伦特原油2024年4月以来首次升破90美元/桶，消息称，科威特削减部分油田石油产量
财联社,2026-03-06 13:51:26,阿联酋考虑冻结伊朗资产
同花顺,2026-03-06 13:48:33,高盛：仍预计美联储将降息两次 落地时间难测
同花顺,2026-03-06 13:47:36,大商所焦煤主力合约大涨5%
财联社,2026-03-06 13:45:59,今天上午日本再向海洋排放核污染水
同花顺,2026-03-06 13:45:54,WTI原油日内暴涨逾10%
同花顺,2026-03-06 13:45:52,美股三大股指期货均跌超1%
财联社,2026-03-06 13:44:44,安世中国：大部分业务已恢复运行 可保障基本生产运营
财联社,2026-03-06 13:43:49,【金牌纪要库·风口会议】英伟达投资全球光芯片领域技术龙头，提升、锁定高端部件供货能力，这家英伟达核心供应商有望进一步提升高端光模块出货能力
同花顺,2026-03-06 13:42:25,美国劳动力市场“假性企稳”或迫使美联储重新审视就业风险
同花顺,2026-03-06 13:23:07,华培动力：终止筹划发行可转换公司债券及支付现金购买资产并募集配套资金暨关联交易事项并复牌
财联社,2026-03-06 13:19:14,东芝重组巨额债务 目标2028财年重新上市
财联社,2026-03-06 13:17:33,沪深两市成交额突破1.5万亿 较上一日此时缩量超1600亿
财联社,2026-03-06 13:14:34,中国信通院：截至2025年6月我国计算设备智能算力规模达到782 EFlops 同比增长96%
财联社,2026-03-06 13:12:21,李云泽谈金融机构资本补充：通过市场化方式撬动更多社会资金
同花顺,2026-03-06 13:11:45,PTA主力合约触及涨停，涨幅7.01%，现报6316元/吨
同花顺,2026-03-06 13:10:29,2026全球开发者先锋大会将于3月27日至29日在上海举办
同花顺,2026-03-06 13:09:12,香溢融通：2025年净利润8030.57万元，同比增长51.03%
财联社,2026-03-06 13:06:12,【风口研报·公司】北美七大科技巨头签署自主供电承诺，分析师强call公司新获海外客户9亿元/年的燃气发电项目定点，且今年将开始供货，未来还有望实现拓品类和拓客户
同花顺,2026-03-06 13:04:36,苯乙烯主力合约触及涨停
同花顺,2026-03-06 13:03:48,纯苯主力合约触及涨停
财联社,2026-03-06 13:03:06,算力租赁概念再度拉升 宁波建工、威星智能双双涨停
同花顺,2026-03-06 13:01:22,华利安美股盘前跌超29%
同花顺,2026-03-06 13:00:21,期市夜盘开盘，国内期货主力合约普涨
财联社,2026-03-06 12:53:17,伊朗称未来几天对敌方攻击将更加猛烈和广泛
同花顺,2026-03-06 12:49:42,全国政协委员王理宗：建立终身学习体系和职业培训计划 帮助劳动者适应技术发展
财联社,2026-03-06 12:48:30,埃诺格鲁肽（先维盈®）获批用于中国成人体重管理
同花顺,2026-03-06 12:46:05,中兴通讯：拟向全体股东每10股派发4.11元人民币现金（含税）
同花顺,2026-03-06 12:46:02,中兴通讯：2025年净利润56.18亿元，同比下降33.32%
财联社,2026-03-06 12:45:21,【机构调研】这家公司产品及业务全面契合配网升级和电网数字化转型，在手订单超40亿元
同花顺,2026-03-06 12:40:32,巴林和科威特拉响防空警报
同花顺,2026-03-06 12:39:13,真我暂停新机研发？相关人士否认：回归OPPO后产品线会有新规划
同花顺,2026-03-06 12:38:54,千问将持续推进“AI办事”
同花顺,2026-03-06 12:37:37,西安旅游：拟1398.16万元转让红土公司50%股权
财联社,2026-03-06 12:25:10,【盘中宝•数据】电网+电力+军工+算力+小金属，五大热点一周以来获融资净买入情况（附表）
财联社,2026-03-06 12:18:27,美智库：美对伊朗军事行动前四天花费约37亿美元
财联社,2026-03-06 12:15:22,特朗普威胁下一个就是古巴
财联社,2026-03-06 12:15:08,以色列驻巴林使馆遭袭
财联社,2026-03-06 12:06:58,软银据悉寻求最高400亿美元贷款 用于投资OpenAI
同花顺,2026-03-06 12:06:46,3月6日 周五《新闻联播》要闻15条
同花顺,2026-03-06 12:04:55,以军称摧毁哈梅内伊在德黑兰的地堡
财联社,2026-03-06 12:03:36,澄天伟业：公司液冷产品已实现小批量产品交付
财联社,2026-03-06 12:02:34,财联社C50风向指数调查：2月新增信贷及社融或同比少增、M2增速小幅回落
同花顺,2026-03-06 12:02:26,山东药玻：拟向全体股东每10股派发现金1.8元（含税）
同花顺,2026-03-06 12:02:21,山东药玻：2025年净利润6.9亿元，同比下降26.87%
财联社,2026-03-06 12:02:20,财联社3月6日午间新闻精选
财联社,2026-03-06 12:01:56,伊朗库姆市附近两处军事中心遭袭
财联社,2026-03-06 12:01:26,埃夫特：工业机器人产品通过SGS功能安全认证
同花顺,2026-03-06 12:00:26,信测标准：股东李生平已减持1%股份
同花顺,2026-03-06 12:00:21,蓝宇股份：股东王英海已减持0.0446%股份，不再为持股5%以上股东
财联社,2026-03-06 12:00:18,港股午评：恒生指数涨1.84% 恒生科技指数涨3.68%
同花顺,2026-03-06 11:59:59,中国人民银行行长潘功胜出席十四届全国人大四次会议经济主题记者会(全文)
同花顺,2026-03-06 11:56:38,纽约期金失守5080美元/盎司
同花顺,2026-03-06 11:56:23,布伦特原油站上89美元/桶
财联社,2026-03-06 11:53:50,3月6日午间涨停分析
同花顺,2026-03-06 11:50:48,华泰证券：“十五五”聚焦经济自身动能 超配电力链中上游品种
财联社,2026-03-06 11:50:13,东土科技：公司确有中标国家部委及北京市相关重大产业项目 主要聚焦工业母机、工业机器人等核心领域
同花顺,2026-03-06 11:48:38,联科科技：2025年净利润2.93亿元，同比增长7.55%
同花顺,2026-03-06 11:48:34,联科科技：拟向全体股东每10股派发现金股利人民币5元（含税）
同花顺,2026-03-06 11:46:36,爱克股份：2025年净利润亏损7723.2万元
财联社,2026-03-06 11:46:22,我国首艘分布式泵舱超大型自航耙吸挖泥船下水
财联社,2026-03-06 11:46:11,美国国防部官员称目前未与Anthropic进行任何实质性谈判
同花顺,2026-03-06 11:45:44,沪电股份：全资子公司以970.45万元出售所持黄石供应链100%股权
同花顺,2026-03-06 11:45:34,沪电股份：子公司昆山沪利微电拟投资55亿元建生产项目
同花顺,2026-03-06 11:45:11,盛泰集团：拟出售昊泰纺织70%股权，交易金额1.9亿元人民币
同花顺,2026-03-06 11:45:06,德明利：向特定对象发行股票数量上限调整至不超过6805.37万股
同花顺,2026-03-06 11:45:05,重庆：建设西部金融中心，给出“通道+绿色”方案
同花顺,2026-03-06 11:44:13,伊朗袭击驻科威特的美军基地，称打击将继续
财联社,2026-03-06 11:43:20,德路里报告：本周世界集装箱运价指数上涨3%至1958美元/FEU
财联社,2026-03-06 11:33:28,【掘金行业龙头】可控核聚变+商业航天+工业母机，攻克核聚变部件“卡脖子”难题，完成BEST产品交付，这家公司机床用于航天军工、长征火箭、天宫飞船等领域
财联社,2026-03-06 11:31:49,国内期货主力合约多数上涨 烧碱、纯苯、苯乙烯涨停
财联社,2026-03-06 11:31:44,午评：创业板指半日涨0.85% 电网设备概念持续爆发
财联社,2026-03-06 11:26:49,港股生物技术板块走强 药捷安康-B涨超30%
财联社,2026-03-06 11:17:05,斯里兰卡已协助伊朗军舰上200余名船员安全撤离
财联社,2026-03-06 11:15:15,郑州：公积金贷款买装配式商品住房 额度拟最高可上浮20%
财联社,2026-03-06 11:11:56,存储芯片概念再度活跃 朗科科技涨超10%
财联社,2026-03-06 11:11:00,猪肉、鸡肉概念震荡走强 湘佳股份涨停
财联社,2026-03-06 11:10:51,【盘中宝】算力规模持续扩张拉动需求增长，多家运营商正积极布局该领域，以开拓第二成长曲线，这家公司深度服务数据中心与AI算力基建
同花顺,2026-03-06 11:08:56,佩斯科夫：受中东局势影响，对俄能源需求显著上升
同花顺,2026-03-06 11:08:48,长春高新：公司从不以单一市场传言作为价值导向
同花顺,2026-03-06 11:07:14,伊朗外长强烈谴责美军无预警袭击“德纳”号护卫舰
财联社,2026-03-06 11:05:20,港股高开高走 恒生科技指数涨超3%
同花顺,2026-03-06 11:04:59,阿斯麦美股盘前跌超2%
同花顺,2026-03-06 10:58:55,狮头股份：拟公开挂牌转让龙净水业70%股权，挂牌价不低于1637.96万元
财联社,2026-03-06 10:58:51,主力资金监控：协鑫集成净买入超11亿
同花顺,2026-03-06 10:58:49,源杰科技：拟发行H股股票并在香港联交所主板上市
同花顺,2026-03-06 10:58:45,济民健康：双鸽集团拟协议转让公司5%股份
同花顺,2026-03-06 10:58:40,横店影视：股东金华恒影拟减持不超过1%
同花顺,2026-03-06 10:58:34,迈为股份：拟投资35亿元建设钙钛矿电池项目
同花顺,2026-03-06 10:56:16,中国驻卡塔尔大使馆：请滞留中方人员利用航班恢复机会抓紧时间撤离
财联社,2026-03-06 10:55:19,特朗普称对伊朗军事行动“没有时间限制”
财联社,2026-03-06 10:52:51,【风口研报·公司】铜基材料可用于锂电、AIDC、电子电路等领域，这家公司出海布局获取全球化红利，锂电与电子铜箔放量在即
财联社,2026-03-06 10:51:53,美军据报或对袭击伊朗学校负责
财联社,2026-03-06 10:51:35,有色·钨概念快速走高 章源钨业逼近涨停
财联社,2026-03-06 10:50:34,独家｜三安光电及合作伙伴已研制具备高速调制能力的Micro LED光源器件 产品已送样国际客户
同花顺,2026-03-06 10:50:25,中国铝业：蒋涛已减持金额24.62万元，占0.00012%
同花顺,2026-03-06 10:47:24,中农立华：股东广东益隆拟减持不超过2%
同花顺,2026-03-06 10:45:36,以色列北部多地响起防空警报
同花顺,2026-03-06 10:45:23,柬埔寨首相称将坚决铲除电信网络诈骗
同花顺,2026-03-06 10:43:38,卡塔尔官员：海湾地区所有能源出口国或在数周内停止油气生产
财联社,2026-03-06 10:42:32,美军驻卡塔尔空军基地遭无人机袭击
财联社,2026-03-06 10:41:27,发电机概念持续拉升 苏常柴A等多股涨停
同花顺,2026-03-06 10:39:47,中国散裂中子源二期工程首个线站成功出束
同花顺,2026-03-06 10:37:49,日本据悉考虑释放国家石油储备
财联社,2026-03-06 10:36:11,古巴确认美籍快艇闯入古巴事件已致5人死亡
财联社,2026-03-06 10:33:25,CPO概念震荡回升 联特科技触及20cm涨停创历史新高
同花顺,2026-03-06 10:32:07,全国人大代表朱建弟：要打通“北交板-创业板”转板通道
财联社,2026-03-06 10:27:40,阿塞拜疆总统要求伊朗就无人机事件道歉
财联社,2026-03-06 10:26:05,泽连斯基：“友谊”输油管道或在一个半月内恢复运行
财联社,2026-03-06 10:24:57,意大利防长说美以对伊军事打击违反国际法
财联社,2026-03-06 10:23:32,土耳其总统说中东局势已达到“恐怖程度”
财联社,2026-03-06 10:21:59,大金融板块震荡拉升 瑞达期货涨停
财联社,2026-03-06 10:20:17,最高法副院长高晓力：加快制定证券市场内幕交易、操纵市场等民事赔偿司法解释
同花顺,2026-03-06 10:01:09,华灿光电：针对Micro LED在光通信等扩展领域的应用，目前仍处于早期研发和样品验证阶段
同花顺,2026-03-06 09:59:20,京基智农：2026年2月，公司销售生猪收入2.69亿元；商品猪销售均价11.41元/kg
同花顺,2026-03-06 09:57:27,文科股份：与佛山建发等签署战略合作协议
同花顺,2026-03-06 09:57:01,西贝餐饮迎来重大变革：CEO卸任与大规模关店行动
同花顺,2026-03-06 09:51:42,东阳光：拟取得东数一号70.00%股权，股票复牌
同花顺,2026-03-06 09:49:26,中国人民银行行长：2025年末境外机构和个人持有境内人民币金融资产超过10万亿元
同花顺,2026-03-06 09:44:02,卫光生物：收到药品注册临床试验受理通知书
同花顺,2026-03-06 09:43:50,新希望：2026年2月，公司销售商品猪98.22万头，环比减少12.44%
同花顺,2026-03-06 09:41:08,驻韩美军被曝部分军力或被抽调至中东
同花顺,2026-03-06 09:40:41,潘功胜：有序推进人民币国际化
同花顺,2026-03-06 09:39:43,先惠技术：与宁德时代签订9.45亿元销售合同
财联社,2026-03-06 09:38:29,部分港股油气设备股走强 百勤油服涨20%
财联社,2026-03-06 09:38:24,脑机接口概念逆势活跃 国际医学涨停
