来源,时间,标题
财联社,2026-03-26 02:19:42,欧洲理事会主席：欧盟需提升战略自主性
财联社,2026-03-26 02:12:53,伊朗总统：国家高层在战争问题上高度团结
财联社,2026-03-26 02:03:45,内塔尼亚胡称要“瓦解真主党”
财联社,2026-03-26 01:53:05,LME期铜收涨221美元
财联社,2026-03-26 01:43:09,近东救济工程处：391名该机构相关者在本轮巴以冲突期间丧生
财联社,2026-03-26 01:35:04,伊朗军方称击落美军F-18战机
财联社,2026-03-26 01:24:36,德国总理说欧洲正敦促美以结束对伊战事
财联社,2026-03-26 01:23:53,联大通过决议 宣布奴隶制行为为最严重反人类罪
财联社,2026-03-26 01:14:04,白宫拟本周末在巴基斯坦开会讨论停战方案
财联社,2026-03-26 01:08:30,扎哈罗娃：太空演变为军事对抗舞台的风险持续上升
财联社,2026-03-26 01:01:29,氧化铝夜盘收跌0.98%
财联社,2026-03-26 00:43:07,伊朗军方：霍尔木兹海峡局势发展由伊朗掌控
财联社,2026-03-26 00:39:38,伊朗军方消息人士：若遭挑衅 伊方可能开启其他战线
财联社,2026-03-26 00:37:12,欧洲主要股指收盘集体上涨
财联社,2026-03-26 00:24:20,伊朗称伊敌对力量相关方都无权通行霍尔木兹海峡
财联社,2026-03-26 00:19:09,欧洲央行官员Rehn称目前尚难将人工智能纳入货币政策考量
财联社,2026-03-26 00:09:02,匈牙利外长：即日起逐步停止向乌克兰输送天然气
财联社,2026-03-26 00:05:35,丹麦首相递交辞呈 新一轮组阁程序启动
财联社,2026-03-26 00:02:29,古特雷斯呼吁美以结束对伊朗的战争
财联社,2026-03-25 23:56:21,欧洲央行行长警告能源供应危机推高通胀风险
财联社,2026-03-25 23:47:19,重庆立法促进火锅产业发展
财联社,2026-03-25 23:33:34,伊朗军方称正在搜捕从中东地区基地内逃亡的美军
财联社,2026-03-25 23:25:31,王毅同埃及外长阿卜杜勒阿提通电话
财联社,2026-03-25 23:24:25,王毅同土耳其外长费丹通电话
财联社,2026-03-25 23:21:12,美众议院议长：美军在伊朗“不会进行地面作战”
财联社,2026-03-25 23:15:52,国际原油价格日内跌幅收窄至3%
财联社,2026-03-25 23:13:57,以政府批准最高40万人预备役征召上限
财联社,2026-03-25 23:04:52,蒙牛2025年业绩：全年实现收入822.4亿元 经营现金流等指标创新高
财联社,2026-03-25 23:00:57,国内商品期市夜盘收盘涨跌参半 化工品涨幅居前甲醇涨3%
财联社,2026-03-25 23:00:08,伊朗说不允许特朗普决定停战时间
财联社,2026-03-25 22:53:56,NBA董事会批准投票 探讨竞标新球队的可能性
财联社,2026-03-25 22:49:42,港股IPO：星环信息科技（上海）股份有限公司递表港交所
财联社,2026-03-25 22:46:50,伊朗外交部：伊朗没有与美国谈判 将继续行使自卫权
财联社,2026-03-25 22:45:22,安徽大学团队研发磁性表征新方法 为存储器件研发开辟新路径
财联社,2026-03-25 22:38:03,伊朗媒体：伊朗拒绝美国停战方案 提出伊方5项条件
财联社,2026-03-25 22:37:34,北京汽车2025年实现净利润1.227亿元 较2024年同期下降87.2%
财联社,2026-03-25 22:37:10,扎哈罗娃：美呼吁与伊朗谈判 可能旨在准备重新部署武装力量
财联社,2026-03-25 22:27:32,国际原子能机构总干事：美伊或将在巴基斯坦举行会谈
财联社,2026-03-25 22:24:40,美股AI应用软件股集体上扬 Braze涨超20%
财联社,2026-03-25 22:22:21,巴西发布首款本土组装超音速战斗机F-39E“鹰狮”
财联社,2026-03-25 22:22:04,伊朗一高级官员说对美国停战提议做出“消极回应”
财联社,2026-03-25 22:21:01,中菲合作遣返一涉嫌组织他人偷越国（边）境罪的嫌犯
财联社,2026-03-25 22:20:37,王文涛部长出席世贸组织第14届“中国项目”圆桌会开幕式并致辞
财联社,2026-03-25 22:20:12,珍酒李渡发布2025年业绩 核心盈利水平保持稳定
财联社,2026-03-25 22:19:32,【公告全知道】光模块+算力+AI智能体+机器人+芯片！公司自研硅光芯片已应用于400G、800G及1.6T光模块交付
财联社,2026-03-25 22:06:13,【风口研报·洞察】Optimus即将步入“学龄期”，分析师认为随着越来越多供应商的 PPA（生产件批准程序）密集落地，下一个产业节点即为年中的正式量产；回调后各行业处在上证什么位置
财联社,2026-03-25 22:02:14,覆盖全民 我国加快建立长期护理保险制度
财联社,2026-03-25 22:01:42,以军称打击了伊朗一处“水下研究设施”
财联社,2026-03-25 22:00:06,中国海警局新闻发言人就菲海警煽宣炒作发表谈话
财联社,2026-03-25 21:30:37,美股三大指数集体高开 Arm美股涨超9%
财联社,2026-03-25 21:25:21,白宫贸易顾问：鲍威尔在任期结束后留在美联储 “绝对有害”
财联社,2026-03-25 21:22:32,剂泰科技(北京)股份有限公司-P提交港股上市申请书
财联社,2026-03-25 21:20:46,SK海力士递表剑指华尔街 欲赴美上市融资最高百亿美元
财联社,2026-03-25 21:18:40,巴西鸡肉到港增多 二季度鸡副难撑高位
财联社,2026-03-25 21:18:04,【财联社早知道】事关词元（Tokens），国家超算互联网宣布新一轮动作，机构称中国AI推理Token消耗量2030年将达3900千万亿，这家公司构建了从算力供给-运维-服务的一站式算力综合服务体系
财联社,2026-03-25 21:18:02,独家|连云港海关工作人员：经核实 未见查获所谓“稀土走私大案”
财联社,2026-03-25 21:16:36,伊朗政府信息委员会主席：15点停战协议是特朗普的“又一个谎言”
财联社,2026-03-25 21:12:46,美股存储概念股盘前走弱
财联社,2026-03-25 21:12:34,俄希望美为解决乌克兰问题继续发挥作用
财联社,2026-03-25 21:10:20,上海市长会见美国康宁公司董事会主席 期待公司助力上海制造转型升级
财联社,2026-03-25 21:07:58,联合国官员警告中东局势存在进一步恶化风险
财联社,2026-03-25 21:01:17,特朗普将请扎克伯格、埃里森和黄仁勋加入科技委员会
财联社,2026-03-25 20:57:41,信维通信：信维电科已实现关键料号突破与国产替代 部分产品在北美大客户验证中
财联社,2026-03-25 20:54:07,标普500盈利预期逆势上修 华尔街押注美股挺过地缘风险冲击
财联社,2026-03-25 20:14:10,英唐智控：公司正按照相关法律法规和交易方案推进收购事宜
财联社,2026-03-25 20:13:22,【电报解读】国家超算互联网单用户免费“词元”额度升至3000万，云计算行业的定价逻辑开始全面转向溢价变现下，机构建议关注“Token工厂”三大核心主线，这家公司将形成万卡规模的智能算力供应
财联社,2026-03-25 20:12:17,紫光股份：成功落地多个国产万卡智算集群
财联社,2026-03-25 20:10:37,高盛资管调查报告：超50%保险机构认为AI投资最大机会在基础设施、数据中心
财联社,2026-03-25 20:09:52,古茗：2025年收入129亿元 同比增长46.9%
财联社,2026-03-25 20:09:41,诺诚健华：2025年首次实现盈利 取消股票简称标识U
财联社,2026-03-25 20:08:37,金山办公：2025年净利润同比增长11.63% 拟每10股派12.52元
财联社,2026-03-25 20:04:13,伊朗逮捕39名从事间谍活动的雇佣人员
财联社,2026-03-25 20:02:46,3月25日周三《新闻联播》要闻24条
财联社,2026-03-25 19:57:06,国务院国资委：推动中央企业财务数智化转型升级
财联社,2026-03-25 19:53:59,快手程一笑：预计可灵AI在2026年实现收入同比翻倍以上增长
财联社,2026-03-25 19:53:06,内地与澳门经贸合作委员会第八次会议在京召开
财联社,2026-03-25 19:52:03,北京市经信局：将印发实施高精尖产业发展规划
财联社,2026-03-25 19:48:12,肯尼亚多地洪灾已致88人死亡
财联社,2026-03-25 19:18:14,洛克希德·马丁：将精确打击导弹产量提升四倍
财联社,2026-03-25 19:13:22,中国广核：2025年净利润98亿元 同比下降9.9%
财联社,2026-03-25 19:11:47,商务部副部长凌激会见阿联酋兰五资本首席执行官夏本佳
财联社,2026-03-25 19:06:30,中国太平2025年业绩公布：寿险业务结构持续优化
财联社,2026-03-25 18:59:16,第一届粤港澳深四地金融监管联席会议
财联社,2026-03-25 18:55:16,匈牙利总理有意停止向乌克兰供应天然气
财联社,2026-03-25 18:54:35,大连港西芒杜保税破碎项目投产 SimFer首船铁矿石到港
财联社,2026-03-25 18:51:52,广州新机场开工建设 黄坤明强调：立足长远适度超前谋划一批交通项目工程
财联社,2026-03-25 18:49:43,航空工业成飞研制出混合动力氢能源无人机
财联社,2026-03-25 18:46:48,伊朗据悉要求希望通过霍尔木兹海峡的船舶提供船员和货物详情
财联社,2026-03-25 18:45:24,速腾聚创首次盈利即破亿 激光雷达行业迎来龙头换位
财联社,2026-03-25 18:43:21,重磅官宣：拼多多“新拼姆”落地上海 一期已注资150亿
财联社,2026-03-25 18:15:10,伊朗海军：美“林肯”号航母一直在伊朗监控中
财联社,2026-03-25 18:05:40,金力永磁：2025年净利润同比增长142% 拟10派2.2元
财联社,2026-03-25 18:04:18,雅化集团：签署五年期锂辉石精矿采购协议
财联社,2026-03-25 18:03:13,丁薛祥出席2026中关村论坛年会开幕式并致辞
财联社,2026-03-25 18:00:37,睿能科技：拟收购博泰智能不超过75%的股权以取得控制权 股票明起停牌
财联社,2026-03-25 17:59:04,以色列称伊朗40分钟内向以发射四轮导弹
财联社,2026-03-25 17:57:28,杭电股份：股东富春江通信集团及4名董高拟合计减持不超0.89%股份
财联社,2026-03-25 17:56:45,香港暂停进口德国勃兰登堡州Elbe-Elster区禽肉及禽类产品
财联社,2026-03-25 17:55:39,丹麦首相向国王递交辞呈
同花顺,2026-03-25 17:53:55,LME金属期货收盘集体上涨
同花顺,2026-03-25 17:42:19,匈牙利将逐步停止对乌克兰供气
财联社,2026-03-25 17:19:23,中国政府中东问题特使翟隽集体会见海合会国家驻华使节
财联社,2026-03-25 17:18:55,中国人寿：拟出资28亿元参与设立科创接力基金
财联社,2026-03-25 17:17:12,中国人寿：2025年净利润1540.78亿元 同比增长44%
财联社,2026-03-25 17:13:15,李云泽会见汇丰集团首席执行官艾桥智
同花顺,2026-03-25 17:13:02,美媒：白宫拟本周末在巴基斯坦开会讨论停战方案
财联社,2026-03-25 17:12:58,华尔街大鳄称黄金正重演“2008年剧本” 大胆预测黄金后续将反弹至11400美元
财联社,2026-03-25 17:12:45,嘉实原油LOF：3月26日开市起至当日10:30停牌
财联社,2026-03-25 17:11:33,中国东航：拟购101架A320NEO系列飞机 约为1088.93亿元
财联社,2026-03-25 17:11:24,上海期货交易所对部分客户采取限制开仓监管措施
财联社,2026-03-25 17:10:56,上海警方深入推进 “涉企网络谣言”打击整治
财联社,2026-03-25 17:09:27,中红医疗：子公司留置针产品拟中选京津冀“3+N”联盟集采
财联社,2026-03-25 17:08:45,佳禾食品：拟投建10亿元超级植物奶智能制造项目
同花顺,2026-03-25 17:08:30,国际铜夜盘收涨0.94%，沪铜收涨1.11%
财联社,2026-03-25 17:04:01,工信部：截至2月末5G移动电话用户达12.35亿户 比上年末净增3044万户
同花顺,2026-03-25 16:56:18,俄外交部发言人：博鳌亚洲论坛有助于深化区域合作
同花顺,2026-03-25 16:30:10,范式智能技术集团股份有限公司启动上市辅导
财联社,2026-03-25 16:15:52,公募总规模首破38万亿元 连续十一个月创下历史新高
财联社,2026-03-25 16:14:47,美股太空概念股盘前全线上扬
财联社,2026-03-25 16:13:31,美方禁止进口外国制造的路由器被解读为针对中国 外交部回应
财联社,2026-03-25 16:11:33,伊朗称遭遇美国外交背叛
财联社,2026-03-25 16:09:45,香港恒生科技指数收涨1.91% 泡泡玛特跌超22%
财联社,2026-03-25 16:07:31,中国与肯尼亚签署《关于共同发展经济伙伴关系协定早期收获的安排》
财联社,2026-03-25 16:07:18,伊朗称迄今未与美进行任何谈判
财联社,2026-03-25 16:04:37,伊朗：满足条件的非敌对船只可通行霍尔木兹海峡
财联社,2026-03-25 16:02:51,韩国自研超音速战机KF-21首架量产机出厂
财联社,2026-03-25 16:01:40,欧洲主要股指集体高开 法国CAC40指数涨超1%
同花顺,2026-03-25 16:01:15,俄外交部发言人：太空演变为军事对抗舞台的风险持续上升
财联社,2026-03-25 16:01:09,大摩：将中国神华纳入中国内地/香港焦点名单 评级“增持”
同花顺,2026-03-25 15:53:00,西班牙首相重申坚持反战立场
同花顺,2026-03-25 15:35:06,黎真主党称做好与以色列无限期战斗准备
同花顺,2026-03-25 15:30:33,数据显示，俄罗斯石油出口能力已因基础设施遭袭和油轮被扣押事件而缩减了40%
财联社,2026-03-25 15:29:16,商务部：有权采取相应措施 坚决维护中国产业利益
财联社,2026-03-25 15:28:36,伊朗倡议中东建立无美以联盟
财联社,2026-03-25 15:25:19,硅业分会：多晶硅价格延续跌势 上下游企业预期相对悲观
财联社,2026-03-25 15:24:18,日本内阁官房长官：将防止再度发生强闯使馆这类事件
财联社,2026-03-25 15:22:23,3月25日涨停分析
财联社,2026-03-25 15:21:48,以军方称轰炸德黑兰两处海军巡航导弹生产基地
财联社,2026-03-25 15:20:51,安全气囊盖板或脱落 通用在美召回2819辆汽车
财联社,2026-03-25 15:20:50,贝莱德CEO：150美元的油价将引发全球经济衰退
财联社,2026-03-25 15:19:58,高盛维持年底金价5400美元的乐观预测
同花顺,2026-03-25 15:19:26,伊朗称正在搜捕逃亡美军
财联社,2026-03-25 15:17:01,国债期货收盘表现分化
同花顺,2026-03-25 15:16:39,WTI原油跌超2%
财联社,2026-03-25 15:14:32,泡泡玛特小家电核心代工方为新宝股份 已启动大规模备货
财联社,2026-03-25 15:12:03,船只扎堆涌向红海 沙特延布港至亚洲油轮运费暴跌
财联社,2026-03-25 15:11:45,中上协：截至2月底全市场总市值再创历史新高突破116.8万亿 同比增长34%
财联社,2026-03-25 15:09:02,秘鲁对华汽车轮胎启动反倾销调查
同花顺,2026-03-25 15:00:29,期市夜盘收盘，国内期货主力合约涨跌互现
同花顺,2026-03-25 14:58:40,内蒙古锡林郭勒盟多伦县附近发生4.3级左右地震
同花顺,2026-03-25 14:49:18,伊朗称发动“真实承诺-4”第81波行动，打击以色列70多处目标
同花顺,2026-03-25 14:45:47,伊朗外交部：伊朗没有与美国谈判将继续行使自卫权
同花顺,2026-03-25 14:39:53,伊朗媒体：伊朗拒绝美国停战方案　提出伊方5项条件
财联社,2026-03-25 14:24:03,3月25日全国农产品批发市场猪肉平均价格为15.80元/公斤 比昨天下降1.4%
财联社,2026-03-25 14:22:52,英唐智控跌超19% 成交额超25亿
财联社,2026-03-25 14:21:32,主力资金监控：电子板块净流入超81亿
同花顺,2026-03-25 14:20:03,王文涛出席世贸组织第14届“中国项目”圆桌会开幕式并致辞
财联社,2026-03-25 14:17:29,韩正访问肯尼亚
财联社,2026-03-25 14:17:07,央行在香港招标发行600亿元6个月期央行票据 中标利率为1.48%
财联社,2026-03-25 14:16:38,国家发改委发布2026年规章制定工作计划
财联社,2026-03-25 14:13:38,泡泡玛特王宁：预计2026年实现不低于20%的增长
同花顺,2026-03-25 14:12:48,拼多多美股涨幅扩大至8%
财联社,2026-03-25 14:10:21,港股泡泡玛特跌超20% 非Labubu IP产品销售额未达预期
同花顺,2026-03-25 14:08:21,纳斯达克中国金龙指数涨幅扩大涨2.0%
财联社,2026-03-25 14:07:33,港股泡泡玛特跌超18% 非Labubu IP产品销售额未达预期
同花顺,2026-03-25 14:04:40,中办、国办发布关于加快建立长期护理保险制度的意见
财联社,2026-03-25 14:04:08,俄称打击乌军工企业及军用机场
财联社,2026-03-25 14:03:36,泡泡玛特将在今年下半年推出LABUBU 4.0系列
财联社,2026-03-25 14:00:54,我国科研团队实现新型薄膜光伏研究新突破
财联社,2026-03-25 13:58:03,军工概念持续反弹 湖南天雁2连板
同花顺,2026-03-25 13:56:26,美国官员尚未确认“林肯号”航空母舰是否遭到攻击
同花顺,2026-03-25 13:56:11,上期所合成橡胶主力合约大涨5%
同花顺,2026-03-25 13:51:05,截至2月底我国境内公募基金管理规模为38.61万亿元
同花顺,2026-03-25 13:46:24,三一重工董事长唐修国：今年以来电动重卡海外订单同比增长超50%，预计未来2—3年将成倍增长
同花顺,2026-03-25 13:45:02,佳禾食品：签订产业项目发展框架协议，总投资金额约10亿元人民币
同花顺,2026-03-25 13:39:53,中泰化学：2025年净亏损2.89亿元
同花顺,2026-03-25 13:39:48,*ST椰岛：若经审计后的2025年度净利润为负值且营业收入低于3亿元，公司股票可能被终止上市
同花顺,2026-03-25 13:36:40,美股半导体板块盘初走强
同花顺,2026-03-25 13:30:40,美股开盘：美股三大指数集体高开
同花顺,2026-03-25 13:28:40,华安、海富通合并大局已定，华安主导，迎重磅人事布局
财联社,2026-03-25 13:28:32,湖南省政府与比亚迪举行工作会谈
同花顺,2026-03-25 13:26:24,伦敦中英投资者论坛聚焦加强双边合作
同花顺,2026-03-25 13:23:54,中远海特：2025年净利润17.8亿元，同比增长16.29%
财联社,2026-03-25 13:23:35,储能概念午后异动 圣阳股份直线涨停
财联社,2026-03-25 13:20:37,限制特朗普战争权力的议案再遭美参议院否决
财联社,2026-03-25 13:19:44,【风口研报·公司】2026清明假期数据同比涨幅接近1倍，公司演艺索道双核驱动+国资赋能，业绩已是2019年的近3倍，新项目有序落地有望进一步打开成长空间
同花顺,2026-03-25 13:18:58,连云港海关工作人员：经核实 未见查获所谓“稀土走私大案”
财联社,2026-03-25 13:17:09,上交所：富国标普石油天然气勘探及生产精选行业QDII临时停牌
财联社,2026-03-25 13:11:55,三菱电机投资日本人工智能创企Sakana AI
同花顺,2026-03-25 13:11:00,英国暂停加密货币政治捐款，禁令适用于“任何金额”的捐赠
财联社,2026-03-25 13:10:06,沪深两市成交额突破1.5万亿 较上一日此时放量超1400亿
财联社,2026-03-25 13:07:43,日本可重复使用火箭实验机首次试飞中止
财联社,2026-03-25 13:03:40,人形机器人概念午后活跃 斯菱智驱涨超10%
同花顺,2026-03-25 13:03:13,统一股份：2025年净利润1307.74万元，同比下降58.34%
财联社,2026-03-25 13:02:51,港股泡泡玛特午后跌超14% 非Labubu IP产品销售额未达预期
同花顺,2026-03-25 13:02:15,特朗普将邀请扎克伯格、埃里森和黄仁勋加入技术专家小组
同花顺,2026-03-25 13:00:16,期市夜盘开盘，国内期货主力合约多数上涨
同花顺,2026-03-25 12:59:35,禾望电气：2025年净利润5.31亿元，同比增长20.53%
财联社,2026-03-25 12:57:03,黎真主党向以色列发射多枚火箭弹
同花顺,2026-03-25 12:55:15,金山云：第四季度总收入27.61亿元，同比增长23.7%
同花顺,2026-03-25 12:54:58,马钢股份：2025年净利润亏损2.09亿元
同花顺,2026-03-25 12:53:53,交行回应撤销私人银行专营牌照
财联社,2026-03-25 12:52:21,“空天街区”商业航天产业九大项目集中启动
财联社,2026-03-25 12:51:05,委内瑞拉外交使团将于本周赴美履职
财联社,2026-03-25 12:44:03,招商轮船称公司没有船舶在波斯湾 油轮运价大涨
财联社,2026-03-25 12:41:05,美调整探月计划 暂停“门户”空间站项目
财联社,2026-03-25 12:39:15,中远海运国际（香港）：2025年公司权益持有人应占溢利7.71亿港元 同比增长9%
财联社,2026-03-25 12:38:45,【机构调研】数据中心建设进程加速，这家公司越南光通信产品生产基地全面投产
财联社,2026-03-25 12:30:25,小菜园：2025年股东应占溢利7.15亿元 同比增长23.16%
财联社,2026-03-25 12:27:40,华昊中天医药-B：核数师表示预期将在审核报告中发出保留意见
财联社,2026-03-25 12:25:47,泡泡玛特：2025年净利润127.8亿元人民币 同比增长308.8%
财联社,2026-03-25 12:21:52,月之暗面杨植麟：大模型训练进入第三个阶段 今年起AI研发会逐渐加速
财联社,2026-03-25 12:19:43,石药集团：2025年净利润38.8亿元人民币 同比减少10.3%
财联社,2026-03-25 12:16:55,巴西联邦最高法院批准前总统博索纳罗居家监禁
同花顺,2026-03-25 12:14:43,2025年中国人寿总保费首次突破7000亿元
财联社,2026-03-25 12:14:02,IDC：2025年中国智能眼镜市场出货量246万台 同比增长87.1%
同花顺,2026-03-25 12:13:29,冀东装备：2025年净利润2611.5万元，同比增长19.47%
同花顺,2026-03-25 12:13:24,东诚药业：2025年净利润1.96亿元，同比增长6.42%
同花顺,2026-03-25 12:13:18,"赛诺医疗：2025年净利润4728.63万元，同比上涨3,057.07%"
同花顺,2026-03-25 12:13:08,英唐智控：澄清不实传闻，并购项目正常推进
财联社,2026-03-25 12:08:50,安踏2025年净利润135.9亿元 同比增长13.9%
财联社,2026-03-25 12:08:06,蓝思科技：公司已成功研发出抗原子氧剥蚀、抗辐射的大尺寸UTG柔性玻璃 目前产品正配合国内外头部客户测试
同花顺,2026-03-25 12:07:22,古茗：2025年收入129.14亿元，同比增长46.9%
同花顺,2026-03-25 12:06:38,快手程一笑回应Seedance2.0影响：众多参与者可以提速行业进步
同花顺,2026-03-25 12:03:41,北新建材：2025年净利润29.06亿元，同比下降20.31%
同花顺,2026-03-25 12:03:37,金山办公：2025年净利润18.36亿元，同比增长11.63%
财联社,2026-03-25 12:02:49,财联社3月25日午间新闻精选
同花顺,2026-03-25 12:02:39,百济神州：2025年净利润2.87亿美元
财联社,2026-03-25 12:01:29,新时达：公司与海尔智家有具身智能机器人相关部分部件合作 占公司营收比重小
财联社,2026-03-25 12:00:24,港股午评：恒生指数涨0.04% 恒生科技指数跌0.48%
同花顺,2026-03-25 11:59:25,欢乐家：2025年净利润4417.46万元，同比下降70.03%
同花顺,2026-03-25 11:58:09,拼多多陈磊：国际贸易环境加剧变化，全力投入中国供应链
同花顺,2026-03-25 11:57:42,新天绿能：2025年净利润18.26亿元，同比增长9.21%
同花顺,2026-03-25 11:55:17,海波重科：控股股东张海波已减持股份比例降至49.86%
同花顺,2026-03-25 11:54:59,天沃科技：累计诉讼金额7.11亿元，公司已申请强制执行
财联社,2026-03-25 11:54:37,金饰克价重回1400元 一夜大涨近70元
同花顺,2026-03-25 11:54:22,伊朗外交部说非敌对国家船舶可在协调后通行霍尔木兹海峡
财联社,2026-03-25 11:53:42,3月25日午间涨停分析
同花顺,2026-03-25 11:52:37,中复神鹰：2025年净利润9618.41万元，同比扭亏为盈
同花顺,2026-03-25 11:18:28,海森药业：2025年净利润1.36亿元，同比增长10.87%
同花顺,2026-03-25 11:18:06,天合光能：子公司天合科技拟出资4500万元设立合资公司
同花顺,2026-03-25 11:15:29,安恒信息：2025年净利润亏损5749.92万元
同花顺,2026-03-25 11:15:09,华工科技：2025年净利润14.71亿元，同比增长20.48%
同花顺,2026-03-25 11:14:49,拼多多组建“新拼姆” 未来三年计划总投入1000亿元
同花顺,2026-03-25 11:13:00,中国广核：2025年净利润97.65亿元，同比下降9.90%
同花顺,2026-03-25 11:11:15,泰福泵业：公司控制人正在筹划控制权变更相关事宜，公司股票将于2026年3月26日继续停牌
同花顺,2026-03-25 11:11:04,节能国祯：2025年净利润3.56亿元，同比下降2.89%
同花顺,2026-03-25 11:11:00,高盟新材：2025年净利润1.04亿元，同比下降23.18%
同花顺,2026-03-25 11:10:31,凌激副部长兼国际贸易谈判副代表会见阿联酋兰五资本首席执行官夏本佳
同花顺,2026-03-25 11:06:49,通合科技：2025年净利润4015.33万元，同比增长67.72%
同花顺,2026-03-25 11:06:31,尤洛卡：2025年净利润1.83亿元，同比增长92.73%
同花顺,2026-03-25 11:05:34,奔驰新一代S级轿车将搭载智谱多模态大模型
同花顺,2026-03-25 11:04:18,赤峰黄金：李金阳及其一致行动人拟协议转让公司12.73%股份
同花顺,2026-03-25 11:04:06,红板科技：拟发行1亿股
财联社,2026-03-25 11:02:41,主力资金监控：立讯精密净买入超19亿
同花顺,2026-03-25 11:01:32,特朗普支持率降至第二任期以来最低
财联社,2026-03-25 11:00:53,全国首条硅基光子芯片8英寸量产线在苏州开工
同花顺,2026-03-25 11:00:05,阿拉丁：徐久振已减持0.90%
财联社,2026-03-25 10:58:40,国台办回应岛内称大陆海警船进入东沙岛所谓“限制水域”
财联社,2026-03-25 10:57:25,绿电概念涨势扩大 华电能源等十余股涨停
同花顺,2026-03-25 10:56:38,国家新闻出版署：2026年3月份共130款游戏获批
同花顺,2026-03-25 10:54:37,新力金融：2025年净利润3567.77万元，同比增长14.49%
同花顺,2026-03-25 10:52:22,腾讯回应“龙虾”产品安全疑问，AI Agent安全生意显露潜力
财联社,2026-03-25 10:50:45,【盘中宝】随着人工智能等产业快速发展，该技术已成为光通信领域重要发展方向，这家公司拥有多种核心技术
财联社,2026-03-25 10:45:48,以军称已打击伊朗超3000目标
财联社,2026-03-25 10:40:15,旅游概念异动拉升 桂林旅游涨停
