来源,时间,标题
同花顺,2025-09-23 21:29:11.000,OpenAI在美国新增五个数据中心地址，扩展星际之门（Stargate）
同花顺,2025-09-23 21:27:32.000,英伟达董事马克·A·史蒂文斯抛售35万股
同花顺,2025-09-23 21:18:15.000,富时A50期指连续夜盘收跌0.25%
同花顺,2025-09-23 21:15:16.000,通义千问推出Qwen3-VL
同花顺,2025-09-23 21:13:19.000,COMEX黄金期货收涨0.58%，白银期货收涨0.12%
财联社,2025-09-23 21:11:41.000,为防范假借“银龄行动”名义开展商业活动牟利 两部门发布提示
财联社,2025-09-23 21:10:55.000,招商基金董事长王小青离任 钟文岳代任
财联社,2025-09-23 21:08:50.000,【财联社早知道】阿里团队发布全新终端AI智能体，机构预计2032年AI Agent市场规模将超1000亿美元，这家公司自主研发的通用AI AGENT机器人开发平台取得了重大突破
财联社,2025-09-23 21:03:52.000,农业农村部联合中国气象局发布农田渍涝和风灾风险预警
财联社,2025-09-23 21:02:06.000,东方精工：目前公司在“人工智能+机器人”领域持股嘉腾机器人、若愚科技和乐聚机器人
财联社,2025-09-23 21:00:28.000,国家防总针对广西启动防汛防台风四级应急响应
财联社,2025-09-23 20:57:06.000,云图控股：参股四川马边晟隆矿业49%股权并提供借款
财联社,2025-09-23 20:56:00.000,福建启动防汛Ⅳ级应急响应 调整防台风应急响应为Ⅳ级
财联社,2025-09-23 20:54:09.000,绿捷公司涉嫌瞒报食品安全相关信息，公安机关已立案侦查，并控制相关人员
财联社,2025-09-23 20:50:21.000,15连板天普股份：股票交易异常波动 明起停牌核查
财联社,2025-09-23 20:49:36.000,美光科技将于周二盘后公布财报 或将包含对其高带宽内存芯片的强劲预测
财联社,2025-09-23 20:44:43.000,国家防灾减灾救灾委员会启动国家救灾应急响应 指导广东做好台风灾害救助工作
财联社,2025-09-23 20:42:51.000,波兰将重新开放与白俄罗斯的边境口岸
财联社,2025-09-23 20:38:48.000,美联储古尔斯比：目前没有考虑降息50个基点
同花顺,2025-09-23 20:35:23.000,美国至9月19日当周API原油库存下降382.1万桶
同花顺,2025-09-23 20:27:55.000,美光科技：由人工智能驱动的需求正在加速增长 DRAM供应趋紧
同花顺,2025-09-23 20:26:38.000,锂美公司美股盘后上涨超80%
同花顺,2025-09-23 20:07:45.000,稳定币巨头Tether寻求在大规模融资中获得5000亿美元估值
财联社,2025-09-23 20:06:08.000,新疆维吾尔自治区成立70周年庆祝大会25日上午在乌鲁木齐举行 习近平将出席大会
同花顺,2025-09-23 20:05:50.000,美光科技财报超预期
同花顺,2025-09-23 20:05:36.000,纳斯达克中国金龙指数收跌2.22%
财联社,2025-09-23 20:05:02.000,乘联分会秘书长崔东树：2025年8月中国汽车实现出口76.4万辆 同比增25%
财联社,2025-09-23 20:01:40.000,乘联分会秘书长崔东树：中国新能源车1-8月出口表现好于预期
财联社,2025-09-23 19:54:29.000,盛美上海：近期推出的首款KrF工艺前道涂胶显影设备已交付中国头部逻辑晶圆厂客户
财联社,2025-09-23 19:50:55.000,摩根大通美国国债客户调查显示空头占比跃升至2月3日以来最高
财联社,2025-09-23 19:50:09.000,【电报解读】阿里Qwen今晚将发布2个开源模型，国产大模型迈入“强效低耗”时代，这家公司部分解决方案已接入阿里Qwen系列模型
财联社,2025-09-23 19:47:06.000,埃尔多安：以色列在加沙实施“彻头彻尾的种族灭绝” 
财联社,2025-09-23 19:46:22.000,东材科技：高端光刻胶所需单体、光酸、树脂等的合成和纯化业务处于试生产和推广应用阶段
财联社,2025-09-23 19:45:09.000,中国人民银行行长潘功胜会见桥水基金创始人瑞·达利欧
财联社,2025-09-23 19:36:05.000,西班牙政府批准对以色列实施“全面武器禁运”
财联社,2025-09-23 19:31:03.000,奔驰与字节跳动达成AI技术合作 搭载豆包大模型纯电CLA今秋天上市
财联社,2025-09-23 19:30:01.000,精测电子：控股股东、实际控制人拟协议转让5.02%公司股份
同花顺,2025-09-23 19:09:53.000,特朗普与冯德莱莱恩举行会晤 讨论俄乌冲突及中东问题
财联社,2025-09-23 19:03:18.000,美财长：美国已准备好为阿根廷提供金融支持
同花顺,2025-09-23 19:02:12.000,恒指期货夜盘收跌0.05%
财联社,2025-09-23 18:53:56.000,赵乐际会见美国国会众议员代表团
财联社,2025-09-23 18:50:53.000,阿曼一太阳能项目落地 投资超21亿元
财联社,2025-09-23 18:47:57.000,2025光伏行业技术创新大会暨技术百人会召开在即
同花顺,2025-09-23 18:46:13.000,香港发布10号台风信号，发布最高台风警告信号
财联社,2025-09-23 18:45:07.000,维信诺：拟以苏州国显作为项目公司开展昆山全球新型显示产业创新中心项目前期工作
财联社,2025-09-23 18:44:30.000,韩国华城电池厂火灾涉事企业代表一审获刑15年
财联社,2025-09-23 18:38:52.000,博众精工：控股股东一致行动人于9月15日至9月22日期间累计减持549.59万股
财联社,2025-09-23 18:37:56.000,2连板超讯通信：公司董监高减持计划已实施完毕
财联社,2025-09-23 18:37:17.000,伍德赛德能源：未来10年全球LNG需求将增长50%
财联社,2025-09-23 18:36:23.000,中国汽车流通协会：1-8月重型卡车累计零售销量为49.17万辆 同比增长24.92%
同花顺,2025-09-23 18:32:13.000,WTI原油期货结算价报每桶63.41美元，上涨1.81%
同花顺,2025-09-23 18:31:10.000,上期所原油期货夜盘收涨1.47%
财联社,2025-09-23 18:28:58.000,江铃福特将与长安福特乘用车渠道整合 江铃汽车：预计10月官宣
财联社,2025-09-23 18:28:31.000,果麦文化：公司主投电影《三国的星空第一部》将于10月1日上映 影片存在投资收益不确定
财联社,2025-09-23 18:27:53.000,印尼与欧盟签署全面经济伙伴关系协定
财联社,2025-09-23 18:26:05.000,习近平接见新疆各族各界代表
财联社,2025-09-23 18:25:51.000,科威特原油产能创十余年新高
财联社,2025-09-23 18:07:03.000,山西：非常规天然气增储上产正加力提速
财联社,2025-09-23 18:05:06.000,深圳市台风橙色预警信号升级为红色
财联社,2025-09-23 18:00:38.000,报道称德国推进830亿欧元军购计划 美国武器仅占8%
财联社,2025-09-23 17:59:01.000,洲际油气：与关联方签署伊拉克项目原油承销框架协议
财联社,2025-09-23 17:58:13.000,消息称德国推进830亿欧元军购计划 美国武器仅占8%
同花顺,2025-09-23 17:57:14.000,OpenAI和甲骨文据称将宣布在得州扩建数据中心
同花顺,2025-09-23 17:49:50.000,香港天文台发布9号台风信号
财联社,2025-09-23 17:47:29.000,恒瑞医药：阿得贝利单抗注射液新适应症上市许可申请获国家药监局受理
财联社,2025-09-23 17:44:42.000,海立股份：网传涉及公司借壳、重组、资产注入等均为不实信息
财联社,2025-09-23 17:43:18.000,恒瑞医药：SHR7280片药品上市许可申请获国家药监局受理
财联社,2025-09-23 17:39:18.000,南向资金今日净卖出40.69亿港元 阿里获净买入16.73亿港元
财联社,2025-09-23 17:35:49.000,河南出手整治玉器直播乱象 500亿元玉雕产业走向“透明交易”
财联社,2025-09-23 17:35:31.000,东山精密：筹划发行H股股票并在香港联交所上市
财联社,2025-09-23 17:33:11.000,3连板贵广网络：与华为云开展重大算力合作相关传闻不属实
财联社,2025-09-23 17:32:08.000,聚辰股份：工业级存储芯片应用于机器人、高速光模块等领域
财联社,2025-09-23 17:31:53.000,和林微纳：为北美重要客户提供中高端芯片测试探针系列产品
同花顺,2025-09-23 17:28:55.000,迪士尼将从10月21日起提高Disney+订阅价格
同花顺,2025-09-23 17:17:49.000,美联储周二隔夜逆回购协议使用规模升至144.02亿美元
同花顺,2025-09-23 17:16:23.000,美联储主席鲍威尔：关税并非推高通胀的重要因素
同花顺,2025-09-23 17:15:16.000,谷歌向美国所有符合条件的安卓用户推广对话式编辑功能
同花顺,2025-09-23 17:08:41.000,美国财政部拍卖690亿美元两年期国债
财联社,2025-09-23 17:06:06.000,网信部门依法查处UC平台破坏网络生态案件
同花顺,2025-09-23 17:03:50.000,美联储主席鲍威尔：AI意味着某些岗位将被淘汰
财联社,2025-09-23 17:03:48.000,国务院、中央军委公布《军用土地管理条例》
同花顺,2025-09-23 17:02:55.000,礼来公司计划斥资65亿美元在得克萨斯州新建一家工厂
财联社,2025-09-23 17:02:46.000,经合组织预测2025年全球经济增速为3.2% 2026年将放缓至2.9%
财联社,2025-09-23 17:02:27.000,网信部门依法查处今日头条平台破坏网络生态案件
财联社,2025-09-23 17:02:25.000,中央纪委国家监委公开通报八起违反中央八项规定精神典型问题
财联社,2025-09-23 17:01:02.000,受贿数额特别巨大 江西省政协原副主席胡强一审被判13年
同花顺,2025-09-23 17:00:14.000,美联储主席鲍威尔：从许多指标来看，股票价格估值相当高
同花顺,2025-09-23 16:56:33.000,美联储主席鲍威尔：褐皮书显示经济温和增长，但增速并不快
同花顺,2025-09-23 16:52:56.000,国际铜业研究组织：2025年7月世界精炼铜市场过剩5.7万吨
同花顺,2025-09-23 16:39:37.000,现货黄金短线回落超10美元
同花顺,2025-09-23 16:36:09.000,加密货币初创公司ZeroHash从摩根士丹利、SoFi、阿波罗全球管理等机构融资1.04亿美元
同花顺,2025-09-23 16:22:36.000,香港将于凌晨1:40发布九号暴风信号。
财联社,2025-09-23 16:09:30.000,香港恒生指数收跌0.7% 恒生科技指数跌1.45%
财联社,2025-09-23 16:07:38.000,欧林生物：筹划发行H股股票并在香港联合交易所有限公司上市
财联社,2025-09-23 16:06:27.000,亚宝药业：ZY-A002获得药物临床试验批准通知书
财联社,2025-09-23 16:04:47.000,崇德科技：公司经销了斯凯孚的滚动轴承相关产品
同花顺,2025-09-23 16:02:14.000,Meta在WhatsApp上推出信息翻译功能
财联社,2025-09-23 16:00:36.000,市场监管总局约谈货拉拉
同花顺,2025-09-23 15:59:04.000,摩根士丹利将于2026年上半年在E-TRADE平台上推出加密货币交易
财联社,2025-09-23 15:57:51.000,伊朗外长将会晤英法德外长 就伊核问题展开“最后关头”磋商
财联社,2025-09-23 15:56:38.000,《直播电商监督管理办法》近期将发布出台
财联社,2025-09-23 15:53:36.000,外交部：美俄应当切实履行核裁军特殊优先责任
财联社,2025-09-23 15:52:26.000,英国海上贸易行动办公室：也门亚丁东部海域传出爆炸声
财联社,2025-09-23 15:51:45.000,厦门土拍收金逾81亿元 建发、厦门地铁等四家本土企业分食四宗地
财联社,2025-09-23 15:51:10.000,受贿3763万余元 青岛市政协原党组成员、副主席杨锡祥一审获刑12年
同花顺,2025-09-23 15:48:24.000,哥伦比亚金矿塌方25名矿工被困 救援行动进行中
财联社,2025-09-23 15:46:15.000,刚果（金）总统称不会向美国“拍卖矿产资源”
财联社,2025-09-23 15:46:11.000,华凯易佰：罗春计划6个月内增持公司股份不低于2000万元
财联社,2025-09-23 15:45:30.000,今日投资舆情热点
财联社,2025-09-23 15:45:29.000,万安科技：控股子公司获集中采购定点 预计销售总额约2.8亿元
财联社,2025-09-23 15:44:24.000,我国8月纺织服装出口265.4亿美元 下降5%
财联社,2025-09-23 15:43:39.000,深圳美团9月23日18时起暂停外卖服务
同花顺,2025-09-23 15:33:40.000,美国财政部拍卖六周期国债，得标利率4.010%，投标倍数2.51。
同花顺,2025-09-23 15:24:33.000,国际油价涨幅扩大，WTI原油涨2.38%
同花顺,2025-09-23 15:17:07.000,现货铂金上涨超5%
同花顺,2025-09-23 15:06:32.000,巴西基准股票指数上涨逾1%，盘中创下历史高点
财联社,2025-09-23 15:03:38.000,深圳华强：公司与摩尔线程有业务合作
财联社,2025-09-23 15:02:19.000,收评：创业板指探底回升涨0.21% 半导体板块尾盘爆发
财联社,2025-09-23 15:01:43.000,欧洲主要股指开盘集体上涨 法国CAC40指数涨0.39%
同花顺,2025-09-23 15:01:00.000,国内期货夜盘收盘主力合约涨多跌少
财联社,2025-09-23 15:00:30.000,国内商品期货收盘 豆粕跌逾3%
财联社,2025-09-23 14:59:59.000,国家发改委：9月23日国内成品油价格按机制不作调整
财联社,2025-09-23 14:58:12.000,全球首次 我国月度用电量连续两个月破万亿千瓦时
同花顺,2025-09-23 14:49:19.000,据港交所文件：中微半导体（ 深圳）股份有限公司向港交所提交上市申请书
财联社,2025-09-23 14:48:06.000,创业板指翻红 此前一度跌超2%
同花顺,2025-09-23 14:47:25.000,以色列民众反对进攻加沙 民意与政府撕裂加剧
财联社,2025-09-23 14:47:08.000,我国主持的首项IEC轨道交通信号技术领域国际标准正式发布实施
财联社,2025-09-23 14:45:56.000,光刻机概念尾盘异动 凯美特气3连板创历史新高
同花顺,2025-09-23 14:44:02.000,泰国新任总理：泰国人民愿一直与中国并肩前行、相互支持
同花顺,2025-09-23 14:41:53.000,水利部将广东洪水防御应急响应提升至Ⅲ级
财联社,2025-09-23 14:41:47.000,力拓将加入裁员季 料将裁减30名高管
财联社,2025-09-23 14:40:10.000,【盘中宝】价格较年初涨超70%，新政下该品种中长期供需或偏紧缺，价格中枢有望上移，机构预计下游补库力度或加强，这家企业产品广泛应用于多个领域
同花顺,2025-09-23 14:38:16.000,上期所燃油主力合约涨超4%
同花顺,2025-09-23 14:38:13.000,据港交所文件：福建万辰生物科技集团股份有限公司向港交所提交上市申请书
财联社,2025-09-23 14:36:16.000,Mysteel：国庆三大蒙煤进口口岸闭关7天 影响蒙煤187.56万吨供应
财联社,2025-09-23 14:32:27.000,9月多晶硅产量预计小幅下滑 成交价格重心小幅上移
财联社,2025-09-23 14:27:46.000,李成钢国际贸易谈判代表兼副部长会见美国中西部地区政商领袖代表团
财联社,2025-09-23 14:26:47.000,两部门联合启动2025年度计量支撑产业新质生产力发展项目征集工作
财联社,2025-09-23 14:23:51.000,主力资金监控：电子板块净流出超244亿
同花顺,2025-09-23 14:19:03.000,中国石化供中国中车风电专用48K大丝束碳纤维交付发运
同花顺,2025-09-23 14:12:46.000,昊志机电：携机器人核心功能部件领域创新成果亮相上海工博会
同花顺,2025-09-23 14:12:11.000,货拉拉回应被约谈：全盘接受 立即开展整改
同花顺,2025-09-23 14:05:38.000,滴滴双节推出“天天5折”优惠 发放超4亿元司机奖励保障出行
财联社,2025-09-23 14:04:08.000,成都3宗涉宅用地12.84亿元底价成交
财联社,2025-09-23 14:01:17.000,市场监管总局发布《重点排放单位碳计量审查规范》 明年3月8日起施行
财联社,2025-09-23 14:01:14.000,【电报解读】北京持续支持辅助驾驶联网车辆发展，报告预计2025年我国车联网产业规模或超5000亿元，这家公司参股的北京企业拥有相关业务
财联社,2025-09-23 13:59:32.000,融创房地产集团等被执行8.2亿
同花顺,2025-09-23 13:58:32.000,三一集团与中国联通签订战略合作协议
财联社,2025-09-23 13:52:43.000,沪深两市成交额连续第9个交易日突破2万亿 较昨日此时放量超3200亿
同花顺,2025-09-23 13:45:42.000,美联储理事鲍曼：预计2025年共降息三次
同花顺,2025-09-23 13:42:19.000,浪潮软件：证监会同意公司向特定对象发行股票
同花顺,2025-09-23 13:42:14.000,标普500指数触及盘中新高，最新上涨0.1%
同花顺,2025-09-23 13:42:09.000,创业慧康：葛航拟减持2.3982%股份
财联社,2025-09-23 13:38:24.000,电影《南京照相馆》总票房突破30亿元
财联社,2025-09-23 13:37:53.000,【风口研报·公司】具备万吨级半导体材料产能，且已完成头部客户导入验证，分析师强call公司若持续提高持股比例，未来将贡献更多利润增长
同花顺,2025-09-23 13:35:17.000,美法官裁定特朗普政府须恢复加州大学逾5亿美元资金
同花顺,2025-09-23 13:33:05.000,浙江仙通：拟对浩海星空增资4000万元
同花顺,2025-09-23 13:31:29.000,美股开盘：三大指数涨跌不一
财联社,2025-09-23 13:31:22.000,沪银期货主力合约日内涨幅扩大至2%
财联社,2025-09-23 13:28:16.000,铜高速连接器概念局部回暖 沃尔核材触及涨停创历史新高
财联社,2025-09-23 13:26:17.000,北京市经济和信息化局：持续推进“车路云一体化”基础设施在更大范围、更广区域实现覆盖
同花顺,2025-09-23 13:23:52.000,全球首艘双燃料动力滚装船在天津开启首航
同花顺,2025-09-23 13:22:59.000,伊朗部长称寻求让中国成为伊朗旅游业首要合作伙伴
财联社,2025-09-23 13:21:30.000,上海现代服务业人工智能应用服务专委会揭牌成立
同花顺,2025-09-23 13:20:41.000,余承东宣布鸿蒙智行启动OTA全量升级
财联社,2025-09-23 13:20:23.000,香港交易所：“桦加沙”靠近 证券及衍生产品市场将正常交易
财联社,2025-09-23 13:11:20.000,资源涨价叠加需求端询单动作频频 本周嵌入式NAND和LPDDR4X成品迎来普涨行情
同花顺,2025-09-23 13:10:40.000,两部门发布提示 防范假借“银龄行动”名义开展商业活动牟利
财联社,2025-09-23 13:08:05.000,深成指、创业板指双双跌逾2%
同花顺,2025-09-23 13:06:13.000,专家：福建舰打击范围覆盖第二岛链
同花顺,2025-09-23 13:00:51.000,美联储理事鲍曼：是时候采取果断行动降息了
同花顺,2025-09-23 12:54:44.000,润欣科技：孙剑完成减持0.0185%
同花顺,2025-09-23 12:54:32.000,晶瑞电材：股东李虎林持股比例降至4.68%
财联社,2025-09-23 12:50:40.000,汉钟精机：目前公司真空产品在半导体领域使用量较小
同花顺,2025-09-23 12:49:28.000,凯众股份：公司实际控制人变更为杨建刚、侯振坤二人
财联社,2025-09-23 12:42:54.000,深圳成功在香港发行40亿元离岸人民币地方政府债券
同花顺,2025-09-23 12:41:32.000,美联储古尔斯：目前没有考虑降息50个基点
财联社,2025-09-23 12:39:01.000,亿道信息：公司人工智能机器人领域相关产品收入占比较小
财联社,2025-09-23 12:37:52.000,国内首个D-阿洛酮糖产品上市
财联社,2025-09-23 12:36:52.000,诚迈科技注册资本增加约30% 新增工业机器人相关业务
同花顺,2025-09-23 12:31:15.000,美国第二季度经常帐录得-2513亿美元，为2023年第三季度以来最小逆差
财新网,2025-09-23 12:30:00.000,夜读深度：减肥药淘汰赛哨响
同花顺,2025-09-23 12:27:27.000,航天科技：子公司拟挂牌转让4945万元无形资产
同花顺,2025-09-23 12:26:54.000,WTI原油突破63美元/桶
同花顺,2025-09-23 12:26:16.000,8月全国空气质量持续改善 多项主要污染物平均浓度下降明显
同花顺,2025-09-23 12:25:35.000,2025北京文化论坛开幕 聚焦文化和科技融合发展
同花顺,2025-09-23 12:24:04.000,ST炼石：法院裁定受理公司重整
同花顺,2025-09-23 12:23:50.000,江苏国泰：控股股东无偿划转股权 实控人变更为张家港市国有资产管理中心
同花顺,2025-09-23 12:23:32.000,冰轮环境：4董高拟减持0.0229%
财联社,2025-09-23 12:22:48.000,医渡科技中标重组人神经生长因子（SMR001）滴眼液Ⅲ期临床研究项目
财联社,2025-09-23 12:14:41.000,金现代：金现转债即将停止转股 剩最后半个交易日
财联社,2025-09-23 12:14:04.000,【机构调研】国内车载电源头部供应商，Q2单季度营收、净利润创新高，国内外客户有望持续放量
财联社,2025-09-23 12:13:10.000,我国移动互联网用户数突破16亿 8月户均接入流量20.87GB
财联社,2025-09-23 12:09:06.000,国家防总：针对广东海南防汛防台风应急响应提升至三级
同花顺,2025-09-23 12:08:27.000,中国能建总经理倪真与马来西亚副总理法迪拉·优素福会谈
财联社,2025-09-23 12:06:36.000,财联社9月23日午间新闻精选
财联社,2025-09-23 12:05:13.000,东风汽车杨青与华为任正非会谈 双方战略合作将进一步深化
同花顺,2025-09-23 12:02:10.000,*ST惠程：签署《重整财务投资协议》
同花顺,2025-09-23 12:01:37.000,字节跳动与梅赛德斯-奔驰签署战略合作，以AI驱动跨业务升级
财联社,2025-09-23 12:01:20.000,港股午评：恒生指数跌0.97% 恒生科技指数跌2.20%
财联社,2025-09-23 11:56:20.000,2025欧亚经济论坛今天在西安开幕
同花顺,2025-09-23 11:54:05.000,亚威股份：拟向扬州产发集团发行股票募资7.19亿元
同花顺,2025-09-23 11:51:40.000,国家联合资源：预计年度亏损约5000万港元至6000万港元
同花顺,2025-09-23 11:51:31.000,天际股份：财务总监拟减持0.0098%
财联社,2025-09-23 11:51:15.000,IDC：二季度全球智能摄像头市场出货3278.4万台 同比增长0.9%
同花顺,2025-09-23 11:47:20.000,华熙生物：华熙昕宇增持403.68万股
财联社,2025-09-23 11:45:00.000,9月23日午间涨停分析
财联社,2025-09-23 11:44:37.000,交通运输部：《“人工智能+交通运输”实施意见》即将发布施行
同花顺,2025-09-23 11:44:28.000,本轮巴以冲突已致加沙地带65382人死亡
财联社,2025-09-23 11:33:35.000,【大佬持仓跟踪】配合客户持续开发多种丝杠产品，两种产品市占率国内绝对领先，这家公司客户包括特斯拉、比亚迪、蔚小理等新能源汽车厂商
财联社,2025-09-23 11:32:37.000,午评：沪指半日跌1.23% 全市场超4900只个股下跌
财联社,2025-09-23 11:30:40.000,国内金饰价格突破1100元每克
同花顺,2025-09-23 11:27:07.000,甘李药业：签订30亿元框架协议
财联社,2025-09-23 11:21:28.000,厦门海关：前8月福建省啤酒出口同比增长14.57% 居全国第一
同花顺,2025-09-23 11:19:11.000,神马股份：拟以1亿元-2亿元回购公司股份
同花顺,2025-09-23 11:16:32.000,盟固利：银帝等6-9月减持2.33%
同花顺,2025-09-23 11:16:24.000,景兴纸业：持股5%以上股东持股比例被动稀释至12.93%
同花顺,2025-09-23 11:16:08.000,全国工会已建成各类工匠学院超2600家
财联社,2025-09-23 11:13:30.000,余额宝等多只货基调降费率
同花顺,2025-09-23 11:13:16.000,阿里Qwen团队负责人：阿里Qwen团队今晚要发布6个“新东西”
财联社,2025-09-23 11:13:04.000,印度对华铜缆发起反倾销调查
财联社,2025-09-23 11:11:33.000,上海市发布首批面向光刻胶、新型储能、人形机器人等领域中试平台
同花顺,2025-09-23 11:10:18.000,富创精密：沈阳先进增持0.22%股份
财联社,2025-09-23 11:07:02.000,【盘中宝】这类产品能显著提升AI的性能和质量，机构指出国内量产势在必行，上游设备材料或迎来扩产机遇，这家公司细分领域设备已批量出货
同花顺,2025-09-23 11:04:02.000,天安新材：股东拟减持61.15万股
财联社,2025-09-23 11:02:09.000,教育部：“县中振兴行动计划”已正式实施 坚决纠正片面追求升学率倾向
财联社,2025-09-23 11:01:06.000,沪深两市成交额突破1.5万亿 较昨日此时放量超3200亿
同花顺,2025-09-23 11:00:36.000,立讯精密：目前的经营情况正常，近期公司经营情况及内外部经营环境未发生重大变化
同花顺,2025-09-23 10:58:45.000,中科江南：众志软科拟减持1.73%
同花顺,2025-09-23 10:58:20.000,ST路通：庄小正三个月内拟减持0.34%
同花顺,2025-09-23 10:53:47.000,奇精机械：完成董事会换届选举并选举董事长、聘任高级管理人员
财联社,2025-09-23 10:52:22.000,半导体产业链局部异动 立昂微涨停
财联社,2025-09-23 10:51:52.000,今晚成品油零售限价调整或搁浅
财联社,2025-09-23 10:49:30.000,工信部：“十五五”时期要开辟人形机器人、脑机接口、元宇宙、量子信息等新赛道 创建一批未来产业先导区
财联社,2025-09-23 10:47:12.000,首华燃气：下半年计划新增投产深层煤层气水平气井21口
同花顺,2025-09-23 10:47:01.000,遭FBI“钓鱼执法”？白宫力挺边境事务主管“没收钱”
财联社,2025-09-23 10:46:16.000,智元机器人GO-1通用具身基座大模型全面开源
财联社,2025-09-23 10:45:01.000,教育部：我国建成世界规模最大且高质量的智慧教育平台
同花顺,2025-09-23 10:43:20.000,维信诺：拟与昆山唯信联合投资50亿元建设新型显示产业创新中心项目
同花顺,2025-09-23 10:43:09.000,维信诺：与工银资本等共同设立基金
同花顺,2025-09-23 10:42:31.000,腾讯控股：完成发行90亿元票据
财联社,2025-09-23 10:41:47.000,教育部：已建成世界上规模最大的职业教育体系
同花顺,2025-09-23 10:41:44.000,鼎阳科技：初步确定的本次询价转让价格为34.15元/股
同花顺,2025-09-23 10:39:55.000,中国汽车流通协会：8月重型卡车零售销量为6.76万辆，同比增长65.65%
财联社,2025-09-23 10:39:43.000,教育部：“双一流”建设高校在量子科技、生命科学、人工智能等诸多领域取得一批创新成果
同花顺,2025-09-23 10:38:06.000,第九届中国-南非贸易博览会在约翰内斯堡开幕
财联社,2025-09-23 10:35:10.000,三大指数均跌逾1% 下跌个股超5000只
财联社,2025-09-23 10:34:05.000,领益智造：再获行业头部客户超百台具身智能机器人订单
