来源,时间,标题
财联社,2025-11-06 22:02:41.000,【公告全知道】钍基熔盐+可控核聚变+核电+芯片+军工+航空发动机！公司已研发钍基熔盐堆系列产品和技术储备
财联社,2025-11-06 21:58:36.000,振江股份：针对海外燃气轮机客户配套的燃气轮机发电机底座、外壳等钢结构产品持续出货
财联社,2025-11-06 21:56:43.000,【风口研报·洞察】AI数据中心拉动北美电力需求，燃气轮机为匹配需求增长优质选择，目前行业龙头扩产目标明确，燃机零部件主轴/叶片等需求旺盛，国内厂商有望切入全球供应链；11月A股中枢抬升趋于缓慢
财联社,2025-11-06 21:52:01.000,喀麦隆当选总统保罗·比亚宣誓就职
财联社,2025-11-06 21:44:30.000,美联储古尔斯比：在通胀数据缺席的情况下对降息更感不安
财联社,2025-11-06 21:43:35.000,美股盘前要闻一览
财联社,2025-11-06 21:33:49.000,欧盟委员会批准西班牙7亿欧元的计划 以支持清洁技术制造能力
财联社,2025-11-06 21:27:33.000,摩根大通称散户有望支撑美股直至年关
财联社,2025-11-06 21:24:20.000,科泰电源：可生产燃气发电机组并实现热电联产
财联社,2025-11-06 21:23:15.000,世运电路：公司与小鹏自2021年开始合作
财联社,2025-11-06 21:21:50.000,海目星：目前已成功打通锂金属固态电池量产的全线工艺环节
财联社,2025-11-06 21:21:02.000,中烟香港：初步完成中式雪茄全球销售平台的构建
财联社,2025-11-06 21:17:49.000,明阳电气：具备固态变压器相关技术储备
财联社,2025-11-06 21:05:22.000,【财联社早知道】ASML进博会展示全景光刻解决方案，机构预计全球光刻机市场规模2029年将达378.1亿美元，这家公司一直致力于积极拓展激光直写光刻设备在半导体掩模制造领域的量产应用
财联社,2025-11-06 21:02:51.000,文科股份：股东泽广投资计划减持不超0.55%公司股份
财联社,2025-11-06 21:01:58.000,顺络电子：目前公司AI服务器相关的订单饱满 相关业务快速增长
财联社,2025-11-06 20:56:59.000,抚顺特钢：回购股份专用贷款展期至3年
财联社,2025-11-06 20:54:42.000,中国与北欧国家贸易持续增长 今年前三季度达424.3亿美元
财联社,2025-11-06 20:54:07.000,上海市市长龚正会见地中海航运公司CEO，愿强强携手，长期合作，互利共赢
财联社,2025-11-06 20:52:45.000,7天4板振华股份：在股票交易异常波动期间 三名董事合计减持6.4万股公司股份
财联社,2025-11-06 20:46:20.000,金融监管总局首席风险官向东：今年前三季度科技保险保费收入同比增长30% 科技保险有望迎来历史性发展机遇
财联社,2025-11-06 20:40:07.000,工信部：178家国家高新区生产总值占全国GDP总数的14.3%
财联社,2025-11-06 20:35:22.000,理工光科：股东湖北省投资公司计划减持不超0.77%股份
财联社,2025-11-06 20:34:07.000,潍柴动力：拟建立应用于固定式发电市场的电池和电堆生产产线 为AI数据中心等场景提供电力
财联社,2025-11-06 20:07:20.000,诺和诺德与上海临转院开启战略合作
财联社,2025-11-06 20:04:33.000,英国央行预测2025年GDP增速为1.5%
财联社,2025-11-06 20:00:31.000,英国央行维持基准利率在4.00%不变
财联社,2025-11-06 19:58:01.000,水利部发布规范强化河湖管理保护
财联社,2025-11-06 19:55:35.000,爱尔兰政府要求强制圈养禽类以遏制禽流感蔓延
财联社,2025-11-06 19:54:19.000,盛弘股份：特定股东及董监高拟合计减持不超2.82%股份
财联社,2025-11-06 19:52:22.000,农业农村部部长韩俊：健全农业科技领军企业梯度培育机制 发展壮大一批龙头型农业科技领军企业
财联社,2025-11-06 19:50:31.000,金融监管总局党委书记、局长李云泽赴湖南、湖北调研
财联社,2025-11-06 19:50:27.000,第十二届中国—中亚合作论坛在乌鲁木齐举行
财联社,2025-11-06 19:48:03.000,线上线下：副总经理崔嵘计划减持不超0.03%公司股份
财联社,2025-11-06 19:47:21.000,华峰测控再融资事项11月13日上会
财联社,2025-11-06 19:46:40.000,聚焦“好房子”，第二十二届中国住博会开幕
财联社,2025-11-06 19:45:16.000,红日药业：股东姚小青及高管拟合计减持不超1.576%股份
财联社,2025-11-06 19:00:05.000,比亚迪：积极关注具身智能机器人领域 布局未来产业
财联社,2025-11-06 18:54:45.000,智动力：已研发出双幕AR眼镜 固态电池目标能量密度超过500Wh/kg
财联社,2025-11-06 18:52:44.000,罕见特大暴雪 未来三天大范围雨雪将影响超20省区市
财联社,2025-11-06 18:51:09.000,烽火通信：空芯光纤处于试点验证和小规模商用阶段
财联社,2025-11-06 18:50:54.000,豪恩汽电：收到某头部新能源汽车品牌定点信 预估生命周期内总营业额约4.7亿元
财联社,2025-11-06 18:50:47.000,法国审计法院批评卢浮宫“重宣传 轻安全”
财联社,2025-11-06 18:50:01.000,瑞芯微：有多家客户基于瑞芯微主控芯片推出接入AI大模型的AI玩具产品
财联社,2025-11-06 18:48:49.000,网传基金经理“互殴”？鹏华基金闫思倩、王子建回应：恶意诽谤 严重与事实不符
财联社,2025-11-06 18:48:32.000,三丰智能：与专业投资机构共同投资设立创业投资基金
财联社,2025-11-06 18:47:53.000,普洛药业：与嘉兴安帝康生物科技签署战略合作框架协议
财联社,2025-11-06 18:43:24.000,纽威股份：有计划参与第四代核电钍基熔盐堆的阀门研发和供货
财联社,2025-11-06 18:42:16.000,单日客流创历史新高 第八届进博会今日累计入场23.4万人次
财联社,2025-11-06 18:41:42.000,崇德科技：股东张力10月24日-11月6日累计减持53.19万股
财联社,2025-11-06 18:38:57.000,新希望：拟与央企基金和欠发达基金设立合资公司 将新设十六家子公司用于生猪养殖
财联社,2025-11-06 18:35:57.000,松下投资超15亿建电子材料工厂应对AI服务器市场窗口
财联社,2025-11-06 18:33:33.000,广州贝壳二手房业主佣金升至1.5%？公司回应：不实信息
财联社,2025-11-06 18:32:51.000,苏大维格：拟5.1亿元收购常州维普半导体设备有限公司51%股权
财联社,2025-11-06 18:06:03.000,天赐材料：与中创新航签订保供框架协议
财联社,2025-11-06 18:05:34.000,天赐材料：与国轩高科签订年度采购合同
财联社,2025-11-06 18:05:05.000,通化金马：拟7000万元设立全资子公司桂林金马创新投资有限公司
财联社,2025-11-06 18:01:41.000,百联股份：拟向关联方转让杨浦世纪联华100%股权并委托管理
财联社,2025-11-06 18:01:36.000,手握全球最小人工心脏 核心医疗科创板IPO获受理
财联社,2025-11-06 17:59:38.000,【机构龙虎榜解读】CPO+可控核聚变+硅光芯片，多款高端产品用于数据中心，细分产品功率刷新世界记录，为可控核聚变技术路线提供激光芯片，超前布局硅光芯片，这家公司获机构大额净买入
财联社,2025-11-06 17:59:10.000,东风汽车港股：前10月累计汽车销量约150万辆 同比降约1.6%
财联社,2025-11-06 17:57:44.000,GE航空航天进博会期间签约订单总金额近21亿美元
财联社,2025-11-06 17:47:07.000,云南锗业：拟合资设立控股孙公司实施高品质砷化镓晶片建设项目
财联社,2025-11-06 17:45:18.000,标榜股份：终止筹划控制权变更事项 股票复牌
财联社,2025-11-06 17:42:20.000,科创板第五套标准重启后首家创新医疗器械IPO受理
财联社,2025-11-06 17:41:16.000,强瑞技术：预计下半年公司从苹果产业链客户处获取的订单量可能无法保持上半年的同比增速
财联社,2025-11-06 17:39:27.000,广州：2026年起 全市出让的居住用地100%实施装配式建筑
财联社,2025-11-06 17:37:45.000,周大福一年关店近千家
财联社,2025-11-06 17:37:18.000,南向资金全天净买入54.79亿港元 小鹏汽车净买额居首
财联社,2025-11-06 17:32:45.000,威胜信息：AI+技术研发目前已布局源网荷储预测等技术
财联社,2025-11-06 17:02:29.000,中国进出口银行新疆维吾尔自治区分行副行长李盛业接受审查调查
财联社,2025-11-06 17:01:10.000,国务院批复《成渝地区双城经济圈国土空间规划（2021—2035年）》
财联社,2025-11-06 17:00:05.000,云南省能源投资集团副总裁张镭接受审查调查
财联社,2025-11-06 16:58:34.000,重庆建工：子公司联合体中标7.81亿元江湾项目（一期）EPC总承包项目
财联社,2025-11-06 16:57:22.000,国瓷材料：拟1亿元-2亿元回购公司股份
财联社,2025-11-06 16:57:05.000,智库称英国政府面临债务危机
财联社,2025-11-06 16:56:59.000,抚顺特钢：为我国首套钍基熔盐堆提供GH3535合金等关键结构材料
财联社,2025-11-06 16:54:46.000,以防长下令在以色列与埃及边境设立军事禁区
财联社,2025-11-06 16:54:19.000,多氟多：子公司硼同位素产品取得客户订单
财联社,2025-11-06 16:52:13.000,华虹公司：前三季度净利润为2.51亿元 同比下降56.52%
财联社,2025-11-06 16:52:11.000,黄奇帆：建议设立银发产业发展基金
财联社,2025-11-06 16:51:56.000,宝马集团：美国关税致公司盈利承压
财联社,2025-11-06 16:51:54.000,“为宇树科技提供产品收入多少？”金发科技：已有部分客户实现材料的批量供应
财联社,2025-11-06 16:51:00.000,保利置业集团：前10月合同销售约438亿元 同比降10.43%
财联社,2025-11-06 16:02:16.000,天孚通信：部分产品线第三季度不能满足交付需求 正努力提升产出
财联社,2025-11-06 16:02:06.000,欧洲主要股指开盘集体下跌
财联社,2025-11-06 16:00:51.000,浙富控股：控股子公司曾为钍基熔盐实验堆供货
财联社,2025-11-06 15:58:38.000,均胜电子：境外上市外资股（H股）挂牌并上市交易
财联社,2025-11-06 15:57:11.000,商务部回应安世半导体相关问题
财联社,2025-11-06 15:56:44.000,投资管理公司Ares据悉拟招募合伙人级别高管 以增强亚太地区信贷业务
财联社,2025-11-06 15:55:01.000,景津装备：公司实际控制人、董事长兼总经理姜桂廷解除留置
财联社,2025-11-06 15:54:47.000,瑞士宝盛：利好因素将支撑新兴市场股票继续保持强劲势头
财联社,2025-11-06 15:54:44.000,商务部：中国政府高度重视、积极推进加入CPTPP相关工作
财联社,2025-11-06 15:50:59.000,商务部：中方愿同欧盟深化互利合作 探讨商谈包括投资协定在内的各类经贸协议的可能性
财联社,2025-11-06 15:49:48.000,17个项目获2025年世界互联网大会领先科技奖 涵盖大模型、具身智能、量子计算等领域
财联社,2025-11-06 15:48:13.000,贵州茅台：茅台1935在9月、10月的终端动销环比、同比均有明显增长
财联社,2025-11-06 15:47:33.000,力星股份：与浙江荣泰签订战略合作协议 拟在产业机器人用丝杆部件等重要领域的滚动体应用开展战略合作
财联社,2025-11-06 15:47:31.000,集邦咨询：11月电视面板价格预测将全面下调
财联社,2025-11-06 15:46:50.000,亚太药业：盐酸地尔硫䓬片一致性评价申请不予批准
财联社,2025-11-06 15:05:48.000,机构：2025年Q3中国智能手机销量同比下降2.7%
财联社,2025-11-06 15:03:20.000,泰国国王哇集拉隆功将对中国进行国事访问
财联社,2025-11-06 15:03:16.000,收评：沪指涨近1%重返4000点 金属铝、化工板块集体爆发
财联社,2025-11-06 15:02:32.000,国内商品期货多数收涨 对二甲苯涨超3%
财联社,2025-11-06 15:02:00.000,原天风证券海外首席分析师孔蓉拟出任国联民生证券研究院副院长
财联社,2025-11-06 14:57:38.000,机构：2025年上半年全球汽车显示市场出货量达1.2096亿台 同比增长5.1%
财联社,2025-11-06 14:55:21.000,沪深两市成交额突破2万亿 较昨日此时放量超1700亿
财联社,2025-11-06 14:55:06.000,国泰海通等在昆山成立科技股权投资基金 出资额15亿
财联社,2025-11-06 14:51:42.000,11月6日全国农产品批发市场猪肉平均价格为18.06元/公斤 比昨天下降0.7%
财联社,2025-11-06 14:51:32.000,中指研究院：10月房地产行业债券融资512.4亿元 同比增长76.9%
财联社,2025-11-06 14:49:42.000,【盘中宝】订单潮来袭，机构称该行业量产时刻已至，未来5-10年有望成为继智能手机、新能源车后下一代通用平台，这家企业与多家头部企业签订了战略合作协议
财联社,2025-11-06 14:48:49.000,抖音：将进一步规范金融账号经营行为
财联社,2025-11-06 14:43:42.000,主力资金监控：胜宏科技净买入超17亿
财联社,2025-11-06 14:39:50.000,机构：预计2026年CSP合计资本支出增至6000亿美元以上
财联社,2025-11-06 14:39:37.000,本周国内组件低价上调 当前国内低价竞争有所减弱
同花顺,2025-11-06 14:05:47.000,亚马逊：下一代Alexa定制助手将为宝马车载语音助手提供支持
财联社,2025-11-06 14:05:29.000,蓝思科技：获1万台四足机器狗订单
财联社,2025-11-06 14:05:16.000,盛和资源：主要稀土产品价格呈波动上涨态势
财联社,2025-11-06 14:04:22.000,中国船舶集团集中采购合同金额达6.1亿美元 创历史新高
同花顺,2025-11-06 14:03:59.000,世界黄金协会：10月黄金市场日均交易额创历史新高
财联社,2025-11-06 14:01:44.000,创业板指涨逾2% 算力硬件股反弹
财联社,2025-11-06 13:58:09.000,土耳其航空为75架波音飞机订单签署GE航空航天发动机协议
财联社,2025-11-06 13:58:06.000,埃尔多安：土耳其与库尔德工人党和平进程进入“决定性阶段”
同花顺,2025-11-06 13:56:48.000,上海瀚讯：上海双由拟协议转让5.00%公司股份
财联社,2025-11-06 13:49:25.000,重庆本地股局部异动 重庆建工直线涨停
同花顺,2025-11-06 13:41:02.000,阿里健康与多家跨国药企深化战略合作
同花顺,2025-11-06 13:39:08.000,罗克韦尔自动化美股盘前涨超10%
财联社,2025-11-06 13:38:12.000,深圳：支持深交所与主权基金所在国家(地区)的主要交易所建立合作机制
同花顺,2025-11-06 13:37:54.000,中国能建交易分团在第八届进博会现场签约金额达18.28亿美元
财联社,2025-11-06 13:35:17.000,国债期货午后跌幅扩大 30年期主力合约跌0.27%
财联社,2025-11-06 13:34:31.000,江苏高投等在无锡成立集电股权投资基金 出资额20亿元
同花顺,2025-11-06 13:33:47.000,中国一汽与奥迪汽车股份公司签署2026年进口CKD零部件合作谅解备忘录
财联社,2025-11-06 13:27:03.000,算力硬件股持续走强 东山精密、汇绿生态双双涨停
财联社,2025-11-06 13:26:59.000,张又侠会见塞尔维亚国防部长
财联社,2025-11-06 13:26:08.000,沪深两市成交额突破1.5万亿 较昨日此时放量超1600亿
同花顺,2025-11-06 13:25:22.000,机构：2025年Q3中国智能手机销量同比下滑2.7%
同花顺,2025-11-06 13:24:50.000,建邦高科有限公司向港交所提交上市申请书
同花顺,2025-11-06 13:20:45.000,Datadog美股盘前涨超20%
同花顺,2025-11-06 13:20:40.000,谷歌瞄准英伟达定制芯片推出其最强大的人工智能芯片
同花顺,2025-11-06 13:11:33.000,Advanced Drainage美股盘前涨超11%
同花顺,2025-11-06 13:10:42.000,跃赛生物完成近亿元A+轮融资
财联社,2025-11-06 13:06:26.000,特朗普再次指责南非 并重申不会出席G20峰会
财联社,2025-11-06 13:05:06.000,【电报解读】智元机器人出货量明年有望全球第一，机构看好四季度机器人重回科技成长配置主线，这家公司子公司为智元代工
同花顺,2025-11-06 13:05:02.000,Datadog美股盘前涨超11%
同花顺,2025-11-06 13:01:48.000,文科股份：股东泽广投资拟减持不超过0.55%股份
同花顺,2025-11-06 13:00:28.000,国内期货夜盘开盘主力合约涨跌不一
财联社,2025-11-06 13:00:21.000,古巴外长谴责美军打击所谓“贩毒船”是“法外处决”
同花顺,2025-11-06 13:00:11.000,现货白银涨幅扩大至1%
财联社,2025-11-06 12:58:15.000,中国东航签署19份采购协议 总金额12.11亿美元
财联社,2025-11-06 12:58:02.000,财政部在香港成功发行40亿美元主权债券
同花顺,2025-11-06 12:56:11.000,绿城中国：2025年10月，绿城集团自投项目销售金额约为人民币122亿元
同花顺,2025-11-06 12:55:15.000,礼来公布实验性减肥药中期试验积极结果，最高减重20.1%
同花顺,2025-11-06 12:48:57.000,曲江文旅：控股股东所持4.06%股份被拍卖
同花顺,2025-11-06 12:48:44.000,先健科技：G-BranchTM 胸腹主动脉覆膜支架系统获得中国国家药品监督管理局的正式注册批准
财联社,2025-11-06 12:46:31.000,蓝思科技：2025年人形机器人预计出货3000台
财联社,2025-11-06 12:46:23.000,【机构调研】这家公司是行业内率先为新型存储提供薄膜沉积技术支持的设备厂商之一
同花顺,2025-11-06 12:45:54.000,小红书期权回购价格上调超84%至21.2美元/股
财联社,2025-11-06 12:42:07.000,溢价率28.44% 绿城8.58亿元竞得义乌市中心商住地
同花顺,2025-11-06 12:34:04.000,理工光科：股东湖北省投资拟减持不超过0.7692%股份
同花顺,2025-11-06 12:27:56.000,台风“海鸥”在越南中部登陆 造成大面积破坏
同花顺,2025-11-06 12:26:22.000,一心堂：实控人阮鸿献拟向其两女儿分别转让公司总股本的1%
财联社,2025-11-06 12:23:14.000,普京就核试验问题回应：美若行动 俄必反制
财联社,2025-11-06 12:22:13.000,中方反驳美方针对中国军品出口指责
同花顺,2025-11-06 12:21:53.000,周大生：高管许金卓拟减持不超过0.0117%股份
同花顺,2025-11-06 12:20:49.000,达利凯普：股东磐信投资拟减持不超4.5%股份
财联社,2025-11-06 12:20:16.000,中国汽车流通协会肖政三：需要给予经销商更大帮助
财联社,2025-11-06 12:19:51.000,上海浦东新区区长吴金城：智元机器人出货量明年有望全球第一
同花顺,2025-11-06 12:15:58.000,佑驾创新：公司新获智能座舱项目定点，预计全生命周期订单总金额约为人民币3.2亿元
财联社,2025-11-06 12:07:48.000,财联社11月6日午间新闻精选
同花顺,2025-11-06 12:07:37.000,万里石：副董事长邹鹏拟减持不超过1.63%股份
财联社,2025-11-06 12:03:03.000,重庆行政区划调整 撤销江北区、渝北区
财联社,2025-11-06 12:03:03.000,重庆市调整部分行政区划
同花顺,2025-11-06 12:01:17.000,英国央行如期按兵不动
财联社,2025-11-06 12:00:53.000,港股午评：恒生指数涨1.65% 恒生科技指数涨2.04%
同花顺,2025-11-06 11:59:06.000,上纬新材：将与关联方各自独立开展业务 发展具身智能机器人业务
财联社,2025-11-06 11:56:04.000,中德水泥行业节能降碳研讨会在京召开
财联社,2025-11-06 11:53:33.000,单价近35万元/平、总价1.99亿元 瑞慈医疗在上海入手一套豪宅
同花顺,2025-11-06 11:53:13.000,菲利华：董事周生高和职工代表董事孙凯拟分别减持0.1149%和0.0038%
财联社,2025-11-06 11:48:43.000,科大讯飞首发百变声音复刻技术
同花顺,2025-11-06 11:47:59.000,新光药业：股东和丰投资拟减持不超过3%股份
同花顺,2025-11-06 11:46:32.000,塞尔维亚总理马楚特会见华大集团首席执行官尹烨
财联社,2025-11-06 11:46:07.000,11月6日午间涨停分析
同花顺,2025-11-06 11:46:03.000,高盟新材：副总经理李德宇、史向前、王小平拟分别减持0.02%、0.04%和0.001%股份
同花顺,2025-11-06 11:44:31.000,盟固利：股东北京银帝投资及其一致行动人拟合计减持不超3%公司股份
同花顺,2025-11-06 11:43:54.000,达嘉维康：股东钟雪松累计减持0.49%股份
同花顺,2025-11-06 11:43:41.000,迈拓股份：董事辉金鹏、赵家事拟分别减持0.57%和0.29%股份
同花顺,2025-11-06 11:41:41.000,王毅同英国外交大臣库珀通电话
财联社,2025-11-06 11:41:41.000,荷兰安世半导体回应供应链恢复进展 否认张学政恢复CEO职务
同花顺,2025-11-06 11:41:39.000,华纬科技：股东万安投资拟减持不超过1.9199%股份
同花顺,2025-11-06 11:40:55.000,线上线下：副总经理崔嵘拟减持不超过0.03%股份
同花顺,2025-11-06 11:40:31.000,百济神州：预计2025年营业收入将介于人民币362亿元至381亿元之间
财联社,2025-11-06 11:40:20.000,中国汽车流通协会王都：针对行业中存在的“压库”“返利拖欠”问题 中国汽车流通协会已将详实的建议提交给相关部门
财联社,2025-11-06 11:38:55.000,中国汽车流通协会肖政三：将加快经销商授权合同退出条款行业标准化文件的研制工作
财联社,2025-11-06 11:38:23.000,浙江省社保科创股权投资基金登记成立 出资额500亿元
同花顺,2025-11-06 11:38:21.000,中国工商银行与中国数联物流进一步深化战略合作
财联社,2025-11-06 11:34:27.000,江西省人大常委会委员、省人大社会建设委员会副主任委员王爱和被查
财联社,2025-11-06 11:33:26.000,【大佬持仓跟踪】锂电+业绩高增长，扩产后将拥有418万吨锂精矿+7万吨电池级锂盐产能，三季度扣非净利同比增超近5倍，这家公司是全球铯产业链细分绝对龙头
财联社,2025-11-06 11:32:35.000,午评：沪指涨近1%收复4000点大关 化工板块集体走强
财联社,2025-11-06 11:32:05.000,国内期货主力合约多数上涨 烧碱涨超2%
财联社,2025-11-06 11:31:32.000,时的科技与工银金租签署100架E20 eVTOL采购协议
财联社,2025-11-06 11:30:38.000,中国气象局国家空间天气监测预警中心：未来3天或现大地磁暴
同花顺,2025-11-06 11:29:27.000,山东赫达：董事毕松羚拟减持不超过0.1017%股份
财联社,2025-11-06 11:28:26.000,重庆：加强上市辅导培育 推动生物医药企业在境内外资本市场上市
财联社,2025-11-06 11:27:26.000,电解铝概念异动拉升 中国铝业逼近涨停创15年新高
同花顺,2025-11-06 11:26:26.000,上纬新材：要约收购交割完成 智元恒岳持股比例增至58.62%
财联社,2025-11-06 11:25:09.000,重庆：推荐和指导创新药产品纳入“渝快保”等保障范围
财联社,2025-11-06 11:25:01.000,澳大利亚256家企业参展进博会 创历史新高
财联社,2025-11-06 11:22:41.000,重庆：对投资新建的CRO平台给予不超过固定资产投资额20%、最高1000万元资金支持
财联社,2025-11-06 11:20:54.000,重庆：到2027年 全市每年获批上市创新药1—3个
财联社,2025-11-06 11:20:30.000,重庆：对符合科技重大专项支持要求的1类创新药等项目给予资金支持
财联社,2025-11-06 11:18:50.000,【盘中宝】新型储能“一芯难求”，头部电池企业持续满产，机构称“新能源车市场快速增长+储能市场供需两旺”拉动行业上游材料需求，这家企业产品出货量同比增幅超3倍
财联社,2025-11-06 11:11:12.000,歌尔股份在青岛新设智能科技公司 经营范围包括虚拟现实设备制造等业务
财联社,2025-11-06 11:10:23.000,香港商经局局长丘应桦：港府成立专班统筹内地企业出海工作 建一站式资源平台
财联社,2025-11-06 11:09:02.000,半导体设备股持续回暖 金海通涨停
财联社,2025-11-06 11:07:53.000,【风口研报·公司】公司继电器产品应用于数据中心+储能、电力、汽车等新能源领域，当前积极发力新门类及模块化产品，受益多个下游增长，份额有望稳步提升
同花顺,2025-11-06 11:05:56.000,百济神州：第三季度总收入14.12亿美元，同比增长41%
同花顺,2025-11-06 11:05:42.000,ST未名：重组人神经生长因子SMR001滴眼液III期临床试验伦理批件获批
同花顺,2025-11-06 11:04:47.000,中国邮政与中远海运达成战略合作
同花顺,2025-11-06 11:00:44.000,科兴制药：向香港联交所递交H股发行上市申请
同花顺,2025-11-06 11:00:12.000,中国铝业：何文建先生当选董事长
同花顺,2025-11-06 10:57:35.000,南航集团进博会签约额超20亿美元，创六年新高
财联社,2025-11-06 10:57:20.000,主力资金监控：中科曙光净买入超8亿
财联社,2025-11-06 10:51:05.000,【电报解读】再获近百架订单，eVTOL大单频出，大摩预计2030年全球市场规模将达3000亿美元，这家公司助力全球首个载人eVTOL型号TC适航取证
同花顺,2025-11-06 10:50:31.000,豪恩汽电：公司收到某头部新能源汽车品牌产品定点信 预计项目生命周期内总营业额约4.7亿元
同花顺,2025-11-06 10:50:10.000,宁波银行：11月7日起宁行优02停止交易
同花顺,2025-11-06 10:49:08.000,三丰智能：公司及子公司拟以1000万元分别持有长江国鑫基金5%的财产份额
同花顺,2025-11-06 10:48:02.000,普洛药业：与安帝康生物签署战略合作框架协议
财联社,2025-11-06 10:47:02.000,丁薛祥访问巴西
同花顺,2025-11-06 10:46:06.000,科兴生物制药股份有限公司向港交所提交上市申请书
财联社,2025-11-06 10:45:07.000,日本执政党计划每年投入65亿美元 扶持芯片和人工智能产业发展
财联社,2025-11-06 10:43:46.000,将自制芯片？Arm：公司专注于与客户协同设计
财联社,2025-11-06 10:42:58.000,电网设备股反复走强 特变电工触及涨停续创历史新高
财联社,2025-11-06 10:42:55.000,证券板块走强 沪指重回4000点
同花顺,2025-11-06 10:41:09.000,网传基金经理“互殴”？鹏华基金闫思倩、王子建回应：恶意诽谤，严重与事实不符
