来源,时间,标题
财联社,2025-10-01 06:02:45.000,美联储10月降息25个基点的概率升至96.2%
财联社,2025-10-01 05:27:00.000,美国会预算办公室：政府停摆期间每天约75万联邦雇员被迫休假
财联社,2025-10-01 05:19:52.000,特朗普：将与哈佛大学达成协议
财联社,2025-10-01 04:00:42.000,美股三大指数集体收涨 大型科技股涨跌不一
财联社,2025-10-01 03:52:28.000,以色列政府批准任命大卫·齐尼为辛贝特局长
财联社,2025-10-01 03:47:16.000,俄外交部宣布将驱逐一名奥地利外交官
财联社,2025-10-01 03:36:28.000,苏丹西部城市法希尔遭炮击 30人伤亡
财联社,2025-10-01 03:34:28.000,菲律宾官员称地震已造成至少7人死亡
财联社,2025-10-01 03:32:36.000,美联储古尔斯比：政府停摆对经济的影响取决于停摆的范围和持续时间
财联社,2025-10-01 03:06:41.000,以军一天内袭击加沙多地 已致59人死亡
财联社,2025-10-01 03:03:05.000,卡塔尔首相：将与土埃和哈马斯就美方“20点计划”进行讨论
财联社,2025-10-01 03:01:22.000,丹麦称美国将向其提供反无人机支持
财联社,2025-10-01 02:16:09.000,伊朗总统：美国无意通过谈判解决伊朗核问题
财联社,2025-10-01 01:39:51.000,印尼东爪哇省苏梅内普地区附近发生6.5级地震
财联社,2025-10-01 01:34:49.000,乌称俄军袭击第聂伯罗市 致1死15伤
财联社,2025-10-01 01:30:24.000,美国消费者信心指数创4月以来最低水平
财联社,2025-10-01 01:00:01.000,阿富汗通讯网络完全中断
财联社,2025-10-01 00:55:11.000,LME金属期货收盘涨跌不一
财联社,2025-10-01 00:34:43.000,三峡枢纽前三季度通过量达1.28亿吨
财联社,2025-09-30 23:58:42.000,菲律宾发布海啸预警 地震致多地断电
财联社,2025-09-30 23:45:05.000,韩日领导人会谈讨论加强务实合作
财联社,2025-09-30 23:40:49.000,欧洲主要股指集体收涨
财联社,2025-09-30 23:37:55.000,Millennium据悉因FirstBrands破产遭受1亿美元损失
财联社,2025-09-30 23:27:43.000,南非驻法国大使在巴黎身亡
财联社,2025-09-30 23:26:55.000,惠同新材：筹划收购保定三源不低于51%股权 预计构成重大资产重组
财联社,2025-09-30 23:08:57.000,巴基斯坦成功试射“法塔赫-4”巡航导弹
财联社,2025-09-30 22:51:55.000,拉脱维亚报告今年首例野鸟禽流感病例
财联社,2025-09-30 22:21:08.000,辉瑞将在美国投资700亿美元用于药品生产
财联社,2025-09-30 22:17:36.000,上海率先实现生成式人工智能服务备案、登记“双破百”
财联社,2025-09-30 22:13:38.000,土耳其博斯普鲁斯海峡恢复通行
财联社,2025-09-30 22:07:54.000,菲律宾莱特岛附近发生7.0级左右地震
财联社,2025-09-30 22:05:00.000,海南：不得将纯商业住宅房地产项目、以安置房等之名行房地产开发之实的项目申报省重大项目
财联社,2025-09-30 21:59:44.000,G217线独库公路10月10日20时起将实施冬季封闭
财联社,2025-09-30 21:53:41.000,台风“博罗依”在越南造成27人死亡
财联社,2025-09-30 21:50:33.000,财联社9月30日晚间新闻精选
财联社,2025-09-30 21:44:37.000,深圳推出国家绿证“居民购”
财联社,2025-09-30 21:32:18.000,纳斯达克中国金龙指数盘初涨0.3%
财联社,2025-09-30 21:17:20.000,张江高科：控股股东张江集团拟减持不超过1%公司股份
财联社,2025-09-30 21:11:30.000,特朗普：若政府“关门” 大量联邦雇员可能被裁
财联社,2025-09-30 21:05:49.000,"香港外汇交易平均每日成交金额增至8,831亿美元"
财联社,2025-09-30 21:05:47.000,格林基金副总经理杨柳因个人原因离任
财联社,2025-09-30 21:05:36.000,获股东“输血” 南华基金增加注册资本至3.5亿元
财联社,2025-09-30 21:03:08.000,特朗普：哈马斯需在3至4天内回应“20点计划”
财联社,2025-09-30 20:56:27.000,欧央行行长：迄今为止关税推高通胀的效应甚微
财联社,2025-09-30 20:54:20.000,国家数据局：加快构建符合数据要素特性规律的数据交易机构监管体制机制
财联社,2025-09-30 20:52:53.000,合肥：持续推进“好房子”建设 稳步实施城市更新行动
财联社,2025-09-30 20:52:10.000,获1280万美元国防订单 Unusual Machines盘前涨超5%
财联社,2025-09-30 20:05:33.000,9月30日周二《新闻联播》要闻16条
财联社,2025-09-30 20:00:16.000,重庆：强化外卖餐饮安全监管 大力推动落实“互联网+明厨亮灶”要求
财联社,2025-09-30 19:56:43.000,普京签署总统令 缩短俄联邦财产私有化程序
财联社,2025-09-30 19:53:48.000,董事长变更不到半年 东海基金又见副总辞职
财联社,2025-09-30 19:53:29.000,花旗：预测到2029年 美国科技巨头AI支出将突破2.8万亿美元
财联社,2025-09-30 19:47:26.000,广东省明日起实行离境退税“即买即退”省内互认办理
财联社,2025-09-30 19:47:16.000,伦敦跌出全球IPO市场前20名 落后于墨西哥
财联社,2025-09-30 19:43:59.000,摩根大通美债客户调查显示多头占比升至4月以来的新高
财联社,2025-09-30 19:42:28.000,多氟多：公司储能电池已稳定供货于国内外客户 现阶段储能订单饱满
财联社,2025-09-30 19:37:17.000,证券期货违法行为吹哨人奖励工作规定草案征求意见 较大幅度提高奖励标准
财联社,2025-09-30 19:35:15.000,领导层发生变动 Spotify美股盘前跌超5%
财联社,2025-09-30 19:34:24.000,华夏基金迎新任董事长邹迎光 李一梅为副董事长
财联社,2025-09-30 19:31:41.000,新诺威：筹划发行H股股票并在香港联交所上市
财联社,2025-09-30 19:29:43.000,生态环境部公开征求《2024、2025年度全国碳排放权交易市场钢铁、水泥、铝冶炼行业配额总量和分配方案（征求意见稿）》意见
财联社,2025-09-30 19:29:34.000,日本新构型H3运载火箭研发遭遇困难
财联社,2025-09-30 19:28:42.000,巴基斯坦西南部爆炸袭击致多人伤亡
财联社,2025-09-30 19:26:48.000,百望股份境内未上市股份“全流通”获中国证监会备案
财联社,2025-09-30 19:23:14.000,均胜电子港股上市申请获中国证监会备案
财联社,2025-09-30 19:03:43.000,固态电池开发商QuantumScape宣布与康宁达成陶瓷隔膜开发与商业化协议
财联社,2025-09-30 19:02:00.000,机构：9月TOP100房企销售总额环比增长11.9%
财联社,2025-09-30 19:01:42.000,涉嫌炸毁“北溪”天然气管道 一乌克兰人在波兰被捕
财联社,2025-09-30 19:00:20.000,央行对中信银行予以警告 罚款1535.7万元
财联社,2025-09-30 18:58:27.000,新易盛：控股股东高光荣拟询价转让1.15%股份
财联社,2025-09-30 18:57:59.000,央行对浙商银行股份有限公司予以警告 罚款296万元
财联社,2025-09-30 18:55:53.000,海南华铁：子公司终止36.9亿元算力服务协议
财联社,2025-09-30 18:48:54.000,小米汽车公布开店进展：9月新增32家门店
财联社,2025-09-30 18:48:47.000,卡塔尔外交部：土耳其加入加沙停火谈判调停
财联社,2025-09-30 18:47:30.000,工信部部长李乐成：中方支持G20成员围绕产业链供应链对接、技术普及应用、数字能力建设等重点领域深化合作
财联社,2025-09-30 18:46:02.000,中国证监会核准设立瑞穗证券（中国）
财联社,2025-09-30 18:44:53.000,俄外长：即便乌克兰获得“战斧”导弹 也不会改变局势
财联社,2025-09-30 18:44:04.000,央行对中债资信评估有限责任公司予以警告 罚款327.5万元
财联社,2025-09-30 18:43:59.000,央行对国家开发银行予以警告 罚款123万元
财联社,2025-09-30 18:43:54.000,优兔同意支付2450万美元了结特朗普提起的诉讼
财联社,2025-09-30 18:28:47.000,中无人机：签订6.15亿元日常经营重大合同 合同标的为无人机系统
财联社,2025-09-30 18:07:04.000,美联储副主席杰斐逊：明年通胀率将下降 未来几年将达到2%
财联社,2025-09-30 18:04:39.000,寒武纪：定增发行价格为每股1195.02元
财联社,2025-09-30 18:00:49.000,汉威科技：拟4.4亿元出售汉威智源65%股权
财联社,2025-09-30 18:00:02.000,湖南：支持益阳市高端电子元器件产业高质量发展
财联社,2025-09-30 17:59:52.000,中国建设银行广西壮族自治区分行原行长李思影接受审查调查
财联社,2025-09-30 17:59:50.000,*ST正平：公司股票交易存在异常波动 将停牌核查
财联社,2025-09-30 17:55:02.000,德商银行：政府停摆对美元影响可能不大
财联社,2025-09-30 17:53:38.000,证监会召开“十五五”资本市场规划上市公司和行业机构座谈会 吴清：不断提升市场的吸引力、包容性和竞争力
财联社,2025-09-30 17:51:30.000,湖南：加大中医药龙头企业培育 推动2—3家中医药企业挂牌上市
财联社,2025-09-30 17:48:30.000,润达医疗：股东拟合计减持不超3.99%公司股份
财联社,2025-09-30 17:47:18.000,现货黄金日内跌幅扩大至1%
财联社,2025-09-30 17:47:16.000,恒瑞医药：子公司收到SHR-4298注射液药物临床试验批准通知书
财联社,2025-09-30 17:47:08.000,财达证券：股东国控运营累计减持公司总股本的3% 减持股份计划实施完毕
财联社,2025-09-30 17:45:54.000,南向资金今日净买入近155亿港元 阿里巴巴获净买入居前
财联社,2025-09-30 17:43:11.000,时隔4年再次出手减持 豪威集团控股股东虞仁荣拟减持不超过2400万股
财联社,2025-09-30 17:40:41.000,刘小涛任江苏省政府党组书记
财联社,2025-09-30 17:06:06.000,香港预计国庆黄金周迎来内地旅客154万人次 同比增长约11%
财联社,2025-09-30 17:02:12.000,央行：10月9日将开展11000亿元买断式逆回购操作 期限为3个月
财联社,2025-09-30 17:01:51.000,国务院办公厅印发《关于在政府采购中实施本国产品标准及相关政策的通知》
财联社,2025-09-30 17:01:24.000,ST绝味：因未确认加盟门店装修业务收入收到行政处罚
财联社,2025-09-30 17:00:56.000,中证协：围绕2025年第四季度国内外经济形势展望、“反内卷”与新投资机遇两个主题进行研讨
财联社,2025-09-30 16:58:25.000,2025年第七期和第八期国债将于近期发行
财联社,2025-09-30 16:56:28.000,世界首台“摄像”磁共振获批上市
财联社,2025-09-30 16:55:34.000,郑商所发布《郑州商品交易所动力煤期货业务细则》修订案
财联社,2025-09-30 16:51:44.000,上海：对创业投资类基金 可适当提高政府出资比例、放宽基金存续期要求
财联社,2025-09-30 16:50:10.000,上海：创业投资类基金要围绕发展新质生产力 支持科技创新，重点投早、投小、投硬科技
财联社,2025-09-30 16:45:59.000,两部门印发《能源规划管理办法》
财联社,2025-09-30 16:05:51.000,特斯拉第三代人形机器人将于明年开始量产
财联社,2025-09-30 16:04:28.000,沃格光电：公司玻璃基1.6T光模块/CPO项目已正式进入送样阶段
财联社,2025-09-30 16:03:57.000,浙版传媒：间接持有宇树科技0.015%股权
财联社,2025-09-30 15:59:57.000,投资日历：10月资本市场大事提醒
财联社,2025-09-30 15:59:52.000,豆包大模型1.6-vision正式发布
财联社,2025-09-30 15:58:49.000,有研粉材：用于昇腾芯片的高性能散热铜粉为公司独供
财联社,2025-09-30 15:57:27.000,瑞普生物：取得新兽药注册证书
财联社,2025-09-30 15:56:03.000,德国9月季调后失业率为6.3% 失业人数增加1.4万人
财联社,2025-09-30 15:53:16.000,交大思诺：董事长李伟被实施留置
财联社,2025-09-30 15:52:24.000,9月30日连板股分析：蓝丰生化晋级7连板 存储芯片板块爆发
财联社,2025-09-30 15:49:16.000,无锡至宜兴城际轨道交通工程获得全国首批新型政策性金融工具投放
同花顺,2025-09-30 15:07:10.000,珠海宝丰堂半导体股份有限公司向港交所提交上市申请书
财联社,2025-09-30 15:05:23.000,华润燃气投资公司增资至10亿美元
财联社,2025-09-30 15:03:46.000,《求是》杂志发表习近平总书记重要文章《中华民族共同体的形成和发展是人心所向、大势所趋、历史必然》
财联社,2025-09-30 15:02:19.000,收评：A股9月收官！创业板指本月涨超12% 科创50指数本月涨超11%创近4年新高
财联社,2025-09-30 15:01:55.000,欧洲主要股指开盘集体下跌
财联社,2025-09-30 15:01:44.000,印度对涉华原生多层纸板作出反倾销肯定性终裁
财联社,2025-09-30 15:00:57.000,宜春锂企：目前未接到停产通知
财联社,2025-09-30 15:00:27.000,国内商品期货收盘 焦煤跌超3%
财联社,2025-09-30 14:56:30.000,特朗普政府撤销前政府民用枪支出口限制
财联社,2025-09-30 14:54:45.000,哈萨克斯坦首都轻轨项目开始阶段测试
同花顺,2025-09-30 14:50:12.000,分众传媒：“碰一碰”业务未来终端覆盖规模和用户参与度将会逐步提升
同花顺,2025-09-30 14:50:02.000,金奥国际：截至2023年12月31日止年度亏损14.22亿港元
财联社,2025-09-30 14:49:56.000,数据显示日本10月将有逾3000种食品涨价
财联社,2025-09-30 14:47:33.000,昨日股票ETF市场净流入资金超120亿元
同花顺,2025-09-30 14:42:02.000,创纪录 逾15万美国联邦雇员9月底离职
同花顺,2025-09-30 14:38:15.000,消息人士：欧佩克+将考虑更大幅度地增加石油产量
财联社,2025-09-30 14:38:04.000,端侧硬件概念异动拉升 国光电器直线涨停
财联社,2025-09-30 14:37:55.000,【盘中宝】订单快速增长，机构称“政策支持+产业链各环节企业相继发布新技术”等多重利好叠加下，该行业产业化进程有望提前加速，这家企业已获数亿元订单
同花顺,2025-09-30 14:35:10.000,奥联服务集团股份有限公司向港交所提交上市申请书
同花顺,2025-09-30 14:32:25.000,瑞穗证券（中国）获批设立 耿欣将出任总经理
同花顺,2025-09-30 14:30:07.000,英国央行货币政策委员曼恩：英国通胀率正处于持续高企的时期
同花顺,2025-09-30 14:18:24.000,九方智投控股：完成收购广发保险股权
同花顺,2025-09-30 14:14:24.000,中国汽研与天津港保税区管委会签署战略合作框架协议
同花顺,2025-09-30 14:11:22.000,英伟达盘中一度涨近2%
同花顺,2025-09-30 14:08:03.000,郑州市将发放2000万元金秋通用消费券
财联社,2025-09-30 14:03:35.000,硅片企业Q4确定减产 电池片整体库存水平降至3-4GW
同花顺,2025-09-30 14:02:42.000,美国九月消费者信心指数为94.2，预期为96.0，前值为97.4
同花顺,2025-09-30 14:01:13.000,美国8月JOLTs职位空缺722.7万人，预估718.5万人，前值718.5万人
同花顺,2025-09-30 13:59:34.000,美联储柯林斯：在美国政府停摆期间美联储将照常操作
财联社,2025-09-30 13:56:43.000,【盘中宝】产业发展取得积极成效，示范规模稳步扩大，这家公司当前聚焦该智能化主赛道，与头部企业在细分领域有深度合作
财联社,2025-09-30 13:56:35.000,算力硬件股午后持续走弱 新易盛等多股跌超5%
财联社,2025-09-30 13:53:31.000,焦煤期货主力合约跌超3%
同花顺,2025-09-30 13:52:09.000,全国政协副主席、共享基金主席梁振英到中交集团调研
同花顺,2025-09-30 13:46:15.000,美国9月芝加哥PMI 40.6，预期43，前值41.5
财联社,2025-09-30 13:45:08.000,国资委：着力抓好布局结构调整的关键任务 破解科技创新的瓶颈障碍
同花顺,2025-09-30 13:40:33.000,美联储柯林斯：强劲的美国股市提振了家庭财富，提振了消费
财联社,2025-09-30 13:38:52.000,外资今年以来净卖出168亿美元印度股票 接近2022年创下的纪录
同花顺,2025-09-30 13:35:09.000,全球碳化硅厂商Wolfspeed股价上涨28%
财联社,2025-09-30 13:33:17.000,沪金主力合约日内涨超2%
同花顺,2025-09-30 13:32:14.000,美国政府停摆风险令美股承压 三大指数集体低开
财联社,2025-09-30 13:29:31.000,瑞银：外资有望进一步流入中国股市
财联社,2025-09-30 13:24:57.000,沪深两市成交额突破1.5万亿 较昨日此时放量超800亿
同花顺,2025-09-30 13:23:13.000,美国证券交易委员会（SEC）正推动允许股票像加密货币一样进行交易
财联社,2025-09-30 13:21:07.000,北京房地产中介协会：不得采用PUA手段损害房主合法权益
同花顺,2025-09-30 13:20:57.000,石药集团：石药创新H股建议上市 将导致公司持股比例减少约8.46%
同花顺,2025-09-30 13:16:10.000,张江高科：张江集团拟3个月内减持1%
财联社,2025-09-30 13:11:03.000,亿纬锂能：2026–2030年将与TSL Assembly在中东欧地区部署总规模达1GWh的储能系统项目
同花顺,2025-09-30 13:10:42.000,奥园集团：“H奥园02”、“H20奥园1”、“H21奥园”无法按期兑付
同花顺,2025-09-30 13:10:22.000,2025年9月票房26.54亿
同花顺,2025-09-30 13:08:19.000,刘烈宏赴重庆市开展调研
财联社,2025-09-30 13:08:16.000,【机构调研】这家端侧智能服务商面向机器人构建起从12-80TOPS全覆盖的算力平台
财联社,2025-09-30 13:08:00.000,汽车整车板块震荡拉升 赛力斯涨超8%续创历史新高
财联社,2025-09-30 13:06:58.000,杭州：10月9日起暂停实施汽车置换更新补贴政策
财联社,2025-09-30 13:04:32.000,电气风电中标华电宁夏25.625万千瓦风电项目
财联社,2025-09-30 13:02:49.000,国债期货午后涨幅扩大 30年期主力合约涨0.22%
同花顺,2025-09-30 13:01:58.000,美联储柯林斯：尽管就业市场趋软，经济增长依然强劲
同花顺,2025-09-30 13:01:00.000,美国7月S&P/CS20座大城市未季调房价指数同比增长1.8%，预期1.6%
财联社,2025-09-30 12:58:48.000,双节将至 民航旅客运输量预计创历史同期新高
同花顺,2025-09-30 12:58:18.000,复星医药中东办公室于沙特吉达正式揭牌
财联社,2025-09-30 12:56:11.000,11条河流11个站出现超警洪水 广西发布洪水黄色预警
同花顺,2025-09-30 12:53:48.000,天山电子：公司首款企业级SSD混合盘的研发、设计等阶段性工作正在有序推进中
同花顺,2025-09-30 12:50:20.000,广汽本田拟收购东风本田发动机
财联社,2025-09-30 12:47:50.000,日本朝日集团遭网络攻击 部分业务暂停
财联社,2025-09-30 12:45:37.000,2025世界工程组织联合会全体大会暨全球工程大会将于10月在沪举行
同花顺,2025-09-30 12:42:41.000,武汉滨会生物科技股份有限公司-B向港交所提交上市申请书
财联社,2025-09-30 12:40:16.000,聚焦智能机器人产业应用 锦富技术签署相关协议
同花顺,2025-09-30 12:39:17.000,UiPath盘前上涨20%
同花顺,2025-09-30 12:38:43.000,海尔智家：董事、高级管理人员自愿增持公司股份计划实施完毕
同花顺,2025-09-30 12:37:53.000,CoreWeave与Meta签142亿美元算力协议
同花顺,2025-09-30 12:32:21.000,剑桥科技：发行境外上市股份（H股）获得中国证监会备案
同花顺,2025-09-30 12:32:12.000,阳谷华泰：重组申请文件中记载的财务资料已过有效期，深交所对公司本次重组中止审核
同花顺,2025-09-30 12:31:40.000,沈阳化工：公司股票将被实施其他风险警示
同花顺,2025-09-30 12:30:35.000,FF完成对纳斯达克上市公司QLGN的战略投资
财联社,2025-09-30 12:26:40.000,宇树科技专利侵权案一审判决：未构成侵权 原告败诉
财联社,2025-09-30 12:23:29.000,全国首个具身智能领域国家级标准化试点落沪
财联社,2025-09-30 12:22:19.000,长三角铁路今日预计发送旅客365万人次
财联社,2025-09-30 12:20:31.000,香港交易所推出泡泡玛特股票期权
财联社,2025-09-30 12:09:05.000,午间公告：双鹭药业参股公司长风药业拟在香港联交所主板挂牌上市
财联社,2025-09-30 12:04:36.000,【风口研报·公司】全球AI数据中心+光伏部署推动储能需求爆发，这家公司电连系统产品已批量供货特斯拉、阳光电源等储能项目，有望受益特斯拉上海储能工厂放量
财联社,2025-09-30 12:04:23.000,财联社9月30日午间新闻精选
同花顺,2025-09-30 12:02:11.000,德国9月CPI初值环比增长0.2%，预期0.1%，前值0.1%
财联社,2025-09-30 12:00:38.000,港股午评：恒生科技指数涨0.55% 华虹半导体涨近12%
同花顺,2025-09-30 11:59:16.000,华熙生物：控股股东增持0.94%
同花顺,2025-09-30 11:59:11.000,华恒生物：向香港联交所递交H股发行并上市申请
财联社,2025-09-30 11:56:47.000,商务部等五部门支持北京率先试行世贸组织电子商务协定
同花顺,2025-09-30 11:56:24.000,普京签署总统令，缩短俄联邦财产私有化程序
财联社,2025-09-30 11:54:22.000,中国汽车工业协会：8月汽车零部件产品进口金额20.5亿美元 同比下降17.9%
同花顺,2025-09-30 11:50:55.000,抖音安全与信任中心举办专家沟通会，联动各界提升算法透明度
同花顺,2025-09-30 11:46:58.000,多氟多：公司储能电池已稳定供货于国内外客户，现阶段储能订单饱满
同花顺,2025-09-30 11:44:31.000,科泰电源：筹划在境外发行股份(H股)并申请在香港联交所挂牌上市
同花顺,2025-09-30 11:43:48.000,中国证监会、财政部：较大幅度提高吹哨人奖励标准
财联社,2025-09-30 11:43:31.000,9月30日午间涨停分析
财联社,2025-09-30 11:43:07.000,【大佬持仓跟踪】储能+HVDC，国内工商业储能产品出货量市场前三，模块化储能解决方案在全球40余国获得准入认证，这家公司HVDC为未来重点发展方向
财联社,2025-09-30 11:42:12.000,广西针对郁江上游左江流域启动洪水防御三级应急响应
同花顺,2025-09-30 11:38:55.000,中国证监会、财政部就《证券期货违法行为吹哨人奖励工作规定（征求意见稿）》公开征求意见
同花顺,2025-09-30 11:38:23.000,白银有色：收到甘肃证监局行政监管措施决定书
同花顺,2025-09-30 11:34:52.000,中国石油：聘任任立新为总裁
财联社,2025-09-30 11:32:29.000,墨西哥对华自粘胶带发起反倾销调查
财联社,2025-09-30 11:32:24.000,合肥市创业投资引导基金二期登记成立 注册资本20亿
财联社,2025-09-30 11:31:56.000,午评：沪指半日涨0.40% 有色金属、存储芯片概念股持续爆发
财联社,2025-09-30 11:30:07.000,港元隔夜Hibor跃升至今年以来最高水平
同花顺,2025-09-30 11:29:35.000,聚焦全球治理倡议 总台在欧洲拉美多国举办系列研讨活动
同花顺,2025-09-30 11:27:58.000,金辉集团：收购三艘船舶 总合同价为 9915万美元
同花顺,2025-09-30 11:25:15.000,瑞穗证券（中国）获准设立
同花顺,2025-09-30 11:23:13.000,上交所：向海南华铁下发监管工作函
同花顺,2025-09-30 11:21:47.000,*ST金科：拟注销3706万股回购股份
财联社,2025-09-30 11:21:42.000,“成”或“成1”！科创成长层股票标识已上线
财联社,2025-09-30 11:13:12.000,禾赛科技：2026至2027年将继续作为核心战略供应商与小米汽车深化合作关系
财联社,2025-09-30 11:10:39.000,国内金饰价格继续走高 升至1125元/克
财联社,2025-09-30 11:09:29.000,芯片产业链反复走强 华虹公司涨超10%续创历史新高
财联社,2025-09-30 11:08:47.000,安徽省举行第四批重大项目开工动员会 总投资3323.8亿元
同花顺,2025-09-30 11:07:24.000,华发股份：张巍因个人原因辞职
同花顺,2025-09-30 11:07:15.000,恒大汽车：流动性挑战依然存在 股份继续停牌
财联社,2025-09-30 11:06:45.000,广东宏大中标煤矿无人驾驶采煤项目
财联社,2025-09-30 11:05:53.000,吉利控股：旗下沃飞长空大型载人eVTOLAE200-100首架机下线
同花顺,2025-09-30 11:04:42.000,固态电池开发商QuantumScape盘前拉升涨近10%
同花顺,2025-09-30 11:03:37.000,美提加沙“20点计划”被曝经以修改 哈马斯恐难接受
财联社,2025-09-30 10:59:25.000,上海今年以来离境退税销售额同比增长83.8% 退税额增长82.9%
同花顺,2025-09-30 10:59:12.000,浙文互联：临安新锦拟减持1.60%
同花顺,2025-09-30 10:58:22.000,外交部：有关国家执意推动“快速恢复制裁”不具建设性
财联社,2025-09-30 10:57:56.000,主力资金监控：兆易创新净买入超8亿
同花顺,2025-09-30 10:56:08.000,天铭科技：张松拟减持54万股
同花顺,2025-09-30 10:54:37.000,新易盛：股东高光荣拟转让1.15%股份
同花顺,2025-09-30 10:54:01.000,海南华铁：胡丹锋解除质押1.77亿股
财联社,2025-09-30 10:53:57.000,九洲集团中标氟化工领域两大项目
同花顺,2025-09-30 10:53:54.000,*ST金刚：苏州金刚重整计划草案出炉
同花顺,2025-09-30 10:53:25.000,中国人民银行将开展11000亿元买断式逆回购操作
同花顺,2025-09-30 10:53:20.000,*ST金刚：公司及四家子公司召开第一次债权人会议
同花顺,2025-09-30 10:53:14.000,品茗科技：股票交易异常波动暨严重异常波动
财联社,2025-09-30 10:52:11.000,可控核聚变概念异动拉升 合锻智能涨停
同花顺,2025-09-30 10:51:35.000,同飞股份：股东拟询价转让509.24万股
同花顺,2025-09-30 10:48:35.000,日本、韩国对特朗普9000亿美元投资要求持谨慎态度
同花顺,2025-09-30 10:48:34.000,亚信安全：股东权益变动触及1%刻度及5%整数倍
财联社,2025-09-30 10:47:54.000,新研究：可可补充剂展现出强大抗衰老潜力
财联社,2025-09-30 10:47:01.000,传音部分产品明年将采用高通5G移动平台
财联社,2025-09-30 10:46:51.000,军工板块异动拉升 中航沈飞涨超7%创新高
财联社,2025-09-30 10:45:39.000,广西、云南等地24条中小河流发生超警以上洪水
