来源,时间,标题
财联社,2026-03-01 18:06:07,伊朗临时领导委员会人员构成
财联社,2026-03-01 17:50:41,两连胜 中国男篮世预赛战胜中国台北队
财联社,2026-03-01 17:42:35,伊朗第一副总统要求政府在战时确保国家运行持续稳定
财联社,2026-03-01 17:40:40,伊朗最高国家安全委员会秘书：美以将遭受“从未感受过的打击”
财联社,2026-03-01 17:35:47,独家｜萝卜快跑临时暂停阿联酋境内无人驾驶服务
财联社,2026-03-01 17:35:09,中信证券：伊朗局势仍在快速变化 预计难以一次性按最终情景推测并演绎
财联社,2026-03-01 17:34:41,中信证券：预计涨价驱动的行情在3月还将持续
财联社,2026-03-01 17:29:18,沙特首都利雅得东部传来巨大爆炸声
财联社,2026-03-01 17:26:24,伊朗国家电视台大楼附近区域发生爆炸
财联社,2026-03-01 17:20:58,【风口研报·快评】一文厘清地缘冲突对化工影响几何，伊朗分别是这些化工品前五大生产/出口国，若长期断供，分析师看好产品价格上涨有望给龙头企业带来利润增厚；另有公司核心产品是一种可持续燃料的上游关键原料
财联社,2026-03-01 17:15:40,日本九州岛附近海域发生5.5级地震
财联社,2026-03-01 17:11:37,伊朗总统就最高领袖遇袭身亡发表声明 称将追究相关责任
财联社,2026-03-01 17:10:55,国投白银LOF：3月2日开市起至当日10:30停牌
财联社,2026-03-01 17:03:48,天宜新材：预重整产业投资人遴选完成 紫光通信联合体为正选
财联社,2026-03-01 17:03:37,北汽蓝谷：2月新能源车产量7631辆 同比增长16.43%
财联社,2026-03-01 16:56:54,上汽集团：前2个月整车销量59.69万辆 同比增长6.76%
财联社,2026-03-01 16:47:56,伊朗警察部队情报部门司令在美以袭击行动中遇袭身亡
财联社,2026-03-01 16:47:17,第34届华交会3月1日开幕 吸引3325家境内外企业参展
财联社,2026-03-01 16:44:57,汇宇制药：修正2025年度业绩快报 确认公允价值变动收益为-1.73亿元
财联社,2026-03-01 16:44:43,华安证券：控股股东安徽国控集团拟购买可转债并转股方式增持公司股份
财联社,2026-03-01 16:41:50,以军称首次打击伊朗首都中心地带目标
财联社,2026-03-01 16:35:43,阿曼一港口据称遭遇空袭
财联社,2026-03-01 16:33:24,海湾国家连续第二天遭袭
财联社,2026-03-01 16:32:12,美以对伊朗首都发动60起袭击致57人死亡
财联社,2026-03-01 16:25:42,艾迪药业：实控人之一、董事长傅和亮拟1000万元—1500万元增持股份
财联社,2026-03-01 16:22:32,溢多利：子公司植酸酶产品获欧盟批准注册
财联社,2026-03-01 16:20:51,【风口研报·行业】美伊冲突导致能源链上行周期加速，油轮与航运船舶板块迎来联动行情，分析师梳理受益上市公司；焦煤价格中枢或抬升至2000元/吨，这家公司坐拥5座在产矿山
财联社,2026-03-01 16:20:50,中源协和：子公司获医疗器械注册证 产品为国内首款飞行时间质谱法肿瘤伴随诊断试剂盒
财联社,2026-03-01 16:17:52,中文在线：向香港联交所递交境外上市股份（H股）发行上市申请
财联社,2026-03-01 16:17:30,3天2板中钨高新：经营发展过程中主要面临的风险包括钨价持续上涨后存在冲高回落风险以及成本压力在产业链中传导受阻的风险等
财联社,2026-03-01 16:17:28,伊朗首都德黑兰发生多起爆炸
财联社,2026-03-01 16:09:43,狮头股份：因财务资料过期 上交所中止审核公司重大资产重组
财联社,2026-03-01 16:09:09,乌官员称俄方已同意美向乌提供的安全保障条款
财联社,2026-03-01 16:06:27,杭州银行：张精科行长任职资格获监管核准
财联社,2026-03-01 16:05:22,中国天楹：正在全力推进吉林辽源、黑龙江安达两大氢基能源一体化标杆项目进程
财联社,2026-03-01 16:04:55,长城汽车：2月新能源车销售12744台
财联社,2026-03-01 16:04:11,以色列特拉维夫多栋建筑遭伊朗袭击
财联社,2026-03-01 16:02:42,《深圳经济特区河套深港科技创新合作区深圳园区条例》正式施行
财联社,2026-03-01 16:01:46,极氪2月交付新车23867辆 同比增70%
财联社,2026-03-01 15:59:50,启迪环境：股票交易异常波动 预计2025年度期末净资产可能为负值
财联社,2026-03-01 15:59:16,伊朗军方称对多处美军基地发动袭击
财联社,2026-03-01 15:56:22,华夏幸福：临时管理人公开招募重整投资人
财联社,2026-03-01 15:55:52,伊朗伊斯兰革命卫队称摧毁美军MQ-9无人机
财联社,2026-03-01 15:53:50,5天3板泰嘉股份：2025年度数据中心电源业务营收占比较小 且不涉及AI芯片业务
财联社,2026-03-01 15:46:27,7天5板章源钨业：钨产品被广泛应用于航空航天等领域 宏观经济环境将影响市场需求和钨产品价格进而影响公司经营业绩
财联社,2026-03-01 15:41:43,艾哈迈德·瓦希迪将担任伊朗伊斯兰革命卫队总司令
财联社,2026-03-01 15:36:38,7连板豫能控股：如未来股票价格进一步上涨 公司可能向深交所申请停牌核查
财联社,2026-03-01 15:31:26,蔚来：2月交付新车20797台 同比增长57.6%
财联社,2026-03-01 15:25:46,伊朗和美国代表在联合国安理会紧急会议上言辞交锋
财联社,2026-03-01 15:13:01,多家航司公布涉中东机票退改方案
财联社,2026-03-01 15:05:04,陈茂波：香港有足够预案应对中东战事带来的市场风险
财联社,2026-03-01 15:03:53,伊拉克武装组织称打击美军基地
财联社,2026-03-01 14:58:12,伊朗外长就最高领袖遇害发表声明
财联社,2026-03-01 14:55:37,伊朗最高领袖身亡后 伊拉克宣布举行三天全国哀悼
财联社,2026-03-01 14:53:34,美军乌代德空军基地方向升起浓烟
财联社,2026-03-01 14:48:54,伊朗公布部分遇害高级军官名单
财联社,2026-03-01 14:46:02,美情报机构：对伊朗发动打击前已对哈梅内伊活动轨迹进行数月追踪
财联社,2026-03-01 14:45:02,以军称过去24小时向伊朗投掷超1200枚导弹
财联社,2026-03-01 14:37:54,业内人士：中东局势或驱动甲醇价格上行
财联社,2026-03-01 14:37:12,伊朗马汉航空暂停所有航班运营
财联社,2026-03-01 14:35:04,伊朗方面确认武装部队总参谋长穆萨维身亡
财联社,2026-03-01 14:34:43,全国政协十四届四次会议新闻发布会3月3日举行
财联社,2026-03-01 14:34:12,【电报解读】多家功率半导体龙头企业集体宣布涨价，机构看好当前半导体产业已呈现“景气拉动+成本传导+供给收缩”三线并进的系统性涨价趋势，这家公司是长江存储的重要供应商
财联社,2026-03-01 14:28:47,我国最大内陆淡水湖进入新一年禁渔期
财联社,2026-03-01 14:11:31,交易商与船商纷纷避开霍尔木兹海峡
财联社,2026-03-01 14:10:09,全国政协十四届常委会第十五次会议开幕 王沪宁出席
财联社,2026-03-01 14:01:56,阿联酋迪拜杰贝阿里港冒出黑色浓烟
财联社,2026-03-01 13:59:46,伊朗官员：很快成立临时领导委员会 选举最高领袖
财联社,2026-03-01 13:58:55,全球大量投资者告别美国 高盛：美股创30多年来最差开局
财联社,2026-03-01 13:57:18,伊朗军方称对美以目标发动大规模无人机袭击
财联社,2026-03-01 13:47:45,伊朗最高领袖顾问：伊朗临时领导委员会将于3月1日成立
财联社,2026-03-01 13:42:49,伊朗最高领袖顾问：伊朗局势依然稳定
财联社,2026-03-01 13:33:41,伊朗议会议长：已为哈梅内伊殉难后的阶段制定预案
财联社,2026-03-01 13:31:11,伊朗民众举行集会悼念哈梅内伊
财联社,2026-03-01 13:24:38,特朗普：若伊朗进行报复 将对伊朗发动打击
财联社,2026-03-01 13:24:38,特朗普：若伊朗发动猛烈行动 美将以“前所未见的强大力量”回击
财联社,2026-03-01 13:21:14,【研选】油运市场延续强势，VLCC即期运价创近六年新高，造船市场景气度拐点已显；公司以“光棒-光纤-光缆”等网络基础通信产品为根基，精准卡位AI算力光芯片与可控核聚变超导材料赛道
财联社,2026-03-01 13:05:03,最新卫星图公布 显示哈梅内伊住所遭袭的前后对比景象
财联社,2026-03-01 12:54:18,苏州市智能算力产业创新中心正式成立
财联社,2026-03-01 12:49:48,伊朗伊斯兰革命卫队发布6号公告 袭击27处美军基地
财联社,2026-03-01 12:48:52,卡塔尔首都西南方向遭导弹袭击
财联社,2026-03-01 12:47:38,5省区国省干线50个路段因降雪封闭管控
财联社,2026-03-01 12:45:43,印度马哈拉施特拉邦爆炸造成至少15人死亡
财联社,2026-03-01 12:45:43,中西合作确认欧洲首例侏罗纪蜥蜴行迹
财联社,2026-03-01 12:45:03,阿联酋迪拜再次传出爆炸声
财联社,2026-03-01 12:39:31,内塔尼亚胡称打伊朗需多久就持续多久
财联社,2026-03-01 12:34:35,伊朗导弹击中以军总参谋部
财联社,2026-03-01 12:29:31,伊朗再对美以基地发动大规模袭击
财联社,2026-03-01 12:24:03,以军称完成对伊朗新一轮空袭 袭击约30个目标
财联社,2026-03-01 12:17:29,迪拜多处建筑遭袭
财联社,2026-03-01 12:16:48,韩国2月份半导体出口额同比增长160.8% 刷新历史纪录
财联社,2026-03-01 12:16:35,国际足联希望所有球队安全参加世界杯
财联社,2026-03-01 12:04:58,特朗普宣称外交解决伊朗问题将“比以前容易得多”
财联社,2026-03-01 12:03:33,江苏省扬州市政协副主席殷旭东接受监察调查
财联社,2026-03-01 12:02:40,外交部：提醒在伊朗中国公民尽快撤离
财联社,2026-03-01 11:57:55,美军称伊朗已收到警告
财联社,2026-03-01 11:51:10,伊朗称未研制能打到美国的导弹
财联社,2026-03-01 11:46:43,伊朗对美军基地发起袭击
财联社,2026-03-01 11:39:08,2026年汽车“国补”配套细则已在全国落地
财联社,2026-03-01 11:35:41,巴克莱：美伊紧张局势下 布伦特原油或涨至80美元/桶
财联社,2026-03-01 11:28:14,切断霍尔木兹海峡后会发生什么？专家：布伦特原油可能率先突破80美元
财联社,2026-03-01 11:12:20,伊朗伊斯兰革命卫队总司令等高官在美以袭击中身亡
财联社,2026-03-01 11:11:40,伊朗政府就哈梅内伊殉职发表声明
财联社,2026-03-01 11:02:55,美方宣布发动新一轮打击
财联社,2026-03-01 10:56:33,多国谴责美以袭击伊朗
财联社,2026-03-01 10:54:11,五角大楼称美军12小时内对伊朗发动900次空袭
财联社,2026-03-01 10:47:05,中国学者领衔提出规范使用抗菌药物的数字化方案
财联社,2026-03-01 10:40:19,“雪龙”号靠港澳大利亚霍巴特 105名考察队员将转机回国
财联社,2026-03-01 10:36:20,伊朗方面称哈梅内伊“在工作岗位上殉职”
财联社,2026-03-01 10:29:43,以军说打击伊朗西部和中部30多个目标
财联社,2026-03-01 10:27:37,伊朗伊斯兰革命卫队就哈梅内伊殉职发表声明
财联社,2026-03-01 10:25:09,伊朗防空系统密集启动空中浓烟滚滚
财联社,2026-03-01 10:24:23,伊朗称将开启最猛烈进攻
财联社,2026-03-01 10:23:25,据称伊朗防长等约40名伊朗官员在袭击中死亡
财联社,2026-03-01 10:17:08,2026年大学生志愿服务西部计划报名开启
财联社,2026-03-01 10:06:09,理想汽车：2月交付新车26421辆
同花顺,2026-03-01 10:02:32,03月01日晚间公告集锦：豫能控股发布股票交易严重异常波动公告
财联社,2026-03-01 09:59:49,美官员：美以在哈梅内伊与其高级助手举行会议时发动袭击
同花顺,2026-03-01 09:59:07,伊朗宣布阿里礼萨·阿拉菲为宪法监护委员会选出的法学家
同花顺,2026-03-01 09:53:43,以色列宣称打死40名伊朗军事指挥官
同花顺,2026-03-01 09:48:43,南水北调工程结束冰期输水 中线工程输水16.48亿立方米
财联社,2026-03-01 09:44:06,全国政协会议议程今日发布
财联社,2026-03-01 09:40:26,伊朗政府宣布40天全国哀悼
同花顺,2026-03-01 09:36:14,萝卜快跑临时暂停阿联酋境内无人驾驶服务
同花顺,2026-03-01 09:30:52,国际能源署（IEA）称，正密切关注中东局势及其对全球油气市场和贸易流动的潜在影响
财联社,2026-03-01 09:30:47,伊朗最高领袖哈梅内伊遇袭身亡
财联社,2026-03-01 09:24:52,零跑汽车：2月交付28067台
财联社,2026-03-01 09:21:38,阿富汗首都喀布尔传出爆炸声
财联社,2026-03-01 09:17:25,分析认为全球能源供应将被扰乱
同花顺,2026-03-01 09:16:14,日本九州岛附近海域发生5.5级地震，震源深度130千米
财联社,2026-03-01 09:11:27,伊朗反击首日以色列1人死121人伤
财联社,2026-03-01 09:10:16,美国或放弃让伊朗国王之子巴列维上位
财联社,2026-03-01 09:06:34,泰国黄金交易限制措施生效 当局力图遏制泰铢升值
财联社,2026-03-01 09:01:10,中国裁判组将执裁女足亚洲杯揭幕战
同花顺,2026-03-01 08:57:59,北汽蓝谷：2月新能源车产量7631辆，同比增长16.43%
同花顺,2026-03-01 08:57:33,上汽集团：前2月整车销量59.69万辆，同比增长6.76%
财联社,2026-03-01 08:55:15,艾迪精密：数控切削类产品价格3月1日起大幅上调
财联社,2026-03-01 08:53:46,我国海上油田首次实现无人机规模化作业
同花顺,2026-03-01 08:48:25,全社会跨区域人员流动量完成2.19亿人次
同花顺,2026-03-01 08:42:10,华安证券：安徽国控集团拟增持不超过2%
同花顺,2026-03-01 08:40:27,阿曼沿海油轮遭袭击
财联社,2026-03-01 08:36:50,国际原子能机构理事会将于2日召开关于伊朗的特别会议
财联社,2026-03-01 08:35:10,伊朗首都德黑兰传出巨大爆炸声
财联社,2026-03-01 08:33:32,哈梅内伊四位亲属据称在袭击中身亡
同花顺,2026-03-01 08:33:13,德黑兰红新月会：美国和以色列对伊朗发动军事打击以来，在首都德黑兰共发动60起袭击，造成57人死亡
财联社,2026-03-01 08:32:12,以军称对伊朗导弹发射装置和防空系统发动新一轮打击
同花顺,2026-03-01 08:30:21,汇宇制药：修正2025年度业绩快报，确认公允价值变动收益为-1.73亿元
财联社,2026-03-01 08:29:39,北方多地将现较强降雪 江南华南降雨频繁部分地区有暴雨
财联社,2026-03-01 08:28:36,伊拉克民兵武装对伊拉克及其周边地区美方目标发动无人机袭击
财联社,2026-03-01 08:27:54,我国首个省级光热专项支持性政策出台
同花顺,2026-03-01 08:22:31,艾迪药业：公司实际控制人之一、董事长傅和亮拟1000.00万元—1500.00万元增持股份
同花顺,2026-03-01 08:21:53,两部门部署加强常态化防止返贫致贫就业帮扶
同花顺,2026-03-01 08:18:54,中源协和：子公司获医疗器械注册证，产品为国内首款飞行时间质谱法肿瘤伴随诊断试剂盒
同花顺,2026-03-01 08:16:43,特斯拉：将Cybertruck双电机全轮驱动版售价提高至69990美元
同花顺,2026-03-01 08:14:01,特拉维夫多处建筑遭袭 相关区域实施严格管制
财联社,2026-03-01 08:11:15,DDR4价格已连续11个月上涨
财联社,2026-03-01 08:09:53,伊朗导弹击中以色列中部1死20伤
财联社,2026-03-01 08:08:26,章源钨业：3月1日起调整硬质合金产品价格
财联社,2026-03-01 08:07:02,境外黑客攻击某电商平台数据库窃取敏感信息 数据托管背后暗藏国家安全风险
同花顺,2026-03-01 08:06:06,小鹏汽车：2月共交付新车15256台
同花顺,2026-03-01 08:04:00,埃及主要股指早盘下跌5.44%
同花顺,2026-03-01 07:59:13,长城汽车：2月销量为72594台
同花顺,2026-03-01 07:58:20,极氪：2月交付新车23867辆
同花顺,2026-03-01 07:57:01,泰嘉股份：2025年度数据中心电源业务营收占比较小 且不涉及AI芯片业务
财联社,2026-03-01 07:57:01,美能源部官员：美国不打算从战略储备中释放石油
财联社,2026-03-01 07:55:18,阿布扎比机场遭袭多人死伤
同花顺,2026-03-01 07:54:53,巴基斯坦抗议活动致6人死亡
同花顺,2026-03-01 07:54:17,中钨高新：无应披露未披露重大事项 市盈率显著高于行业水平
同花顺,2026-03-01 07:50:59,消息称欧佩克+或考虑将石油产量提高超13.7万桶/日
同花顺,2026-03-01 07:50:18,7天5板章源钨业异动公告：宏观经济环境将影响市场需求和钨产品价格进而影响公司经营业绩
财联社,2026-03-01 07:45:05,伊朗南部一体育馆遭空袭 20名女排球员丧生
同花顺,2026-03-01 07:44:26,天成自控：天成自控关于子公司收到客户项目定点通知的公告
同花顺,2026-03-01 07:42:15,伊朗将领空关闭时间延长至当地时间3月3日中午12时
同花顺,2026-03-01 07:38:47,宗馥莉砍掉娃哈哈机器人业务，精机公司解散清算
同花顺,2026-03-01 07:38:39,豫能控股：股票交易严重异常波动，如未来股票价格进一步上涨 公司可能向深交所申请停牌核查
同花顺,2026-03-01 07:15:49,卡塔尔多哈西南方遭新一轮导弹袭击
同花顺,2026-03-01 07:15:24,多国及国际组织谴责美以军事行动 呼吁恢复对话
同花顺,2026-03-01 07:12:40,沙特阿拉伯股市指数（TASI）目前下跌2%
同花顺,2026-03-01 07:08:16,英伟达与全球电信巨头携手，致力于在开放、安全的原生AI平台上构建6G网络
同花顺,2026-03-01 07:05:16,文远知行暂时停运阿联酋迪拜Robotaxi车队
同花顺,2026-03-01 07:02:35,沙特阿拉伯主要股指早盘下跌4.6%
财联社,2026-03-01 07:00:21,以军称已完成对伊朗新一轮空袭
同花顺,2026-03-01 06:58:39,在伊经营酒店华人关店并撤离
财联社,2026-03-01 06:52:19,伊朗足协主席：美国袭击后 很难期待世界杯了
财联社,2026-03-01 06:49:26,以色列最南端城市埃拉特响起防空警报
同花顺,2026-03-01 06:48:55,伊朗方面确认武装部队总参谋长、防长等高级将领遇袭身亡
财联社,2026-03-01 06:38:43,阿联酋应对137枚导弹209架无人机袭击
同花顺,2026-03-01 06:33:50,伊朗电视台：伊朗武装部队总参谋长阿卜杜勒拉希姆·穆萨维遇害
财联社,2026-03-01 06:29:27,中方呼吁立即停止军事行动 防止中东局势轮番升级
同花顺,2026-03-01 06:28:29,迪拜接连传出爆炸声，导弹降落城区
财联社,2026-03-01 06:23:42,昨夜今晨美以袭击伊朗事件进展：以方宣布哈梅内伊死讯，特朗普“证实”，伊朗外交部否认；美军称其无伤亡报告；霍尔木兹海峡关闭
同花顺,2026-03-01 06:05:11,周末要闻回顾：2025年沪深交易所A股累计筹资12583亿元
同花顺,2026-03-01 05:36:01,阿富汗首都遭空袭发生连续爆炸
同花顺,2026-03-01 05:34:29,伊拉克境内美军基地上空冒出浓烟
同花顺,2026-03-01 05:25:28,特朗普：伊朗刚刚宣称今天将发动前所未有的猛烈打击，他们最好不要这么做
同花顺,2026-03-01 05:13:46,伊朗总统等3人将临时代行最高领袖职权
同花顺,2026-03-01 05:08:30,伊朗最高国家安全委员会秘书阿里·拉里贾尼预计很快将发表声明
同花顺,2026-03-01 05:08:21,伊朗一小学遭导弹袭击 已致148死95伤
同花顺,2026-03-01 05:03:04,以军称打击伊朗西部和中部约30个目标
同花顺,2026-03-01 04:51:41,伊朗伊斯兰革命卫队：已袭击27个美军基地和以军总司令部等地
同花顺,2026-03-01 04:49:18,伊朗伊斯兰革命卫队发布6号公告
同花顺,2026-03-01 04:38:18,以色列中部、耶路撒冷及约旦河西岸启动红色警报
同花顺,2026-03-01 04:27:32,迪拜再次传出爆炸声
同花顺,2026-03-01 04:08:38,美以开打伊朗 中东航班大乱
同花顺,2026-03-01 04:04:13,全球多地举行示威活动 抗议美以军事打击伊朗
同花顺,2026-03-01 04:02:46,外交部和中国驻伊朗使领馆提醒在伊朗中国公民尽快撤离
同花顺,2026-03-01 03:59:36,加密货币交易平台Coinbase部分用户交易可能遇到延迟或性能下降
同花顺,2026-03-01 03:56:13,俄谴责美以空袭伊朗 呼吁回归外交途径
同花顺,2026-03-01 03:53:55,摩根大通预警：400亿至1500亿美元美国CLO贷款面临人工智能冲击
同花顺,2026-03-01 03:51:21,拓竹科技全面下架泡泡玛特热门模型
同花顺,2026-03-01 03:46:14,伊朗对伊拉克北部美军基地发起袭击
同花顺,2026-03-01 03:46:00,迪拜机场酒店受波及 阿联酋拦截数百次导弹和无人机袭击
同花顺,2026-03-01 02:56:46,韩国产业部表示，若供应中断，计划向业界提供石油储备
同花顺,2026-03-01 02:40:11,全军启用预备役人员证
同花顺,2026-03-01 02:27:46,2026年春风行动暨就业援助季活动已发布岗位1300多万个
同花顺,2026-03-01 02:26:10,伊朗防空系统密集启动 空中浓烟滚滚
同花顺,2026-03-01 02:24:11,伊朗伊斯兰革命卫队：“历史上最猛烈的进攻行动”即将开始
同花顺,2026-03-01 02:23:16,美媒称伊朗防长等约40名伊朗官员在袭击中死亡
同花顺,2026-03-01 02:17:26,伊朗媒体说哈梅内伊“在工作岗位上殉职”
同花顺,2026-03-01 02:16:44,德黑兰东北部传出爆炸声 防空系统已启动
同花顺,2026-03-01 02:06:18,2月理想汽车交付新车26421辆
同花顺,2026-03-01 02:05:40,青海海西州唐古拉地区发生3.4级地震，震源深度10千米
同花顺,2026-03-01 02:04:13,比特币升破68000美元，日内涨1.55%
同花顺,2026-03-01 02:04:05,伊朗伊斯法罕传出巨大爆炸声
同花顺,2026-03-01 01:58:14,伊朗伊斯兰革命卫队：哈梅内伊遇刺将更加坚定我们继承其遗志的决心
同花顺,2026-03-01 01:51:19,日本外相参加七国集团外长电话会议 就伊朗局势交换信息
同花顺,2026-03-01 01:31:01,伊媒体称伊朗最高领袖哈梅内伊遇害
同花顺,2026-03-01 01:20:36,全国铁路今天预计发送旅客1675万人次
同花顺,2026-03-01 01:10:58,伊朗反击首日 以色列1人死121人伤
同花顺,2026-03-01 01:09:10,外媒爆料：美军在对伊朗军事打击的前12个小时内发动近900次袭击
同花顺,2026-03-01 00:36:28,国际原子能机构理事会将于3月2日召开关于伊朗的特别会议
同花顺,2026-03-01 00:11:57,小米汽车2月份交付量超过20000台
同花顺,2026-03-01 00:09:03,美国高官声称，伊朗计划先发制人发射导弹，特朗普“被迫”采取行动
同花顺,2026-03-01 00:00:56,数据托管背后暗藏国家安全风险
同花顺,2026-03-01 00:00:01,伊朗民众在德黑兰举行集会 谴责美以袭击
同花顺,2026-02-28 23:55:58,以军称伊朗向以色列发射新一轮导弹
同花顺,2026-02-28 23:55:07,阿联酋阿布扎比扎耶德国际机场遭袭 致一名亚洲公民死亡
同花顺,2026-02-28 23:55:00,新华社评美以打击伊朗：穷兵黩武带不来真正的安全
同花顺,2026-02-28 23:53:11,美国国防部长赫格赛思：伊朗有机会但拒绝达成协议
同花顺,2026-02-28 23:49:50,伊朗导弹袭击再次击中巴林
同花顺,2026-02-28 23:42:42,迪拜国际机场航站楼遭到袭击
同花顺,2026-02-28 23:40:23,特朗普称伊朗最高领袖哈梅内伊已身亡
同花顺,2026-02-28 23:40:16,古特雷斯在安理会伊朗局势紧急会议上呼吁立即停火 重返谈判
同花顺,2026-02-28 23:40:01,多位美国民主党人士批评特朗普政府对伊朗发动空袭
同花顺,2026-02-28 15:01:02,阿富汗首都市中心响起爆炸声
同花顺,2026-02-28 14:59:49,以军称完成对伊朗战略防御系统大范围打击
同花顺,2026-02-28 14:57:45,伊朗针对美军基地的新一轮导弹攻击已经开始
