来源,时间,标题
同花顺,2026-03-13 08:01:07,美股中概股盘前涨跌互现，理想汽车跌1%
同花顺,2026-03-13 08:01:03,PayPay美股盘前涨超10%
财联社,2026-03-13 08:00:25,财联社3月13日早间新闻精选
同花顺,2026-03-13 08:00:19,奥多比美股盘前跌超8%
财联社,2026-03-13 07:50:11,“养虾热”带火Mac mini 华强北多个销售档口已断货
财联社,2026-03-13 07:49:17,【点金互动易】算电协同+虚拟电厂，这家公司通过共建虚拟电厂调度实现算力跨省快速转移，探索算电协同规模化落地
财联社,2026-03-13 07:48:15,芯片行业景气推升税收 韩国或可追加20万亿韩元
财联社,2026-03-13 07:44:00,港股市场年内回购金额合计已超过200亿港元
财联社,2026-03-13 07:43:25,海南自贸港正式落地向境外投资者销售公募基金业务
财联社,2026-03-13 07:37:31,美国颁发许可证 允许部分俄罗斯石油销售
同花顺,2026-03-13 07:20:49,东航春运期间累计运输旅客1815万人次，同比增长4.1%
同花顺,2026-03-13 07:19:01,创历史纪录，全国首个春运超过千万旅客的机场来了
同花顺,2026-03-13 07:18:06,作为预防性措施，阿曼苏哈尔港暂停运营
同花顺,2026-03-13 07:16:36,现货白银失守82美元/盎司
同花顺,2026-03-13 07:13:04,上期所贵金属及有色金属仓单日报：铜仓单减少，白银增加
同花顺,2026-03-13 07:11:20,美议员要求防长因伊朗小学遭袭辞职
财联社,2026-03-13 07:07:35,伊朗称抵抗组织击落美军加油机
同花顺,2026-03-13 07:06:01,美元指数DXY重回100大关，为去年11月以来首次
同花顺,2026-03-13 07:05:13,俄罗斯卢布兑美元跌破80大关，为自1月9日以来首次
财联社,2026-03-13 07:04:34,我国成功发射试验三十号卫星03、04星
同花顺,2026-03-13 07:02:24,中国人民银行召开2026年宣传思想文化和群团工作会议
同花顺,2026-03-13 07:01:36,ETF收评：深价值ETF交银领涨4.23%，机床ETF领跌3.96%
同花顺,2026-03-13 07:01:32,ETF两市成交额5229.26亿元
同花顺,2026-03-13 07:00:52,A股收评：沪指震荡下挫跌0.81%，稀有金属、算力租赁板块集体走弱
同花顺,2026-03-13 07:00:51,股指期货午盘收盘 主力合约集体收跌
财联社,2026-03-13 06:58:53,加拿大将斥资近350亿加元加强北部防御
财联社,2026-03-13 06:53:41,【研选】煤炭作为能源压舱石的地位有望进一步巩固，煤价弹性较强的企业有望率先受益；分析师看好这家创新型生物制药企业2026年加入全球肿瘤一线竞争阵营，迎来新一轮增长起点
同花顺,2026-03-13 06:53:30,中国代表：美国是伊核危机的始作俑者
财联社,2026-03-13 06:52:00,供应链开始出现波动 韩国芯片巨头急查氦气库存
同花顺,2026-03-13 06:48:13,泡泡玛特起诉拓竹4月初开庭，知情人士：拓竹正寻求和解、合作
财联社,2026-03-13 06:43:22,以军袭击贝鲁特和黎南部 本轮冲突已致黎巴嫩687人死亡
财联社,2026-03-13 06:22:46,开年“补血忙” 中小银行增资扩股潮再起
财联社,2026-03-13 06:12:30,美联储3月维持利率不变的概率为99.1%
同花顺,2026-03-13 06:12:24,长三角地区首台“华龙一号”核电机组并网成功
同花顺,2026-03-13 06:11:19,大商所苯乙烯主力合约大跌6% WTI原油跌超1%
同花顺,2026-03-13 06:10:59,大商所苯乙烯主力合约大跌5%
同花顺,2026-03-13 06:10:42,上期所欧线集运主力合约大跌8%
财联社,2026-03-13 06:06:54,周五（3月13日）重点关注财经事件和经济数据
财联社,2026-03-13 06:05:28,伊朗副外长：允许部分国家船只通过霍尔木兹海峡
同花顺,2026-03-13 06:05:02,脑机接口板块快速拉升，创新医疗涨停
财联社,2026-03-13 06:00:00,周五你需要知道的隔夜全球要闻：美军加油机在伊拉克坠毁，伊朗最高领袖说继续关闭霍尔木兹海峡，布油结算价自2022年8月以来首次突破100美元/桶
同花顺,2026-03-13 05:57:41,土耳其南部因吉尔利克美军基地响起防空警报
同花顺,2026-03-13 05:57:32,欧阳明高：未来五年新能源汽车将有全过程安全、全自动驾驶、全固态电池等七大技术方向
财联社,2026-03-13 05:54:41,美军加油机在伊拉克坠毁
同花顺,2026-03-13 05:54:25,海关总署广东分署：今年前两月，广东外贸继续稳中有进，顺利实现“开门红”
财联社,2026-03-13 05:53:20,以军对黎巴嫩真主党基础设施完成多轮空袭
同花顺,2026-03-13 05:51:33,商务部：美方以“产能过剩”为由发起301调查是单边主义行径
财联社,2026-03-13 05:45:29,我国成功发射卫星互联网低轨20组卫星
同花顺,2026-03-13 05:44:46,上期所沪银主力合约跌超2%，广期所铂主力合约跌超2%
同花顺,2026-03-13 05:42:37,英特尔近期面临CPU供应紧缩问题
同花顺,2026-03-13 05:40:16,美国豁免令或将允许购买1900万桶俄罗斯石油
同花顺,2026-03-13 05:39:26,金银偏弱，建议继续做空白银波动率
财联社,2026-03-13 05:38:25,机构：战略石油储备可能需要数周才能运抵目的地
同花顺,2026-03-13 05:37:34,PCB概念股局部走高，亨通股份触及涨停
同花顺,2026-03-13 05:34:30,上期所欧线集运主力合约大跌7%
同花顺,2026-03-13 05:32:04,以军称一天内空袭伊朗中西部超200处目标
同花顺,2026-03-13 05:31:26,国际资本再评估蚂蚁：已度过关键调整期，业务重回增长轨道
同花顺,2026-03-13 05:16:52,小金属板块震荡走弱，中钨高新逼近跌停
同花顺,2026-03-13 05:10:49,刘国梁卸任WTT董事会主席
同花顺,2026-03-13 05:10:24,高盛：预计布伦特原油价格在3月均价将超过每桶100美元
财联社,2026-03-13 05:10:10,美国弗吉尼亚州一大学枪击事件已致2死2伤 枪手曾因涉恐受刑
同花顺,2026-03-13 05:09:46,电网设备板块局部走低，顺钠股份触及跌停
财联社,2026-03-13 05:07:31,以军称打击伊朗巴斯基民兵目标
同花顺,2026-03-13 05:06:52,银行板块震荡上扬，重庆银行等股涨超2%
财联社,2026-03-13 05:06:21,伊斯兰革命卫队官员：已摧毁七成美在中东地区基地和指挥部
同花顺,2026-03-13 05:04:23,俄外交部：美以军事行动破坏了整个中东的稳定
同花顺,2026-03-13 05:03:56,土耳其南部美军基地响起防空警报
同花顺,2026-03-13 05:00:26,OpenClaw走红 展示AI智能体潜力与风险
财联社,2026-03-13 04:59:22,国际油价12日大幅上涨
同花顺,2026-03-13 04:54:31,紫金矿业、厦门国资等成立股权投资基金
同花顺,2026-03-13 04:53:49,泰国副总理：已准备好从俄罗斯购买石油
财联社,2026-03-13 04:47:54,秘鲁多地因暴雨进入60天紧急状态
同花顺,2026-03-13 04:37:28,水利部、市场监管总局联合印发《合同节水管理项目服务合同（示范文本）》
财联社,2026-03-13 04:35:14,以色列总理威胁刺杀伊朗新最高领袖
同花顺,2026-03-13 04:31:51,日元兑美元自2024年7月以来首次跌破159.45
同花顺,2026-03-13 04:21:14,京津冀定制快巴新增京雄通勤线路 16日开通运营
同花顺,2026-03-13 04:19:49,腾讯出行接入两家广州自动驾驶公司Robotaxi服务
同花顺,2026-03-13 04:19:03,俄罗斯谴责美方所谓“接管”古巴言论
财联社,2026-03-13 04:18:54,美以速战速决计划落空持久战承压
同花顺,2026-03-13 04:15:32,RELX悦刻公布2025打假数据：协助打假489起，涉案金额超7000万
同花顺,2026-03-13 04:15:07,赫力昂在上海临港建设中国首个口腔健康产品生产基地
同花顺,2026-03-13 04:14:45,网易回应苹果佣金下调
同花顺,2026-03-13 04:14:20,大晓机器人开源实时生成世界模型Kairos 3.0-4B
同花顺,2026-03-13 04:10:40,香港交易所提议降低不同投票权股票上市的市值门槛
财联社,2026-03-13 04:09:11,Adobe第一财季营收64亿美元
同花顺,2026-03-13 04:02:35,3月13日午间公告一览：广济药业全资子公司济康公司通过协议方式收购长江广济公司49%股权
同花顺,2026-03-13 04:01:10,港股午评：恒生指数跌0.48%，恒生科技指数跌0.41%
财联社,2026-03-13 04:00:59,利弗莫尔中概股龙头指数收跌2.18%
财联社,2026-03-13 04:00:34,美股三大指数集体收跌 芯片股普跌
财联社,2026-03-13 03:59:19,伊朗公布袭击美军基地卫星图像
同花顺,2026-03-13 03:51:51,阿里巴巴公布新专利 可提升模型的推理能力
财联社,2026-03-13 03:50:14,俄外交部：全球治理倡议对构建多极世界秩序具有重要意义
同花顺,2026-03-13 03:47:52,阿布扎比国家石油公司本月减少陆上合作伙伴约五分之一的原油供应量
财联社,2026-03-13 03:46:44,以总理内塔尼亚胡：黎真主党将付出沉重代价
同花顺,2026-03-13 03:44:58,韩国称考虑发放能源补贴券 并提高核电和燃煤发电量
同花顺,2026-03-13 03:42:42,恒大集团等被恢复执行21.2亿
财联社,2026-03-13 03:39:39,美官员称在伊拉克的美军人员未出现重大伤亡
同花顺,2026-03-13 03:32:51,以色列总理内塔尼亚胡称正“粉碎”伊朗政权，袭击伊核科学家
同花顺,2026-03-13 03:32:17,ETF午评：豆粕ETF领涨4.44%，巴西ETF易方达领跌3.11%
同花顺,2026-03-13 03:32:11,ETF两市成交额3678.73亿元
同花顺,2026-03-13 03:30:47,A股午评：创业板指半日微跌，风电、化工板块涨幅居前
同花顺,2026-03-13 03:26:55,沪深京三市成交额超1.5万亿元，较上日此时缩量847亿元
财联社,2026-03-13 03:24:43,伊朗武装部队：任何攻击伊能源设施和港口的行为都将遭到毁灭性回击
同花顺,2026-03-13 03:18:29,朝中社：日本推动军国主义复活将触碰“红线”
同花顺,2026-03-13 03:18:03,SC原油主力合约日内暴涨8.00%，现报769.40元/桶
财联社,2026-03-13 03:09:50,以军称对伊朗首都基础设施进行大规模攻击
同花顺,2026-03-13 03:07:57,黄金点评：海外降息预期调整，油涨金跌持续到何时？
同花顺,2026-03-13 03:07:54,郑商所菜粕主力合约大涨5%
同花顺,2026-03-13 03:07:09,雷军回应2年交付超60万辆车
同花顺,2026-03-13 02:57:42,四川局组织召开辖区商业不动产REITs试点推进工作会
同花顺,2026-03-13 02:51:24,内塔尼亚胡称正“粉碎”伊朗政权 袭击伊核科学家
财联社,2026-03-13 02:50:56,伊朗首都德黑兰传出爆炸声 防空系统启动
同花顺,2026-03-13 02:49:58,美国土安全部“停摆”近一月参议院拨款法案再受挫
同花顺,2026-03-13 02:48:21,龙芯中科与中国长城互联网信息中心达成战略合作
同花顺,2026-03-13 02:45:49,可控核聚变板块短线拉升，兰石重装涨停
同花顺,2026-03-13 02:45:00,字节跳动在乌兰察布成立新科技公司 注册资本16亿
同花顺,2026-03-13 02:43:26,伊拉克民兵武装称袭击两架美军加油机
同花顺,2026-03-13 02:42:33,国家认监委：截至去年底我国共颁发有效认证证书438万余张
同花顺,2026-03-13 02:42:24,中东冲突已致伊朗等国410万人流离失所
同花顺,2026-03-13 02:41:50,港股耀才证券金融盘中涨超30%
同花顺,2026-03-13 02:41:45,文远知行与腾讯云深化合作 微信可呼叫Robotaxi
同花顺,2026-03-13 02:41:27,郑商所瓶片主力合约大涨6%
同花顺,2026-03-13 02:38:05,沪深京三市成交额超1.2万亿元，较上日此时缩量327亿元
财联社,2026-03-13 02:37:50,西班牙外交大臣：美方对西班牙采取任何行动都“毫无意义”
同花顺,2026-03-13 02:36:37,腾讯：苹果调整中国区App Store佣金政策，行业迎来更开放平台环境
同花顺,2026-03-13 02:34:02,存储芯片板块震荡回升，大为股份涨停
同花顺,2026-03-13 02:32:58,南向资金净买入超30亿港元
财联社,2026-03-13 02:26:17,美国一犹太会堂发生枪击
财联社,2026-03-13 02:24:50,伊朗宣布设立“全国团结周”
同花顺,2026-03-13 02:24:35,总量再上新台阶 2025年我国海洋生产总值超11万亿元
同花顺,2026-03-13 02:24:03,同比增长近40% 春运期间海南离岛免税购物金额近75亿元
财联社,2026-03-13 02:21:32,伊朗军方称“精确打击”美海军第五舰队位于巴林的总部
财联社,2026-03-13 02:19:59,英驻伊拉克部队击落伊朗无人机 残骸坠落致多名美军受伤
财联社,2026-03-13 01:57:51,LME期铜收跌42美元
财联社,2026-03-13 01:42:50,利比亚民族统一政府进行内阁改组
财联社,2026-03-13 01:42:11,联合国：伊朗已有约320万人因冲突流离失所
同花顺,2026-03-13 01:35:10,太力科技：公司TPE材料尚未应用于机器人皮肤相关场景
同花顺,2026-03-13 01:34:59,农药、化肥板块拉升，潞化科技2连板
同花顺,2026-03-13 01:33:13,电池产业链盘初拉升，中科电气涨超10%
同花顺,2026-03-13 01:30:08,经济日报：稳住股市的决心就是信心
财联社,2026-03-13 01:29:31,拉夫罗夫与古巴外长通电话 重申俄方反对美对古经济政治施压
财联社,2026-03-13 01:28:55,伊朗外交部发言人：美军基地已成地区不稳定因素
同花顺,2026-03-13 01:28:13,ETF开盘：沪港深500ETF易方达领涨9.89%，巴西ETF易方达领跌2.86%
同花顺,2026-03-13 01:26:39,煤炭板块高开，郑州煤电涨停
同花顺,2026-03-13 01:25:56,加拿大宣布拨款350亿加元用于北部地区国防和基础设施建设
同花顺,2026-03-13 01:22:13,深南电路：将持续关注大宗商品价格变化及上游原材料价格传导情况
同花顺,2026-03-13 01:22:07,理想汽车-W低开1.71%
同花顺,2026-03-13 01:21:56,上一交易日ETF两市融资融券余额1177.79亿元
同花顺,2026-03-13 01:21:05,央行开展375亿元7天期逆回购操作
同花顺,2026-03-13 01:20:58,港股开盘：恒生指数低开0.52%，恒生科技指数低开0.42%
同花顺,2026-03-13 01:20:37,高盛下调美国经济增长预期
同花顺,2026-03-13 01:19:47,Meta在Facebook Marketplace推出AI驱动新功能
同花顺,2026-03-13 01:15:22,人民币兑美元中间价报6.9007，较上日调低48点
同花顺,2026-03-13 01:13:40,小米官宣：新一代小米SU7本月即将正式发布
财联社,2026-03-13 01:01:58,氧化铝夜盘收涨0.17%
财联社,2026-03-13 01:01:18,俄向伊朗提供人道主义援助
财联社,2026-03-13 00:45:49,伊朗称特朗普几条推文结束不了战争
财联社,2026-03-13 00:28:44,美国抵押贷款利率创11个月来最大涨幅 伊朗战争引发通胀忧虑
财联社,2026-03-13 00:27:10,伊朗武装部队誓言卫国至最后一滴血
财联社,2026-03-13 00:18:35,美国弗吉尼亚州一大学发生枪击 一名枪手死亡
同花顺,2026-03-13 00:16:45,美国国土安全部“停摆”近一月 参议院拨款法案再受挫
同花顺,2026-03-13 00:16:37,美国ITC推翻美国商务部裁定，将不对进口自中国的活性阳极材料征收双反关税
财联社,2026-03-13 00:14:49,涨价范围扩大 全国多地通知上调水泥价格
财联社,2026-03-13 00:10:04,伊朗最高领袖穆杰塔巴·哈梅内伊发布个人照片
同花顺,2026-03-13 00:09:05,期货早报：国际原油大涨超10%！伊朗新领袖称或封锁霍尔木兹海峡
财联社,2026-03-13 00:08:41,美以伊战火冲击全球化肥供应链
同花顺,2026-03-13 00:05:07,日经225指数跌幅扩大，现跌2.0%
同花顺,2026-03-13 00:04:40,迪士尼任命Paul Roeder为首席传播官
同花顺,2026-03-13 00:04:33,脑机接口独角兽阶梯医疗完成5亿元融资
同花顺,2026-03-13 00:00:26,推进跨省秒调阅 全国医保影像索引已上传3.49亿条
财联社,2026-03-13 00:00:03,为绕开霍尔木兹海峡 沙特抢租闲置油轮
同花顺,2026-03-12 23:59:58,我国第二部“法典”命名法律通过 强化生态保护
财联社,2026-03-12 23:59:51,科创成长层首批6家企业将摘“U”出层
同花顺,2026-03-12 23:58:07,公募自购热情高涨 权益基金成布局重点
同花顺,2026-03-12 23:56:34,超额收益显著分化 私募量化指增策略面临考验
同花顺,2026-03-12 23:56:14,与“三医”联动 商业健康保险释放加速发展信号
同花顺,2026-03-12 23:56:09,芝商所警告：若美国政府介入石油期货市场将引发史诗级灾难
同花顺,2026-03-12 23:54:11,清华经管金融系主任朱英姿：财政和货币政策协同关键在于目标一致、工具互补、传导顺畅
财联社,2026-03-12 23:52:32,以军方称在黎境内打死伊朗民兵组织指挥官
同花顺,2026-03-12 23:52:17,现货黄金站上5100美元/盎司
同花顺,2026-03-12 23:50:59,清华经管党委副书记刘庆：“4.5%—5%”释放宏观经济治理范式转变信号
同花顺,2026-03-12 23:47:00,早盘交易中，日本日经平均指数期货下跌1.1%
同花顺,2026-03-12 23:46:01,美国财长贝森特：为了增加现有供应的全球覆盖范围，财政部正提供一项临时授权，允许各国购买目前滞留在海上的俄罗斯石油
同花顺,2026-03-12 23:45:36,伊朗武装部队：对伊能源基础设施和港口的袭击都将遭“毁灭性回击”
财联社,2026-03-12 23:33:24,美国财政部自11月以来首次削减6周期国库券发行规模
财联社,2026-03-12 23:32:20,以军称对黎真主党发动新一轮空袭
财联社,2026-03-12 23:30:24,以军空袭黎巴嫩大学一校区 致2死多伤
财联社,2026-03-12 23:15:57,中国-英国（苏格兰）企业交流对接会在爱丁堡举行
财联社,2026-03-12 23:15:51,尼泊尔民族独立党成为联邦议会众议院第一大党
财联社,2026-03-12 23:05:16,债券交易员不再押注美联储2026年降息一次的概率为100%
财联社,2026-03-12 23:00:46,国内商品期市夜盘收盘多数上涨 油脂油料涨幅居前
财联社,2026-03-12 22:49:51,特朗普政府势将暂停实施琼斯法以抑制油价上涨
财联社,2026-03-12 22:48:21,欧洲水泥股下挫 欧盟据悉拟放宽碳规则
同花顺,2026-03-12 22:46:16,韩国国会通过对美投资特别法
财联社,2026-03-12 22:46:07,两部门印发示范文本推动合同节水管理健康有序发展
财联社,2026-03-12 22:42:50,美福特号航母洗衣房起火
同花顺,2026-03-12 22:34:23,中方强烈谴责始作俑者美国
财联社,2026-03-12 22:32:43,【金牌纪要库】中东地缘冲突直接威胁全球9%的电解铝产能，中国电解铝4500万吨产能利用率逼近99%极限，海外扩产同样面临电力基建约束，具备资源自给优势、绿电绑定能力的企业有望受益
同花顺,2026-03-12 22:32:14,AI需求大增叠加涨价潮 十大晶圆代工产值去年增超26%
财联社,2026-03-12 22:32:01,欧盟据悉考虑放宽碳配额规则并扩大国家援助 以遏制电价飙升
同花顺,2026-03-12 22:31:27,春耕在即 钾肥企业呼吁稳产保供
财联社,2026-03-12 22:30:34,国际油价短线拉升 涨幅扩大至10%
同花顺,2026-03-12 22:29:12,拍卖市场频频遇冷 非上市银行股权需重赋价值
同花顺,2026-03-12 22:27:25,“养虾热”带火Mac mini：华强北一机难求，普遍加价几百元
同花顺,2026-03-12 22:25:32,银行理财产品业绩基准密集下调
同花顺,2026-03-12 22:25:18,部分险企主动调降分红险预定利率至1.25%
同花顺,2026-03-12 22:25:09,公募新品频现提前结募增量资金密集“候场”
同花顺,2026-03-12 22:24:35,年内6家险企增资合计超50亿元
同花顺,2026-03-12 22:24:06,港股公司纷纷出手 年内回购额已超200亿港元
财联社,2026-03-12 22:23:54,美国新屋开工意外攀升 受多户型住宅项目提振
同花顺,2026-03-12 22:23:32,积极信号不断 广深楼市“小阳春”正酝酿
同花顺,2026-03-12 22:21:44,上海自贸离岸债再迎创新实践 多币种发行拓展跨境融资空间
同花顺,2026-03-12 22:20:04,增量资金持续涌入 爆款基金批量涌现
财联社,2026-03-12 22:18:36,伊朗新任最高领袖称或开辟新战线
财联社,2026-03-12 22:11:06,王毅同古共中央政治局委员、外交部长罗德里格斯通电话
同花顺,2026-03-12 22:10:15,伊拉克北部一军事基地遭袭，6名法国士兵受伤
同花顺,2026-03-12 22:10:06,美情报部门认为伊朗政权目前仍保持团结
同花顺,2026-03-12 22:09:10,以军空袭黎南部城镇造成9人死亡
财联社,2026-03-12 22:08:19,瀚天天成电子科技（厦门）股份有限公司通过港交所上市聆讯
同花顺,2026-03-12 22:08:15,全球最大的黄金ETF SPDR Gold Trust持仓较前日减少1.43吨
财联社,2026-03-12 22:07:29,花旗上调伊朗冲突背景下的油价预测
财联社,2026-03-12 22:06:43,【公告全知道】光模块+芯片+人形机器人+固态电池+储能！公司目前设备已在400G/800G高速光模块规模化生产中批量应用
同花顺,2026-03-12 22:00:39,现货黄金站上5080美元/盎司
财联社,2026-03-12 21:57:04,胜宏科技：2026年度投资计划不超过200亿元
财联社,2026-03-12 21:53:43,胜宏科技：2025年净利润同比增长274% 拟每10股派20元
财联社,2026-03-12 21:49:36,财联社3月12日晚间新闻精选：伊朗最高领袖称 霍尔木兹海峡将继续关闭
财联社,2026-03-12 21:49:12,伊朗新任最高领袖称要向敌人索赔
财联社,2026-03-12 21:47:48,蔚能电池与武汉东湖高新区签约 落地98亿元新基建项目
财联社,2026-03-12 21:46:50,【风口研报·洞察】天然气单月上涨超60%+欧洲核电将迎退役高峰，海风已成为欧洲能源转型的关键一环，叠加国内风电需求继续向上，助力产业链盈利弹性释放；地缘角度看油价
财联社,2026-03-12 21:43:42,美能源部长称美国“尚未准备好”在霍尔木兹海峡护航
同花顺,2026-03-12 21:42:05,博通全球首款102.4 Tbps交换芯片实现量产出货
财联社,2026-03-12 21:32:42,理想汽车总裁马东辉：尽量在公司内部消化外部涨价压力
财联社,2026-03-12 21:32:31,中国驻以色列使馆：特别提醒在以色列北部中国公民务必尽快转移避险并加强安全防范
财联社,2026-03-12 21:31:13,美股三大指数集体低开 纳指跌0.9%
财联社,2026-03-12 21:26:58,伊朗最高领袖说只针对敌人基地进行打击
财联社,2026-03-12 21:25:18,ST京蓝：1月23日至3月12日期间股价累计涨幅176.79% 明起停牌核查
财联社,2026-03-12 21:24:39,伊最高领袖说继续关闭霍尔木兹海峡
财联社,2026-03-12 21:23:57,伊朗最高领袖要求地区美军基地关闭
财联社,2026-03-12 21:22:52,俄国防部说“喀山”号核潜艇训练中发射巡航导弹
财联社,2026-03-12 21:20:33,伊朗新任最高领袖首份声明
财联社,2026-03-12 21:17:24,俄外交部：已制定调解伊朗问题建议并就此展开沟通
财联社,2026-03-12 21:16:07,商品期货夜盘走势分化 部分化工品走弱
财联社,2026-03-12 21:16:02,特宝生物：董事长提议回购1亿元-2亿元公司股份
同花顺,2026-03-12 21:13:22,美国财长贝森特：美联储距离重返量化宽松还有很长的路要走
财联社,2026-03-12 21:12:36,【财联社早知道】华为拟近期发布新一代AI数据基础设施，分析师称Agent规模化落地可期，这家公司已推出为银行和金融机构量身打造的AI Agent
财联社,2026-03-12 21:10:30,伊朗高官警告美勿袭电力系统
财联社,2026-03-12 21:07:17,微软推出健康助手Copilot Health
同花顺,2026-03-12 21:00:36,美元指数12日上涨
同花顺,2026-03-12 20:53:00,伊朗革命卫队称对美第五舰队基地发动袭击
同花顺,2026-03-12 20:48:13,标普考虑修改规则，以加快SpaceX进入标普500指数的进程
同花顺,2026-03-12 20:45:16,受伊朗局势冲突影响，Meta在波斯湾的大型海底电缆项目已停工
同花顺,2026-03-12 20:32:53,现货黄金失守5060美元/盎司
同花顺,2026-03-12 20:25:19,现货白银日内跌超2%，现报83.77美元/盎司
同花顺,2026-03-12 20:21:35,现货白银跌超1%
同花顺,2026-03-12 20:21:33,现货黄金失守5080美元/盎司
同花顺,2026-03-12 20:20:26,特朗普：已全面听取关于密歇根犹太教堂袭击事件的简报
同花顺,2026-03-12 20:17:53,美以速战速决计划落空 持久战承压
同花顺,2026-03-12 20:12:22,Adobe股价盘后跌幅扩大，现跌超7%
财联社,2026-03-12 20:09:10,广东省猪粮比价进入过度下跌一级预警区间
财联社,2026-03-12 20:07:19,南都电源：拟14.15亿元转让铅回收公司华铂再生资源100%股权
财联社,2026-03-12 20:06:08,Meta：将在未来两年内推出四代新款MTIA芯片 以支持生成式AI推理生产
财联社,2026-03-12 20:02:31,中信证券：香港证监会及廉署持搜查令到访香港子公司的营业地点并带走部分文件 公司及香港子公司经营情况正常
同花顺,2026-03-12 20:00:43,纳斯达克中国金龙指数收跌1.04%
财联社,2026-03-12 20:00:31,央行行长潘功胜：构建科学稳健的货币政策体系，继续实施好适度宽松的货币政策，加大逆周期和跨周期调节力度
财联社,2026-03-12 19:59:44,2026年度电影总票房突破110亿
财联社,2026-03-12 19:56:42,飞凯材料：拟投资10亿元在安徽东至经济开发区建设新生产基地
财联社,2026-03-12 19:54:41,光迅科技：注意到网络出现涉及公司送样及潜在客户、取得大额订单、收入预测等相关信息 经核实均为不实信息
财联社,2026-03-12 19:54:40,伊朗称袭击以色列两处空军基地和辛贝特总部
财联社,2026-03-12 19:53:26,紫金矿业：全资子公司与专业投资机构共同投资设立基金
财联社,2026-03-12 19:52:27,超讯通信：拟投资设立超微智算 加快拓展算力业务布局
财联社,2026-03-12 19:49:00,德国莱茵集团计划在400亿美元投资计划下大举投资美国
同花顺,2026-03-12 19:47:04,美国10年期国债收益率涨超3.3个基点，刷新日高至4.2746%
同花顺,2026-03-12 19:43:44,美国货币市场基金资产规模达到创纪录的7.82万亿美元
