来源,时间,标题
同花顺,2026-03-11 02:51:51,美将启动下一代飞行器试点计划
同花顺,2026-03-11 02:49:15,上期所欧线集运主力合约大涨7%
同花顺,2026-03-11 02:49:09,港股恒生科技指数涨幅达1%
同花顺,2026-03-11 02:48:59,宁德时代港股涨幅扩大至10%
财联社,2026-03-11 02:48:20,美国特使：普京否认向伊朗提供有关美军的情报
同花顺,2026-03-11 02:47:21,北大医药与九州通全擎健康深化OTC领域战略协同
同花顺,2026-03-11 02:46:56,创业板指涨超2%，新能源赛道股领涨
财联社,2026-03-11 02:45:47,五角大楼：对伊朗军事行动已致美军约140人受伤
财联社,2026-03-11 02:44:09,伊朗副总统称将继续捍卫国土 未放弃通过谈判解决问题
财联社,2026-03-11 02:43:22,知情人士称美政府要求以色列停止袭击伊朗能源设施
财联社,2026-03-11 02:35:29,上期所原油期货夜盘收跌超12%
同花顺,2026-03-11 02:34:24,鸿蒙终端设备数量已突破4700万台
同花顺,2026-03-11 02:34:04,我科研人员取得工业级TOPCon电池技术重大突破
财联社,2026-03-11 02:33:41,以色列帕尔马希姆空军基地遭伊朗导弹袭击
财联社,2026-03-11 02:28:46,美官员称“海军护航油轮通过霍尔木兹海峡”后删帖 伊朗回应：纯属谎言
同花顺,2026-03-11 02:26:52,沪深京三市成交额超1.2万亿元，较上日此时缩量109亿元
同花顺,2026-03-11 02:25:19,特朗普宣布将在得州建设美国50年来首座新炼油厂
同花顺,2026-03-11 02:24:42,钛白粉概念股短线拉升，金浦钛业涨停
同花顺,2026-03-11 02:22:59,美国和以色列对伊朗发动猛烈打击
同花顺,2026-03-11 02:19:43,伊拉克总理：不得使用伊拉克领空打击周边国家
财联社,2026-03-11 01:59:10,俄罗斯布良斯克州遭导弹袭击 已致6死37伤
财联社,2026-03-11 01:46:58,美国驻多伦多总领馆遭枪击 加拿大警方加强安保
财联社,2026-03-11 01:36:00,美能源部长称美军成功护送油轮通过霍尔木兹海峡
同花顺,2026-03-11 01:34:45,培育钻石板块反复活跃，黄河旋风涨停
同花顺,2026-03-11 01:32:50,光纤概念股盘初上扬，长飞光纤触及涨停
同花顺,2026-03-11 01:26:45,全国政协主席王沪宁在全国政协十四届四次会议闭幕会上发表讲话
同花顺,2026-03-11 01:26:41,工业母机板块高开，华东数控涨停
同花顺,2026-03-11 01:26:23,ETF开盘：民企ETF弘毅远方领涨9.55%，标普油气ETF嘉实领跌2.68%
同花顺,2026-03-11 01:26:00,赫力昂斥资6亿在上海新建口腔健康工厂
同花顺,2026-03-11 01:25:39,A股开盘：三大指数集体高开
财联社,2026-03-11 01:22:47,4名伊朗外交官在以色列对贝鲁特的袭击中丧生
同花顺,2026-03-11 01:21:47,央行开展265亿元7天期逆回购操作
财联社,2026-03-11 01:21:36,因从事间谍活动 10名伊朗伊斯兰革命卫队情报组织成员被捕
同花顺,2026-03-11 01:20:49,港股开盘：恒生指数高开0.59%，恒生科技指数高开0.87%
财联社,2026-03-11 01:20:44,WTI原油期货日内大跌至18%
同花顺,2026-03-11 01:20:43,上期所欧线集运主力合约大涨6%
同花顺,2026-03-11 01:19:38,上期所欧线集运主力合约大涨5%
同花顺,2026-03-11 01:17:33,上一交易日ETF两市融资融券余额1193.75亿元
同花顺,2026-03-11 01:16:33,安理会审议叙利亚化武问题 中方呼吁严格遵守销毁原则
同花顺,2026-03-11 01:15:24,人民币兑美元中间价报6.8917，较上日调高65点
财联社,2026-03-11 01:14:38,以色列军方称打击伊朗多地安全机构目标
同花顺,2026-03-11 01:10:32,任天堂股价上涨10%
财联社,2026-03-11 01:09:43,国际铜夜盘收涨0.75%
同花顺,2026-03-11 01:09:11,宇树科技四足机器人外观专利获授权
财联社,2026-03-11 01:07:56,WTI原油期货跌幅扩大至15%
同花顺,2026-03-11 01:06:53,全国政协十四届四次会议闭幕会通过了提案工作情况报告决议
同花顺,2026-03-11 01:06:40,天风证券：看好AI时代下供电系统变革带来的投资机会
财联社,2026-03-11 01:05:46,NASA：SpaceX的“星舰”月球着陆器进度比原计划落后两年 预计还会有更多延误
财联社,2026-03-11 01:03:32,布伦特原油期货跌幅扩大至13%
财联社,2026-03-11 00:58:13,多个联合国机构警告中东战火引发“黑雨”等后果
财联社,2026-03-11 00:52:51,英国“龙”号驱逐舰启程前往东地中海
财联社,2026-03-11 00:36:41,俄罗斯伊朗两国总统通话 讨论双边关系及地区局势
财联社,2026-03-11 00:33:43,欧洲主要股指收盘普涨
财联社,2026-03-11 00:32:18,伊朗称打击以色列一处军事中心及卫星信息接收中心
财联社,2026-03-11 00:28:14,美特使称美俄乌三方会谈推迟至下周举行
财联社,2026-03-11 00:26:30,美国驻加拿大多伦多领事馆遭枪击 无人伤亡
财联社,2026-03-11 00:26:01,王毅同卡塔尔首相兼外交大臣穆罕默德通电话
财联社,2026-03-11 00:25:12,王毅同巴基斯坦副总理兼外长达尔通电话
财联社,2026-03-11 00:17:29,伊朗重申敌对势力相关船只无权通过霍尔木兹海峡
财联社,2026-03-11 00:16:48,印度航空宣布分阶段上调其国内和国际航线的燃油附加费
同花顺,2026-03-11 00:15:03,期货早报：美放风护航后删帖 特朗普警告伊勿布雷 隔夜国内原油跌超12%
同花顺,2026-03-11 00:14:14,国际能源署（IEA）据悉提议史上最大规模的战略石油储备释放
同花顺,2026-03-11 00:05:56,现货白银失守88美元/盎司
同花顺,2026-03-11 00:02:10,福布斯发布年度富豪榜，马斯克身价8390亿美元蝉联榜首
同花顺,2026-03-11 00:01:37,日韩股市集体高开
同花顺,2026-03-11 00:01:03,和誉：FGFR2/3抑制剂ABSK061获FDA授予罕见儿科疾病药物资格认定
财联社,2026-03-10 23:58:54,伊朗实施“真实承诺4”第35轮打击行动
同花顺,2026-03-10 23:56:45,全国政协委员、宁德时代董事长曾毓群：加强中国电池技术标准国际化推广
同花顺,2026-03-10 23:51:03,WTI原油站上83美元/桶
同花顺,2026-03-10 23:48:53,韩国将改革退休金制度
同花顺,2026-03-10 23:43:59,全国政协十四届四次会议闭幕会
财联社,2026-03-10 23:37:53,伊朗议会议长：将以“以眼还眼”原则回应任何袭击
同花顺,2026-03-10 23:35:40,应用材料公司与美光科技和SK海力士科技建立合作伙伴关系
同花顺,2026-03-10 23:28:40,微软提交法庭之友意见书 支持Anthropic起诉美国国防部
同花顺,2026-03-10 23:25:47,上交所：稳妥推进第五套上市标准行业扩围，支持关键核心技术领域科技型企业常态化上市融资
财联社,2026-03-10 23:24:27,黎真主党向以色列北部地区发射火箭弹
财联社,2026-03-10 23:21:54,美以袭击已致伊朗超1.5万人受伤
同花顺,2026-03-10 23:21:22,伊朗发起第37波打击
财联社,2026-03-10 23:20:42,俄伊外长就中东局势发展交换意见
财联社,2026-03-10 23:19:21,丹麦宣布关闭驻伊朗大使馆并撤离工作人员
财联社,2026-03-10 23:18:09,伊朗总统称不懂历史才妄图摧毁伊朗
财联社,2026-03-10 23:15:32,伊朗官员强调“不会与美国进行任何谈判”
财联社,2026-03-10 23:14:11,BioNTech联合创始人年内将离职 创立新的mRNA技术公司
财联社,2026-03-10 23:11:02,美军“末日飞机”被曝多次出动
财联社,2026-03-10 23:00:59,伊朗公布“真实承诺4”第34轮行动细节
同花顺,2026-03-10 22:48:14,瑞银集团：预计澳洲联储将在3月加息25个基点
财联社,2026-03-10 22:44:22,国家发展改革委外资司与地中海航运公司、马士基集团进行工作会谈
财联社,2026-03-10 22:43:21,美油、布油期货跌幅扩大至11% 七国集团责成国际能源署筹备释放紧急石油储备的情景方案
同花顺,2026-03-10 22:42:50,特朗普威胁伊朗不得在霍尔木兹海峡布雷
财联社,2026-03-10 22:40:41,南京栖霞区、江宁区发布“养龙虾”政策
财联社,2026-03-10 22:37:11,独家|部分金融机构上周收到风险提示 严控部署使用OpenClaw类似平台
同花顺,2026-03-10 22:35:35,瑞士一公交车起火致6死5伤
同花顺,2026-03-10 22:33:16,全球最大的白银ETF iShares Silver Trust持仓量较前日减少56.34吨
财联社,2026-03-10 22:31:20,利弗莫尔中概股龙头指数涨幅扩大至1%
财联社,2026-03-10 22:26:33,绿城中国：预计2025年公司股东应占利润同比下降95%左右
同花顺,2026-03-10 22:19:36,国内首家车规级芯片专业封测工厂在上海临港投产
同花顺,2026-03-10 22:17:12,科技企业纷纷入局“养虾” AI智能体从概念走向应用
财联社,2026-03-10 22:17:02,杭州萧山：拟提供OpenClaw免费部署与开发 支持Token消耗补贴
同花顺,2026-03-10 22:16:17,苹果首款折叠屏手机将至 产业链个股闻风而动
同花顺,2026-03-10 22:15:07,成本压力推动手机终端涨价 AI转型成破局关键
财联社,2026-03-10 22:09:23,哈马斯：以色列持续关闭拉法口岸严重违反停火协议
财联社,2026-03-10 22:08:53,美国参谋长联席会议主席：美军打击伊朗地下武器库
同花顺,2026-03-10 22:08:38,全球最大的黄金ETF SPDR Gold Trust持仓较前日增加2.86吨
财联社,2026-03-10 22:05:51,【公告全知道】OpenClaw+芯片+人形机器人+算力+华为！公司多平台成功接入Clawdbot并构建个人AIAgent载体
同花顺,2026-03-10 22:05:25,朝鲜再次试射战略巡航导弹
同花顺,2026-03-10 22:02:45,WTI原油期货涨幅扩大至4%，报85.7美元/桶
财联社,2026-03-10 21:57:53,中东冲突引发市场剧烈波动 全球最大的几家对冲基金损失数亿美元
同花顺,2026-03-10 21:53:20,以军称对德黑兰发动新一轮打击
财联社,2026-03-10 21:49:12,【风口研报·洞察】北美光伏扩产招标进程提速，地面光伏10GW总包订单落地在即，分析师看好叠瓦技术路径驱动组件设备与浆料价值量大幅增长；恒生科技指数企稳了么
财联社,2026-03-10 21:45:22,抖音严打AI生成色情低俗类违规内容，今年以来已处置1.4万个账号
财联社,2026-03-10 21:45:04,我国多家航司进一步优化部分中东航线非自愿退改规定
财联社,2026-03-10 21:44:38,杭州铜师傅文创（集团）股份有限公司通过港交所上市聆讯
财联社,2026-03-10 21:42:54,财联社3月10日晚间新闻精选
财联社,2026-03-10 21:41:16,美股矿业股走强
财联社,2026-03-10 21:40:17,美股石油股走低
同花顺,2026-03-10 21:36:41,甲骨文美股盘后涨幅扩大至10%
财联社,2026-03-10 21:24:35,荣耀CEO李健：荣耀人形机器人聚焦购物协助、工作检查、陪伴三大消费级场景
同花顺,2026-03-10 21:23:44,特朗普：“美国优先”炼油公司正在得克萨斯州布朗斯维尔市建设美国50年来首家新炼油厂
财联社,2026-03-10 21:17:45,蔚来CFO曲玉：2026年一季度整车毛利率预计可保持2025年四季度水平
财联社,2026-03-10 21:04:21,【财联社早知道】事关OpenClaw，国家互联网应急中心发布安全应用风险提示，机构预计2030年中国AI智能体安全市场规模或超800亿元，这家公司围绕智能体全生命周期，构建了五层闭环安全体系
财联社,2026-03-10 21:04:15,TCL智家：2025年净利润同比增长10.22%
财联社,2026-03-10 21:02:24,高通和Wayve推动面向量产的端到端ADAS和自动驾驶人工智能技术
财联社,2026-03-10 21:01:59,AI开源智能体OpenClaw引爆科技圈 近10家上市公司公告或互动平台回应相关情况
财联社,2026-03-10 20:59:55,以色列中部地区响起防空警报
财联社,2026-03-10 20:57:10,美防长称将对伊朗发起“最高强度”打击
财联社,2026-03-10 20:56:50,印媒放风：印度已批准放宽对中国等陆上邻国的外国直接投资规定
同花顺,2026-03-10 20:56:43,ChatGPT 及其他聊天机器人已获美国参议院批准使用
同花顺,2026-03-10 20:55:22,甲骨文美股盘后涨超8%，公司第三财季调整后营收超预期
财联社,2026-03-10 20:47:27,加拿大正式撤销关闭TikTok当地业务的决定 公司回应：期待投资新项目
同花顺,2026-03-10 20:42:18,俄罗斯布良斯克遭乌克兰导弹袭击 6死37伤
同花顺,2026-03-10 20:42:02,美国至3月6日当周API成品油进口 33.8万桶/日，前值-17.3万桶/日
同花顺,2026-03-10 20:41:53,美国至3月6日当周API原油进口 -11.3万桶，前值-15.1万桶
同花顺,2026-03-10 20:40:23,美国至3月6日当周API汽油库存 -183.8万桶，前值-328.6万桶
同花顺,2026-03-10 20:40:09,美国至3月6日当周API原油库存 -167.8万桶，前值564.7万桶
同花顺,2026-03-10 20:27:55,加拿大总理卡尼：七国集团领导人将于周三讨论能源协调问题
同花顺,2026-03-10 20:13:37,特朗普：美国将摧毁任何试图在霍尔木兹海峡布雷的船只
同花顺,2026-03-10 20:09:58,甲骨文美股盘后涨近5%。
同花顺,2026-03-10 20:09:58,甲骨文美股盘后涨近5%
同花顺,2026-03-10 20:09:01,甲骨文第三季度调整后营收 171.9 亿美元
财联社,2026-03-10 20:06:57,特朗普称有可能有条件同伊朗谈判
财联社,2026-03-10 20:03:39,金海通：2025年净利润同比增长124.93% 拟10派3.8元转增4.5股
同花顺,2026-03-10 20:00:46,纳斯达克中国金龙指数收涨1.94%，蔚来涨15.08%
财联社,2026-03-10 20:00:29,中证协启动2025年度证券行业人力资源管理情况调研
财联社,2026-03-10 19:58:03,伊朗否认袭击土耳其 强调警惕以方“离间图谋”
财联社,2026-03-10 19:56:12,国产机床爆单 有机床生产企业订单排至9月
同花顺,2026-03-10 19:55:15,美元指数10日下跌
财联社,2026-03-10 19:53:17,芯原股份：筹划发行H股股票并在香港联合交易所有限公司上市
同花顺,2026-03-10 19:52:32,General Catalyst正商讨推进融资，拟筹集约100亿美元资金
财联社,2026-03-10 19:47:24,【机构调研】金刚石功能化应用加速突破，这家公司持续投资扩大MPCVD金刚石产能
财联社,2026-03-10 19:46:29,赢合科技：股东王维东拟减持不超2.47%股份
财联社,2026-03-10 19:45:19,通威股份：拟筹划购买丽豪清能100%股权 股票3月11日复牌
同花顺,2026-03-10 19:32:09,美俄乌三方会谈或于下周在土耳其举行
同花顺,2026-03-10 19:18:35,马斯克旗下的 xAI 已获得在密西西比州建设发电厂的许可
财联社,2026-03-10 19:10:15,多个重点项目在珠海集中签约 总投资超100亿元
财联社,2026-03-10 19:09:40,上交所：持续深化资本市场投融资综合改革
财联社,2026-03-10 19:07:14,上交所：研究储备一批支持科技创新和新质生产力发展的政策措施
财联社,2026-03-10 19:01:40,“龙虾”智能体更新后依然存在安全风险 专家最新提示
财联社,2026-03-10 18:59:02,花旗集团将2026-2030年全球人工智能资本支出预测上调至8.9万亿美元
财联社,2026-03-10 18:53:49,匈牙利国会通过一项反对乌克兰加入欧盟的提案
财联社,2026-03-10 18:49:33,佩斯科夫：新一轮俄美乌三方会谈日期及地点尚未确定
财联社,2026-03-10 18:49:06,雷诺集团首席技术官：将持续在中国开发新车型
财联社,2026-03-10 18:48:46,英伟达与ABB联手研制AI工业机器人
财联社,2026-03-10 18:44:30,俄国防部：俄防空系统一天击落241架无人机和3枚“海马斯”火箭弹
财联社,2026-03-10 18:44:25,长龄液压：要约收购结果公布 股票复牌
财联社,2026-03-10 18:39:24,博睿数据：OpenClaw是开源AI智能体执行框架 公司目前对此类技术尚无监控方案和产品
财联社,2026-03-10 18:35:48,蔚来发布2025Q4及全年财报：Q4经营利润12.5亿元 现金储备环比大幅增长近百亿
财联社,2026-03-10 18:34:14,宇新股份：股东倪毓蓓拟减持不超1%股份
财联社,2026-03-10 18:14:34,俄方称近期预防多起针对高官的暗杀行动
财联社,2026-03-10 18:11:14,大为股份：拟定增募资不超过1.09亿元 用于嵌入式存储器研发和产业化项目
财联社,2026-03-10 18:08:16,快手获得CBA联赛2025-2026赛季赛事直播及短视频权益
财联社,2026-03-10 18:06:28,珍宝岛：分公司获得布瑞哌唑化学原料药上市申请批准通知书
财联社,2026-03-10 18:05:26,解放军和武警部队代表团发言人：坚决粉碎“台独”分裂和外部干涉图谋
财联社,2026-03-10 18:03:40,SpaceX：倾向于选择在纳斯达克进行IPO 要求将其尽早纳入纳斯达克100指数作为上市条件
财联社,2026-03-10 18:02:17,2026年全国一般公共预算安排国防支出1.94万亿元
财联社,2026-03-10 18:01:38,优刻得：搭载OpenClaw镜像的轻量云主机产品尚未形成规模化的产品体系
财联社,2026-03-10 17:59:47,去年冠军基今年收益转负
财联社,2026-03-10 17:58:16,工信部：到2026年底培育一批行业数据合作联合体 建设重点行业数据可信互联平台
财联社,2026-03-10 17:57:00,工信部：打造行业数据资源库、数据技术攻关库、工业数据标准库、高质量行业数据集库等四大资源库
财联社,2026-03-10 17:56:32,德国大众集团拟2030年前裁退5万人
财联社,2026-03-10 17:56:26,风范股份：中标2.90亿元特高压直流输电项目
财联社,2026-03-10 17:55:43,广东：重点推动碳化硅、氮化镓等材料规模化制备与应用
财联社,2026-03-10 17:49:16,广东：加快发展L3、L4等高阶自动驾驶 部署建设若干全场景全域无人交通试验“安全沙箱”
同花顺,2026-03-10 17:22:40,大众汽车宣布，到2030年将在德国裁员5万人
同花顺,2026-03-10 17:22:26,美国天然气期货跌超5.00%，现报2.969美元/百万英热
同花顺,2026-03-10 17:21:53,WTI原油期货日内大跌至18%，报77.708美元/桶
同花顺,2026-03-10 17:18:31,WTI原油期货跌幅扩大至17%
同花顺,2026-03-10 17:17:26,美联储隔夜逆回购协议（RRP）使用规模为2.78亿美元（交易对手4家）
财联社,2026-03-10 17:14:37,上海启动股权信托财产登记试点
财联社,2026-03-10 17:14:21,热景生物：子公司SGC001创新药Ⅱ期临床研究完成首例受试者入组给药
同花顺,2026-03-10 17:11:46,WTI原油期货跌幅扩大至15%，报80.455美元/桶
同花顺,2026-03-10 17:11:37,亚马逊吸引了约1260亿美元的美国债券发行订单
财联社,2026-03-10 17:10:40,俄罗斯重申太空非军事化立场
财联社,2026-03-10 17:09:56,富临精工：目前公司产能实现满产满销
同花顺,2026-03-10 17:06:25,美国天然气期货跌超4.00%，现报3.002美元/百万英热
同花顺,2026-03-10 17:06:13,NASA：SpaceX的“星舰”月球着陆器用于NASA宇航员任务的进度比原计划落后两年 预计还会有更多延误
财联社,2026-03-10 17:03:31,包头稀交所：今日稀土主流产品价格大幅下跌
财联社,2026-03-10 17:03:18,五菱汽车：预计2025年公司拥有人应占利润同比增加约54%
财联社,2026-03-10 17:02:27,【电报解读】智元机器人新设两家具身智能公司，机构称2026年人形机器人产业正迎来“1-10”的关键跨越，新一轮定价窗口建议关注五大细分领域，这家公司已取得智元机器人小批量订单
财联社,2026-03-10 17:00:29,法巴：伊朗战事如果升级 中国股市在亚洲市场的优势可能扩大
财联社,2026-03-10 16:59:34,京东推出OpenClaw远程部署专项服务
财联社,2026-03-10 16:56:18,佛山市禅城区：推出面向公众的“小龙虾”免费部署服务
同花顺,2026-03-10 16:54:25,WTI原油期货日内跌幅达13%，报82.43美元/桶
财联社,2026-03-10 16:52:17,广东省新增3款已完成登记的生成式人工智能服务
同花顺,2026-03-10 16:51:43,特朗普预计将于周三在肯塔基州举行活动
财联社,2026-03-10 16:48:59,伊朗议长：绝不寻求停火 将让侵略者吸取教训
同花顺,2026-03-10 16:41:40,加拿大皇家银行首席执行官麦凯：人工智能对我们业务的任何部分都产生了影响
同花顺,2026-03-10 16:39:54,巴克莱银行预计墨西哥将在2026年再降息三次，每次25个基点
同花顺,2026-03-10 16:36:34,俄罗斯伊朗两国总统通话，讨论双边关系及地区局势
同花顺,2026-03-10 16:31:30,Brahma AI与谷歌云合作开发交互式数字人
同花顺,2026-03-10 16:22:57,广东德聚技术股份有限公司启动上市辅导
同花顺,2026-03-10 16:20:10,河北景隆智能装备股份有限公司启动上市辅导
同花顺,2026-03-10 16:18:53,谷歌推出多模态模型Gemini Embedding 2公开预览版
同花顺,2026-03-10 16:17:39,印度航空：非洲燃油附加费上调至90美元
同花顺,2026-03-10 16:14:41,广州市委书记冯忠华会见沃尔玛中国总裁及首席执行官朱晓静
同花顺,2026-03-10 16:14:00,美国能源信息署表示，鉴于预测期内库存预计将大幅增加，预计欧佩克+明年不会大幅提高产量
同花顺,2026-03-10 16:13:50,美国3月EIA当年短期前景美国原油产量预期 1361万桶/日，前值1360万桶/日
财联社,2026-03-10 16:11:24,以军称监测到伊朗新一轮导弹袭击
财联社,2026-03-10 16:10:43,甘肃甘南州迭部县发生3.6级地震 震源深度11千米
财联社,2026-03-10 16:09:53,恒生科技指数收涨2.40% 半导体板块涨幅居前
财联社,2026-03-10 16:09:34,韩国散户在此轮暴跌中坚持不降杠杆 或是害怕重蹈去年4月覆辙
财联社,2026-03-10 16:09:27,上海国际能源交易中心：调整原油、低硫燃料油期货相关合约涨跌停板幅度和交易保证金比例
财联社,2026-03-10 16:06:34,江苏：到2030年 推动不少于20款脑机接口产品通过医疗器械注册审批
财联社,2026-03-10 16:06:10,广期所发布关于多晶硅期货ps2703、碳酸锂期货lc2703合约有关事项的公告
财联社,2026-03-10 16:05:42,江苏：加强对脑机接口关键元器件、整机产品的前瞻布局
财联社,2026-03-10 16:05:10,郑州110千伏曙光（超算）变电站新建工程投运
同花顺,2026-03-10 16:04:46,博雷顿与广州发展新能源集团签约，将合作矿山光储一体化、海外新能源开发
财联社,2026-03-10 16:04:35,长盈精密：筹划发行H股股票并在香港联交所上市
财联社,2026-03-10 16:04:25,上期能源所调整原油、低硫燃料油期货相关合约涨跌停板幅度和交易保证金比例
财联社,2026-03-10 16:04:12,江苏：支持脑机接口整机头部企业打造开放创新平台 加快成长为具备生态引领力的链主企业
同花顺,2026-03-10 16:03:56,EIA大幅上调美、布两油今年均价预期
财联社,2026-03-10 16:03:33,江苏：引导有条件的地区设立脑机接口产业投资基金 吸引社会资本参与 助力种子期、初创期企业发展壮大
财联社,2026-03-10 16:01:45,欧洲主要股指集体高开 德国DAX30指数涨超2%
财联社,2026-03-10 16:01:25,江苏：围绕柔性电极、脑机芯片、软件系统等关键软硬件领域 培育专精特新企业
财联社,2026-03-10 16:00:56,江苏：到2030年 培育不少于30个“脑机接口+消费”典型应用场景
财联社,2026-03-10 16:00:44,上期所调整燃料油、石油沥青、丁二烯橡胶期货相关合约涨跌停板幅度和交易保证金比例
同花顺,2026-03-10 15:58:59,美国特使维特科夫：俄罗斯在昨日通话中表示，他们并未分享有关美国军事资产的情报
同花顺,2026-03-10 15:57:50,俄罗斯总统普京与伊朗总统佩泽希齐扬通电话
同花顺,2026-03-10 15:53:06,英特尔涨超5%
同花顺,2026-03-10 15:48:22,多伦多股票指数涨幅扩大，上涨1%
同花顺,2026-03-10 15:44:40,标普500指数涨幅扩大至0.5%，创盘中新高
同花顺,2026-03-10 15:43:30,荣耀将考虑在国内市场推出子品牌 持续推动渠道优化
同花顺,2026-03-10 15:19:17,丹麦关闭驻伊朗大使馆，撤离工作人员
财联社,2026-03-10 15:18:38,机构：2025年中国腕戴设备市场同比增长20.8%
财联社,2026-03-10 15:15:56,机构：存储器与CPU价格同步上涨 主流笔电售价或将上调40%
财联社,2026-03-10 15:15:04,3月10日涨停分析
同花顺,2026-03-10 15:14:40,波音称因布线问题推迟部分737 MAX飞机交付
财联社,2026-03-10 15:14:36,美军对伊打击行动已损失11架“死神”无人机 总价值3.3亿美元
同花顺,2026-03-10 15:12:19,传腾讯秘密启动微信 AI 智能体项目，剑指阿里字节
同花顺,2026-03-10 15:10:58,爱彼迎（Airbnb）聘请优步（Uber）资深高管富尔德纳担任全球运营主管
同花顺,2026-03-10 15:08:34,马士基将推出临时紧急燃油附加费
同花顺,2026-03-10 15:06:41,埃及央行：2月核心通胀率同比从1月的11.2%升至12.7%
财联社,2026-03-10 15:06:33,智元机器人联合隆鑫通用、卧龙电驱 新设两家具身智能公司
同花顺,2026-03-10 15:06:07,波音公布2月交付数据公布后，美股股价下跌3.1%
财联社,2026-03-10 15:05:57,伊朗伊斯兰革命卫队称袭击伊拉克境内美军驻地
财联社,2026-03-10 15:04:43,光伏电池片库存持续下降 厂商评估3月复产提产计划
同花顺,2026-03-10 15:04:19,波音：2月份共计获得21份订单，取消了6份
同花顺,2026-03-10 15:04:03,波音公司：线路缺陷将延缓部分737 Max飞机的交付
同花顺,2026-03-10 15:01:58,新冠明星企业创始人夫妇官宣离职
财联社,2026-03-10 15:01:58,收评：创业板指高开高走涨超3% 全市场超4500只个股上涨
财联社,2026-03-10 15:01:48,国内期货市场多数下跌 集运欧线跌近14%
同花顺,2026-03-10 15:01:08,沙特阿美总裁：海运持续受阻将对石油市场和世界经济造成严重后果
同花顺,2026-03-10 15:00:42,期市夜盘收盘，国内期货主力合约多数下跌
同花顺,2026-03-10 15:00:23,多地政府机关单位近期牵头举办OpenClaw相关专题培训
