来源,时间,标题
同花顺,2026-05-01 11:36:05,李强在广西调研时强调 ，加快推进水网建设，全面提升综合效益，为经济社会发展提供基础支撑和重要保障
同花顺,2026-05-01 11:35:17,以军称在黎巴嫩南部摧毁大量真主党基础设施
同花顺,2026-05-01 11:20:56,德意志银行将Alphabet目标价从390美元上调至430美元
同花顺,2026-05-01 11:19:29,比亚迪4月销量32.11万辆
财联社,2026-05-01 11:07:48,何立峰会见比利时副首相兼外交大臣普雷沃
同花顺,2026-05-01 11:05:41,特斯拉今年在欧洲市场销量回暖 一季度涨幅近45%
同花顺,2026-05-01 11:05:08,英伟达持仓股Nebius同意收购Eigen AI
财联社,2026-05-01 11:00:46,广东惠州实施人才房票政策：不限户籍社保 最高补贴10万元
财联社,2026-05-01 10:58:37,特朗普威胁削减驻德美军 默茨强调跨大西洋伙伴关系
同花顺,2026-05-01 10:53:44,“五一”假期首日全国道路交通总体平稳
财联社,2026-05-01 10:52:08,中上协：全市场上市公司2025年合计分红2.43万亿元 较上年增加805亿元
同花顺,2026-05-01 10:48:43,瑞穗银行将闪迪股票目标价从1000美元上调至1220美元
财联社,2026-05-01 10:43:57,英国罗罗公司预测年利润增16% 称可完全化解伊朗战事影响
同花顺,2026-05-01 10:42:50,Moderna美股盘前涨超10%
同花顺,2026-05-01 10:42:36,摩根士丹利将苹果公司目标股价从315美元上调至330美元
财联社,2026-05-01 10:41:39,特朗普称将取消对苏格兰威士忌的关税和进口限制
财联社,2026-05-01 10:40:29,2025年全市场上市公司实现营收73.01万亿元 同比增长1.2%
财联社,2026-05-01 10:35:57,伊朗外长：“制止以色列侵略黎巴嫩”是伊美停火方案组成部分
财联社,2026-05-01 10:33:37,机构: 4月深圳一二手网签量超9000套
财联社,2026-05-01 10:29:43,摩尔线程完成DeepSeek-V4全链路工程化适配
财联社,2026-05-01 10:10:02,第四批全国中成药联盟采购开标 覆盖89种临床常用药品
同花顺,2026-05-01 10:08:06,SpaceX：星舰项目累计投入超150亿美元 计划在2026年下半年发射“星链 V3”卫星
同花顺,2026-05-01 10:07:23,雅诗兰黛美股盘前涨超10%
财联社,2026-05-01 10:06:25,黎巴嫩真主党使用光纤无人机对抗以军
财联社,2026-05-01 10:04:22,理想汽车4月交付量达34085辆
财联社,2026-05-01 10:02:15,点名意大利西班牙 特朗普拟削减在欧多国驻军
财联社,2026-05-01 09:58:27,TCL李东生拜访索尼集团：合资公司已就中长期战略方向形成初步规划
同花顺,2026-05-01 09:58:21,现货黄金失守4560美元/盎司
财联社,2026-05-01 09:58:04,单程仅约2小时 广东湛江往返越南芽庄航线复航
同花顺,2026-05-01 09:49:58,花旗集团预计，日本央行自6月起将大约每六个月加息一次
同花顺,2026-05-01 09:43:43,五一假期，港珠澳大桥珠海公路口岸迎入境高峰
财联社,2026-05-01 09:39:27,白宫记协晚宴枪击事件嫌疑人将在案件审理期间继续被关押
同花顺,2026-05-01 09:38:35,以色列对黎巴嫩南部发动袭击
同花顺,2026-05-01 09:31:07,伊朗外长同欧盟外交与安全政策高级代表通话，讨论地区局势
同花顺,2026-05-01 09:19:30,伊朗外长：美对伊战事耗资千亿美元，以色列优先就是美国垫底
财联社,2026-05-01 09:15:02,美国汽油均价再创近4年来新高
财联社,2026-05-01 09:08:48,今天全国铁路预计发送旅客2480万人次
同花顺,2026-05-01 09:06:21,量化交易公司Susquehanna将闪迪目标价从1000美元翻倍上调至2000美元
同花顺,2026-05-01 09:05:55,日本央行数据显示进行了约5.4万亿日元的汇市干预
财联社,2026-05-01 08:55:44,美政府官员：2月28日开始的“敌对行动已结束”
财联社,2026-05-01 08:54:52,国能龙源射阳100万千瓦海上风电项目一期工程开工
同花顺,2026-05-01 08:54:03,日本财务省财务官三村淳表示，仍不对汇率问题置评
同花顺,2026-05-01 08:53:18,现货白银失守73美元/盎司
财联社,2026-05-01 08:52:38,亚洲最长地铁环线 武汉地铁12号线一期通车
财联社,2026-05-01 08:51:13,上海航运交易所：节前运输市场总体平稳 航线运价整体略有上浮
同花顺,2026-05-01 08:45:40,北京发布大风蓝色预警 2日中午至前半夜将有7、8级阵风
财联社,2026-05-01 08:41:29,铁路上海站今迎“五一”假期客流最高峰 预计发送旅客82.8万人次
财联社,2026-05-01 08:31:12,受AI相关需求提振 韩国出口继续激增
同花顺,2026-05-01 08:30:54,重庆：加大公积金惠民力度
同花顺,2026-05-01 08:30:36,英国4月制造业PMI终值53.7，预期53.3，初值53.6
同花顺,2026-05-01 08:26:10,美股总市值突破75万亿美元 创历史新高
同花顺,2026-05-01 08:21:27,重庆：鼓励企业用好债券市场中长期、低成本资金 发行科技创新债券等创新产品
同花顺,2026-05-01 08:21:10,现货黄金失守4570美元/盎司
财联社,2026-05-01 08:19:28,西部数据美股夜盘跌超7%
财联社,2026-05-01 08:07:07,特斯拉去年从SpaceX与xAI斩获5.73亿美元营收
同花顺,2026-05-01 08:06:28,Twilio盘前涨20.69%，现报178.70美元
同花顺,2026-05-01 08:06:12,美国第五大社交媒体平台Reddit股票在盘前交易中上涨13%
同花顺,2026-05-01 08:01:47,美股大型科技股盘前多数上涨，苹果涨2%
同花顺,2026-05-01 08:01:38,美股中概股盘前涨跌互现，蔚来跌2%
同花顺,2026-05-01 08:01:29,Roblox盘前跌21.75%，现报43.24美元
同花顺,2026-05-01 08:01:18,美股存储芯片概念股盘前下跌
财联社,2026-05-01 08:00:30,韩国4月进口同比增长16.7% 出口同比增长48%
财联社,2026-05-01 07:59:27,伊朗外交部：期待伊美谈判迅速达成结果并不现实
同花顺,2026-05-01 07:54:34,现货黄金失守4580美元/盎司
同花顺,2026-05-01 07:50:55,俄称乌军大规模袭击扎波罗热地区 多处能源基础设施受损
财联社,2026-05-01 07:49:29,以色列被曝向阿联酋部署激光防御系统应对伊朗
同花顺,2026-05-01 07:44:46,2026年五一档首日票房破1亿元
同花顺,2026-05-01 07:44:35,LME铝主力合约涨超1%
财联社,2026-05-01 07:42:21,腾云智算与华为达成深度合作 共筑福建智算新生态
财联社,2026-05-01 07:38:49,美军一艘驱逐舰据报发生火灾
同花顺,2026-05-01 07:37:52,极氪4月交付新车31787辆，同比增长132%
同花顺,2026-05-01 07:33:55,深蓝汽车4月全球销量33187辆，同比增长64.8%
财联社,2026-05-01 07:30:04,一季度世界最大清洁能源走廊发电量超618亿千瓦时 同比增长7.19%
同花顺,2026-05-01 07:26:03,泽连斯基称乌克兰多地遭袭 多人受伤
同花顺,2026-05-01 07:22:13,美元兑日元在急挫约150点后，又拉升约90点
同花顺,2026-05-01 07:21:03,5月1日全社会跨区域人员流动量预计超3.4亿人次
同花顺,2026-05-01 07:18:27,LME镍主力合约涨超1%
财联社,2026-05-01 07:14:32,美国两大铁路公司申请合并 拟打造横贯全国货运网络
同花顺,2026-05-01 07:14:32,英国国民西敏寺银行首席执行官：该公司40%的代码现在由人工智能编写
同花顺,2026-05-01 07:07:09,现货黄金失守4590美元/盎司
同花顺,2026-05-01 07:07:02,小鹏集团：4月共交付新车31011台，环比增长13%
同花顺,2026-05-01 07:01:42,杰富瑞将闪迪目标股价从1000美元上调至1400美元
同花顺,2026-05-01 07:01:02,英国富时100指数开盘跌0.33%
同花顺,2026-05-01 06:59:27,第四批全国中成药联盟采购开标 310个产品拟中选
同花顺,2026-05-01 06:58:48,特朗普再批主持人 美监管机构提前审查电视台执照引质疑
同花顺,2026-05-01 06:52:31,电影《寒战1994》总票房破3000万元
同花顺,2026-05-01 06:31:07,日经225指数收涨0.38%
同花顺,2026-05-01 06:30:19,现货白银跌超1%
同花顺,2026-05-01 06:19:43,现货黄金失守4600美元/盎司
同花顺,2026-05-01 06:17:33,“我没意见”　特朗普就伊朗队赴美参加世界杯表态
同花顺,2026-05-01 06:07:45,东风奕派4月销量20537辆
同花顺,2026-05-01 05:46:24,上海签署首份覆盖全市快递行业的劳动规则协议
同花顺,2026-05-01 05:32:31,今起施行 杭州为具身智能机器人立法
同花顺,2026-05-01 05:04:52,跨境客流持续走高 广深港高铁成为大湾区互联互通“黄金通道”
同花顺,2026-05-01 04:53:23,11国外长谴责以袭击全球坚韧船队
同花顺,2026-05-01 04:24:16,国务院安委办部署“五一”假期期间安全生产明查暗访工作
同花顺,2026-05-01 04:08:00,中国常驻联合国副代表孙磊对美起草安理会涉南苏丹决议一意孤行表示遗憾
同花顺,2026-05-01 04:03:54,蔚来汽车四月交付量为29356辆 同比增长23%
同花顺,2026-05-01 03:51:25,商务部新闻发言人就美国联邦通信委员会审议通过检测认证和电信领域相关限制措施事答记者问
同花顺,2026-05-01 03:40:16,南非葡萄酒行业欢迎中国零关税举措
同花顺,2026-05-01 03:37:59,以色列防长称或很快恢复对伊朗打击
同花顺,2026-05-01 03:31:39,宁德时代上线电池在供车型查询入口
同花顺,2026-05-01 03:11:05,成本上涨 消费品巨头联合利华决定提价
同花顺,2026-05-01 02:35:05,机构：4月深圳一二手网签量超9000套
同花顺,2026-05-01 02:32:33,2025年上市公司整体业绩企稳回暖 科技创新势能迸发
同花顺,2026-05-01 02:31:56,WTI原油涨超1%
同花顺,2026-05-01 02:16:19,长三角铁路迎来“五一”假期客流高峰，预计发送旅客470万人次
同花顺,2026-05-01 02:12:14,智己汽车：2026年4月销量10016台，1-4月累计销量同比增长130%
同花顺,2026-05-01 02:01:30,"理想汽车：2026年4月交付34,085辆汽车"
同花顺,2026-05-01 01:49:38,武汉轨道交通12号线一期开通运营
同花顺,2026-05-01 01:46:18,哥伦比亚谴责以色列扣押本国援加沙船员
同花顺,2026-05-01 01:35:19,零跑汽车4月交付71387台，同比增长73.9%
同花顺,2026-05-01 01:31:22,富时中国A50指数期货涨1%
同花顺,2026-05-01 01:22:06,民航局副局长胡振江率团赴港澳开展民航安全技术交流
同花顺,2026-05-01 01:13:00,问界M6发布一周交付突破5000台
同花顺,2026-05-01 01:11:50,小米汽车2026年4月交付量超过30000台
同花顺,2026-05-01 01:07:31,韩国4月份半导体出口额达到319亿美元，同比大增173%
同花顺,2026-05-01 01:05:41,30年期日本国债收益率下降2.0个基点，至3.715%
同花顺,2026-05-01 01:02:10,布伦特原油站上112美元/桶
同花顺,2026-05-01 01:01:58,富时中国A50期货盘初上涨0.8%
同花顺,2026-05-01 00:32:00,黑龙江省启动“五一”文旅消费周活动
同花顺,2026-05-01 00:03:00,布伦特原油站上111美元/桶
同花顺,2026-05-01 00:02:41,日经225指数高开0.16%
同花顺,2026-04-30 23:50:10,现货白银日内涨幅扩大至1%
同花顺,2026-04-30 23:33:34,日本4月东京CPI同比增长1.5%，预期1.70%，前值1.40%
同花顺,2026-04-30 23:28:05,英媒：以色列已向阿联酋部署激光防御系统应对伊朗
同花顺,2026-04-30 22:59:42,国际足联主席：已收到5亿份2026年世界杯球票购票需求
同花顺,2026-04-30 22:57:02,德黑兰传出防空系统拦截声 以宣称考虑恢复对伊军事行动
同花顺,2026-04-30 22:56:43,伊朗股市暂停交易至5月4日
同花顺,2026-04-30 22:52:29,新兴市场股市录得2022年以来最佳单月表现，AI热潮与油价风险交织
同花顺,2026-04-30 22:50:52,联合国机构：加沙爆炸物污染严重 已成“每日紧急危机”
同花顺,2026-04-30 22:42:39,巴勒斯坦足协主席拒绝握手以官员
同花顺,2026-04-30 22:24:09,美官员称伊朗战事成本或达500亿美元 为官方披露两倍
同花顺,2026-04-30 22:17:26,特朗普称已“摧毁”伊朗核能力 仅少数人知晓谈判实际进展
同花顺,2026-04-30 22:03:44,美联储6月维持利率不变的概率为95%
同花顺,2026-04-30 22:03:31,德黑兰部分城区启动防空系统拦截无人机 现已恢复平静
同花顺,2026-04-30 21:51:24,苹果CEO库克：预计第三季度的内存成本将显著高于第二季度
