来源,时间,标题
财联社,2026-05-02 19:16:19,外交部发言人就赖清德搭乘斯威士兰国王“私人飞机”窜斯答记者问
财联社,2026-05-02 19:01:44,商务部新闻发言人就阻断美国对5家中国企业实施涉伊朗石油制裁措施答记者问
财联社,2026-05-02 19:00:55,商务部公告2026年第21号 公布关于美国对5家中国企业实施涉伊朗石油制裁措施的阻断禁令
财联社,2026-05-02 18:43:54,15岁蒋林静首夺跳水世界杯总决赛女子10米台冠军
财联社,2026-05-02 18:25:09,墨西哥州长受美方指控后提出临时离职以配合本国调查
财联社,2026-05-02 18:05:41,马斯克1583亿美元薪酬实际为0
财联社,2026-05-02 17:58:30,以色列称将把扣押的2名活动人士移交执法部门
财联社,2026-05-02 17:43:23,日本奈良县发生5.7级地震
财联社,2026-05-02 17:27:13,五一假期首日 琼州海峡客滚运输多项数据创单日历史新高
财联社,2026-05-02 17:10:03,德防长：对美撤军“早有预期” 德美仍将保持密切军事合作
财联社,2026-05-02 17:08:59,交通运输部：今天全社会跨区域人员流动量约3亿人次
财联社,2026-05-02 16:48:14,美政府救助谈判破裂 精神航空停止运营
财联社,2026-05-02 16:35:34,英国法院一审裁定三星向中兴支付3.92亿美元
财联社,2026-05-02 16:31:03,苏州：提高公积金贷款最高限额 个人公积金最高贷款额度调整为150万元
财联社,2026-05-02 16:29:14,以军称摧毁超50个黎巴嫩真主党设施
财联社,2026-05-02 16:21:25,伊朗宣布处决两名向以色列提供情报的间谍
财联社,2026-05-02 16:09:23,以色列对黎巴嫩袭击造成至少13人死亡
财联社,2026-05-02 16:06:06,特朗普谈及美军扣押伊朗油轮：我们就像海盗
财联社,2026-05-02 15:36:24,香港控烟新规生效以来已发出多张罚单
财联社,2026-05-02 15:28:45,意大利托斯卡纳大区林火持续 约3000人撤离
财联社,2026-05-02 15:07:39,2026年五一档新片票房突破3亿元
财联社,2026-05-02 14:53:15,联合国难民署：中东局势致物资运输成本上升 交付推迟
财联社,2026-05-02 14:52:45,民调显示超六成人认为美对伊动武错误
财联社,2026-05-02 14:49:35,广西迎暴雨+强对流天气 防汛四级响应已启动
财联社,2026-05-02 14:48:25,古巴国家主席：美对古实施“种族灭绝式封锁”
财联社,2026-05-02 14:43:03,以军袭击黎巴嫩南部村庄
财联社,2026-05-02 14:40:19,阿富汗首都喀布尔发生爆炸
财联社,2026-05-02 14:30:51,伊朗高级军事官员：伊美间再次爆发军事冲突可能性很大
财联社,2026-05-02 14:26:35,Spirit航空公司即日起停止运营
财联社,2026-05-02 14:20:14,特朗普支持率低迷 共和党冲刺“重划选区”
财联社,2026-05-02 14:04:26,“五一”假期首日高速公路充电量同比增长55.6%
财联社,2026-05-02 13:41:19,我国首个算电协同绿电直供项目投运
财联社,2026-05-02 13:35:38,古巴举行劳动节集会呼吁保卫祖国
财联社,2026-05-02 13:10:47,日本央行前行长黑田东彦称2%的通胀目标已实现
财联社,2026-05-02 12:57:23,特朗普称美国已出售1亿桶委内瑞拉石油 近期将翻倍
财联社,2026-05-02 12:47:41,伊朗外长称仍愿同美国进行外交对话
财联社,2026-05-02 12:46:35,伯克希尔股东大会即将召开 新任CEO顶替巴菲特主导问答环节
财联社,2026-05-02 12:36:08,5月1日全国铁路发送旅客2484.4万人次 创历史新高
财联社,2026-05-02 12:24:47,日本岩手县大规模山林火灾已扑灭
财联社,2026-05-02 11:47:55,美滥用人工智能谋求技术军事霸权
财联社,2026-05-02 11:32:16,上海迎来首票非洲20个国家零关税项下商品
财联社,2026-05-02 11:21:59,马里军事检方就“4·25”袭击事件展开调查
同花顺,2026-05-02 11:08:50,“五一”假期第二天 全国主干公路交通仍处高位运行
同花顺,2026-05-02 11:07:58,美军拦截并登上伊朗油轮 特朗普戏称“我们简直就像海盗”
同花顺,2026-05-02 11:07:19,菲律宾马荣火山处于活动状态 形成火山碎屑流
同花顺,2026-05-02 11:01:49,商务部：针对美国对5家中国企业实施涉伊朗石油制裁措施发布禁令
同花顺,2026-05-02 10:57:07,特朗普威胁提高汽车关税，欧盟：将“保留所有选项”
财联社,2026-05-02 10:48:00,墨西哥总统：愿与美国合作 但不会在基本原则上让步
同花顺,2026-05-02 10:42:28,七个OPEC+国家原则上达成协议，将在6月将石油产量配额提高约18.8万桶/日
财联社,2026-05-02 10:28:24,日本采购的俄罗斯原油将于2日抵达
财联社,2026-05-02 10:23:52,国际海事组织决定加开会议商讨净零排放框架
同花顺,2026-05-02 10:09:58,瑞典一集会活动发生爆炸 已致3人受伤
同花顺,2026-05-02 10:04:28,自然资源部与中国气象局联合发布地质灾害气象风险预警
同花顺,2026-05-02 09:59:01,中方点名个别超级核大国：四处发动战争 推高军备竞赛风险
财联社,2026-05-02 09:58:09,上汽大通4月销量23860辆 同比增长35%
财联社,2026-05-02 09:46:35,平陆运河总体工程进度超94% 预计9月通航
财联社,2026-05-02 09:35:58,今天全国铁路预计发送旅客1970万人次
财联社,2026-05-02 09:35:26,巴西和西班牙要求以色列释放两名被扣押活动人士
财联社,2026-05-02 09:29:24,新疆阿克苏地区库车市发生4.1级地震 震源深度22公里
同花顺,2026-05-02 09:23:16,中国首个大规模“算电协同”绿电直供项目正式投运
同花顺,2026-05-02 09:20:13,石油美元体系正悄然松动，中东能源格局或迎大洗牌
财联社,2026-05-02 09:10:25,今天全国高速公路车流量预计超6000万辆次
财联社,2026-05-02 09:09:58,德国2025年右翼动机暴力事件创2016年以来新高
同花顺,2026-05-02 08:58:25,美政府救助谈判破裂，精神航空停止运营
财联社,2026-05-02 08:55:07,上海4月二手房网签量创近10年同期新高
同花顺,2026-05-02 08:53:12,非盟委员会主席：没有南非的G20峰会将“毫无意义”
财联社,2026-05-02 08:49:51,特朗普称美国“几乎能立即接管”古巴
同花顺,2026-05-02 08:44:28,土耳其四月贸易逆差为85亿美元
财联社,2026-05-02 08:43:36,长三角铁路今日预计发送418万人次 增开旅客列车209列
同花顺,2026-05-02 08:40:29,英国法院一审裁定三星向中兴支付3.92亿美元，全球专利之争加剧
同花顺,2026-05-02 08:39:03,数十人被扣40小时，加沙援助船队成员遭以军虐待殴打
财联社,2026-05-02 08:32:36,美军使用AI技术在霍尔木兹海峡扫雷
同花顺,2026-05-02 08:30:38,德国中国商会就欧委会依据《外国补贴条例》排除中企发表声明
同花顺,2026-05-02 08:27:51,特朗普又放威胁：从伊朗回来的路上顺道“解决古巴”
财联社,2026-05-02 08:24:24,南方降雨进入最强时段 中东部气温先降后升波动明显
财联社,2026-05-02 08:08:41,深圳口岸今年出入境人数突破1亿人次
财联社,2026-05-02 08:05:08,辉瑞与Arvinas公司乳腺癌新药获得美国FDA批准
同花顺,2026-05-02 08:03:20,5月1日全社会跨区域人员流动量3.37亿人次
同花顺,2026-05-02 08:00:16,美国航空：正在评估增加额外运力的各种可行方案
财联社,2026-05-02 07:56:07,刷新纪录！我国抽水蓄能电站最深竖井全线贯通
同花顺,2026-05-02 07:49:23,全国首支机器人交警中队正式上岗
同花顺,2026-05-02 07:46:02,“五一”假期运输火车票已售1.17亿张
同花顺,2026-05-02 07:44:56,美国为伊朗战事消耗大量军火库存　对欧洲国家武器交付受阻
财联社,2026-05-02 07:43:05,暴雨蓝色预警：9省区部分地区有大到暴雨 广西局地有大暴雨
财联社,2026-05-02 07:30:43,长安汽车4月交付20.95万辆 同比增长1.7%
财联社,2026-05-02 07:29:10,智度德正：兰佳合法担任公司法定代表人
同花顺,2026-05-02 07:25:10,芬兰银行行长雷恩：芬兰必须继续整顿公共财政
同花顺,2026-05-02 07:20:21,2484.4万人次！5月1日全国铁路旅客发送量创单日新高
同花顺,2026-05-02 07:19:13,多国人士呼吁日本正视东京审判历史正义
财联社,2026-05-02 07:16:59,亿航智能EH216-S完成墨西哥及拉丁美洲首次载人飞行
同花顺,2026-05-02 07:10:32,2026五一档新片总票房破3亿
财联社,2026-05-02 06:50:36,中国担任安理会5月轮值主席 将聚焦三项重点
财联社,2026-05-02 06:35:02,周六你需要知道的隔夜全球要闻：特朗普称对伊朗最新提交的谈判方案“不满意”；美称将于下周对欧盟输美汽车加征25%关税；美股涨跌不一 存储概念强势连涨五周
财联社,2026-05-02 06:28:42,新疆阿克苏地区库车市发生4.5级地震 震源深度18千米
同花顺,2026-05-02 06:23:00,美国精神航空公司表示将逐步停止所有运营
财联社,2026-05-02 06:20:16,美联储6月维持利率不变的概率为92.8%
财联社,2026-05-02 06:19:59,美国务院批准向中东四国出售武器
同花顺,2026-05-02 06:08:33,LABUBU冰箱二手价回落，一夜跌10000元
同花顺,2026-05-02 06:08:23,俄罗斯一住宅发生火灾7人死亡
同花顺,2026-05-02 05:39:25,东航就一航班飞机与廊桥发生局部碰擦致歉：机上旅客安全
同花顺,2026-05-02 05:35:14,经济、生态效益双赢，我国首个算电协同绿电直供项目投运
财联社,2026-05-02 05:30:51,美防长下令从德国撤出5000名驻军
同花顺,2026-05-02 05:27:22,湖北荆州市监利市发生3.1级地震 震源深度7公里
同花顺,2026-05-02 05:20:28,今年前四月，上海虹桥机场出入境公务机航班总量居全国首位
财联社,2026-05-02 05:07:40,古巴外长：坚决反对美国加大对古制裁
同花顺,2026-05-02 04:59:36,特朗普称已出售1亿桶委内瑞拉石油，近期将翻倍
财联社,2026-05-02 04:56:49,欧委会发言人：欧盟将保留一切选项维护自身利益
财联社,2026-05-02 04:46:06,伊朗革命卫队：将按最高领袖指示重塑波斯湾管理规则
同花顺,2026-05-02 04:20:53,内塔尼亚胡发布健身视频，此前已成功接受早期前列腺癌治疗
财联社,2026-05-02 04:14:50,美国多家石油巨头CEO警告称能源市场正逼近悬崖边缘
同花顺,2026-05-02 04:13:38,中国代表说世界足够大可容纳中美
同花顺,2026-05-02 04:05:18,创新药行业迎来业绩拐点，17家上市公司净利同比增超100%
同花顺,2026-05-02 04:04:56,百亿私募一季报调仓换股情况曝光
同花顺,2026-05-02 04:04:37,四川宜宾市兴文县发生3.3级地震 震源深度7千米
财联社,2026-05-02 04:01:36,利弗莫尔中概股龙头指数收跌0.16% 热门中概股多数下跌
财联社,2026-05-02 04:00:46,美股三大指数收盘涨跌不一 热门科技股多数上涨
财联社,2026-05-02 03:57:10,美国4月对亚洲液化天然气出口激增
财联社,2026-05-02 03:35:27,消息人士：马里北部一军营遭武装组织控制
财联社,2026-05-02 03:30:35,美元指数1日上涨
同花顺,2026-05-02 03:29:24,“五一”小长假首日 上海机场、邮轮、港口全线火热
同花顺,2026-05-02 03:22:25,特斯拉在加拿大推出新的Model 3系列，来自上海工厂
同花顺,2026-05-02 03:17:10,美威胁撤军对欧战略施压 安全承诺沦为筹码
财联社,2026-05-02 03:16:12,美媒：特朗普告知国会 对伊朗战事已“结束”
财联社,2026-05-02 03:16:12,白宫致函美国国会 称与伊朗的敌对行动已经“结束”
财联社,2026-05-02 02:56:39,伊朗最高领袖：当前阶段需要推动“经济抗争”
财联社,2026-05-02 02:55:47,受美国拖欠会费等因素影响 世贸组织计划削减10%预算
同花顺,2026-05-02 02:53:59,奇瑞汽车：QQ3纯电轿车上市首月交付13612台
同花顺,2026-05-02 02:52:48,巴西和西班牙联合声明，强烈谴责以色列
同花顺,2026-05-02 02:41:01,古巴称美制裁是强化种族灭绝式封锁
财联社,2026-05-02 02:21:47,航运分析机构：过去一天7艘船通过霍尔木兹海峡
财联社,2026-05-02 02:19:03,未爆弹药爆炸致伊朗伊斯兰革命卫队14人死亡
同花顺,2026-05-02 02:17:54,雷军：新一代SU7锁单已超7万台
财联社,2026-05-02 02:08:15,美军称执行对伊海上封锁已使45艘商船调转航向
同花顺,2026-05-02 01:51:47,上汽大通4月销量23860辆，同比增长35%
财联社,2026-05-02 01:51:42,美最新民调：超六成民众认为对伊朗动武是“错误决定”
财联社,2026-05-02 01:45:00,俄伊外长通电话 讨论伊朗就结束与美以冲突的立场
同花顺,2026-05-02 01:34:12,美军“福特”号航母已离开中东
财联社,2026-05-02 01:31:47,“全球坚韧船队”部分成员在希腊登岸 约30人受伤
同花顺,2026-05-02 01:23:43,伊朗外长与欧盟外长通话讨论地区局势
同花顺,2026-05-02 01:21:23,五一档首日：《寒战1994》领跑，平均票价创近4年新低
财联社,2026-05-02 01:20:07,美军在中东8国16处军事设施在伊朗袭击中受损
同花顺,2026-05-02 01:14:37,新势力4月销量放榜：零跑7万辆创新高，理想、小鹏超3万辆
财联社,2026-05-02 01:14:09,特朗普威胁提高欧盟汽车进口关税 欧盟：不可接受
财联社,2026-05-02 01:04:24,特朗普暗示不会就持续对伊朗军事行动寻求国会批准
同花顺,2026-05-02 01:02:54,伊朗：波斯湾区域新管理模式将在伊最高领袖指挥下制定
同花顺,2026-05-02 00:57:32,Coinbase表示已就加密货币法案的关键条款达成协议
财联社,2026-05-02 00:56:12,LME金属期货收盘涨跌不一
同花顺,2026-05-02 00:48:55,特朗普声称美国“几乎能立即”接管古巴
同花顺,2026-05-02 00:48:33,受中东局势缓和影响，国际油价5月1日下跌
财联社,2026-05-02 00:47:00,卡塔尔宣布将全面恢复全天候海上航运活动
同花顺,2026-05-02 00:45:23,因机场场地及运营资源调整，深航马尼拉机场休息室暂停服务
财联社,2026-05-02 00:42:44,美总统签署行政令 扩大对古巴制裁范围
同花顺,2026-05-02 00:41:18,节后首日，将有31只基金齐发
同花顺,2026-05-02 00:35:20,新疆阿克苏地区库车市发生4.5级地震
同花顺,2026-05-02 00:35:06,上海4月二手房网签量创近10年同期新高：购房者决策周期明显缩短
同花顺,2026-05-02 00:34:59,长三角铁路今日预计发送418万人次，增开旅客列车209列
同花顺,2026-05-02 00:34:46,美国批准对以色列等4国超过86亿美元军售
财联社,2026-05-02 00:33:10,特朗普称对伊朗最新提交的谈判方案“不满意”
同花顺,2026-05-02 00:31:52,胖东来回应探店博主“249元奢侈品毛巾”“走不出河南”等质疑性言论
财联社,2026-05-02 00:17:10,以官员：以军将能否移除伊朗浓缩铀视为战事“成败关键”
财联社,2026-05-02 00:15:23,伊朗议会议长：伊朗将迎来新的建设阶段
财联社,2026-05-02 00:04:44,泽连斯基称将启动对乌军的改革
财联社,2026-05-01 23:55:37,特朗普：将于下周对欧盟输美汽车和卡车加征25%关税
财联社,2026-05-01 23:48:31,美国国防部与7家人工智能公司达成合作协议
财联社,2026-05-01 23:46:30,欧股主要指数收涨
同花顺,2026-05-01 23:36:59,暴雨蓝色预警：9省区部分地区有大到暴雨，广西局地有大暴雨
同花顺,2026-05-01 23:30:30,长安汽车4月交付20.95万辆，同比增长1.7%
同花顺,2026-05-01 23:24:34,库克发出预警：内存成本将显著上涨
同花顺,2026-05-01 23:14:50,墨西哥西部发生车祸致11人死亡
同花顺,2026-05-01 23:13:23,美国至5月1日当周石油钻井总数报408口，前值407口
同花顺,2026-05-01 23:08:22,极狐汽车4月销量16532辆，同比增长101.7%
同花顺,2026-05-01 23:06:12,游戏驿站美股盘后一度涨超8%，eBay涨幅超13%
财联社,2026-05-01 22:59:49,英特尔股价触及100美元 总市值飙升至5000亿美元
财联社,2026-05-01 22:46:31,美国SEC改财报为半年披露的提案通过白宫审查
财联社,2026-05-01 22:38:24,英海军：美以伊战事致霍尔木兹海峡航运量骤降九成以上
财联社,2026-05-01 22:27:19,美官员：美军“福特”号航母已离开中东
财联社,2026-05-01 22:21:02,美国银行策略师建议做空2年期美国国债 指出美联储可能转向鹰派
财联社,2026-05-01 22:18:53,美股存储板块四大龙头盘中均创记录新高
财联社,2026-05-01 22:12:43,WTI原油失守100美元关口
财联社,2026-05-01 22:11:49,报道称自二战结束以来 美国债首次超过经济总量
财联社,2026-05-01 21:56:12,现货白银向上突破76美元
财联社,2026-05-01 21:56:05,国际油价扩大跌幅 美油期货跌超4%
财联社,2026-05-01 21:44:42,闪迪收复跌幅并转涨 今日多家机构集中大幅上调闪迪目标价
财联社,2026-05-01 21:30:49,美股三大股指小幅高开 Reddit大涨超13%
财联社,2026-05-01 20:48:07,比特币涨至78000美元 过去24小时涨2.26%
财联社,2026-05-01 20:45:48,台湾宜兰县海域发生5.4级地震 震源深度100千米
财联社,2026-05-01 20:41:35,美股盘前要闻一览：美股总市值首次突破75万亿美元大关；美国防部与7家AI公司达成协议；SpaceX计划下半年发射“星链 V3”卫星
财联社,2026-05-01 20:27:10,5月1日周五《新闻联播》要闻20条
财联社,2026-05-01 20:26:19,伊朗已向巴基斯坦递交最新谈判方案
财联社,2026-05-01 20:24:13,世界气象组织：今年南亚大部分地区季风季降雨量可能偏低
财联社,2026-05-01 20:10:07,中信建投：霍尔木兹海峡封锁是核心矛盾 阿联酋退出OPEC对油价的压制短期效果有限
财联社,2026-05-01 20:09:28,美联储哈马克：FOMC的宽松倾向已不再合适
财联社,2026-05-01 19:51:40,报道称美国“艾森豪威尔”号航母维修后重返服役
财联社,2026-05-01 19:45:18,美国防部与7家AI公司达成协议
财联社,2026-05-01 19:37:18,李强在广西调研时强调 加快推进水网建设 全面提升综合效益 为经济社会发展提供基础支撑和重要保障
财联社,2026-05-01 19:01:42,Nebius同意收购Eigen AI
财联社,2026-05-01 18:57:30,重庆、云南局地发生地质灾害的气象风险较高
财联社,2026-05-01 18:30:53,埃克森美孚第一季度实现净收益42亿美元
财联社,2026-05-01 18:21:58,沪市主板1223家公司2025年累计分红规模达1.82万亿元
财联社,2026-05-01 18:21:21,科创板连续七年保持近13%的研发投入强度 稳居A股各板块研发投入强度首位
财联社,2026-05-01 18:06:54,俄首次发射新一代运载火箭“联盟-5”号
财联社,2026-05-01 18:04:45,SpaceX：星舰项目累计投入超150亿美元 计划2026年下半年发射“星链 V3”卫星
财联社,2026-05-01 17:58:48,报道：沙特4月原油出口量出现回升 4月油运量已达到战前总量60%
财联社,2026-05-01 17:55:06,阿联酋正式退出欧佩克 中东能源格局进入变数时代
财联社,2026-05-01 17:32:08,“五一”首日上海市共接待游客387.27万人次 同比增长15.02%
财联社,2026-05-01 17:31:37,伊朗外长同欧盟外交与安全政策高级代表通话 讨论地区局势
财联社,2026-05-01 17:13:02,兆易创新：中长期来看2D NAND供应非常紧张 价格可能会持续上行
财联社,2026-05-01 17:05:04,Susquehanna将闪迪目标价从1000美元翻倍上调至2000美元
财联社,2026-05-01 16:59:48,阿塞拜疆议会宣布暂停与欧洲议会所有联系
财联社,2026-05-01 16:47:22,美银：全球超大规模云计算企业2027年AI资本开支或达1万亿美元
财联社,2026-05-01 16:43:27,俄黑海港口城市图阿普谢炼油厂再次遭袭受损
财联社,2026-05-01 16:40:50,伊朗称最高领袖身体健康
财联社,2026-05-01 16:33:11,重庆：培育未来产业标志性产品和应用场景
财联社,2026-05-01 16:30:09,美国民众因高油价放弃66号公路百年纪念之旅
财联社,2026-05-01 16:25:25,美股总市值首次突破75万亿美元大关 创历史新高
财联社,2026-05-01 16:25:25,美股总市值首次突破75万亿美元 创历史新高
财联社,2026-05-01 16:18:54,新加坡总理：中东局势或致部分经济体面临衰退风险
财联社,2026-05-01 16:11:27,现货黄金日内跌幅扩大至1%
财联社,2026-05-01 16:02:17,美股芯片存储板块盘前普跌 西部数据跌超7%
财联社,2026-05-01 15:59:57,日元午后恢复上行延续因两年来首次干预而引发的涨势
财联社,2026-05-01 15:52:28,湖北以旧换新国补扩品 新增智能服务机器人等10个品类产品
财联社,2026-05-01 15:50:11,以媒：美国“即将决定”是否重启对伊朗军事行动
财联社,2026-05-01 15:37:22,云深处科技完成IPO辅导
财联社,2026-05-01 15:28:42,内外压力叠加 欧元区经济复苏前景堪忧
财联社,2026-05-01 15:27:00,全球最大广告集团被曝为美国石油巨头打造数十亿美元 “漂绿” 营销骗局
财联社,2026-05-01 15:17:28,摆脱对美依赖 欧盟-南共市自贸协定临时生效
同花顺,2026-05-01 15:02:12,据报道美国精神航空准备停运
同花顺,2026-05-01 14:58:45,CBOT玉米主力合约涨超1%
财联社,2026-05-01 14:55:45,乌克兰官员称日本放宽武器出口限制或可让乌获得日本武器
财联社,2026-05-01 14:51:54,我国科学家揭示反刍动物甲烷排放调控机制
同花顺,2026-05-01 14:48:59,汇丰银行将苹果公司目标股价从250美元上调至260美元
财联社,2026-05-01 14:45:57,美驻黎使馆提出黎以领导人直接会晤
同花顺,2026-05-01 14:42:44,张雪机车排位赛第6
同花顺,2026-05-01 14:29:18,英特尔持续拉升，现涨超5%
同花顺,2026-05-01 14:27:32,美军最大航母“福特”号已离开中东地区
同花顺,2026-05-01 14:24:16,伊朗谈判方案已被转交美国
同花顺,2026-05-01 14:22:12,美股存储芯片板块四大龙头盘中均创记录新高
同花顺,2026-05-01 14:16:44,巴克莱将苹果目标价从248美元上调至253美元
财联社,2026-05-01 14:16:08,供应短缺 肯尼亚临时放宽燃油环保标准
同花顺,2026-05-01 14:15:30,阿联酋今起正式退出欧佩克
同花顺,2026-05-01 14:15:10,航运数据显示，委内瑞拉4月石油出口量增至123万桶/日
同花顺,2026-05-01 14:13:45,国际油价继续下跌，WTI原油期货价格跌4.87%
同花顺,2026-05-01 14:12:42,现货黄金站上4650美元/盎司
同花顺,2026-05-01 14:11:39,伊朗足协主席：国家队是否赴美参加世界杯仍需与国际足联沟通协调
同花顺,2026-05-01 14:11:25,美股光通信股集体走高，lumentum控股涨逾7%
财联社,2026-05-01 14:09:30,交通运输部：4月30日全社会跨区域人员流动量22074.8万人次 同比增长3.5%
同花顺,2026-05-01 14:04:36,达拉斯联储主席洛根反对美联储政策声明中隐含的降息倾向
同花顺,2026-05-01 14:03:58,苹果涨超5%
同花顺,2026-05-01 14:02:22,现货黄金站上4640美元/盎司
同花顺,2026-05-01 14:00:23,美国4月ISM制造业PMI 52.7，预期53，前值52.7
同花顺,2026-05-01 13:59:55,美国股市涨幅扩大，纳斯达克综合指数上涨1.00%
同花顺,2026-05-01 13:55:52,国际油价扩大跌幅，布伦特原油失守108美元/桶
同花顺,2026-05-01 13:55:25,现货白银站上76美元/盎司
财联社,2026-05-01 13:53:46,日本开始追加释放国家石油储备
同花顺,2026-05-01 13:53:23,埃克森美孚CEO：霍尔木兹海峡重新开放后航运流量需1-2个月恢复
财联社,2026-05-01 13:48:40,最低工资托底、划定派费直达底线 上海首份快递行业劳动规则协议出炉
财联社,2026-05-01 13:36:10,杭州为具身智能机器人立法 今起施行
同花顺,2026-05-01 13:31:39,社媒平台Reddit大涨超13%
同花顺,2026-05-01 13:30:47,美股开盘：美股三大指数集体高开
财联社,2026-05-01 13:29:27,加快场景培育开放 河南出台三年行动方案
同花顺,2026-05-01 13:28:02,以军向黎巴嫩南部一村庄发布紧急撤离警告
同花顺,2026-05-01 13:13:40,美国国际集团高管：软件相关风险敞口约为1.3亿美元
同花顺,2026-05-01 13:04:31,强生美股盘前涨超4%
财联社,2026-05-01 12:37:18,中国驻欧盟使团：欧洲议会有关决议粗暴干涉中国内政，已提出严正交涉
财联社,2026-05-01 12:34:09,驻日美军舰载机陆上起降训练再次引发抗议
财联社,2026-05-01 12:32:12,品牌金饰克价超1400元 贵金属分析师：预计价格中心年内将逐步上移
同花顺,2026-05-01 12:28:21,5月1日 周五《新闻联播》要闻14条
同花顺,2026-05-01 12:27:31,伊朗递交最新谈判方案
同花顺,2026-05-01 12:25:26,纳斯达克100指数期货抹去早前跌幅
财联社,2026-05-01 12:12:35,中方对美起草安理会涉南苏丹决议一意孤行表示遗憾
同花顺,2026-05-01 12:10:40,美联储哈马克：联邦公开市场委员会的宽松倾向已不再合适
同花顺,2026-05-01 12:09:42,奇瑞集团4月销量25.1万辆，同比增长25.2%
财联社,2026-05-01 12:02:47,蔚来4月交付新车29356台 同比增长22.8%
同花顺,2026-05-01 12:01:59,美联储哈玛克：2026年经济迄今表现强劲
同花顺,2026-05-01 11:58:33,阿古斯研究将高通目标价从180美元上调至220美元
同花顺,2026-05-01 11:58:11,伊朗外长与多国外长通话 通报结束战争最新立场
同花顺,2026-05-01 11:57:32,苹果美股盘前涨超4%
财联社,2026-05-01 11:51:23,美联邦通信委员会审议通过检测认证和电信领域相关限制措施 商务部回应
财联社,2026-05-01 11:44:46,郑栅洁：推进算力资源规模化、集约化、绿色化、普惠化发展 深化拓展“人工智能+”
同花顺,2026-05-01 11:40:02,雷蒙德·詹姆斯将闪迪目标股价从725美元上调至1470美元
