来源,时间,标题
财联社,2026-04-02 07:50:33,具身智能机器人广东省工程研究中心获批组建
同花顺,2026-04-02 07:48:10,大疆回应新品盲订
同花顺,2026-04-02 07:47:18,骑手举报 行业自查 北京市场监管首次全链路共治餐饮违规
财联社,2026-04-02 07:47:04,品种创新 首季熊猫债发行规模大增
同花顺,2026-04-02 07:46:50,莎普爱思：与温州医科大学附属眼视光医院等签署技术转让合同
财联社,2026-04-02 07:46:36,【点金互动易】创新药+抗癌药，这家公司自研多个一类新药平台，核心产品对标主流药物更具疗效优势，且拥有高壁垒的高血压细分赛道放量预期
财联社,2026-04-02 07:46:01,中信建投：看好锂电设备与固态电池板块配置价值
财联社,2026-04-02 07:42:57,一季度超1600只基金分红531亿元 债基分红数量占据绝对主力
财联社,2026-04-02 07:41:59,公募独门股数量锐减 高弹性标的居多
同花顺,2026-04-02 07:30:32,“十四五”期间，我国发布物流领域国家标准210项
同花顺,2026-04-02 07:28:49,外交部再回应霍尔木兹海峡通航问题，当前的关键是尽快停止军事行动
同花顺,2026-04-02 07:27:58,外交部：中国和库克群岛的关系不针对第三方，也不应当受到第三方的干扰和制约
同花顺,2026-04-02 07:26:18,商务部介绍中国-东盟自贸区3.0版最新进展
同花顺,2026-04-02 07:17:50,万马股份：目前不涉及光纤、光纤预制棒业务
同花顺,2026-04-02 07:13:07,商务部回应Meta收购Manus及企业跨国经营问题
财联社,2026-04-02 07:09:38,新研究警示吸电子烟可能致癌
财联社,2026-04-02 07:08:32,【研选】创新药板块周期向上与成长兼具，内外需共振，价值迎修复拐点；公司BD价值兑现，加速生物药创新成果从“中国研发”向“全球变现”转化，为后续管线BD合作树立标杆
同花顺,2026-04-02 07:08:23,伊朗最高领袖顾问：霍尔木兹海峡对伊朗人民的敌人将永远关闭
财联社,2026-04-02 07:08:18,450Tb/s！商业光纤数据传输速度创纪录
财联社,2026-04-02 07:07:36,新型催化剂助力乙烯工业高效净化
同花顺,2026-04-02 07:07:12,中兴通讯、摩尔线程等成立产业创新中心公司
同花顺,2026-04-02 07:06:55,“832平台乡村振兴公益行”2026年首发活动在广西启动
同花顺,2026-04-02 07:03:19,欧洲主要股指集体低开
同花顺,2026-04-02 07:03:11,南向资金净买入超100亿港元
同花顺,2026-04-02 07:02:53,A股收评：沪指跌0.74%险守3900点 全市场超4300家个股下跌
财联社,2026-04-02 07:02:02,逾1300家公司一季度获机构调研 四大行业备受青睐
同花顺,2026-04-02 07:01:57,ETF收评：标普油气ETF领涨6.51%，中韩半导体ETF领跌4.86%
财联社,2026-04-02 06:59:16,百亿级私募调仓路线图浮现
同花顺,2026-04-02 06:53:24,石油涨价、内存飙涨：家电业4月开启涨价潮 涨幅最高20%
财联社,2026-04-02 06:43:03,AI缺电逻辑持续演绎 燃气轮机需求激增
财联社,2026-04-02 06:41:26,逾八成消费电子及家电A股公司2025年实现盈利
财联社,2026-04-02 06:38:21,3月楼市成交反弹 百家典型房企销售环比增长127.1%
财联社,2026-04-02 06:36:53,美国执行载人绕月任务火箭发射升空
财联社,2026-04-02 06:36:22,5亿元逆回购创10年新低 4月流动性料维持偏松
财联社,2026-04-02 06:33:54,周四你需要知道的隔夜全球要闻：中东停战预期升温，国际油价承压，金价四连涨，美股四月开门红
同花顺,2026-04-02 06:21:52,报道：俄罗斯对生产商实施汽油出口禁令，期限至7月底
同花顺,2026-04-02 06:21:29,华谊集团投资成立化工公司，注册资本1亿元
同花顺,2026-04-02 06:13:53,卡塔尔航空将恢复更多中国航线，中国航司仍停飞
同花顺,2026-04-02 06:12:05,日本40年期国债收益率上升6.5个基点
同花顺,2026-04-02 06:09:12,国际金价银价持续下挫，现货黄金失守4570美元/盎司
同花顺,2026-04-02 06:09:01,上期所沪金主力合约跌超2%
财联社,2026-04-02 06:08:51,美联储4月维持利率不变的概率为97.4%
同花顺,2026-04-02 06:07:56,上期所沪银主力合约大跌6%
同花顺,2026-04-02 06:05:14,欧洲天然气价格上涨幅度高达7.2%
同花顺,2026-04-02 06:04:52,奇瑞集团3月出口近15万辆汽车
同花顺,2026-04-02 06:03:02,广州：建设多元融合的城市一张算力网，加强算力基础设施建设统筹
同花顺,2026-04-02 06:02:30,现货黄金失守4580美元/盎司
同花顺,2026-04-02 06:01:46,上期所原油主力合约大涨5% 郑商所甲醇主力合约涨超4%
财联社,2026-04-02 06:01:41,美油低开超1%
同花顺,2026-04-02 05:59:27,深证成指跌2%
同花顺,2026-04-02 05:57:58,俄研制的mRNA个性化癌症疫苗启动临床应用
同花顺,2026-04-02 05:57:33,富时中国A50指数期货跌1%
财联社,2026-04-02 05:56:18,消息人士称伊朗要求停火谈判必须以永久结束战争为前提
同花顺,2026-04-02 05:55:23,广州：目标到2030年，基本建成现代化基础设施体系
同花顺,2026-04-02 05:53:59,上证指数跌1%
财联社,2026-04-02 05:42:05,美情报机构：伊朗目前无意参与实质性谈判
财联社,2026-04-02 05:41:39,伊朗外交部发言人：伊朗已做好应对任何攻击的准备
同花顺,2026-04-02 05:33:43,上期所沪银主力合约大跌5% COMEX白银期货大跌6%
财联社,2026-04-02 05:31:56,周四（4月2日）重点关注财经事件和经济数据
同花顺,2026-04-02 05:27:49,内蒙古阿拉善盟阿拉善右旗发生3.1级地震
财联社,2026-04-02 05:27:16,伊朗称其反击行动最终目标包括美军撤离中东
同花顺,2026-04-02 05:24:54,医药商业板块午后再度拉升
同花顺,2026-04-02 05:24:49,美国10年期国债收益率上升6个基点至4.38%
财联社,2026-04-02 05:21:28,美元指数1日下跌
同花顺,2026-04-02 05:20:04,俄外交部：日本部署远程导弹的后果不堪设想
同花顺,2026-04-02 05:18:42,欧股期货走低，欧洲斯托克50指数期货跌幅扩大至2%
同花顺,2026-04-02 05:17:36,伯克希尔在市场波动之际聘请银行安排日元债券发行
同花顺,2026-04-02 05:11:34,ETF两市成交额超4000亿元
财联社,2026-04-02 05:09:50,国际油价1日下跌
同花顺,2026-04-02 05:03:10,恒宇信通应收账款增加引质疑，最新回应
同花顺,2026-04-02 05:02:45,创业板指跌2%
同花顺,2026-04-02 05:02:25,能源冲击韩公共部门车辆将单双号限行
同花顺,2026-04-02 05:01:11,上证50股指期货(IH)主力合约日内跌超1%
同花顺,2026-04-02 04:57:17,英媒：欧洲国家曾被特朗普威胁加入“霍尔木兹联盟”
财联社,2026-04-02 04:54:00,俄国防部称完全控制卢甘斯克 乌暂未回应
财联社,2026-04-02 04:53:20,法国欲召集多国讨论霍尔木兹海峡局势
同花顺,2026-04-02 04:48:57,北上广深二手房成交集体井喷 喜提“小阳春”
同花顺,2026-04-02 04:41:33,以军称监测到伊朗四次对以袭击
同花顺,2026-04-02 04:36:33,江苏信托原董事长调任江苏国信，总经理代行董事长职责
同花顺,2026-04-02 04:35:12,丰田汽车公司将面向日本市场销售美国制造的Tundra和Highlander车型
同花顺,2026-04-02 04:33:15,英国将召集35国开会讨论恢复霍尔木兹海峡通航，不包括美国
同花顺,2026-04-02 04:30:38,腾讯版“小龙虾”WorkBuddy就登录异常致歉：将向所有受影响国内用户补偿1000 Credits
同花顺,2026-04-02 04:29:49,布伦特原油站上108美元/桶
同花顺,2026-04-02 04:25:54,特朗普抱怨北约不帮忙只会找借口
同花顺,2026-04-02 04:25:38,印尼解除海啸预警
同花顺,2026-04-02 04:17:58,印尼马鲁古海峡发生7.4级地震 一人死亡
同花顺,2026-04-02 04:17:49,中欧班列中通道一季度通行中欧班列超1100列
同花顺,2026-04-02 04:13:56,石油ETF华安今日上市
同花顺,2026-04-02 04:12:00,荣耀前CMO郭锐官宣加入智界，出任董事长兼CEO
同花顺,2026-04-02 04:08:27,国家药监局发布“生物制品分段生产”操作指南
财联社,2026-04-02 04:02:57,热门中概股收盘多数上涨 利弗莫尔中概股龙头指数涨0.65%
财联社,2026-04-02 04:01:37,美股纳指收涨超1% 芯片股走强
财联社,2026-04-02 03:56:22,美国将委内瑞拉代总统移出制裁名单
财联社,2026-04-02 03:31:59,特朗普要求军方提夺取伊核材料计划
财联社,2026-04-02 03:29:12,伊朗最高领袖外交政策顾问遇袭重伤
财联社,2026-04-02 03:11:23,伊朗最高领袖发表致辞 缅怀冲突死难者
财联社,2026-04-02 03:07:46,美国防部将部署在中东的A-10攻击机规模扩大一倍
同花顺,2026-04-02 02:59:54,野村：特朗普讲话未发出缓和紧张局势的明确信号，亚洲货币兑美元可能走弱
财联社,2026-04-02 02:57:36,伊朗总统致美国人民公开信：伊朗人民对其他国家没有敌意
同花顺,2026-04-02 02:55:50,德国新规：加油站一天只准涨价一次
同花顺,2026-04-02 02:54:41,国家医保局专项行动继续打击“回流药”违法链条
同花顺,2026-04-02 02:50:34,南向资金净买入超50亿港元
同花顺,2026-04-02 02:48:45,三星领跌韩国科技股
同花顺,2026-04-02 02:47:43,国家制造强国建设战略咨询委员会副主任苏波：未来10年，我国仍要坚持智能制造主攻方向不动摇
同花顺,2026-04-02 02:46:41,沪深京三市成交额超1万亿元，较上日此时缩量1313亿元
同花顺,2026-04-02 02:45:20,千问AI眼镜首次OTA升级 接入淘宝闪购、支付宝等
同花顺,2026-04-02 02:36:22,国家药监局：到2030年“人工智能+药品监管”运行管理机制基本形成
同花顺,2026-04-02 02:35:03,创新药板块震荡走强 津药药业5连板
同花顺,2026-04-02 02:34:10,蚂蚁联合清华大学开源ClawAegis
同花顺,2026-04-02 02:33:48,内外盘白银期货、现货走低
同花顺,2026-04-02 02:33:36,美军前司令警告说登陆伊朗后果严重
同花顺,2026-04-02 02:33:12,智界汽车官宣郭锐为董事长兼首席执行官
同花顺,2026-04-02 02:32:16,美股股指期货跌势扩大，标普500期指跌逾1%
财联社,2026-04-02 02:28:33,以军称两天内空袭伊朗约400个目标
财联社,2026-04-02 02:19:44,伊朗237名学生死于美以袭击
财联社,2026-04-02 01:58:08,山西一煤业公司发生冒顶事故 4人被困
财联社,2026-04-02 01:41:40,伊朗媒体：伊朗总统将发表致美国人民公开信
财联社,2026-04-02 01:40:17,特朗普称伊朗目前“已无能力”发展核武器
财联社,2026-04-02 01:37:55,伊朗军方高官：抵抗阵线在对美以战斗中展现力量
同花顺,2026-04-02 01:36:16,福建：到2030年全省竹产业全产业链产值突破1500亿元
同花顺,2026-04-02 01:35:52,电力板块初盘冲高 新中港、乐山电力涨停
同花顺,2026-04-02 01:35:04,日经225指数向下跌破53000点
财联社,2026-04-02 01:34:35,三国际机构决定成立协调小组应对中东战争的经济影响
同花顺,2026-04-02 01:33:54,机场航运板块开盘走弱 中国东航跌超4%
同花顺,2026-04-02 01:33:52,布伦特原油站上106美元/桶
同花顺,2026-04-02 01:32:43,现货黄金失守4650美元/盎司 纽约期金失守4680美元/盎司
同花顺,2026-04-02 01:31:38,美股纳斯达克100指数期货跌超1%
同花顺,2026-04-02 01:31:29,现货黄金失守4680美元/盎司
同花顺,2026-04-02 01:31:17,特朗普：若无法达成协议，将猛烈打击伊朗所有发电厂
同花顺,2026-04-02 01:30:33,贵金属板块集体低开 晓程科技低开近4%
同花顺,2026-04-02 01:30:21,股指期货早盘开盘 主力合约集体低开
同花顺,2026-04-02 01:28:12,油气开采板块再度高开 贝肯能源高开近6%
同花顺,2026-04-02 01:27:35,韩元兑美元跌破1500关口
同花顺,2026-04-02 01:26:31,ETF开盘：上证580ETF领涨7.56%，巴西ETF领跌2.34%
同花顺,2026-04-02 01:26:22,现货白银失守73美元/盎司
同花顺,2026-04-02 01:25:55,现货黄金失守4700美元/盎司
同花顺,2026-04-02 01:25:36,A股开盘：三大指数集体低开
财联社,2026-04-02 01:14:02,伊朗称600多处教育设施遭美以蓄意袭击
财联社,2026-04-02 01:08:38,消息人士称特朗普开出停火条件：需满足美方“特定要求”
财联社,2026-04-02 00:52:54,LME期铜收涨99美元
财联社,2026-04-02 00:49:33,伊朗总统强调捍卫国家独立与安全
财联社,2026-04-02 00:46:54,伊朗军方称打击以色列军工企业
财联社,2026-04-02 00:45:48,伊朗强调不理会美以的“幻想与谎言”
财联社,2026-04-02 00:23:11,美官员称美军已损失16架MQ-9型“死神”无人机
同花顺,2026-04-02 00:20:42,仙乐健康：2026年第一季度取得2项发明专利证书、1项保健食品注册证书和8项保健食品备案凭证
同花顺,2026-04-02 00:19:17,中信证券：预计保险板块调整结束，建议积极把握重大机遇期
同花顺,2026-04-02 00:19:00,印尼北马鲁古省附近海域发生7.6级地震已发布海啸预警
同花顺,2026-04-02 00:12:45,美媒：美军方已制定夺取伊朗浓缩铀的计划
同花顺,2026-04-02 00:10:47,WTI原油失守98美元/桶
财联社,2026-04-02 00:06:44,俄外长：若被视为伊朗问题调解方 俄方愿提供协助
同花顺,2026-04-02 00:04:06,布伦特原油失守100美元/桶
同花顺,2026-04-01 23:57:01,穆杰塔巴号召民众植树缅怀死难者
财联社,2026-04-01 23:55:21,美股三大指数涨幅继续扩大 标普500指数重新触及6600点
同花顺,2026-04-01 23:55:00,华西证券：当下AI应用发展迅速，叠加文娱消费回暖
同花顺,2026-04-01 23:53:58,今麦郎董事长回应手打是商标
财联社,2026-04-01 23:50:32,伊朗革命卫队称“完全掌控”霍尔木兹海峡局势
财联社,2026-04-01 23:48:59,美股存储板块全线爆发 美光、西部数据、闪迪均涨超10%
财联社,2026-04-01 23:45:27,特朗普成首位出席美最高法庭审总统
同花顺,2026-04-01 23:45:15,马斯克与美国SEC就有关推特持股争议一案或将进入庭审
同花顺,2026-04-01 23:44:00,伊朗外交部发言人：美方要求“过分且不合理”
财联社,2026-04-01 23:41:04,欧洲各国股市均大幅收涨 多国股指涨超3%
同花顺,2026-04-01 23:35:40,美机构发布预警：印尼附近海域地震或引发海啸
财联社,2026-04-01 23:33:03,美官员称美伊讨论以重开霍尔木兹海峡为条件的停火协议
同花顺,2026-04-01 23:31:51,现货黄金站上4800美元/盎司
财联社,2026-04-01 23:30:53,伊朗重申将封锁霍尔木兹海峡作为反制手段
财联社,2026-04-01 23:26:48,刚刚过去的一个小时 以色列遭开战以来最大规模导弹袭击
同花顺,2026-04-01 23:23:34,京东集团公布100亿元以人民币计值的优先票据定价
财联社,2026-04-01 23:21:37,美股石油股普跌 西方石油跌逾4%
财联社,2026-04-01 23:17:32,亿万富翁马斯克旗下的SpaceX公司已秘密提交IPO文件
同花顺,2026-04-01 23:14:05,自然资源部：印尼马鲁古海北部海域地震不会对我国沿岸造成影响
财联社,2026-04-01 23:13:36,富临运业：实际控制人将变更为东阳市国资办 明起复牌
同花顺,2026-04-01 23:05:19,全球最大的白银ETF iShares Silver Trust持仓量较前日减少2.82吨
同花顺,2026-04-01 23:03:24,印尼发生7.6级地震
财联社,2026-04-01 23:01:20,部分期货品种夜盘收盘 几乎全线下跌
财联社,2026-04-01 23:00:37,【季报高增长】半导体+IGBT，一季度净利润同比增长超20%，这家公司聚焦适配AI领域需求的功率半导体产品研发，受益于全球半导体行业的涨价潮从存储芯片迅速蔓延至功率芯片等领域的趋势
财联社,2026-04-01 23:00:23,中东最大铝生产商阿联酋环球铝业的冶炼厂停运 袭击严重破坏运营
同花顺,2026-04-01 23:00:14,WTI原油失守99美元/桶
财联社,2026-04-01 22:57:15,伊朗以色列同时大规模互袭
同花顺,2026-04-01 22:56:49,印尼马鲁古海峡附近发生7.5级左右地震
财联社,2026-04-01 22:55:20,港股IPO：宜美智科递表港交所
财联社,2026-04-01 22:52:06,美国制造业扩张速度创2022年来最高 伊朗战争推动投入成本跃升
财联社,2026-04-01 22:48:58,港股IPO：AR眼镜公司XREAL Ltd.递表港交所
同花顺,2026-04-01 22:42:24,新投资额度火速“上架”，QDII产品集体开门迎客
同花顺,2026-04-01 22:39:05,首季熊猫债发行规模大增
财联社,2026-04-01 22:30:39,美国能源信息署：美国上周原油库存增加545.1万桶 远高于市场预期
财联社,2026-04-01 22:29:14,伊朗革命卫队：若美以实施“恐怖行动”将对等回应
同花顺,2026-04-01 22:26:55,现货白银失守74美元/盎司
同花顺,2026-04-01 22:18:36,5亿元逆回购创10年新低，分析称4月流动性料维持偏松
财联社,2026-04-01 22:18:32,【公告全知道】算力+商业航天+智能电网+储能+绿色电力！公司成功打造全国首个算电协同项目并持股蓝箭航天
财联社,2026-04-01 22:14:29,伊朗外长：只有伊朗和阿曼才能决定霍尔木兹海峡的未来
财联社,2026-04-01 22:14:12,克罗地亚决定释放储备柴油
财联社,2026-04-01 22:13:40,俄罗斯表示将继续推进火箭核发动机研究
财联社,2026-04-01 22:10:21,德国回应特朗普“退约”威胁 称将继续支持北约
同花顺,2026-04-01 22:08:37,全球最大的黄金ETF SPDR Gold Trust持仓较前日增加3.71吨
同花顺,2026-04-01 22:04:42,现货白银跌超1%
同花顺,2026-04-01 22:01:16,COMEX白银期货跌超1%
财联社,2026-04-01 21:59:15,财联社4月1日晚间新闻精选
财联社,2026-04-01 21:56:38,伊朗回应特朗普停火言论 称霍尔木兹海峡不对敌开放
财联社,2026-04-01 21:54:55,美股存储概念股延续强势上涨
财联社,2026-04-01 21:53:28,【风口研报·洞察】游戏行业将4月迎来新品上线潮，多个重磅作品陆续面世，分析师指出当前游戏板块估值中枢处于14-15倍PE，仅高于18年及22年版号停发期间，后续有望迎来修复；反攻之路配置科技制造与内需
财联社,2026-04-01 21:48:37,伊朗首都德黑兰发生爆炸
财联社,2026-04-01 21:34:42,伊朗称已击落150架美以无人机
财联社,2026-04-01 21:33:53,伊朗称超11.5万处民用设施在冲突中受损
财联社,2026-04-01 21:32:32,特朗普称将很快撤出伊朗战事
财联社,2026-04-01 21:30:37,美股三大指数集体高开 耐克跌超12%
财联社,2026-04-01 21:28:49,多家银行4月1日起下调部分存款挂牌利率 短期产品成重点
财联社,2026-04-01 21:23:46,瑞安航空：欧洲5月可能出现航空燃油短缺
财联社,2026-04-01 21:23:05,史上最严充电宝新规2027年4月实施 多电芯企业通过摸底测试
财联社,2026-04-01 21:22:19,云南2.25GW风、光项目竞配启动
财联社,2026-04-01 21:21:38,【财联社早知道】高盛预计到2026Q4全球AI相关硬件营收将突破7000亿美元，机构称2026年或迎来AI第三次算力需求高增，这家公司已建立了全面的产品系列，能够为客户提供一站式的配套光纤器件解决方案
财联社,2026-04-01 21:20:29,埃及首都开罗一服装厂发生火灾 致9死17伤
财联社,2026-04-01 21:19:41,尹锡悦看守所内“吸金”12亿韩元 比李在明年薪高数倍
同花顺,2026-04-01 21:17:19,富时中国A50指数期货夜盘收涨0.03%
财联社,2026-04-01 21:13:17,内塔尼亚胡当年曾怂恿美国打伊拉克
财联社,2026-04-01 21:10:50,伊朗发动“真实承诺-4”行动第89波攻势
财联社,2026-04-01 21:10:10,甘肃：“十五五”风光新增80GW 开展“新能源+”十大行动
同花顺,2026-04-01 20:28:25,印度政府公告：自4月2日起至6月30日止，对部分化学品的进口关税降至零
财联社,2026-04-01 20:17:47,气象局最新预测：今年将有7至9个台风登陆或影响我国沿海
财联社,2026-04-01 20:14:16,美国法官裁定白宫“断供”公共媒体违宪
财联社,2026-04-01 20:13:11,【风口研报·公司】3D视觉与英伟达Jetson Thor平台适配，这家公司细分产品市占率超70%，与优必选、普渡等超100家机器人企业达成合作；公司最新季度业绩增长提速，海外市场爆发的新兴赛道布局领先
财联社,2026-04-01 20:11:02,阿联酋已拦截超2000架无人机
同花顺,2026-04-01 20:00:32,美股收评：美股三大指数集体收涨
财联社,2026-04-01 19:58:48,美联储巴尔金：预期通胀进展缓慢 不会迅速回到目标
财联社,2026-04-01 19:58:42,4月1日周三《新闻联播》要闻19条
同花顺,2026-04-01 19:55:45,伊朗媒体：伊朗前外长在空袭中受伤
财联社,2026-04-01 19:55:04,交易员称美股本轮劲扬主要由空头回补所致 并非伊朗和平前景
财联社,2026-04-01 19:51:39,美股黄金股盘前续涨
财联社,2026-04-01 19:49:02,小鹏副总裁魏斌已于近期离职
财联社,2026-04-01 19:48:33,胜蓝股份：控股股东及部分董事拟合计减持不超3.19%公司股份
同花顺,2026-04-01 19:46:16,伊朗：600多所学校和教育中心遭蓄意袭击
财联社,2026-04-01 19:45:10,奥来德：控股股东、实际控制人及一致行动人、部分高管拟合计减持不超过3%
财联社,2026-04-01 19:44:48,美官员称美军意图扩大在格陵兰岛军事存在
财联社,2026-04-01 19:44:09,伊朗称打击美预警机加油机部署地
同花顺,2026-04-01 19:27:09,山西一煤业公司发生冒顶事故4人被困 救援进行中
财联社,2026-04-01 19:22:36,崔东树：1-2月锂电池出口额142亿美元 增长46%
财联社,2026-04-01 19:19:32,以色列空袭贝鲁特南部致5死21伤
财联社,2026-04-01 19:19:12,能特科技：因涉嫌信息披露违法违规被中国证监会立案
财联社,2026-04-01 19:17:46,【机构龙虎榜解读】CPO设备+半导体设备+数据中心，在光通信CPO半导体领域推出了多款设备，可应用于AI服务器和数据中心等功能模块及器件制造环节，相关设备已实现销售并保持稳步增长，这家公司获净买入
财联社,2026-04-01 19:16:31,由于缺少燃料 日本海洋研究开发机构被迫中止4月海洋调查计划
同花顺,2026-04-01 19:13:40,穆杰塔巴号召伊朗民众“以烈士的名义”种树
财联社,2026-04-01 19:09:00,埃尔多安谴责美以袭击伊朗 称将坚决避免该国受波及
财联社,2026-04-01 19:08:23,城投控股：股东弘毅基金拟减持不超3%股份
财联社,2026-04-01 19:05:56,国芯科技：股东拟合计减持不超1.5%股份
财联社,2026-04-01 19:05:38,英国将举办国际会议讨论恢复霍尔木兹海峡通航
财联社,2026-04-01 19:05:30,尿素市场交投按需 价格窄幅波动
财联社,2026-04-01 19:04:37,高盛：预计到2026年第四季度 AI相关硬件营收将突破7000亿美元
财联社,2026-04-01 19:02:14,重庆市政府原参事赵江平接受纪律审查和监察调查
同花顺,2026-04-01 19:01:31,在岸人民币兑美元夜盘收盘报6.8750，较上一交易日上涨131点
财联社,2026-04-01 19:00:44,东鹏饮料：拟10亿至20亿元回购股份 不低于90%将用于注销并减少注册资本
财联社,2026-04-01 18:59:42,《2025年中国专利调查报告》发布 企业发明专利产业化率达54.0%
财联社,2026-04-01 18:58:56,行云科技：公司及子公司预计不超过70亿元用于服务器设备及零部件采购
同花顺,2026-04-01 18:58:20,伊朗总统致美国人民公开信
财联社,2026-04-01 18:58:11,不点名抨击特朗普？马克龙：有些国家可能会在不通知你的情况下伤害你
财联社,2026-04-01 18:54:41,博汇股份：预计一季度净利润同比增长184%-205%
同花顺,2026-04-01 18:42:04,德国索林根持刀伤人事件致两人受伤
同花顺,2026-04-01 18:23:14,纳斯达克100指数涨幅收窄至1.0%，此前一度上涨1.8%
财联社,2026-04-01 18:22:42,普京：全球油气供应面临挑战 俄可提供“解决方案”
财联社,2026-04-01 18:20:25,澳总理：伊朗战事对澳经济的冲击将持续数月
财联社,2026-04-01 18:19:06,【风口研报·记者传真】“一天一个价”！这个化工品种进入3月飙涨90%，产品供不应求，上市公司获益几何？
财联社,2026-04-01 18:18:20,中东战争推高燃油价格 亚太地区消费者加速“弃油转电”
财联社,2026-04-01 18:16:14,三江购物：股东阿里泽泰拟减持不超2%公司股份
财联社,2026-04-01 18:12:25,珠海中富：筹划控制权变更 股票明起停牌
财联社,2026-04-01 18:11:20,光华科技：董事蔡雯因涉嫌内幕交易被立案
财联社,2026-04-01 18:11:01,以军称黎巴嫩真主党南方阵线指挥官身亡
财联社,2026-04-01 18:07:44,云南对一起交通事故查处实行挂牌督办
财联社,2026-04-01 18:07:08,云南白药：INB301注射液获准开展肿瘤恶病质临床试验
财联社,2026-04-01 18:06:28,欧洲央行管委马赫鲁夫：已准备好在数据明确战争影响时采取行动
财联社,2026-04-01 18:04:59,上汽集团：2025年度净利润101.06亿元 同比增长506.45%
财联社,2026-04-01 18:04:53,沪电股份：同意投资约68亿元建设印制电路板生产项目
财联社,2026-04-01 18:04:08,宁波港：2025年度净利润51.68亿元 同比增长5.63%
同花顺,2026-04-01 18:04:08,现货黄金涨超1%
财联社,2026-04-01 18:03:02,百利天恒：iza-bren联合用药获2个II/III期临床试验批准
同花顺,2026-04-01 17:56:50,山西一煤业公司发生冒顶事故，4人被困
同花顺,2026-04-01 17:50:41,LME金属期货收盘集体上涨
同花顺,2026-04-01 17:45:29,礼来首席执行官：礼来公司反对将特朗普时期的药品定价协议写入法律
财联社,2026-04-01 17:29:41,华谊兄弟：5640万元债务逾期及账户被冻结
财联社,2026-04-01 17:28:51,伊朗副议长：目前最高领袖未批准任何谈判
