来源,时间,标题
同花顺,2025-11-03 09:07:11.000,郭守敬望远镜已发布光谱数2807万条 恒星参数1159万组
同花顺,2025-11-03 09:05:08.000,王东明会见日本工会总联合会代表团
财联社,2025-11-03 09:04:05.000,广东：2025年底前扩展工业旅游资源数到300家左右
同花顺,2025-11-03 09:03:17.000,英国西北部一列车脱轨 当地进入“重大事故”应急状态
同花顺,2025-11-03 09:01:55.000,美股中概股盘前涨跌互现，小马智行涨1%
同花顺,2025-11-03 09:01:48.000,美股科技“七姐妹”盘前多数上涨，Meta涨1%
财联社,2025-11-03 09:01:24.000,广东：组织好“粤超”足球赛、“省港杯”足球赛等区域精品赛事
财联社,2025-11-03 09:00:34.000,国内商品期货市场开盘多数下跌
同花顺,2025-11-03 08:57:36.000,土耳其总统谴责以色列违反停火协议
同花顺,2025-11-03 08:56:24.000,思维列控今日跌9.87%，有4家机构专用席位净卖出1.25亿元
同花顺,2025-11-03 08:55:39.000,四川黄金：取得采矿许可证及完成探矿权延续登记
同花顺,2025-11-03 08:53:28.000,国药现代：控股子公司签署药品上市许可转让合同
同花顺,2025-11-03 08:51:24.000,知情人士：威马汽车预计月底开新车发布会，目前售后还没完全恢复
同花顺,2025-11-03 08:49:42.000,凯伦股份：控股子公司签订1.98亿元日常经营重大合同
同花顺,2025-11-03 08:48:18.000,黄金税收新规出台后，招行实体金条价格已含税
同花顺,2025-11-03 08:41:55.000,赛托生物：子公司收到甲泼尼龙化学原料药上市申请批准通知书
同花顺,2025-11-03 08:40:07.000,恒瑞医药：瑞维鲁胺片获临床试验批准
同花顺,2025-11-03 08:37:28.000,北方稀土：人形机器人正成为稀土磁材需求增长的核心新引擎
同花顺,2025-11-03 08:32:15.000,同和药业：公司通过美国FDA现场检查
同花顺,2025-11-03 08:29:49.000,沈阳原上汽通用工厂改造，吉利将借其缓解银河产能压力
同花顺,2025-11-03 08:25:32.000,工行回应暂停部分如意金积存业务：公告属实 存量客户处于有效期内不受影响
同花顺,2025-11-03 08:23:54.000,2025年国谈现场环节正式结束
同花顺,2025-11-03 08:23:47.000,申通快递：完成收购浙江丹鸟物流科技有限公司100%股权
财联社,2025-11-03 08:21:19.000,长城科技：实际控制人正在筹划股份协议转让事宜 停牌不超过2个交易日
财联社,2025-11-03 08:14:30.000,中泰证券：政策与技术双轮驱动 光伏产业迈向高质量发展
财联社,2025-11-03 08:10:14.000,财联社11月3日早间新闻精选
财联社,2025-11-03 08:09:14.000,特朗普称尚未认真考虑向乌克兰提供“战斧”导弹
财联社,2025-11-03 08:06:58.000,【九点特供】燃料从“铀”到“钍”，中国核能科技实现全新突破，分析师看好我国钍资源储量丰富，钍基熔盐堆可以助力能源独立，这家公司在钍基熔盐堆领域具有丰富的技术储备和产品销售
财联社,2025-11-03 08:03:58.000,奥特曼称OpenAI年收入远超130亿美元
财联社,2025-11-03 08:03:50.000,马尔代夫正式实施“世代禁烟令”
同花顺,2025-11-03 08:02:30.000,美国能源部长称重启核试验“不包含核爆炸”
财联社,2025-11-03 07:58:41.000,石四药集团：维生素B6注射液通过仿制药质量和疗效一致性评价
同花顺,2025-11-03 07:55:12.000,韩建河山：公司中标项目签订合同，金额为2.07亿元
同花顺,2025-11-03 07:54:03.000,城发环境：入选印尼垃圾发电项目供应商
同花顺,2025-11-03 07:53:54.000,大连电瓷：预中标国家电网5900万元项目
财联社,2025-11-03 07:53:40.000,投资日历：周一资本市场大事提醒
同花顺,2025-11-03 07:53:31.000,凯龙高科：取得E-mark认证
同花顺,2025-11-03 07:52:52.000,开云集团Bottega Veneta将宣布调价，预计上调20%-30%
同花顺,2025-11-03 07:52:49.000,通达股份：预中标1.33亿元国家电网物资
同花顺,2025-11-03 07:52:11.000,土耳其10月消费者价格指数同比上涨32.87%
财联社,2025-11-03 07:51:17.000,中信建投：持续看好储能全球共振大趋势不变
同花顺,2025-11-03 07:51:10.000,俄罗斯堪察加东岸远海发生6.1级地震
财联社,2025-11-03 07:49:41.000,粉笔：公司董事会主席兼主要股东张小龙增持股份
财联社,2025-11-03 07:48:29.000,本周央行公开市场将有20680亿元逆回购到期
同花顺,2025-11-03 07:48:03.000,恒而达：行星滚柱丝杠螺纹高效磨削工艺的研发已到最后冲刺阶段
同花顺,2025-11-03 07:47:14.000,李家超：帮助内地企业利用香港作为跳板扩展海外业务
同花顺,2025-11-03 07:46:23.000,南向资金净买入超40亿港元
财联社,2025-11-03 07:44:56.000,泰国空置房屋达164万套
财联社,2025-11-03 07:41:11.000,【点金互动易】六氟磷酸锂+固态电池，六氟磷酸锂产线满产，这家公司硫化物固态电解质中试推进，已经具备中试量产的能力
财联社,2025-11-03 07:38:30.000,A股限售股解禁一览：43.54亿元市值限售股今日解禁
同花顺,2025-11-03 07:38:10.000,“十四五”期间 我国研制发布数据领域国家标准超120项
财联社,2025-11-03 07:37:37.000,倒车影像无法正常显示 日本丰田汽车在加拿大召回近10万辆汽车
同花顺,2025-11-03 07:33:48.000,以方确认哈马斯移交的三具被扣押人员遗体身份
同花顺,2025-11-03 07:32:46.000,美方称中方正在秘密测试核武器，中方：中国始终坚持走和平发展道路，恪守“暂停核试验”承诺
同花顺,2025-11-03 07:30:26.000,现货白银站上49美元/盎司
同花顺,2025-11-03 07:08:13.000,百奥泰成立生物药业公司，注册资本3.3亿元
同花顺,2025-11-03 07:07:59.000,利元亨与中原特钢签署战略合作协议
同花顺,2025-11-03 07:03:48.000,期货收评：大幅补涨 菜粕涨超4%！黑色建材尾盘走低
财联社,2025-11-03 07:03:32.000,斩断田间窃密黑手！间谍在我国搜集农作物基因数据
财联社,2025-11-03 07:02:12.000,【研选】光伏行业顶层政策+行业自律+技术迭代的供给侧改革思路愈发明确，分析师看好反内卷核心抓手多晶硅企业；公司各业务增速均环比提升，订阅业务加速提升投资者信心
同花顺,2025-11-03 07:02:06.000,现货黄金站上4020美元/盎司
同花顺,2025-11-03 07:01:04.000,ETF收评：中韩半导体ETF领涨4.62%，科创信息ETF领跌2.23%
同花顺,2025-11-03 07:01:00.000,ETF两市成交额5581.69亿元
同花顺,2025-11-03 07:00:45.000,A股收评：沪指缩量反弹涨0.55%，游戏、文化传媒等AI应用方向持续爆发
财联社,2025-11-03 07:00:41.000,截至三季度末 险资持仓A股市值超6500亿元
财联社,2025-11-03 07:00:23.000,拓展双向投资合作空间 更多细化措施将出台
财联社,2025-11-03 06:59:24.000,技术迭代引爆中尺寸OLED需求 国内显示面板企业竞相扩产力争上游
财联社,2025-11-03 06:58:34.000,券商三季度新进206只个股 重点布局有色金属、医药生物板块
财联社,2025-11-03 06:55:57.000,具有超导性能的锗材料制成
同花顺,2025-11-03 06:54:13.000,ETF两市成交额超5500亿元
同花顺,2025-11-03 06:46:40.000,沪深京三市成交额超2万亿元，较上日此时缩量2104亿元
同花顺,2025-11-03 06:46:17.000,以太坊日内跌近4%
同花顺,2025-11-03 06:45:51.000,实探华强北：内存条价格已翻倍 “早上报价下午又涨100多” 专家：算力中心建设推动上涨
同花顺,2025-11-03 06:41:56.000,泉果基金创始人王国斌突然离世
同花顺,2025-11-03 06:37:52.000,第八届进博会完成布展 新增600余家参展企业
同花顺,2025-11-03 06:33:55.000,挪威将与空客等公司达成协议解决30亿美元诉讼
同花顺,2025-11-03 06:33:21.000,2025年9月全国电视剧（网络剧）拍摄制作备案公示剧目141部
同花顺,2025-11-03 06:31:27.000,韩国综指收涨2.78%
财联社,2025-11-03 06:28:52.000,279家北交所公司披露三季报 超八成盈利
财联社,2025-11-03 06:24:04.000,上市公司业绩向好 分红回购频次稳步提升
财联社,2025-11-03 06:18:50.000,周一（11月3日）重点关注财经事件和经济数据
财联社,2025-11-03 06:14:59.000,美联储12月降息25个基点的概率为69.8%
同花顺,2025-11-03 06:06:54.000,最高检：今年前9个月检察机关起诉侵害未成年人犯罪5.3万人
同花顺,2025-11-03 06:02:43.000,中国人民银行与韩国银行续签双边本币互换协议
财联社,2025-11-03 06:00:21.000,新型钙钛矿光伏器件光电转换率达25.19% 再创新高
同花顺,2025-11-03 05:51:05.000,越疆发布家庭智能体机器人Rover X1
同花顺,2025-11-03 05:50:19.000,沪深京三市成交额超1.7万亿元，较上日此时缩量1872亿元
同花顺,2025-11-03 05:44:59.000,创业板指午后翻红，此前跌超2%
同花顺,2025-11-03 05:43:07.000,ETF两市成交额超4500亿元
同花顺,2025-11-03 05:41:02.000,阿联酋国家石油公司：2040年后，石油日需求量将保持在1亿桶以上
同花顺,2025-11-03 05:36:53.000,萝卜快跑：已覆盖全球22个城市 周单量超25万单
财联社,2025-11-03 05:33:20.000,新型人工神经元能模仿脑细胞电化学行为
同花顺,2025-11-03 05:29:18.000,光伏设备板块午后再度拉升，阿特斯涨超10%
同花顺,2025-11-03 05:18:57.000,港股午后震荡走高，恒生指数涨1%
同花顺,2025-11-03 05:18:13.000,化工板块震荡走强，化肥方向领涨
同花顺,2025-11-03 05:15:42.000,助力中国和沙特的民航连接 SAL与中国货运航空签署协议
同花顺,2025-11-03 05:14:48.000,沪深京三市成交额超1.5万亿元，较上日此时缩量1961亿元
同花顺,2025-11-03 05:14:26.000,存储芯片板块午后持续回暖，香农芯创涨超5%再创新高
同花顺,2025-11-03 05:13:50.000,高盛：首予康诺亚“买入”评级及目标价92.67港元
同花顺,2025-11-03 05:12:33.000,AI医疗影像独角兽数坤科技再冲IPO
同花顺,2025-11-03 05:09:11.000,卫星导航板块午后快速走高，航天智装20cm涨停创新高
同花顺,2025-11-03 05:07:48.000,食品股午后持续走高，巴比食品涨停
财新网,2025-11-03 05:00:00.000,伯克希尔三季报 巴菲特3817亿美元现金储备创历史新高
财联社,2025-11-03 04:56:19.000,阿富汗发生6.4级地震 震源深度20公里
同花顺,2025-11-03 04:48:38.000,野村证券上调MSCI中国及MSCI除日本外亚洲指数预期 看好盈利增长与人工智能前景
同花顺,2025-11-03 04:40:42.000,阿富汗6.4级地震已致10人死亡 240人受伤
同花顺,2025-11-03 04:37:02.000,广州地铁回应“‘摇一摇’广告影响扫码乘车”：已立即关闭
同花顺,2025-11-03 04:33:35.000,司法部系统重申行政执法人员负面禁令
财联社,2025-11-03 04:30:57.000,西太平洋银行全年净利润69.2亿澳元 不及预期
同花顺,2025-11-03 04:25:10.000,高盛：我们仍然认为 美联储降息的动机与我们对美元进一步下行的前提是一致的
财联社,2025-11-03 04:21:11.000,欧佩克从俄罗斯、伊拉克等五个国家收到了最新的减产补偿计划
同花顺,2025-11-03 04:19:27.000,萝卜快跑披露周单量超25万单
同花顺,2025-11-03 04:16:26.000,11月3日午间公告一览：神宇股份发行可转换公司债券获同意
同花顺,2025-11-03 04:14:02.000,智元机器人与龙旗科技合作落地真机强化学习技术
同花顺,2025-11-03 04:09:30.000,韩国股市延续AI热潮涨势 SK海力士一度上涨10%
同花顺,2025-11-03 04:06:30.000,美团LongCat-Flash-Omni正式发布并开源
同花顺,2025-11-03 04:04:37.000,第八届进博会新闻中心向中外媒体开放，设AI服务专区
同花顺,2025-11-03 04:04:22.000,世纪华通旗下盛趣游戏与芒果TV达成独家战略合作
同花顺,2025-11-03 04:01:09.000,港股午评：恒生指数涨0.58%，恒生科技指数跌0.24%
财新网,2025-11-03 04:00:00.000,税收优惠政策突然调整
财新网,2025-11-03 04:00:00.000,创新药板块近期持续调整
同花顺,2025-11-03 03:59:41.000,汇丰：美元或持续承压，预计2026年初触底
财联社,2025-11-03 03:57:51.000,以色列称接收三具以方被扣押人员遗体
同花顺,2025-11-03 03:48:35.000,韩国芯片股上涨
财联社,2025-11-03 03:41:28.000,菲律宾发生5.5级地震 震源深度120公里
同花顺,2025-11-03 03:39:24.000,主要产油国宣布12月保持增产节奏 明年初暂停增产
财联社,2025-11-03 03:31:43.000,或上调资金总额、或提高价格上限 多家A股公司回购计划“加码”
同花顺,2025-11-03 03:30:56.000,A股午评：创业板指半日跌1.37%，固态电池、光刻机等热门赛道股多数调整
同花顺,2025-11-03 03:30:45.000,ETF午评：纳指生物科技ETF领涨4.21%，科创信息ETF领跌3.65%
同花顺,2025-11-03 03:30:32.000,ETF两市成交额3565.79亿元
同花顺,2025-11-03 03:15:26.000,国务院安委会办公室召开建筑施工安全生产形势分析会
财联社,2025-11-03 03:13:05.000,A股主题交易活跃度有望上行 机构看好科技核心主线不变
同花顺,2025-11-03 03:08:01.000,财政部副部长廖岷会见英国内阁办公室副常务次官迈克尔·埃拉姆
同花顺,2025-11-03 03:07:30.000,亚投行将在香港设立办事处
同花顺,2025-11-03 03:03:25.000,国家发展改革委原党组成员、副主任徐宪平被开除党籍
财新网,2025-11-03 03:00:00.000,已纳入新的绩效考核
同花顺,2025-11-03 02:58:38.000,工业富联成交额达100亿元
同花顺,2025-11-03 02:55:43.000,存储芯片板块探底拉升，普冉股份涨近10%
同花顺,2025-11-03 02:53:34.000,英特尔正在就收购美国AI芯片独角兽SambaNova进行初步谈判
同花顺,2025-11-03 02:50:39.000,指数短线拉升，沪指再度翻红
同花顺,2025-11-03 02:50:26.000,沪深京三市成交额超1.2万亿元，较上日此时缩量1257亿元
同花顺,2025-11-03 02:48:46.000,高德、HERE达成合作 为中国汽车品牌提供ADAS等解决方案
财联社,2025-11-03 02:42:48.000,两融业务驱动业绩增长 上市券商利息净收入同比增逾五成
同花顺,2025-11-03 02:41:16.000,李乐成：加快推进人工智能赋能新型工业化
同花顺,2025-11-03 02:37:40.000,北京亦庄前三季度GDP同比增长10.8%
财联社,2025-11-03 02:37:24.000,ETF规模10个月增长逾2万亿元
同花顺,2025-11-03 02:36:12.000,创业板指跌超2%，全市场超2800只个股下跌
同花顺,2025-11-03 02:34:08.000,瑞尔特上演“天地板”
同花顺,2025-11-03 02:23:48.000,沪深京三市成交额超1万亿元，较上日此时缩量1000亿元
同花顺,2025-11-03 02:22:28.000,造纸板块震荡拉升，华泰股份直线涨停
同花顺,2025-11-03 02:20:43.000,原北京市国家税务局党组书记、局长吴新联被查
同花顺,2025-11-03 02:17:02.000,2026年度“北京普惠健康保”开放参保，起付线降至15000元，特药报销比例提高
同花顺,2025-11-03 02:16:54.000,“三桶油”持续拉升，中国海油涨超5%
同花顺,2025-11-03 02:16:24.000,科技部推动“创新积分制2.0”在全国试行
财联社,2025-11-03 02:14:19.000,个人养老金基金三周年：数量超300只 规模迈上150亿元
同花顺,2025-11-03 02:03:07.000,银行板块短线拉升，上海银行涨超2%
同花顺,2025-11-03 02:01:39.000,事关港澳台人员往来、过境免签口岸扩容等 10项重磅政策发布
同花顺,2025-11-03 02:00:23.000,开盘半小时 沪深京三市成交额达7467亿元
同花顺,2025-11-03 01:59:44.000,燃气板块震荡拉升，百川能源涨停
财联社,2025-11-03 01:55:47.000,美一客机险与直升机空中相撞
同花顺,2025-11-03 01:42:32.000,海南自贸区板块逆势上扬，海马汽车、欣龙控股涨停
同花顺,2025-11-03 01:41:37.000,创业板指跌1%
同花顺,2025-11-03 01:41:32.000,前三季度规上电子信息制造业增加值同比增长10.9％
同花顺,2025-11-03 01:41:25.000,光刻机概念股震荡走弱，凯美特气接近跌停
同花顺,2025-11-03 01:39:30.000,黄金概念盘初走低，潮宏基接近跌停
同花顺,2025-11-03 01:38:56.000,中证1000股指期货(IM)主力合约日内跌超1%
同花顺,2025-11-03 01:37:04.000,影视传媒、短剧游戏板块盘初冲高，欢瑞世纪、粤传媒2连板
同花顺,2025-11-03 01:35:59.000,煤炭开采加工板块盘初拉升，安泰集团涨停
同花顺,2025-11-03 01:33:23.000,电池板块盘初走低，海科新源跌超10%
同花顺,2025-11-03 01:32:23.000,存储芯片板块盘初下挫，时空科技跌停
财联社,2025-11-03 01:30:42.000,俄罗斯总理签署命令 终止与芬兰能源协议部分条款
同花顺,2025-11-03 01:30:26.000,北交所新股N丹娜高开超440%
同花顺,2025-11-03 01:28:40.000,Sora概念、游戏等AI应用方向高开，三七互娱一字涨停
同花顺,2025-11-03 01:26:56.000,可控核聚变板块高开，浙富控股、海陆重工涨停
同花顺,2025-11-03 01:26:12.000,ETF开盘：中证2000ETF增强领涨9.97%，科创半导体ETF鹏华领跌2.62%
同花顺,2025-11-03 01:25:03.000,消息人士：台积电启动“连4年涨价”计划，5纳米以下估涨约5-10%
同花顺,2025-11-03 01:24:40.000,韩国KOSPI指数涨幅扩大至2%
同花顺,2025-11-03 01:23:19.000,港股新能源汽车板块高开，蔚来、小鹏汽车涨超3%
同花顺,2025-11-03 01:21:48.000,港股开盘：恒生指数高开0.36%，恒生科技指数高开0.48%
同花顺,2025-11-03 01:21:25.000,央行今日开展783亿元7天期逆回购操作
财联社,2025-11-03 01:19:33.000,泄露虐囚视频的以军高官失踪
财联社,2025-11-03 00:50:50.000,胡塞武装回应以色列威胁
同花顺,2025-11-03 00:23:52.000,公募基金重仓股迭代折射产业变迁 AI新贵崛起
同花顺,2025-11-03 00:21:26.000,陈茂波：预计香港全年经济增长目标可顺利实现
同花顺,2025-11-03 00:20:59.000,长城科技：筹划控制权变更，股票自11月3日起停牌
同花顺,2025-11-03 00:15:00.000,华泰证券：2026年度A股市场风格进入再均衡而非切换
同花顺,2025-11-03 00:13:42.000,北京推出一揽子新政促进青年就业创业 高校毕业生招考招聘条件放宽
同花顺,2025-11-03 00:09:04.000,第二届中欧科学家论坛在德举办 共探科技合作
同花顺,2025-11-03 00:08:21.000,东京证券交易所因文化日休市一日
同花顺,2025-11-02 23:59:43.000,建设高质量资本市场 服务“十五五”战略全局
同花顺,2025-11-02 23:57:11.000,或上调资金总额 或提高价格上限 多家A股公司回购计划“加码”
同花顺,2025-11-02 23:50:20.000,本周中国央行公开市场将有20680亿元逆回购到期
同花顺,2025-11-02 23:35:38.000,工业机器人产量大增 前三季度我国实现“智”造升级
同花顺,2025-11-02 23:35:13.000,倒车影像无法正常显示，日本丰田汽车在加拿大召回近10万辆汽车
同花顺,2025-11-02 23:28:24.000,“双11”高铁快运逾十年，“十四五”铁路快运能力增七成
同花顺,2025-11-02 23:28:16.000,阿布扎比国家石油公司、阿布扎比未来能源公司、XRG与微软达成人工智能部署协议
财联社,2025-11-02 23:12:30.000,泽连斯基称德国已向乌交付“爱国者”防空导弹系统
同花顺,2025-11-02 23:02:42.000,三季报外资“新面孔”频现“老玩家”回归 加仓A股看好估值提升潜力
同花顺,2025-11-02 23:01:57.000,技术迭代引爆中尺寸OLED需求，国内显示面板企业竞相扩产力争上游
同花顺,2025-11-02 23:01:43.000,俄称在红军城打击被围困的乌军 乌称击退俄军进攻
同花顺,2025-11-02 23:01:21.000,基金发行头部效应愈加明显 多家中小公募“颗粒无收”
同花顺,2025-11-02 23:01:08.000,现货黄金失守3990美元/盎司
财联社,2025-11-02 22:45:10.000,卢浮宫抢劫案嫌疑人多为惯犯 两人曾共同犯案
财联社,2025-11-02 21:59:13.000,土耳其将主办加沙问题会议 聚焦停火与人道主义援助
财联社,2025-11-02 21:58:19.000,【公告全知道】存储芯片+CPO+人工智能+数据中心！存储行业头部企业已实现存储模组全产品线布局
财联社,2025-11-02 21:49:27.000,下周资本市场大事提醒：数据潮、财报季交织来袭 马斯克天价薪酬博弈迎终局
财联社,2025-11-02 21:48:44.000,【风口研报·洞察】早研CRO迎来新一轮上行周期，国内“成本+效率”优势突出，推动海外早研产业链“渐向国内转移”，目前行业利润触底，订单逐步回暖；11月份A股的季节性规律
财联社,2025-11-02 21:30:33.000,二十余家A股上市公司本周披露并购重组最新公告 东土科技拟购买高威科100%股份股票明起复牌
财联社,2025-11-02 21:27:43.000,俄黑海港口设施遭袭 乌军证实实施火力打击
财联社,2025-11-02 21:15:23.000,商务部副部长凌激出席中国与DEPA成员部级会议
财联社,2025-11-02 21:14:31.000,商务部部长王文涛会见加拿大国贸部长西杜 就中加经贸关系以及各自关心的经贸问题进行交流
财联社,2025-11-02 21:01:52.000,丽江警方约谈三家共享单车企业：要求杜绝无牌上路、配齐安全装备
财联社,2025-11-02 21:01:10.000,【金牌纪要库】AI应用移动端月活跃突破7亿大关！多领域已率先实现业绩破冰，这些业内重点企业均有AI应用成果新突破，另外这些企业已有配套产业优先布局
财联社,2025-11-02 20:44:52.000,以总理：以将打击任何袭击企图 不会征求美方许可
财联社,2025-11-02 20:41:29.000,商务部部长王文涛会见新西兰贸易部长麦克莱 就中新经贸关系等议题进行交流
财联社,2025-11-02 20:41:09.000,商务部：敦促日方尽快将中方有关实体移出出口管制最终用户清单
财联社,2025-11-02 20:34:59.000,【风口研报·公司】“PCB铜电镀+服务器液冷”双轮驱动，这家公司为胜宏、景旺、鹏鼎等头部PCB厂商供货，上半年液冷铜基散热片实现营业同比增长596%；周策略：11月市场或将横盘，结构性机会仍存
财联社,2025-11-02 20:21:18.000,何立峰与切尔内申科共同主持召开中俄总理定期会晤委员会第二十九次会议
财联社,2025-11-02 20:16:53.000,印度发射该国迄今最重卫星
财联社,2025-11-02 20:08:08.000,商务部：坚持智能化绿色化融合的方向 加快人工智能等数智技术创新
财联社,2025-11-02 20:01:31.000,土耳其与伊拉克签署水资源合作融资机制文件
财联社,2025-11-02 19:59:08.000,11月2日周日《新闻联播》要闻23条
财联社,2025-11-02 19:57:39.000,首期江苏社保科创基金正式签约落地苏州
财联社,2025-11-02 18:53:26.000,广西金融投资集团有限公司原党委书记蒙坤伟接受审查调查
财联社,2025-11-02 18:47:08.000,商务部部长王文涛：推动尽快恢复中日韩自贸协定谈判 共同维护自由贸易和多边主义
财联社,2025-11-02 18:41:47.000,中际旭创：公司1.6T光模块包含硅光和EML方案
财联社,2025-11-02 18:32:05.000,中信建投：A股或进入新一轮横盘调整 关注主线和风格切换
财联社,2025-11-02 18:04:15.000,吉利汽车10月汽车销量307133辆 同比增加35%
财联社,2025-11-02 17:40:07.000,尼日利亚：美方指责言论不符合实情
财联社,2025-11-02 17:32:04.000,香港财政司司长称香港有望实现年度增长目标
财联社,2025-11-02 17:32:00.000,海南调整2025年汽车报废更新补贴政策
财联社,2025-11-02 17:25:34.000,永臻股份：股东君联相道、君联嘉茂合计拟减持不超3%公司股份
财联社,2025-11-02 17:24:04.000,【风口研报·公司】过去十多年维持较高增长的“长坡厚雪”赛道，公司作为全球龙头不仅价格战压力已缓解，且扩张步伐稳健，分析师上调未来三年盈利预测；储能景气度有望持续，头部企业将具备显著竞争优势
财联社,2025-11-02 17:23:52.000,北汽蓝谷：子公司10月份销量同比增长112.02%
财联社,2025-11-02 17:19:20.000,【财联社早知道】重磅！国常会部署加快场景培育和开放推动新场景大规模应用，机构称AI应用已经迎来业绩兑现的拐点，这家公司是国内AI企业第一梯队，已构建起算力到AI应用的全链条布局
财联社,2025-11-02 16:56:48.000,万科A：与深铁集团签署框架协议 约定深铁集团向公司提供不超过220亿元借款额度
财联社,2025-11-02 16:47:54.000,长安汽车：10月份新能源汽车销量同比增长36.14%
财联社,2025-11-02 16:41:45.000,大烨智能：全资子公司拟与OOS签署光船租赁合同
财联社,2025-11-02 16:39:10.000,英国火车袭击事件致数人重伤 反恐警察介入调查
财联社,2025-11-02 16:38:42.000,比亚迪：前10月新能源汽车销量同比增长13.88%
财联社,2025-11-02 16:29:27.000,伊朗总统：伊朗将重建核设施 但不寻求制造核武器
财联社,2025-11-02 16:28:16.000,“天价抗癌疗法”CAR-T或将在今年商保价格协商中实现突破
财联社,2025-11-02 16:24:29.000,【风口研报·公司】AI应用端多家龙头三季报业绩超预期，分析师看好这家AI应用公司所处赛道行业壁垒高、研发周期长，未来3年业绩有望大幅增长；这家CDMO企业切入CGT领域
财联社,2025-11-02 16:18:44.000,涛涛车业：递交H股发行上市申请并刊发申请资料
财联社,2025-11-02 16:14:35.000,贝达药业：与晟斯生物达成战略合作 取得重组凝血因子产品独家总经销权
财联社,2025-11-02 16:02:02.000,赛力斯：10月新能源汽车销量同比增长42.89%
财联社,2025-11-02 15:55:34.000,金力永磁：部分董事及高管拟合计减持不超0.15%股份
财联社,2025-11-02 15:52:41.000,荣旗科技：员工战略配售资管计划拟减持不超1.32%股份
