来源,时间,标题
财联社,2026-03-19 15:59:41,3月19日连板股分析：连板股晋级率不足三成 算电协同概念逆势活跃
财联社,2026-03-19 15:59:04,欧洲天然气期货一度飙升35% 此前世界最大液化天然气出口厂所在工业城遭袭
财联社,2026-03-19 15:57:08,中国银行牵头协助法国巴黎银行首次发行熊猫债
同花顺,2026-03-19 15:55:27,伊朗称逮捕178名“叛徒”及美以雇佣人员
财联社,2026-03-19 15:54:39,国家统计局发布2026年2月份分年龄组失业率数据
财联社,2026-03-19 15:54:02,外汇局：围绕科技创新、智能制造等重点领域 加强外汇政策供给
财联社,2026-03-19 15:52:37,外汇局：完善跨境资金流动监测预警 必要时强化宏观审慎管理
财联社,2026-03-19 15:52:30,本月已签26艘 山东船厂疯狂接单
同花顺,2026-03-19 15:50:33,特朗普将与日本首相讨论贸易及其他事宜
同花顺,2026-03-19 15:46:44,美情报总监：美以对伊朗军事打击的目的“不同”
同花顺,2026-03-19 15:44:59,比特币跌破69000美元，日内跌3.26%
同花顺,2026-03-19 15:37:13,伊朗外长：若基础设施再遭袭 伊朗将不再克制
同花顺,2026-03-19 15:27:44,佰维存储：2025年净利润8.53亿元，同比增长429.07%
财联社,2026-03-19 15:22:24,本轮美以伊冲突以来 首次有巴勒斯坦人遭伊朗袭击身亡
同花顺,2026-03-19 15:22:15,美军F-35战机在美国空军基地紧急迫降
财联社,2026-03-19 15:21:33,海南省国有资产监督管理委员会原党委副书记王有福被“双开”
财联社,2026-03-19 15:21:10,美国解除对俄罗斯石油禁令仅一周 印度炼油商抢购约3000万桶俄石油
财联社,2026-03-19 15:19:47,文远知行：与ELEVATE Slovakia达成战略合作 启动斯洛伐克首个自动驾驶项目
财联社,2026-03-19 15:19:28,里昂：降BOSS直聘目标价至20美元 维持“跑赢大市”评级
同花顺,2026-03-19 15:18:13,前美联储副主席克拉里达：冲突持续时间越长，对美国经济的负面影响就越大
同花顺,2026-03-19 15:18:06,以军称袭击伊朗里海沿岸港口城市 摧毁多艘海军舰艇
财联社,2026-03-19 15:15:49,3月19日涨停分析
财联社,2026-03-19 15:15:28,德国重申不参与霍尔木兹海峡护航
同花顺,2026-03-19 15:14:38,市场消息：伊朗导弹直接袭击以色列海法炼油厂后，海法多个地区停电
财联社,2026-03-19 15:14:33,比特币跌破7万美元关口 过去24小时内跌5.4%
财联社,2026-03-19 15:11:25,广州海珠计划出台“OPC创新发展十条”：OPC社区运营机构年度最高支持150万元
同花顺,2026-03-19 15:11:05,卡塔尔首相表示，目前与伊朗的信任已经丧失，但“必须重建”
同花顺,2026-03-19 15:10:56,英镑兑美元上涨1%
财联社,2026-03-19 15:09:32,大众点评“必吃榜”上线有奖举报通道
财联社,2026-03-19 15:08:41,建材规格加价风暴席卷全国 已有超过30家生产企业提高了螺纹钢的规格加价
同花顺,2026-03-19 15:07:44,中国铁塔：2025年营收突破1000亿元 持续强化科技创新引领
同花顺,2026-03-19 15:05:27,香港荃湾老围地区发生火灾，已疏散约100人
同花顺,2026-03-19 14:58:15,内存涨价潮席卷全球 32G内存条从800元暴涨到3800元
同花顺,2026-03-19 14:47:33,以色列称本轮美以伊冲突已有超3900名伤者被送医
同花顺,2026-03-19 14:43:00,春假经济火了 多地春假清明连休拼出6天
同花顺,2026-03-19 14:33:57,美国至上周EIA天然气库存增加350亿立方英尺
同花顺,2026-03-19 14:33:07,卧龙新能：2025年净利润亏损1.87亿元
同花顺,2026-03-19 14:33:02,卧龙新能：与卧龙租赁和卧龙保理签订业务合作框架协议，提供融资额度不超过人民币5000万元
财联社,2026-03-19 14:20:43,独家|相关部门召开会议 要求多家猪企汇报全年生产目标
财联社,2026-03-19 14:18:45,标普全球将本田汽车评级下调至BBB+ 展望稳定
财联社,2026-03-19 14:12:45,汇丰据悉考虑未来几年裁减2万岗位
财联社,2026-03-19 14:12:02,内蒙古一公司发生爆炸事故 2人失联
财联社,2026-03-19 14:07:06,阿努廷再次当选泰国新一任总理
财联社,2026-03-19 14:07:01,亚马逊：智能助理Alexa+登陆英国
财联社,2026-03-19 14:05:57,以军称伊朗今天已发射多轮导弹
财联社,2026-03-19 14:03:59,古巴谴责美国施压哥斯达黎加降级与古双边关系
财联社,2026-03-19 13:57:49,伊朗判处3名为美以行动提供支持的人员死刑
财联社,2026-03-19 13:57:12,2025年港股通资金流入1.4万亿 日均成交额同比增151%
同花顺,2026-03-19 13:31:43,中国联通：2025年净利润91.27亿元，同比增长1.1%
同花顺,2026-03-19 13:31:22,郑商所瓶片主力合约大跌5%
财联社,2026-03-19 13:29:46,【金牌纪要库·风口会议】2026年超薄铜箔显著溢价，复合铜箔核心瓶颈在于良率提升，这两家已有高端铜箔批量出货的企业或受益行业浪潮
财联社,2026-03-19 13:28:22,AI应用端局部异动 昆仑万维涨近10%
财联社,2026-03-19 13:28:11,法国启动建造新核动力航母
同花顺,2026-03-19 13:26:41,俄称其天然气管道设施再遭袭
同花顺,2026-03-19 13:23:25,据港交所文件：四川英发睿能科技股份有限公司向港交所提交上市申请书
同花顺,2026-03-19 13:15:31,欧洲央行如期按兵不动
财联社,2026-03-19 13:13:09,机构：预测苹果将在2026年取得28%的市场份额 逼近三星的领先位置
财联社,2026-03-19 13:11:10,【风口研报·公司】错过了亚翔集成不能再错过它，这家深耕本土的洁净室龙头需求同样持续旺盛，海外收入更是大幅增长超600%，今年起产品有望向北美进一步输出
同花顺,2026-03-19 13:08:21,雪峰科技：2025年净利润5.04亿元，同比下降24.65%
同花顺,2026-03-19 13:08:12,晶丰明源：向玮峻思等50名交易对方发行4035.24万股股份购买易冲科技100%股权
同花顺,2026-03-19 13:07:29,杭州市政府与国网浙江省电力有限公司签订战略合作协议
同花顺,2026-03-19 13:06:30,王毅同英国外交大臣库珀通电话
同花顺,2026-03-19 13:05:31,大商所液化石油气（LPG）主力合约大涨7%
同花顺,2026-03-19 13:04:38,ST炼石：申请撤销对公司股票交易实施其他风险警示
同花顺,2026-03-19 13:04:31,ST炼石：2025年净利润亏损5.18亿元
同花顺,2026-03-19 13:03:42,李宁：2025年净利润29.36亿元，同比增长3.2%
同花顺,2026-03-19 13:02:50,上期所沪银主力合约暴跌14%
同花顺,2026-03-19 12:59:57,晶赛科技：2025年净利润968.37万元，同比增长63.47%
同花顺,2026-03-19 12:58:01,雷军：小米集团未来三年在AI领域至少投入600亿元
财联社,2026-03-19 12:51:56,【盘中宝•数据】AI电力瓶颈催生储能新需求，最新整理储能行业上市公司市占率、出货量等（附表）
财联社,2026-03-19 12:47:06,本田将扩大在印度的摩托车生产产能
财联社,2026-03-19 12:45:33,阿斯利康宣布在上海建立细胞疗法商业化生产供应基地与创新中心
财联社,2026-03-19 12:28:58,阿联酋谴责针对其油气能源设施的袭击
财联社,2026-03-19 12:21:52,三部门：加快补齐汽车芯片、基础软件等短板 推动扩大应用规模
财联社,2026-03-19 12:20:15,雅化集团：公司在津巴布韦的Kamativi锂矿目前可以达到年230万吨原矿处理能力
财联社,2026-03-19 12:15:11,美情报总监称伊朗政权“完整但遭严重削弱”
财联社,2026-03-19 12:12:32,华为企业级智能体开发平台AgentArts将于4月30日公测
同花顺,2026-03-19 12:12:06,美国国防部长赫格塞思：今天针对伊朗的打击规模又将是最大的
同花顺,2026-03-19 12:11:02,现货黄金失守4620美元/盎司  现货白银暴跌9%
同花顺,2026-03-19 12:09:27,美国财长贝森特：美国可能单方面释放石油储备
财联社,2026-03-19 12:07:19,瑞声科技：2025年净利润同比增长39.8%，拟派发全年股息每股0.35港元
同花顺,2026-03-19 12:06:47,美国财长贝森特：我们不会攻击伊朗的能源基础设施
同花顺,2026-03-19 12:06:34,LME锡主力合约大跌6%
同花顺,2026-03-19 12:04:46,交易员们纷纷调高对欧洲央行利率走势的押注，预计2026年将有50个基点的加息幅度
同花顺,2026-03-19 12:04:10,现货黄金失守4630美元/盎司
同花顺,2026-03-19 12:04:01,COMEX白银期货暴跌10%
同花顺,2026-03-19 12:03:37,COMEX黄金期货大跌5%
财联社,2026-03-19 12:03:33,财联社3月19日午间新闻精选
同花顺,2026-03-19 12:03:30,现货白银大跌8%
同花顺,2026-03-19 12:03:26,现货黄金失守4650美元/盎司
同花顺,2026-03-19 12:01:43,英国央行如期维持利率不变
财联社,2026-03-19 12:00:50,港股午评：恒生指数跌1.66% 恒生科技指数跌1.58%
财联社,2026-03-19 12:00:48,伊拉克民兵武装称已对美方单位发动483次袭击
同花顺,2026-03-19 11:59:31,3月19日 周四《新闻联播》要闻19条
同花顺,2026-03-19 11:58:59,三峡集团与水利部座谈
财联社,2026-03-19 11:56:50,3月19日午间涨停分析
同花顺,2026-03-19 11:56:46,ST联合：2025年营业收入4.27亿元，净利润亏损3750.78万元
财联社,2026-03-19 11:55:21,俄方说俄美乌安全问题工作组已暂停工作
同花顺,2026-03-19 11:52:40,阿里巴巴：百炼MaaS平台Token消耗3个月升6倍，将成阿里云最大收入产品
同花顺,2026-03-19 11:47:47,佛塑科技：拟公开挂牌转让控股子公司成都东盛包装材料有限公司51%股权
财联社,2026-03-19 11:47:00,友邦人寿2025年下半年业绩增长势头加速
同花顺,2026-03-19 11:45:06,南非举办首届国家交通运输大会推进行业转型
财联社,2026-03-19 11:36:39,南方多雨模式短时间内不会结束 长沙连续降雨日数或达10天以上
同花顺,2026-03-19 11:15:47,维尔利：2025年净利润亏损3.48亿元
同花顺,2026-03-19 11:15:44,维尔利：预计2026年第一季度净利润为400万元—600万元，同比扭亏为盈
同花顺,2026-03-19 11:15:06,深圳市政府与南方电网公司签署深化战略合作框架协议
同花顺,2026-03-19 11:14:07,王凯在郑州商丘调研超硬材料产业发展情况
同花顺,2026-03-19 11:13:00,2025年上海新设外资企业超过6300家
同花顺,2026-03-19 11:12:29,旭光电子：2025年净利润1.62亿元，同比增长57.67%
同花顺,2026-03-19 11:10:52,钢研高纳：2025年净利润8744.73万元，同比下降64.83%
同花顺,2026-03-19 11:09:55,阿里平头哥GPU已规模化量产
同花顺,2026-03-19 11:09:31,中材科技：2025年净利润18.18亿元，同比增长103.82%
同花顺,2026-03-19 11:09:28,金雷股份：海上风电核心部件数字化制造项目节余募集资金4261.74万元拟永久补充流动资金
同花顺,2026-03-19 11:09:20,西域旅游：2025年净利润7468.15万元，同比下降13.68%
同花顺,2026-03-19 11:08:19,小米造车5年花了400多亿
同花顺,2026-03-19 11:07:08,盛屯矿业：2025年净利润19.61亿元，同比下降2.19%
同花顺,2026-03-19 11:07:05,江河集团：2025年净利润6.1亿元，同比下降4.31%
同花顺,2026-03-19 11:05:07,农业银行与国家融资担保基金联合发文 推进民间投资专项担保计划加快实施
同花顺,2026-03-19 11:04:18,烽火通信参与组建“武汉市卫星与应用产业创新联盟”，共促武汉商业航天创新发展
同花顺,2026-03-19 11:03:37,深深房A：2025年净利润9995.6万元，同比增长156.56%
财联社,2026-03-19 11:03:13,【风口研报·公司】光芯片自研的AI光模块+AI PCB新产能投产+苹果折叠屏等创新硬件受益，这家平台型AI硬件企业迎来新一轮价值重估起点
财联社,2026-03-19 11:01:33,主力资金监控：紫金矿业净卖出超13亿
财联社,2026-03-19 11:00:23,沈阳优化调整5项住房公积金贷款和提取政策
财联社,2026-03-19 10:53:35,【盘中宝】能源转型叠加能源安全需求，这类产品经济性显著突出，相关出口链或迎战略发展期，这家公司该领域已形成完善的产品系列
财联社,2026-03-19 10:51:36,中国化工装备有限公司原副总经理李东平接受纪律审查和监察调查
财联社,2026-03-19 10:49:36,多国领导人将出席博鳌亚洲论坛2026年年会
财联社,2026-03-19 10:48:20,财政部、央行3个月期国库现金定存中标利率1.72%
财联社,2026-03-19 10:45:07,世卫组织官员正为中东地区可能发生的“核灾难”做准备
财联社,2026-03-19 10:43:49,平安系再提女将 张剑颖出任平安资管总经理
财联社,2026-03-19 10:43:32,香港金管局回应美联储议息决定：继续密切监察市场变化 维持货币及金融稳定
财联社,2026-03-19 10:42:36,两名美国宇航员完成太空行走 为空间站电力系统改造做准备
财联社,2026-03-19 10:40:50,卡塔尔多处能源设施再遭袭起火
财联社,2026-03-19 10:40:27,小米集团涨超5% 新一代SU7将于今日晚些时间公布
财联社,2026-03-19 10:32:16,沪深两市成交额突破1万亿 较上一日此时放量超800亿
财联社,2026-03-19 10:25:30,海关总署发布新规 提升进口食品安全监管水平
财联社,2026-03-19 10:24:53,中信证券裘翔：利润率企稳回升是接续牛市必要前提 关注重心从估值转向利润率
同花顺,2026-03-19 10:16:09,拉法口岸自美以军事打击伊朗以来首次恢复双向通行
同花顺,2026-03-19 10:16:00,阿联酋附近海域报告两起商船遇袭事件
同花顺,2026-03-19 10:12:01,佩斯科夫：俄方期待尽快恢复乌克兰问题三方谈判
同花顺,2026-03-19 10:10:52,中国巨石：董事长刘燕因退休年龄辞职
同花顺,2026-03-19 10:10:43,中国巨石：2025年净利润32.85亿元，同比增长34.38%
同花顺,2026-03-19 10:06:52,伊朗称进攻与防御力度空前，警告若能源设施再遭袭将报复
同花顺,2026-03-19 10:05:56,常山北明：副董事长李锋、总经理应华江拟分别减持0.08%
同花顺,2026-03-19 10:02:06,万物云：2025年集团总收入为人民币372.72亿元，同比增长2.7%
同花顺,2026-03-19 10:00:50,星宇股份：2025年净利润16.24亿元，同比增长15.32%
同花顺,2026-03-19 09:59:17,阿联酋坚持1.4万亿美元对美投资承诺
同花顺,2026-03-19 09:59:04,格利尔：跃承合伙受让公司21.95%股份 成为控股股东
同花顺,2026-03-19 09:55:55,有研硅：拟使用超募资金1.95亿元设立全资子公司
同花顺,2026-03-19 09:54:40,一份CT报告错两次 涉事医院通报：对相关责任人严肃处理
同花顺,2026-03-19 09:52:49,WTI原油失守95美元/桶
同花顺,2026-03-19 09:52:24,两位消息人士透露，沙特延布港恢复石油装货
同花顺,2026-03-19 09:48:45,亚泰集团：挂牌转让江苏威凯尔500万股股份，挂牌底价不低于1.91亿元
同花顺,2026-03-19 09:42:54,欧洲议会恢复推进批准欧美贸易协议
财联社,2026-03-19 09:34:37,绿电概念逆势活跃 韶能股份、粤电力A2连板
财联社,2026-03-19 09:33:04,存储芯片概念集体走弱 恒烁股份跌超10%
财联社,2026-03-19 09:32:07,油气概念表现活跃 科力股份涨超10%
财联社,2026-03-19 09:31:01,化工板块大面积高开 兴化股份一字涨停
财联社,2026-03-19 09:30:54,香港恒生指数跌幅扩大至2%
财联社,2026-03-19 09:30:51,江苏省政协人口资源环境委员会原主任王奇接受纪律审查和监察调查
财联社,2026-03-19 09:26:11,深成指、创业板指跌超1%
财联社,2026-03-19 09:22:45,香港恒生指数开盘跌1.82% 热门科技股普跌
财联社,2026-03-19 09:22:26,港股油气设备股走强 山东墨龙涨近15%
财联社,2026-03-19 09:22:13,央行公开市场今日净回笼115亿元
同花顺,2026-03-19 09:17:03,澳门立法会表决通过《澳门特别行政区维护国家安全委员会》法案
同花顺,2026-03-19 09:16:32,中国巨石淮安年产3.9亿米电子布生产线点火
同花顺,2026-03-19 09:15:46,华原股份：股东华盛企业拟减持不超过1%
财联社,2026-03-19 09:14:33,【盘中宝】地缘冲突下“大宗涨价+HALO交易+能源安全”等多重催化不断强化，全球能源共振预期向上，该领域替代需求有望持续释放，这家企业前三季度产量同比增近80%
同花顺,2026-03-19 09:14:19,晋亿实业：2025年净利润2.42亿元，同比增长86.12%
同花顺,2026-03-19 09:13:38,蓝帆医疗：6名董监高拟增持不低于500万元
同花顺,2026-03-19 09:11:40,欧盟推进与美国的贸易协议，提交议会供全体投票表决
同花顺,2026-03-19 09:11:03,隧道股份：认购中国能建股票，占发行后总股本3.10%
同花顺,2026-03-19 09:10:33,匈牙利总理：“友谊”管道恢复供油前 不支持欧盟任何涉乌决定
同花顺,2026-03-19 09:09:34,法国启动建造新核动力航母工作
同花顺,2026-03-19 09:07:20,财政部拟第一次续发行2026年记账式附息（五期）国债
同花顺,2026-03-19 09:06:39,国家外汇管理局：完善跨境资金流动监测预警 必要时强化宏观审慎管理
同花顺,2026-03-19 09:05:58,贝莱德（BlackRock）对江西铜业股份的多头持仓比例增至5.32%
同花顺,2026-03-19 09:05:16,外交部：台湾问题是中国内政，美方应停止炒作“中国威胁论”
同花顺,2026-03-19 09:02:27,中证协向全行业征集文化建设与廉洁从业实践案例和先进个人事迹
同花顺,2026-03-19 09:01:40,市场监管总局发布2026版汽车召回用户指南
同花顺,2026-03-19 09:01:38,华森制药：独立董事李嘉明先生不幸逝世
财联社,2026-03-19 08:17:12,赤峰黄金：实控人筹划公司控制权变更事项 股票今日开市起停牌
财联社,2026-03-19 08:14:48,泰国今日将投票选举新一任总理
财联社,2026-03-19 08:14:43,知情人士称美政府考虑在中东部署数千名士兵
同花顺,2026-03-19 08:13:45,鼎龙股份：年产300吨KrF/ArF光刻胶产业化项目建成投产
财联社,2026-03-19 08:13:03,中信证券：黄金板块有望再创新高
同花顺,2026-03-19 08:11:04,印尼政府将削减开支应对油价压力
同花顺,2026-03-19 08:09:58,港股收评：恒生指数跌2.02%，恒生科技指数跌2.19%
同花顺,2026-03-19 08:09:25,科威特国家石油公司一炼油厂遭无人机袭击起火
同花顺,2026-03-19 08:08:44,亿纬锂能：“龙泉三号”和“龙泉四号”全固态电池成功下线
同花顺,2026-03-19 08:07:50,今年前两月中国内地访日游客同比下降54.1%
同花顺,2026-03-19 08:05:16,麦当劳回应销售蛋挞：个别餐厅限时供应新品
同花顺,2026-03-19 08:03:57,内马铁路二期项目在肯尼亚举行开工仪式
财联社,2026-03-19 08:01:57,财联社3月19日早间新闻精选
同花顺,2026-03-19 08:01:27,南向资金净买入超250亿港元
同花顺,2026-03-19 08:01:19,欧洲主要股指开盘集体下跌
同花顺,2026-03-19 08:01:15,美股中概股盘前涨跌互现，小鹏汽车涨2%
同花顺,2026-03-19 08:01:08,美股大型科技股盘前多数下跌，谷歌A跌0.4%
同花顺,2026-03-19 08:00:31,美光科技美股盘前跌超4%
同花顺,2026-03-19 07:59:47,现货黄金失守4730美元/盎司
同花顺,2026-03-19 07:57:31,现货白银大跌6%
财联社,2026-03-19 07:57:12,乍得军方进入“最高警戒状态”应对苏丹方向袭击
同花顺,2026-03-19 07:56:38,南向资金净买入超240亿港元
财联社,2026-03-19 07:54:47,华泰证券：重视券商股的战略性配置机会
同花顺,2026-03-19 07:53:05,英飞凌宣布进一步扩大与英伟达的合作，重点聚焦人形机器人领域
同花顺,2026-03-19 07:52:03,商务部介绍中方参加MC14会议相关情况
同花顺,2026-03-19 07:51:25,国家外汇管理局：进一步健全预期管理机制，维护外汇市场稳健运行
财联社,2026-03-19 07:50:17,英伟达将与Qnity Electronics合作研发半导体先进材料
财联社,2026-03-19 07:47:17,华泰证券：2026年或成为绿氢产业拐点之年
财联社,2026-03-19 07:41:46,【点金互动易】PCB+光模块+机器人，MiniLED COB封装基板已大批量出货，高阶HDI及光模块产品向客户批量供货，这家公司柔性电路板产品是机器人关节必备部件
同花顺,2026-03-19 07:23:10,拉里贾尼在以色列袭击中遇难 外交部：反对在国际关系中使用武力
同花顺,2026-03-19 07:21:47,本轮美以伊冲突以来，首次有巴勒斯坦人遭伊朗袭击身亡
同花顺,2026-03-19 07:21:37,南向资金净买入超190亿港元
同花顺,2026-03-19 07:18:23,小云雀AI上线短剧Agent：搭载Seedance 2.0 10万字剧本一键成片
同花顺,2026-03-19 07:15:03,外资药企持续加码上海，阿斯利康布局细胞疗法全链条
同花顺,2026-03-19 07:10:32,NYMEX汽油主力合约涨超4%
财联社,2026-03-19 07:07:49,中国代表：中东局势正被推向危险深渊
财联社,2026-03-19 07:05:45,纳米颗粒在人体内“教导”T细胞精准“杀敌”
财联社,2026-03-19 07:05:12,真空紫外激光器转换效率大幅提升
同花顺,2026-03-19 07:04:28,美媒：联邦调查局对前国家反恐中心主任展开泄密调查
同花顺,2026-03-19 07:02:22,泰国国会下议院投票选举新总理，阿努廷当选泰国第33任总理
同花顺,2026-03-19 07:02:15,市场监管总局：加力破除地方保护与市场分割，深入整治“内卷式”竞争
同花顺,2026-03-19 07:01:34,ETF收评：标普油气ETF领涨10.01%，黄金股ETF领跌6.74%
同花顺,2026-03-19 07:01:28,ETF两市成交额5255.91亿元
同花顺,2026-03-19 07:01:16,泰国期货交易所宣布暂时暂停白银在线期货交易
同花顺,2026-03-19 07:00:59,A股收评：沪指跌1.39%险守4000点 全市场近5000只个股下跌
财联社,2026-03-19 06:57:32,阿布扎比Habshan天然气设施停运
财联社,2026-03-19 06:56:02,新型脑机接口可作意念打字“键盘”
同花顺,2026-03-19 06:54:50,现货黄金、纽约期金失守4750美元/盎司
财联社,2026-03-19 06:52:43,结构性行情中觅先机 涨价与科技或是布局关键词
同花顺,2026-03-19 06:52:35,现货白银失守72美元/盎司 COMEX白银期货大跌7%
同花顺,2026-03-19 06:52:16,广期所多晶硅主力合约大跌8%
同花顺,2026-03-19 06:52:07,上期所沪金主力合约大跌5% 纽约期金失守4760美元/盎司
财联社,2026-03-19 06:41:48,存储芯片涨价潮席卷产业链 新一轮成本考验已至
同花顺,2026-03-19 06:21:32,相关部门召开会议 要求多家猪企汇报全年生产目标
同花顺,2026-03-19 06:20:21,广期所铂主力合约大跌7%
同花顺,2026-03-19 06:19:10,广期所多晶硅主力合约大跌7%
财联社,2026-03-19 06:19:04,周四（3月19日）重点关注财经事件和经济数据
财联社,2026-03-19 06:18:45,伊朗南部一处司法机构遭袭 致14死50伤
同花顺,2026-03-19 06:13:11,伊朗称美以袭击已造成至少18名医护人员死亡
同花顺,2026-03-19 06:11:34,南向资金净买入超100亿港元
财联社,2026-03-19 06:09:11,美联储4月维持利率不变的概率为100%
同花顺,2026-03-19 06:06:56,泰国国会下议院投票选举产生新总理
同花顺,2026-03-19 06:06:42,辞职美高官：伊朗从未接近拥核 以色列经常传假情报
财联社,2026-03-19 06:06:32,美福特号航母起火后赴地中海维修
同花顺,2026-03-19 06:04:46,银行板块局部拉升，工商银行涨超2%
同花顺,2026-03-19 06:03:51,沪深京三市成交额超1.7万亿元，较上日此时放量809亿元
同花顺,2026-03-19 06:02:50,南向资金净买入超90亿港元
财联社,2026-03-19 06:00:05,周四你需要知道的隔夜全球要闻：伊朗打击利雅得炼油厂美方专属区域，卡塔尔拉斯拉凡工业城遭导弹袭击，美联储维持利率不变
同花顺,2026-03-19 05:56:11,南向资金净买入超80亿港元
同花顺,2026-03-19 05:55:19,广期所铂主力合约大跌6% 钯主力合约大跌7%
同花顺,2026-03-19 05:54:17,多元金融板块短线拉升，中油资本直线涨停
财联社,2026-03-19 05:44:14,特朗普据报暂不想再袭伊朗能源设施
财联社,2026-03-19 05:41:11,尼日利亚军方：击退恐怖组织攻击 打死80名恐怖分子
财联社,2026-03-19 05:30:07,美联储利率决议及鲍威尔发布会要点总结：美联储维持利率不变，鲍威尔称在司法部调查结束之前无意离开美联储
同花顺,2026-03-19 05:29:57,沪深京三市成交额超1.5万亿元，较上日此时放量616亿元
同花顺,2026-03-19 05:24:05,小摩：重申英伟达“增持”评级，多个增量收入来源为市场预期提供可观的上行空间
同花顺,2026-03-19 05:22:10,花旗：日本央行的决定不太可能成为日元进一步走软的催化剂
同花顺,2026-03-19 05:21:16,银信科技等成立智能教育科技公司，含多项AI业务
财联社,2026-03-19 05:08:42,伊朗发起“真实承诺4”第63轮行动 报复能源基础设施遭袭
财联社,2026-03-19 05:04:12,国际油价18日微涨
同花顺,2026-03-19 05:03:44,昆仑万维：SkyReels V4登上Artificial Analysis榜单全球第一
同花顺,2026-03-19 05:01:48,港股有色金属板块午后持续下挫，万国黄金集团跌超18%
财联社,2026-03-19 05:00:40,卡塔尔宣布伊朗武官为“不受欢迎的人”
同花顺,2026-03-19 04:58:35,美国天然气期货日内涨超3.00%
财联社,2026-03-19 04:53:00,以军：开战以来首次袭击伊朗北部目标
同花顺,2026-03-19 04:51:01,伊朗议会议长：双方对抗已进入全新阶段
同花顺,2026-03-19 04:49:38,美联储维持联邦基金利率目标区间于3.5-3.75厘
同花顺,2026-03-19 04:44:26,华润医药退出天麦生物股权 或因核心研发不及预期
财联社,2026-03-19 04:44:09,普京就拉里贾尼遇难向伊朗最高领袖表示哀悼
同花顺,2026-03-19 04:43:48,专家：冲突持续 伊朗以对等反制和连环打击维系军事威慑
