来源,时间,标题
同花顺,2026-06-02 17:03:05,微软首席执行官宣布推出Cobalt 200芯片预览版
同花顺,2026-06-02 16:56:40,以军称在黎南部开展定点行动 打击武装人员与武器设施
同花顺,2026-06-02 16:56:34,中小银行按下代销货币基金申购业务“暂停键”
同花顺,2026-06-02 16:55:59,多家民营银行中长期定存利率跌至“1字头”
同花顺,2026-06-02 16:55:23,微软首席执行官：过去18个月公司新增的数据中心容量，超过了Azure成立头十年的新增总量
同花顺,2026-06-02 16:35:59,布伦特原油站上96美元/桶
同花顺,2026-06-02 16:24:05,标普500指数总市值历史上首次突破69万亿美元关口
同花顺,2026-06-02 16:23:57,全国骑行用户破1.3亿 带动骑行装备、折叠自行车热销
同花顺,2026-06-02 16:19:36,捷克一架私人飞机坠毁 致2人死亡
同花顺,2026-06-02 16:17:12,SpaceX表示计划通过一次全新股发行的首次公开募股（IPO）筹集至少750亿美元
同花顺,2026-06-02 16:12:29,巴西总统签署法令确保顺利举办女足世界杯
同花顺,2026-06-02 16:10:48,Coinbase Global股价下跌4.8%，Strategy股价下跌8.6%
同花顺,2026-06-02 15:22:37,云迹科技与奇安信联合发布高安全机器人
同花顺,2026-06-02 15:22:33,齐向东：AI引爆网安千亿增量市场，最大受益者属于创新头部厂商
同花顺,2026-06-02 15:20:51,上海二手房5月成交2.8万套，创近6年同期新高
同花顺,2026-06-02 15:17:25,澳大利亚前高官发起一项针对美英澳合作的公开调查
同花顺,2026-06-02 15:16:23,近10年来首次 俄称美官方代表团将出席圣彼得堡国际经济论坛
同花顺,2026-06-02 15:15:59,欧洲央行：黄金替代美元成全球官方储备第一大资产
同花顺,2026-06-02 15:14:12,天津港集团与深圳港集团签署战略合作框架协议
同花顺,2026-06-02 15:13:56,芝商所旗下交易所股价大跌
同花顺,2026-06-02 15:11:57,绩优基金限购现分歧：有的收紧至千元，有的放宽至两万元，科技新品成资金配置新出口
同花顺,2026-06-02 15:08:57,有关垃圾焚烧，杜祥琬院士发布辟谣声明
同花顺,2026-06-02 15:08:34,中俄智库高端论坛在莫斯科举办
同花顺,2026-06-02 15:07:03,房利美和房地美下挫 FHFA局长身兼代理情报总监引发质疑
同花顺,2026-06-02 15:05:28,阿斯麦股价续刷新高，总市值超过6500亿美元
同花顺,2026-06-02 15:04:19,英国央行行长贝利：并非所有人工智能相关股都会成为赢家
同花顺,2026-06-02 15:03:25,孟加拉国外长卡利勒当选第81届联大主席
同花顺,2026-06-02 15:01:53,期市夜盘收盘，国内期货主力合约涨跌互现，沥青跌超2%
同花顺,2026-06-02 14:47:21,华为数字能源与协鑫集团达成重要共识
同花顺,2026-06-02 14:37:45,美国务卿称美国正与伊朗进行对话
同花顺,2026-06-02 14:34:54,以军袭击黎南部多地致10死131伤
同花顺,2026-06-02 14:32:41,美国国务卿鲁比奥称美国正与伊朗谈判
同花顺,2026-06-02 13:13:46,我国光通信技术实现重要突破 全球首条三波段超低损耗多芯光缆线路正式开通
同花顺,2026-06-02 13:03:03,成都首次完成无人/有人机混合运行验证试飞
同花顺,2026-06-02 13:02:42,贝因美：控股股东重整计划获法院批准，金华市国资委将控制13.35%股份
同花顺,2026-06-02 13:01:23,*ST岭南：公司股票被叠加实施其他风险警示
同花顺,2026-06-02 13:00:18,期市夜盘开盘，国内期货主力合约多数上涨，沪锡涨超1%
同花顺,2026-06-02 12:54:51,晶科储能完成722MWh储能系统交付
同花顺,2026-06-02 12:54:38,伊媒：霍尔木兹海峡通行许可已开放申请
同花顺,2026-06-02 12:54:20,当前我国夏粮收获进度超三成
同花顺,2026-06-02 12:44:44,世界气象组织：近期出现厄尔尼诺事件概率为80%
同花顺,2026-06-02 12:43:29,东杰智能：股价异常波动，控制权变更剩余10亿元转让价款支付安排仍在协商
同花顺,2026-06-02 12:42:13,国家发改委：要推进国有经济布局优化和结构调整 激发国有企业内生动力活力
同花顺,2026-06-02 12:40:41,以军袭击加沙多地 致多人伤亡
同花顺,2026-06-02 12:40:24,微芯科技美股盘前涨超10%
同花顺,2026-06-02 12:39:26,长高电新：证券简称变更为长高电气，6月3日起启用
同花顺,2026-06-02 12:35:25,微软盘前跌3.10%，现报446.24美元
同花顺,2026-06-02 12:34:57,贵州茅台：2025年年度利润分配方案每股分红金额调整至28.02元（含税）
同花顺,2026-06-02 12:34:33,报告显示北京位列全球数字旅游引领型城市榜首
同花顺,2026-06-02 12:33:31,巴林禁止本国公民前往伊朗和伊拉克
同花顺,2026-06-02 12:32:59,英媒：美国考虑在更多北约欧洲国家部署核武器
同花顺,2026-06-02 12:32:36,上海市委书记陈吉宁走访重点企业并开展现场办公
同花顺,2026-06-02 11:30:27,欣灵电气：控股股东及一致行动人拟减持3%股份
同花顺,2026-06-02 11:30:10,苏奥传感：股东汪文巧拟减持1.12%股份
同花顺,2026-06-02 11:30:05,联域股份：董事、总经理潘年华拟减持不超过2.99%股份
同花顺,2026-06-02 11:29:49,盈新发展：转让西宁置业100%股权，预计净利润增加4.7亿元
同花顺,2026-06-02 11:29:00,易德龙：调整回购价格上限至不超过人民币44.4元/股
同花顺,2026-06-02 11:23:22,一艘货轮在伊拉克南部港口附近被导弹击中
同花顺,2026-06-02 11:19:22,浩通科技：控股股东夏军等3名股东拟减持不超过3%股份
同花顺,2026-06-02 11:18:42,刚果（金）埃博拉疫情累计确诊病例321例
同花顺,2026-06-02 11:17:41,唯科科技：员工持股平台拟合计减持1%股份
同花顺,2026-06-02 11:15:14,挖金客：拟出资4900万元设立参股子公司，持股35%
同花顺,2026-06-02 11:14:41,乘联分会：2026年5月，国内车企新能源乘用车预估批售量达136万辆，同比、环比均上涨超11%
同花顺,2026-06-02 11:14:17,老虎国际：6月12日起 暂停存量投资者账户在中国境内所有品种的新开仓、加仓交易
同花顺,2026-06-02 11:12:01,必得科技：董事夏帮华拟减持0.0065%股份
同花顺,2026-06-02 11:11:54,*ST景谷：连续6交易日涨停，涨幅偏离值累计35.88%，澄清无资本运作计划
同花顺,2026-06-02 11:11:47,今世缘百亿品牌拟年内推出重磅单品“三开”，时隔22年补足空白价格带
同花顺,2026-06-02 11:10:16,再升科技：公司针对相关市场主体未经事实核查编造虚假内容 已报案处理
同花顺,2026-06-02 11:07:37,NVIDIA Spectrum-X以太网硅光技术现已全面量产 较传统收发器的网络能效提升5倍
同花顺,2026-06-02 11:04:29,强脑科技预计今年灵巧手的销量将激增
同花顺,2026-06-02 11:01:17,国家邮政局局长赵冲久赴浙江调研
同花顺,2026-06-02 10:58:10,芯动联科：电子院及微电子院拟合计减持不超过2.987%股份
同花顺,2026-06-02 09:27:04,联美控股：中城美创以4000万元认购中城典实扩募份额
同花顺,2026-06-02 09:24:19,巴克莱银行将法兰克福上市的海力士股票的目标价格从1100欧元上调至2300欧元
同花顺,2026-06-02 09:23:16,伊朗革命卫队：将保持最高级别军事戒备状态
同花顺,2026-06-02 09:21:47,快递领域首个国际标准化机构在我国成立
同花顺,2026-06-02 09:20:49,长源电力：5月发电量28.29亿千瓦时，同比降低4.62%
同花顺,2026-06-02 09:18:56,意法半导体美股盘前涨超10%
同花顺,2026-06-02 09:17:27,欧元区5月通胀率预计升至3.2%
同花顺,2026-06-02 09:17:19,伊朗称过去24小时24艘船通过霍尔木兹海峡
同花顺,2026-06-02 09:14:55,2025年全国A级景区接待游客75.1亿人次
同花顺,2026-06-02 09:14:42,唯特偶：控股股东及一致行动人持股比例降至48.97%
同花顺,2026-06-02 09:14:32,艾德生物：筹划控制权变更，继续停牌不超过3个交易日
同花顺,2026-06-02 09:12:33,伯特利：收购豫北转向50.9727%股份交割完成
同花顺,2026-06-02 09:08:46,贝莱德（BlackRock）对中联重科的多头持仓比例增至6.35%
同花顺,2026-06-02 09:08:35,摩根大通（JPMorgan）对中国平安H股的多头持仓比例降至7.91%
同花顺,2026-06-02 09:08:26,铭科精技：拟使用不超过3600万元回购公司股份
同花顺,2026-06-02 09:08:24,花旗集团对中国平安H股的多头持仓比例增至6.06%
同花顺,2026-06-02 09:08:21,宝莫股份：子公司投资7863万元建设聚丙烯酰胺及油田助剂项目
同花顺,2026-06-02 09:08:10,塞力医疗：拟1862.6万元出售北京供应链50%的股权
同花顺,2026-06-02 09:08:09,贝莱德（BlackRock）对快手-W的多头持仓比例降至4.92%
同花顺,2026-06-02 09:08:03,摩根大通（JPMorgan）对小鹏集团-W的多头持仓比例增至7.13%
同花顺,2026-06-02 07:36:52,原华为盘古“90后少帅”离职创业，新公司已获1亿美元估值新融资
同花顺,2026-06-02 07:31:19,墨西哥总统指责美国极右翼势力干涉墨西哥内政
同花顺,2026-06-02 07:30:45,以军称在加沙地带打死五名武装人员
同花顺,2026-06-02 07:30:34,美防长称支持日本扩大军事合作，外交部：绥靖纵容终将养虎为患
同花顺,2026-06-02 07:26:41,市场监管总局等三部门：支持保健食品新功能产品创新，保障产品质量安全有效
同花顺,2026-06-02 07:26:21,外交部：希望菲方别任由个别跳梁小丑，一再破坏双方稳定关系的努力
同花顺,2026-06-02 07:25:59,伊朗称仍在评估谅解备忘录最终文本，尚未回应美方
同花顺,2026-06-02 07:18:28,中国内地航线燃油附加费将下调
同花顺,2026-06-02 07:16:30,星海图发布自研双足人形机器人
同花顺,2026-06-02 07:15:00,美媒：俄2024年底以来首次补给驻叙空军基地
同花顺,2026-06-02 07:13:55,特朗普被曝拟放弃“反武器化”基金计划
同花顺,2026-06-02 07:11:29,美据报或在欧洲增加核部署
同花顺,2026-06-02 07:11:27,现货黄金站上4540美元/盎司
同花顺,2026-06-02 07:08:07,襄阳轴承：巴西工厂落成开业 补齐南美产能板块
同花顺,2026-06-02 07:05:40,韩正将赴俄罗斯出席第二十九届圣彼得堡国际经济论坛并访问白俄罗斯
同花顺,2026-06-02 07:04:15,王文涛部长会见巴西外交部长维埃拉
同花顺,2026-06-02 07:01:49,欧洲主要股指开盘集体上涨
同花顺,2026-06-02 07:01:20,ETF收评：通信ETF领涨6.72%，国企红利ETF领跌6.1%
同花顺,2026-06-02 07:00:54,A股收评：创业板指高开高走涨2.66% 元件、光纤概念、CPO板块领涨
同花顺,2026-06-02 07:00:51,ETF两市成交额5188.39亿元
同花顺,2026-06-02 05:34:38,筹划控制权变更事项“告吹”，和仁科技股价重挫逾17%，公司回应
同花顺,2026-06-02 05:33:09,俄南部一炼油厂遭无人机袭击起火
同花顺,2026-06-02 05:31:10,现货白银涨超2%
同花顺,2026-06-02 05:29:39,铜缆高速连接板块震荡走强，鑫科材料涨停
同花顺,2026-06-02 05:27:38,现货白银站上76美元/盎司
同花顺,2026-06-02 05:27:17,Arm首席执行官：存储芯片供应整体仍吃紧
同花顺,2026-06-02 05:25:56,柬埔寨就海洋问题致函泰国和联合国，启动强制调解程序
同花顺,2026-06-02 05:25:23,创业板指涨3%，元件、CPO、光纤概念板块领涨
同花顺,2026-06-02 05:21:01,高通将发布全新数据中心业务品牌Dragonfly
同花顺,2026-06-02 05:17:51,沪深京三市成交额超2万亿元，较上日此时缩量1297亿元
同花顺,2026-06-02 05:16:59,半导体板块震荡走高，裕太微20cm涨停，源杰科技、江丰电子、杰华特涨幅居前
同花顺,2026-06-02 05:15:27,江西铜业触及涨停
同花顺,2026-06-02 05:13:18,马尔代夫将限制16岁以下青少年访问部分社媒平台
同花顺,2026-06-02 05:12:38,美国五角大楼新闻办公室成为媒体禁区
同花顺,2026-06-02 05:12:28,恒生科技指数涨幅扩大至4%
同花顺,2026-06-02 05:08:18,量子计算公司Quantinuum与三菱电机达成量子计算合作协议
同花顺,2026-06-02 05:07:37,第九届“选择法国”峰会聚焦人工智能产业链
同花顺,2026-06-02 05:05:53,富时中国A50指数期货涨2%
同花顺,2026-06-02 05:02:54,小金属板块短线拉升
同花顺,2026-06-02 05:01:37,美国拟“腰斩”在非洲办签证的使领馆数量
同花顺,2026-06-02 03:08:49,ETF两市成交额超3000亿元
同花顺,2026-06-02 02:59:52,老挝人革党中央总书记、国家主席通伦抵达杭州开始访华
同花顺,2026-06-02 02:59:33,光纤概念板块持续走强，亨通光电涨停
同花顺,2026-06-02 02:59:03,以色列议会一读通过解散议会法案
同花顺,2026-06-02 02:57:19,创业板指涨超2%
同花顺,2026-06-02 02:54:34,长飞光纤光缆港股涨超10%
同花顺,2026-06-02 02:54:29,半导体板块震荡拉升，寒武纪涨超5%
同花顺,2026-06-02 02:47:49,乌称基辅市遭袭已致1死20伤 俄方暂无回应
同花顺,2026-06-02 02:47:16,阿里内部复盘外卖大战得失：即时零售的竞争刚开始
同花顺,2026-06-02 02:31:53,A股三大指数集体翻红
同花顺,2026-06-02 02:31:17,商务部：对澳大利亚进口的牛肉数量达到规定数量100%的第3日起(含当日)，将在现行适用关税税率基础上加征55%关税
同花顺,2026-06-02 02:29:56,欧洲理事会主席敦促波黑加快入盟改革进程
同花顺,2026-06-02 02:28:15,元件板块持续拉升，风华高科触及涨停
同花顺,2026-06-02 02:23:24,欧洲议会将举行特别会议，讨论表决欧美贸易协议
同花顺,2026-06-02 02:22:12,电力板块局部拉升，韶能股份触及涨停
同花顺,2026-06-02 02:20:52,南向资金净买入超50亿港元
同花顺,2026-06-02 02:20:22,港股恒生科技指数涨幅达3%
同花顺,2026-06-02 02:17:42,港股科网股集体走高，美团涨超8%
同花顺,2026-06-02 02:15:50,快递领域首个国际标准化机构在中国成立
同花顺,2026-06-02 00:39:24,全国首家网上离境退税商店在北京落地
同花顺,2026-06-02 00:38:47,高温范围今日将达近期最大 南方新一轮降水将上线
同花顺,2026-06-02 00:37:50,深圳住宅网签时隔14个月再破万套：多个新盘“日光”，二手房成交价重回“6字头”
同花顺,2026-06-02 00:34:34,韩国KOSPI指数宽幅波动，收复3%的跌幅转涨
同花顺,2026-06-02 00:31:07,全球最大的白银ETF iShares Silver Trust持仓量较前日减少37.99吨
同花顺,2026-06-02 00:29:46,中信建投：算力等高频高速需求快速增长 电子级PTFE有望大规模应用
同花顺,2026-06-02 00:26:23,现货黄金站上4490美元/盎司
同花顺,2026-06-02 00:21:53,中方代表：黎以停火已名存实亡 呼吁立即实现停火止战
同花顺,2026-06-02 00:16:06,韩国KOSPI指数早间大幅波动
同花顺,2026-06-02 00:12:59,李宁与库里达成长期合作
同花顺,2026-06-02 00:08:13,韩国KOSPI指数快速跳水，跌幅扩大至3%
同花顺,2026-06-02 00:04:16,韩国综指涨幅扩大至1%
同花顺,2026-06-02 00:04:12,日韩股市涨跌互现
同花顺,2026-06-01 23:56:59,六连板*ST雅博：公司股票交易存在市场情绪过热、非理性炒作情况
同花顺,2026-06-01 23:54:40,意大利南部海域发生6.2级地震 多地有震感
同花顺,2026-06-01 23:47:44,伊朗议长强调对黎巴嫩的支持立场
同花顺,2026-06-01 23:46:20,特朗普：与伊朗“一周内”达成协议
同花顺,2026-06-01 23:45:38,新工艺实现多层单晶硅电路垂直集成
同花顺,2026-06-01 23:44:49,货币基金“T+1”结算落地 多家中小银行暂停货基申购
同花顺,2026-06-01 23:41:40,非化石能源电力消费核算指南出台 绿证市场迎利好
同花顺,2026-06-01 23:20:22,乌克兰首都基辅连续传出剧烈爆炸声
同花顺,2026-06-01 23:16:19,现货白银站上75美元/盎司
同花顺,2026-06-01 23:13:17,白酒消费税纳税申报新规施行，提升征管效能
同花顺,2026-06-01 23:10:11,趁晴抢收 全国小麦收获进度近三成
同花顺,2026-06-01 23:07:12,Anthropic向美国证券交易委员会保密提交IPO文件草案
同花顺,2026-06-01 22:51:59,伊朗：必要情况下“动用一切能力捍卫自身利益”
同花顺,2026-06-01 22:44:34,第勒尼安海发生6.2级地震 震源深度250公里
同花顺,2026-06-01 22:44:12,知名牛散扎堆掘金北交所新三板 长线投资渐成风向
同花顺,2026-06-01 22:39:55,储蓄国债即将纳入个人养老金产品池
同花顺,2026-06-01 22:39:43,白酒消费税纳税申报新规施行
同花顺,2026-06-01 22:34:58,券商密集上线Skills，行业AI竞争走向纵深
同花顺,2026-06-01 22:33:27,第勒尼安海附近发生6.2级左右地震
同花顺,2026-06-01 22:31:38,实际有效汇率指数创1973年以来新低 日元结构性贬值压力难消
同花顺,2026-06-01 22:31:21,端侧AI驱动下一轮增长 国产存储芯片迎新机遇
同花顺,2026-06-01 22:31:02,10年期国债收益率低见1.704% 债市交易逻辑重回基本面
同花顺,2026-06-01 22:30:54,美联储6月维持利率不变的概率为98.4%
同花顺,2026-06-01 22:19:57,韩国数据显示：在韩新注册登记进口汽车数量，中国车史上首超日本车
同花顺,2026-06-01 22:15:24,黎总统重申外交途径是解决冲突的唯一出路
同花顺,2026-06-01 22:09:52,5月多家券商领罚 监管紧盯分支机构合规短板
同花顺,2026-06-01 22:07:13,四大因素推升海运价格 集运指数近七周累计涨超60%
同花顺,2026-06-01 21:51:42,特朗普称美伊或于一周内达成协议 延长停火并重开霍尔木兹海峡
同花顺,2026-06-01 21:27:08,哈马斯称其代表团与土耳其情报局局长讨论加沙局势
同花顺,2026-06-01 21:22:10,莫斯科交易所测试用于人工智能代理参与交易的基础设施
同花顺,2026-06-01 21:18:45,以总理称与特朗普通话，将继续在黎南开展行动
同花顺,2026-06-01 21:15:33,富时中国A50指数期货夜盘收跌0.06%，报15533点
同花顺,2026-06-01 21:13:47,今年以来超600只理财产品提前退场
同花顺,2026-06-01 21:04:09,谷歌母公司Alphabet已达成协议，通过私募配售向伯克希尔哈撒韦公司出售100亿美元的股票
同花顺,2026-06-01 21:03:31,慧与股价盘后飙升超30% 预计未来18个月服务器需求增长强劲
同花顺,2026-06-01 21:03:21,标普：上调戴尔科技评级至BBB+，前景展望稳定
同花顺,2026-06-01 20:57:10,Meta上线AI聊天机器人付费订阅业务，用于覆盖其2026年1250亿–1450亿美元的预期资本开支
同花顺,2026-06-01 20:50:36,深圳3D打印机圈粉全球 狂揽近90%市场份额
同花顺,2026-06-01 20:42:19,谷歌母公司拟增加800亿美元股本，伯克希尔将投资100亿美元
同花顺,2026-06-01 20:37:20,美国战略石油储备降至两年多来最低水平
同花顺,2026-06-01 20:27:44,伊朗伊斯兰革命卫队称对美以船只实施打击
同花顺,2026-06-01 20:13:27,以总理：以军将继续按计划在黎南部开展行动
同花顺,2026-06-01 20:13:21,丹麦看守首相宣布新政府组建完成
同花顺,2026-06-01 20:08:57,黎巴嫩总统办公室：真主党已承诺停止打击以色列
同花顺,2026-06-01 20:08:50,2026年全国“服务消费季”在杭州启动
同花顺,2026-06-01 20:08:05,伊朗革命卫队暗示曼德海峡通航将受管控
同花顺,2026-06-01 20:07:50,芝加哥商业交易所集团宣布推出全天候（24/7）加密货币期货和期权交易
同花顺,2026-06-01 20:06:20,美股三大股指集体收涨
同花顺,2026-06-01 18:49:04,特朗普：以军不会前往贝鲁特，黎真主党同意停火
同花顺,2026-06-01 18:28:36,黎官员称真主党已准备好与以色列全面停火
同花顺,2026-06-01 18:28:32,雅加达一居民区发生火灾 消防部门已展开灭火行动
同花顺,2026-06-01 17:55:51,特朗普：与伊朗的谈判正“快速推进”
同花顺,2026-06-01 17:40:39,伊朗外交部：美对以色列违反黎以停火协议负有直接责任
同花顺,2026-06-01 17:38:26,特朗普：以色列和黎真主党的所有交火行动将立即停止
同花顺,2026-06-01 17:36:11,以军称拦截多枚黎巴嫩真主党发射的火箭弹
同花顺,2026-06-01 17:36:01,伦敦股市1日下跌
同花顺,2026-06-01 17:01:16,中国驻柬使馆敦促柬方全力侦办中国公民遇害案件
同花顺,2026-06-01 16:51:08,哥伦比亚一架小型飞机坠毁 4人遇难
同花顺,2026-06-01 16:51:02,Tripo AI完成近2亿美元A+轮和A++轮融资，以推进其AI 3D及世界模型路线图
同花顺,2026-06-01 16:34:38,以军称打死1名黎真主党军事指挥官
同花顺,2026-06-01 16:33:16,195只公募基金正式“换标尺”
同花顺,2026-06-01 16:33:04,3家港股AI企业正在“回A”辅导 “A+H”持续扩容
同花顺,2026-06-01 16:22:46,特朗普称尚未收到伊朗关于暂停谈判的消息
同花顺,2026-06-01 16:13:49,美国总统特朗普在接受NBC新闻记者采访时表示，他尚未收到伊朗关于暂停谈判的消息
同花顺,2026-06-01 16:13:38,特朗普谈及伊朗问题：说实话，我们话说得太多了。保持缄默或许才是上策
同花顺,2026-06-01 16:13:10,上交所：对邦彦技术股份有限公司有关责任人予以监管警示
同花顺,2026-06-01 16:11:10,Anthropic投资方股价跳涨
同花顺,2026-06-01 16:08:53,比特币跌破71000美元，日内跌3.69%
同花顺,2026-06-01 16:07:50,董军同南非国防和退伍军人部部长会谈
同花顺,2026-06-01 16:02:41,黎巴嫩议会议长：真主党已准备好和以色列达成停火协议
同花顺,2026-06-01 16:02:01,意大利交通部数据：5 月特斯拉新车上牌量同比下滑 23.5%
同花顺,2026-06-01 16:01:55,日菲商定尽早实现老旧日舰对菲出口
同花顺,2026-06-01 16:00:33,Anthropic 已向美国证券交易委员会（SEC）秘密递交 S-1 招股说明书草案
同花顺,2026-06-01 15:59:53,SpaceX：马斯克同意接受为期366天的股票锁定期
同花顺,2026-06-01 15:54:47,伊朗最高领袖军事顾问：伊方耐心有限 绝不允许海上封锁继续
同花顺,2026-06-01 15:47:48,乌干达反政府武装袭击刚果（金）东部致16人死亡
同花顺,2026-06-01 15:47:35,伊朗武装部队警告以色列
同花顺,2026-06-01 14:15:39,中美两军在美国夏威夷举行2026年度中美海上军事安全磋商机制工作小组会议
同花顺,2026-06-01 14:14:58,美国供应管理学会5月份制造业指数升至54.0，预估为53.0
同花顺,2026-06-01 14:13:20,以军要求黎巴嫩首都贝鲁特南郊居民撤离
同花顺,2026-06-01 14:08:23,新易盛：1.6T光模块产品订单相对于去年增幅很大，预计在今年呈现出逐季快速增长的趋势
同花顺,2026-06-01 14:00:03,伊朗暂停通过中间人同美国的对话 要求满足前不举行任何谈判
同花顺,2026-06-01 13:57:36,丽珠医药：重组人促卵泡激素注射液获得药品注册证书
同花顺,2026-06-01 13:52:57,伊朗官员：以色列必须立即停止在黎巴嫩和加沙地带的军事行动
同花顺,2026-06-01 13:42:45,Arm盘初涨幅一度扩大至逾16%，总市值超4300亿美元
同花顺,2026-06-01 13:37:41,戴尔科技股价上涨8%
同花顺,2026-06-01 13:37:33,莲花控股：股东周口中控持股比例降至8.31%
同花顺,2026-06-01 13:35:26,美光科技涨超5% 股价突破1000美元
同花顺,2026-06-01 13:32:18,伊朗计划彻底封锁霍尔木兹海峡并启动曼德海峡“战线”
同花顺,2026-06-01 13:30:56,美股开盘：美股三大指数集体低开
同花顺,2026-06-01 13:27:30,美军证实驻科威特基地遭伊朗袭击称无人员伤亡
同花顺,2026-06-01 13:26:33,东阳光：控股子公司签署100亿元至120亿元算力服务采购合同
同花顺,2026-06-01 13:26:07,WTI原油大涨6%
同花顺,2026-06-01 13:20:22,伊朗媒体：伊朗暂停通过中间人同美国的对话
同花顺,2026-06-01 13:16:01,美、布两油短线拉升
同花顺,2026-06-01 13:15:15,岚图汽车：5月交付新车13003辆，同比增长30%
同花顺,2026-06-01 11:59:18,亚威股份：拟投资Haco欧洲公司80%股份及美国公司49%股份
同花顺,2026-06-01 11:54:18,*ST易录：预重整债权申报截止日为2026年6月28日
同花顺,2026-06-01 11:52:20,广西柳州受地震影响的45所市属学校全部复课
同花顺,2026-06-01 11:46:46,华特气体：信息披露义务人持股比例从50.00%减少至44.83%
同花顺,2026-06-01 11:43:11,和仁科技：终止筹划控制权变更 6月2日复牌
同花顺,2026-06-01 11:40:41,华兰股份：全资子公司拟2.05亿元增资自然常数获34.17%股权
同花顺,2026-06-01 11:34:29,皖维高新：向控股股东转让巢湖国元小额贷款有限公司10%股权
同花顺,2026-06-01 11:34:21,*ST中地：公司股票将于6月3日撤销退市风险警示 日涨跌幅限制变更为10%
同花顺,2026-06-01 11:32:15,中方向非洲有关国家和非盟提供抗击埃博拉疫情援助
同花顺,2026-06-01 11:22:59,*ST天龙：涉及决议撤销诉讼法院已受理
同花顺,2026-06-01 11:22:23,声迅股份：拟2.51亿元收购武汉中科锐择光电科技有限公司51%股权
同花顺,2026-06-01 11:18:54,北京市首个太空算力产业创新中心正式成立
同花顺,2026-06-01 11:18:53,江苏国信：未开展算电协同及蒙电入苏项目，一季度净利润同比降9.73%
同花顺,2026-06-01 11:16:35,高通美股盘前跌幅扩大至10%
同花顺,2026-06-01 11:16:27,赛力斯：2026年5月汽车销量36480辆，同比下降17.38%
同花顺,2026-06-01 11:15:41,伊朗外长：任何一条战线的停火遭破坏等同所有战线停火遭破坏
同花顺,2026-06-01 11:13:23,安集科技：多名股东减持计划到期未减持
