来源,时间,标题
同花顺,2026-06-04 22:28:20,机构前瞻下半年资本市场新趋势：改革强根基 资金增活力 工具提质效
同花顺,2026-06-04 22:28:15,ETF座次重新洗牌 资金“换挡”重塑市场生态
同花顺,2026-06-04 22:28:10,核心驱动力并未动摇 五大券商把脉A股下半年机遇
同花顺,2026-06-04 22:28:02,高温与算电协同助力 A股电力板块投资价值升温
同花顺,2026-06-04 22:27:40,透视年内债市信披监管措施：紧盯关键主体，全链条、穿透式深化
同花顺,2026-06-04 22:21:43,券商密集发布2026年度提质增效方案 锚定投行提质、控薪增效、分红回馈三条主线
同花顺,2026-06-04 22:21:35,前5个月基金新开户数近160万 基金经理对后市普遍持乐观态度
同花顺,2026-06-04 22:21:28,多路增量资金加码A股 主动权益类基金加仓科技成长
同花顺,2026-06-04 22:19:40,普京：需要说服乌方相信俄罗斯同意妥协
同花顺,2026-06-04 22:15:54,美元指数4日下跌
同花顺,2026-06-04 22:02:06,美联储6月维持利率不变的概率为96.4%
同花顺,2026-06-04 21:55:04,SpaceX告知投行其IPO发行价定为每股135美元，不会变动
同花顺,2026-06-04 21:50:49,以色列继续空袭黎巴嫩 真主党打死以军士兵
同花顺,2026-06-04 21:50:44,伊朗官员：若以色列向黎巴嫩达希耶方向推进将承受巨大代价
同花顺,2026-06-04 21:50:40,特朗普：乐见“普泽会” 俄乌会“妥协”
同花顺,2026-06-04 21:50:27,哈马斯高官与伊朗外长通话讨论地区局势
同花顺,2026-06-04 21:34:17,富时中国A50指数期货夜盘收涨0.16%，报15734点
同花顺,2026-06-04 21:34:12,美方将古巴国家主席列入制裁名单
同花顺,2026-06-04 21:33:57,国际油价4日显著下跌
同花顺,2026-06-04 20:56:12,特朗普称黎以和平谈判取得一定进展
同花顺,2026-06-04 20:55:28,特朗普称若达成协议 不排除与伊朗最高领袖会晤
同花顺,2026-06-04 20:21:47,美国总统特朗普：我们不需要与伊朗达成协议，也可以取得他们的浓缩铀
同花顺,2026-06-04 20:21:42,美国财政部网站显示，美国制裁古巴主席米格尔·迪亚斯
同花顺,2026-06-04 20:17:52,瑞士将在G7法国峰会期间向毗邻边境派兵四千
同花顺,2026-06-04 20:00:40,美股收评：美股三大指数收盘涨跌不一
同花顺,2026-06-04 19:57:15,德国落选安理会非常任理事国，德外长：或因支持乌克兰和以色列
同花顺,2026-06-04 19:57:06,俄总统新闻秘书：随时欢迎泽连斯基来莫斯科谈
同花顺,2026-06-04 19:26:55,伊朗外长：地区国家不应让美国利用其领土攻击伊朗
同花顺,2026-06-04 19:19:40,世界粮食计划署：中东危机外溢冲击全球粮食安全
同花顺,2026-06-04 19:06:12,在岸人民币兑美元夜盘收盘报6.7750，较上一交易日上涨43点
同花顺,2026-06-04 19:05:56,泽连斯基公开致信普京　提议举行会晤
同花顺,2026-06-04 19:05:32,普京愿在俄美会晤基础上与乌谈判
同花顺,2026-06-04 19:05:12,俄外长：俄已更新海湾地区安全构想并递交各方
同花顺,2026-06-04 18:21:41,美国天然气期货价格涨幅扩大至5%
同花顺,2026-06-04 18:20:44,胡塞武装称已做好准备应对任何局势发展
同花顺,2026-06-04 18:05:16,高盛预计SpaceX到2030年将“烧掉”3500亿美元现金，资本支出的80%将用于人工智能
同花顺,2026-06-04 18:04:42,普京：控制顿巴斯和与乌方达成和平协议不矛盾
同花顺,2026-06-04 18:04:35,LME金属期货收盘涨跌不一
同花顺,2026-06-04 18:03:19,普京：俄罗斯不拒绝与欧洲对话
同花顺,2026-06-04 17:43:55,普京：俄方愿在美国安克雷奇与乌方谈判
同花顺,2026-06-04 17:42:24,伊朗5月石油出口量降至每日30万桶以下，为至少六年来最低水平
同花顺,2026-06-04 17:04:56,伦敦股市4日上涨
同花顺,2026-06-04 17:04:12,俄外长：“拜登的战争”变成“特朗普的战争”
同花顺,2026-06-04 17:01:37,波士顿联储研究显示石油冲击对美国的影响弱于1970年代
同花顺,2026-06-04 16:59:11,世界最大海上换流站“海风之心”顺利完成海上安装
同花顺,2026-06-04 16:40:28,新疆伊犁州霍尔果斯市发生4.8级地震 震源深度17公里
同花顺,2026-06-04 16:38:12,公募机构对直销业务“做减法”
同花顺,2026-06-04 16:20:07,北京中科信半导体股份有限公司启动上市辅导
同花顺,2026-06-04 16:11:58,现货白银涨超1.50%
同花顺,2026-06-04 16:07:04,OpenAI：今天向美国的Plus和Pro用户提供更新，未来几周将向其他国家及免费和Go用户推出
同花顺,2026-06-04 16:05:21,Meta旗下Instagram推出Instagram Plus
同花顺,2026-06-04 16:05:11,Meta 股票价格上涨 3.1%，创盘中新高
同花顺,2026-06-04 16:00:49,美股减肥药板块走高，礼来、诺和诺德双双涨超5%
同花顺,2026-06-04 15:50:20,欧盟中国商会：中欧应加强互联互通与合作，共同促进创新发展
同花顺,2026-06-04 15:39:46,欧洲三大股指收盘全线上涨
同花顺,2026-06-04 15:35:44,罗马尼亚总统任命欧金·托马茨为总理
同花顺,2026-06-04 15:29:04,中国贸促会新闻发言人就美国贸易代表办公室发起强迫劳动301调查并拟加征关税发表谈话
同花顺,2026-06-04 15:28:38,为破解航运困局，阿联酋布局新输油管道
同花顺,2026-06-04 15:24:09,中国铁建：巩固完善公司市场化经营机制 推动科技创新与产业创新深度融合
同花顺,2026-06-04 15:22:51,法兰克福机场发生客机起落架坍塌事故致多人受伤
同花顺,2026-06-04 15:22:05,德法英酝酿推动俄乌展开直接谈判
同花顺,2026-06-04 15:21:38,联动科技：加速推进全品类客户导入与批量投产
同花顺,2026-06-04 15:20:44,广东：要大力推动批零住餐业实现量质齐升 加快培育金融业成为强大的支柱性产业
同花顺,2026-06-04 15:02:01,全国麦收高效有序推进 良种良法助力颗粒归仓
同花顺,2026-06-04 14:59:36,陕西麦科奥特医药科技股份有限公司 - B通过港交所上市聆讯
同花顺,2026-06-04 14:46:44,全球最大直驱型漂浮式海上风电机组示范工程建设正式启动
同花顺,2026-06-04 14:35:17,外资加速重仓中国硬科技
同花顺,2026-06-04 14:31:16,2026年度澜湄合作专项基金柬埔寨项目签署协议
同花顺,2026-06-04 14:28:59,美国国会众议院3日通过一项决议，旨在限制美国总统特朗普对伊朗采取军事行动的权力
同花顺,2026-06-04 14:05:05,黎巴嫩真主党领导人：只要以色列的占领仍然存在，真主党的抵抗就将继续
同花顺,2026-06-04 14:02:22,NYMEX取暖油主力合约跌超4%
同花顺,2026-06-04 14:02:15,特朗普认为赞成限制其战争权力的众议员“不爱国”
同花顺,2026-06-04 14:02:04,美国5月全球供应链压力指数 1.77，前值1.82
同花顺,2026-06-04 14:01:20,乌克兰总理：欧盟成员国均已同意开启乌方入盟谈判
同花顺,2026-06-04 13:59:12,道指刷新纪录新高，盘中涨幅达1.5%
同花顺,2026-06-04 13:50:51,证监会同意泰诺麦博科创板IPO注册
同花顺,2026-06-04 13:40:47,美股光通信股盘初下跌
同花顺,2026-06-04 13:38:31,美股道琼斯指数期货涨超1%
同花顺,2026-06-04 13:34:49,李飞飞长文拆解世界模型实现路径
同花顺,2026-06-04 13:31:16,美股开盘：美股三大指数涨跌不一
同花顺,2026-06-04 13:29:43,我国成功发射千帆极轨11组卫星
同花顺,2026-06-04 13:28:24,礼来美股盘前涨超2%
同花顺,2026-06-04 13:26:14,格力电器：董明珠的一致行动人减持总股本的0.76%
同花顺,2026-06-04 13:18:53,阿布扎比公司旗下铜企再获赞比亚铜精矿出口豁免 却仍称不计划出口
同花顺,2026-06-04 13:18:39,谷歌宣布在德克萨斯州格雷和罗伯茨县新建一座数据中心并进行能源投资
同花顺,2026-06-04 13:18:29,上海市市场监管局召开第五期企业圆桌会 12家平台企业参与
同花顺,2026-06-04 13:04:27,摩根大通：4、5月全球股票回购金额创纪录 科技行业回购力度加大
同花顺,2026-06-04 13:02:17,剑桥科技：完成配售1560万股新H股 募资净额约19.67亿港元
同花顺,2026-06-04 13:00:12,期市夜盘开盘，国内期货主力合约多数下跌，燃油跌超2%
同花顺,2026-06-04 12:57:13,伊戈尔：5名股东已合计减持0.0833%股份
同花顺,2026-06-04 12:52:46,沪电股份独家回应海外订单传闻：若有大额订单会及时披露，目前没有需披露信息
同花顺,2026-06-04 12:52:24,伊朗“圣城旅”：以色列须撤退至冲突爆发前的位置
同花顺,2026-06-04 12:44:21,拓山重工：控股股东等3人拟合计减持不超2.81%股份
同花顺,2026-06-04 12:44:03,高端光纤预制棒价格涨幅近550% 业内人士：短期内光棒供给紧缺的情况仍会阶段性固化
同花顺,2026-06-04 12:43:23,空缺半月，交行普惠金融部总经理到岗
同花顺,2026-06-04 12:42:29,唯特偶：深交所向唯特偶下发关注函 要求说明公司目前主营产品分别应用在光模块生产三大环节的具体情况
同花顺,2026-06-04 12:39:10,韩国执政党赢得地方选举
同花顺,2026-06-04 12:38:46,合肥城建：股东工投控股和董事王庆生拟分别减持1%和0.0014%股份
同花顺,2026-06-04 12:37:18,克罗地亚一架小型飞机坠毁造成4人死亡
同花顺,2026-06-04 12:34:56,广西探路AI赋能制造业焕新
同花顺,2026-06-04 12:23:49,日联科技：拟发行股份、可转债及支付现金收购菲莱测试100%股权，交易作价9.36亿元
同花顺,2026-06-04 12:22:30,美联新材：股东张盛业已减持1.99995%股份
同花顺,2026-06-04 12:21:03,金时科技：公司超级电容器业务目前暂无在手订单，公司不涉及液冷、光通信业务
同花顺,2026-06-04 12:16:09,博杰股份：拟定增募资不超15.03亿元用于服务器检测设备及散热模组零部件产能建设等项目
同花顺,2026-06-04 12:15:02,黎总统称黎以停火协议获批后24小时内可实施
同花顺,2026-06-04 12:14:48,6月4日周四《新闻联播》要闻22条
同花顺,2026-06-04 12:08:36,WTI原油期货跌幅扩大至4.20% 跌破每桶92美元
同花顺,2026-06-04 11:04:40,市场监管总局公布传统工艺市场“打假清源”典型案例
同花顺,2026-06-04 10:59:52,*ST节能：神雾集团所持5.10%公司股份将被司法拍卖
同花顺,2026-06-04 10:59:42,节能风电：调整2025年年度利润分配方案 每股派发现金红利调整为人民币0.00295元（含税）
同花顺,2026-06-04 10:59:38,悦心健康：联合关联方受让斯米克健康科技36%股权
同花顺,2026-06-04 10:59:13,以军开始从黎南部德宾镇撤军
同花顺,2026-06-04 10:57:57,东材科技：董事长唐安斌拟减持0.2872%
同花顺,2026-06-04 10:57:54,长沙银行：湖南长银五八增资8.21亿元
同花顺,2026-06-04 10:57:17,联合健康盘前上涨2.4%
同花顺,2026-06-04 10:52:33,百利天恒：注射用BL-M05D1（ADC）用于在既往经一线治疗的Claudin18.2阳性晚期胃癌或胃食管结合部腺癌III期临床试验完成首例受试者入组
同花顺,2026-06-04 10:52:30,百利天恒：注射用BL-M08D1（ADC）联合用药治疗弥漫大B细胞淋巴瘤获得药物临床试验批准通知书
同花顺,2026-06-04 10:44:03,合合信息：罗希平减持1.01%公司股份 持股比例降至4.11%
同花顺,2026-06-04 10:42:28,美诺华：拟定增募资不超21.09亿元
同花顺,2026-06-04 10:38:47,鼎通科技：公司液冷产品目前仅少量、阶段性交付，暂无大额长期锁定订单
同花顺,2026-06-04 10:38:00,焦平铁路全线最大制梁场正式投产
同花顺,2026-06-04 10:37:52,美媒：SpaceX上市或造富多名美国政府官员
同花顺,2026-06-04 10:37:20,梓橦宫：子公司酒石酸西尼必利原料药取得上市申请受理通知书
同花顺,2026-06-04 10:32:38,美商会会长：美中关系新定位利好双边经贸发展
同花顺,2026-06-04 10:29:43,万润股份：向全体股东每10股派1.25元
同花顺,2026-06-04 10:29:37,致尚科技：公司持续收到美国某光纤连接解决方案提供商的采购订单，累积订单金额约6640.04万美元
同花顺,2026-06-04 10:26:27,以军空袭加沙城致9人死亡
同花顺,2026-06-04 09:20:12,机构：一季度华为、荣耀位居中国折叠屏市场前二位
同花顺,2026-06-04 09:18:07,浙能台二电二期卸煤码头正式投运
同花顺,2026-06-04 09:14:47,贝莱德（BlackRock）对江西铜业股份的多头持仓比例增至5.83%
同花顺,2026-06-04 09:14:38,摩根大通（JPMorgan）对中国平安H股的多头持仓比例降至7.97%
同花顺,2026-06-04 09:14:30,贝莱德（BlackRock）对工商银行H股的多头持仓比例增至5.04%
同花顺,2026-06-04 09:14:19,贝莱德（BlackRock）对中国人寿H股的多头持仓比例增至6.08%
同花顺,2026-06-04 09:12:43,高盛对再鼎医药的多头持仓比例增至5.9%
同花顺,2026-06-04 09:12:34,贝莱德（BlackRock）对中兴通讯H股的多头持仓比例增至8.38%
同花顺,2026-06-04 09:12:20,贝莱德（BlackRock）对ASMPT的多头持仓比例增至5.12%
同花顺,2026-06-04 09:12:10,摩根大通（JPMorgan）对哔哩哔哩-W的多头持仓比例增至12.17%
同花顺,2026-06-04 09:12:04,高盛对哔哩哔哩-W的多头持仓比例降至4.99%
同花顺,2026-06-04 09:11:52,瑞银集团（UBS）对泡泡玛特的多头持仓比例增至42.14%
同花顺,2026-06-04 09:11:29,摩根大通（JPMorgan）对小鹏集团-W的多头持仓比例增至7.03%
同花顺,2026-06-04 09:11:15,贝莱德（BlackRock）对洛阳钼业H股的多头持仓比例降至7.94%
同花顺,2026-06-04 09:10:53,伊朗最高领袖发表书面致辞呼吁团结
同花顺,2026-06-04 09:10:42,摩根大通（JPMorgan）对药明康德H股的多头持仓比例增至12.04%
同花顺,2026-06-04 09:10:25,贝莱德（BlackRock）对长和的多头持仓比例增至5.04%
同花顺,2026-06-04 09:10:00,美股存储板块盘前走低，美光科技跌超6%
同花顺,2026-06-04 09:08:04,江苏有线：拟追加投资常熟银行至不超过4.5%股份、12亿元
同花顺,2026-06-04 09:07:28,台积电美股盘前跌超2%
同花顺,2026-06-04 07:35:28,乌克兰称多地遭袭断电
同花顺,2026-06-04 07:35:08,多伦科技：多名董事及高管已增持30.15万股
同花顺,2026-06-04 07:33:55,鼎通科技：向不特定对象发行可转债申请获同意
同花顺,2026-06-04 07:33:48,概伦电子：重组事项将于2026年6月10日上会审核
同花顺,2026-06-04 07:32:53,思特威：向特定对象发行股票申请获同意
同花顺,2026-06-04 07:31:58,商务部公告2026年第22号 公布对原产于韩国、泰国和马来西亚的进口共聚聚甲醛反倾销措施相关企业税率继承的决定
同花顺,2026-06-04 07:29:57,杭州二手房市场走热 连续三个月成交超9000套
同花顺,2026-06-04 07:28:20,外交部：炮制借口、造谣抹黑不能成为美对古巴野蛮封锁的理由
同花顺,2026-06-04 07:26:49,外交部：希望欧方客观理性看待中欧经贸关系
同花顺,2026-06-04 07:24:49,SAP大中华区总裁原欣：AI时代的企业壁垒，不在于有多少智能体
同花顺,2026-06-04 07:23:09,外交部谈“五眼联盟”指责中方“间谍威胁”：很讽刺
同花顺,2026-06-04 07:20:25,欧盟考虑推出新对华贸易限制工具，外交部：违背经济规律，损人不利己
同花顺,2026-06-04 07:16:00,预告：国新办将于2026年6月8日（星期一）上午10时举行《城市更新“十五五”规划》有关情况政策例行吹风会
同花顺,2026-06-04 07:14:41,商务部：反对美以“强迫劳动”为由对华贸易限制
同花顺,2026-06-04 07:12:39,长电科技高密度3D系统集成新厂房启用，聚焦AI电源模组等高附加值领域
同花顺,2026-06-04 07:10:21,欧洲主要股指开盘多数上涨
同花顺,2026-06-04 07:08:44,商务部：美滥用出口管制冲击全球半导体产供链稳定
同花顺,2026-06-04 07:06:23,期货收评：全线下挫！碳酸锂跌近5% 多晶硅下跌超3%
同花顺,2026-06-04 07:04:27,中国维和部队在阿卜耶伊开展助学慰问人道主义援助
同花顺,2026-06-04 07:02:53,ETF两市成交额4336.14亿元
同花顺,2026-06-04 05:30:43,大商所焦煤主力合约大涨5%
同花顺,2026-06-04 05:29:37,沪深京三市成交额超2万亿元，较上日此时缩量2235亿元
同花顺,2026-06-04 05:28:55,新石器在安徽成立新公司，含智能机器人业务
同花顺,2026-06-04 05:19:25,零售板块持续下挫，中央商场触及跌停
同花顺,2026-06-04 05:12:05,存储芯片板块震荡走强，德明利触及涨停
同花顺,2026-06-04 05:03:44,大地电气等成立汽车电子新公司
同花顺,2026-06-04 05:02:59,铜缆高速连接板块短线拉升，鼎通科技20cm涨停
同花顺,2026-06-04 04:55:52,中方决定禁止新西兰有关议员入境
同花顺,2026-06-04 04:52:50,台积电首席执行官：台积电不会突然大幅涨价
同花顺,2026-06-04 04:47:37,台积电首席执行官：正尽全力确保台积电不会成为（供应链）瓶颈
同花顺,2026-06-04 04:36:47,航行警告 渤海军事演习
同花顺,2026-06-04 04:35:51,日本央行考虑本月加息0.25个百分点
同花顺,2026-06-04 04:32:05,现货黄金涨超1%
同花顺,2026-06-04 04:25:11,印尼央行副行长：印尼央行持续加大汇市干预力度
同花顺,2026-06-04 04:13:56,菲律宾基准股指下跌1%
同花顺,2026-06-04 04:10:13,台积电魏哲家：CoPoS最快两年放量
同花顺,2026-06-04 04:08:39,Omdia：一季度电视出货量增长6%，世界杯备货周期正式启动
同花顺,2026-06-04 04:08:21,6月4日午间公告一览：ST迪威迅将于2026年6月24日下午15:00召开2025年度股东会
同花顺,2026-06-04 04:01:12,港股午评：恒生指数跌1.4%，恒生科技指数跌1.43%
同花顺,2026-06-04 03:58:37,灵心巧手投资成立科技公司 含可穿戴智能设备制造业务
同花顺,2026-06-04 03:01:36,老挝人革党中央总书记、国家主席通伦抵达北京
同花顺,2026-06-04 02:59:33,全球首个万亿美元ETF诞生
同花顺,2026-06-04 02:56:32,以色列空袭加沙城多处民宅，至少9人死亡
同花顺,2026-06-04 02:54:16,沪深京三市成交额超1.5万亿元，较上日此时缩量1206亿元
同花顺,2026-06-04 02:53:19,煤炭开采加工板块震荡走高，安泰集团涨停
同花顺,2026-06-04 02:46:50,美国火星大气探测器MAVEN任务终结
同花顺,2026-06-04 02:43:04,BC电池板块短线拉升
同花顺,2026-06-04 02:41:15,澳大利亚总理回应美国新关税提案：不合理，澳美就关税存在“意识形态分歧”
同花顺,2026-06-04 02:37:05,美联储“褐皮书”显示美国消费支出贫富分化加剧
同花顺,2026-06-04 02:36:04,第九届进博会推介会在奥地利维也纳举行
同花顺,2026-06-04 02:32:13,中国联通在杭州投资成立智算科技公司
同花顺,2026-06-04 02:30:04,易方达基金新进为非货ETF规模第一
同花顺,2026-06-04 02:27:05,半导体材料板块短线拉升
同花顺,2026-06-04 02:23:04,超级电容板块震荡拉升，江海股份涨停
同花顺,2026-06-04 02:19:02,泽连斯基说愿即刻与普京直接谈判
同花顺,2026-06-04 02:18:38,南向资金净买入超20亿港元
同花顺,2026-06-04 02:16:45,英国监管机构给谷歌AI搜索“立新规”
同花顺,2026-06-04 02:15:21,西班牙政府启动年度高温防护计划
同花顺,2026-06-04 02:14:27,全球最大的黄金ETF SPDR Gold Trust持仓较前日减少1.14吨
同花顺,2026-06-04 02:13:36,日经225指数跌幅扩大至2%
同花顺,2026-06-04 01:53:54,北证50指数跌幅扩大至2%
同花顺,2026-06-04 01:48:53,港股恒生指数跌幅达1%
同花顺,2026-06-04 01:45:58,国家金融监督管理总局上海监管局等四部门：建立本市养老服务信托品牌，形成上海养老服务金融样本
同花顺,2026-06-04 01:45:05,中船系板块持续上攻，中船特气涨超16%
同花顺,2026-06-04 01:43:29,存储芯片板块上扬，大为股份涨停
同花顺,2026-06-04 01:41:58,沪深京三市成交额超5000亿元，较上日此时缩量806亿元
同花顺,2026-06-04 01:37:37,油价或迎年内第二降 加满一箱油将少花21元
同花顺,2026-06-04 01:35:21,电力板块短线拉升，豫能控股涨停
同花顺,2026-06-04 01:33:50,房地产板块短线拉升，阳光股份涨停
同花顺,2026-06-04 01:33:08,铜缆高速连接板块拉升，鑫科材料3连板
同花顺,2026-06-04 01:31:42,5月下旬与5月中旬相比13种产品价格上涨
同花顺,2026-06-04 01:29:29,股指期货早盘开盘 主力合约集体低开
同花顺,2026-06-04 01:27:40,联合国警告黎以冲突激化致黎人道危机加剧
同花顺,2026-06-04 01:26:28,ETF开盘：石油ETF领涨2.06%，巴西ETF领跌2.87%
同花顺,2026-06-04 01:25:29,富时中国A50指数期货跌幅扩大至1%
同花顺,2026-06-04 01:25:19,A股开盘：三大指数集体低开
同花顺,2026-06-04 01:23:21,现货黄金站上4470美元/盎司
同花顺,2026-06-04 01:22:07,央行：今日7天期逆回购操作量为零
同花顺,2026-06-04 01:21:30,港股开盘：恒生指数低开0.66%，恒生科技指数低开1.23%
同花顺,2026-06-04 01:21:13,上一交易日ETF两市融资融券余额1103.19亿元
同花顺,2026-06-04 00:47:08,两市融资余额较上日增加84.95亿元
同花顺,2026-06-04 00:46:44,大亚圣象：《城市更新“十五五”规划》实施将为公司产品带来市场机遇
同花顺,2026-06-04 00:46:07,美军称在东太平洋打击一艘“贩毒船” 致2人死亡
同花顺,2026-06-04 00:45:56,深交所港股通标的证券名单调整，文远知行-W、小马智行-W调入
同花顺,2026-06-04 00:37:23,“西电东送”新通道大同-怀来-天津南特高压工程完成关键施工，进入全面架线阶段
同花顺,2026-06-04 00:28:24,舍弗勒与千寻智能签订战略合作协议 推进具身智能产业发展
同花顺,2026-06-04 00:23:13,微信正与手机厂商合作推出Agent-to-Agent助手能力
同花顺,2026-06-04 00:22:18,华泰证券：下半年风险资产或延续占优
同花顺,2026-06-04 00:21:24,铁路端午假期运输首日火车票今天起售
同花顺,2026-06-04 00:21:13,江波龙：目前存储产业正处于高景气周期中
同花顺,2026-06-04 00:19:06,特朗普：若有美军士兵战死，将考虑终止与同伊朗停火
同花顺,2026-06-04 00:17:19,全球最大的白银ETF iShares Silver Trust持仓量较前日持平
同花顺,2026-06-04 00:10:28,强化覆盖力度 发力未来汽车 汽车行业标准化建设提速进阶
同花顺,2026-06-04 00:07:33,谢锋大使同知名跨国公司高管集体交流
同花顺,2026-06-04 00:06:41,京东方A：玻璃基封装载板试验线良率尚未达到量产水平
同花顺,2026-06-04 00:02:11,日韩股市低开
同花顺,2026-06-03 23:56:43,李家超：香港与乌兹别克斯坦互免签证30天
同花顺,2026-06-03 23:52:07,AI基建催生“算力金属”热潮 供给端“硬约束”成为核心逻辑
同花顺,2026-06-03 23:48:52,鲁比奥：俄乌谈判陷停滞 局势存升级风险
同花顺,2026-06-03 23:45:01,纽约期金站上4480美元/盎司
同花顺,2026-06-03 23:27:07,业内人士预计：5月份PPI有望继续回升
同花顺,2026-06-03 23:25:12,中信建投：预计后续债市走强节奏有所放缓，短期内10Y国债在1.70%一线盘整震荡
同花顺,2026-06-03 23:14:51,以色列和黎巴嫩同意停火 但有前提
同花顺,2026-06-03 22:54:08,港股主题ETF资金切换 减持恒生科技加仓创新药
同花顺,2026-06-03 22:54:01,科技主题LOF业绩批量翻倍，溢价水平走高触发风控加码
同花顺,2026-06-03 22:53:53,年内多家公募迎资金驰援 强化资本储备“压舱石”
同花顺,2026-06-03 22:53:45,避开拥挤赛道布局AI上游 基金经理看好能源类“科技奶牛”
同花顺,2026-06-03 22:53:34,上市公司再掀回购热潮 年内披露金额已超千亿元
同花顺,2026-06-03 22:49:21,需求爆发遭遇供给刚性 “算力金属”开启价值重估新周期
同花顺,2026-06-03 22:49:12,CPU重回AI算力聚光灯下 本土厂商获“替代窗口”
同花顺,2026-06-03 22:48:13,云霄直流通道输电权市场化交易启动
同花顺,2026-06-03 22:35:59,硬科技企业IPO提速 险资提前押注
同花顺,2026-06-03 22:31:50,外媒：AI推动韩股市值超印度，三星电子和SK海力士是主要推手
同花顺,2026-06-03 22:29:38,AI与新能源需求共振 高端铜箔产能供不应求
同花顺,2026-06-03 22:29:02,央行公开市场再现“零操作” 技术性回笼不改资金面宽松预期
同花顺,2026-06-03 22:28:34,绩优科技主题基金频频限购 机构：后市关注标的估值与业绩匹配度
同花顺,2026-06-03 22:28:00,储蓄国债正式纳入个人养老金产品池 补齐养老投资零风险资产
同花顺,2026-06-03 22:25:45,商业银行二永债发行持续升温
同花顺,2026-06-03 22:24:58,算力大单频现 租赁市场进入规模化增长周期
同花顺,2026-06-03 22:14:51,OpenAI据悉正计划将Codex与ChatGPT合并
同花顺,2026-06-03 22:14:34,伊朗外长：若以色列侵略黎巴嫩贝鲁特，伊方将重新开战
同花顺,2026-06-03 22:09:15,Meta计划推出的“Hatch”人工智能智能体，拟每月最高收费200美元
同花顺,2026-06-03 22:08:42,特朗普称美伊协议可能在本周末达成
同花顺,2026-06-03 21:43:49,韩媒：韩国地方选举 执政党锁定胜局
同花顺,2026-06-03 21:35:36,美众议院叫停对伊朗军事行动
同花顺,2026-06-03 21:28:07,伊朗称爱国者导弹致科威特机场受损
同花顺,2026-06-03 21:19:43,博通股价盘后跌幅扩大至12%
同花顺,2026-06-03 21:01:47,韩国5月外汇储备 4269.9亿美元，前值4278.8亿美元
