来源,时间,标题
财联社,2025-12-01 17:08:33.000,抖音：7月以来已封禁投资理财类涉诈账号超80万个
财联社,2025-12-01 17:07:10.000,美股加密货币概念股盘前走低
财联社,2025-12-01 17:06:42.000,REITs项目行业范围清单（2025年版）印发 人工智能基础设施项目在列
财联社,2025-12-01 17:05:17.000,国家发改委印发不动产投资信托基金（REITs）项目行业范围清单
财联社,2025-12-01 17:04:14.000,克而瑞：11月房企推盘积极性小幅回升 广州单月供应规模环比翻番
财联社,2025-12-01 17:03:20.000,金盘科技：已完10kV/2.4MW固态变压器样机研发
财联社,2025-12-01 17:02:03.000,法国总统希望将“手机禁令”扩大到高中
财联社,2025-12-01 17:01:00.000,美凯龙：杭州灏月9月10日～11月18日合计减持5567.33万股
财联社,2025-12-01 17:00:35.000,兰剑智能：AMR等机器人已应用于比亚迪、宁德时代项目
财联社,2025-12-01 16:59:29.000,空客：中国民航机队所涉A320系列飞机已采取预防性措施 航班运行平稳正常
财联社,2025-12-01 16:58:34.000,蓝思科技：公司独立董事谢志明因病逝世
财联社,2025-12-01 16:57:17.000,远东股份：11月子公司中标/签约千万元以上合同订单合计23.83亿元
财联社,2025-12-01 16:56:25.000,华润双鹤：控股子公司盐酸吡格列酮分散片通过仿制药一致性评价
财联社,2025-12-01 16:55:55.000,三星医疗：子公司签订印尼电表年度招标项目合同 合同金额约1.6亿元人民币
财联社,2025-12-01 16:55:34.000,谷歌CEO警告：美国AI监管混乱 恐在全球竞争中落后
财联社,2025-12-01 16:06:16.000,交大思诺：公司董事长李伟解除留置
财联社,2025-12-01 16:02:46.000,瑞银：西方国家政府可能盯上个人财富 以填补巨大公共债务窟窿
财联社,2025-12-01 16:01:30.000,欧洲主要股指集体低开
财联社,2025-12-01 16:01:06.000,雀巢中国回应婴儿营养品业务与惠氏合并：不影响现有业务开展
财联社,2025-12-01 16:01:03.000,今年10月中国企业信用指数为161.56 信用水平基本平稳
财联社,2025-12-01 15:59:52.000,长华集团：获国内车企项目定点 预计销售总额约7.32亿元
财联社,2025-12-01 15:57:44.000,外交部：祝贺吉尔吉斯斯坦提前议会选举顺利举行
财联社,2025-12-01 15:53:09.000,立中集团：与伟景智能签署人形机器人零部件委托加工技术协议
财联社,2025-12-01 15:53:07.000,新加坡将禁止中学生在校内使用智能手机或手表
财联社,2025-12-01 15:49:48.000,12月1日连板股分析：连板股晋级率近八成 端侧AI全线爆发
财联社,2025-12-01 15:47:44.000,法国总统马克龙将访华 外交部介绍情况
财联社,2025-12-01 15:44:20.000,交通运输部副部长付绪银会见挪威渔业与海洋政策大臣
财联社,2025-12-01 15:44:11.000,上海发布引进人才、持居住证人员申办常住户口办法
财联社,2025-12-01 15:40:07.000,日方对自身在台湾问题上的立场一再含糊其辞 外交部：某些人从未真正汲取历史教训
财联社,2025-12-01 15:40:02.000,马斯克预言：AI将在三年内终结美国“债务危机”
财联社,2025-12-01 15:38:17.000,工业富联：截至11月30日累计回购股份931.99万股 使用资金总额2.47亿元
财联社,2025-12-01 15:37:50.000,交易所债券市场收盘 万科债普遍继续下滑
财联社,2025-12-01 15:06:57.000,市场监管总局正式受理婴配液态乳产品配方注册申请
财联社,2025-12-01 15:03:29.000,收评：沪指涨0.65%重返3900点 两市成交额放量近2900亿
财联社,2025-12-01 15:01:29.000,法国总统马克龙将访华
财联社,2025-12-01 15:00:56.000,国内商品期货收盘 沪银涨近6%再创收盘新高
财联社,2025-12-01 14:59:26.000,亚马逊和谷歌联手打通高速云链路
财联社,2025-12-01 14:58:01.000,航行警告！渤海海峡有军事活动
财联社,2025-12-01 14:56:02.000,深交所：“21万科02”盘中临时停牌
财联社,2025-12-01 14:54:32.000,全球百强军火商去年收入创纪录 其中39家总部位于美国
财联社,2025-12-01 14:51:23.000,【盘中宝】火山引擎FORCE原动力大会本月召开，机构称字节已形成模型、平台、应用、硬件全AI产业链布局，这家企业与火山引擎持续合作，拥有AI玩具细分领域方案
财联社,2025-12-01 14:42:54.000,机构：NAND Flash wafer供给紧缩加剧 11月部分产品合约价涨幅逾60%
财联社,2025-12-01 14:42:05.000,北京：创新“一网通办”数智应用场景 全面优化高频服务系统
财联社,2025-12-01 14:39:19.000,北京：拟加强“人工智能+政务服务”统筹建设 强化政务领域大模型顶层设计
财联社,2025-12-01 14:33:36.000,美防长被爆在一次打击“贩毒船”行动中下令“杀光所有人” 特朗普回应
财联社,2025-12-01 14:31:26.000,日韩股市双双收跌 日经225指数跌近2%
财联社,2025-12-01 14:31:19.000,阶跃星辰开源GUI Agent技术和4B GUI Agent模型
财联社,2025-12-01 14:08:09.000,俄安全部门称挫败一起针对俄高级军官袭击事件
财联社,2025-12-01 14:04:56.000,累库持续 光伏电池价格持续回落
财联社,2025-12-01 14:03:06.000,【盘中宝】AI基础设施最重要的物料之一，这类芯片供不应求，价格正在飞速提升，这家公司已量产多款相关产品
财联社,2025-12-01 14:00:27.000,今年我国快递业务量首次突破1800亿件 创历史新高
财联社,2025-12-01 13:56:24.000,沪深两市成交额突破1.5万亿 较上一日此时放量超2700亿
财联社,2025-12-01 13:55:48.000,腾讯旗下财付通小贷增资至150亿 增幅42.5%
财联社,2025-12-01 13:53:52.000,布伦特原油期货涨幅扩大至2%
财联社,2025-12-01 13:45:25.000,白银价格创历史新高 今年涨幅已超90%
财联社,2025-12-01 13:37:39.000,光刻胶概念午后异动 容大感光涨超10%
财联社,2025-12-01 13:29:44.000,港股TATA健康复牌大涨超700%
财联社,2025-12-01 13:21:06.000,抗流感概念反复活跃 海王生物触及涨停
财联社,2025-12-01 13:16:58.000,【风口研报·公司】签订重磅战略合作协议拓展机器人关节模组，这家公司凭借万向节技术积累，切入具身智能核心零部件，同时储能固态电池产线计划2026年年初投产
财联社,2025-12-01 13:12:39.000,航运板块震荡走强 招商轮船涨停创18年新高
财联社,2025-12-01 13:10:52.000,工信部：鼓励中国光伏、风电、锂电池、新能源汽车等优势企业“走出去”
财联社,2025-12-01 13:10:15.000,东航C919今日起执飞上海至兰州定期航线 此为该机型首次执飞高原航线
财联社,2025-12-01 13:09:19.000,塔吉克斯坦与阿富汗边境发生武装袭击致中国公民伤亡 中使馆再发提醒
财联社,2025-12-01 13:05:30.000,存储芯片概念午后拉升 北京君正涨超10%
财联社,2025-12-01 13:04:29.000,首飞高原机场！东航C919国产大飞机今日起执行上海至兰州定期航线
财联社,2025-12-01 12:59:56.000,中国驻塔大使馆：要求塔方采取必要措施确保中国企业及公民安全
财联社,2025-12-01 12:55:49.000,湖南广电与张家界市达成战略合作 大庸古城预计在2026年7月开园
财联社,2025-12-01 12:54:58.000,中东部气温将大面积创新低 降温过后升温迅速
财联社,2025-12-01 12:53:40.000,武契奇回应美国对塞尔维亚石油工业公司采取措施：我不理解
财联社,2025-12-01 12:50:23.000,福建泉州洛江实施购房补贴 购房限期内最高7万元/套
财联社,2025-12-01 12:45:18.000,“冒充总统索要钱财” 韩总统府发声：将依法严肃惩处
财联社,2025-12-01 12:41:56.000,美两党议员警告：美防长可能犯下战争罪
财联社,2025-12-01 12:41:51.000,【机构调研】这家公司打造端侧AI全链路音频方案，全系智能产品接入豆包VLM多模态AI大模型
财联社,2025-12-01 12:28:16.000,澳大利亚国防部启动50年来最大规模重组
财联社,2025-12-01 12:23:10.000,特朗普：暂停接收难民措施或将维持“很长时间”
财联社,2025-12-01 12:12:35.000,林清轩回应招股书失效：上市正在流程中 已获证监会备案通知书
财联社,2025-12-01 12:08:46.000,财联社12月1日午间新闻精选
财联社,2025-12-01 12:01:30.000,安妮股份：公司筹划控制权变更事项 股票停牌
财联社,2025-12-01 12:00:21.000,港股午评：恒生指数涨0.81% 恒生科技指数涨0.99%
财联社,2025-12-01 11:51:03.000,12月1日午间涨停分析
财联社,2025-12-01 11:48:41.000,蚂蚁集团旗下云抒企业管理公司增资至39.4亿 增幅约9%
财联社,2025-12-01 11:46:06.000,中国疾控中心研究员彭质斌：当前仍建议还未接种流感疫苗的适宜人群尽快接种
财联社,2025-12-01 11:45:13.000,【电报解读】中兴通讯封涨停成交量超130亿，搭载豆包的努比亚M153少量发售，快速整理豆包手机相关上市公司（附表）
财联社,2025-12-01 11:42:29.000,中国疾病预防控制中心：当前我国已进入呼吸道传染病高发季节 疫情总体呈上升趋势
财联社,2025-12-01 11:37:06.000,苏州市重大产业发展私募投资基金成立
财联社,2025-12-01 11:33:31.000,深圳地铁集团法定代表人变更 黄力平接替辛杰
财联社,2025-12-01 11:31:30.000,午评：深成指、创业板指均涨近1%  消费电子板块爆发
财联社,2025-12-01 11:30:33.000,瑞银证券：2026年全部A股盈利增速有望升至8%
财联社,2025-12-01 11:25:13.000,深成指涨逾1% AI端侧领涨市场
财联社,2025-12-01 11:15:53.000,我国首次出口泰国的整套铁路大型养路施工车组在昆明下线验收
财联社,2025-12-01 11:15:07.000,我国推动ISO立项首个工业废水毒性削减国际标准
财联社,2025-12-01 11:04:50.000,商务部：鄢东副部长会见韩国驻华大使卢载宪
财联社,2025-12-01 11:03:33.000,机构：11月深圳一二手房网签总量7116套 环比涨3.9%、同比降57.3%
财联社,2025-12-01 11:00:30.000,FF：在必要融资到位等条件下 未来五年产销目标40万-50万台
财联社,2025-12-01 10:59:39.000,中兴通讯封涨停 成交金额超131亿元
财联社,2025-12-01 10:57:17.000,主力资金监控：中兴通讯净买入超23亿
财联社,2025-12-01 10:52:53.000,广州：11月二手住宅网签套数突破9000宗 环比增长逾20%
财联社,2025-12-01 10:52:19.000,工信部：1-10月份规模以上互联网企业实现利润总额1237亿元 同比下降10.9%
财联社,2025-12-01 10:50:41.000,【风口研报·公司】这家公司为国内领先的体育运营赛事IP运营商，受益政策支持+高尔夫赛事运营成第二成长曲线，赛事影响力提升及商业化落地有望带来可观收益
财联社,2025-12-01 10:49:50.000,上海闵行金融投资发展公司增资至50亿 增幅400%
财联社,2025-12-01 10:46:51.000,北京已进入流感高峰期 流行株为甲型H3N2
财联社,2025-12-01 10:46:43.000,中国聚变能源公司：与同方股份探讨“人工智能赋能聚变研发”等议题
财联社,2025-12-01 10:44:50.000,沪深两市成交额突破1万亿 较上一日此时放量超2100亿
财联社,2025-12-01 10:44:33.000,内存芯片价格快速上涨 业内预计手机产品将迎涨价潮
财联社,2025-12-01 10:30:36.000,【盘中宝】这类战略性关键金属下游需求多点开花，行业供需格局改善或支撑价格高位运行，这家公司相关资源储量和生产能力均居行业前列
财联社,2025-12-01 10:30:08.000,上海智算领航私募基金登记成立 出资额50.4亿
财联社,2025-12-01 10:24:23.000,银行板块震荡走强 张家港行涨超5%
财联社,2025-12-01 10:19:47.000,消费电子板块持续拉升 贝隆精密等多股涨停
财联社,2025-12-01 10:18:29.000,豆包手机助手发布技术预览版 可在工程样机nubia M153上体验
财联社,2025-12-01 10:15:41.000,11月百城新建住宅均价为17036元/平方米 环比上涨0.37%同比上涨2.68%
财联社,2025-12-01 10:14:04.000,辽宁“十五五”规划建议：举全省之力发展人工智能核心产业 加快工业软件创新突破
财联社,2025-12-01 10:13:37.000,万科被冻结5.7亿股权
财联社,2025-12-01 10:12:35.000,中信银行成立金融资产投资公司 注册资本100亿
财联社,2025-12-01 10:07:26.000,上海：培育一批以专业化为基础、通过创新运营和操作模式扩展服务项目的新型国际货代企业
财联社,2025-12-01 10:02:23.000,【异动解析】华为AI玩具开售即秒罄，该类产品有望深度受益AI玩具渗透率增长，这家公司在桌面机器人、AI陪伴领域产品率先落地
财联社,2025-12-01 09:56:29.000,金属铜概念表现活跃 江西铜业涨停
财联社,2025-12-01 09:52:12.000,沪深两市成交额突破5000亿 预计全天成交超2万亿
财联社,2025-12-01 09:35:35.000,公安部等十部门联合印发《关于加强生态警务机制建设的意见》
财联社,2025-12-01 09:34:58.000,港股影视股走强 猫眼娱乐涨超4%
财联社,2025-12-01 09:34:54.000,深交所：“22万科02”盘中临时停牌
财联社,2025-12-01 09:34:05.000,贵金属概念盘初拉升 白银有色涨停
财联社,2025-12-01 09:33:46.000,商业航天概念快速走强 航天发展、通宇通讯等多股涨停
财联社,2025-12-01 09:30:30.000,赛力斯涨超4% 获调入港股通
财联社,2025-12-01 09:30:19.000,影视板块大幅高开 中国电影一字涨停
财联社,2025-12-01 09:28:30.000,竞价看龙头
财联社,2025-12-01 09:28:16.000,三大指数集体高开
财联社,2025-12-01 09:22:15.000,金饰克价涨到1336元 有品牌金饰价六连涨
财联社,2025-12-01 09:21:05.000,央行公开市场今日净回笼2311亿元
财联社,2025-12-01 09:18:30.000,辽宁“十五五”规划建议：积极拓展低空+作业、低空+治理、低空+物流、低空+旅游等产业应用场景
财联社,2025-12-01 09:14:49.000,哈马斯官员称以军阻碍停火协议执行
财联社,2025-12-01 09:13:31.000,工信部：1—10月规模以上电子信息制造业增加值同比增长10.6%
财联社,2025-12-01 09:12:58.000,辽宁“十五五”规划建议：面向未来制造等发展方向 重点培育具身智能、第六代移动通信等未来产业
财联社,2025-12-01 09:12:30.000,【盘中宝】AI浪潮下该行业渗透率有望快速提升，机构称相关产业链目前处在0-1阶段，未来市场规模或超1000亿，这家企业已切入头部企业供应链，开展相关关键环节业务
财联社,2025-12-01 09:09:44.000,预告
同花顺,2025-12-01 09:08:38.000,香港火灾遇难人数升至151人
同花顺,2025-12-01 09:07:32.000,新版中俄双边投资协定于12月1日正式生效
同花顺,2025-12-01 09:04:53.000,花旗集团对中国平安的多头持仓比例降至6.07%
同花顺,2025-12-01 09:04:43.000,摩根大通（JPMorgan）对小鹏汽车-W的多头持仓比例增至5.33%
同花顺,2025-12-01 09:04:30.000,摩根大通（JPMorgan）对宁德时代的多头持仓比例增至8.09%
同花顺,2025-12-01 09:03:18.000,星云股份：股东江美珠近期累计减持0.50%
同花顺,2025-12-01 09:01:18.000,美股中概股盘前涨跌互现，小马智行涨3%
同花顺,2025-12-01 09:01:08.000,美股大型科技股盘前普跌，Meta跌1%
同花顺,2025-12-01 08:59:52.000,北京人工智能产投基金等入股人形机器人公司星动纪元
同花顺,2025-12-01 08:58:46.000,连城数控：股东兆恒拟减持不超过2%股份
同花顺,2025-12-01 08:57:36.000,蓝思科技：独立董事谢志明逝世
同花顺,2025-12-01 08:54:52.000,远东股份：子公司中标23.83亿元合同订单
同花顺,2025-12-01 08:54:35.000,三星医疗：奥克斯智能科技预中标1.24亿元项目
同花顺,2025-12-01 08:54:14.000,三星医疗：子公司签订1.6亿元人民币海外合同
同花顺,2025-12-01 08:52:34.000,华润双鹤：控股子公司双鹤天安药业盐酸吡格列酮分散片获得药品补充申请批准通知书
同花顺,2025-12-01 08:48:44.000,英国拟对国际留学生征收6%附加费
同花顺,2025-12-01 08:48:39.000,宁波富达：控股子公司拟公开挂牌出售河口瀛洲水泥有限公司100%股权
同花顺,2025-12-01 08:48:18.000,山子高科：收到甘肃证监局警示函
同花顺,2025-12-01 08:46:06.000,普洛药业：全资子公司获阿莫西林克拉维酸钾片药品注册证书
同花顺,2025-12-01 08:46:02.000,蓝思科技独供豆包手机关键精密结构件等，已获上亿订单
财联社,2025-12-01 08:17:24.000,中信证券：科技巨头争相布局 太空算力逐渐成为共识
财联社,2025-12-01 08:12:39.000,日经225指数向下跌破50000点
财联社,2025-12-01 08:11:10.000,美威胁“关闭委领空” 委内瑞拉向国际民航组织提出申诉
财联社,2025-12-01 08:10:57.000,中信证券：国产算力建设提速 超节点驱动网络侧高速成长
财联社,2025-12-01 08:10:42.000,【九点特供】长七A火箭成功发射实践二十八号卫星，首次使用了通用化地面测发控系统和新活动发射平台，该公司开发了“天箭”、“天星”商业航天综合电子系统产品以及地面配套设备；华为首款AI情绪陪伴玩具售罄缺货
财联社,2025-12-01 08:09:59.000,中信证券：AI光互联大有可为 头部厂商优势显著
财联社,2025-12-01 08:07:40.000,中金：当前时点AI板块拥挤风险相对较低 长期依旧存在机会
同花顺,2025-12-01 08:06:50.000,中文传媒：副总经理陈佳羚因工作调整辞职
同花顺,2025-12-01 08:06:30.000,友发集团：终止向特定对象发行A股股票事项
同花顺,2025-12-01 08:05:33.000,交大思诺：董事长李伟解除留置
财联社,2025-12-01 08:02:19.000,日本福岛县附近海域发生4.2级地震
财联社,2025-12-01 08:01:26.000,日经225指数开盘涨0.09%
同花顺,2025-12-01 07:59:37.000,长华集团：公司收到客户项目定点通知书，预计生命周期总销售额约7.32亿元
财联社,2025-12-01 07:59:28.000,投资日历：周一资本市场大事提醒
同花顺,2025-12-01 07:58:24.000,国家能源集团浙江安吉梅溪2×9H级燃机新建工程1号机组正式并网发电
同花顺,2025-12-01 07:56:40.000,震安科技成立现代电子科技公司，含AI业务
同花顺,2025-12-01 07:53:36.000,顺丰控股10亿元成立顺英控股公司
同花顺,2025-12-01 07:51:10.000,福安药业：子公司庆余堂获头孢托仑匹酯颗粒药品注册证书
同花顺,2025-12-01 07:50:51.000,立中集团：签署《人形机器人零部件委托加工技术协议》
同花顺,2025-12-01 07:48:06.000,本钢板材：预计触发本钢转债转股价格向下修正条件
同花顺,2025-12-01 07:45:03.000,重庆港：拟投资2.99亿元建设江津港现代化多式联运集疏运能力提升项目（二期改扩建工程）
财联社,2025-12-01 07:45:01.000,【点金互动易】锂电材料+EVA，锂电碳酸酯溶剂全产全销，受益于近期EC等溶剂供需偏紧，产品价格快速上涨，这家公司稳居EVA高端阵营
财联社,2025-12-01 07:44:56.000,殷勇会见越南农业与环境部部长
财联社,2025-12-01 07:44:18.000,日本一钢铁厂发生爆炸并引发火灾 大火仍未扑灭
同花顺,2025-12-01 07:44:03.000,华策影视发表声明 公开谴责短剧跟风拍摄
同花顺,2025-12-01 07:41:08.000,外交部：中方观察团给予吉尔吉斯斯坦提前举行议会选举高度评价
同花顺,2025-12-01 07:40:42.000,汉马科技：11月货车产量1947辆、销量2002辆，同比大增
财新网,2025-12-01 07:14:05.067,泰国机动车10月不太好卖
同花顺,2025-12-01 07:08:44.000,现代汽车11月全球销量同比下降2.4%
同花顺,2025-12-01 07:06:40.000,腾讯旗下财付通小贷公司增资至150亿元
同花顺,2025-12-01 07:03:46.000,上汽集团成立科技公司，含汽车零部件及配件制造业务
同花顺,2025-12-01 07:03:21.000,斯里兰卡极端天气灾害致355人死亡
同花顺,2025-12-01 07:00:55.000,ETF收评：黄金股票ETF基金领涨4.09%，豆粕ETF领跌2.52%
同花顺,2025-12-01 07:00:51.000,ETF两市成交额4289.65亿元
同花顺,2025-12-01 07:00:48.000,A股收评：沪指放量涨0.65%收复3900点，有色金属、AI端侧方向多点爆发
财新网,2025-12-01 06:58:48.087,AI眼镜赛道又添一“重量级”玩家
同花顺,2025-12-01 06:56:55.000,重药控股与华益科技签署战略合作协议
同花顺,2025-12-01 06:54:06.000,“21万科02”盘中临时停牌
同花顺,2025-12-01 06:51:01.000,集邦咨询：NAND Flash wafer供给紧缩加剧 11月部分产品合约价涨幅逾60%
同花顺,2025-12-01 06:50:51.000,市场监管总局：婴幼儿配方液态乳产品配方的注册管理按婴幼儿配方乳粉产品配方规定执行
同花顺,2025-12-01 06:48:44.000,沪深300股指期货(IF)主力合约日内涨超1%
同花顺,2025-12-01 06:47:28.000,民生加银基金人士：消费需求或复苏 年末看好三大板块
同花顺,2025-12-01 06:45:52.000,阳光电源成交额达100亿元
同花顺,2025-12-01 06:41:24.000,长亮科技中标厦门国际银行新一代分布式核心业务系统项目
同花顺,2025-12-01 06:40:11.000,北京：推进政务服务全流程智能化 分批建设专业领域政务咨询智能体
同花顺,2025-12-01 06:38:38.000,三友科技等成立硅基启灵科技公司，含AI及机器人业务
财新网,2025-12-01 06:27:26.105,期货人的“黑色星期五”
财新网,2025-12-01 06:27:26.105,“黑色星期五”席卷美国交易场
同花顺,2025-12-01 06:00:56.000,涉及个人信息处理等国家标准今起实施
同花顺,2025-12-01 06:00:33.000,阳光乳业连拉两板，公司回应新业务暂无时间表
同花顺,2025-12-01 05:59:55.000,历史新高！今年我国快递业务量首次突破1800亿件
同花顺,2025-12-01 05:54:39.000,印度电信部要求苹果等智能手机制造商预装政府推出的网络安全应用程序
同花顺,2025-12-01 05:54:26.000,ChatGPT发布三周年，美购物网站“黑色星期五”AI流量飙升805%
同花顺,2025-12-01 05:53:52.000,ETF两市成交额超3500亿元
同花顺,2025-12-01 05:53:40.000,沪深京三市成交额超1.5万亿元，较上日此时放量2723亿元
同花顺,2025-12-01 05:49:18.000,佛塑科技等成立新材料公司 注册资本7500万
同花顺,2025-12-01 05:46:43.000,我使馆提醒中方人员紧急撤离塔吉克斯坦和阿富汗边境地区
同花顺,2025-12-01 05:42:21.000,白银价格创历史新高，今年涨幅已超90%
同花顺,2025-12-01 05:38:06.000,光刻胶概念股异动拉升，容大感光涨超10%
同花顺,2025-12-01 05:37:06.000,湖南广电与张家界市达成战略合作，大庸古城预计在2026年7月开园
同花顺,2025-12-01 05:36:01.000,20年期日本国债收益率上涨5.5个基点，至2.88%，为1999年6月以来的最高水平
同花顺,2025-12-01 05:32:51.000,日本央行行长植田和男：希望在将利率提高至0.75%后，再进一步阐述未来加息路径
同花顺,2025-12-01 05:31:54.000,港股TATA健康时隔逾1年半复牌大涨，一度涨超700%
同花顺,2025-12-01 05:24:46.000,拉美民间智库谴责美方“全面关闭”委内瑞拉空域言论
同花顺,2025-12-01 05:18:26.000,流感板块午后拉升，海王生物触及涨停
同花顺,2025-12-01 05:13:41.000,港口航运板块午后走高，招商轮船涨停
同花顺,2025-12-01 05:11:27.000,南向资金净买入超20亿港元
同花顺,2025-12-01 05:11:21.000,免税店板块午后震荡上扬，中国中免涨超8%
同花顺,2025-12-01 05:06:18.000,日经225指数日内跌幅达2%
同花顺,2025-12-01 05:04:06.000,存储芯片板块午后拉升，北京君正涨超13%
同花顺,2025-12-01 05:02:26.000,国产C919飞机首飞高原机场定期航线
同花顺,2025-12-01 04:47:14.000,前10个月我国规上电子信息制造业增加值同比增长10.6%
同花顺,2025-12-01 04:47:06.000,澳门11月幸运博彩毛收入同比增长14.4%，预估为增长10.5%
同花顺,2025-12-01 04:39:52.000,摩根大通将马士基目标价从8800丹麦克朗下调至8000丹麦克朗
同花顺,2025-12-01 04:38:38.000,山子高科在浙江新设机器人科技公司，含多项AI业务
同花顺,2025-12-01 04:30:07.000,中信银行新设金融资产投资公司
同花顺,2025-12-01 04:27:30.000,宇树科技成功注册GAMEBOT商标
同花顺,2025-12-01 04:27:21.000,日本10年期国债收益率上涨5.5个基点
同花顺,2025-12-01 04:25:27.000,2025年11月鸿蒙智行全系交付新车81864台，同比增长89.61%，创单月交付历史新高
同花顺,2025-12-01 04:23:55.000,福德士河与比亚迪携手打造250MWh储能系统
同花顺,2025-12-01 04:23:35.000,软银：将扩大机器人可以执行的任务范围
同花顺,2025-12-01 04:21:31.000,"特朗普：暂停接收难民措施或将维持“很长时间"""
同花顺,2025-12-01 04:20:41.000,12月1日午间公告一览：安妮股份自2025年12月1日起停牌
同花顺,2025-12-01 04:20:14.000,速腾聚创诉灵明光子侵害技术秘密，激光雷达SPAD芯片成焦点
同花顺,2025-12-01 04:15:33.000,赣州和美药业股份有限公司 - B向港交所提交上市申请书
同花顺,2025-12-01 04:15:16.000,林清轩回应招股书失效：上市正在流程中，已获证监会备案通知书
同花顺,2025-12-01 04:12:49.000,泰铢持稳 泰国股市上涨
同花顺,2025-12-01 04:07:39.000,英国成立新左翼政党
同花顺,2025-12-01 04:01:29.000,港股午评：恒生指数涨0.81%，恒生科技指数涨0.99%
同花顺,2025-12-01 04:00:45.000,世界田联主席：中国田径体系将促进世界田径发展
同花顺,2025-12-01 03:52:15.000,北京已进入流感高峰期 多措并举保障患儿就医需求
同花顺,2025-12-01 03:44:37.000,上海检察机关推出12条举措保障国际航运中心建设，已成立四个服务站
