来源,时间,标题
财联社,2025-12-02 21:56:57.000,截至10月底 中国市场监管部门已为逾4000万户经营主体修复信用
财联社,2025-12-02 21:55:20.000,富瀚微：已发布AI眼镜芯片 目前正与数家AI眼镜客户合作开发中
财联社,2025-12-02 21:52:28.000,【风口研报·洞察】AEC龙头Credo盘前大涨18%，第二财季业绩同比增长272.1%超预期，分析师认为公司业绩放量表明AI互连需求正处于快速上升期，对产业链具有明确的映射意义；年底的港股红利行情
财联社,2025-12-02 21:49:44.000,财联社12月2日晚间新闻精选
财联社,2025-12-02 21:43:52.000,普利特：LCP改性产品已经批量应用于多款手机连接器等精密零部件中
财联社,2025-12-02 21:43:02.000,江苏神通：津西重工计划1亿元-1.55亿元继续增持公司股份
财联社,2025-12-02 21:42:14.000,容大感光：RGB光刻胶已少量销售 正推进客户验证
财联社,2025-12-02 21:41:50.000,伯特利：机器人丝杠和电机子公司预计明年中旬实现量产
财联社,2025-12-02 21:36:53.000,爱尔兰宣布将向乌克兰提供1.25亿欧元援助
财联社,2025-12-02 21:33:07.000,中越二维码互联互通项目在越南投入应用
财联社,2025-12-02 21:32:16.000,辰安科技：实控人拟变更为合肥市国资委 股票复牌
财联社,2025-12-02 21:26:51.000,美股盘前要闻一览
财联社,2025-12-02 21:16:52.000,摩根大通美债客户调查显示净多头占比创一个月新低
财联社,2025-12-02 21:16:14.000,IBM CEO：以现有成本建设AI数据中心“几乎不可能回本”
财联社,2025-12-02 21:15:52.000,合富中国：全资子公司拟向关联方销售一台磁振造影即時导航放射治疗系统
财联社,2025-12-02 21:15:43.000,合富中国：控股股东拟减持不超2%股份
财联社,2025-12-02 21:13:27.000,英国央行对依托债务的AI热潮提出警告 并称部分企业CDS表现令人警觉
财联社,2025-12-02 21:13:08.000,杭汽轮Ｂ：深交所正式受理公司股票主动终止上市的申请
财联社,2025-12-02 21:11:10.000,君亭酒店：实际控制人拟变更为湖北省国资委 股票复牌
财联社,2025-12-02 21:09:23.000,【财联社早知道】刚刚！五部门发文加强数据要素建设，机构称数据要素产业进入密集催化期，这家公司为政企客户提供数据治理到资产运营再到智能应用的一站式服务；这家公司已在AI漫剧制作中使用谷歌模型
财联社,2025-12-02 21:02:17.000,2连板国风新材：PSPI光刻胶产品仍处研发阶段
财联社,2025-12-02 21:02:04.000,13天9板航天发展：公司目前不涉及AI国防系统
财联社,2025-12-02 21:01:37.000,深圳华强：向中兴通讯供应电子元器件及多类电子产品
财联社,2025-12-02 20:53:49.000,龙蟠科技：与Sunwoda签署磷酸铁锂正极材料长期采购协议 预计销售金额约45-55亿元
财联社,2025-12-02 20:06:04.000,中鼎股份：拟发行可转债募资不超过25亿元 用于智能机器人等项目
财联社,2025-12-02 20:05:17.000,深南电路：第三季度存储类封装基板增长最为显著
财联社,2025-12-02 20:01:53.000,祥源文旅：全资子公司拟3.45亿元收购金秀莲花山景区开发公司100%股权
财联社,2025-12-02 20:01:29.000,亚马逊年度云计算大会开幕 CEO发布重磅演讲
财联社,2025-12-02 19:59:53.000,新疆和田地区和康县发生3.6级地震 震源深度93千米
财联社,2025-12-02 19:57:12.000,【电报解读】大摩将谷歌2027年TPU产量预测从约300万块上调至500万块，机构测算其OCS定制化网络将使资本开支大幅减少30%，相关核心部件供应商有望受益，这家公司开发了OCS全光交换机元组件
财联社,2025-12-02 19:56:39.000,大摩：人形机器人芯片市场规模将加速扩张
财联社,2025-12-02 19:55:10.000,研究报告：亚太数据中心规模正爆发式增长 未来五年年增22%
财联社,2025-12-02 19:52:43.000,智谱CEO张鹏：公司2025年营收预计实现100%以上增长
财联社,2025-12-02 19:51:08.000,华纳收购战升级 奈飞据悉提出以现金为主的收购方案
财联社,2025-12-02 19:50:06.000,华阳集团：今年以来光通讯模块零部件相关订单金额大幅增长
财联社,2025-12-02 19:46:12.000,武契奇：美方尚未发放豁免许可 塞尔维亚关键炼油厂停产
财联社,2025-12-02 19:45:16.000,国家发展改革委印发第二轮国家生态产品价值实现机制试点名单
财联社,2025-12-02 19:44:36.000,爱克股份：拟22亿元购买东莞硅翔100%股权且明日复牌 后者积极拓展液冷产品线并已于2024年实现收入
财联社,2025-12-02 19:43:29.000,卡塔尔外交部：正努力推动加沙停火第二阶段谈判
财联社,2025-12-02 19:42:39.000,博亚精工：询价转让价格为21.00元/股
财联社,2025-12-02 19:38:34.000,阿石创：拟定增募资不超9亿元 用于超高纯半导体靶材项目、半导体材料研发项目等
财联社,2025-12-02 19:05:10.000,天孚通信：董事及高管拟合计减持不超0.0611%股份
财联社,2025-12-02 19:02:13.000,西藏那曲市比如县附近发生4.8级左右地震
财联社,2025-12-02 19:01:46.000,西安奕材：拟投建武汉硅材料基地项目 项目总投资约125亿元
财联社,2025-12-02 19:01:03.000,【机构龙虎榜解读】端侧AI+AI玩具+AI眼镜+机器人，推出基于高通高算力芯片的端侧AI解决方案及具身智能机器人开发平台Fibot，并与行业头部AR眼镜企业XREAL达成战略合作，这家公司获净买入
财联社,2025-12-02 18:59:30.000,年薪涨至435万元仍不满意 艾比森董事长丁彦辉对董事长选举议案投反对票
财联社,2025-12-02 18:59:26.000,寒潮+大风双预警 江苏安徽浙江等地降温将超10℃
财联社,2025-12-02 18:56:25.000,乌军否认俄控制红军城
财联社,2025-12-02 18:53:19.000,澜起科技：截至11月30日已累计回购公司A股股份150.5万股 支付金额约2.02亿元
财联社,2025-12-02 18:52:19.000,大摩将谷歌2027年TPU产量预测从约300万块上调至500万块
财联社,2025-12-02 18:50:19.000,年末存储厂商延续惜售策略 本周存储成品整体维持涨价势头
财联社,2025-12-02 18:49:50.000,日本加息前景搅动美国市场
财联社,2025-12-02 18:45:10.000,人福医药：子公司撤回重组质粒-肝细胞生长因子注射液药品注册申请
财联社,2025-12-02 18:41:58.000,*ST正平：停牌核查工作已完成 股票明起复牌
财联社,2025-12-02 18:37:30.000,捷佳伟创：半导体清洗设备、碳化硅高温热处理工艺设备都已出货给客户
财联社,2025-12-02 18:34:38.000,派能科技：股东融科创投拟减持不超3%股份
财联社,2025-12-02 18:33:23.000,珍宝岛：全资子公司获得盐酸莫西沙星片药品注册证书
财联社,2025-12-02 18:06:49.000,经合组织维持今明两年全球经济增速预期
财联社,2025-12-02 18:05:25.000,经合组织：美关税对自身影响尤为明显
财联社,2025-12-02 18:03:27.000,微软CEO承诺加码欧盟AI投资
财联社,2025-12-02 18:00:02.000,*ST万方：股东双阳农商行拟减持不超3%股份
财联社,2025-12-02 17:58:47.000,长沙市低空产业发展公司成立
财联社,2025-12-02 17:57:29.000,中国电影：参与《得闲谨制》出品
财联社,2025-12-02 17:52:22.000,印尼洪灾和山体滑坡灾害已致702人死亡
财联社,2025-12-02 17:49:39.000,3连板顺灏股份：轨道辰光的主要业务是通过将算力卫星发射至晨昏轨道组建太空数据中心
财联社,2025-12-02 17:49:34.000,豪威集团：控股股东虞仁荣拟向宁波东方理工大学基金会捐赠2.48%公司股份
财联社,2025-12-02 17:48:31.000,联合国警告：AI可能加剧全球贫富差距
财联社,2025-12-02 17:47:45.000,重庆出台10条措施支持“好房子”建设 将推进智能建造升级
财联社,2025-12-02 17:45:28.000,起亚美国11月的总销量为72002辆 同比增长3%
财联社,2025-12-02 17:43:22.000,财政部拟第二次续发行2025年记账式附息（十九期）国债 招标面值总额960亿元
财联社,2025-12-02 17:06:42.000,【电报解读】发改委要求全链条推动重点领域关键核心技术攻关取得决定性突破，机构称政策监管、技术突破与生态协同正合力推动中国商业航天进入高质量发展拐点，这家公司已实现批量交付多种火箭箭体结构件
财联社,2025-12-02 17:06:31.000,香港大埔宏福苑火灾已造成156人遇难
财联社,2025-12-02 17:06:03.000,特变电工：应收账款2期资产支持专项计划成立
财联社,2025-12-02 17:05:52.000,北注协报告显示超七成受访上市公司管理层已将ESG纳入战略决策
财联社,2025-12-02 17:05:42.000,首部地方性冰雪产业法规出台 ：七台河鼓励“AI+冰雪”
财联社,2025-12-02 17:03:46.000,富信科技：股东拟询价转让公司总股本2.02%
财联社,2025-12-02 17:01:28.000,广西壮族自治区政协原常委韦均林接受审查调查
财联社,2025-12-02 16:58:22.000,英国首相承认脱欧重创英国经济
财联社,2025-12-02 16:57:41.000,果麦文化：投资影片《三国的星空》亏损约4000万元
财联社,2025-12-02 16:56:17.000,华康洁净：中标1.76亿元柯桥未来医学中心净化系统项目
财联社,2025-12-02 16:51:15.000,专家称巴西阿拉比卡咖啡收成可能逊于预期 因天气异常及品种偏好改变
财联社,2025-12-02 16:48:08.000,2025约旦中国电影节在安曼举行
财联社,2025-12-02 16:48:07.000,佳能回应中山打印机工厂停止经营
财联社,2025-12-02 16:46:30.000,国家能源局：10月全国新增建档立卡新能源发电项目共5358个
财联社,2025-12-02 16:45:30.000,恒瑞医药：注射用甲苯磺酸瑞马唑仑上市许可申请获受理
财联社,2025-12-02 16:44:34.000,法德：俄乌“和平计划” 欧洲必须“坐到谈判桌前”
财联社,2025-12-02 16:43:59.000,中汽协：10月汽车商品进出口总额为253.1亿美元 环比增长1.7%
财联社,2025-12-02 16:04:36.000,担心权益受损 美国民众反对兴建AI数据中心
财联社,2025-12-02 16:02:28.000,森马服饰：已推出疯狂动物城IP联名产品
财联社,2025-12-02 16:02:11.000,中国国航换帅完成工商变更 注册资本增至174.48亿
财联社,2025-12-02 16:01:29.000,江西：加快推进脑机接口技术在神经与精神类疾病诊疗、养老康复等领域的临床研究
财联社,2025-12-02 16:00:56.000,欧洲主要股指开盘多数上涨
财联社,2025-12-02 16:00:03.000,引力传媒：目前在业务开展过程中已应用谷歌Veo3及Nano Banana模型
财联社,2025-12-02 15:57:03.000,英国央行称七大贷款机构在最新压力测试中展现韧性
财联社,2025-12-02 15:56:46.000,卓易信息：子公司为中国大陆唯一获得英特尔授权的独立BIOS供应商
财联社,2025-12-02 15:55:20.000,天津育儿补贴方案发布
财联社,2025-12-02 15:54:33.000,岱美股份：子公司收到火灾事故部分保险赔偿款1470万美元
财联社,2025-12-02 15:53:50.000,三友医疗：与韩国细基生物签署战略合作和经销协议
财联社,2025-12-02 15:53:46.000,蒙古工矿部紧急部署能源资源领域重点工作 将持续发布勘探招标
财联社,2025-12-02 15:52:56.000,特朗普警告以色列勿干涉叙利亚
财联社,2025-12-02 15:52:07.000,11月A股新开户数238万户 今年已累计新开2484万户
财联社,2025-12-02 15:51:45.000,今日投资舆情热点
财联社,2025-12-02 15:51:45.000,珠海冠宇：有为中兴客户供应手机类电池
财联社,2025-12-02 15:50:50.000,航天电器：CPO光模块系列产品处于市场推广阶段 CPC相关产品在研制中
财联社,2025-12-02 15:49:03.000,尼日利亚国防部长辞职
财联社,2025-12-02 15:07:26.000,卓创资讯：屠宰量逐步恢复 11月份生猪屠宰毛利回暖
财联社,2025-12-02 15:05:43.000,蓝佛安出席中亚经济合作天山论坛开幕式并致辞
财联社,2025-12-02 15:02:21.000,收评：创业板指低开低走跌0.69% 福建板块逆势爆发
财联社,2025-12-02 15:02:03.000,美政府将入股芯片制造工艺初创公司xLight
财联社,2025-12-02 15:00:35.000,国内商品期货收盘 BR橡胶涨约4%
财联社,2025-12-02 14:51:27.000,墨西哥大毒枭之子相继获罪
财联社,2025-12-02 14:48:47.000,沪深两市成交额突破1.5万亿 较昨日此时缩量超2600亿
财联社,2025-12-02 14:43:08.000,中国药品价格登记系统正式上线 9家药企首批登记
财联社,2025-12-02 14:41:18.000,机构：三季度中国PC市场出货量同比增长2% 达到1130万台
财联社,2025-12-02 14:39:24.000,古特雷斯正式提交联合国削减预算和裁员方案
财联社,2025-12-02 14:38:53.000,12月组件排产预计大降 终端需求将回归冷淡时期
财联社,2025-12-02 14:38:02.000,俄罗斯将开始接受对人民币计价主权债的认购
财联社,2025-12-02 14:32:25.000,12月2日全国农产品批发市场猪肉平均价格为17.59元/公斤 比昨天下降1.2%
财联社,2025-12-02 14:32:16.000,尾盘算力硬件股再度异动 菲菱科思20cm涨停
财联社,2025-12-02 14:07:10.000,华伍股份：公司已将商业航天作为未来重点发展方向之一 正积极推进相关战略布局与业务洽谈
同花顺,2025-12-02 14:06:52.000,深圳市大族数控科技股份有限公司向港交所提交上市申请书
同花顺,2025-12-02 14:00:50.000,翔鹭钨业：国安基金拟减持不超过0.49%股份
财联社,2025-12-02 13:59:31.000,Burry据报道已做空特斯拉 “荒谬”的估值和马斯克的薪酬计划乃原因所在
同花顺,2025-12-02 13:59:15.000,戴尔科技盘前股价上涨1.9%，特朗普在社交媒体上称“我爱戴尔”
同花顺,2025-12-02 13:56:36.000,波音美股盘前涨超5%
财联社,2025-12-02 13:54:44.000,【盘中宝】供电保障体系的理想方案，AIDC建设有望提振该市场增长，这家公司相关细分领域已有产品技术布局
财联社,2025-12-02 13:51:17.000,2025脑机接口大会将于12月4日至5日在上海举行
同花顺,2025-12-02 13:37:56.000,日本周新增流感病例超过19万例
财联社,2025-12-02 13:37:50.000,深交所：“23万科01”盘中临时停牌
财联社,2025-12-02 13:34:55.000,南宁：新婚购房按每套2万元给予补贴 三孩购房补贴6万元
同花顺,2025-12-02 13:30:42.000,遥望科技：挂牌转让佛山星期六鞋业100%股权，首次挂牌转让底价不低于4.53亿元
财联社,2025-12-02 13:28:58.000,福建规划建设金门供水第二通道、马祖供水、泉金高速等一批重大项目
财联社,2025-12-02 13:28:11.000,消息称台积电董事长魏哲家将出席OIP论坛南京场
财联社,2025-12-02 13:27:38.000,福建本地股持续走高 东百集团等近十股涨停
财联社,2025-12-02 13:25:36.000,美连锁超市就“对等关税”起诉特朗普政府
同花顺,2025-12-02 13:17:53.000,ST聆达：重整计划出资人权益调整方案获法院裁定批准
同花顺,2025-12-02 13:15:03.000,广期所获批加入联合国可持续证券交易所倡议（UN SSE）
同花顺,2025-12-02 13:14:37.000,合富中国：控股股东合富香港拟减持不超过2%股份
财联社,2025-12-02 13:09:31.000,【风口研报·公司】公司围绕商业航天全产业链进行深度布局，覆盖制造、运营、测控、应用等多个环节，且联手中科曙光布局太空算力
财联社,2025-12-02 13:08:25.000,西班牙部署军队参与防控非洲猪瘟
同花顺,2025-12-02 13:07:54.000,*ST南置：已向上海泷临出售房地产开发、租赁业务相关资产及负债
同花顺,2025-12-02 13:06:11.000,大东北“串珠成链”！东北铁路首次推出15日旅游计次票
财联社,2025-12-02 13:03:46.000,创业板指跌逾1% 下跌个股近3900只
财联社,2025-12-02 13:01:54.000,食品板块异动 安记、惠发午后直线拉升涨停
同花顺,2025-12-02 13:00:40.000,伯灵顿百货美股盘前涨超15%
同花顺,2025-12-02 13:00:35.000,国内期货夜盘开盘主力合约涨跌不一
同花顺,2025-12-02 13:00:14.000,晶瑞电材：已有多款KrF光刻胶量产出货，ArF光刻胶已小批量出货
财联社,2025-12-02 12:59:13.000,日本游退潮 11月后两周韩国酒店预订热度同比增长超240%
同花顺,2025-12-02 12:55:12.000,倍通数智开曼控股有限公司向港交所提交上市申请书
同花顺,2025-12-02 12:54:07.000,甲骨文美股盘前涨超2%
财联社,2025-12-02 12:51:29.000,上海：2026年8月1日起 所有新建或更新的公共充（换）电设施均须采用通过充电桩产品强制性认证的产品
财联社,2025-12-02 12:49:52.000,【机构调研】这家公司打造宇航级产品生产线，为航天领域客户提供安全载荷、计算载荷等
同花顺,2025-12-02 12:48:24.000,华控赛格：山西国资委将受让山西建投52.44%股权
同花顺,2025-12-02 12:48:01.000,重庆建工：重庆高速集团拟无偿划转公司8.00%股份
同花顺,2025-12-02 12:46:22.000,传音控股：向香港联交所递交H股发行上市申请
财联社,2025-12-02 12:45:25.000,以代表团赴德交付“箭-3”导弹防御系统
同花顺,2025-12-02 12:44:24.000,北方稀土：获准注册发行15亿元中期票据和10亿元超短期融资券
财联社,2025-12-02 12:43:42.000,国际电信联盟宣布：2027年世界无线电通信大会将在中国上海举办
同花顺,2025-12-02 12:40:25.000,山科智能：湖北长芯半导体科技有限公司通过协议受让方式增持7%公司股份
同花顺,2025-12-02 12:40:10.000,福赛科技：金乐海拟减持不超过0.7503%公司股份
同花顺,2025-12-02 12:39:58.000,ST智云：慧达富能将成为公司的控股股东
财联社,2025-12-02 12:39:02.000,药明生物：与卡塔尔自由区管理局签署战略合作备忘录 将全球服务网络与专业业务能力拓展至中东地区
同花顺,2025-12-02 12:37:45.000,2025卫星互联网产业生态大会将于12月4日至5日在沪举办
财联社,2025-12-02 12:36:00.000,宁德时代：1000座换电站将于春节前正式运营
财联社,2025-12-02 12:29:01.000,支持台胞开设沙县小吃门店等 福建发布12条惠台政策措施
财联社,2025-12-02 12:21:08.000,中国驻英国使馆发言人就英国首相斯塔默外交政策演讲涉华内容答记者问
财联社,2025-12-02 12:17:20.000,白鸽在线港股IPO及境内未上市股份“全流通”获中国证监会备案
财联社,2025-12-02 12:15:06.000,集邦咨询：存储器价格飙升冲击游戏主机毛利 2026年出货量预估将下调至年减4.4%
财联社,2025-12-02 12:06:49.000,滨江集团13.61亿元底价斩获杭州一宅地
财联社,2025-12-02 12:06:29.000,财联社12月2日午间新闻精选
同花顺,2025-12-02 12:05:49.000,新疆和田地区和康县发生3.6级地震
同花顺,2025-12-02 12:04:31.000,中国央行：11月公开市场国债买卖净投放500亿元人民币
同花顺,2025-12-02 12:03:40.000,长虹美菱：累计回购股份比例达到1.0015%
同花顺,2025-12-02 12:03:30.000,中鼎股份：拟发行可转换公司债券总额不超过人民币25亿元
同花顺,2025-12-02 12:01:55.000,海安集团：董事黄振华因公司治理结构调整辞职
财联社,2025-12-02 12:01:14.000,山东海运与中船动力达成X82DF-E多燃料主机订单合作意向
同花顺,2025-12-02 12:00:20.000,12月2日 周二《新闻联播》要闻9条
财联社,2025-12-02 12:00:20.000,港股午评：恒生指数涨0.11% 恒生科技指数跌0.53%
同花顺,2025-12-02 11:58:58.000,市场监管总局启动修订《国家食品安全事故应急预案（征求意见稿）》，公开征求意见
财联社,2025-12-02 11:58:26.000,优必选科技与卓世科技达成战略合作 计划未来5年联合部署1万台机器人
财联社,2025-12-02 11:53:50.000,12月2日午间涨停分析
财联社,2025-12-02 11:51:10.000,全国医疗卫生机构总诊疗人次超101亿
同花顺,2025-12-02 11:51:00.000,3连板苏豪汇鸿：公司生产经营情况未发生重大变化
财联社,2025-12-02 11:47:28.000,国民技术港股IPO获中国证监会备案
财联社,2025-12-02 11:46:17.000,瑞银巩旻：预计2026年中国乘用车批发增速将从2025年11%放缓至3%
同花顺,2025-12-02 11:44:33.000,乘联分会初步数据：11月全国乘用车厂商新能源批发172万辆，同比增长20%
同花顺,2025-12-02 11:43:58.000,武契奇：美方尚未发放豁免许可，塞尔维亚关键炼油厂停产
同花顺,2025-12-02 11:42:16.000,博亚精工：询价转让价格为21元/股
同花顺,2025-12-02 11:42:06.000,爱克股份：拟22亿元购买东莞硅翔100%股权 股票明起复牌
同花顺,2025-12-02 11:41:49.000,2连板冰山冷热：股票异常波动期间，控股股东未买卖公司股票
财联社,2025-12-02 11:41:26.000,优地机器人在港交所发行上市计划获证监会备案
财联社,2025-12-02 11:41:08.000,福建产投启航股权投资合伙企业登记成立 出资额15亿
同花顺,2025-12-02 11:37:06.000,特斯拉公司11月售出86700辆中国产汽车
同花顺,2025-12-02 11:35:02.000,永安林业：股东远兴建设公司收到行政监管措施决定书
同花顺,2025-12-02 11:34:48.000,津荣天宇：公司以自有资金600万元认购合伙企业5.82%的基金份额
财联社,2025-12-02 11:32:39.000,午评：创业板指半日跌近1% 福建板块逆势走强
财联社,2025-12-02 11:32:20.000,【大佬持仓跟踪】AI算力+消费电子+机器人，产品应用于多个AI客户的TPU的电源解决方案，推出了448G的高速互联产品，这家公司人形机器人今年预计出货数千台
财联社,2025-12-02 11:25:00.000,上海：普惠性民办幼儿园保育教育费收费标准为不高于700元/生·月
财联社,2025-12-02 11:17:22.000,沪深两市成交额突破1万亿 较昨日此时缩量超1600亿
财联社,2025-12-02 11:15:48.000,海南自贸概念回升 海马汽车涨停
财联社,2025-12-02 11:13:58.000,知情人士称美国政府解雇纽约8名移民法官
财联社,2025-12-02 11:12:43.000,阿里发布Qwen-Image模型新版本 千问APP首发接入
财联社,2025-12-02 11:11:35.000,欧盟撤销对华诉讼
财联社,2025-12-02 11:08:46.000,全国“以竹代塑”工作推进现场会在福建南平召开
财联社,2025-12-02 11:07:17.000,云南省大理州副州长、州公安局局长雷楚英接受纪律审查和监察调查
财联社,2025-12-02 11:06:02.000,中国药品价格登记系统上线
同花顺,2025-12-02 11:05:32.000,12月21日起，深圳24小时通关口岸暂停跨境货运车辆通关服务
同花顺,2025-12-02 11:04:02.000,新莱应材：厉善君等多名董事拟减持股份不超过24.34万股
同花顺,2025-12-02 11:03:32.000,绿联科技：珠海锡恒投资合伙企业拟减持不超过2%股份
同花顺,2025-12-02 11:03:21.000,同有科技：股东佟易虹、杨永松各拟减持不超过1%股份
财联社,2025-12-02 11:00:23.000,【盘中宝】AI赋能万物通过应用端实现，大模型厂商正加速AI应用形态革新与场景渗透，这家公司相关细分领域业务已实现收入过亿元
同花顺,2025-12-02 11:00:11.000,美特使已抵达莫斯科，为今年第6次访俄
同花顺,2025-12-02 11:00:07.000,西安奕材：与关联方共同投资10亿元设立项目公司
财联社,2025-12-02 10:59:21.000,马来西亚总理：英特尔承诺在马投资2.08亿美元用于芯片产业
财联社,2025-12-02 10:58:58.000,五粮液集团入股四川航空集团完成工商变更 后者增资至12.19亿
财联社,2025-12-02 10:58:14.000,福建：围绕福州都市圈和厦漳泉都市圈建设城市级数据中心
财联社,2025-12-02 10:55:58.000,福建：构建全省算力一体化服务体系 探索面向港澳台、东南亚的算力出海模式
财联社,2025-12-02 10:55:19.000,主力资金监控：中兴通讯净卖出超20亿
财联社,2025-12-02 10:54:17.000,福建：谋划建设一批中型算力基础设施项目 推动智算中心提升国产化率
财联社,2025-12-02 10:53:37.000,福建：升级扩容“福淡”“厦金”海底光缆 推进“福州—深圳短路径光缆”项目建设
同花顺,2025-12-02 10:49:24.000,高澜股份：拟出售东莞硅翔16.9759%股权
同花顺,2025-12-02 10:47:23.000,北方股份：特沃上海拟减持不超过3%
同花顺,2025-12-02 10:44:56.000,人福医药：子公司撤回药品注册申请
财联社,2025-12-02 10:44:46.000,工业和信息化部电子信息司就筹备中国人工智能终端行业协会听取意见
财联社,2025-12-02 10:42:27.000,澳大利亚法院责令谷歌缴纳5500万澳元罚款 因有反竞争行为
财联社,2025-12-02 10:41:32.000,国债期货多数走弱 30年期主力合约跌幅扩大至0.46%
同花顺,2025-12-02 10:41:17.000,*ST正平：公司股票将于2025年12月3日复牌
同花顺,2025-12-02 10:39:40.000,科恒股份：放弃控股子公司深圳浩能33.21%股权转让优先购买权
同花顺,2025-12-02 10:34:32.000,派能科技：融科创投拟减持不超过3%
同花顺,2025-12-02 10:34:26.000,复宏汉霖：地舒单抗生物类似药HLX14的上市注册申请获国家药品监督管理局受理
同花顺,2025-12-02 10:33:49.000,比音勒芬：拟以10股派0.2元
同花顺,2025-12-02 10:33:41.000,亿纬锂能与中国燃气达成全方位战略合作
同花顺,2025-12-02 10:33:24.000,香港特区政府介绍火灾搜救进展：5栋大楼完成搜救
财联社,2025-12-02 10:33:12.000,【风口研报·公司】发布AI手机、自研+第三方AI模型全布局，这家公司逐步构建起“端侧轻量化AI+云端协同+多端互联”的综合能力，持续提升AI手机用户体验
财联社,2025-12-02 10:30:58.000,巴西对华丙烯酸丁酯发起反倾销调查
财联社,2025-12-02 10:30:33.000,冰雪产业概念再度走强 冰山冷热2连板
财新网,2025-12-02 10:29:11.725,比亚迪11月产量
