来源,时间,标题
财联社,2025-12-01 22:35:16.000,英唐智控：公司车载显示芯片部分已实现量产
财联社,2025-12-01 22:34:29.000,纳斯达克中国金龙指数盘初涨约0.5%
财联社,2025-12-01 22:31:42.000,纳指低开0.85% 科技、加密货币板块领跌
财联社,2025-12-01 22:23:28.000,Strategy宣布建立股息和利息准备金 以缓解市场对其可能出售比特币的担忧
财联社,2025-12-01 22:20:58.000,航旅纵横大面积误发通知？最新回应：提供专项补偿
财联社,2025-12-01 22:17:52.000,泽连斯基与马克龙会谈 聚焦和平谈判与安全保障
财联社,2025-12-01 22:13:52.000,国泰海通：中国资本市场处于大发展的周期 股指向上还有很大空间
财联社,2025-12-01 22:13:27.000,俄外交部：北约对俄“先发制人打击”言论“极不负责任”
财联社,2025-12-01 22:03:38.000,【公告全知道】6G+商业航天+芯片+军工+华为！公司拥有6G低轨卫星互联网系统等关键技术
财联社,2025-12-01 21:56:18.000,园林股份：拟购买华澜微6.5%股份 交易总金额合计1.12亿元
财联社,2025-12-01 21:53:00.000,【风口研报·洞察】字节发布豆包手机助手，抢占手机AI入口，分析师认为12月18日至19日举办的“Force字节原动力大会”或为产业链注入全新驱动力；如何布局春季躁动行情
财联社,2025-12-01 21:52:38.000,万科20亿元境内债展期初步方案：本金及利息兑付拟展期一年 票面利率维持不变
财联社,2025-12-01 21:51:38.000,崔东树：2025年10月中国占世界汽车份额38%
财联社,2025-12-01 21:46:21.000,财联社12月1日晚间新闻精选
财联社,2025-12-01 21:40:57.000,"BitMine上周增持96,798枚以太坊 总持仓量增至3,726,499枚"
财联社,2025-12-01 21:40:39.000,北京深演智能科技股份有限公司递表港交所
财联社,2025-12-01 21:34:27.000,工信部部长李乐成会见挪威渔业和海洋政策大臣玛丽安·奈斯
财联社,2025-12-01 21:33:06.000,农业农村部：统筹推进南疆现代设施农业高质量发展
同花顺,2025-12-01 21:29:25.000,马克龙：只有乌欧参与才能达成俄乌“和平计划”
同花顺,2025-12-01 21:29:14.000,富时A50期指连续夜盘收涨0.13%
财联社,2025-12-01 21:25:27.000,摩根士丹利策略师：韩元最糟糕时期可能已经过去
财联社,2025-12-01 21:21:05.000,TCL中环：张长旭辞去CFO职务 聘任杨帆为新任CFO
财联社,2025-12-01 21:17:31.000,上海闵行区330公里自动驾驶测试道路即将开放
财联社,2025-12-01 21:15:54.000,卓翼科技：认定和山未来为公司控股股东 陈雍为实际控制人
财联社,2025-12-01 21:15:08.000,博亚精工：股东李文喜计划询价转让450万股 占总股本3.83%
财联社,2025-12-01 21:12:35.000,高乐股份：实控人将变更为王帆 股票明起复牌
财联社,2025-12-01 21:12:16.000,Strategy上周斥资1170万美元增持130枚比特币
同花顺,2025-12-01 21:11:49.000,亚马逊计划推出新的美国超快速配送服务
财联社,2025-12-01 21:08:51.000,乌克兰第聂伯市遭导弹袭击致4人死亡
财联社,2025-12-01 21:08:37.000,【财联社早知道】DeepSeek发布两款新模型，机构称国产大模型迭代推动AI算力投资持续高景气，这家公司参股了国内掌握TPU架构AI芯片核心研发技术并实现TPU芯片量产的公司
财联社,2025-12-01 21:06:47.000,威领股份：山南锑金将成为第一大股东 股票将于明日复牌
财联社,2025-12-01 21:04:42.000,沃尔核材：高速通信线448G样品已送客户验证
同花顺,2025-12-01 21:03:34.000,纳斯达克中国金龙指数收涨0.87%，热门中概股多数收涨
财联社,2025-12-01 21:03:10.000,英伟达以每股414.79美元的价格投资20亿美元入股新思科技
财联社,2025-12-01 21:03:07.000,金字火腿：中晟微专注于400G/800G/1.6T高速光模块芯片
财联社,2025-12-01 20:56:31.000,海航控股：拟向海航货运增资7.5亿元
同花顺,2025-12-01 20:08:25.000,谷歌将Gemini 3人工智能模式引入谷歌搜索，覆盖近120个国家和地区
财联社,2025-12-01 20:06:32.000,佰维存储：拟择机出售所持联芸科技部分或全部股票
财联社,2025-12-01 20:04:30.000,佰维存储：回购股份资金总额调整为8000万元-1.5亿元 回购股份价格上限上调至不超过182.07元/股
财联社,2025-12-01 20:01:09.000,市场监管总局：严打持证企业为无证主体“贴牌”等违法行为
财联社,2025-12-01 20:00:57.000,【电报解读】性能比肩GPT-5略低于Gemini-3.0-Pro，DeepSeek V3.2正式版发布！机构看好AI软硬件协同将优化大模型部署性能，这家公司完成DeepSeek-R1的接入与本地化部署
财联社,2025-12-01 20:00:19.000,中信证券维持戴尔“买入”评级 目标价160美元
财联社,2025-12-01 19:58:34.000,两连败 中国男篮76比90再输韩国
财联社,2025-12-01 19:56:40.000,中绿电：证券简称拟变更为绿发电力
财联社,2025-12-01 19:56:33.000,中粮科技：投资8.8亿元建设平凉25万吨/年淀粉糖及1万吨/年阿洛酮糖新建项目
财联社,2025-12-01 19:52:56.000,印尼洪灾和山体滑坡已致604人遇难
财联社,2025-12-01 19:52:00.000,俄外交部发言人：北约言论显露蓄意升级局势企图
财联社,2025-12-01 19:48:39.000,赛力斯11月新能源汽车销量55203辆 同比增长50%
财联社,2025-12-01 19:47:14.000,12月中国境内到日本的计划航班取消超40%
财联社,2025-12-01 19:45:21.000,日本民众要求调查美军基地“永久性化学物”污染问题
财联社,2025-12-01 19:43:58.000,深房中协：深圳二手房市场已逐步走出最低谷 交易量进入企稳阶段
财联社,2025-12-01 19:40:46.000,【机构调研】这家智能蓝牙穿戴SoC芯片厂商端侧AI处理器芯片相关销售收入实现数倍增长
同花顺,2025-12-01 19:34:57.000,荷兰和乌克兰将联合生产无人机
同花顺,2025-12-01 19:26:35.000,加密货币市场跌势连绵 近10亿美元杠杆头寸被平仓
同花顺,2025-12-01 19:08:52.000,美国南卡罗来纳州将向华盛顿派遣300名国民警卫队士兵
同花顺,2025-12-01 19:04:34.000,恒指期货夜盘收涨0.63%
财联社,2025-12-01 19:02:46.000,神火股份：向全资子公司神火新材增资10亿元
财联社,2025-12-01 19:02:35.000,永泰能源：拟使用3亿元-5亿元回购股份用于注销
财联社,2025-12-01 19:00:30.000,比亚迪今年1-11月汽车销量418万辆 同比增长11.3%
财联社,2025-12-01 19:00:15.000,茂业商业：控股股东一致行动人11月28日至12月1日减持2511.35万股
财联社,2025-12-01 18:59:55.000,金一文化：海科金集团拟延长对海鑫资产股权托管期限5年
财联社,2025-12-01 18:57:07.000,【机构龙虎榜解读】端侧AI+存储芯片，新制程的DDR4产品已开始给客户送样，预计明年会有收入的提升，LPDDR5的产品正在规划中，计划推出更大算力SoC芯片，布局边缘AI与大模型应用，这家公司获净买入
财联社,2025-12-01 18:52:47.000,3连板睿能科技：股东平潭捷润于11月1日至12月1日期间减持150万股公司股份
财联社,2025-12-01 18:50:33.000,全国首单工业厂房持有型不动产ABS落地
财联社,2025-12-01 18:46:10.000,中证协启动证券业“十五五”规划网络基础设施专项调研
财联社,2025-12-01 18:46:05.000,睿能科技：前三季度工业自动化控制产品应用到机器人领域占公司营业收入比例约1.02%
财联社,2025-12-01 18:45:56.000,宁波富邦：拟3.7亿元出售中华纸业2.5%股权
财联社,2025-12-01 18:45:10.000,广期所：调整多晶硅期货PS2601合约交易保证金标准及交易限额
财联社,2025-12-01 18:44:52.000,电影《疯狂动物城2》内地票房破20亿
财联社,2025-12-01 18:39:13.000,担忧富豪外逃 瑞士否决50%遗产税提案
财联社,2025-12-01 18:38:55.000,北方国际：向特定对象发行股票申请获得中国证监会同意注册批复
同花顺,2025-12-01 18:38:48.000,白宫新闻秘书莱维特：将就特朗普相关账户事宜发布声明
同花顺,2025-12-01 18:34:37.000,用户报告称，OpenAI出现诸多故障
同花顺,2025-12-01 18:17:00.000,美联储隔夜逆回购协议（RRP）使用规模为32.4亿美元
财联社,2025-12-01 18:02:11.000,京东：“国民好车”11月24日前大定订单可全额退款
财联社,2025-12-01 18:01:09.000,宁德时代1-6职级员工基本工资上调150元
财联社,2025-12-01 18:00:47.000,宁德时代发布春节坚守岗位奖励计划 满足条件至少奖励3200元
财联社,2025-12-01 17:59:43.000,中信建投今日大宗交易折价成交1411.59万股 成交额3.29亿元
财联社,2025-12-01 17:58:09.000,北汽蓝谷：11月新能源汽车销量同比增长112.71%
同花顺,2025-12-01 17:52:56.000,日本学者批评高市发言极为轻率 严重影响中日人员交流
财联社,2025-12-01 17:46:03.000,4天3板梅雁吉祥：主营业务水力发电、测绘地理信息未发生重大变化
财联社,2025-12-01 17:41:21.000,华夏幸福：平安人寿及其一致行动人10月20日至10月21日减持781.55万股
财联社,2025-12-01 17:40:47.000,新亚电子：高频高速铜缆已供货谷歌数据中心
财联社,2025-12-01 17:40:11.000,南向资金今日净买入超21亿港元 中兴通讯获净买入居前
财联社,2025-12-01 17:39:25.000,美芯晟：无线充电芯片已用于豆包AI手机
财联社,2025-12-01 17:37:12.000,ST先河：已申请撤销其他风险警示
财联社,2025-12-01 17:35:50.000,太龙药业：控股股东筹划公司股份转让事宜 股票停牌
财联社,2025-12-01 17:34:40.000,"小鹏汽车：11月交付36,728辆汽车 同比增长19%"
财联社,2025-12-01 17:33:33.000,日本关西机场12月第二周中国航班数将减少约34%
财联社,2025-12-01 17:32:36.000,俄总统普京将于2日会见美特使威特科夫
财联社,2025-12-01 17:31:17.000,外高桥造船超额完成年度交船目标
财联社,2025-12-01 17:30:17.000,交通银行：捐赠港币1000万元用于香港救灾
财联社,2025-12-01 17:29:33.000,中央生态环保督察通报河北唐山违规上马钢铁项目
同花顺,2025-12-01 17:16:52.000,美国参议员卡西迪：特朗普今天将签署一项支持法案
财联社,2025-12-01 17:08:33.000,抖音：7月以来已封禁投资理财类涉诈账号超80万个
财联社,2025-12-01 17:07:10.000,美股加密货币概念股盘前走低
财联社,2025-12-01 17:06:42.000,REITs项目行业范围清单（2025年版）印发 人工智能基础设施项目在列
财联社,2025-12-01 17:05:17.000,国家发改委印发不动产投资信托基金（REITs）项目行业范围清单
财联社,2025-12-01 17:04:14.000,克而瑞：11月房企推盘积极性小幅回升 广州单月供应规模环比翻番
财联社,2025-12-01 17:03:20.000,金盘科技：已完10kV/2.4MW固态变压器样机研发
财联社,2025-12-01 17:02:03.000,法国总统希望将“手机禁令”扩大到高中
财联社,2025-12-01 17:01:00.000,美凯龙：杭州灏月9月10日～11月18日合计减持5567.33万股
财联社,2025-12-01 17:00:35.000,兰剑智能：AMR等机器人已应用于比亚迪、宁德时代项目
财联社,2025-12-01 16:59:29.000,空客：中国民航机队所涉A320系列飞机已采取预防性措施 航班运行平稳正常
财联社,2025-12-01 16:58:34.000,蓝思科技：公司独立董事谢志明因病逝世
财联社,2025-12-01 16:57:17.000,远东股份：11月子公司中标/签约千万元以上合同订单合计23.83亿元
财联社,2025-12-01 16:56:25.000,华润双鹤：控股子公司盐酸吡格列酮分散片通过仿制药一致性评价
财联社,2025-12-01 16:55:55.000,三星医疗：子公司签订印尼电表年度招标项目合同 合同金额约1.6亿元人民币
财联社,2025-12-01 16:55:34.000,谷歌CEO警告：美国AI监管混乱 恐在全球竞争中落后
同花顺,2025-12-01 16:40:02.000,摩根士丹利将英伟达目标股价从 235美元上调至 250美元
同花顺,2025-12-01 16:22:42.000,现货白银向上突破58美元/盎司，日内上涨近3%
同花顺,2025-12-01 16:22:29.000,上市辅导提醒：宁夏维尔精工股份有限公司启动上市辅导
财联社,2025-12-01 16:06:16.000,交大思诺：公司董事长李伟解除留置
财联社,2025-12-01 16:02:46.000,瑞银：西方国家政府可能盯上个人财富 以填补巨大公共债务窟窿
财联社,2025-12-01 16:01:30.000,欧洲主要股指集体低开
财联社,2025-12-01 16:01:06.000,雀巢中国回应婴儿营养品业务与惠氏合并：不影响现有业务开展
财联社,2025-12-01 16:01:03.000,今年10月中国企业信用指数为161.56 信用水平基本平稳
财联社,2025-12-01 15:59:52.000,长华集团：获国内车企项目定点 预计销售总额约7.32亿元
财联社,2025-12-01 15:57:44.000,外交部：祝贺吉尔吉斯斯坦提前议会选举顺利举行
同花顺,2025-12-01 15:53:52.000,乌克兰总统泽连斯基：新的和平计划看起来更好，美国谈判代表将向俄罗斯传达其立场
同花顺,2025-12-01 15:53:44.000,第19届世界水资源大会在摩洛哥开幕，中方阐释洪水治理管理三种模式
财联社,2025-12-01 15:53:09.000,立中集团：与伟景智能签署人形机器人零部件委托加工技术协议
财联社,2025-12-01 15:53:07.000,新加坡将禁止中学生在校内使用智能手机或手表
财联社,2025-12-01 15:49:48.000,12月1日连板股分析：连板股晋级率近八成 端侧AI全线爆发
财联社,2025-12-01 15:47:44.000,法国总统马克龙将访华 外交部介绍情况
财联社,2025-12-01 15:44:20.000,交通运输部副部长付绪银会见挪威渔业与海洋政策大臣
财联社,2025-12-01 15:44:11.000,上海发布引进人才、持居住证人员申办常住户口办法
同花顺,2025-12-01 15:44:06.000,比特币跌破84000美元，日内跌7.07%
财联社,2025-12-01 15:40:07.000,日方对自身在台湾问题上的立场一再含糊其辞 外交部：某些人从未真正汲取历史教训
财联社,2025-12-01 15:40:02.000,马斯克预言：AI将在三年内终结美国“债务危机”
财联社,2025-12-01 15:38:17.000,工业富联：截至11月30日累计回购股份931.99万股 使用资金总额2.47亿元
财联社,2025-12-01 15:37:50.000,交易所债券市场收盘 万科债普遍继续下滑
同花顺,2025-12-01 15:32:42.000,美股加密货币概念股短线下挫
同花顺,2025-12-01 15:30:57.000,英伟达首席执行官黄仁勋表示，与新思科技的交易并非排他性协议
同花顺,2025-12-01 15:20:02.000,日本前外相批高市早苗“台湾有事”言论：可能开启战争道路
财联社,2025-12-01 15:06:57.000,市场监管总局正式受理婴配液态乳产品配方注册申请
财联社,2025-12-01 15:03:29.000,收评：沪指涨0.65%重返3900点 两市成交额放量近2900亿
财联社,2025-12-01 15:01:29.000,法国总统马克龙将访华
同花顺,2025-12-01 15:01:18.000,国内期货夜盘收盘主力合约涨多跌少
财联社,2025-12-01 15:00:56.000,国内商品期货收盘 沪银涨近6%再创收盘新高
财联社,2025-12-01 14:59:26.000,亚马逊和谷歌联手打通高速云链路
财联社,2025-12-01 14:58:01.000,航行警告！渤海海峡有军事活动
财联社,2025-12-01 14:56:02.000,深交所：“21万科02”盘中临时停牌
财联社,2025-12-01 14:54:32.000,全球百强军火商去年收入创纪录 其中39家总部位于美国
财联社,2025-12-01 14:51:23.000,【盘中宝】火山引擎FORCE原动力大会本月召开，机构称字节已形成模型、平台、应用、硬件全AI产业链布局，这家企业与火山引擎持续合作，拥有AI玩具细分领域方案
同花顺,2025-12-01 14:49:16.000,云南金浔资源股份有限公司向港交所提交上市申请书
同花顺,2025-12-01 14:43:18.000,住房城乡建设部：各地要扎实推进2025年治理欠薪冬季行动
财联社,2025-12-01 14:42:54.000,机构：NAND Flash wafer供给紧缩加剧 11月部分产品合约价涨幅逾60%
财联社,2025-12-01 14:42:05.000,北京：创新“一网通办”数智应用场景 全面优化高频服务系统
同花顺,2025-12-01 14:41:36.000,现货黄金短线走低逾20美元，现报4230.99美元/盎司
财联社,2025-12-01 14:39:19.000,北京：拟加强“人工智能+政务服务”统筹建设 强化政务领域大模型顶层设计
财联社,2025-12-01 14:33:36.000,美防长被爆在一次打击“贩毒船”行动中下令“杀光所有人” 特朗普回应
财联社,2025-12-01 14:31:26.000,日韩股市双双收跌 日经225指数跌近2%
财联社,2025-12-01 14:31:19.000,阶跃星辰开源GUI Agent技术和4B GUI Agent模型
同花顺,2025-12-01 14:30:49.000,美股开盘：三大指数集体低开
同花顺,2025-12-01 14:21:38.000,据港交所文件：深圳乐动机器人股份有限公司向港交所提交上市申请书
财联社,2025-12-01 14:08:09.000,俄安全部门称挫败一起针对俄高级军官袭击事件
财联社,2025-12-01 14:04:56.000,累库持续 光伏电池价格持续回落
同花顺,2025-12-01 14:03:06.000,总投资100亿元，迈富时全球研发总部落户南京
财联社,2025-12-01 14:03:06.000,【盘中宝】AI基础设施最重要的物料之一，这类芯片供不应求，价格正在飞速提升，这家公司已量产多款相关产品
财联社,2025-12-01 14:00:27.000,今年我国快递业务量首次突破1800亿件 创历史新高
财联社,2025-12-01 13:56:24.000,沪深两市成交额突破1.5万亿 较上一日此时放量超2700亿
财联社,2025-12-01 13:55:48.000,腾讯旗下财付通小贷增资至150亿 增幅42.5%
财联社,2025-12-01 13:53:52.000,布伦特原油期货涨幅扩大至2%
同花顺,2025-12-01 13:51:54.000,园林股份：拟购买华澜微6.4969%股份 交易总金额合计1.12亿元
财联社,2025-12-01 13:45:25.000,白银价格创历史新高 今年涨幅已超90%
同花顺,2025-12-01 13:42:49.000,韩国公民因涉嫌走私在伊朗被捕
同花顺,2025-12-01 13:39:20.000,据港交所文件，北京深演智能科技股份有限公司向港交所提交上市申请书
财联社,2025-12-01 13:37:39.000,光刻胶概念午后异动 容大感光涨超10%
同花顺,2025-12-01 13:31:36.000,乌克兰第聂伯罗市遭袭 已致4人死亡
财联社,2025-12-01 13:29:44.000,港股TATA健康复牌大涨超700%
同花顺,2025-12-01 13:26:24.000,OpenAI入股Thrive Holdings
同花顺,2025-12-01 13:22:21.000,TCL中环：聘任杨帆为公司新任CFO
财联社,2025-12-01 13:21:06.000,抗流感概念反复活跃 海王生物触及涨停
财联社,2025-12-01 13:16:58.000,【风口研报·公司】签订重磅战略合作协议拓展机器人关节模组，这家公司凭借万向节技术积累，切入具身智能核心零部件，同时储能固态电池产线计划2026年年初投产
财联社,2025-12-01 13:12:39.000,航运板块震荡走强 招商轮船涨停创18年新高
同花顺,2025-12-01 13:12:16.000,博亚精工：股东李文喜拟通过询价转让方式减持3.83%公司股份
财联社,2025-12-01 13:10:52.000,工信部：鼓励中国光伏、风电、锂电池、新能源汽车等优势企业“走出去”
财联社,2025-12-01 13:10:15.000,东航C919今日起执飞上海至兰州定期航线 此为该机型首次执飞高原航线
财联社,2025-12-01 13:09:19.000,塔吉克斯坦与阿富汗边境发生武装袭击致中国公民伤亡 中使馆再发提醒
同花顺,2025-12-01 13:08:57.000,高乐股份：拟向特定对象发行不超过1.33亿股A股
同花顺,2025-12-01 13:05:56.000,新思科技美股盘前涨超10%
财联社,2025-12-01 13:05:30.000,存储芯片概念午后拉升 北京君正涨超10%
财联社,2025-12-01 13:04:29.000,首飞高原机场！东航C919国产大飞机今日起执行上海至兰州定期航线
同花顺,2025-12-01 13:01:11.000,博通美股盘前跌超2%
财联社,2025-12-01 12:59:56.000,中国驻塔大使馆：要求塔方采取必要措施确保中国企业及公民安全
财联社,2025-12-01 12:55:49.000,湖南广电与张家界市达成战略合作 大庸古城预计在2026年7月开园
财联社,2025-12-01 12:54:58.000,中东部气温将大面积创新低 降温过后升温迅速
财联社,2025-12-01 12:53:40.000,武契奇回应美国对塞尔维亚石油工业公司采取措施：我不理解
同花顺,2025-12-01 12:53:28.000,卓翼科技：和山未来成为公司控股股东，陈雍为实际控制人
同花顺,2025-12-01 12:50:50.000,香港暂停进口加拿大、波兰和英国部分地区禽肉及禽类产品
财联社,2025-12-01 12:50:23.000,福建泉州洛江实施购房补贴 购房限期内最高7万元/套
同花顺,2025-12-01 12:49:50.000,以总统回应内塔尼亚胡赦免请求：国家利益是唯一考量
同花顺,2025-12-01 12:47:58.000,Shopify美股盘前跌超5%
财联社,2025-12-01 12:45:18.000,“冒充总统索要钱财” 韩总统府发声：将依法严肃惩处
财联社,2025-12-01 12:41:56.000,美两党议员警告：美防长可能犯下战争罪
财联社,2025-12-01 12:41:51.000,【机构调研】这家公司打造端侧AI全链路音频方案，全系智能产品接入豆包VLM多模态AI大模型
同花顺,2025-12-01 12:41:35.000,蜀道装备：拟与关联方共同投资20亿元设立产业投资基金
财联社,2025-12-01 12:28:16.000,澳大利亚国防部启动50年来最大规模重组
同花顺,2025-12-01 12:26:18.000,英伟达美股盘前跌超2%
同花顺,2025-12-01 12:25:24.000,久量股份：融信量及其一致行动人合计减持221.65万股
同花顺,2025-12-01 12:25:09.000,天华新能：控股股东协议转让12.95%公司股份完成过户登记
财联社,2025-12-01 12:23:10.000,特朗普：暂停接收难民措施或将维持“很长时间”
同花顺,2025-12-01 12:20:11.000,茅台机场乘机抽取购酒资格活动延长至年底
同花顺,2025-12-01 12:18:54.000,华润医药：拟发行30亿元中期票据
同花顺,2025-12-01 12:18:37.000,合力泰：拟投资5000万元参与设立产业基金 主要投资半导体、人工智能等行业
同花顺,2025-12-01 12:18:32.000,飞马国际：副总经理姚旭辞职
财联社,2025-12-01 12:12:35.000,林清轩回应招股书失效：上市正在流程中 已获证监会备案通知书
财联社,2025-12-01 12:08:46.000,财联社12月1日午间新闻精选
同花顺,2025-12-01 12:08:42.000,上海二手房市场现“翘尾行情”
同花顺,2025-12-01 12:06:49.000,浙江：抢抓人工智能发展浪潮，发挥数字经济、平台经济优势作用
同花顺,2025-12-01 12:04:05.000,美迪凯：拟定增募资不超过7亿元，用于MEMS器件光学系统制造等项目
同花顺,2025-12-01 12:03:52.000,诺德股份：孙公司参与投资设立产业基金
同花顺,2025-12-01 12:03:00.000,市场监管总局对为无证食品生产提供便利条件行为加大打击力度
财联社,2025-12-01 12:01:30.000,安妮股份：公司筹划控制权变更事项 股票停牌
同花顺,2025-12-01 12:01:21.000,佳禾智能：控股股东文富投资已减持333.8万股
同花顺,2025-12-01 12:01:09.000,中金辐照：拟定增募资不超过8亿元
同花顺,2025-12-01 12:00:25.000,鼎泰高科：向香港联交所递交H股发行上市申请
财联社,2025-12-01 12:00:21.000,港股午评：恒生指数涨0.81% 恒生科技指数涨0.99%
同花顺,2025-12-01 11:58:07.000,唐人神：大生行饲料完成减持0.6981%公司股份
同花顺,2025-12-01 11:57:57.000,京粮控股：股东王岳成拟减持不超过0.69%股份
同花顺,2025-12-01 11:56:53.000,20分钟“空中直达” 江苏太仓—浦东首条常态化低空航线开通
同花顺,2025-12-01 11:55:55.000,中粮科技：拟投资8.8亿元建设平凉25万吨/年淀粉糖及1万吨/年阿洛酮糖新建项目
同花顺,2025-12-01 11:55:48.000,星网锐捷：拟以8000万元出资设立产业基金
同花顺,2025-12-01 11:53:35.000,12月1日 周一《新闻联播》要闻12条
财联社,2025-12-01 11:51:03.000,12月1日午间涨停分析
财联社,2025-12-01 11:48:41.000,蚂蚁集团旗下云抒企业管理公司增资至39.4亿 增幅约9%
财联社,2025-12-01 11:46:06.000,中国疾控中心研究员彭质斌：当前仍建议还未接种流感疫苗的适宜人群尽快接种
财联社,2025-12-01 11:45:13.000,【电报解读】中兴通讯封涨停成交量超130亿，搭载豆包的努比亚M153少量发售，快速整理豆包手机相关上市公司（附表）
财联社,2025-12-01 11:42:29.000,中国疾病预防控制中心：当前我国已进入呼吸道传染病高发季节 疫情总体呈上升趋势
财联社,2025-12-01 11:37:06.000,苏州市重大产业发展私募投资基金成立
财联社,2025-12-01 11:33:31.000,深圳地铁集团法定代表人变更 黄力平接替辛杰
财联社,2025-12-01 11:31:30.000,午评：深成指、创业板指均涨近1%  消费电子板块爆发
财联社,2025-12-01 11:30:33.000,瑞银证券：2026年全部A股盈利增速有望升至8%
财联社,2025-12-01 11:25:13.000,深成指涨逾1% AI端侧领涨市场
财联社,2025-12-01 11:15:53.000,我国首次出口泰国的整套铁路大型养路施工车组在昆明下线验收
财联社,2025-12-01 11:15:07.000,我国推动ISO立项首个工业废水毒性削减国际标准
同花顺,2025-12-01 11:05:12.000,源飞宠物：股东平阳晟飞持股比例下降至5%
财联社,2025-12-01 11:04:50.000,商务部：鄢东副部长会见韩国驻华大使卢载宪
同花顺,2025-12-01 11:04:39.000,热景生物：公司与关联方拟共同投资尧景基因 公司出资2400万元
财联社,2025-12-01 11:03:33.000,机构：11月深圳一二手房网签总量7116套 环比涨3.9%、同比降57.3%
同花顺,2025-12-01 11:01:08.000,国家药监局注销4家企业共9个医疗器械注册证书
财联社,2025-12-01 11:00:30.000,FF：在必要融资到位等条件下 未来五年产销目标40万-50万台
财联社,2025-12-01 10:59:39.000,中兴通讯封涨停 成交金额超131亿元
