来源,时间,标题
同花顺,2025-09-09 04:09:15.000,Lazada成立“一键轻出海”项目组，和天猫首次系统性打通
同花顺,2025-09-09 04:05:24.000,微软大手笔锁定 174 亿美元外部 AI GPU 云算力，Nebius 负责供应
财联社,2025-09-09 04:02:03.000,纳斯达克中国金龙指数收涨2.12%
同花顺,2025-09-09 04:01:29.000,港股午评：恒生指数涨0.8%，恒生科技指数涨1.03%
财联社,2025-09-09 04:00:46.000,美股三大指数集体收涨 纳指创收盘新高
财联社,2025-09-09 04:00:46.000,美股三大指数集体收涨 博通涨超3%
财联社,2025-09-09 03:54:55.000,美元指数8日下跌
财联社,2025-09-09 03:53:15.000,国际油价8日上涨
同花顺,2025-09-09 03:47:04.000,上半年国家高新区企业营业收入同比增长6.5%
同花顺,2025-09-09 03:34:37.000,国家气象中心：6月末以来的高温天气已持续71天，9月17日以后将趋于结束
同花顺,2025-09-09 03:31:16.000,A股午评：创业板指半日跌1.77%，黄金股逆市大涨
同花顺,2025-09-09 03:30:45.000,ETF午评：黄金股ETF基金领涨5.91%，创业板50ETF万家领跌3.74%
同花顺,2025-09-09 03:30:31.000,ETF两市成交额2489.90亿元
财新网,2025-09-09 03:30:00.000,美国人信用卡消费增长强劲
同花顺,2025-09-09 03:27:08.000,哈马斯谴责以总理宣扬战争言论
同花顺,2025-09-09 03:25:00.000,习近平：维护好、巩固好、发展好中朝关系始终是中国党和政府坚定不移的战略方针
同花顺,2025-09-09 03:24:07.000,华天科技等在南京成立先进封装公司 注册资本20亿元
同花顺,2025-09-09 03:21:35.000,曝阿里将发布重磅业务 知情人士称与高德有关
同花顺,2025-09-09 03:12:49.000,工信部：我国企业研发经费占全社会研发经费75%以上
财联社,2025-09-09 03:12:41.000,特朗普被曝指派其女婿库什纳制定加沙“战后方案”
同花顺,2025-09-09 03:11:07.000,百度文心大模型X1.1深度思考模型发布
同花顺,2025-09-09 03:07:38.000,美航天局将启动3D打印模拟舱火星任务实验
同花顺,2025-09-09 03:06:50.000,沪深京三市成交额超1.2万亿元，较上日此时缩量3606亿元
同花顺,2025-09-09 03:04:40.000,小米汽车公布辅助驾驶新专利 可提高车辆对天气的自适应性
财联社,2025-09-09 03:01:51.000,美国消费者借贷创三个月来最大增长 信用卡余额大增
同花顺,2025-09-09 03:01:15.000,上海银行间同业拆放利率(Shibor)集体上涨
同花顺,2025-09-09 02:59:07.000,工信部：DeepSeek、通义千问等国产大模型引领全球开源创新生态
同花顺,2025-09-09 02:57:51.000,工信部：全国“5G+工业互联网”建设项目超过2万个
同花顺,2025-09-09 02:48:43.000,工信部：高端智能车用芯片仍存短板 将进一步完善支持政策
同花顺,2025-09-09 02:47:20.000,中芯国际成交额达100亿元
同花顺,2025-09-09 02:46:31.000,等待裁决 泰国前总理他信携女儿佩通坦现身最高法院
同花顺,2025-09-09 02:40:17.000,工信部：打造新型工业网络，推进蜂窝车联网部署
同花顺,2025-09-09 02:39:42.000,英伟达下一代Rubin芯片已流片，未来5年数据中心资本支出超3万亿
同花顺,2025-09-09 02:39:00.000,小鹏汽车具身机器人模型训练方法专利公布
同花顺,2025-09-09 02:38:28.000,工信部：将引导万兆光网从技术试点走向部署应用
同花顺,2025-09-09 02:32:02.000,香港恒生指数盘中突破26000点，续创近4年新高
同花顺,2025-09-09 02:31:17.000,工信部：正在研究人工智能+制造专项行动实施方案
同花顺,2025-09-09 02:28:06.000,工信部：截至今年7月规模以上工业企业数量较2020年末增加13.8万家
同花顺,2025-09-09 02:27:21.000,工信部：大国重器在增进民生福祉方面发挥重要作用
财联社,2025-09-09 02:22:05.000,美国土安全部启动针对芝加哥的非法移民打击行动
同花顺,2025-09-09 02:20:27.000,电力市场化改革迈出关键一步！新能源全面入市在山东落地
同花顺,2025-09-09 02:16:46.000,浙江出台若干措施，促进文化和旅游消费高质量发展
同花顺,2025-09-09 02:12:41.000,港股内房股走高，碧桂园涨超20%
同花顺,2025-09-09 02:07:46.000,工信部：我国建成全球最大、覆盖最广的网络基础设施
同花顺,2025-09-09 02:06:49.000,机器人智能装备引投资关注 投洽会聚焦前沿产业
同花顺,2025-09-09 02:04:34.000,工信部：我国制造业总体规模连续15年保持全球第一
同花顺,2025-09-09 02:02:59.000,沪深京三市成交额超7000亿元，较上日此时缩量2416亿元
同花顺,2025-09-09 02:02:24.000,王腾被小米辞退后再回应网上传言，称没有窃取公司机密出售
同花顺,2025-09-09 02:01:01.000,非法收受他人财物数额特别巨大 张效廉被提起公诉
财新网,2025-09-09 02:00:00.000,数据推荐：铁矿石进口量维持高位
同花顺,2025-09-09 01:33:13.000,房地产板块盘初活跃，首开股份5连板
同花顺,2025-09-09 01:29:47.000,国债期货开盘涨跌互现
同花顺,2025-09-09 01:26:48.000,ETF开盘：中创400ETF领涨4.13%，创大盘ETF领跌2.75%
同花顺,2025-09-09 01:26:08.000,中芯国际复牌低开超11%
财联社,2025-09-09 01:23:13.000,以总理称以军部队正在集结 准备进入加沙城展开地面行动
同花顺,2025-09-09 01:21:39.000,央行今日开展2470亿元7天期逆回购操作
同花顺,2025-09-09 01:21:10.000,港股开盘：恒生指数高开0.3%，恒生科技指数高开0.57%
同花顺,2025-09-09 01:20:58.000,四川自贡市富顺县发生3.6级地震
同花顺,2025-09-09 01:20:53.000,昨日ETF两市资金净流入222.14亿元
同花顺,2025-09-09 01:18:35.000,方正电机等成立动力科技公司 含汽车零部件业务
同花顺,2025-09-09 01:17:33.000,昨日ETF两市融资融券余额1101.97亿元
同花顺,2025-09-09 01:15:52.000,人民币兑美元中间价较上日调升21点至7.1008
同花顺,2025-09-09 01:13:49.000,第二批城市一刻钟便民生活圈全域推进先行区试点名单公布
财联社,2025-09-09 01:11:43.000,同花顺：董事长易峥提前终止减持计划
同花顺,2025-09-09 01:04:41.000,芯原股份在广州成立新公司 含集成电路业务
财联社,2025-09-09 01:03:05.000,沪锡收跌0.54%
同花顺,2025-09-09 01:01:51.000,美国SEC加密任务组将于10月17日举办金融监管与隐私圆桌会议
财联社,2025-09-09 00:59:52.000,法国总理贝鲁领导的政府未通过国民议会信任投票
财联社,2025-09-09 00:52:25.000,LME期铜收涨18美元 报9915美元/吨
财联社,2025-09-09 00:33:28.000,批评停火提案 哈马斯称美方意在促使其拒绝而非终结战争
财联社,2025-09-09 00:17:56.000,法国国民议会举行特别会议 法总理称过度债务已“构成威胁”
财新网,2025-09-09 00:16:56.144,2025年9月9日
财联社,2025-09-09 00:08:31.000,中国继续引领新兴市场ETF资金流入
同花顺,2025-09-09 00:01:24.000,20年期日本国债收益率下跌2.5个基点，至2.645%
同花顺,2025-09-09 00:00:14.000,现货白银站上41美元/盎司
财联社,2025-09-08 23:59:46.000,摩根大通交易员警告降息或引发美股下挫
同花顺,2025-09-08 23:53:37.000,中国银行联合国家知识产权局开展“知惠行”专项活动
同花顺,2025-09-08 23:48:13.000,业绩分化明显 休闲食品公司亟须业务破局
同花顺,2025-09-08 23:48:01.000,法国政府未通过信任投票 总理贝鲁被迫辞职
同花顺,2025-09-08 23:45:41.000,欧尔班致信欧盟委员会 要求欧盟偿还匈牙利保护边境费用
财联社,2025-09-08 23:40:57.000,中概股36氪第六次触发熔断 熔断前大涨307%
同花顺,2025-09-08 23:38:55.000,全球首家具身智能机器人4S店“满月”
财联社,2025-09-08 23:38:07.000,周一欧洲股市集体收涨 德股涨近1%
同花顺,2025-09-08 23:36:40.000,股债联动错位屡现 债券配置良机渐至
财联社,2025-09-08 23:36:01.000,波兰总统下周会晤德总统 拟提超1.6万亿美元二战赔款
同花顺,2025-09-08 23:35:42.000,迎接ETF市场扩容机遇 公募构建多层次产品矩阵
同花顺,2025-09-08 23:33:37.000,FAA 尚未就波音737 MAX的生产上限做出任何决定
同花顺,2025-09-08 23:32:57.000,中国移动、中国联通启动算力服务器集中采购
财联社,2025-09-08 23:29:54.000,小米开除王腾 后者曾任小米中国区市场部总经理
同花顺,2025-09-08 23:29:26.000,Tom Lee：BitMine已持有超过200万个以太币，价值超过85亿美元
财联社,2025-09-08 23:27:44.000,美上诉法院维持原判 特朗普需向卡罗尔支付8330万美元赔偿
同花顺,2025-09-08 23:26:40.000,证监系统已走访上市公司3700余家 年底前实现全覆盖
同花顺,2025-09-08 23:25:54.000,欧洲议会议员：欧盟在能源采购问题上采取双重标准
财联社,2025-09-08 23:21:51.000,中概股36氪涨幅达180%
财联社,2025-09-08 23:15:20.000,胡塞武装称三次袭击以色列 以方机场关闭、警报响起
财联社,2025-09-08 23:14:43.000,习近平：各国发展离不开开放合作的国际环境 谁也不能退回到自我封闭的孤岛
财联社,2025-09-08 23:00:46.000,美国8月纽约联储1年通胀预期为增长3.2%
同花顺,2025-09-08 22:58:36.000,美国白宫据悉在准备批评劳工统计局的报告，将列举美国劳工统计局的数据缺陷
财联社,2025-09-08 22:42:45.000,世界最大清洁能源走廊2025年首次全开运行
财联社,2025-09-08 22:41:03.000,天普股份：收购方资金未到位且暂无资产注入计划 股票明起复牌
财联社,2025-09-08 22:37:46.000,联合国秘书长：强烈谴责在耶路撒冷发生的恐怖袭击
财联社,2025-09-08 22:35:26.000,【电报解读】全球首款！宁德时代钠新电池通过新国标认证，机构称钠电已突破规模化成本临界点，全链成本优势凸显，目前研究钠离子电池的主流厂商均是这家公司的客户
财联社,2025-09-08 22:32:27.000,ST浩丰：筹划公司控制权变更事项 股票明起停牌
财联社,2025-09-08 22:28:56.000,土耳其发布未来三年经济规划 促增长降通胀
同花顺,2025-09-08 22:28:30.000,美国启动打击芝加哥非法移民行动
财联社,2025-09-08 22:19:27.000,南都电源：预期明年公司在北美的数据中心锂电营收会比今年翻倍增长
财联社,2025-09-08 22:18:01.000,美股黄金板块普涨 哈莫尼黄金涨4%
财联社,2025-09-08 22:16:30.000,西班牙召回驻以大使 回应以方诽谤指控及入境禁令
同花顺,2025-09-08 22:04:36.000,道琼斯指数期货涨0.03%，标普500指数期货涨0.04%，纳斯达克100指数期货涨0.02%
财联社,2025-09-08 21:56:57.000,亚康股份：股东徐江拟转让260万股股份用于解除公司银行账户冻结
财联社,2025-09-08 21:55:55.000,泽连斯基：只要俄罗斯没有“全面占领”乌克兰 就是乌克兰胜利
财联社,2025-09-08 21:51:20.000,诺普信：实控人及其一致行动人拟减持不超过2.98%公司股份
财联社,2025-09-08 21:51:06.000,Databricks融资10亿美元 估值超过1000亿美元
财联社,2025-09-08 21:50:58.000,【公告全知道】人形机器人+铜缆高速连接+液冷服务器+华为！公司有应用于人形机器人的连接器小批量订单
财联社,2025-09-08 21:48:06.000,领益智造：公司晋升为AMD核心供应商
财联社,2025-09-08 21:47:25.000,国家税务总局：8月份全国企业销售收入保持较快增长
同花顺,2025-09-08 21:46:26.000,挪威执政党所在阵营赢得议会选举
财联社,2025-09-08 21:46:25.000,特朗普政府请求最高法院允许其冻结数十亿美元对外援助
财联社,2025-09-08 21:45:44.000,【风口研报·洞察】上海开启AI应用补贴，支持“AI+数字广告”Agent研发，分析师看好AI广告商业逻辑清晰、价值相对明确，下游大型企业接受度较高；主线结构切换的方向在哪
同花顺,2025-09-08 21:45:42.000,中国地震台网：西藏那曲市双湖县发生4级地震
财联社,2025-09-08 21:43:25.000,财联社9月8日晚间新闻精选
财联社,2025-09-08 21:41:44.000,阿根廷股市盘中跌幅创2020年以来最大
财联社,2025-09-08 21:40:36.000,韩国将尼帕病毒感染列为一级传染病
同花顺,2025-09-08 21:37:03.000,杭州华澜微电子股份有限公司启动上市辅导
同花顺,2025-09-08 21:36:33.000,先临三维科技股份有限公司启动上市辅导
同花顺,2025-09-08 21:36:06.000,广东恒翼能科技股份有限公司启动上市辅导
财联社,2025-09-08 21:36:00.000,我国港口日均流动超94万个标箱
同花顺,2025-09-08 21:34:04.000,杭州玄机科技股份有限公司启动上市辅导
同花顺,2025-09-08 21:23:30.000,人工智能公司Nebius盘后涨幅扩大至50%
同花顺,2025-09-08 21:17:55.000,富时A50期指连续夜盘收跌0.01%，报14832点
同花顺,2025-09-08 21:14:22.000,微软与Nebius签署云协议，基础设施合同金额高达194亿美元
财联社,2025-09-08 21:09:58.000,【财联社早知道】苹果据悉今年将量产1亿部iPhone17系列手机，机构称新型号升级或驱动新一轮换机潮，这家苹果供应商已形成MIM零件+模组的发展模式；它在固态电池领域CNT供货量占据市场绝大部分份额
财联社,2025-09-08 21:09:46.000,AgRural：巴西2025/26年度大豆播种率为0.02% 去年同期播种尚未启动
财联社,2025-09-08 21:06:56.000,台风塔巴移入广西
财联社,2025-09-08 21:05:05.000,四维图新：拟以现金及资产形式参与PhiGent Robotics新一轮融资
财联社,2025-09-08 21:02:38.000,欧菲光：拟发行股份购买欧菲微电子28.2461%股权 交易价格17.91亿元
财联社,2025-09-08 20:57:24.000,通富微电：公司是AMD最大的封装测试供应商 为其封测CPU、GPU、服务器等产品
财联社,2025-09-08 20:56:57.000,现货黄金年内累计大涨1000美元/盎司 涨幅高达38%
财联社,2025-09-08 20:53:37.000,乾照光电：股东拟提前终止减持计划并承诺12月31日前不减持
同花顺,2025-09-08 20:52:03.000,一箭11星，我国成功发射吉利星座05组卫星
财联社,2025-09-08 20:51:23.000,联合化学：公司目前正在研发半导体新材料产品
财联社,2025-09-08 20:50:57.000,特斯拉美国电动车市场份额跌至38% 创近八年新低
财联社,2025-09-08 20:47:46.000,上海市市长会见韩国釜山市市长并签署协议 进一步深化友好城市关系
财联社,2025-09-08 20:44:09.000,高盟新材：已完成大尺寸偏光片用压敏胶中试工艺研究 项目处于送样阶段
财联社,2025-09-08 20:43:28.000,ST柯利达：控股股东拟协议转让不超过3000万股公司股份
财联社,2025-09-08 20:42:44.000,国家防总办公室向广东调拨990件中央应急抢险救灾物资
财联社,2025-09-08 20:38:45.000,固高科技：光远自动化与固丰拟合计减持不超过1.51%公司股份
同花顺,2025-09-08 20:20:50.000,戴尔首席财务官Yvonne McGill将离职
财联社,2025-09-08 20:03:52.000,华大九天：初步确定的本次询价转让价格为97.43元/股
财联社,2025-09-08 20:02:06.000,习近平出席金砖国家领导人线上峰会
财联社,2025-09-08 20:01:09.000,9月8日周一《新闻联播》要闻20条
财联社,2025-09-08 19:52:54.000,苹果据悉今年将量产1亿部iPhone17系列手机：ProMax领跑 Air产量最低
财联社,2025-09-08 19:52:21.000,独家|宇树科技：目前公司未讨论过IPO估值
财联社,2025-09-08 19:51:46.000,习近平将出席金砖国家领导人线上峰会
财联社,2025-09-08 19:48:32.000,【电报解读】OpenAl试图自研芯片控制成本！机构称ASIC相比GPU具有低成本、定制化的优势，2028年市场规模或占AI芯片的19%，有望带来两大领域投资机会，这家公司提供相关综合解决方案
财联社,2025-09-08 19:47:19.000,网络安全公司Netskope在美国IPO中寻求最高65亿美元估值
财联社,2025-09-08 19:43:47.000,王毅会见葡萄牙国务部长兼外长兰热尔
财联社,2025-09-08 19:42:43.000,贝莱德调查显示 24%的养老金计划考虑增添另类资产
财联社,2025-09-08 19:40:34.000,晶升股份：拟购买北京为准智能科技股份有限公司的控制权 股票复牌
同花顺,2025-09-08 19:40:00.000,美国纽交所将于9月13日进行市场范围的熔断测试
财联社,2025-09-08 19:37:59.000,【机构调研】这家智能装备制造商在手订单已超过去年全年水平
财联社,2025-09-08 19:36:31.000,中芯国际：拟发行股份购买中芯北方49%股权 股票复牌
财联社,2025-09-08 19:33:52.000,宸展光电：股东松堡投资拟减持不超过3%公司股份
财联社,2025-09-08 19:32:10.000,财政部部长蓝佛安会见新开发银行行长罗塞芙
财联社,2025-09-08 19:27:30.000,研究：带状疱疹疫苗可能降低心脏病及中风风险
同花顺,2025-09-08 19:06:54.000,美国7月消费者信贷增加160.1亿美元
财联社,2025-09-08 19:05:23.000,14家基金公司获批二批科创债ETF
同花顺,2025-09-08 19:05:15.000,美国参议院银行委员会将于9月10日就米兰的美联储理事提名进行投票
财联社,2025-09-08 19:04:48.000,Strategy在9月2日至9月7日期间以总价2.17亿美元购入1955枚比特币
财联社,2025-09-08 19:01:07.000,四川省成都市人大常委会党组副书记谢瑞武接受审查调查
财联社,2025-09-08 18:59:48.000,万通发展：完成对数渡科技增资及相关股权收购
财联社,2025-09-08 18:57:33.000,周大生：与无忧传媒等共同投资设立合资公司
财联社,2025-09-08 18:53:52.000,上海启动未来产业试验场项目储备库工作
财联社,2025-09-08 18:49:32.000,金鸿顺：股东高德投资拟以19.593元/股协议转让13%公司股份
财联社,2025-09-08 18:47:49.000,欧盟称将与美方讨论对俄制裁方案
财联社,2025-09-08 18:43:23.000,韩国拟对涉华碳钢及合金钢热轧板卷征收临时反倾销税
同花顺,2025-09-08 18:39:05.000,谷歌：已解决谷歌会议（Google Meet）用户遇到的问题
财联社,2025-09-08 18:36:51.000,回声星通信将以约170亿美元的价格向SpaceX出售频谱许可
财联社,2025-09-08 18:35:59.000,上周无新增IPO受理企业
同花顺,2025-09-08 18:35:06.000,上期所原油期货夜盘收涨0.84%
财联社,2025-09-08 18:32:50.000,越南对涉华木纤维板作出反倾销初裁
同花顺,2025-09-08 18:31:15.000,标普确认墨西哥展望维持稳定
同花顺,2025-09-08 18:16:46.000,墨西哥一火车与客运巴士相撞 已致8死45伤
同花顺,2025-09-08 18:04:24.000,谷歌会议（Google Meet）在美国出现14259次故障
财联社,2025-09-08 18:04:17.000,五年内预计“烧钱”超千亿美元 OpenAl试图自研芯片控制成本
财联社,2025-09-08 18:02:20.000,第22届东博会即将推出国内首个会展智能体
财联社,2025-09-08 17:59:34.000,*ST苏吴：全资子公司犯骗取进出口退税罪 被判处罚金八百万元
财联社,2025-09-08 17:55:58.000,长春高新：子公司金赛药业GS3-007a干混悬剂境内生产药品注册临床试验申请获受理
财联社,2025-09-08 17:53:49.000,以色列警方：耶路撒冷枪击事件枪手来自约旦河西岸
财联社,2025-09-08 17:49:19.000,持续干旱 韩国一城市发布“限水令”
财联社,2025-09-08 17:46:26.000,龙佰集团：子公司发生安全事故致5人死亡 已暂时停业整顿
财联社,2025-09-08 17:45:17.000,富力地产向债券持有人公布境内债重组方案 提供包括现金购回等选项
财联社,2025-09-08 17:44:20.000,南向资金今日净买入约167亿港元 阿里巴巴获净买入居前
财联社,2025-09-08 17:43:55.000,“丝路海运”新增命名15条航线 总航线达148条
财联社,2025-09-08 17:42:13.000,厦钨新能：减持计划实施期间宁波海诚已减持0.9%公司股份
财联社,2025-09-08 17:40:22.000,中汽协：1-7月汽车零部件产品出口金额累计达556.1亿美元 同比增长4.4%
财联社,2025-09-08 17:40:17.000,电气风电：控股股东上海电气拟减持不超过1.00%公司股份
财联社,2025-09-08 17:39:37.000,联得装备：成为京东方第8.6代AMOLED生产线项目第一中标候选人
财联社,2025-09-08 17:37:12.000,威胜控股：两家附属公司中标南方电网订单 涉资约3.7亿元
财联社,2025-09-08 17:35:58.000,线上线下：控股股东变更为深蕾科技 实控人变更为夏军、李蔚
同花顺,2025-09-08 17:34:31.000,优步计划明年在慕尼黑开展自动驾驶测试 股价上涨3.6%
财联社,2025-09-08 17:04:55.000,Uber与Momenta计划明年在德国测试L4级自动驾驶
财联社,2025-09-08 17:03:20.000,江特电机：实控人之一王新间接增持公司股份 持股比例升至9.29%
同花顺,2025-09-08 17:01:02.000,法国总理贝鲁在国民议会不信任投票中失利，将需提交辞呈
同花顺,2025-09-08 17:01:02.000,法国总理贝鲁在国民议会信任投票中失利，将需提交辞呈
财联社,2025-09-08 16:59:46.000,华鲁恒升：20万吨/年二元酸项目投产
财联社,2025-09-08 16:58:13.000,保诚：以约270万英镑回购约28万股
财联社,2025-09-08 16:56:50.000,冰雹、暴雨、大风、雷电 上海“四黄”预警高挂
财联社,2025-09-08 16:56:36.000,昭衍新药：董事、监事及高管拟合计减持不超过0.1132%公司股份
财联社,2025-09-08 16:55:05.000,2025成都国际车展成交金额57.53亿元
同花顺,2025-09-08 16:53:06.000,中概股36氪股票盘中已经累计熔断16次
财联社,2025-09-08 16:50:57.000,商务部：推动年底前正式签署中国—东盟自贸区3.0版议定书
财联社,2025-09-08 16:49:42.000,安德利果汁：以约1.13亿港元回购651.2万股
财联社,2025-09-08 16:49:05.000,汇丰控股：在港交所等交易所回购约346万股
财联社,2025-09-08 16:47:19.000,江淮汽车：8月销量同比下降13.23%
财联社,2025-09-08 16:44:11.000,市场监管总局印发行动方案 推动计量技术规范提档升级
财联社,2025-09-08 16:42:17.000,华商基金旗下基金一日售罄 500万自购
财联社,2025-09-08 16:40:07.000,香港证监会谴责极讯亚太没有向联交所申报交叉盘买卖并处以罚款800万港元
同花顺,2025-09-08 16:07:48.000,因泄露机密信息，小米中国区市场部总经理王腾被辞退！本人发文道歉！
财联社,2025-09-08 16:05:52.000,易德龙：凯恩贝拉基金累计减持245.25万股公司股份
财联社,2025-09-08 16:03:06.000,国家能源局：防范违规代办电力业务资质许可
同花顺,2025-09-08 16:02:30.000,36氪恢复交易后涨幅收窄至192%
财联社,2025-09-08 15:58:03.000,小商品城：拟设立全球数贸中心酒店分公司
财联社,2025-09-08 15:56:03.000,海康威视：完成6832.68万股股份注销
同花顺,2025-09-08 15:52:03.000,中概股36氪恢复交易后股价回落，涨幅收窄至245%后再次熔断
财联社,2025-09-08 15:51:06.000,美联新材：已批量交付半固态电池凝胶隔膜
财联社,2025-09-08 15:50:13.000,9月8日连板股分析：两市逾百股涨超9% 连板股晋级率近六成
财联社,2025-09-08 15:49:14.000,正裕工业：设立控股子公司斐博森公司 致力于机器人用柔性触觉传感技术的研发等
财联社,2025-09-08 15:47:37.000,大北农：2025年8月份生猪销售收入11.21亿元
财联社,2025-09-08 15:47:13.000,今起育儿补贴申领正式全面开放
财联社,2025-09-08 15:46:58.000,杭州征求意见：到2030年 数字经济核心产业增加值占GDP的31.5%以上
财联社,2025-09-08 15:46:52.000,杭州征求意见：到2030年人工智能核心产业营业收入超6000亿元、规上企业超1000家
财联社,2025-09-08 15:46:22.000,我国拟修改对外贸易法 将部分改革举措上升为法律制度
财联社,2025-09-08 15:46:14.000,大秦铁路：8月大秦线完成货物运输量3230万吨 同比增长3.03%
同花顺,2025-09-08 15:44:09.000,中概股36氪第六次触发熔断，熔断前大涨307%
财联社,2025-09-08 15:42:58.000,中方回应美方：坚决反对，中国是法治国家，根本不存在所谓错误拘押问题
财联社,2025-09-08 15:42:15.000,西班牙将批准对以色列实施武器禁运的法令
财联社,2025-09-08 15:40:48.000,第六次中韩法制计量合作委员会会议在西安召开
同花顺,2025-09-08 15:23:07.000,中概股36氪涨幅达180%，此前已经四次触发熔断
同花顺,2025-09-08 15:10:23.000,特朗普表示，预计与大学达成“更多和解”
同花顺,2025-09-08 15:04:19.000,成都华微：签署1.05亿元采购框架协议
财联社,2025-09-08 15:03:58.000,收评：沪指窄幅震荡涨0.38% 机器人概念股爆发
财联社,2025-09-08 15:03:24.000,伊朗外长重申愿意限制核活动换取制裁解除
同花顺,2025-09-08 15:02:23.000,京东超市：未来三年用户数从3亿将增至5亿
财联社,2025-09-08 15:01:35.000,国内商品期货多数收涨 玻璃涨超3%
同花顺,2025-09-08 14:58:16.000,沪金主力合约持续走高
同花顺,2025-09-08 14:56:45.000,现货黄金站上3640美元
财联社,2025-09-08 14:55:20.000,佛山一涉宅用地8.53亿元成交 溢价率2%
同花顺,2025-09-08 14:55:03.000,俄外交部召见阿根廷大使 否认监听指控并要求阿方解释
同花顺,2025-09-08 14:53:39.000,36氪再次出发熔断，熔断前涨幅达86.83%
财联社,2025-09-08 14:52:06.000,高盛：由于美联储预期降息 预计到2026年中期标普500指数将上涨6%
财联社,2025-09-08 14:52:04.000,【盘中宝】欧盟发布54亿欧元核聚变投资计划，机构称可控核聚变行业进入快速孵化阶段，有望逐渐迈向商业化阶段，这家企业掌握细分技术
财联社,2025-09-08 14:46:59.000,河北自贸区产业投资集团增资至130亿 增幅约2067%
同花顺,2025-09-08 14:46:30.000,据港交所文件：安徽希磁科技股份有限公司向港交所提交上市申请书
