来源,时间,标题
财联社,2025-11-04 15:00:18.000,Xanadu拟借道SPAC赴美上市 抢占纯光子量子计算第一股
财联社,2025-11-04 14:58:49.000,瑞银证券孟磊：A股市场中期展望依然向好 创业板具有较好风险收益比
同花顺,2025-11-04 14:57:31.000,现货黄金短线反弹近20美元
财联社,2025-11-04 14:51:26.000,任天堂第二财季经营利润882.5亿日元 同比增长32%
财联社,2025-11-04 14:42:33.000,美媒称英再向乌提供风暴之影导弹
同花顺,2025-11-04 14:41:49.000,华荣股份：回购股份金额上限更正为不超过人民币8000万元
财联社,2025-11-04 14:41:41.000,穆迪：澳洲联储料维持观望 最早2026年中才可能降息
财联社,2025-11-04 14:40:20.000,商务部副部长李成钢会见通用电气能源集团全球副总裁思睿迈
财联社,2025-11-04 14:38:14.000,公募基金业绩比较基准要素库已下发 按季度评估
财联社,2025-11-04 14:37:03.000,空间站钥匙完成交接 神二十航天员准备回家
同花顺,2025-11-04 14:35:53.000,纳斯达克中国金龙指数盘初跌超2%
同花顺,2025-11-04 14:30:57.000,现货黄金失守3960美元/盎司
同花顺,2025-11-04 14:30:42.000,美股开盘：三大指数集体低开
财联社,2025-11-04 14:28:30.000,日本财长再发汇率警告 当局干预预期升温
同花顺,2025-11-04 14:25:19.000,万事达美股盘前涨超5%
同花顺,2025-11-04 14:24:56.000,应用材料美股盘前跌超7%
财联社,2025-11-04 14:22:04.000,冰雪产业概念股逆势拉升 大连圣亚涨停创新高
财联社,2025-11-04 14:21:58.000,全国冬小麦播种过四成
财联社,2025-11-04 14:20:51.000,主力资金监控：阳光电源净卖出超12亿
同花顺,2025-11-04 14:18:43.000,近600位基金经理管理规模不足2亿元
同花顺,2025-11-04 14:15:12.000,零跑汽车回应一汽收购其股权：相关报道不实
财联社,2025-11-04 14:06:20.000,加拿大政府：欢迎中国恢复公民赴加团队游业务的决定
财联社,2025-11-04 14:02:43.000,苹果网页版AppStore可搜索、浏览 无需苹果设备也能访问体验
财联社,2025-11-04 14:02:00.000,中国国产船用仪器打破国外垄断 首获欧洲高端船舶订单
财联社,2025-11-04 13:59:24.000,沪深两市成交额突破1.5万亿 较昨日此时缩量超2200亿
财联社,2025-11-04 13:59:12.000,贵金属概念持续调整 国城矿业触及跌停
同花顺,2025-11-04 13:55:24.000,香港功夫巨星元彪品鉴茅台酒
财联社,2025-11-04 13:54:15.000,商务部新闻发言人就安世半导体相关问题应询答记者问
财联社,2025-11-04 13:53:36.000,【盘中宝】总规模或将在2025年突破万亿元，该产业未来或将成为我国内需消费的重要增长点，这家公司近年来承接过多个相关工程项目
同花顺,2025-11-04 13:53:21.000,现货白银跌幅扩大至1%
财联社,2025-11-04 13:51:12.000,创业板指跌逾2% 下跌个股近4000只
同花顺,2025-11-04 13:47:37.000,越疆机器人与浪潮云正式签署全球战略合作协议
同花顺,2025-11-04 13:47:22.000,港科大与西藏生态监测中心签署高原生态保护合作协议
财联社,2025-11-04 13:43:42.000,午后抗流感概念局部异动 华兰疫苗涨超10%
财联社,2025-11-04 13:39:08.000,香港金管局总裁余伟文：密切留意传统金融服务面临的新维度和挑战
同花顺,2025-11-04 13:33:06.000,双枪科技：科发资本、张美云拟分别减持0.11%和0.10%股份
同花顺,2025-11-04 13:30:48.000,台积电美股盘前跌超2%
财联社,2025-11-04 13:28:27.000,印度对涉华丁基橡胶发起反倾销调查
同花顺,2025-11-04 13:28:10.000,中晶科技：股东隆基绿能、董事郭兵健拟合计减持不超3.66%股份
财联社,2025-11-04 13:27:15.000,俄罗斯一石化厂遭无人机袭击发生爆炸
同花顺,2025-11-04 13:23:41.000,南京大学、影石创新、栖霞区签订战略合作协议
同花顺,2025-11-04 13:08:11.000,英集芯：北京芯动能投资基金持股比例降至4.82%
同花顺,2025-11-04 13:05:52.000,海陆重工参与钍基熔盐实验堆项目
财联社,2025-11-04 13:03:29.000,SK海力士年内飙涨近240% 韩国交易所罕见发出投资谨慎提示
同花顺,2025-11-04 12:54:33.000,硕腾美股盘前跌超10%
财联社,2025-11-04 12:54:24.000,国资委：因地制宜培育壮大新兴产业和未来产业 努力开辟增长“第二曲线”
财联社,2025-11-04 12:53:25.000,全国工商联：加快传统产业升级和新兴产业培育 锻造企业的硬核实力 自觉抵制内卷式竞争
财联社,2025-11-04 12:51:24.000,首创沪语交互AI应用 上海银行携手财跃星辰、阶跃星辰共创智慧养老金融服务新范式
同花顺,2025-11-04 12:49:40.000,京东双11手机榜：苹果登顶销冠，小米摘国产第一
同花顺,2025-11-04 12:49:23.000,证监会副主席李明：将进一步深化内地与香港资本市场务实合作
同花顺,2025-11-04 12:48:10.000,赢合科技：董事王君拟减持2700股
财联社,2025-11-04 12:42:16.000,【机构调研】这家高端半导体设备供应商新品类产品多点突破，12英寸晶圆边缘修整装备批量出货
同花顺,2025-11-04 12:35:08.000,何立峰会见美国高盛集团董事长兼首席执行官苏德巍
财联社,2025-11-04 12:31:53.000,国资委：贯彻“应给尽给、能给尽给”的政策导向 持续支持中央企业优化科技创新机制
同花顺,2025-11-04 12:30:13.000,小鹏汽车重启Robotaxi项目，内部转岗进行时
同花顺,2025-11-04 12:29:41.000,达意隆：股东乐丰投资已减持3%公司股份
同花顺,2025-11-04 12:29:20.000,雷迪克：拟以1.6亿元取得机器人与脑机接口公司傲意科技20.41%股权
同花顺,2025-11-04 12:29:11.000,智己旗舰SUV LS9亮相，33.69万元起售
同花顺,2025-11-04 12:28:45.000,神州信息：股东申昌科技累计减持950万股 减持计划已实施完成
财联社,2025-11-04 12:28:38.000,秘鲁宣布与墨西哥断交 墨外交部回应
财联社,2025-11-04 12:27:36.000,贸促会会长任鸿斌：推动中加关系早日回到健康、稳定、可持续的正确轨道
同花顺,2025-11-04 12:20:45.000,OPPO客服回应多款网易游戏停运OPPO渠道服：相关合作到期
财联社,2025-11-04 12:19:43.000,浙江台州“第一高楼”将被拍卖 资产包起拍价28.7亿元
同花顺,2025-11-04 12:19:30.000,世粮署：加沙家庭仍在为温饱而挣扎
财联社,2025-11-04 12:19:15.000,改造原上汽通用北盛工厂（三期）？吉利汽车：正积极研究并探讨多种扩产方案
财联社,2025-11-04 12:17:45.000,何立峰在香港国际金融领袖投资峰会上发表视频致辞
同花顺,2025-11-04 12:16:05.000,杭汽轮Ｂ：公司股票将自11月5日起停牌直至终止上市
财联社,2025-11-04 12:15:35.000,深圳机场口岸今年以来通关量超过去年全年 免签入境外国人增长
财联社,2025-11-04 12:14:48.000,前10月地方政府发债同比增23%
同花顺,2025-11-04 12:08:06.000,中国通号微小目标探测雷达获得国家无线电发射设备型号核准证书
财联社,2025-11-04 12:05:24.000,习近平会见俄罗斯总理米舒斯京
财联社,2025-11-04 12:00:58.000,白家犯罪集团案一审宣判：白所成等5人被判死刑
同花顺,2025-11-04 12:00:18.000,Shopify美股盘前跌超5%
财联社,2025-11-04 12:00:15.000,港股午评：恒生指数涨0.20% 恒生科技指数跌0.20%
同花顺,2025-11-04 12:00:15.000,广西加快推动关键金属产业创新发展
财联社,2025-11-04 11:59:32.000,美财长将出席最高法院关于特朗普关税政策合法性听证会
同花顺,2025-11-04 11:59:24.000,星源卓镁：公司收到客户项目定点通知，预计未来4年销售总金额约为20.21亿元
同花顺,2025-11-04 11:59:03.000,蓝黛科技：子公司拟出售资产 转让对价为1.1亿元
同花顺,2025-11-04 11:55:48.000,优步美股盘前跌超6%
同花顺,2025-11-04 11:53:36.000,20CM两连板宝色股份：公司未涉及媒体报道的“2MWt液态燃料钍基熔盐实验堆（TMSR-LF1）项目”业务
财联社,2025-11-04 11:51:18.000,河南多地启动重污染天气橙色预警响应
同花顺,2025-11-04 11:51:13.000,挪威邮轮美股盘前跌超10%
同花顺,2025-11-04 11:50:33.000,实达集团：拟购买数产名商95%股权，预计交易价格1.85亿元
同花顺,2025-11-04 11:50:25.000,德生科技：实控人虢晓彬已减持0.51%公司股份
财联社,2025-11-04 11:46:35.000,新研究：格陵兰岛面积“缩水”且缓慢向西北漂移
同花顺,2025-11-04 11:46:03.000,辉瑞2025年Q3营收166.5亿美元，市场预期165.9亿美元，上年同期177.02亿美元
同花顺,2025-11-04 11:45:34.000,浙江省空港口岸实现离境退税服务全覆盖
财联社,2025-11-04 11:43:10.000,11月4日午间涨停分析
财联社,2025-11-04 11:40:53.000,李成钢国际贸易谈判代表兼副部长会见加中贸易理事会主席德马雷并出席加中贸易理事会第47届年会
同花顺,2025-11-04 11:39:51.000,利仁科技：利仁投资已减持0.0779%股份
同花顺,2025-11-04 11:39:31.000,大叶股份：德创骏博已减持0.86%公司股份
同花顺,2025-11-04 11:35:02.000,福泰制药美股盘前跌超5%
同花顺,2025-11-04 11:34:57.000,科大讯飞无锡产业加速中心启用
同花顺,2025-11-04 11:34:43.000,美国前副总统切尼去世，被认为曾鼓动小布什发动伊拉克战争
财联社,2025-11-04 11:34:10.000,【大佬持仓跟踪】国产软件+AI智能体+鸿蒙，金融AI智能体业务已取得数亿收入，开源鸿蒙软件发行版数量在社区位列第一，这家公司银行业IT解决方案份额连续5年国内第一
同花顺,2025-11-04 11:33:34.000,百胜中国：第三季度经营利润同比增长8%至4亿美元
财联社,2025-11-04 11:32:50.000,"贵州省国防科技工业办公室原主任李刚被""双开"""
财联社,2025-11-04 11:31:21.000,午评：深成指、创业板指半日均跌超1% 福建板块逆势上扬
财联社,2025-11-04 11:28:51.000,AI大模型实时投资比赛“Alpha Arena”结果出炉：阿里千问Qwen夺冠
财联社,2025-11-04 11:24:03.000,【盘中宝】这类产品扮演“智驾大脑”的重要角色，是承载大幅增长的计算需求的重要载体，这家公司相产品通过车规认证并稳定量产多代
财联社,2025-11-04 11:20:26.000,美防长下令军方人员未经批准不得与国会接触
财联社,2025-11-04 11:17:19.000,冰雪经济概念逆势活跃 雪人集团直线涨停
财联社,2025-11-04 11:14:29.000,“太空交接”完成！神二十航天员11月5日返回地球
财联社,2025-11-04 11:14:19.000,2025年国谈落幕：创新药目录降价建议区间或为15%～50%
财联社,2025-11-04 11:10:37.000,量子科技概念局部回暖 科大国创涨近10%
财联社,2025-11-04 11:07:44.000,内蒙古培育重点产业引导基金成立 出资额86.75亿元
财联社,2025-11-04 11:05:14.000,工业和信息化部电子信息司赴华为开展“十五五”电子信息制造业发展规划调研
财联社,2025-11-04 11:01:49.000,黄金概念走弱 多股跌超3%
同花顺,2025-11-04 11:01:32.000,公募基金业绩比较基准要素库及运作说明已下发至行业机构
同花顺,2025-11-04 11:01:11.000,Spotify Technology美股盘前涨超6%
同花顺,2025-11-04 10:56:18.000,同程旅行携手顺丰速运推动会员体系互通
同花顺,2025-11-04 10:56:01.000,2025年6G发展大会下周在北京举办
财联社,2025-11-04 10:55:51.000,主力资金监控：计算机板块净流出超75亿
财联社,2025-11-04 10:50:40.000,习近平就牙买加遭受飓风灾害向牙买加总督艾伦致慰问电 李强向牙买加总理霍尔尼斯致慰问电
同花顺,2025-11-04 10:47:40.000,第八届进博会进境展品通关基本完成
同花顺,2025-11-04 10:45:37.000,震有科技：一致行动人协议转让5.00%股份完成过户登记
同花顺,2025-11-04 10:45:28.000,天合光能：有则创投已减持0.5724%
财联社,2025-11-04 10:45:24.000,沪深两市成交额突破1万亿 较昨日此时缩量超1500亿
财联社,2025-11-04 10:44:25.000,创业板指跌逾1% 下跌个股近3700只
财联社,2025-11-04 10:39:27.000,七国外长一致同意维护加沙停火协议
同花顺,2025-11-04 10:39:20.000,广汇物流：累计已回购股数1477.04万股
财联社,2025-11-04 10:39:10.000,深圳鲲鹏资本等成立鲲航投资合伙企业 出资额78.41亿
同花顺,2025-11-04 10:39:04.000,方正证券：中国信达三月内拟减持1.00%
财联社,2025-11-04 10:37:14.000,受台风“海鸥”影响，进出海南岛列车停运
同花顺,2025-11-04 10:37:00.000,力拓CEO：“十五五”规划建议为国际矿产巨头在华发展指明了方向
同花顺,2025-11-04 10:34:18.000,宁波中百：张江波拟减持1%股份
财联社,2025-11-04 10:32:17.000,短剧概念震荡回升 欢瑞世纪触及涨停
同花顺,2025-11-04 10:31:00.000,2025年药品目录谈判协商结果将于12月第一个周末公布
同花顺,2025-11-04 10:30:31.000,九号公司：股东拟减持0.04%
同花顺,2025-11-04 10:27:54.000,药易购：拟补缴企业所得税及滞纳金合计约645.11万元
财联社,2025-11-04 10:27:10.000,华润置地预计在本月发行约10亿美元离岸债券？华润置地相关人士：不予置评
同花顺,2025-11-04 10:25:21.000,益诺思：张江生药基地拟受让422.94万股股份
同花顺,2025-11-04 10:23:20.000,*ST阳光：控股股东京基集团解除质押23.98%公司股份
财联社,2025-11-04 10:23:15.000,百度集团涨超5% 萝卜快跑周全无人订单量超过25万宗
财联社,2025-11-04 10:22:45.000,银行板块震荡拉升 厦门银行涨近5%
同花顺,2025-11-04 10:20:41.000,Fabrinet美股盘前涨超11%
同花顺,2025-11-04 10:20:35.000,市场监管总局召回中心与中国家用电器研究院签署合作框架协议
财联社,2025-11-04 10:20:15.000,证监会副主席李明：系统谋划推出更多有力度的开放举措
财联社,2025-11-04 10:14:17.000,半导体设备股震荡反弹 中微公司涨超7%
财联社,2025-11-04 10:12:11.000,习近平将会见俄罗斯总理米舒斯京
财联社,2025-11-04 10:11:48.000,蚂蚁集团等成立创新数谷创业投资合伙企业 出资额6亿
财新网,2025-11-04 10:11:45.665,海洋产业稳定增长
财联社,2025-11-04 10:06:19.000,金融监管总局副局长周亮：进一步完善内地与香港金融监管合作机制和政策框架
财联社,2025-11-04 10:06:10.000,国家卫健委等部门：加快智能理疗技术推广应用 支持符合条件的人工智能产品进入临床试验
同花顺,2025-11-04 10:05:06.000,中炬高新：黎汝雄已增持0.0129%
财联社,2025-11-04 10:04:50.000,江苏省市场监督管理局原局长朱勤虎接受审查调查
财联社,2025-11-04 10:04:21.000,中国人民银行副行长陆磊：9月末已有1176家境外机构进入境内债券市场 持债规模达3.8万亿元
财联社,2025-11-04 10:03:28.000,金融监管总局副局长周亮：支持港资机构来内地发展
财联社,2025-11-04 10:03:07.000,国家卫健委等部门联合发布《关于促进和规范“人工智能+医疗卫生”应用发展的实施意见》
财联社,2025-11-04 10:02:58.000,贵州：深入实施“白酒+”产业融合行动 制定白酒出口三年行动计划和目录指引
财联社,2025-11-04 10:02:34.000,贵州：鼓励企业发扬和传承酱酒工艺 研制低度酒、风味白酒、果味酒、中式鸡尾酒以及适应不同场景的基酒产品
财联社,2025-11-04 10:01:23.000,开盘半小时两市缩量超1200亿 预计全天成交超1.8万亿
财联社,2025-11-04 10:00:54.000,国家烟草专卖局原党组成员、副局长张天峰被提起公诉
同花顺,2025-11-04 09:59:34.000,宁德时代：累计回购1599.08万股 总金额为人民币43.86亿元
财联社,2025-11-04 09:58:59.000,李家超：香港前10月IPO募资额排名全球第一
同花顺,2025-11-04 09:58:56.000,威高血净：正在推进以发行股份的方式购买威高普瑞100%股权
同花顺,2025-11-04 09:57:39.000,亚马逊美股盘前跌超2%
同花顺,2025-11-04 09:57:21.000,谷歌A美股盘前跌超2%
同花顺,2025-11-04 09:55:04.000,影石创新回应市场份额下降：第三方数据准确性存疑
同花顺,2025-11-04 09:53:26.000,真爱美家：筹划控制权变更事项 自2025年11月5日起停牌
同花顺,2025-11-04 09:52:28.000,鑫宏业：机器人专用线缆已批量下线 开启规模化量产
同花顺,2025-11-04 09:50:43.000,立讯精密在江西成立智能装备公司 注册资本1000万
同花顺,2025-11-04 09:48:18.000,欧洲斯托克600指数下跌逾1.5%
同花顺,2025-11-04 09:47:09.000,英伟达美股盘前跌超2%
同花顺,2025-11-04 09:47:00.000,中冶京诚与华为签署战略合作协议
同花顺,2025-11-04 09:44:42.000,利群股份：董事胡培峰拟减持0.08%
同花顺,2025-11-04 09:44:37.000,京东方联合英特尔推出首款AI驱动多频显示解决方案
同花顺,2025-11-04 09:44:18.000,西班牙电信美股盘前跌超10%
同花顺,2025-11-04 09:43:18.000,多款网易游戏停运OPPO渠道服，OPPO客服：相关合作到期
同花顺,2025-11-04 09:42:44.000,苏利股份：沽盛投资拟减持0.4816%
财联社,2025-11-04 09:32:09.000,芳香胺概念延续强势 百合花等多股2连板
财联社,2025-11-04 09:27:30.000,竞价看龙头
财联社,2025-11-04 09:26:46.000,央行副行长陆磊：把握好政策支持力度和节奏 抓好各项货币政策工具的实施和执行
财联社,2025-11-04 09:26:09.000,三大指数集体低开
财联社,2025-11-04 09:24:26.000,美旅游协会警告：政府“停摆”或引发节日出行混乱
财联社,2025-11-04 09:21:25.000,【盘中宝】前三季度全球装机同比增近70%，机构称该行业在AI数据中心应用有望迎来大发展，这家企业相关产品明年出货量有望增超50%，海外订单占比大幅提升
财联社,2025-11-04 09:21:16.000,央行公开市场今日净回笼3578亿元
财联社,2025-11-04 09:21:03.000,香港恒生指数开盘跌0.04%
财联社,2025-11-04 09:18:57.000,中国石化和LG化学宣布联合开发钠离子电池材料
财联社,2025-11-04 09:08:09.000,中央网信办：11月4日至12月20日开展“清朗·十五运会和残特奥会网络环境整治”专项行动
同花顺,2025-11-04 09:06:19.000,花旗集团对中兴通讯H股的多头持仓比例增至8.05%
同花顺,2025-11-04 09:05:07.000,特斯拉美股盘前跌超2%
同花顺,2025-11-04 09:04:21.000,阿里通义千问推出Qwen3-Max-Thinking尝鲜版
财联社,2025-11-04 09:03:25.000,部分存储封测厂商计划涨价
同花顺,2025-11-04 09:02:46.000,央行：将开展7000亿元买断式逆回购操作
同花顺,2025-11-04 09:02:37.000,国务院办公厅发关于2026年部分节假日安排的通知
同花顺,2025-11-04 09:02:19.000,Palantir美股盘前跌超5%
同花顺,2025-11-04 09:01:35.000,美股科技“七姐妹”盘前普跌，特斯拉跌1%
同花顺,2025-11-04 09:01:27.000,美股中概股盘前多数下跌，百度涨3%
财联社,2025-11-04 09:00:44.000,国内商品期货开盘涨跌不一
财联社,2025-11-04 09:00:25.000,较强冷空气明起登场 新一轮雨雪天气将自西向东影响我国
同花顺,2025-11-04 09:00:05.000,南非贸工部海外首个办公室落地深圳
同花顺,2025-11-04 08:57:49.000,布伦特原油失守64美元/桶
同花顺,2025-11-04 08:57:07.000,招商轮船今日跌9.54%，有2家机构专用席位净卖出1.24亿元
财联社,2025-11-04 08:56:54.000,高盛：上调比亚迪A股和H股目标价
同花顺,2025-11-04 08:53:43.000,江航装备：副总经理、总会计师孙军因工作安排辞职
同花顺,2025-11-04 08:49:44.000,乘联数据综合预估：10月全国新能源乘用车厂商批发销量161万辆，同比增长16%
财联社,2025-11-04 08:48:57.000,均胜电子：H股发行的最终价格为每股22港元
同花顺,2025-11-04 08:48:46.000,"乘联分会：特斯拉10月份中国制造汽车销量为61,497辆"
同花顺,2025-11-04 08:48:18.000,中国石化本届进博会采购签约超409亿美元
同花顺,2025-11-04 08:44:41.000,华熙生物：国寿成达拟减持2.00%
同花顺,2025-11-04 08:44:10.000,国脉文化：公司收到政府补助378万元
财联社,2025-11-04 08:13:14.000,【九点特供】AI时代以来首次长期涨价行动！台积电启动“连续4年涨价”，分析师看好晶圆代工行业未来几年都有望保持增长态势，这家公司在上海有三座8英寸晶圆厂；逼近12万元/吨，六氟磷酸锂1个月涨幅接近翻倍
财联社,2025-11-04 08:08:18.000,韩正会见卡塔尔埃米尔塔米姆
同花顺,2025-11-04 08:03:37.000,国科恒泰：取得医疗器械订单处理发明专利
同花顺,2025-11-04 08:03:09.000,乐普医疗：可充电植入式脑深部神经刺激器系统产品获NMPA注册批准
同花顺,2025-11-04 08:02:58.000,佛塑科技：全资子公司易事达公司通过国家级专精特新“小巨人”企业认定
财联社,2025-11-04 08:02:52.000,财联社11月4日早间新闻精选
同花顺,2025-11-04 08:01:01.000,欧股开盘普跌
财联社,2025-11-04 08:00:56.000,【点金互动易】钍基熔盐堆+核电，深度参与首台套钍基熔盐堆项目，这家公司攻克项目重大难题获嘉奖，并成功向法国电力交付核电零部件
财联社,2025-11-04 07:59:58.000,俄称打击乌军工企业 乌称打击俄能源设施
同花顺,2025-11-04 07:54:25.000,万辰集团：拟向江苏省慈善总会捐赠500万元
同花顺,2025-11-04 07:54:04.000,格尔软件：收到政府补助407.4万元
财联社,2025-11-04 07:52:27.000,海兰信：全资子公司联合中标三亚崖州湾科技城海洋科学观测网及岸基保障基地项目
同花顺,2025-11-04 07:49:36.000,金石亚药：子公司双氯芬酸钠缓释片通过仿制药一致性评价
同花顺,2025-11-04 07:48:36.000,千里科技：10月销量增111.44%
同花顺,2025-11-04 07:47:48.000,远东股份：子公司中标10.62亿元合同订单
同花顺,2025-11-04 07:46:47.000,工业富联：累计回购0.04%公司股份，已回购金额1.47亿元
同花顺,2025-11-04 07:46:28.000,上海新能源汽车推广规模居全球城市首位
财联社,2025-11-04 07:46:07.000,投资日历：周二资本市场大事提醒
财联社,2025-11-04 07:45:57.000,丁薛祥在人民日报发表署名文章：“十五五”时期经济社会发展的主要目标
财联社,2025-11-04 07:45:48.000,中信建投：坚定看好人形机器人产业趋势 聚集T链和国产链确定性企业
同花顺,2025-11-04 07:42:01.000,中密控股：公司业务暂未涉及固态硫化物锂电池产线
同花顺,2025-11-04 07:40:12.000,泉阳泉：控股子公司中标1.48亿元项目
财联社,2025-11-04 07:38:25.000,中国驻美大使谢锋：“十五五”规划将为中美合作带来更大机遇
财联社,2025-11-04 07:37:03.000,A股限售股解禁一览：17.4亿元市值限售股今日解禁
同花顺,2025-11-04 07:36:09.000,太平洋：董事杨智峰离任
财联社,2025-11-04 07:35:33.000,中国驻美大使谢锋：中美应相互支持办好2026年APEC和G20会议
同花顺,2025-11-04 07:34:40.000,宇通客车：10月销量同比降5.62%
财联社,2025-11-04 07:34:34.000,中国驻美大使谢锋：要胸怀大格局、多算长远账，探索新时期中美正确相处之道
同花顺,2025-11-04 07:33:51.000,津药药业：子公司药品通过仿制药一致性评价
同花顺,2025-11-04 07:33:33.000,广安爱众：副总经理刘波、罗晓霞辞职
财联社,2025-11-04 07:27:50.000,近七成有色股前三季度净利增长
同花顺,2025-11-04 07:23:14.000,诺基亚计划申请从巴黎证券交易所退市
财联社,2025-11-04 07:22:23.000,银行美元定存利率普遍降至3%左右
同花顺,2025-11-04 07:20:07.000,委内瑞拉向中俄伊寻求导弹 外交部：中委合作不针对第三方
同花顺,2025-11-04 07:06:02.000,爱玛科技成立进出口贸易新公司
财联社,2025-11-04 07:04:19.000,超2100亿港元 港股前10月IPO募资额领跑全球
财联社,2025-11-04 07:03:47.000,受益储能需求大爆发 碳酸锂产业熬过寒冬春山在望
财联社,2025-11-04 07:03:09.000,短剧带货成“双11”新战场 电商与内容平台竞逐新赛道
同花顺,2025-11-04 07:02:39.000,ETF收评：亚太精选ETF领涨2.35%，日经225ETF领跌5.76%
同花顺,2025-11-04 07:02:35.000,ETF两市成交额4997.32亿元
财联社,2025-11-04 07:02:20.000,10月中国物流业景气指数50.7% 保持扩张态势
同花顺,2025-11-04 07:02:05.000,伊朗全国举行反美集会 纪念“反对全球傲慢日”
同花顺,2025-11-04 07:00:53.000,A股收评：创业板指低开低走跌近2%，三市成交额不足两万亿元
同花顺,2025-11-04 06:55:56.000,中国人民银行副行长陆磊出席第四届国际金融领袖投资峰会和香港金融科技周2025活动
财联社,2025-11-04 06:54:48.000,【研选】我国客车行业9月产批同环比增长，出口高增延续，分析师判断海外市场业绩贡献对客车行业在3-5年会至少再造一个中国市场；重卡出口龙头，长期成长空间明确，有望实现持续增长
同花顺,2025-11-04 06:53:15.000,台风“海鸥”袭击菲律宾 已致2人死亡
同花顺,2025-11-04 06:53:03.000,全国秋粮收获过九成 东北秋粮有望再获丰收
同花顺,2025-11-04 06:51:40.000,中山市产业投资母基金等成立新基金
同花顺,2025-11-04 06:48:12.000,第八届中国国际进口博览会明日开幕
同花顺,2025-11-04 06:42:57.000,李成钢国际贸易谈判代表兼副部长会见通用电气能源集团全球副总裁思睿迈
同花顺,2025-11-04 06:38:22.000,公募基金业绩比较基准要素库已下发，按季度评估
同花顺,2025-11-04 06:37:28.000,神舟二十号和二十一号航天员乘组完成在轨交接
