来源,时间,标题
同花顺,2025-12-01 10:58:58.000,广东鼎泰高科技术股份有限公司向港交所提交上市申请书
同花顺,2025-12-01 10:58:27.000,比亚迪：11月新能源汽车产量47.42万辆，销量48.02万辆
财联社,2025-12-01 10:57:17.000,主力资金监控：中兴通讯净买入超23亿
同花顺,2025-12-01 10:56:57.000,广东鼎泰高科向港交所提交上市申请书
财联社,2025-12-01 10:52:53.000,广州：11月二手住宅网签套数突破9000宗 环比增长逾20%
财联社,2025-12-01 10:52:19.000,工信部：1-10月份规模以上互联网企业实现利润总额1237亿元 同比下降10.9%
财联社,2025-12-01 10:50:41.000,【风口研报·公司】这家公司为国内领先的体育运营赛事IP运营商，受益政策支持+高尔夫赛事运营成第二成长曲线，赛事影响力提升及商业化落地有望带来可观收益
财联社,2025-12-01 10:49:50.000,上海闵行金融投资发展公司增资至50亿 增幅400%
同花顺,2025-12-01 10:48:45.000,宁德时代：参与投资博裕新智新产（宁波）股权投资合伙企业（有限合伙）
财联社,2025-12-01 10:46:51.000,北京已进入流感高峰期 流行株为甲型H3N2
财联社,2025-12-01 10:46:43.000,中国聚变能源公司：与同方股份探讨“人工智能赋能聚变研发”等议题
财联社,2025-12-01 10:44:50.000,沪深两市成交额突破1万亿 较上一日此时放量超2100亿
财联社,2025-12-01 10:44:33.000,内存芯片价格快速上涨 业内预计手机产品将迎涨价潮
同花顺,2025-12-01 10:43:14.000,纽威股份：股东席超拟减持不超过1%
同花顺,2025-12-01 10:34:05.000,沃尔德：多名股东拟减持股份
同花顺,2025-12-01 10:32:58.000,卧龙新能：拟对外投资8.04亿元建设储能电站
同花顺,2025-12-01 10:31:08.000,德众汽车：成立全资孙公司凯里宝利
财联社,2025-12-01 10:30:36.000,【盘中宝】这类战略性关键金属下游需求多点开花，行业供需格局改善或支撑价格高位运行，这家公司相关资源储量和生产能力均居行业前列
财联社,2025-12-01 10:30:08.000,上海智算领航私募基金登记成立 出资额50.4亿
同花顺,2025-12-01 10:29:47.000,瑞松科技：中标3.31亿元项目
同花顺,2025-12-01 10:29:15.000,加拿大拟新建输油管道开拓亚洲市场
同花顺,2025-12-01 10:24:25.000,日本与菲律宾就出口导弹展开非正式磋商
财联社,2025-12-01 10:24:23.000,银行板块震荡走强 张家港行涨超5%
财新网,2025-12-01 10:23:21.683,韩国11月出口额保持增长
财新网,2025-12-01 10:23:21.683,半导体和汽车业比较争气，韩国出口额保持了增长
同花顺,2025-12-01 10:20:13.000,雄帝科技：高晶、郑嵩合计持股比例减少至35.00%
同花顺,2025-12-01 10:20:08.000,探路者：拟以3.21亿元收购贝特莱51%股权
财联社,2025-12-01 10:19:47.000,消费电子板块持续拉升 贝隆精密等多股涨停
财联社,2025-12-01 10:18:29.000,豆包手机助手发布技术预览版 可在工程样机nubia M153上体验
财联社,2025-12-01 10:15:41.000,11月百城新建住宅均价为17036元/平方米 环比上涨0.37%同比上涨2.68%
财联社,2025-12-01 10:14:04.000,辽宁“十五五”规划建议：举全省之力发展人工智能核心产业 加快工业软件创新突破
财联社,2025-12-01 10:13:37.000,万科被冻结5.7亿股权
财联社,2025-12-01 10:12:35.000,中信银行成立金融资产投资公司 注册资本100亿
财联社,2025-12-01 10:07:26.000,上海：培育一批以专业化为基础、通过创新运营和操作模式扩展服务项目的新型国际货代企业
同花顺,2025-12-01 10:06:05.000,现货黄金站上4260美元/盎司
同花顺,2025-12-01 10:06:04.000,常友科技：核心技术人员万慧荣先生离职
同花顺,2025-12-01 10:05:25.000,欧派家居：拟向全体股东每股派发现金红利1.24元（含税）
同花顺,2025-12-01 10:03:25.000,芯原股份：兴橙投资方和国开基金拟减持1%和0.15%股份
财联社,2025-12-01 10:02:23.000,【异动解析】华为AI玩具开售即秒罄，该类产品有望深度受益AI玩具渗透率增长，这家公司在桌面机器人、AI陪伴领域产品率先落地
同花顺,2025-12-01 10:01:41.000,中电环保：签订1.26亿元陕煤煤化工水处理项目合同
同花顺,2025-12-01 09:59:55.000,我国单机容量最大、效率最高燃机投产
同花顺,2025-12-01 09:58:51.000,国博电子今日大宗交易折价成交118.7万股，成交额7306万元
财联社,2025-12-01 09:56:29.000,金属铜概念表现活跃 江西铜业涨停
财联社,2025-12-01 09:52:12.000,沪深两市成交额突破5000亿 预计全天成交超2万亿
同花顺,2025-12-01 09:51:59.000,苹果正加速推进其首款可折叠iPhone的研发 预计将于2026年秋季正式发布
同花顺,2025-12-01 09:51:41.000,北汽蓝谷：11月新能源汽车产量31935辆，同比增180.57%
同花顺,2025-12-01 09:50:06.000,艾华集团：拟以2035.6万元收购艾华新动力电容(苏州)有限公司100%股权
同花顺,2025-12-01 09:45:53.000,和达科技：股东上海建元拟减持不超过0.0954%
同花顺,2025-12-01 09:45:09.000,东安动力：11月发动机销量同比增21.83%
同花顺,2025-12-01 09:44:18.000,梅雁吉祥：全资子公司矿产资源储量备案申请获受理事项尚存在评审结果不确定及审批环节不确定性风险
同花顺,2025-12-01 09:42:34.000,金龙汽车：副总裁吴文彬辞任
同花顺,2025-12-01 09:41:14.000,永贵电器：公司控股子公司近期收到1789.9万元中标通知书
同花顺,2025-12-01 09:40:50.000,韩国首尔市长被起诉
同花顺,2025-12-01 09:40:15.000,和誉药业：口服小分子KRAS G12D抑制剂ABSK141的IND申请获FDA批准
同花顺,2025-12-01 09:39:42.000,莱尔科技：对控股子公司增资4000万元
同花顺,2025-12-01 09:37:45.000,福然德：控股股东、实际控制人的一致行动人拟减持不超3%
财联社,2025-12-01 09:35:35.000,公安部等十部门联合印发《关于加强生态警务机制建设的意见》
财联社,2025-12-01 09:34:58.000,港股影视股走强 猫眼娱乐涨超4%
财联社,2025-12-01 09:34:54.000,深交所：“22万科02”盘中临时停牌
财联社,2025-12-01 09:34:05.000,贵金属概念盘初拉升 白银有色涨停
财联社,2025-12-01 09:33:46.000,商业航天概念快速走强 航天发展、通宇通讯等多股涨停
财联社,2025-12-01 09:30:30.000,赛力斯涨超4% 获调入港股通
财联社,2025-12-01 09:30:19.000,影视板块大幅高开 中国电影一字涨停
财联社,2025-12-01 09:28:16.000,三大指数集体高开
财联社,2025-12-01 09:22:15.000,金饰克价涨到1336元 有品牌金饰价六连涨
财联社,2025-12-01 09:21:05.000,央行公开市场今日净回笼2311亿元
财联社,2025-12-01 09:18:30.000,辽宁“十五五”规划建议：积极拓展低空+作业、低空+治理、低空+物流、低空+旅游等产业应用场景
财联社,2025-12-01 09:14:49.000,哈马斯官员称以军阻碍停火协议执行
财联社,2025-12-01 09:13:31.000,工信部：1—10月规模以上电子信息制造业增加值同比增长10.6%
财联社,2025-12-01 09:12:58.000,辽宁“十五五”规划建议：面向未来制造等发展方向 重点培育具身智能、第六代移动通信等未来产业
财联社,2025-12-01 09:12:30.000,【盘中宝】AI浪潮下该行业渗透率有望快速提升，机构称相关产业链目前处在0-1阶段，未来市场规模或超1000亿，这家企业已切入头部企业供应链，开展相关关键环节业务
财联社,2025-12-01 09:09:44.000,预告
同花顺,2025-12-01 09:08:38.000,香港火灾遇难人数升至151人
同花顺,2025-12-01 09:07:32.000,新版中俄双边投资协定于12月1日正式生效
同花顺,2025-12-01 09:04:53.000,花旗集团对中国平安的多头持仓比例降至6.07%
同花顺,2025-12-01 09:04:43.000,摩根大通（JPMorgan）对小鹏汽车-W的多头持仓比例增至5.33%
同花顺,2025-12-01 09:04:30.000,摩根大通（JPMorgan）对宁德时代的多头持仓比例增至8.09%
同花顺,2025-12-01 09:03:18.000,星云股份：股东江美珠近期累计减持0.50%
同花顺,2025-12-01 09:01:18.000,美股中概股盘前涨跌互现，小马智行涨3%
同花顺,2025-12-01 09:01:08.000,美股大型科技股盘前普跌，Meta跌1%
同花顺,2025-12-01 08:59:52.000,北京人工智能产投基金等入股人形机器人公司星动纪元
同花顺,2025-12-01 08:58:46.000,连城数控：股东兆恒拟减持不超过2%股份
同花顺,2025-12-01 08:57:36.000,蓝思科技：独立董事谢志明逝世
同花顺,2025-12-01 08:54:52.000,远东股份：子公司中标23.83亿元合同订单
同花顺,2025-12-01 08:54:35.000,三星医疗：奥克斯智能科技预中标1.24亿元项目
同花顺,2025-12-01 08:54:14.000,三星医疗：子公司签订1.6亿元人民币海外合同
同花顺,2025-12-01 08:52:34.000,华润双鹤：控股子公司双鹤天安药业盐酸吡格列酮分散片获得药品补充申请批准通知书
同花顺,2025-12-01 08:48:44.000,英国拟对国际留学生征收6%附加费
同花顺,2025-12-01 08:48:39.000,宁波富达：控股子公司拟公开挂牌出售河口瀛洲水泥有限公司100%股权
同花顺,2025-12-01 08:48:18.000,山子高科：收到甘肃证监局警示函
同花顺,2025-12-01 08:46:06.000,普洛药业：全资子公司获阿莫西林克拉维酸钾片药品注册证书
同花顺,2025-12-01 08:46:02.000,蓝思科技独供豆包手机关键精密结构件等，已获上亿订单
财联社,2025-12-01 08:17:24.000,中信证券：科技巨头争相布局 太空算力逐渐成为共识
财联社,2025-12-01 08:12:39.000,日经225指数向下跌破50000点
财联社,2025-12-01 08:11:10.000,美威胁“关闭委领空” 委内瑞拉向国际民航组织提出申诉
财联社,2025-12-01 08:10:57.000,中信证券：国产算力建设提速 超节点驱动网络侧高速成长
财联社,2025-12-01 08:10:42.000,【九点特供】长七A火箭成功发射实践二十八号卫星，首次使用了通用化地面测发控系统和新活动发射平台，该公司开发了“天箭”、“天星”商业航天综合电子系统产品以及地面配套设备；华为首款AI情绪陪伴玩具售罄缺货
财联社,2025-12-01 08:09:59.000,中信证券：AI光互联大有可为 头部厂商优势显著
财联社,2025-12-01 08:07:40.000,中金：当前时点AI板块拥挤风险相对较低 长期依旧存在机会
同花顺,2025-12-01 08:06:50.000,中文传媒：副总经理陈佳羚因工作调整辞职
同花顺,2025-12-01 08:06:30.000,友发集团：终止向特定对象发行A股股票事项
同花顺,2025-12-01 08:05:33.000,交大思诺：董事长李伟解除留置
财联社,2025-12-01 08:02:19.000,日本福岛县附近海域发生4.2级地震
财联社,2025-12-01 08:01:26.000,日经225指数开盘涨0.09%
同花顺,2025-12-01 07:59:37.000,长华集团：公司收到客户项目定点通知书，预计生命周期总销售额约7.32亿元
财联社,2025-12-01 07:59:28.000,投资日历：周一资本市场大事提醒
同花顺,2025-12-01 07:58:24.000,国家能源集团浙江安吉梅溪2×9H级燃机新建工程1号机组正式并网发电
同花顺,2025-12-01 07:56:40.000,震安科技成立现代电子科技公司，含AI业务
同花顺,2025-12-01 07:53:36.000,顺丰控股10亿元成立顺英控股公司
同花顺,2025-12-01 07:51:10.000,福安药业：子公司庆余堂获头孢托仑匹酯颗粒药品注册证书
同花顺,2025-12-01 07:50:51.000,立中集团：签署《人形机器人零部件委托加工技术协议》
同花顺,2025-12-01 07:48:06.000,本钢板材：预计触发本钢转债转股价格向下修正条件
同花顺,2025-12-01 07:45:03.000,重庆港：拟投资2.99亿元建设江津港现代化多式联运集疏运能力提升项目（二期改扩建工程）
财联社,2025-12-01 07:45:01.000,【点金互动易】锂电材料+EVA，锂电碳酸酯溶剂全产全销，受益于近期EC等溶剂供需偏紧，产品价格快速上涨，这家公司稳居EVA高端阵营
财联社,2025-12-01 07:44:56.000,殷勇会见越南农业与环境部部长
财联社,2025-12-01 07:44:18.000,日本一钢铁厂发生爆炸并引发火灾 大火仍未扑灭
同花顺,2025-12-01 07:44:03.000,华策影视发表声明 公开谴责短剧跟风拍摄
同花顺,2025-12-01 07:41:08.000,外交部：中方观察团给予吉尔吉斯斯坦提前举行议会选举高度评价
同花顺,2025-12-01 07:40:42.000,汉马科技：11月货车产量1947辆、销量2002辆，同比大增
财新网,2025-12-01 07:14:05.067,泰国机动车10月不太好卖
财新网,2025-12-01 07:14:05.067,泰国人最近不买车
同花顺,2025-12-01 07:08:44.000,现代汽车11月全球销量同比下降2.4%
同花顺,2025-12-01 07:06:40.000,腾讯旗下财付通小贷公司增资至150亿元
同花顺,2025-12-01 07:03:46.000,上汽集团成立科技公司，含汽车零部件及配件制造业务
同花顺,2025-12-01 07:03:21.000,斯里兰卡极端天气灾害致355人死亡
同花顺,2025-12-01 07:00:55.000,ETF收评：黄金股票ETF基金领涨4.09%，豆粕ETF领跌2.52%
同花顺,2025-12-01 07:00:51.000,ETF两市成交额4289.65亿元
同花顺,2025-12-01 07:00:48.000,A股收评：沪指放量涨0.65%收复3900点，有色金属、AI端侧方向多点爆发
财新网,2025-12-01 06:58:48.087,AI眼镜赛道又添一“重量级”玩家
同花顺,2025-12-01 06:56:55.000,重药控股与华益科技签署战略合作协议
同花顺,2025-12-01 06:54:06.000,“21万科02”盘中临时停牌
同花顺,2025-12-01 06:51:01.000,集邦咨询：NAND Flash wafer供给紧缩加剧 11月部分产品合约价涨幅逾60%
同花顺,2025-12-01 06:50:51.000,市场监管总局：婴幼儿配方液态乳产品配方的注册管理按婴幼儿配方乳粉产品配方规定执行
同花顺,2025-12-01 06:48:44.000,沪深300股指期货(IF)主力合约日内涨超1%
同花顺,2025-12-01 06:47:28.000,民生加银基金人士：消费需求或复苏 年末看好三大板块
同花顺,2025-12-01 06:45:52.000,阳光电源成交额达100亿元
同花顺,2025-12-01 06:41:24.000,长亮科技中标厦门国际银行新一代分布式核心业务系统项目
同花顺,2025-12-01 06:40:11.000,北京：推进政务服务全流程智能化 分批建设专业领域政务咨询智能体
同花顺,2025-12-01 06:38:38.000,三友科技等成立硅基启灵科技公司，含AI及机器人业务
财新网,2025-12-01 06:27:26.105,期货人的“黑色星期五”
财新网,2025-12-01 06:27:26.105,“黑色星期五”席卷美国交易场
同花顺,2025-12-01 06:00:56.000,涉及个人信息处理等国家标准今起实施
同花顺,2025-12-01 06:00:33.000,阳光乳业连拉两板，公司回应新业务暂无时间表
同花顺,2025-12-01 05:59:55.000,历史新高！今年我国快递业务量首次突破1800亿件
同花顺,2025-12-01 05:54:39.000,印度电信部要求苹果等智能手机制造商预装政府推出的网络安全应用程序
同花顺,2025-12-01 05:54:26.000,ChatGPT发布三周年，美购物网站“黑色星期五”AI流量飙升805%
同花顺,2025-12-01 05:53:40.000,沪深京三市成交额超1.5万亿元，较上日此时放量2723亿元
同花顺,2025-12-01 05:49:18.000,佛塑科技等成立新材料公司 注册资本7500万
同花顺,2025-12-01 05:46:43.000,我使馆提醒中方人员紧急撤离塔吉克斯坦和阿富汗边境地区
同花顺,2025-12-01 05:42:21.000,白银价格创历史新高，今年涨幅已超90%
同花顺,2025-12-01 05:38:06.000,光刻胶概念股异动拉升，容大感光涨超10%
同花顺,2025-12-01 05:37:06.000,湖南广电与张家界市达成战略合作，大庸古城预计在2026年7月开园
同花顺,2025-12-01 05:36:01.000,20年期日本国债收益率上涨5.5个基点，至2.88%，为1999年6月以来的最高水平
同花顺,2025-12-01 05:32:51.000,日本央行行长植田和男：希望在将利率提高至0.75%后，再进一步阐述未来加息路径
同花顺,2025-12-01 05:31:54.000,港股TATA健康时隔逾1年半复牌大涨，一度涨超700%
同花顺,2025-12-01 05:24:46.000,拉美民间智库谴责美方“全面关闭”委内瑞拉空域言论
同花顺,2025-12-01 05:18:26.000,流感板块午后拉升，海王生物触及涨停
同花顺,2025-12-01 05:13:41.000,港口航运板块午后走高，招商轮船涨停
同花顺,2025-12-01 05:11:21.000,免税店板块午后震荡上扬，中国中免涨超8%
同花顺,2025-12-01 05:06:18.000,日经225指数日内跌幅达2%
同花顺,2025-12-01 05:04:06.000,存储芯片板块午后拉升，北京君正涨超13%
同花顺,2025-12-01 05:02:26.000,国产C919飞机首飞高原机场定期航线
同花顺,2025-12-01 04:47:14.000,前10个月我国规上电子信息制造业增加值同比增长10.6%
同花顺,2025-12-01 04:47:06.000,澳门11月幸运博彩毛收入同比增长14.4%，预估为增长10.5%
同花顺,2025-12-01 04:39:52.000,摩根大通将马士基目标价从8800丹麦克朗下调至8000丹麦克朗
同花顺,2025-12-01 04:38:38.000,山子高科在浙江新设机器人科技公司，含多项AI业务
同花顺,2025-12-01 04:30:07.000,中信银行新设金融资产投资公司
同花顺,2025-12-01 04:27:30.000,宇树科技成功注册GAMEBOT商标
同花顺,2025-12-01 04:27:21.000,日本10年期国债收益率上涨5.5个基点
同花顺,2025-12-01 04:25:27.000,2025年11月鸿蒙智行全系交付新车81864台，同比增长89.61%，创单月交付历史新高
同花顺,2025-12-01 04:23:55.000,福德士河与比亚迪携手打造250MWh储能系统
同花顺,2025-12-01 04:23:35.000,软银：将扩大机器人可以执行的任务范围
同花顺,2025-12-01 04:21:31.000,"特朗普：暂停接收难民措施或将维持“很长时间"""
同花顺,2025-12-01 04:20:41.000,12月1日午间公告一览：安妮股份自2025年12月1日起停牌
同花顺,2025-12-01 04:20:14.000,速腾聚创诉灵明光子侵害技术秘密，激光雷达SPAD芯片成焦点
同花顺,2025-12-01 04:15:33.000,赣州和美药业股份有限公司 - B向港交所提交上市申请书
同花顺,2025-12-01 04:15:16.000,林清轩回应招股书失效：上市正在流程中，已获证监会备案通知书
同花顺,2025-12-01 04:12:49.000,泰铢持稳 泰国股市上涨
同花顺,2025-12-01 04:07:39.000,英国成立新左翼政党
同花顺,2025-12-01 04:01:29.000,港股午评：恒生指数涨0.81%，恒生科技指数涨0.99%
同花顺,2025-12-01 04:00:45.000,世界田联主席：中国田径体系将促进世界田径发展
同花顺,2025-12-01 03:52:15.000,北京已进入流感高峰期 多措并举保障患儿就医需求
同花顺,2025-12-01 03:44:37.000,上海检察机关推出12条举措保障国际航运中心建设，已成立四个服务站
同花顺,2025-12-01 03:41:59.000,东方甄选新增外卖业务
同花顺,2025-12-01 03:40:43.000,大连海事局发布渤海航行警告，三日特定时段部分海域禁止驶入
同花顺,2025-12-01 03:37:48.000,财政部、国家医保局：修订《城乡医疗救助基金管理办法》
同花顺,2025-12-01 03:37:01.000,流感流行进入上升期，中国疾控中心研究员：当前仍然建议还未接种流感疫苗的适宜人群尽快接种
同花顺,2025-12-01 03:33:19.000,期货午评：美联储降息预期升温 沪银飙涨6%突破历史新高！
同花顺,2025-12-01 03:30:55.000,ETF午评：通信设备ETF领涨3.66%，日经225ETF易方达领跌2.0%
同花顺,2025-12-01 03:30:47.000,A股午评：深成指半日涨近1%，AI眼镜、手机等端侧硬件股集体爆发
同花顺,2025-12-01 03:30:33.000,ETF两市成交额2556.37亿元
同花顺,2025-12-01 03:29:31.000,摩根大通上调宁德时代AH股目标价
同花顺,2025-12-01 03:22:51.000,沪深京三市成交额超1.2万亿元，较上日此时放量2424亿元
同花顺,2025-12-01 03:21:04.000,深圳地铁集团法定代表人变更
同花顺,2025-12-01 03:20:47.000,深证成指涨1%
同花顺,2025-12-01 03:14:37.000,国家干细胞资源库迎首个分库 2项国际标准+5项团体标准发布
同花顺,2025-12-01 03:14:09.000,理想AI眼镜Livis发布会将于12月3日举行
同花顺,2025-12-01 03:10:11.000,顺丰推出“超时赔付”服务：成本由公司承担，快递员无需承担
同花顺,2025-12-01 03:05:42.000,白俄罗斯：愿与北约成员国展开对话以确保东欧安全
同花顺,2025-12-01 03:04:30.000,俞敏洪接任东方甄选公司法定代表人
同花顺,2025-12-01 03:03:51.000,豆包发布手机助手技术预览版 与多家手机厂商洽谈合作
同花顺,2025-12-01 02:49:23.000,中央生态环境保护督察公布天津、河北环境问题
财新网,2025-12-01 02:46:58.621,“债市女王”确认正在配合调查
财新网,2025-12-01 02:46:58.621,债市女王翟晨曦确认正在配合调查
同花顺,2025-12-01 02:42:48.000,沪深京三市成交额超1万亿元，较上日此时放量2143亿元
同花顺,2025-12-01 02:41:26.000,AI手机概念股持续走强，天音控股、福蓉科技涨停
同花顺,2025-12-01 02:32:42.000,字节回应与中兴手机合作：无自研手机计划，发布手机助手技术预览版
同花顺,2025-12-01 02:27:03.000,越南VN指数涨幅扩大至1.2%
同花顺,2025-12-01 02:25:49.000,光伏板块冲高回落，阿特斯跌超7%
同花顺,2025-12-01 02:21:32.000,上海发布服务贸易促进指导目录
同花顺,2025-12-01 02:21:08.000,券商资管子公司申请公募牌照热情退去
同花顺,2025-12-01 02:18:53.000,银行板块震荡上扬，张家港行涨超5%
同花顺,2025-12-01 02:17:45.000,辽宁“十五五”规划建议：积极发展冰雪经济 推动全产业链发展
同花顺,2025-12-01 02:17:36.000,热轧板卷均价连续4年下跌 12月检修增加或提振市场
同花顺,2025-12-01 02:16:16.000,中际旭创成交额达100亿元
同花顺,2025-12-01 02:15:46.000,神22乘组在序列中永远空缺 神20飞船将以无人状态返回地球
同花顺,2025-12-01 02:14:42.000,国债期货拉升 30年期主力合约涨超0.1%
同花顺,2025-12-01 02:11:58.000,小米汽车将开放“现车选购”
同花顺,2025-12-01 02:09:46.000,AI眼镜概念股早盘走强，广和通大涨15%
同花顺,2025-12-01 01:34:56.000,港股有色金属板块盘初冲高，中国白银集团涨超10%
同花顺,2025-12-01 01:34:17.000,“22万科02”盘中临时停牌
同花顺,2025-12-01 01:31:10.000,白银、铜等金属板块集体高开，兴业银锡涨超7%
同花顺,2025-12-01 01:29:03.000,商业航天概念股集体高开，雷科防务等股2连板
同花顺,2025-12-01 01:28:25.000,纽约期金站上4270美元/盎司
同花顺,2025-12-01 01:27:30.000,影视院线板块高开，中国电影涨停
同花顺,2025-12-01 01:26:59.000,ETF开盘：深100ETF银华领涨7.22%，日经225ETF领跌1.66%
同花顺,2025-12-01 01:26:35.000,SemiAnalysis：OpenAI“筹备采用谷歌TPU”导致英伟达让步 其算力集群成本降低约30%
同花顺,2025-12-01 01:25:58.000,天风证券低开近9%
同花顺,2025-12-01 01:25:23.000,A股开盘：三大指数集体高开
同花顺,2025-12-01 01:22:23.000,日本央行行长植田和男：自日美贸易协定达成以来，经济前景的不确定性有所缓解
同花顺,2025-12-01 01:21:23.000,港股开盘：恒生指数高开0.34%，恒生科技指数高开0.21%
同花顺,2025-12-01 01:21:18.000,日本央行行长：本央行将根据各种数据讨论经济活动、国内外通胀以及市场发展情况，并考虑加息的利弊
同花顺,2025-12-01 01:20:57.000,央行今日开展1076亿元7天期逆回购操作
同花顺,2025-12-01 01:19:59.000,我国绿氢年产能超22万吨 多项技术指标居全球首位
同花顺,2025-12-01 01:19:51.000,导演辟谣《疯狂动物城》真人版
同花顺,2025-12-01 01:18:12.000,有色金属期货走高
同花顺,2025-12-01 01:18:01.000,上一交易日ETF两市融资融券余额1185.37亿元
同花顺,2025-12-01 01:15:25.000,人民币兑美元中间价较上日调升30点至7.0759
同花顺,2025-12-01 01:15:16.000,日本央行行长：三年预测期内下半部分通胀将大致符合2%目标
同花顺,2025-12-01 00:15:07.000,日经225指数向下跌破50000点 受电子和制药股拖累
同花顺,2025-12-01 00:08:05.000,日本2年期国债收益率升至1%，为2008年以来首次
同花顺,2025-12-01 00:07:17.000,从老有所养到老有所享 我国银发消费正跨越升级
同花顺,2025-12-01 00:06:53.000,中金：当前时点AI板块拥挤风险相对较低，长期依旧存在机会
同花顺,2025-11-30 23:58:48.000,两部门筹建绿色发展投融资合作伙伴关系指导委员会
同花顺,2025-11-30 23:50:59.000,北京迎降温降雪 气温将降至冰点
同花顺,2025-11-30 23:49:28.000,“核动力”蒸汽上线 碳足迹仅为燃煤1/600
同花顺,2025-11-30 23:43:04.000,黑龙江省农产品加工体系工作交流会暨科技成果发布会成功举办
同花顺,2025-11-30 23:42:38.000,我国粮食主产区秋冬种基本结束 田管有序展开
同花顺,2025-11-30 23:41:52.000,体育外卖快速崛起 改变传统培训模式
同花顺,2025-11-30 23:40:21.000,商业不动产REITs试点启动 高质量扩容可期
同花顺,2025-11-30 23:34:34.000,AI与储能双向赋能 重塑投资格局
同花顺,2025-11-30 23:32:38.000,A股持续高位震荡 机构：跨年行情可期
同花顺,2025-11-30 23:31:55.000,人民日报钟声：日本所谓“台湾地位未定”论，是对历史的无知和现实的误判
同花顺,2025-11-30 23:31:09.000,美国“黑色星期五”线上销售额创新高 但物价上涨抑制需求
同花顺,2025-11-30 23:30:57.000,华泰证券：布局“春躁”中的高胜率方向，建议关注航空装备及AI链相关行业
财新网,2025-11-27 10:24:11.382,中国连锁咖啡店生存图鉴
财新网,2025-11-27 08:03:56.167,CEO吴泳铭还回应了AI泡沫问题
