来源,时间,标题
财联社,2026-03-07 03:51:57,伊朗纳坦兹市郊区传出爆炸声
同花顺,2026-03-07 03:36:52,文旅部：将持续提升入境旅游全链条的便利化水平
同花顺,2026-03-07 03:35:35,联合国秘书长警告中东局势可能失控
财联社,2026-03-07 03:32:53,国际原油期货结算价创2023年10月以来新高 WTI原油期货本周累涨超35%
财联社,2026-03-07 03:32:53,国际原油期货结算价创有记录以来最大周涨幅 WTI原油期货本周累涨超35%
同花顺,2026-03-07 03:30:30,英媒：美军B-1战略轰炸机傍晚降落英国皇家空军基地
同花顺,2026-03-07 03:29:06,国家卫健委：“十五五”期间将实施医疗卫生强基工程、康复护理扩容提升工程等一系列重点工程
财联社,2026-03-07 03:26:41,委内瑞拉恢复稀释原油出口
财联社,2026-03-07 03:16:46,PIMCO：私人债务市场应做好迎接“全面违约周期”的准备
财联社,2026-03-07 03:14:13,伊朗称向美军“林肯”号航母发射导弹
财联社,2026-03-07 03:09:03,关税退款面临阻碍 美国海关称不能遵令停止计算紧急关税
同花顺,2026-03-07 02:59:00,人社部：第48届世界技能大赛将于9月22日到27日在上海举办
财联社,2026-03-07 02:54:47,伊拉克巴格达国际机场附近传出爆炸声
同花顺,2026-03-07 02:44:10,文化和旅游部部长孙业礼：体验经济正流行开来
同花顺,2026-03-07 02:41:33,人社部：正谋划一批务实管用、含金量高的重大就业政策、行动计划等
财联社,2026-03-07 02:40:39,巴克莱：如果中东局势再持续数周 布伦特原油有可能试探120美元/桶
同花顺,2026-03-07 02:35:00,人社部：将加大对外贸、住宿、餐饮等劳动密集型行业就业扶持
财联社,2026-03-07 02:32:10,美联储哈玛克：美联储利率政策很可能在相当长一段时间内维持不变
同花顺,2026-03-07 02:26:41,教育部：将深入开展校园餐教辅征订等专项治理
同花顺,2026-03-07 02:26:05,人力资源社会保障部部长王晓萍：就业是家事更是国事
同花顺,2026-03-07 02:24:44,民政部：加强养老服务人才培养培训 将“养老服务师”纳入新职业
财联社,2026-03-07 02:22:12,美联储柯林斯：没有紧急必要改变货币政策立场 预计通胀将缓慢回落至2%的目标
同花顺,2026-03-07 02:14:27,我国高等教育毛入学率超60%，“双一流”高校扩招3.8万人
同花顺,2026-03-07 02:06:56,国家外汇管理局公布2026年2月末外汇储备规模数据
同花顺,2026-03-07 02:05:28,中国央行连续第16个月增持黄金
财联社,2026-03-07 02:01:18,国际能源署：物流中断带来挑战 全球石油供应仍充足
同花顺,2026-03-07 01:57:26,十四届全国人大四次会议上午10时举行记者会
财联社,2026-03-07 01:56:22,伊朗启动“真实承诺4”第23轮军事行动
同花顺,2026-03-07 01:55:01,伊朗驻联合国代表：美以蓄意打击平民和民用基础设施构成战争罪
财联社,2026-03-07 01:43:11,国际原油期货涨势不止 布伦特原油期货涨幅扩大至10%
财联社,2026-03-07 01:41:24,古特雷斯呼吁停止中东地区冲突并尽快开启外交谈判
财联社,2026-03-07 01:26:37,WTI原油期货涨幅扩大至12%
同花顺,2026-03-07 01:25:20,美国与厄瓜多尔展开联合行动，打击厄境内贩毒团伙
财联社,2026-03-07 01:21:03,欧洲私募巨头CVC拟在上市前收购比利时Belfius银行股份
财联社,2026-03-07 01:02:32,欧洲央行执委施纳贝尔：欧洲央行仍处有利地位 但伊朗战争带来通胀上行风险
财联社,2026-03-07 00:54:05,WTI原油期货涨幅扩大至11% 向上触及90美元/桶关口
财联社,2026-03-07 00:45:25,欧洲主要股指集体收跌 德国DAX30指数跌1.21%
财联社,2026-03-07 00:38:44,美联储理事米兰：中性利率可能在2.5%-2.75%左右
财联社,2026-03-07 00:35:01,据悉英国央行就MFS风险敞口问询银行 巴克莱在列
财联社,2026-03-07 00:30:47,伊朗称对巴林境内美军驻地的袭击已致多人死伤
财联社,2026-03-07 00:28:05,法国向地中海部署两栖攻击舰
财联社,2026-03-07 00:24:06,芬兰拟修法解除“核禁令”
财联社,2026-03-07 00:23:22,俄乌交换1000名被俘士兵
同花顺,2026-03-07 00:16:37,日本考虑为第二个美国投资项目斥资15万亿日元
财联社,2026-03-06 23:59:41,能源危机山雨欲来 霍尔木兹海峡困住中东石油出口
同花顺,2026-03-06 23:56:25,伊朗外交使团发表声明，强烈谴责美以军事侵略
财联社,2026-03-06 23:54:56,伊朗官员对库尔德武装“渗透”活动发出警告
同花顺,2026-03-06 23:54:26,今年首艘国际邮轮抵沪，船上99%外籍旅客免签入境
财联社,2026-03-06 23:52:35,深圳兆威机电香港公开发售部分获得约1537倍认购
同花顺,2026-03-06 23:38:07,经济日报：AI玩具撬动消费风口
财联社,2026-03-06 23:37:36,美股资产管理公司股价大跌 负面信用事件加剧避险情绪
财联社,2026-03-06 23:32:32,伊朗伊斯兰革命卫队：大规模发射新一代导弹 打击美军多个基地
同花顺,2026-03-06 23:25:29,特朗普和美国大军火商开会
财联社,2026-03-06 23:20:41,收益率飙升 短期英国国债势创2023年以来最差单周表现
财联社,2026-03-06 23:20:07,美股下跌之际中概股逆势走强 京东以5.5%涨幅领涨
同花顺,2026-03-06 23:18:06,十四届全国人大四次会议将于今日上午10时举行民生主题记者会
财联社,2026-03-06 23:15:18,京东涨近6% 高盛认为其差异化优势被市场低估
财联社,2026-03-06 23:07:20,以色列称对位于黎南部的哈马斯筹资负责人办公室发动空袭
财联社,2026-03-06 23:04:55,以军袭击黎巴嫩已造成217人死798人伤
财联社,2026-03-06 23:01:54,国内商品期市夜盘收盘多数上涨 能源品涨幅居前
财联社,2026-03-06 22:58:17,正式测定：所罗门群岛发生6.3级地震 震源深度10千米
财联社,2026-03-06 22:56:23,呷哺呷哺：预计2025年净亏损约2.9亿-3.1亿元 较2024年同期收窄
财联社,2026-03-06 22:54:42,中东海上战争险费率敲定 油轮日租金近80万美元一周跳涨4倍
财联社,2026-03-06 22:52:07,美联储官员古尔斯比：希望能在今年年底前开始降息
财联社,2026-03-06 22:47:03,中东航线运价暴涨 多家外资船司征收紧急冲突附加费
财联社,2026-03-06 22:46:11,国际原油飙升 美股石油股表现强劲
财联社,2026-03-06 22:40:19,所罗门群岛附近发生6.4级左右地震
同花顺,2026-03-06 22:14:51,波音称收购Spirit AeroSystems将有助于提高安全性
财联社,2026-03-06 22:13:26,特朗普宣称“与伊朗不会达成任何协议”
财联社,2026-03-06 22:11:40,加密货币全线下跌 比特币跌超5%
财联社,2026-03-06 22:09:04,化工品期货夜盘全线上涨 燃油涨16%苯乙烯涨9%
财联社,2026-03-06 22:07:29,美国非农就业人数意外大减且失业率回升 或使美联储重新聚焦就业
财联社,2026-03-06 22:04:37,财联社3月6日晚间新闻精选
财联社,2026-03-06 21:56:51,一艘拖船在霍尔木兹海峡遭不明物体击中
财联社,2026-03-06 21:56:08,美油涨幅进一步扩大至8%
同花顺,2026-03-06 21:53:56,现货黄金涨1.75%，本周累跌2.06%
财联社,2026-03-06 21:49:32,证监会明确短线交易监管规定的适用主体和券种范围
财联社,2026-03-06 21:48:34,希腊将部署“爱国者”防空系统和F-16战机协防保加利亚
财联社,2026-03-06 21:47:23,布伦特原油2024年4月以来首次升破90美元/桶 本周累计涨23%
同花顺,2026-03-06 21:24:56,标普确认阿布扎比和阿联酋AA评级，展望稳定
财联社,2026-03-06 21:22:43,以军对伊朗首都德黑兰与伊斯法罕发动空袭
财联社,2026-03-06 21:20:12,华培动力：终止购买美创智感100%股权 股票下周一复牌
财联社,2026-03-06 21:16:48,深交所：启用181001-181999代码区间用于不动产基金中商业不动产REITs业务
财联社,2026-03-06 21:13:53,法国“戴高乐”号航母抵达地中海
财联社,2026-03-06 21:13:16,黄河防凌进入开河关键期 两部门会商部署重点地区防凌工作
财联社,2026-03-06 21:04:57,美股盘前要闻一览：国际油价创两年来新高；市场料欧央行7月前加息概率已超六成；软银寻求最高400亿美元贷款用于投资OpenAI
财联社,2026-03-06 21:02:15,东风集团股份：1-2月累计汽车销量为22.8万辆 同比增长约1.2%
财联社,2026-03-06 21:00:13,国内商品期货夜盘开盘 原油、化工品大幅高开
财联社,2026-03-06 20:59:26,比特币跌至70000美元下方 过去24小时跌4%
财联社,2026-03-06 20:52:53,郑商所对部分客户采取限制开仓、限制出金的监管措施
财联社,2026-03-06 20:50:21,阿塞拜疆决定从伊朗撤出全部外交人员
财联社,2026-03-06 20:49:42,中兴通讯：公司及子公司拟使用不超过400亿元自有资金进行委托理财
财联社,2026-03-06 20:48:39,中兴通讯：2025年净利润56.18亿元
同花顺,2026-03-06 20:35:07,甲骨文和OpenAI终止扩建德克萨斯州数据中心的计划
财联社,2026-03-06 20:07:45,迪拜机场加快航班恢复
财联社,2026-03-06 20:05:45,雄安新区空天信息和卫星互联网产业已形成雁阵格局
财联社,2026-03-06 20:04:50,美股石油股盘前普涨
财联社,2026-03-06 20:03:51,东诚药业：控股子公司蓝纳成自主研发的225Ac-LNC1011注射液完成首例参与者入组
财联社,2026-03-06 19:52:53,欧股跌幅扩大
财联社,2026-03-06 19:52:24,华泰证券：超配电力链中上游品种 内需与AI是能源之外的主要线索
财联社,2026-03-06 19:51:37,美财长：为确保原油持续流入全球市场 允许印度短期采购俄油
财联社,2026-03-06 19:51:29,恒天海龙：恒天集团3月3日至3月5日减持0.8%公司股份
财联社,2026-03-06 19:46:49,黄金回收量显著下滑 “以旧换新”成深圳门店主要业务
财联社,2026-03-06 19:45:07,沪电股份：全资子公司拟55亿元投建印制电路板生产项目 生产高层数、高频高速、高密度互连、高通流印制电路板
财联社,2026-03-06 19:42:52,伊朗称一艘美国油轮在科威特边境遭袭
财联社,2026-03-06 19:41:14,因拒绝美军方不受限制地使用其AI模型 美国一科技公司被列入“黑名单”
财联社,2026-03-06 19:40:42,深港通下的港股通标的证券名单调整 3月9日起生效
财联社,2026-03-06 19:39:44,以军称正拦截伊朗方向发射的导弹
同花顺,2026-03-06 19:34:27,WTI原油期货4月合约涨超12%
同花顺,2026-03-06 19:27:41,委内瑞拉在中断15个月后恢复稀释原油出口
财联社,2026-03-06 19:10:17,中国—瑞士自贸协定升级第四轮谈判在瑞士举行
财联社,2026-03-06 19:09:43,佩斯科夫：受中东局势影响 对俄能源需求显著上升
财联社,2026-03-06 19:03:17,麦科田医疗港股IPO及境内未上市股份“全流通”获中国证监会备案
财联社,2026-03-06 19:03:13,国务院办公厅印发《关于加强基层消防工作的意见》 督促行业、系统基层单位落实消防安全责任制
财联社,2026-03-06 19:01:40,日本油企申请释放国家战略储备原油
财联社,2026-03-06 19:01:37,【机构龙虎榜解读】CPO+数据中心+芯片，正研发下一代CPO高速光连接技术，800G光模块已给多个客户送样并测试中，拥有光芯片到光器件设计制造能力，机构大额净买入这家公司
财联社,2026-03-06 19:01:37,源杰科技：筹划发行H股股票并在香港联交所主板上市
财联社,2026-03-06 19:01:26,今年我国首次开展大规模跨电网经营区绿电交易
财联社,2026-03-06 19:01:26,习近平：推进全民健康数智化建设
财联社,2026-03-06 19:00:26,乐动机器人港股IPO及境内未上市股份“全流通”获中国证监会备案
财联社,2026-03-06 18:59:36,俄乌进行新一轮被扣押人员交换
财联社,2026-03-06 18:58:22,国际能源署署长：市场上石油充足 目前无动用应急储备的计划
财联社,2026-03-06 18:57:55,习近平：坚定不移走中国特色卫生与健康发展道路 推动“十五五”时期健康中国建设取得决定性进展
财联社,2026-03-06 18:57:49,普源精电港股上市获中国证监会备案
财联社,2026-03-06 18:56:18,欧洲天然气本周料收涨逾60% 势创能源危机以来最大单周涨幅
财联社,2026-03-06 18:53:33,迈为股份：拟投资35亿元建设钙钛矿叠层电池成套装备项目
财联社,2026-03-06 18:53:17,杭州余杭区：即日起至3月31日购买全区新建商品住宅 每套补助5万元
财联社,2026-03-06 18:52:53,迈为股份：控股子公司拟15亿元投建半导体装备研发制造项目
同花顺,2026-03-06 18:52:35,巴克莱称，如果中东局势再持续数周，布伦特原油有可能试探120美元/桶
财联社,2026-03-06 18:51:20,星环科技：公司仍处于未盈利状态
同花顺,2026-03-06 18:16:22,美国将围绕海湾货运开辟200亿美元再保险工具
财联社,2026-03-06 18:08:14,伊朗说要动用新一代导弹打击美以目标
财联社,2026-03-06 18:05:39,中国女足3:0战胜乌兹别克斯坦女足 两轮战罢暂列小组第二
财联社,2026-03-06 18:04:57,特朗普称当前未考虑向伊朗派地面部队
财联社,2026-03-06 17:59:47,华灿光电：针对MicroLED在光通信等扩展领域的应用 目前仍处于早期研发和样品验证阶段
财联社,2026-03-06 17:56:58,俄央行将外币现金提取限制措施再延长半年
财联社,2026-03-06 17:54:51,Meta智能眼镜曝隐私风险 用户AI互动画面会被第三方查看
财联社,2026-03-06 17:54:35,胡塞称全面支持伊朗准备随时参战
财联社,2026-03-06 17:54:08,浙江省足协：2026年全力办好首届浙江省城市足球联赛
财联社,2026-03-06 17:54:06,方大炭素：拟使用自有资金购买理财产品 总额度不超过16亿元
财联社,2026-03-06 17:51:45,东阳光：拟取得东数一号70%股权 股票复牌
财联社,2026-03-06 17:49:36,意大利防长：美以违反国际法 “不是我们想要的战争”
财联社,2026-03-06 17:48:18,潘功胜：将继续稳步扩大金融高水平开放 支持上海国际金融中心建设
财联社,2026-03-06 17:47:44,连续6年赤字 德国科隆大教堂将收门票
财联社,2026-03-06 17:46:32,200多名船员已上岸 伊朗军舰船员转移至斯里兰卡
财联社,2026-03-06 17:45:35,南向资金今日净卖近22亿港元 阿里巴巴遭净卖出居前
财联社,2026-03-06 17:40:44,美油涨幅扩大至4% 续创2024年7月以来新高
同花顺,2026-03-06 17:25:55,美国天然气期货涨超6.00%，现报3.205美元/百万英热
同花顺,2026-03-06 17:21:30,以色列全境发布伊朗导弹最新预警，警报随时可能响起
同花顺,2026-03-06 17:16:47,美国原油价格升破90美元 伊朗战事持续冲击能源供应
财联社,2026-03-06 17:12:56,郑栅洁：从未来发展考虑 将推进人工智能超大规模智算集群、卫星互联网、可控核聚变等一系列重大工程和项目
财联社,2026-03-06 17:12:39,迪拜黄金库存积压严重 目前正以折扣价出售
财联社,2026-03-06 17:11:20,郑栅洁：“十五五”时期将实施一批投资万亿级以上的能源重大工程
财联社,2026-03-06 17:11:02,伊朗外长与古巴外长通话 谴责美以军事行动
财联社,2026-03-06 17:10:42,商务部部长谈外贸：西方不亮东方亮 任尔东西南北风
财联社,2026-03-06 17:08:16,澳洲3月9日起严禁未成年人访问色情网站
财联社,2026-03-06 17:06:48,恒瑞医药：子公司收到阿得贝利单抗注射液药物临床试验批准通知书
财联社,2026-03-06 17:06:46,"香港金管局：2026年2月底 官方外汇储备资产为4,392亿美元"
财联社,2026-03-06 17:05:52,蓝佛安：财政呈现紧平衡态势 必须更好地统筹生财、聚财、用财之道
财联社,2026-03-06 17:05:28,财政部部长：中央本级“三公”经费压减7%以上
财联社,2026-03-06 17:05:23,苏州人工智能专项母基金等成立投资合伙企业 出资额5亿
财联社,2026-03-06 17:04:19,潘功胜：在防范金融风险、维护金融稳定方面重点做好五个方面工作
财联社,2026-03-06 17:04:00,央行行长潘功胜：2025年我国重点领域金融风险有序化解 中国股票市场在全球主要股市中表现较好
财联社,2026-03-06 17:00:58,3月焦煤市场供需好转 价格震荡运行为主
财联社,2026-03-06 17:00:36,徽商银行：2025年净利润约169.3亿元 同比增长约6.3%
同花顺,2026-03-06 16:45:59,美联储理事：油价冲击可能抑制核心通胀
同花顺,2026-03-06 16:26:36,美国海关与边境保护局将推出退款处理系统
同花顺,2026-03-06 16:25:04,西班牙首相：美以对伊军事行动是“极其严重的错误”
同花顺,2026-03-06 16:24:20,预测市场平台Kalshi因伊朗领导人相关预测市场豁免条款遭起诉
财联社,2026-03-06 16:10:11,郑栅洁：“十五五”规划纲要草案中民生福祉类指标占比最高
财联社,2026-03-06 16:08:54,机构：成本抬升叠加出口利好 苯乙烯期价强势封涨停
财联社,2026-03-06 16:08:05,郑栅洁：应对学龄人口三个排浪式达峰 “十五五”规划将普通高中建设和优质本科扩容作为重点任务
财联社,2026-03-06 16:06:57,中微半导推出新一代CMS32F040系列32位微控制器
同花顺,2026-03-06 16:05:27,美国国务卿鲁比奥：美国目标是政权更迭而非更迭国家
财联社,2026-03-06 16:03:07,财政部部长蓝佛安：千亿级财政金融协同促内需专项资金可惠及万亿级信贷
财联社,2026-03-06 16:01:17,欧洲主要股指开盘集体上涨
财联社,2026-03-06 16:00:13,证监会主席吴清：监管执法和投资者保护是核心职能 不能削弱、只能加强
财联社,2026-03-06 15:58:42,长江和记宣布就巴拿马政府强行接管货柜码头事宜采取进一步法律行动
财联社,2026-03-06 15:58:12,吴清：中国资产吸引力明显提高
财联社,2026-03-06 15:57:30,财政部部长：中央财政安排1000亿元支持财政金融协同促内需
财联社,2026-03-06 15:55:49,证监会主席吴清：精准有力打击财务造假、操纵市场、内幕交易等恶性违法行为
财联社,2026-03-06 15:54:22,证监会主席吴清：围绕深化投融资综合改革 进一步完善资本市场基础制度
财联社,2026-03-06 15:54:15,证监会主席吴清：股市风向标的作用更加凸显
财联社,2026-03-06 15:53:22,证监会主席吴清：在持续狠抓上市公司真实性的基础上进一步提升可投性
财联社,2026-03-06 15:53:06,韩国与阿联酋商定恢复航班运行
同花顺,2026-03-06 15:23:09,中概股逆势走强 京东以5.5%涨幅领涨
同花顺,2026-03-06 15:22:34,日本考虑释放战略石油储备应对霍尔木兹海峡运输中断
同花顺,2026-03-06 15:19:08,美股三大股指跌幅收窄
财联社,2026-03-06 15:17:48,财政部部长：今年财政资金规模安排三方面创“新高”
财联社,2026-03-06 15:16:26,国债期货收盘多数持平
财联社,2026-03-06 15:16:20,郑栅洁：会同财政部、人民银行等部门设立国家级并购基金
财联社,2026-03-06 15:13:24,高澜股份：直流输电液冷产品已应用于国内外50余条高压直流输电工程
财联社,2026-03-06 15:12:56,国家发展改革委主任：“十五五”末人工智能相关产业规模将增长到10万亿元以上
财联社,2026-03-06 15:12:38,国家发展改革委主任：北斗产业规模五年内有望突破1万亿元
财联社,2026-03-06 15:12:17,上期所：铅期货合约交割品级中替代品对标准品贴水150元/吨
财联社,2026-03-06 15:11:49,郑栅洁：将推进“六张网”和重点领域建设 投资将超过7万亿元
财联社,2026-03-06 15:11:40,国家发展改革委主任：预计“十五五”时期服务业规模将突破100万亿元
财联社,2026-03-06 15:11:33,郑栅洁：安排更多的政策和资金 更好地释放消费潜力
同花顺,2026-03-06 15:11:25,"LME三月期铝价格上涨3%至每吨3,395美元"
财联社,2026-03-06 15:11:01,上期所：修订案及升贴水设置自2026年3月17日从铅期货PB2703合约开始实施
财联社,2026-03-06 15:08:20,国家发改委主任郑栅洁：预计今年GDP增量超过6万亿元
同花顺,2026-03-06 15:07:46,现货白银日内涨幅扩大至3%，报84.78美元/盎司
财联社,2026-03-06 15:07:41,扎波罗热核电站受损高压供电线路已修复
财联社,2026-03-06 15:06:34,出口设施仍然关闭 卡塔尔能源将其长期租用的LNG运输船对外出租
财联社,2026-03-06 15:04:46,本周多晶硅价格较大幅走跌 市场看空情绪逐渐加强
同花顺,2026-03-06 15:04:22,现货黄金向上触及5150美元，日内上涨1.39%
财联社,2026-03-06 15:02:30,港股IPO：琻捷电子递表港交所
财联社,2026-03-06 15:01:40,收评：沪指缩量涨0.38% 智能电网、化工板块全线走强
同花顺,2026-03-06 15:00:37,期市夜盘收盘，国内期货主力合约普涨
同花顺,2026-03-06 14:57:13,文远知行迪拜Robotaxi车队恢复运营
同花顺,2026-03-06 14:57:05,诚邦股份：2025年净亏损1.2亿元
同花顺,2026-03-06 14:51:31,美联储古尔斯比：今天的就业报告令人失望
同花顺,2026-03-06 14:42:48,国防部就澳大利亚炒作所谓中国军机不安全接近其舰载机答问
同花顺,2026-03-06 14:39:00,以军称精准打击一名伊朗高级指挥官
同花顺,2026-03-06 14:34:09,伊朗外长就军舰遭袭事件与印度和斯里兰卡外长通话
同花顺,2026-03-06 14:32:51,美国能源部长赖特：实施了抑制措施以帮助降低油价
同花顺,2026-03-06 14:32:43,美国总统特朗普认为汽油价格会“很快”下降
同花顺,2026-03-06 14:32:25,伊朗德黑兰传出巨大爆炸声
同花顺,2026-03-06 14:32:21,美国总统特朗普：古巴“很快”就会垮台
同花顺,2026-03-06 14:30:49,美股开盘：2月非农爆冷 美股三大指数集体低开
同花顺,2026-03-06 14:29:11,WTI原油日内暴涨12.00%，现报88.42美元/桶
同花顺,2026-03-06 14:25:27,全国政协委员郭媛媛：人工智能时代 陪伴不能被“AI”异化
同花顺,2026-03-06 14:19:42,深交所：本周对近期股价异常波动的“豫能控股”进行重点监控
同花顺,2026-03-06 14:10:39,卡塔尔政府发出手机警报，警告威胁升级
同花顺,2026-03-06 14:10:32,化工品期货夜盘全线上涨
同花顺,2026-03-06 14:07:02,安迪苏：2025年度净利润11.55亿元，同比下降4.13%
同花顺,2026-03-06 14:06:24,土耳其银行指数跌4.7%，创1月16日以来盘中新低
同花顺,2026-03-06 14:06:08,浙江东日：2025年净利润1.44亿元，同比增长6.94%
同花顺,2026-03-06 14:04:01,燃油主力合约日内暴涨16.00%，现报4511.00元/吨
财联社,2026-03-06 14:03:48,先为达生物：全球首个偏向型GLP-1减重药物先维盈获批上市
同花顺,2026-03-06 14:02:35,外交部副部长苗得雨出席加纳独立日招待会
同花顺,2026-03-06 14:02:18,郑商所短纤主力合约触及涨停
同花顺,2026-03-06 13:59:44,亚马逊美股盘前跌超2%
财联社,2026-03-06 13:59:06,联合海上信息中心：霍尔木兹海峡航运几乎完全停滞
同花顺,2026-03-06 13:58:34,英伟达美股盘前跌超2%
同花顺,2026-03-06 13:58:20,郑商所甲醇主力合约大涨8%
财联社,2026-03-06 13:57:30,蜜雪冰城正试水现磨咖啡
同花顺,2026-03-06 13:55:35,美股恐慌指数VIX最新上涨3.12点至26.87点
同花顺,2026-03-06 13:55:20,盖普美股盘前跌超10%
同花顺,2026-03-06 13:53:46,全国政协委员张文宏呼吁：为中国创新药企的生存与盈利留出空间
同花顺,2026-03-06 13:52:31,布伦特原油2024年4月以来首次升破90美元/桶，消息称，科威特削减部分油田石油产量
财联社,2026-03-06 13:51:26,阿联酋考虑冻结伊朗资产
同花顺,2026-03-06 13:48:33,高盛：仍预计美联储将降息两次 落地时间难测
同花顺,2026-03-06 13:47:36,大商所焦煤主力合约大涨5%
财联社,2026-03-06 13:45:59,今天上午日本再向海洋排放核污染水
同花顺,2026-03-06 13:45:54,WTI原油日内暴涨逾10%
同花顺,2026-03-06 13:45:52,美股三大股指期货均跌超1%
财联社,2026-03-06 13:44:44,安世中国：大部分业务已恢复运行 可保障基本生产运营
财联社,2026-03-06 13:43:49,【金牌纪要库·风口会议】英伟达投资全球光芯片领域技术龙头，提升、锁定高端部件供货能力，这家英伟达核心供应商有望进一步提升高端光模块出货能力
同花顺,2026-03-06 13:42:25,美国劳动力市场“假性企稳”或迫使美联储重新审视就业风险
同花顺,2026-03-06 13:23:07,华培动力：终止筹划发行可转换公司债券及支付现金购买资产并募集配套资金暨关联交易事项并复牌
财联社,2026-03-06 13:19:14,东芝重组巨额债务 目标2028财年重新上市
财联社,2026-03-06 13:17:33,沪深两市成交额突破1.5万亿 较上一日此时缩量超1600亿
财联社,2026-03-06 13:14:34,中国信通院：截至2025年6月我国计算设备智能算力规模达到782 EFlops 同比增长96%
财联社,2026-03-06 13:12:21,李云泽谈金融机构资本补充：通过市场化方式撬动更多社会资金
同花顺,2026-03-06 13:11:45,PTA主力合约触及涨停，涨幅7.01%，现报6316元/吨
同花顺,2026-03-06 13:10:29,2026全球开发者先锋大会将于3月27日至29日在上海举办
同花顺,2026-03-06 13:09:12,香溢融通：2025年净利润8030.57万元，同比增长51.03%
财联社,2026-03-06 13:06:12,【风口研报·公司】北美七大科技巨头签署自主供电承诺，分析师强call公司新获海外客户9亿元/年的燃气发电项目定点，且今年将开始供货，未来还有望实现拓品类和拓客户
