来源,时间,标题
同花顺,2026-01-01 09:26:38,2025年一汽解放全年销售整车突破28万辆
财联社,2026-01-01 09:24:13,元旦长三角铁路预计发送旅客370万人次
财联社,2026-01-01 09:23:30,金饰克价跌至1345元
财联社,2026-01-01 09:15:10,港珠澳大桥客流车流双破纪录
同花顺,2026-01-01 09:05:20,中信证券：预计美联储将在2026年1月暂停降息
财联社,2026-01-01 09:01:30,2025年度中国电影总票房518.32亿 同比增长21.95%
同花顺,2026-01-01 09:00:57,中信证券：太空光伏有望步入万亿元市场规模，建议把握太空光伏长期投资机会
财联社,2026-01-01 08:59:14,叙北部安全人员遭自杀式袭击致1死多伤
同花顺,2026-01-01 08:53:58,联合国报告：东京滑落为全球人口第三大城市
同花顺,2026-01-01 08:50:13,DeepSeek元旦发布新论文 开启架构新篇章
财联社,2026-01-01 08:37:54,天津低空飞行服务平台及“低空云”试运行
同花顺,2026-01-01 08:37:17,元旦假期前一天，全社会跨区域人员流动量超2亿人次
财联社,2026-01-01 08:33:09,《天津市民营经济促进条例》今起施行
财联社,2026-01-01 08:32:41,四川新能源装机容量突破3200万千瓦
财联社,2026-01-01 08:17:01,2025年三峡船闸年通过量、升船机年客运量双创历史新高
同花顺,2026-01-01 08:09:03,蔚来：2026年1月1日起车辆购置税优惠政策将由免征调整为减半征收
同花顺,2026-01-01 08:04:59,"蔚来汽车2025年共交付326,028辆，同比增长46.9%"
同花顺,2026-01-01 08:04:29,"小鹏汽车2025年12月交付37,508辆"
同花顺,2026-01-01 08:04:29,"小鹏汽车2025年年交付量达到429,445辆，较去年增长126%"
同花顺,2026-01-01 07:54:45,瑞士滑雪胜地爆炸以致10死10伤
财联社,2026-01-01 07:48:11,委内瑞拉一化工企业否认涉毒指控 称火灾非遭袭所致
财联社,2026-01-01 07:41:18,大风蓝色预警继续发布 新疆甘肃等4省区部分地区阵风可达7至8级
同花顺,2026-01-01 07:39:14,RCEP生效实施四年 浙江超800亿元出口货物享惠
财联社,2026-01-01 07:34:01,鸿蒙智行12月交付89611台
财联社,2026-01-01 07:31:07,寒潮蓝色预警继续：江西、福建等地部分地区降温可达10℃
同花顺,2026-01-01 07:26:41,极氪月销首破3万台，2025全年交付超22.4万台
财联社,2026-01-01 07:22:21,AI加速全球可控核聚变商业化进程
同花顺,2026-01-01 07:14:23,青茂边检站2025年验放出入境旅客超3600万人次
同花顺,2026-01-01 07:09:27,美称打击两艘所谓贩毒船打死5人
财联社,2026-01-01 07:05:30,银行通过香港贴现窗口借入资金规模创7月份以来最高
同花顺,2026-01-01 06:51:49,元旦买金热：水贝黄金挤满买金人，投资银条溢价也缺货
财联社,2026-01-01 06:46:41,刚果（金）东部南基伍省冲突造成至少1500名平民死亡
同花顺,2026-01-01 06:46:01,蔚来品牌换电体系一月份将新增超4200块长续航电池包
同花顺,2026-01-01 06:44:16,2026年元旦档档期票房破2亿
财联社,2026-01-01 06:39:44,委内瑞拉军方称已摧毁第40架涉毒飞机
财联社,2026-01-01 06:31:22,离岸人民币兑美元较周二纽约尾盘涨165点
财联社,2026-01-01 06:30:00,周四你需要知道的隔夜全球要闻：美股三大指数连续三年录得超两位数涨幅；国际金银均创1979年以来最大年度涨幅；国际原油期货结算价创2020年以来最大年度跌幅
同花顺,2026-01-01 06:16:25,上汽大众今年将投放7款全新车型
财联社,2026-01-01 06:08:57,国际金银均创1979年以来最大年度涨幅 现货白银2025年涨近150%
财联社,2026-01-01 06:01:05,保加利亚加入欧元区 成为第21个使用欧元的国家
同花顺,2026-01-01 05:58:16,2025年全国碳市场平稳有序运行
财联社,2026-01-01 05:55:03,沃伦·巴菲特正式退休 卸任伯克希尔·哈撒韦首席执行官
同花顺,2026-01-01 04:59:53,卢卡申科：乌军工厂“一分钟内”被俄导弹摧毁
同花顺,2026-01-01 04:38:25,花旗：印度钢铁股或维持区间震荡走势 进口关税难改格局
同花顺,2026-01-01 04:07:41,上汽通用五菱新能源汽车全年销量首超百万 渗透率提升至61%
同花顺,2026-01-01 01:47:34,小米汽车12月交付量超过5万台
同花顺,2026-01-01 01:45:46,目前主要持有哪些类型的中国股票？罗杰斯回应
同花顺,2026-01-01 00:49:10,安徽省第二季惠民观影活动今日启动 将发放总值3940万元的电影消费券
同花顺,2026-01-01 00:19:48,经济日报：培育更多健康消费增长点
同花顺,2026-01-01 00:08:25,韩国12月份出口同比增长13.4%
同花顺,2025-12-31 23:57:15,新年全国首单“国补”，花落广州
同花顺,2025-12-31 22:55:10,美国对七国旅行禁令于1月1日生效
同花顺,2025-12-31 22:53:24,全球最大黄金ETF--SPDR Gold Trust持仓较上日减少1.43吨
同花顺,2025-12-31 22:52:57,加沙停火协议第二阶段停滞 美以持续施压
同花顺,2025-12-31 22:51:34,打击“伊斯兰国”联军将撤离在伊拉克一处主要基地
同花顺,2025-12-31 22:41:39,普京新年贺词：相信我们终将胜利
同花顺,2025-12-31 22:33:05,墨西哥比索兑美元2025年累计上涨13.53%
同花顺,2025-12-31 22:09:24,波音公司获得一份价值27亿美元的固定价格合同
同花顺,2025-12-31 22:00:41,塞浦路斯开始担任欧盟轮值主席国
同花顺,2025-12-31 21:48:29,寒潮推动电力需求飙升，法国核电发电量创七年最高
