来源,时间,标题
财联社,2026-04-05 03:40:16,尼日利亚发生大规模绑架事件 超150人被绑架
财联社,2026-04-05 03:38:47,以官员称伊朗仍有超千枚可打击以色列的弹道导弹
财联社,2026-04-05 02:56:53,以军等美国开绿灯袭击伊朗能源设施
财联社,2026-04-05 01:48:03,伊朗称打击地区美方目标 科威特及阿联酋传出爆炸声
财联社,2026-04-05 01:22:41,伊朗媒体：特朗普深陷战争泥潭
财联社,2026-04-05 01:22:13,美国将在对伊军事行动中投入几乎全部远程隐身巡航导弹
财联社,2026-04-05 00:34:45,美媒称伊朗用多光谱摄像机识别美以战机
财联社,2026-04-05 00:29:53,伊朗发动第七轮导弹袭击 耶路撒冷拦截导弹升空
财联社,2026-04-05 00:09:44,两架美国“黑鹰”被伊朗山民击中
财联社,2026-04-05 00:08:37,伊朗外长：若发生核泄漏 周边国家将遭殃
财联社,2026-04-04 23:14:44,美国油价升至每加仑4.1美元 伊朗战争爆发后已上涨37%
财联社,2026-04-04 22:45:41,伊朗“圣城旅”已故指挥官苏莱曼尼的亲属在美被逮捕
财联社,2026-04-04 22:39:42,土耳其总统：美以伊冲突已致地区陷入地缘战略僵局
财联社,2026-04-04 22:34:44,俄国家原子能公司从伊朗布什尔核电站撤离198人
财联社,2026-04-04 22:20:56,特朗普再警告伊朗：“48小时内”可能采取进一步行动
财联社,2026-04-04 22:03:41,媒体称至少16架美国MQ－9型“死神”无人机被击落
财联社,2026-04-04 21:46:18,清明假期首日 长三角铁路客流破单日纪录
财联社,2026-04-04 21:23:43,伊朗称打击以色列本-古里安机场多个设施
财联社,2026-04-04 21:10:56,【电报解读】全球首次！国星宇航硅基智能体调用太空算力通过信通院测试，太空算力被视为数字经济的“战略制高点”，行业正从“概念验证”走向“工程实践”，这家公司与国星宇航有业务合作
财联社,2026-04-04 21:06:34,兆瓦级氢燃料航空涡桨发动机首飞成功
财联社,2026-04-04 21:00:47,伊朗：开战以来 763所学校被毁
财联社,2026-04-04 20:53:09,厄瓜多尔瓜亚斯省发生5.3级地震
财联社,2026-04-04 20:46:20,安阳钢铁：二炼轧作业部高磁感取向硅钢再获新突破
财联社,2026-04-04 20:29:20,德国外长呼吁欧盟决策取消全体一致通过原则
财联社,2026-04-04 20:12:07,4月4日周六《新闻联播》要闻23条
财联社,2026-04-04 20:02:22,伊朗伊斯兰革命卫队：击中霍尔木兹海峡一艘以相关船只
财联社,2026-04-04 19:55:21,匈牙利总理：欧洲能源危机逼近 欧盟应尽快补充油气储备
财联社,2026-04-04 19:51:25,伊朗称霍尔木兹甘省2座港口遭袭
财联社,2026-04-04 19:43:05,充电涨价与“用油发电”关系不大 我国不存在大规模用油发电情况
财联社,2026-04-04 19:35:51,伊朗核电站附近再遭袭 国际原子能机构呼吁严防核事故
财联社,2026-04-04 19:31:16,伊朗外长：针对伊石化设施的袭击揭示美以真正意图
财联社,2026-04-04 19:12:50,土耳其两周用掉近120吨黄金
财联社,2026-04-04 19:08:28,菲律宾南部海域发生6.0级地震
财联社,2026-04-04 19:07:51,伊外长：美媒歪曲伊朗立场 伊朗从未拒绝前往伊斯兰堡
财联社,2026-04-04 18:57:13,印尼北苏拉威西省附近海域发生6.2级地震
财联社,2026-04-04 18:53:03,多只千亿市值科技巨头近一周获得逾百家机构调研
财联社,2026-04-04 18:42:57,美以袭击对伊朗25家制药企业造成损失
财联社,2026-04-04 18:35:26,Meta将于5月份在墨西哥湾区削减近200个工作岗位
财联社,2026-04-04 18:26:19,伊朗否认石化经济特区遭袭后发生有毒物质泄漏
财联社,2026-04-04 18:22:23,中信建投：紧盯中东变局 把握中国优势资产
财联社,2026-04-04 18:10:06,针对德国中餐从业人员盗抢等恶性案件频发 中领馆提醒
财联社,2026-04-04 17:52:10,以色列最大天然气田恢复运营
财联社,2026-04-04 17:46:54,重庆一固定三角翼飞行器坠落致2人受伤 官方通报
财联社,2026-04-04 17:36:02,伊拉克关闭与伊朗接壤的一处边境口岸
财联社,2026-04-04 17:20:50,日本商船三井公司：关联公司一艘液化石油气船通过霍尔木兹海峡
财联社,2026-04-04 17:17:27,印度塔塔钢铁因超额采矿被罚款约1.89亿美元
财联社,2026-04-04 16:53:48,以军称监测到新一波来袭的伊朗导弹
财联社,2026-04-04 16:53:23,美联航将暂停飞往以色列航班至9月份
财联社,2026-04-04 16:49:31,中东战争令欧洲热泵供暖需求激增
财联社,2026-04-04 16:44:44,伊朗布什尔核电站附近区域遭袭致1人死亡
财联社,2026-04-04 16:38:25,中国人民银行行长潘功胜会见标准银行集团首席执行官西姆•沙巴拉拉
财联社,2026-04-04 16:30:03,通威与GBP株式会社签署合作框架协议
财联社,2026-04-04 16:22:29,乌克兰对俄罗斯相关实体及个人实施制裁
财联社,2026-04-04 16:21:45,美以袭击伊朗石化经济特区多人受伤
财联社,2026-04-04 16:19:07,土交通部长称又一艘土耳其船只通过霍尔木兹海峡
财联社,2026-04-04 16:18:01,广东备案大模型数量已达132款
财联社,2026-04-04 16:06:15,伊朗警告以色列：若伊使馆和外交机构遭袭 将迅速反击
财联社,2026-04-04 16:01:03,中国人民银行行长潘功胜会见埃塞俄比亚央行行长伊尤布·特卡里恩
财联社,2026-04-04 15:55:53,浙江金七门核电“华龙一号”2号机组建设全面启动
财联社,2026-04-04 15:48:20,伊官员：伊朗石油出口量有所增加 全国燃料供应正常
财联社,2026-04-04 15:46:31,美情报评估：霍尔木兹海峡短期内不太可能“打通”
财联社,2026-04-04 15:45:30,伊朗马赫沙赫尔石化特区发生爆炸
财联社,2026-04-04 15:45:05,中加金融工作组首次会议在京举行
财联社,2026-04-04 15:40:42,国际货币基金组织敦促日本央行继续加息
财联社,2026-04-04 15:39:15,胜宏科技：未来AI PCB是整个PCB行业最具确定性的增长细分方向
财联社,2026-04-04 15:34:36,浙江嘉兴港首次实现重大件设备直通欧洲
财联社,2026-04-04 15:33:30,因燃油价格上涨 欧盟五国财长呼吁对能源企业征收暴利税
财联社,2026-04-04 15:31:49,伊朗军方：如基础设施遇袭 将“更有力更果断”回击
财联社,2026-04-04 15:31:03,中国驻以使馆提醒在以中国公民远离民用基础设施
财联社,2026-04-04 15:24:27,对伊朗行动致美军13死365伤
财联社,2026-04-04 15:21:03,中国有色金属工业协会硅业分会赴包头开展硅产业深度调研
财联社,2026-04-04 15:12:00,伊朗军方：已做好伏击敌方先进战斗机的准备
财联社,2026-04-04 15:07:45,第七艘悬挂印度国旗的液化石油气船驶出霍尔木兹海峡
财联社,2026-04-04 15:02:24,美国大模型头部公司宣布正式封杀OpenClaw
财联社,2026-04-04 14:55:46,全国春灌面积达1.5亿亩 累计供水142亿立方米
同花顺,2026-04-04 14:55:22,伊朗允许运载必需品的船只通过霍尔木兹海峡
财联社,2026-04-04 14:43:28,铁路12306已累计发售清明假期车票6125万张
财联社,2026-04-04 14:41:21,法国海关查获1.1吨可卡因
财联社,2026-04-04 14:39:35,伊朗称美驻沙特大使馆遭袭与伊无关 系以色列所为
财联社,2026-04-04 14:34:46,以军称空袭德黑兰多处关键基础设施
财联社,2026-04-04 14:22:58,一季度经深圳机场口岸免签入境外国人增长超六成
财联社,2026-04-04 14:14:39,伊朗称击落一架敌方MQ-1无人机
同花顺,2026-04-04 14:02:01,俄罗斯从伊朗布什尔核电站撤离198名员工，称事态正朝最糟糕情况发展
财联社,2026-04-04 14:01:46,广西海事局启动西江干线船舶水污染物“零排放”工作
同花顺,2026-04-04 14:00:39,东航物流依托第五航权首次完成新西兰至阿根廷活体动物运输
同花顺,2026-04-04 13:55:28,以色列多地遭袭
同花顺,2026-04-04 13:55:24,美国情报界评估：伊朗短期内不会放松对霍尔木兹海峡的控制
同花顺,2026-04-04 13:55:17,新修订《殡葬管理条例》全面实施，让殡葬服务更透明可及
同花顺,2026-04-04 13:55:12,466万人次，长三角铁路单日客发量创历史新高
财联社,2026-04-04 13:46:55,猪价低位下探 或刺激行业去产能提速
财联社,2026-04-04 13:38:51,深圳“细胞十条”发布 推动细胞与基因产业提速发展
财联社,2026-04-04 13:31:10,法国“戴高乐”号航母停靠希腊苏达湾海军基地
同花顺,2026-04-04 13:23:56,全球首次！我国兆瓦级氢燃料航空涡桨发动机首飞成功
财联社,2026-04-04 13:23:52,伊朗总统：让国际社会评判 谁是谈判者谁是恐怖分子
同花顺,2026-04-04 13:16:48,伊朗称动用新型防空系统击落美国战机
财联社,2026-04-04 13:11:43,假期首日 国铁集团郑州局预计发送旅客98.6万人次
财联社,2026-04-04 13:03:50,美国加州南部野火迅速蔓延 地方政府下达疏散令
财联社,2026-04-04 12:58:53,一名美军战机飞行员仍失踪 特朗普：希望“那种情况”不会发生
同花顺,2026-04-04 12:57:57,斯里兰卡多措并举应对能源危机
同花顺,2026-04-04 12:50:05,以军称袭击伊朗“圣城旅”黎巴嫩部队和杰哈德指挥中心
财联社,2026-04-04 12:48:38,2026年清明档新片票房破亿
同花顺,2026-04-04 12:35:19,伊朗发动第95波打击
财联社,2026-04-04 12:34:53,金饰价格一夜又跌11元
同花顺,2026-04-04 12:31:46,澳门国际乒联单打世界杯：王楚钦战胜约奇克晋级四强
财联社,2026-04-04 12:28:52,清明假期首日琼州海峡客流预计达8万人次 同比增长约14%
同花顺,2026-04-04 12:26:56,霍尔木兹海峡航运险情升级，美国再保险扩容至400亿美元
财联社,2026-04-04 12:24:57,伊朗德黑兰接连传出多次爆炸声
同花顺,2026-04-04 12:18:32,陈群获任联合国教科文组织教育助理总干事
财联社,2026-04-04 12:17:51,财联社创投通：一级市场本周融资总额约113.99亿元 先进制造、医疗健康活跃度居前
财联社,2026-04-04 11:57:44,能源供应趋紧 韩国鼓励非高峰使用公共交通
财联社,2026-04-04 11:51:53,迪拜甲骨文大楼外立面遭防空系统拦截碎片击中 无人员伤亡
财联社,2026-04-04 11:50:52,美国20多州就特朗普政府有关邮寄投票行政令提起诉讼 白宫回应
同花顺,2026-04-04 11:50:18,两架美军战机被伊朗击落，美以对伊朗发动军事行动以来首次承认
同花顺,2026-04-04 11:50:17,美国和以色列袭击伊朗首都大学，教学中心成废墟
财联社,2026-04-04 11:49:11,南非新政延长签证宽限期 将刺激旅游市场
财联社,2026-04-04 11:34:51,清明假期第一天 全社会跨区域人员流动量预计约2.96亿人次
财联社,2026-04-04 11:25:09,深圳市暴雨黄色预警信号扩展至全市
财联社,2026-04-04 11:20:57,中国新型储能新增装机连续四年居全球首位 预计2030年累计将超370GW
同花顺,2026-04-04 11:17:35,辽宁沈阳 潜逃近十年 涉贷款诈骗嫌疑人被押解回国
财联社,2026-04-04 11:11:53,小鹏回应澳大利亚独家经销商合作破裂
同花顺,2026-04-04 11:09:25,伊朗外长：美国媒体歪曲伊朗立场 伊朗从未拒绝前往伊斯兰堡
同花顺,2026-04-04 11:09:05,清明假期第一天全国道路交通平稳有序
财联社,2026-04-04 10:58:57,也门民众大规模集会谴责美以罪行
财联社,2026-04-04 10:57:43,中东局势致燃料紧缺 日本多地温泉被迫停业
财联社,2026-04-04 10:56:48,农业成本因伊朗战事上升 土耳其取消部分化肥关税
同花顺,2026-04-04 10:54:04,美国情报部门评估，霍尔木兹海峡短期内不太可能“打通”
财联社,2026-04-04 10:40:50,千问3.6Plus大模型登顶全球模型调用排行榜首 日调用量破万亿
财联社,2026-04-04 10:37:55,美国旧金山国际机场发生火灾
同花顺,2026-04-04 10:26:30,中国散户又出手了！相信“回调就是上车机会”，3月以来净买入1.25万亿
同花顺,2026-04-04 10:26:28,奥地利副总理：不想卷入特朗普发动的战争
财联社,2026-04-04 10:20:45,铁路上海站今日预计发送旅客76.1万人 同比增11%
财联社,2026-04-04 10:19:40,我国牵头高压直流输电领域电容器国际标准成功立项
同花顺,2026-04-04 10:18:44,清明假期港珠澳大桥珠海公路口岸迎来入境客流车流高峰
财联社,2026-04-04 10:12:53,我国主导国际学术期刊Vita将出版
同花顺,2026-04-04 10:12:33,日本日媒：高市政府已敲定放宽武器出口方案
同花顺,2026-04-04 10:12:30,美国媒体报道 特朗普对两部长不满 或进一步调整内阁
财联社,2026-04-04 10:11:36,清明假期预计出游规模增长6% 跨省游占比超54%
财联社,2026-04-04 10:08:58,长三角铁路今日预计发送旅客455万人次
财联社,2026-04-04 10:06:22,以色列袭击黎巴嫩致至少10人受伤
财联社,2026-04-04 10:05:50,美官员：伊朗对美国驻沙特大使馆的袭击造成严重破坏
财联社,2026-04-04 10:00:15,多省区国省干线多路段因雨雪雾封闭管控
财联社,2026-04-04 09:48:11,总投资50亿元 苏州光通信产业基地将落户苏州工业园区
财联社,2026-04-04 09:47:29,印尼北苏拉威西省附近海域发生5.8级地震
财联社,2026-04-04 09:46:31,以军在叙利亚南部发动袭击
财联社,2026-04-04 09:43:12,财政部副部长廖岷视频会见世界银行副行长萨维德拉
财联社,2026-04-04 09:37:29,国家统计局：3月下旬生猪价格环比下降5.9%
同花顺,2026-04-04 09:31:09,清明假期首日，北京祭扫+出京“双高峰”部分路段车流集中
同花顺,2026-04-04 09:31:00,以军称伊朗发射集束弹头导弹 击中以中部多地致住宅受损
同花顺,2026-04-04 09:30:57,美以对伊朗发动军事打击 伊朗展开反击 冲突进入第36天 美以伊对抗仍在升级
财联社,2026-04-04 09:23:17,第四届链博会推介会暨中哈供应链合作研讨会在阿斯塔纳成功举办
财联社,2026-04-04 09:10:15,非盟欢迎中巴关于恢复海湾和中东地区和平稳定的倡议
财联社,2026-04-04 09:08:32,全国铁路今天预计发送旅客2190万人次
同花顺,2026-04-04 09:03:11,外媒：讲述中国成功的真相对实现和平至关重要
财联社,2026-04-04 09:00:34,秘鲁首都一体育场墙体倒塌 至少60人受伤
财联社,2026-04-04 08:46:37,上海航运交易所：地缘局势依旧紧张 多数运价继续上涨
财联社,2026-04-04 08:42:28,以军空袭位于贝鲁特的黎巴嫩真主党基础设施
财联社,2026-04-04 08:39:21,中金：黄金投资需求和价格或均存向上修复空间
财联社,2026-04-04 08:30:46,清明假期首日南方降雨短暂缩减 华北黄淮等地仍有风沙来扰
同花顺,2026-04-04 08:26:11,全球共话“十五五”开局｜跨国企业负责人：中国“强科技+扩内需”为世界提供“新机遇”
财联社,2026-04-04 08:20:00,美国防部：365名美军人员在对伊朗军事行动中受伤
财联社,2026-04-04 08:17:08,江苏：加快打造人工智能创新发展高地 大力支持OPC创新创业
财联社,2026-04-04 08:09:48,蓝佛安会见加拿大财政部部长商鹏飞
财联社,2026-04-04 08:03:33,伊朗伊斯兰革命卫队任命穆哈比为发言人
同花顺,2026-04-04 08:00:24,以军称空袭德黑兰“关键基础设施”，以多地因伊朗打击受损
同花顺,2026-04-04 07:59:53,网传“印尼油轮通过霍尔木兹海峡”视频系伪造
财联社,2026-04-04 07:45:45,中指研究院：3月50城住宅租金止跌回升 一线城市集体上涨
同花顺,2026-04-04 07:45:34,军事评论员：美国空军预警机还够用吗
财联社,2026-04-04 07:22:48,2025年我国商业航天核心产业规模超万亿元
财联社,2026-04-04 07:08:48,以色列南部工业园遭伊朗导弹袭击起火
同花顺,2026-04-04 07:07:13,霍尔木兹海峡的船舶交通量略有上升，但仍处于较低水平
财联社,2026-04-04 07:00:41,15部门启动“一起益企”中小企业服务行动
财联社,2026-04-04 06:45:24,以色列称监测到伊朗发射的导弹 南部多地响起防空警报
财联社,2026-04-04 06:36:27,中央气象台4月4日06继续发布大风蓝色预警
财联社,2026-04-04 06:26:21,周六你需要知道的隔夜全球要闻：伊朗拒绝在伊斯兰堡与美方会面，美军两架战机接连坠毁；多国股市因假期休市
财联社,2026-04-04 06:11:23,伊朗公布击中美军A-10攻击机瞬间画面
财联社,2026-04-04 05:59:04,中央气象台继续发布沙尘暴蓝色预警
财联社,2026-04-04 05:50:27,伊朗军方严正警告美方：若破坏伊基础设施必遭强硬回击
财联社,2026-04-04 05:11:00,高市政府已敲定放宽武器出口方案 拟月内修改相关限制原则
财联社,2026-04-04 04:27:19,阿富汗北部地震已致8人死亡
财联社,2026-04-04 04:13:26,美军两架搜救直升机被击中 无人受伤
财联社,2026-04-04 04:11:15,美以空袭伊朗卡拉季大桥已致13人遇难
财联社,2026-04-04 04:00:36,特朗普称美军机被击落不会影响与伊朗谈判
财联社,2026-04-04 03:53:50,伊朗首都德黑兰再次遭袭
财联社,2026-04-04 03:38:43,伊朗驳斥“防空系统已被摧毁”的说法 公布最新战果
财联社,2026-04-04 03:05:31,美军又一架战机坠毁
财联社,2026-04-04 02:54:48,美方曾提议停火48小时 伊朗以战场行动作出“回应”
财联社,2026-04-04 02:30:25,阿联酋天然气设施起火 致1死4伤
财联社,2026-04-04 02:21:09,伊朗驻阿根廷临时代办被驱逐 离境前批阿方“站队”美以
财联社,2026-04-04 02:13:16,美军“黑鹰”直升机执行搜救任务时疑似被伊朗击中
财联社,2026-04-04 02:03:44,美伊停火斡旋陷入僵局 伊朗拒绝在伊斯兰堡与美方会面
财联社,2026-04-04 02:03:44,伊朗正式回复调解方：未来几天里不愿在巴基斯坦与美国官员会面
财联社,2026-04-04 02:00:44,商务部：从未组织、参与或运营任何冠名“投资中国”字样的App应用
财联社,2026-04-04 02:00:15,美法官维持撤销鲍威尔相关传票裁决 检方誓言提起上诉
财联社,2026-04-04 01:37:50,联黎部队阵地发生爆炸 三名维和人员受伤
财联社,2026-04-04 01:37:18,中东最大铝生产商的工厂遭袭受损严重 全面复产或需一年
财联社,2026-04-04 01:35:17,美使馆称黎巴嫩境内的大学或遭袭 敦促美公民撤离
财联社,2026-04-04 01:27:43,伊朗议长发文嘲讽美国战机被击落
财联社,2026-04-04 01:21:13,巴西南部一小型飞机坠毁 至少三人死亡
同花顺,2026-04-04 01:01:45,越南一季度GDP同比增长7.83%
财联社,2026-04-04 01:01:05,旧金山联储行长：美国就业零增长未必意味劳动力市场疲软
财联社,2026-04-04 00:39:24,伊朗发起“真实承诺-4”行动第93波攻势
财联社,2026-04-04 00:38:55,一架美国F-16战斗机将在沙特紧急降落
财联社,2026-04-04 00:31:32,日欲开发低成本导弹加强反击能力
财联社,2026-04-04 00:17:59,伊朗恰拉克港口遭袭 4艘登陆艇受损 1人遇难
财联社,2026-04-04 00:13:37,特朗普计划拨款1.52亿美元重启“恶魔岛”监狱
财联社,2026-04-04 00:10:58,中东冲突推高能源成本 全球食品价格3月上涨
财联社,2026-04-04 00:05:43,民调：美民众对美以伊战事普遍悲观 超七成反对派遣地面部队
财联社,2026-04-03 23:57:14,以军称过去24小时对伊朗多地实施70余次空袭
财联社,2026-04-03 23:56:49,俄土总统通电话讨论波斯湾形势
财联社,2026-04-03 23:49:42,以媒称一名被击落美军战机机组人员“已被救出”
财联社,2026-04-03 23:37:31,“新美联储通讯社”：就业超预期增长暂解美联储两难 市场削减降息押注
财联社,2026-04-03 23:24:18,恒信东方：因2022年年报存在虚假记载被实施其他风险警示 股票简称变更为“ST恒信”
财联社,2026-04-03 23:18:52,美国联手新伙伴 将霍尔木兹海峡再保险担保翻倍至400亿美元
财联社,2026-04-03 23:09:51,以军称对德黑兰基础设施发动新一轮空袭
财联社,2026-04-03 23:08:45,洲际油气：股东海口东铎涉嫌在限制转让期内转让股票 收到行政处罚事先告知书
财联社,2026-04-03 23:03:16,快舟十一号遥十三运载火箭通过出厂质量评审
财联社,2026-04-03 22:48:04,500Ah+大电芯密集亮相储能展 业内预计下半年至明年行业将进入市场切换期
同花顺,2026-04-03 22:44:12,意大利央行下调未来三年经济增长预期
财联社,2026-04-03 22:36:05,阿联酋环球铝业公司：恢复阿布扎比铝产量可能需时长达一年
财联社,2026-04-03 22:23:10,我国将加快培育太空算力产业 稳居全球“第一梯队”
财联社,2026-04-03 22:20:58,特朗普欲将NASA在2027年拨款缩减至188亿美元 降幅达23%
财联社,2026-04-03 22:08:25,美官员证实一架美军战斗机在伊朗境内被击落
财联社,2026-04-03 22:02:54,美国服务业活动自2023年以来首次萎缩
财联社,2026-04-03 21:50:59,小米法务部：已帮助66位车主向法院成功立案 民事诉讼案取得首个胜诉判决
财联社,2026-04-03 21:47:32,伊朗媒体称美方营救飞行员未能成功
财联社,2026-04-03 21:47:23,张雪机车创始人：未来五年 中国大排量摩托会吃掉50%以上的份额
财联社,2026-04-03 21:45:27,美国3月标普全球服务业PMI终值49.8 为3年来新低
财联社,2026-04-03 21:42:21,航锦科技：因涉嫌信披违规被证监会立案
财联社,2026-04-03 21:41:49,诺和诺德称Wegovy片剂平均减重效果显著优于礼来的orforglipron
财联社,2026-04-03 21:40:31,财联社4月3日晚间新闻精选
财联社,2026-04-03 21:39:36,事关数据产权登记 国家数据局公开征求意见
财联社,2026-04-03 21:37:02,摩根大通：AI需求“挤爆”先进制程 台积电Q1毛利率或超预期上行
财联社,2026-04-03 21:32:06,特朗普要求1.5万亿美元军费
财联社,2026-04-03 21:31:04,胡塞武装强调不会袖手旁观
财联社,2026-04-03 21:30:43,俄外长：美国不应空谈解封霍尔木兹海峡 而应停火
财联社,2026-04-03 21:23:05,准油股份修正2025年度业绩预告：预计营业收入2.7亿元–2.95亿元
财联社,2026-04-03 21:21:02,准油股份修正2025年度业绩预告：预计扣除后营业收入2.695亿元-2.945亿元 股票交易可能被实施退市风险警示
财联社,2026-04-03 21:21:02,准油股份：股票交易可能被实施退市风险警示
财联社,2026-04-03 21:20:57,以军称伊朗向以色列发动新一轮导弹袭击
同花顺,2026-04-03 21:20:06,富时中国A50指数期货夜盘收涨0.31%，报14503点
财联社,2026-04-03 21:16:20,2026年度电影总票房突破120亿
财联社,2026-04-03 21:10:46,高乐股份：拟定向募资不超8.54亿元 用于补充流动资金
财联社,2026-04-03 21:09:41,并行科技：拟采购不超过1.02亿元交换机等网络设备和不超过4624万元GPU算力服务器
财联社,2026-04-03 21:09:34,长虹能源：拟9.99亿元投建马来西亚锂电池生产基地
财联社,2026-04-03 21:08:06,泰达股份：拟向泰达供应链转让其持有的泰达能源51%股权 交易价格1.87亿元
财联社,2026-04-03 21:03:34,储能电芯供不应求：订单排期至明年 企业加速扩产应对需求爆发
财联社,2026-04-03 21:02:33,深交所：本周共对151起证券异常交易行为采取自律监管措施
财联社,2026-04-03 21:01:16,山东章鼓：因2024年年报存在虚假记载将被实施其他风险警示 股票简称变更为“ST章鼓”
财联社,2026-04-03 20:59:41,全国消费品以旧换新工作推进电视电话会议在京召开：要求持续提高补贴审核和资金兑付效率
财联社,2026-04-03 20:58:02,泽连斯基：将于近日就乌美安全保障剩余问题给出答复
财联社,2026-04-03 20:54:20,千里科技：2025年净利润8441万元 同比增长111%
财联社,2026-04-03 20:54:03,恒力重工一季度签约108艘新造船项目
财联社,2026-04-03 20:54:01,三艘阿曼籍船只通过霍尔木兹海峡
财联社,2026-04-03 20:13:14,世界杯门票涨价 美加墨世界杯最贵票价超75000元
财联社,2026-04-03 20:11:45,我国学者为破解“达尔文的困惑”提供证据
财联社,2026-04-03 20:11:29,伊媒称悬赏活捉美军飞行员
财联社,2026-04-03 20:09:32,模塑科技：控股股东拟合计减持不超3%股份
财联社,2026-04-03 20:08:55,以总理：以美保持协调 将持续对伊朗实施打击
财联社,2026-04-03 20:05:23,*ST岩石：股票市值首次低于5亿元提示终止上市风险
财联社,2026-04-03 20:04:06,一季度不足三成百强房企拿地 越秀集团、保利发展拿地金额最多
财联社,2026-04-03 20:02:41,中颖电子：拟向控股股东定增募资不超10亿元 用于高端工业级芯片研发及产业化项目等
财联社,2026-04-03 19:58:14,阿联酋防空系统拦截导弹 坠落碎片致12人受伤
财联社,2026-04-03 19:57:20,亿利达：实控人将变更为桐乡市财政局 股票复牌
财联社,2026-04-03 19:50:01,以军警告将攻击黎巴嫩南部两座桥梁
财联社,2026-04-03 19:49:20,4月3日周五《新闻联播》要闻26条
财联社,2026-04-03 19:46:48,中东战火烧向奢侈品 奢侈品巨头市值蒸发千亿美元
同花顺,2026-04-03 19:45:20,伊朗驳斥“防空系统已被摧毁”的说法，公布最新战果
财联社,2026-04-03 19:43:51,金地集团：2025年度净亏损132.81亿元
财联社,2026-04-03 19:41:14,商务部：2026年一季度消费品以旧换新销售额超4300亿元
同花顺,2026-04-03 19:31:24,伊朗军队称击落一架美军A-10攻击机
财联社,2026-04-03 19:14:29,高成本低需求 磷酸氢钙价格收涨谨慎
