来源,时间,标题
同花顺,2026-06-03 20:59:50,特朗普称与伊朗谈判进展“非常顺利”
同花顺,2026-06-03 20:55:19,文件显示，SpaceX的IPO计划6月11日定价
同花顺,2026-06-03 20:52:48,比特币自3月30日以来首次跌破65000美元
同花顺,2026-06-03 20:42:08,世卫：刚果（金）埃博拉疫情防控正“迎头赶上”
同花顺,2026-06-03 20:40:17,SpaceX将IPO发行规模定为5.556亿股 发行价预计为135美元/股
同花顺,2026-06-03 20:39:54,美国制裁致维萨卡和万事达卡在古巴暂停使用
同花顺,2026-06-03 20:27:44,美加墨世界杯决赛举办地食住行涨价明显
同花顺,2026-06-03 20:24:36,匈牙利总理称不支持加快推进乌克兰入欧谈判进程
同花顺,2026-06-03 20:22:20,卡塔尔埃米尔与美国总统通电话 讨论最新地区局势
同花顺,2026-06-03 20:21:52,卢拉：美国不买 我们就卖给想买的国家
同花顺,2026-06-03 20:20:54,国际油价3日上涨
同花顺,2026-06-03 20:20:40,伊朗称在阿曼湾打击一艘美驱逐舰 美军否认
同花顺,2026-06-03 20:20:10,美股三大股指集体收跌
同花顺,2026-06-03 20:19:52,博通第二财季半导体解决方案营收为150.1亿美元，市场预期为146.5亿美元
同花顺,2026-06-03 20:19:19,美元指数3日上涨
同花顺,2026-06-03 19:53:09,美联储“褐皮书”显示能源涨价推高通胀水平
同花顺,2026-06-03 19:53:00,胡塞武装发表声明 重申支持伊朗维护自身权利
同花顺,2026-06-03 19:38:16,美军：伊朗关于“美方导弹拦截器致科威特机场受损”说法不实
同花顺,2026-06-03 19:38:10,伊朗军队称打击一艘美国军舰
同花顺,2026-06-03 19:17:20,美联储褐皮书：总体而言 物价以温和至强劲的速度上涨
同花顺,2026-06-03 19:17:10,谷歌的股权出售据悉获得数倍超额认购
同花顺,2026-06-03 19:17:00,郭明錤：苹果眼镜路线图生变 Vision Pro后续版本被砍
同花顺,2026-06-03 19:16:41,欧盟提出一揽子科技促进法案 涵盖先进半导体、AI、算电协同等领域
同花顺,2026-06-03 19:15:01,伊媒：伊美谅解备忘录若谈成　将分四阶段推进
同花顺,2026-06-03 19:14:49,阿拉格齐：伊朗实施“自卫性打击”　随时回应敌对行动
同花顺,2026-06-03 19:14:34,知情人士称伊美谅解备忘录若谈成 将分四阶段推进
同花顺,2026-06-03 19:13:43,NYMEX铂金主力合约跌超4%
同花顺,2026-06-03 19:13:36,玻利维亚新防长上任 强调恢复秩序
同花顺,2026-06-03 19:13:30,内塔尼亚胡称与特朗普存在“战术分歧” 但核心目标一致
同花顺,2026-06-03 19:13:25,伊朗革命卫队否认向科威特机场开火
同花顺,2026-06-03 19:13:19,菲律宾参议院参议长否认被罢免职务
同花顺,2026-06-03 17:52:13,LME金属期货收盘集体下跌
同花顺,2026-06-03 17:51:57,年内券商发债突破1万亿元 同比增长114.86%
同花顺,2026-06-03 17:33:48,联合国安理会改选非常任理事国 菲律宾落选
同花顺,2026-06-03 17:33:14,美国务卿称格陵兰岛“目前仍属于丹麦”
同花顺,2026-06-03 17:07:12,美军称对伊朗的海上封锁已使125艘商船改变航向
同花顺,2026-06-03 16:40:16,纽约联储行长：未来利率路径无明显方向 不太担心通胀持续
同花顺,2026-06-03 16:31:49,潘兴广场抛售环球音乐约 8060 万股股票
同花顺,2026-06-03 16:28:12,内塔尼亚胡承认与特朗普存在“战术分歧”
同花顺,2026-06-03 16:25:24,法国称羁押了被海军拦截的俄罗斯油轮船长
同花顺,2026-06-03 16:20:08,安徽九华新材料股份有限公司启动上市辅导
同花顺,2026-06-03 16:19:52,俄国防部称核潜艇训练时发射一枚巡航导弹
同花顺,2026-06-03 16:09:45,谷歌旗下 Google Labs 推出 DreamBeans 产品
同花顺,2026-06-03 16:03:19,机构：2026年全球半导体市场规模预计突破1.5万亿美元
同花顺,2026-06-03 16:03:06,美国务卿：针对伊朗的“史诗怒火”军事行动已经结束
同花顺,2026-06-03 16:00:18,美国加州银行人质劫持事件结束 嫌犯被击毙
同花顺,2026-06-03 15:54:56,中国驻菲律宾大使馆：再次提醒在菲律宾中国公民和企业加强安全防范
同花顺,2026-06-03 15:52:54,新安洁：董事长魏延田被留置时间延长三个月
同花顺,2026-06-03 15:51:20,法国总理：以色列应停止在黎巴嫩军事行动
同花顺,2026-06-03 15:50:08,美股道琼斯指数期货跌超1%
同花顺,2026-06-03 15:47:28,奥地利等四国当选安理会非常任理事国
同花顺,2026-06-03 15:36:58,刚果（金）东北部发生沉船事故致60多人失踪
同花顺,2026-06-03 15:31:42,欧洲主要股指收盘集体下跌
同花顺,2026-06-03 15:29:32,伊朗议会要员：停止所有战线战争是伊美谈判首要内容
同花顺,2026-06-03 15:24:39,科威特国际机场恢复运行 巴林和阿联酋机场运行正常
同花顺,2026-06-03 15:21:50,美国称将调整其对北约部队的贡献
同花顺,2026-06-03 15:20:34,债市疑似“乌龙指”，农发行：取消发行
同花顺,2026-06-03 15:17:52,泽连斯基：现有资金可充分保障乌军装备与作战需求
同花顺,2026-06-03 15:12:23,涉玩具、鞋服、文具等，今年我国已召回儿童用品38.88万件
同花顺,2026-06-03 15:10:01,日本“石脑油危机”蔓延 多个行业受波及
同花顺,2026-06-03 15:08:02,概伦电子：收到上海证券交易所审核中心意见落实函
同花顺,2026-06-03 15:06:10,汉商集团董事会会议又现反对声音，董秘：没有矛盾，站的角度不一样
同花顺,2026-06-03 15:04:09,星源材质通过港交所上市聆讯
同花顺,2026-06-03 15:02:56,泽连斯基称愿即刻与普京展开直接谈判
同花顺,2026-06-03 15:02:29,我国实现高蛋白玉米自主育种
同花顺,2026-06-03 15:00:28,期市夜盘收盘，国内期货主力合约多数上涨，焦煤涨超3%
同花顺,2026-06-03 14:59:14,安克创新科技股份有限公司向港交所提交上市申请书
同花顺,2026-06-03 14:54:48,Adobe正在考虑两位内部领导和几位外部人工智能专家担任首席执行官职位
同花顺,2026-06-03 14:52:52,美国国务卿鲁比奥：美国军队正在保护通过霍尔木兹海峡的商业船只
同花顺,2026-06-03 14:48:57,安克创新科技重新递交港股上市申请
同花顺,2026-06-03 14:43:28,纳斯达克100指数转涨，费城半导体指数涨超1.6%，生物科技指数反弹超0.7%
同花顺,2026-06-03 14:41:56,美国战略石油储备库存降至逾两年低位
同花顺,2026-06-03 13:26:03,Kimi发布桌面端产品Kimi Work，定位通用型本地 Agent
同花顺,2026-06-03 13:25:38,俄副外长：若领土完整遭侵犯 俄保留以核武器回击可能性
同花顺,2026-06-03 13:20:52,伊朗媒体称霍尔木兹海峡管理草案进入审议阶段
同花顺,2026-06-03 13:17:00,月之暗面宣布Kimi Work开启公测
同花顺,2026-06-03 13:12:42,总投资300亿元打造GW级绿电直连数据中心集群 万国数据与乌兰察布市政府签署战略合作协议
同花顺,2026-06-03 13:11:37,新疆阿克苏地区库车市发生3.2级地震 震源深度27千米
同花顺,2026-06-03 13:10:58,达利凯普：董事兼总工程师拟减持不超过0.37%股份
同花顺,2026-06-03 13:10:22,并行科技成立新公司 含数据处理和存储支持服务等业务
同花顺,2026-06-03 13:08:47,德勤与谷歌云及Wiz合作，推出人机协作的人工智能网络防御系统
同花顺,2026-06-03 13:03:27,期市夜盘开盘，国内期货主力合约多数上涨，低硫燃油涨超2%
同花顺,2026-06-03 13:03:22,卡塔尔首相与沙特外交大臣通电话 讨论地区局势
同花顺,2026-06-03 12:58:28,纳微半导体盘前快速拉升，现涨超22%
同花顺,2026-06-03 12:55:49,重庆钢铁：向特定对象发行A股股票申请获得中国证监会同意注册批复
同花顺,2026-06-03 12:48:57,内蒙古打造高原寒地低空经济综试基地
同花顺,2026-06-03 12:46:19,科威特称伊朗袭击致63人受伤
同花顺,2026-06-03 12:41:07,纳斯达克100指数期货转跌，标普500指数期货下跌0.3%
同花顺,2026-06-03 12:40:41,我国火箭推进剂贮箱箱底实现量产 有望为商业航天的高频次发射降本增效
同花顺,2026-06-03 12:40:10,华为发布新一代组串式构网PCS解决方案
同花顺,2026-06-03 12:38:48,特朗普称对以总理在黎军事行动“不悦” 证实斥责其“疯了”
同花顺,2026-06-03 11:36:15,美国俄勒冈州海岸附近发生5.5级地震
同花顺,2026-06-03 11:30:03,重庆市与中国南水北调集团签署战略合作协议
同花顺,2026-06-03 11:24:23,澳大利亚外长称反对以色列升级黎巴嫩局势
同花顺,2026-06-03 11:24:07,比亚迪入局人形机器人
同花顺,2026-06-03 11:19:24,豆包：对于广大用户日常使用的功能 将保持目前的免费服务
同花顺,2026-06-03 11:17:59,科大国创：控股股东合肥国创与智德龙腾终止协议转让5.00%公司股份
同花顺,2026-06-03 11:16:43,166家外资企业获增值电信业务经营试点批复
同花顺,2026-06-03 11:16:07,药易购：终止协议转让部分公司股份
同花顺,2026-06-03 11:13:35,石药集团：受托人根据2026年股份奖励计划在市场上购买1380万股公司股份
同花顺,2026-06-03 11:13:23,精研科技：控股股东及一致行动人、董事拟分别减持1%和0.27%股份
同花顺,2026-06-03 11:12:04,鼎汉技术：高管万卿拟减持0.05%股份
同花顺,2026-06-03 11:11:57,通富微电：向特定对象发行股票获深交所审核通过
同花顺,2026-06-03 11:10:26,天源迪科：股东陈友拟减持0.6272%股份
同花顺,2026-06-03 11:05:37,晶丰明源：募投项目结项并将节余7164.77万元补充流动资金
同花顺,2026-06-03 11:04:41,银之杰：澄清“被立案调查”传闻不属实
同花顺,2026-06-03 11:03:05,爱普股份：收购挪亚圣诺股权延期至6月30日
同花顺,2026-06-03 11:02:15,英诺赛科：完成H股全流通，合计3.74亿股境内未上市股份已转换为H股
同花顺,2026-06-03 11:00:39,亚士创能：控股股东一致行动人拟被动减持不超过3%股份
同花顺,2026-06-03 10:53:38,方大炭素：回购专用证券账户拟减持不超过2%股份
同花顺,2026-06-03 10:53:04,普蕊斯：新疆泰睿及观由昭泰完成减持，合计减持2.48%股份
同花顺,2026-06-03 09:36:37,伊朗官员：如有必要伊方会同美进行谈判
同花顺,2026-06-03 09:35:29,超威半导体美股盘前涨超2%
同花顺,2026-06-03 09:32:55,南向资金今日净买入186.83亿港元 盈富基金获净买入居前
同花顺,2026-06-03 09:32:34,俄乌互称击落对方大量来袭无人机
同花顺,2026-06-03 09:31:51,红星发展：公司股票连续3个交易日内日收盘价格涨幅偏离值累计超过20%
同花顺,2026-06-03 09:31:43,多地银行正按要求适当加大信贷投放
同花顺,2026-06-03 09:21:13,段永平在泡泡玛特持股比例升至6.04%
同花顺,2026-06-03 09:17:28,工业和信息化部向166家外资企业发放经营试点批复覆盖全部增值电信业务
同花顺,2026-06-03 09:16:21,伊朗外交部强烈谴责美国袭击伊朗油轮和格什姆岛
同花顺,2026-06-03 09:16:12,纳斯达克ETF华安：二级市场交易价格溢价，提醒投资者注意风险
同花顺,2026-06-03 09:12:08,金龙汽车：5月客车产量4146辆、销量3509辆
同花顺,2026-06-03 09:12:05,鑫科材料：股票连续3个交易日内日收盘价格涨幅偏离值累计达到20%
同花顺,2026-06-03 09:09:52,英特尔美股盘前涨超4%
同花顺,2026-06-03 09:09:18,*ST新元：公司因施工合同纠纷被起诉 涉案金额7261.7万元
同花顺,2026-06-03 09:05:54,亨通股份：蒋海东受让5.24%公司股份
同花顺,2026-06-03 09:04:12,出口民调：韩国执政党在第九届地方选举中获得压倒性胜利
同花顺,2026-06-03 09:03:35,*ST航图：董事会提议向下修正“宏图转债”转股价格
同花顺,2026-06-03 09:03:34,摩根士丹利：腾讯股价因微信AI智能体测试上涨10%
同花顺,2026-06-03 09:02:35,中埃两国央行续签双边本币互换协议
同花顺,2026-06-03 09:02:02,龙净环保：完成回购0.4735%公司股份
同花顺,2026-06-03 07:41:10,深圳楼市新政满月：新房成交涨五成，首个“日光盘”诞生
同花顺,2026-06-03 07:39:44,南向资金净买入超180亿港元
同花顺,2026-06-03 07:37:39,博威合金：GB300液冷板材料已小批量供货 关于下一代Rubin架构的液冷板提供了铜金刚石、3D打印
同花顺,2026-06-03 07:35:42,泽连斯基称乌方打击俄境内多处重要目标
同花顺,2026-06-03 07:33:56,Perplexity智能体调度工具即将登陆Windows
同花顺,2026-06-03 07:33:35,外交部：与台独分裂势力捆绑没有前途
同花顺,2026-06-03 07:33:23,南向资金净买入超170亿港元
同花顺,2026-06-03 07:31:26,外交部：中欧经贸关系的本质是互利共赢
同花顺,2026-06-03 07:29:52,外交部回应当前美伊局势：战事再起不符合任何一方的利益
同花顺,2026-06-03 07:27:43,外交部：关税战、贸易战不符合任何一方的利益
同花顺,2026-06-03 07:25:30,外交部回应日方不当言论：日本避而不谈军国主义侵略扩张罪行
同花顺,2026-06-03 07:22:47,扎波罗热核电站第17次完全失去外部供电
同花顺,2026-06-03 07:21:25,南向资金净买入超160亿港元
同花顺,2026-06-03 07:20:10,港股恒生科技指数跌幅达3%
同花顺,2026-06-03 07:19:59,恒力重工签订21+4艘新造船项目，总价值近150亿元
同花顺,2026-06-03 07:19:03,微软 CEO 纳德拉：确保数据中心不推高电价，继续建设才会获得许可
同花顺,2026-06-03 07:17:21,光联芯科完成近5亿元融资
同花顺,2026-06-03 07:13:25,两周内卖了120亿美元黄金？印度央行澄清：相关报道并不属实
同花顺,2026-06-03 07:12:32,机构：一季度存储器价格全面上涨，各类产品季增幅度将创历史新高
同花顺,2026-06-03 07:10:42,第二十九届圣彼得堡国际经济论坛开幕
同花顺,2026-06-03 05:35:41,煤炭开采加工板块午后持续拉升，晋控煤业触及涨停
同花顺,2026-06-03 05:29:39,火山引擎提升MaaS营收目标至全年150亿元，Seedance 2.0单月营收已超10亿元
同花顺,2026-06-03 05:25:43,商业航天板块震荡走高，中国卫星涨超8%
同花顺,2026-06-03 05:25:32,俄称圣彼得堡市遭乌无人机袭击 有人员受伤
同花顺,2026-06-03 05:18:46,南向资金净买入超80亿港元
同花顺,2026-06-03 05:18:23,电力板块局部拉升，京能电力直线涨停
同花顺,2026-06-03 05:15:53,半导体板块涨幅扩大，盛美上海涨超14%
同花顺,2026-06-03 05:07:19,沪深京三市成交额超2万亿元，较上日此时放量932亿元
同花顺,2026-06-03 05:05:39,东非共同体召开应对埃博拉疫情会议
同花顺,2026-06-03 05:03:47,机器人板块短线拉升，埃斯顿涨停
同花顺,2026-06-03 05:02:49,南向资金净买入超70亿港元
同花顺,2026-06-03 05:02:20,创业板指午后涨4%
同花顺,2026-06-03 05:01:30,科威特境内有导弹无人机残骸起火
同花顺,2026-06-03 05:01:23,科创50指数涨幅扩大至5%
同花顺,2026-06-03 04:58:57,欧盟部署最大规模应对野火措施
同花顺,2026-06-03 04:55:01,顿涅茨克地区遭袭致7人死亡
同花顺,2026-06-03 04:53:35,印尼股市基准指数下跌4.9%
同花顺,2026-06-03 04:50:34,景顺长城基金旗下全球芯片LOF基金二级市场交易价格明显高于基金份额净值
同花顺,2026-06-03 04:47:22,晶科能源钱晶：组件价格变化的影响正逐渐减少
同花顺,2026-06-03 04:40:00,俄列宁格勒州遭无人机袭击 圣彼得堡机场实施管制
同花顺,2026-06-03 03:09:28,海辰储能发布10小时+储能系统，明年开启交付
同花顺,2026-06-03 03:09:14,中国稀土集团、中国铀业等在江西成立国家稀土技术创新中心
同花顺,2026-06-03 03:04:19,今年前5个月上海口岸离境退税20.1万票 居全国首位
同花顺,2026-06-03 03:03:58,富时中国A50指数期货涨超1%
同花顺,2026-06-03 03:01:53,我国牵头修订的通用模件熔断体国际标准发布
同花顺,2026-06-03 03:01:38,科创50指数涨幅扩大至4%，芯片产业链概念股领涨
同花顺,2026-06-03 02:59:57,中国红十字会总会紧急向黑龙江省调拨救灾物资
同花顺,2026-06-03 02:58:07,中企将在马德里推出无人驾驶出租车服务
同花顺,2026-06-03 02:55:11,越南VN指数下跌1%至1807.93点
同花顺,2026-06-03 02:52:23,小金属板块走高，中钨高新涨停
同花顺,2026-06-03 02:50:24,通信设备板块震荡走高，世嘉科技涨停
同花顺,2026-06-03 02:45:07,两部门部署在云霄直流开展输电权市场化交易
同花顺,2026-06-03 02:43:05,上交会将发布80余项国际技术合作需求
同花顺,2026-06-03 02:41:55,国台办：维护台海和平稳定是中美双方的最大公约数
同花顺,2026-06-03 02:40:31,沪深京三市成交额超1.5万亿元，较上日此时放量538亿元
同花顺,2026-06-03 02:37:16,国台办：一个中国原则是人心所向、大势所趋
同花顺,2026-06-03 02:36:58,国台办：缺电已成台湾发展软肋 大家有目共睹
同花顺,2026-06-03 02:35:07,广西壮族自治区抗震救灾指挥部发布通知，终止广西壮族自治区地震三级应急响应
同花顺,2026-06-03 02:32:43,国台办：民进党当局跪美输诚 只会自食恶果
同花顺,2026-06-03 02:31:09,创业板指涨超3%，再创历史新高
同花顺,2026-06-03 01:55:18,墨西哥总统要求美国大使尊重墨内政
同花顺,2026-06-03 01:54:53,联合国3日举行安理会非常任理事国选举
同花顺,2026-06-03 01:54:01,淄博：优化部分住房公积金使用政策
同花顺,2026-06-03 01:53:24,港股科网股集体回调，哔哩哔哩-W跌近4%
同花顺,2026-06-03 01:50:10,创业板指涨2%，铜缆高速连接、光纤概念、培育钻石板块领涨
同花顺,2026-06-03 01:48:05,科创50指数涨幅扩大至2%
同花顺,2026-06-03 01:47:28,韩国举行第九届地方选举
同花顺,2026-06-03 01:45:51,光纤概念板块涨幅扩大，三孚股份、亨通光电涨停
同花顺,2026-06-03 01:45:20,中国5月RatingDog服务业PMI54.4，前值52.6
同花顺,2026-06-03 01:43:31,培育钻石板块冲高，楚江新材涨停
同花顺,2026-06-03 01:41:43,极佳视界与隆盛科技旗下隆盛唯睿达成深度战略合作
同花顺,2026-06-03 01:39:40,沪深京三市成交额超5000亿元，较上日此时放量442亿元
同花顺,2026-06-03 01:39:32,元件板块短线拉升
同花顺,2026-06-03 01:38:57,智元开源AGIBOT WORLD 2026主题二，专属于世界模型的数据集
同花顺,2026-06-03 01:37:05,美称击落伊朗袭科威特美军无人机
同花顺,2026-06-03 01:37:01,创业板指涨1%，铜缆高速连接、光纤概念、CPO板块领涨
同花顺,2026-06-03 01:35:15,影视院线板块下挫，北京文化跌停
同花顺,2026-06-03 01:33:32,泽连斯基：俄袭击造成乌克兰22人死亡
同花顺,2026-06-03 00:47:25,泰国司法部长：前总理他信将被特赦
同花顺,2026-06-03 00:47:10,两市融资余额较上日增加13.38亿元
同花顺,2026-06-03 00:46:35,日经225指数涨超2%
同花顺,2026-06-03 00:45:08,天风证券：煤化工盈利或进入上行周期
同花顺,2026-06-03 00:39:51,匈牙利总理：准备好与泽连斯基会谈
同花顺,2026-06-03 00:32:51,联发科：下一代芯片独家采用英特尔EMIB-T封装 预计2027年Q4量产
同花顺,2026-06-03 00:28:55,泰和新材：芳纶主要在光缆成缆过程中使用，在光纤中不多
同花顺,2026-06-03 00:23:20,全球最大的白银ETF iShares Silver Trust持仓量较前日减少44.53吨
同花顺,2026-06-03 00:20:36,消息人士称SpaceX计划在公开募股中设定每股135美元的定价目标
同花顺,2026-06-03 00:18:52,特朗普否认美伊对话已暂停数日
同花顺,2026-06-03 00:15:46,美军证实先空袭后拦截，否认第五舰队总部遇袭
同花顺,2026-06-03 00:14:36,布伦特原油站上97美元/桶
同花顺,2026-06-03 00:11:59,铠侠涨超5%
同花顺,2026-06-03 00:03:45,期货早报：美军袭击伊朗油轮！科威特全国拉响防空警报，油价开盘拉升
同花顺,2026-06-03 00:02:08,日经225指数日内涨幅达1.00%
同花顺,2026-06-03 00:01:51,打击跨境电商“黑注册” 3人非法倒卖公民资料被刑拘
同花顺,2026-06-03 00:01:40,日经225指数开盘涨0.83%
同花顺,2026-06-02 23:59:15,伊朗革命卫队：为回应美军袭击，已打击美以船只及美军基地
同花顺,2026-06-02 23:58:10,美伊再次互袭
同花顺,2026-06-02 23:49:16,Silvio Napoli已出任Lucid首席执行官
同花顺,2026-06-02 23:33:45,“险资系”私募基金投资动向曝光 坚守“红利+成长”哑铃型策略
同花顺,2026-06-02 23:30:21,供给偏紧 AI需求托底 锡价中长期上行可期
同花顺,2026-06-02 23:20:03,现货黄金失守4470美元/盎司
同花顺,2026-06-02 23:19:57,COMEX白银期货跌超1%
同花顺,2026-06-02 23:10:46,现货黄金失守4480美元/盎司
同花顺,2026-06-02 23:10:41,科威特称拦截来袭导弹 伊朗格什姆岛传爆炸声
同花顺,2026-06-02 23:10:21,纽约期金失守4510美元/盎司
同花顺,2026-06-02 22:49:28,联合国专家谴责美国对古巴革命领袖的指控
同花顺,2026-06-02 22:49:23,日媒：中国国债吸引力凸显
同花顺,2026-06-02 22:48:38,柬埔寨宣布启动强制调解程序，以解决与泰国重叠海洋权益主张
同花顺,2026-06-02 22:48:16,今年前五月我国新开国际航空货运航线80条
同花顺,2026-06-02 22:48:12,美国国务卿鲁比奥：以色列拟控加沙七成区域 不符美方立场
同花顺,2026-06-02 22:35:01,外资公募再增资，中国资产性价比吸引全球资金
同花顺,2026-06-02 22:34:56,SpaceX计划最快周三确定IPO条款
同花顺,2026-06-02 22:15:53,上证报评论：莫让票据冲量稀释信贷成色
同花顺,2026-06-02 22:15:23,联合国：刚果（金）东部暴力升级阻碍埃博拉疫情防控工作
同花顺,2026-06-02 22:11:25,港股回购热度升温，机构建议关注结构性机会
同花顺,2026-06-02 22:08:29,光通信产业链领涨 A股结构性行情延续
同花顺,2026-06-02 22:07:46,“含科量”悄然抬升 消费主题基金审美坐标位移
同花顺,2026-06-02 22:06:39,美军在波斯湾袭击一艘油轮
同花顺,2026-06-02 22:05:42,平陆运河今天将实现全线通水
同花顺,2026-06-02 22:05:17,美债收益率涨跌不一，30年期美债收益率跌1.21个基点
同花顺,2026-06-02 21:47:31,伊朗南部格什姆岛传出爆炸声
同花顺,2026-06-02 21:36:50,迈威尔科技股价盘后涨幅扩大，一度达9.4%
同花顺,2026-06-02 21:27:36,受台风“蔷薇”影响，日本和歌山县发布最高等级5级警戒
同花顺,2026-06-02 21:15:48,富时中国A50指数期货夜盘收跌0.15%，报15912点
同花顺,2026-06-02 21:15:06,匈牙利总理称不会向乌克兰供武
同花顺,2026-06-02 21:10:36,网络安全公司NetSkope美股盘后涨3.8%
同花顺,2026-06-02 21:07:36,美军称袭击一艘伊朗相关油轮 使其失去航行能力
同花顺,2026-06-02 21:03:10,韩国第九届地方选举正式投票开始
同花顺,2026-06-02 20:54:45,录音显示美军袭击一艘伊朗相关油轮
同花顺,2026-06-02 20:48:44,美国至5月29日当周API原油库存 -675.7万桶，预期-360.5万桶
同花顺,2026-06-02 20:47:10,游戏驿站美股盘后大涨 12%
同花顺,2026-06-02 20:44:36,游戏驿站一季度净销售8.353亿美元，同比增长14%
同花顺,2026-06-02 20:33:31,加纳两车相撞造成至少15人死亡25人重伤
同花顺,2026-06-02 20:20:32,美股三大股指小幅收涨
同花顺,2026-06-02 20:19:43,国际油价2日上涨
同花顺,2026-06-02 20:19:01,纳斯达克中国金龙指数收涨1.87%
同花顺,2026-06-02 19:54:35,无锡上线“词元超市” 企业用AI更简单、更省钱
同花顺,2026-06-02 19:51:10,丹麦新政府：坚守格陵兰岛主权
同花顺,2026-06-02 19:50:55,美元指数2日上涨
同花顺,2026-06-02 19:46:08,比特币跌破67000美元，日内跌6.22%
同花顺,2026-06-02 19:45:23,美国制裁伊朗加密货币交易平台及相关人员
同花顺,2026-06-02 19:15:06,微软推出首个AI推理模型Mai-Thinking-1
同花顺,2026-06-02 19:14:46,英伟达与微软达成合作：推出统一技术栈 用于部署Agentic AI
同花顺,2026-06-02 19:14:23,黎巴嫩真主党不接受与以色列“部分停火”
同花顺,2026-06-02 19:14:17,以色列拨款10亿新谢克尔以设立特别军事法庭
同花顺,2026-06-02 18:34:36,墨西哥总统辛鲍姆：墨美摩擦系极右翼势力搞事
同花顺,2026-06-02 18:34:28,真主党不接受与以色列“部分停火” 双方继续互袭
同花顺,2026-06-02 18:34:23,白宫记协晚宴改期至7月，特朗普称计划出席
同花顺,2026-06-02 18:34:18,美军称“林肯”号航母继续参与对伊朗封锁行动
同花顺,2026-06-02 18:17:39,泽连斯基称俄袭击已致乌22死130伤
同花顺,2026-06-02 18:04:38,加拿大正式提议续签美墨加协定
同花顺,2026-06-02 18:04:22,美国国务卿鲁比奥：美伊仍在谈，协议何时达成不确定
同花顺,2026-06-02 17:19:50,多个伊拉克民兵组织宣布拟解除武装
同花顺,2026-06-02 17:15:53,微软宣布面向新型AI设备推出项目Solara
同花顺,2026-06-02 17:13:49,6月百基新发、多点开花机构：A股市场中长期配置价值不改
同花顺,2026-06-02 17:13:08,机构持续入局 ETF竞争迈入品牌化阶段
同花顺,2026-06-02 17:12:48,英伟达CEO黄仁勋：微软部署最强大的英伟达Blackwell芯片
同花顺,2026-06-02 17:09:41,特朗普：美伊对话一直在持续进行
同花顺,2026-06-02 17:06:39,微软发布微软Web IQ产品
同花顺,2026-06-02 17:06:18,伦敦股市2日上涨
