来源,时间,标题
同花顺,2025-09-16 10:49:48.000,腾讯控股：斥资5.51亿港元回购85.3万股
财联社,2025-09-16 10:48:40.000,固态电池概念震荡调整 杭可科技跌超10%
同花顺,2025-09-16 10:48:30.000,甲骨文盘前涨幅扩大至5.5%
财联社,2025-09-16 10:46:54.000,豆包月活超越DeepSeek 夺8月中国原生AI App月活第一
财联社,2025-09-16 10:46:45.000,河南省“专精特新”专板正式开板 首批106家企业入驻
财联社,2025-09-16 10:45:17.000,【盘中宝】AI基础设施的重要组成部分，行业巨头因需求飙升上调价格，这家公司相关产品上具备完整的产品线
同花顺,2025-09-16 10:45:08.000,四川凉山州首届转山转海节今日启幕
同花顺,2025-09-16 10:43:49.000,航行警告 黄海海域军事演习
财联社,2025-09-16 10:42:20.000,姚振华及宝能集团等被恢复执行33.2亿
同花顺,2025-09-16 10:42:07.000,安正时尚：回购账户拟减持0.48%
同花顺,2025-09-16 10:40:23.000,润建股份：中标1.11亿元中国联通项目
财联社,2025-09-16 10:40:11.000,腾讯云：全面适配主流国产芯片
财联社,2025-09-16 10:39:45.000,创业板指跌逾1% 下跌个股超3400只
财联社,2025-09-16 10:39:11.000,农业农村部：当前已有95%以上的村卫生室纳入医保
同花顺,2025-09-16 10:39:05.000,天承科技：睿兴二期拟减持不超过1.68%股份
同花顺,2025-09-16 10:38:47.000,尖峰集团：取得不超过3600万元金融机构股票回购专项贷款承诺函
财联社,2025-09-16 10:38:16.000,伊朗原子能组织主席：伊朗与国际原子能机构需建立新核查程序
同花顺,2025-09-16 10:37:13.000,武汉杉杉奥特莱斯将启动试营业
同花顺,2025-09-16 10:36:43.000,“十四五”以来农发行累计投入超1200亿元支持种业发展
财联社,2025-09-16 10:31:32.000,日本自民党新总裁选战升温 本周将迎“参选高峰期”
财联社,2025-09-16 10:31:07.000,滴滴旗下99宣布在巴西加码20亿雷亚尔投资
财联社,2025-09-16 10:26:24.000,沪深两市成交额突破1万亿 预计全天成交金额近2.3万亿
财联社,2025-09-16 10:25:38.000,安踏：前8个月74名员工因严重舞弊触犯集团红线被辞退
财联社,2025-09-16 10:22:31.000,中国—东盟博览会首设1万平方米人工智能专馆
财联社,2025-09-16 10:20:56.000,藏粤直流输电工程今天启动建设 每年可输送超430亿度电能
财联社,2025-09-16 10:16:31.000,三大指数全线翻绿
财联社,2025-09-16 10:15:19.000,世贸组织《渔业补贴协定》正式生效
财联社,2025-09-16 10:14:39.000,扩围升级 推动城市一刻钟便民生活圈建设相关政策将出台
财联社,2025-09-16 10:13:24.000,联发科称其首款2纳米系统级芯片已完成流片
财联社,2025-09-16 10:10:23.000,统一大市场板块爆发 飞马国际、供销大集双双涨停
财联社,2025-09-16 10:10:05.000,2024年农村居民人均可支配收入达到23119元
财联社,2025-09-16 10:08:23.000,“十四五”以来我国累计建成高标准农田超10亿亩
财联社,2025-09-16 10:05:53.000,“十四五”以来我国粮食产量迈上新台阶 人均占有量达500公斤
财联社,2025-09-16 10:04:42.000,AI眼镜概念异动拉升 比依股份、科森科技双双涨停
财联社,2025-09-16 09:57:55.000,PCB概念再度走强 胜宏科技涨超7%续创历史新高
同花顺,2025-09-16 09:56:24.000,俄罗斯一辆全地形车坠湖 已致5人溺亡
同花顺,2025-09-16 09:54:54.000,麦迪科技：股东翁康拟减持股份不超1.7%
同花顺,2025-09-16 09:54:42.000,我国8月批准注册医疗器械产品263个
同花顺,2025-09-16 09:52:46.000,卡塔尔埃米尔与美国务卿会谈 讨论加沙局势和多哈遭袭事件
同花顺,2025-09-16 09:52:09.000,美以勾兑吞并约旦河西岸“剧本”？专家称将毒化中东政治氛围
同花顺,2025-09-16 09:47:19.000,四川发布山洪灾害黄色预警 9地发生山洪灾害可能性较大
同花顺,2025-09-16 09:46:38.000,2024年湖北农林牧渔业总产值居全国第4位
同花顺,2025-09-16 09:43:49.000,“黑科技”亮相第二届公共安全科技装备展，揭秘中国外贸枪械“撒手锏”
同花顺,2025-09-16 09:43:26.000,甲骨文美股盘前涨超4%
财新网,2025-09-16 09:40:00.000,A股港股上周看产业，本周盯宏观
同花顺,2025-09-16 09:35:52.000,爱威科技：设立湖南爱威光学科技有限公司，注册资本1000万元
同花顺,2025-09-16 09:35:21.000,灿芯股份：初步确定的询价转让价格为61.88元/股
同花顺,2025-09-16 09:33:37.000,安彩高科：拟1501.12万元收购河南高纯矿物100%股权
财联社,2025-09-16 09:33:09.000,高盛将中芯国际H股目标价上调15%
财联社,2025-09-16 09:33:00.000,抖音概念盘初活跃 省广集团涨停
同花顺,2025-09-16 09:29:52.000,加沙局势升级引发投资者恐慌，以色列股市走低
同花顺,2025-09-16 09:28:46.000,国信证券：三分之一董事发生变动
财联社,2025-09-16 09:24:43.000,港股新股禾赛开盘涨近8% 公开发售阶段获超168倍认购
同花顺,2025-09-16 09:24:20.000,新化股份：董事拟减持不超过75200股
财联社,2025-09-16 09:22:09.000,央行公开市场今日净投放400亿元
财联社,2025-09-16 09:21:49.000,香港恒生指数开盘涨0.34% 禾赛科技首日挂牌高开7.7%
财联社,2025-09-16 09:17:53.000,【盘中宝】AI催生需求，微软、谷歌、Meta纷纷押注，机构连续第五年上调该行业扩张预测，这家企业细分业务已获亿元级订单
财联社,2025-09-16 09:10:00.000,美国重新解读军控协议 以放宽军用无人机出口
同花顺,2025-09-16 09:07:38.000,亿帆医药：子公司合肥亿帆生物制药获注射用硫酸艾沙康唑药品注册证书
同花顺,2025-09-16 09:05:18.000,第138届广交会首批进境展品顺利通关入境
同花顺,2025-09-16 09:01:43.000,新华制药：子公司获熊去氧胆酸胶囊药品注册证书
财联社,2025-09-16 09:01:03.000,特朗普：内塔尼亚胡不会再袭击卡塔尔
财新网,2025-09-16 09:00:00.000,数据推荐：发电设备产量月同比增三成
同花顺,2025-09-16 08:59:44.000,爱柯迪：拟发行股份及支付现金购买卓尔博71%股权
财联社,2025-09-16 08:58:40.000,1至8月京津冀地区出口9401.5亿元 规模创新高
同花顺,2025-09-16 08:58:39.000,商务部等9部门：支持有条件的幼儿园招收2—3岁幼儿
同花顺,2025-09-16 08:56:05.000,商务部等9部门：加大消费信贷支持力度
同花顺,2025-09-16 08:55:20.000,商务部等9部门：支持金融机构扩大服务消费领域信贷投放
同花顺,2025-09-16 08:54:27.000,商务部等9部门：吸引更多境外人员入境消费 有序扩大单方面免签国家范围
同花顺,2025-09-16 08:53:25.000,商务部等9部门：实施服务消费提质惠民行动
同花顺,2025-09-16 08:52:30.000,吴清主席视频会见国际证监会组织理事会主席让-保罗·塞万斯和秘书长罗德里戈·布埃纳文图拉
同花顺,2025-09-16 08:52:10.000,9部门发布《关于扩大服务消费的若干政策措施》
同花顺,2025-09-16 08:50:11.000,国药现代：全资子公司获药品注册证书
同花顺,2025-09-16 08:47:57.000,腾讯汤道生：腾讯已和多家芯片厂商合作适配
同花顺,2025-09-16 08:42:21.000,第138届广交会首批进境展品今天通关
同花顺,2025-09-16 08:42:21.000,精华制药：孙公司牵头制定产品行业标准
同花顺,2025-09-16 08:39:55.000,云栖大会9月24日开幕：三大主论坛、3500款展品集中亮相
同花顺,2025-09-16 08:34:47.000,佳先股份：拟发行H股并在港交所上市
同花顺,2025-09-16 08:33:35.000,2024年贸仲受理涉外案件758件 同比增长18%
财新网,2025-09-16 08:20:00.000,特朗普觉得上市公司季报太频繁
财联社,2025-09-16 08:12:31.000,财联社9月16日早间新闻精选
财联社,2025-09-16 08:11:08.000,中国海警依法对位黄岩岛领海非法活动的多艘菲律宾公务船采取管制措施
财联社,2025-09-16 08:11:01.000,美称拟向秘鲁出售F-16战机
同花顺,2025-09-16 08:03:41.000,特斯拉美股盘前涨超2%
同花顺,2025-09-16 08:02:37.000,美股中概股盘前涨跌互现，携程涨3%
同花顺,2025-09-16 08:00:17.000,甲骨文美股盘前涨超2%
财联社,2025-09-16 08:00:09.000,中国银河证券：AI应用持续推进游戏行业有望保持高景气度
财联社,2025-09-16 07:59:32.000,机构：第二季度全球数据中心物理基础设施市场增长18%
同花顺,2025-09-16 07:57:42.000,1至8月四川外贸进出口6832亿元 同比增长2.5%
同花顺,2025-09-16 07:55:22.000,中国首次跻身全球创新指数前十 去年居第十一位，今年上升一位
同花顺,2025-09-16 07:54:33.000,泽璟制药：注射用ZG006完成首例受试者入组
同花顺,2025-09-16 07:53:57.000,佳讯飞鸿：子公司佳讯智航语音通信交换系统获临时使用许可证
同花顺,2025-09-16 07:53:18.000,亨迪药业：获得化学原料药上市申请批准通知书
同花顺,2025-09-16 07:50:12.000,喜迎国庆 香港将推出一系列庆祝活动和丰富优惠
财联社,2025-09-16 07:49:53.000,中金：看好头部室内雪场运营商的发展空间以及产业链企业的投资机会
财联社,2025-09-16 07:48:50.000,暴雨黄色预警：山东中南部、四川盆地北部等地部分地区有大暴雨
财联社,2025-09-16 07:48:33.000,国金证券：A股第三轮重估渐行渐近 建议关注三类资产
同花顺,2025-09-16 07:46:13.000,港股药捷安康-B跌超55%，总市值蒸发近2000亿港元
同花顺,2025-09-16 07:44:50.000,欧盟暂时取消讨论新一轮对俄制裁措施草案
财联社,2025-09-16 07:42:45.000,【点金互动易】光芯片+光模块，光通信芯片满足1.6T模块硅光集成需求，这家公司量产功率最高的半导体激光芯片
同花顺,2025-09-16 07:42:41.000,保隆科技：正在为国内头部自主品牌客户开发Robotaxi摄像头
财联社,2025-09-16 07:42:19.000,国办进一步完善旅游市场综合监管机制
同花顺,2025-09-16 07:39:28.000,外交部回应美国在日本部署堤丰
财联社,2025-09-16 07:33:54.000,中国工程机械工业协会：8月销售各类平地机683台 同比下降12.4%
同花顺,2025-09-16 07:31:27.000,外交部回应中美元首是否即将通话
财联社,2025-09-16 07:31:12.000,部分民营银行大额存单利率超2%很抢手
财联社,2025-09-16 07:26:03.000,今起正式实施 常温纯牛奶中禁止添加复原乳
财联社,2025-09-16 07:21:39.000,本源量子启动IPO辅导
财新网,2025-09-16 07:20:00.000,数据推荐：原煤生产降幅收窄
财联社,2025-09-16 07:13:34.000,外卖补贴退坡 头部品牌通过差异化上新等方式留住消费者
同花顺,2025-09-16 07:06:47.000,宁德时代在银川成立新能源科技公司，注册资本2000万
同花顺,2025-09-16 07:05:50.000,高澜股份：公司在微通道液冷技术方面有一定技术储备
同花顺,2025-09-16 07:05:17.000,国防部回应福建舰通过台湾海峡
同花顺,2025-09-16 07:03:25.000,100余个国家、地区和国际组织官方代表团将参加第十二届北京香山论坛
同花顺,2025-09-16 07:01:05.000,A股收评：创业板指探底回升涨0.68% 机器人概念股集体爆发
同花顺,2025-09-16 07:00:48.000,ETF收评：汽车零部件ETF领涨5.26%，港股创新药ETF领跌2.31%
同花顺,2025-09-16 07:00:23.000,ETF两市成交额4366.20亿元
财联社,2025-09-16 06:59:50.000,极端条件下稳定工作的量子传感器问世
财联社,2025-09-16 06:59:20.000,光基芯片执行AI任务能效提升十至百倍
财联社,2025-09-16 06:58:39.000,新型推进器实现非接触清除太空垃圾
财联社,2025-09-16 06:55:08.000,俄称控制一居民点 乌称击退俄军进攻
同花顺,2025-09-16 06:53:37.000,东土科技与海光信息联合发布全国产化工控系统
同花顺,2025-09-16 06:52:46.000,港股药捷安康-B短线快速跳水跌超20%
财联社,2025-09-16 06:52:32.000,持续突破 国产AI芯片抢夺市场窗口期
同花顺,2025-09-16 06:51:09.000,上海发生1.2级地震 震源深度10公里
同花顺,2025-09-16 06:50:26.000,沪深京三市成交额超2.2万亿元，较上日此时放量475亿元
同花顺,2025-09-16 06:50:19.000,南向资金净卖出超20亿港元
同花顺,2025-09-16 06:49:11.000,国债期货拉升 10年期主力合约涨超0.2%
同花顺,2025-09-16 06:46:31.000,现货黄金持续走高，历史首次站上3690美元/盎司，剑指3700美元整数关口
财联社,2025-09-16 06:42:17.000,政策利好叠加需求大增 储能行业持续火热
同花顺,2025-09-16 06:42:10.000,龙蟠科技港股涨超30%
财新网,2025-09-16 06:30:00.000,降息后美国股债市“分分钟翻脸”？
财联社,2025-09-16 06:29:20.000,先行者方能长赢 基金打响AI人才“掐尖战”
财联社,2025-09-16 06:27:43.000,多家车企回应账款支付倡议：合力构建健康、透明的产业链金融秩序
财联社,2025-09-16 06:14:35.000,特朗普下令成立孟菲斯特别工作组 国民警卫队将进驻
财联社,2025-09-16 06:13:51.000,美联储本周降息25个基点的概率为95.9%
同花顺,2025-09-16 06:06:58.000,美团一线城市乐跑骑手月收入超12000元
同花顺,2025-09-16 06:03:39.000,潘功胜《求是》发文：坚定践行全球治理倡议 持续推进全球金融治理改革完善
同花顺,2025-09-16 06:02:22.000,互联网金融板块拉升，金财互联涨停
同花顺,2025-09-16 05:58:35.000,天永智能：与柏奥尼克机器人战略合作推动人形机器人在中国规模化应用
同花顺,2025-09-16 05:58:16.000,A股三大指数午后再度全线翻红
同花顺,2025-09-16 05:55:30.000,港股机器人概念股持续拉升，越疆涨超6%
同花顺,2025-09-16 05:54:19.000,港股华检医疗午后转涨，早盘跌超10%
同花顺,2025-09-16 05:53:24.000,马拉维举行总统、议会和地方政府选举
同花顺,2025-09-16 05:52:10.000,华侨城文旅科技与浙江人形机器人创新中心达成战略合作
财联社,2025-09-16 05:46:55.000,周二（9月16日）重点关注财经事件和经济数据
同花顺,2025-09-16 05:45:17.000,PayPay将允许日本用户在韩国使用该支付应用
同花顺,2025-09-16 05:40:09.000,腾讯正式发布混元3D 3.0模型
同花顺,2025-09-16 05:31:33.000,广东：到2027年规上玩具产业营业收入达一千亿元 AI玩具渗透率达30%以上
同花顺,2025-09-16 05:29:29.000,广东：支持AI融合机器人开辟玩具新市场 探索“AI+玩具+机器人”跨界融合模式
同花顺,2025-09-16 05:26:55.000,沪深京三市成交额超1.7万亿元，较上日此时缩量93亿元
同花顺,2025-09-16 05:00:56.000,沪深京三市成交额超1.5万亿元，较上日此时缩量266亿元
同花顺,2025-09-16 04:59:15.000,野村：韩国央行或连续降息以提振消费
财联社,2025-09-16 04:56:26.000,巴西官员尚未获得赴美参加联合国大会的签证
同花顺,2025-09-16 04:51:32.000,浙江：公布第二批98个城市更新金融服务重点项目，预计总投资额超2096.77亿元
财联社,2025-09-16 04:45:06.000,中方呼吁也门胡塞武装和以色列保持克制
财新网,2025-09-16 04:40:00.000,美国年轻人负债还在增加 放假“玩不起”
同花顺,2025-09-16 04:34:42.000,拉乌利宣誓就任萨摩亚总理
财联社,2025-09-16 04:30:30.000,联合国：以色列对加沙城轰炸升级致大量平民撤离
同花顺,2025-09-16 04:21:16.000,太二酸菜鱼客服回应“鲜活现做”质疑
财联社,2025-09-16 04:18:29.000,委内瑞拉内政部长：委美关系已经破裂
同花顺,2025-09-16 04:15:22.000,OpenAI据悉聘请前xAI首席财务官
同花顺,2025-09-16 04:11:40.000,9月16日午间公告一览：华检医疗与仁和药业全资附属公司仁和国际达成战略合作
同花顺,2025-09-16 04:08:07.000,腾讯云推出Agent Runtime解决方案
同花顺,2025-09-16 04:05:24.000,谷歌开放沃尔瑟姆交叉数据中心，作为其在英国两年内50亿英镑投资的一部分以助力其人工智能经济
财联社,2025-09-16 04:02:47.000,纳斯达克中国金龙指数收涨0.87%
同花顺,2025-09-16 04:01:19.000,港股午评：恒生指数涨0.07%，恒生科技指数涨0.39%
财联社,2025-09-16 04:01:19.000,标普500指数、纳指创收盘新高 谷歌涨超4%
同花顺,2025-09-16 03:59:19.000,特朗普称对《纽约时报》提起150亿美元诉讼
财联社,2025-09-16 03:58:17.000,美元指数15日下跌
财联社,2025-09-16 03:57:51.000,马来西亚连续强降雨引发洪灾致12人遇难
财联社,2025-09-16 03:57:23.000,国际油价15日上涨
财联社,2025-09-16 03:57:23.000,国际油价15日微涨
财联社,2025-09-16 03:54:57.000,海合会最高理事会发表声明谴责以色列袭击卡塔尔
同花顺,2025-09-16 03:52:26.000,日丰股份：向特定对象发行股票申请获中国证监会同意注册
同花顺,2025-09-16 03:50:42.000,比亚迪发布e-Bus平台3.0推动电动客车实现“电比油强”
同花顺,2025-09-16 03:40:32.000,华为、广汽丰田合作计划升级为全栈方案 鸿蒙智行首款硬派SUV落地享界
财新网,2025-09-16 03:40:00.000,新政小幅提振了北京楼市 “金九”有戏吗？
财联社,2025-09-16 03:32:54.000,以军夜间大规模空袭加沙城
同花顺,2025-09-16 03:30:58.000,ETF午评：汽车零部件ETF领涨2.92%，稀有金属ETF基金领跌3.08%
同花顺,2025-09-16 03:30:58.000,A股午评：沪指半日微跌0.1% 物流、统一大市场板块集体爆发
同花顺,2025-09-16 03:30:54.000,ETF两市成交额2617.59亿元
同花顺,2025-09-16 03:30:01.000,上海总部部分人员将南迁深圳？平安人寿最新回应：顺应公司整体经营发展需要
同花顺,2025-09-16 03:28:39.000,中国海警局新闻发言人发表谈话
同花顺,2025-09-16 03:25:42.000,东部战区海军某大队与陆军某旅开展海上装载登陆训练
同花顺,2025-09-16 03:13:22.000,电机板块再度拉升，大洋电机涨停
同花顺,2025-09-16 03:13:16.000,斯沃琪将在美涨价5%至15%
同花顺,2025-09-16 03:10:08.000,以军袭击黎巴嫩南部真主党一指挥部 至少1人死亡
同花顺,2025-09-16 03:04:54.000,腾讯汤道生：每天向腾讯元宝的提问量，已达到年初一个月的总量
同花顺,2025-09-16 03:03:09.000,上海静安“十四五”以来新增跨国公司地区总部54家
同花顺,2025-09-16 03:02:07.000,中科曙光发布智慧工业平台
财联社,2025-09-16 02:58:47.000,布拉德：在符合条件的情况下 “非常有兴趣”成为美联储主席
同花顺,2025-09-16 02:58:17.000,宁德时代入股爱行智慧出行科技公司
同花顺,2025-09-16 02:57:28.000,农业农村部：超1000家企业参与在研国家农业科技项目 占比过半
同花顺,2025-09-16 02:56:46.000,沪深京三市成交额超1.3万亿元，较上日此时缩量573亿元
同花顺,2025-09-16 02:56:41.000,深证成指跌1%
财联社,2025-09-16 02:49:30.000,波兰总理称摧毁一架无人机 两名白俄罗斯公民被逮捕
同花顺,2025-09-16 02:47:33.000,恺英网络在杭州成立多家网络科技公司
同花顺,2025-09-16 02:47:23.000,国新办将于9月19日举行新闻发布会 介绍以生态环境高水平保护推动高质量发展情况
同花顺,2025-09-16 02:43:59.000,农业农村部副部长：“十四五”期间 我国居民食物营养健康水平更加均衡
同花顺,2025-09-16 02:38:57.000,创业板指跌幅扩大至1%，全市场超3400只个股下跌
同花顺,2025-09-16 02:36:35.000,恒生指数、恒生科技指数均转跌
同花顺,2025-09-16 02:36:21.000,电池板块多数调整，杭可科技盘中跌超10%
同花顺,2025-09-16 02:31:09.000,腾讯：AI能力全面开放，全面适配主流国产芯片
财联社,2025-09-16 02:25:35.000,摩根资管的Kelly警告：美联储降息恐损害股市和债市
同花顺,2025-09-16 02:24:52.000,腾讯云邱跃鹏：模型产业重心已向推理转变
同花顺,2025-09-16 02:24:22.000,沪深京三市成交额超1万亿元，较上日此时缩量1156亿元
同花顺,2025-09-16 02:24:16.000,港股创新药概念股震荡走弱，歌礼制药-B跌近8%
同花顺,2025-09-16 02:22:37.000,港股福森药业异动拉升，盘中一度涨400%
财新网,2025-09-16 02:20:00.000,8月宏观数据出炉 社零投资工业增加值均低于预期
同花顺,2025-09-16 02:19:27.000,第22届中国—东盟博览会将于9月17日在广西南宁启幕
同花顺,2025-09-16 02:17:51.000,每年可输送超430亿度电能 藏粤直流输电工程今天启动建设
财联社,2025-09-16 02:17:49.000,英国皇家空军战机将在波兰上空执行防空任务
同花顺,2025-09-16 02:13:52.000,湖北跨境支付通结算规模超2亿元
财联社,2025-09-16 02:13:46.000,中美就妥善解决TikTok问题达成基本框架共识
同花顺,2025-09-16 02:12:52.000,A股三大指数盘中全线翻绿
同花顺,2025-09-16 02:06:11.000,沪深京三市成交额超8000亿元，较上日此时缩量1102亿元
同花顺,2025-09-16 02:06:07.000,蜂巢能源：正在开发能量密度达360Wh/kg的软包半固态电池
同花顺,2025-09-16 02:04:15.000,统一大市场板块震荡拉升，飞马国际、供销大集涨停
同花顺,2025-09-16 02:02:56.000,国家海洋预报台发布风暴潮蓝色警报
同花顺,2025-09-16 02:00:13.000,开盘半小时 沪深京三市成交额达7239亿元
同花顺,2025-09-16 01:57:56.000,腾讯发布全新大模型混元3D 3
同花顺,2025-09-16 01:34:13.000,小红书概念股盘初冲高，省广集团涨停
财联社,2025-09-16 01:32:50.000,国际原子能机构大会呼吁维护全球核不扩散体系
同花顺,2025-09-16 01:32:11.000,房地产板块盘初拉升，香江控股涨停
同花顺,2025-09-16 01:26:17.000,ETF开盘：深证50ETF易方达领涨3.54%，专精特新ETF领跌1.5%
同花顺,2025-09-16 01:24:55.000,禾赛-W香港上市首日开盘涨7.7%
同花顺,2025-09-16 01:22:05.000,央行今日开展2870亿元7天期逆回购操作
同花顺,2025-09-16 01:21:45.000,港股开盘：恒生指数高开0.34%，恒生科技指数高开0.45%
同花顺,2025-09-16 01:21:02.000,昨日ETF两市资金净流入84.16亿元
同花顺,2025-09-16 01:19:18.000,达实智能签约小米武汉二期智能化项目，打造武汉企业园区智慧空间服务标杆！
同花顺,2025-09-16 01:17:09.000,昨日ETF两市融资融券余额1117.05亿元
财联社,2025-09-16 01:16:27.000,阿拉伯－伊斯兰国家紧急峰会发表联合声明 谴责以色列袭击卡塔尔
财联社,2025-09-16 01:16:00.000,氧化铝夜盘收涨超2.8%
同花顺,2025-09-16 01:15:36.000,人民币兑美元中间价较上日调升29点至7.1027
同花顺,2025-09-16 01:13:02.000,辽宁大连发布暴雨红色预警
同花顺,2025-09-16 01:11:43.000,四维图新：杰发科技TPMS等模拟芯片产品占营收比重较小
同花顺,2025-09-16 01:11:00.000,市场监管总局起草液态食品运输新规
同花顺,2025-09-16 01:07:50.000,库克：苹果将投资25亿美元扩大康宁玻璃工厂
同花顺,2025-09-16 01:07:37.000,腾讯据悉开始推介三个品种点心债券
财联社,2025-09-16 01:04:54.000,堪察加东岸远海发生5.9级地震 震源深度20公里
同花顺,2025-09-16 01:04:33.000,现货黄金升至每盎司3685美元上方
财联社,2025-09-16 00:53:04.000,LME期铜收涨119美元 报10186美元/吨
财联社,2025-09-16 00:43:58.000,乌克兰政府批准2026年国家预算草案
财联社,2025-09-16 00:41:38.000,《中华人民共和国政府与波兰共和国政府间合作委员会第四次全体会议共同文件》公布
财联社,2025-09-16 00:35:13.000,2025中国—东盟建设部长圆桌会议共商住建领域高质量发展
财联社,2025-09-16 00:15:06.000,外交部亚洲事务特使访问泰国就柬泰边境冲突做工作
同花顺,2025-09-16 00:12:38.000,美国国务院批准拟向秘鲁出售F-16战机
财联社,2025-09-16 00:07:18.000,中美就TikTok等经贸问题在西班牙马德里举行会谈
财新网,2025-09-16 00:06:33.850,2025年9月16日
同花顺,2025-09-16 00:00:26.000,中国银河证券：AI应用持续推进 游戏行业有望保持高景气度
财联社,2025-09-15 23:59:12.000,现货黄金首次站上3680美元
同花顺,2025-09-15 23:57:54.000,上证报：投资者在指数调整的重要时段需关注指数基金对市场的扰动
财联社,2025-09-15 23:48:12.000,美国中央司令部新任司令首次访问科威特
同花顺,2025-09-15 23:46:00.000,森麒麟：已进入波音、空客等飞机制造企业供应商名录
财联社,2025-09-15 23:45:19.000,美国下调日本汽车进口关税
同花顺,2025-09-15 23:41:10.000,经济日报金观平：开动供需引擎扩大体育消费
财联社,2025-09-15 23:38:02.000,周一欧洲股市收盘多数上涨 斯托克50指数涨0.94%
财联社,2025-09-15 23:37:13.000,新兴市场ETF连续第五周资金流入 中国吸金规模稳居首位
同花顺,2025-09-15 23:36:23.000,人民时评：从体育中挖掘经济增量
同花顺,2025-09-15 23:34:28.000,日经指数期货在新加坡交易所开盘上涨200点，报44745点
同花顺,2025-09-15 23:34:13.000,中国保险业AI科技公司暖哇洞察申请香港IPO
同花顺,2025-09-15 23:31:49.000,人民日报金社平：以“立破之道”建设好全国统一大市场
同花顺,2025-09-15 23:31:00.000,新能源车险承保盈利现曙光
同花顺,2025-09-15 23:30:42.000,我国对东盟进出口连续18个月保持增长
同花顺,2025-09-15 23:28:23.000,信托公司管理办法18年来首修 信托业市场格局将加速重塑
财联社,2025-09-15 23:18:24.000,李成钢：双方就以合作方式妥善解决TikTok相关问题等达成了基本框架共识
财联社,2025-09-15 23:15:57.000,李成钢：中国绝不会以牺牲原则立场、企业利益和国际公平正义为代价，寻求达成任何协议
